210,--,['Raj Banerjee'],DESCONOCIDO,Paarh a film shooted in the vicinities of a village in Malda portrays the ill effects of the flood. It is a story of Man Vs Nature. How settlers of riverbank become a neo refugee in their own homeland is the subject of the film Soil erosion is a problem since ages in our country It refers to several forms of mass wasting that include a wide range of ground movements s... Read all,--,PARH
211,7.2,['Dominique Lienhard'],"['Dominique Lienhard', 'Akira Yoshimura']","Seventheen century. Set in a small village, nestled between the sea and the mountain, the father of Alan, a young fifteen-year-old boy, has sold himself for two years to indentured service. Alan is forced to take the place of his father and struggles to support his family.",1h 34m,Fires in the Dark
212,--,['Xavi Israel'],DESCONOCIDO,,--,His Instrument
213,7.0,['Guillaume Brac'],"['Guillaume Brac', 'Catherine Paillé']",An unlikely oddball trio bond during an impromptu trip to the French countryside on a foolhardy romantic mission.,1h 35m,All Hands on Deck
214,6.1,['Martin Liji'],"['Rosario Cervio', 'Martin Liji']","Lola, a young playwright and drama director, goes into a crisis before her new play is released. Her leading actress raises time and again that she has problems with the text. A friend of her, a visual artist, moves to her home after discovering an affair and her ex-boyfriend claims copyright. Lola doubts about her own play and struggles between moving forward in the ... Read all",1h 7m,The Heat
215,6.5,DESCONOCIDO,DESCONOCIDO,,1h 53m,Love & Drugs 2
216,--,['Jacques Aldridge'],DESCONOCIDO,LEADFOOT: LMack Racing - Stories of the founder of LMack Racing. Lincoln Mack.,--,Leadfoot: LMack Racing
217,5.3,['Riccardo Sesani'],DESCONOCIDO,"The tormented love story of two orphans, Delfo and Salina. Emma, a old lady, will live this love story outside the couple.",1h 24m,Dillo al mare
218,--,['Bridget Pervalle'],DESCONOCIDO,A Mother's memories keep her sane as she fights through the grief of losing of her youngest daughter in a car accident and questioning her faith after making a sacrifice for her daughter to finish her last year in high school with her friends and living with her stepmother who dies as well.,--,My Sweet Buttercup
219,--,['Judith Audu'],DESCONOCIDO,"A riveting tale of love gone sour, 'The Sessions', tells the story of Onome Oghenekaro who is married to Banjo. All seems to be going smoothly until her past comes calling. What was supposed to be a smooth sail turns into a turbulent ride as Onome finds her marriage going through tough times. Her friend Eloho, a therapist decides to wade in to help Onome and Banjo get... Read all",--,The Sessions
220,6.5,DESCONOCIDO,DESCONOCIDO,"Jens and Mike, two police officers on routine patrol, find themselves trapped in a maze of buildings when unrest spreads.",1h 48m,Enforcement
221,6.9,['Jakob Zapf'],"['Ashu B.A.', 'Marcus Seibert', 'Jakob Zapf']","The morose Konrad (85) pushes everyone away, but little Thurba (12) manages to break through his wall.",1h 34m,A Handful of Water
222,6.0,['Jonathan Cuartas'],DESCONOCIDO,Two mysterious siblings find themselves at odds over care for their frail and sickly younger brother.,1h 30m,My Heart Can't Beat Unless You Tell It To
223,6.1,['Jorge Thielen Armand'],"['Rodrigo Michelangeli', 'Jorge Thielen Armand']","To escape the crisis in Venezuela, and his alcoholism, a man retreats into the jungle and meets old friends. But their former happiness is transformed into evil intentions by the lure of gold.",1h 48m,Fortitude
224,6.6,['Antoinette Jadaone'],DESCONOCIDO,"Avid Paulo Avelino fan Jane meets her onscreen idol in less-than-ideal circumstances after stowing away in the back of his pickup truck, and the young stan finds out that he isn't quite the perfect man when nobody's watching.",1h 40m,Fan Girl
225,6.2,['Wei Shujun'],"['Gao Linyang', 'Wei Shujun']","An aimless film school student goes on an ambling road trip across China in a rickety old Jeep in this charming, deeply personal road movie.",2h 14m,Striding Into the Wind
226,--,DESCONOCIDO,DESCONOCIDO,,--,Brutally Tormented
227,5.5,['Nicolas Maury'],"['Maud Ameline', 'Sophie Fillières', 'Nicolas Maury']","Jérémie, a young man at his breaking point, leaves Paris to return to his intrusive mother in Limousin.",1h 48m,My Best Part
228,6.5,['Donato Rotunno'],DESCONOCIDO,"Antonio has spent his whole life away from Italy, his home country. He crosses paths with Leo, a young Italian artist who is trying to make it abroad. The old man and the young woman's destinies mirror each other. Memories from the past are awoken and end up offering a more peaceful future to the both of them.",1h 34m,Io sto bene
229,7.4,['Agasthya Manju'],"['K K Binojee', 'Agasthya Manju']","Beautiful is about ""Can a man take it , if his woman becomes more successful than him?"" It's not about professional jealousy like Abhimaan and Aashiqui 2 but it's about Male pride It's a conceptual sequel to Rangeela as in the rich girl accepted the poor guy in the climax of Rangeela ..But can the poor guy really live under the rich girl's shadow swallowing his self r... Read all",2h 3m,Beautiful
230,7.3,['Tim Barrow'],DESCONOCIDO,"Discharged from a psychiatric hospital, Jacob attempts to resume life in Edinburgh, control his schizophrenia and be a worthwhile member of society. He works collecting litter from streets and parks. He boxes. He takes medication. He writes everything down. His Dad barely wants to know him. Frustrated by this banal existence and encouraged by his psychiatrist, Jacob t... Read all",1h 30m,Riptide
231,7.4,['Andrew Chung'],DESCONOCIDO,"Set in 1996, in a majority-minority neighborhood, 16-year-old Pooja finds herself torn between her crush on a white boy, and her Brown and Black friends. Her pursuit takes a violent turn, making her quest for love, a question of self-love.",1h 1m,White Elephant
232,6.6,['Anoop Panicker'],DESCONOCIDO,A high profile murder baffles the cops when a prison inmate claims responsibility and promises more deaths. Will the police surgeon Bhadra crack this mystery?,2h 3m,Cadaver
233,6.0,DESCONOCIDO,DESCONOCIDO,"A simple internet meet up turns into a weekend of whirlwind romance and self discovery in Radford and Impey's arthouse, greyscale feature.",1h 4m,Stranger Than Us
234,--,['Sean King'],DESCONOCIDO,,--,Bad Girls
235,7.1,['Cássio Pereira dos Santos'],DESCONOCIDO,"A trans girl and her mother move to a new town in order to start fresh, but quickly face dilemmas when the local high school needs a second parental signature for enrollment.",1h 35m,Valentina
236,--,DESCONOCIDO,DESCONOCIDO,DESCONOCIDO,--,Error nombre para la pelicula con id: tt11110654
237,3.3,['Abir Sengupta'],DESCONOCIDO,A coming-of-age story of a girl who experience life through misadventures & dating apps.,1h 59m,Indoo Ki Jawani
238,6.1,['Miroslav Mandic'],DESCONOCIDO,A love story in which fragmented memories are brought back to mind by a song.,1h 30m,Sanremo
239,5.2,['Yûichirô Hirakawa'],"['Yûichirô Hirakawa', 'Keiko Kanome']","Ryoichi Yoshimori is a university student. His girlfriend Kyoko Sawada is older than him, but he enjoys his time with her. After Ryoichi proposes to his girlfriend, she suddenly disappears one day. Several days later, he finally sees her again, but Kyoko does not have any memory of him. Ryoichi is stunned, but he suspects her memory loss is related to the Kiokuya rumo... Read all",1h 45m,The Memory Eraser
240,--,['Thomas Macias'],DESCONOCIDO,"After the death of his father, Rafael gets in trouble with the law and is given a second chance to prove himself but he needs his trainer Will, to do so.",--,Low Point
241,--,['Danilyn Ifversen'],DESCONOCIDO,"Amber fights to uncover the dark secrets hidden behind her obvious mother and determined father. As the secret gets too hard for her mother to handle, she takes a step back from their plan in order to put a stop to the destruction they have caused. Once Amber finds out, she will fight to save her city.",--,The Cure
242,--,DESCONOCIDO,DESCONOCIDO,"Talia is a quiet, contemplative film that follows the title character as she drifts back and forth in time between two relationships. In the present there exists Diana--a sweet and naive young woman with whom Talia struggles to be honest. In the past there is Mona--a passionate, adventurous journalist who is everything Talia wishes she could be. As she struggles to co... Read all",--,Talia
243,3.8,['Masud Kimiai'],"['Sahand Abidi', 'Masud Kimiai', 'Maryam Niazadeh']",Fazli (Saeid Aghakhani) is back to his family after so many years in jail. He tries to gather all his family members in the parental house but in this way he has lots of troubles and stories.,--,It Turned Into Blood
244,7.0,['Pouya Eshtehardi'],DESCONOCIDO,"Hamin is a young private doing his military service in a watchtower in the borderline of Iran and Pakistan. Impatient for a day off to attend his sister's wedding ceremony, he gets into a fight with his commander. Up in the watchtower, Hamin reviews the past years and the things happened to him and his sister since their childhood. Hamin in Balochi means the heat of s... Read all",1h 18m,Untimely
245,5.3,['Imanol Rayo'],"['Miren Gorrotxategi', 'Joanes Urkixo']","When a skeleton turns up in their land, Fermin and Karmen reach out to their son Nestor, who comes to their aid. Next morning both Fermin and the skeleton are gone.",1h 35m,Death Knell
246,--,['Koray Demir'],DESCONOCIDO,,--,Kut Al Amara: From Tale to Truth
247,3.7,['Lara Izagirre'],DESCONOCIDO,"Nora is in her 30s and has barely left her village. When her grandfather passes away, Nora decides to journey along the Basque coast to reunite his ashes' with her grandma's.",1h 40m,Nora
248,--,['Ivan Pagan'],DESCONOCIDO,A street level marijuana dealer's life is seen on a daily basis as he does business with his clientele and others around his city.,1h 22m,Weedman
249,6.6,['Jo Sol'],DESCONOCIDO,"In a remote valley of the Aragonese Pyrenees the legend of Armugan is told. It is said that he is dedicated to a mysterious and terrible profession, the likes of such that no one dares to speak. They say that Armugan moves through the valleys clinging to the body of Anchel, his faithful servant and together they share the secret of a work as old as life, as terrible a... Read all",1h 31m,Armugan
250,6.8,['Fokion Bogris'],"['Yorgos Teltzidis', 'Fokion Bogris', 'Panos Tragos']","Vangelis, a remnant of the rave generation, scrapes by as a small-time weed dealer. He is a cool, low profile person who would rather have a steady job than continue a life in petty crime. However, his prior arrest record blocks his attempts to join a society that rarely forgives past mistakes. When his neighbors threaten to call the cops on him, his life changes over... Read all",1h 41m,Amercement
251,--,['Faozan Rizal'],DESCONOCIDO,,--,Demi Waktu
252,6.2,DESCONOCIDO,DESCONOCIDO,Milea made the decision to part with Dilan as a warning for Dilan to stay away from the motorcycle gang. But the parting which had been only a bluff for Milea became a parting that lasted until they graduated from college and grew up.,1h 42m,Milea
253,5.7,['Carles Torras'],DESCONOCIDO,"Angel works in an ambulance service. After a tragic accident, his personal life begins to deteriorate as he becomes more and more suspicious of his partner Vane.",1h 34m,The Paramedic
254,--,DESCONOCIDO,DESCONOCIDO,DESCONOCIDO,--,Error nombre para la pelicula con id: tt11132898
255,8.3,['Irshad Hameed'],"['Irshad Hameed', 'L. Sreekanthan']",,--,Oru Vadakkan Pennu
256,6.1,['Pamela Tola'],"['Aleksi Bardy', 'Pamela Tola']","After gravely injuring her husband and realising that she might face consequences for it, Inkeri, an elderly woman, embarks on one last road trip.",1h 32m,Ladies of Steel
257,4.0,['Mark A. Grey'],"['Earl Grey', 'Mark A. Grey']",3 Women is a powerful yet touching drama examining the lives of three disparate women reliant on their faith as they strive to gain respect as they go about their lives in their corner of London. Pre lives in an abusive relationship and has a history of domestic abuse since childhood. Nicola is a career executive and is struggling to find respect among her peers in a ... Read all,1h 16m,3 Women
258,--,['Mike Sakamoto'],DESCONOCIDO,,1h 17m,To a Dead Friend
259,5.5,['Raana'],DESCONOCIDO,"Gandhi is an IT guy who suffers from Pseudobulbar, and he uncontrollably laughs during stressful moments. He is taken to a Shiva temple and tied with a holy ornament, which is very strong, but it would bring a threat to him if separated.",2h 19m,Naan Sirithaal
260,--,DESCONOCIDO,DESCONOCIDO,DESCONOCIDO,--,_Titans
261,5.1,['Natalie Rodriguez'],"['Kevin Sean Michaels', 'Natalie Rodriguez']","In this award-winning feature film, a narcissistic screenwriter escapes to a cabin in the woods to finish a screenplay, while reflecting on his problematic past. Based on the short film of the same title.",1h 34m,Howard Original
262,5.8,['Angus Benfield'],"['Angus Benfield', 'Alan Duprey']","Set between the New World (Heaven) and the Old World (Earth) the story follows the life and afterlife of Jonathan Stone and all of those lives around him from his past, present and future.",1h 40m,Heaven
263,--,DESCONOCIDO,DESCONOCIDO,DESCONOCIDO,--,Breaking Free
264,--,DESCONOCIDO,DESCONOCIDO,DESCONOCIDO,--,Hibiscus by the River
265,6.3,['Minuta Gabura'],DESCONOCIDO,,1h 30m,Donne e Donne
266,--,['Serhiy Morgunov'],DESCONOCIDO,The film is a series of interviews with veterans and soldiers. The characters share their life experiences and talk about the difficulties of re-adjusting to civilian life.,--,It's Me
267,--,['Helan Leo'],DESCONOCIDO,,1h 40m,Yazh
268,--,['Nicholas Cook'],DESCONOCIDO,,--,Neverland
269,6.9,['Dace Puce'],DESCONOCIDO,"After a neighbor's daughter throws some contemptuous remarks about his dead father, ten years old boy teaches the girl a cruel lesson thereby condemning himself in the eyes of the surrounding folk.",1h 47m,The Pit
270,--,['Vito Zagarrio'],"['Nicola Rafele', 'Lidia Ravera', 'Vito Zagarrio']",,1h 41m,Le seduzioni
271,5.2,['Yuanyuan Ning'],"['Yuanyuan Ning', 'Xiaobai Ye']","In high school, a boy and a girl are caught holding hands. The whole school is drawn into the resulting furor, with Kafkaesque results.",1h 42m,An Insignificant Affair
272,--,['Sagar Joshi'],DESCONOCIDO,"A guy who is a game addict, turns to an ethical hacker. The Engineer student comes to hacking world for some reasons. The Story is all about that guy.",--,The Third Hacker
273,6.8,['Antonio Pisu'],DESCONOCIDO,"1989: a few weeks before the fall of the Berlin Wall, Pago, Rice and Bibi, three young men from Cesena, visit East-Europe in search of adventure. This journey will change their life forever",1h 44m,Adventures Italian Style
274,6.1,['Alice Filippi'],"['Roberto Proia', 'Michela Straniero']","Marta may be an orphan, and she may be affected by a lethal illness, yet she is the most positive person one can meet. She wants a boy to fall for her. Not any boy - the most handsome of them all. One day, she may have found her match.",1h 31m,Out of My League
275,5.7,['Marion Laine'],DESCONOCIDO,"Jeanne works in a maternity yard in Marseille. Day and night, she struggles with her colleagues to support the mothers and their babies.",1h 31m,Into the World
276,7.8,['Daniel Freeman'],"['Drew Connick', 'Daniel Freeman']","With a piano strapped to the back of his truck, a nomadic street musician drives 2,000 miles north to Canada on an emotional mission to spread his mother's ashes",1h 5m,"Teddy, Out of Tune"
277,4.2,['Partho Ghosh'],DESCONOCIDO,Pyar me thoda twist is a Romcom and action drama film. It's a story of a town near Lucknow (Uttar Pradesh). Hero of the film Dheeraj Thakur (Mukesh J. Bharti) and Heroine Maya (Richa Mukherjee) loves each other even after knowing the old rivalry between their families. A twist comes with the entry of Jwala Singh aka Mr. Wanted. Everyone in the town and police is looki... Read all,--,Pyar Mein Thoda Twist
278,--,['Jack Savant'],DESCONOCIDO,,--,The Recovery
279,7.0,['Kornél Mundruczó'],DESCONOCIDO,"When a young mother's home birth ends in unfathomable tragedy, she begins a year-long odyssey of mourning that fractures relationships with loved ones in this deeply personal story of a woman learning to live alongside her loss.",2h 6m,Pieces of a Woman
280,--,['Gil Osborne'],DESCONOCIDO,,--,Mind Changers
281,5.7,['Melanie Waelde'],DESCONOCIDO,"Five young people in provincial Germany. They run into each other and away from each other. They kiss and they fight. It's their last winter together before they leave school, after that it's stay or go. A feature film debut of enormous intensity.",1h 23m,Naked Animals
282,5.8,DESCONOCIDO,DESCONOCIDO,"After a friend dies from a terminal illness, five friends discover what they are really like and how much they need the support and involvement of their loved ones: one that they have chosen out of authenticity, enjoyment and affection.",1h 43m,Things to Do Before You Die
283,6.9,['Harry Macqueen'],DESCONOCIDO,"Sam and Tusker are traveling across England in their old RV to visit friends, family and places from their past. Since Tusker was diagnosed with dementia two years ago, their time together is the most important thing they have.",1h 35m,Supernova
284,--,['Grange Jonas'],DESCONOCIDO,,--,Strangled Region
285,--,['Bruno de Oliveira'],"['Georgia Barcellos', 'Bruno de Oliveira']","After a robbery in the streets of Porto Alegre, Georgia and Bruno will have their lives intertwined by a tennis game orchestrated by the mysterious Jeweler.",1h 24m,Ten-Love
286,6.5,['Inderpal Singh'],"['Inderpal Singh', 'Kehardeep Singh']","Saira Mallik sets out on a mission to avenge her husband's murder, only to find out that there are bigger conspiracies involved.",2h 5m,Zakhmi
287,--,['Smeep Kang'],DESCONOCIDO,"Best friends and con-artists Vijay and Ajay sever their friendship when Vijay discovers that his father's murderer may be Ajay's long-lost father, setting into motion a bloody saga of familial revenge and emotional turmoil.",2h 2m,Hera Pheri
288,5.7,['Zheng Xu'],DESCONOCIDO,"As Ivan plans to go to America for work purposes, his plans are foiled when he decides to follow his mother on a train to Moscow.",2h 6m,Lost in Russia
289,5.7,['Eugène Green'],DESCONOCIDO,"Adapts the Basque legend of Atarrabi and Mikelats, the tragic story of the sons of goddess Mari-Mother Earth- who are given to the devil for him to raise them.",2h 3m,Atarrabi & Mikelats
290,7.1,DESCONOCIDO,DESCONOCIDO,A struggling former best-selling author dares to fall for an enigmatic dying woman and leaves his lucid reality filled with addictions and writers block to journey with her in a world of the forbidden.,--,Strings
291,7.0,['Pramod Chakravarthi'],DESCONOCIDO,"Guru is a simple government teacher whose purpose of life is to bring government schools on par with the private schools. When he is transferred to a government school in Nelamangala, he investigates and understands the problems that such institutions face.",2h 37m,Drona
292,5.2,['Michal Wnuk'],"['Kaja Krawczyk-Wnuk', 'Michal Wnuk']","Karol, a talented and entrepreneurial 25-year-old, earns extra money in the family business and runs his own promising business. When his father, an aviation instructor, dies in an accident, Karol is responsible for maintaining the house and his mother. Together with two best friends, he puts everything on one card - he intends to build an innovative airship. When a l... Read all",1h 32m,Overclockers
293,6.0,['Helen Shaver'],DESCONOCIDO,"An adaptation of the theatrical play by Pamela Mala Sinha, the film centers on a group of women residing at an inpatient mental health clinic after various personal crises.",1h 43m,Happy Place
294,6.5,DESCONOCIDO,"['Qianying Xie', 'Zhonglin Xu']","Banished to the mortal world, a warrior has to slay a demon to return to the heavenly realm and become a god.",1h 50m,Jiang Ziya
295,6.1,['Claus Drexel'],"['Olivier Brunhes', 'Claus Drexel']","Christine is homeless in Paris. On a winter night she finds Suli, an 8-year-old Eritrean boy, sobbing in front of her shelter. Bound by their marginal conditions, they embark together on an emotional journey to find his mother in Paris.",1h 26m,Under the Stars of Paris
296,5.9,DESCONOCIDO,"['Gianluca De Serio', 'Massimiliano De Serio']","A laborer in Southern Italy raises his son after the sudden death of the kid's mother. He promised his son that his mother will come back to life, and now he must find a way to keep this promise.",1h 44m,The Stonebreaker
297,7.1,['Akiyo Ôhashi'],"['Kanna Kii', 'Akiyo Ôhashi']",Two men meet on a beach in Okinawa and are romantically attracted to each other.,--,The Stranger by the Beach
298,--,['Ashley Hays Wright'],DESCONOCIDO,,--,Loving the Least
299,6.6,['Calvin Grimm'],DESCONOCIDO,"""River of Hope"" tells the story of how a former slave Mary Barnes Cabell and her children helped found the first college for African Americans in West Virginia. Based on true events.",1h 50m,River of Hope
300,6.0,['Enoch Jones'],DESCONOCIDO,"Tim Coleman's search for love has been one hell of a ride, leaving him to question love after every failed attempt. Will Tim's intensified search for love be troubled even the more by a small town girl.",--,A Good Thing
301,6.9,['Jinling Cao'],DESCONOCIDO,"In the woods of Inner Mongolia, Linzi and his older brother Tutu earn a meagre living as lumberjacks. Their difficult, but peaceful lives are upended when they develop an intense rivalry over a local widow and reckless deforestation threaten their homeland. Featuring gorgeous cinematography by Mark Lee Ping-Bing and a moving score by Lim Giong, Anima is an exquisite a... Read all",2h,ANIMA
302,3.6,['Narendra Nath'],"['Narendra Nath', 'Tharun Kumar', 'Ali Lucknowi']","An aspiring Indian entrepreneur confronts disapproval, sexism and rivalry as she draws from culture to start a tea business.",2h 16m,Miss India
303,5.4,['Mike Rohl'],DESCONOCIDO,"When Duchess Margaret unexpectedly inherits the throne to Montenaro and hits a rough patch with Kevin, it's up to her double Stacy to save the day before a new lookalike, party girl Fiona foils their plans.",1h 36m,The Princess Switch: Switched Again
304,2.7,['Steve Lawson'],DESCONOCIDO,Alcatraz. 1937. A young prison guard working the night shift experiences a string of chilling disturbances culminating in the bizarre death of an inmate at the most famous prison in the world,1h 26m,The Haunting of Alcatraz
305,--,DESCONOCIDO,"['Manon Décor', 'Michele Salimbeni']",,--,La Lupa (La Louve)
306,--,DESCONOCIDO,DESCONOCIDO,DESCONOCIDO,--,Error nombre para la pelicula con id: tt11202700
307,--,DESCONOCIDO,DESCONOCIDO,DESCONOCIDO,--,Error nombre para la pelicula con id: tt11204094
308,4.5,['Keenan Jamelle Robinson'],DESCONOCIDO,"Synopsis: This is the second excerpt in the story Keenan Robinson, a recent college graduate struggling to keep his head above water and finding his true calling in life. Keenan takes his younger foster brother Marvin under his wings to help guide him to a better walk with GOD. They face many life challenges and obstacles, life and death decisions together even though... Read all",1h 44m,Nothing Without GOD 2
309,4.7,['Abner Official'],"['Dariana Jozh', 'Abner Official']","Samuel, a young Venezuelan, emigrates from his country in search of a better life and to help his family, without knowing the difficult situations that he will face as an immigrant.",1h 27m,Lejos de Casa pelicula Venezolana
310,8.8,['Karim Kassem'],DESCONOCIDO,"A Lebanese filmmaker (Karim) travels from New York to Beirut to conduct research for a film that he wants to make about blind children in the mountains of Lebanon. He arrives to Beirut with a condition that had been affecting his eyes and causes him to go straight into surgery, temporarily blinding him with patches covering his eyes. He uses the healing time to reflec... Read all",2h 13m,Only the Winds
311,--,DESCONOCIDO,DESCONOCIDO,,--,Six: One by One
312,--,['Ravi Basrur'],DESCONOCIDO,,--,Podi Mass
313,6.4,['S.G. Charles'],DESCONOCIDO,"Lock Up follows the lives of sub-inspector Moorthy and constable Vasanth . There is also Ilavarasi , a hard-nosed police inspector who is put in charge of the station the two men work at after the previous inspector, Sampath, is murdered.",1h 46m,Lockup
314,5.4,['Kazem Mollaie'],DESCONOCIDO,"""The Badger"" is the story of a 40-year-old woman called Soodeh Sharifzadegan who faces a strange incident, right before her second marriage.",1h 33m,The Badger
315,2.5,['Marjorie DeHey'],DESCONOCIDO,"An alcoholic mother trying to flee her life, moves to a new house with her young son where she must battle her addiction as she is confronted by a real-life monster.",1h 31m,Bottle Monster
316,7.4,['Pjer Zalica'],DESCONOCIDO,"April 1992. Members of a large family strewn around the former Yugoslavia gather around the death bed of their elderly matriarch. She is not well, but the forecast of a family doctor that her death is a matter of minutes away proves incorrect, so the waiting stretches out for days. Relatives start bickering, playing tricks and arguing over the inheritance to be left b... Read all",1h 32m,"Focus, Grandma"
317,--,['Mohamed Mouftakir'],DESCONOCIDO,,2h,L'automne des pommiers
318,--,['Simerjit Singh'],DESCONOCIDO,,--,Daddy Cool Munde Fool 2
319,--,['Madheshwara'],DESCONOCIDO,,--,Sadhanai Payanam
320,5.9,['Raphaël Jacoulot'],DESCONOCIDO,"After Francois inherits the family sawmill, he and his wife Naomi try for a child. But when Naomi finds that she is infertile, Francois engages in an affair with his neighbor and must decide where his heart lies when she falls pregnant.",1h 47m,Dreamchild
