103,5.6,['Kris Rey'],DESCONOCIDO,"Following the launch of her new novel, 35-year-old writer Kate's former professor invites her to speak at her alma mater. After accepting the invitation, Kate finds herself deeply enmeshed in the lives of a group of college students.",1h 20m,I Used to Go Here
104,4.9,['Pedro Brenner'],"['Pedro Brenner', 'Seann Dougherty']","Based on true events, The Lady of Guadalupe is a moving religious discovery that juxtaposes folklore with modern times.",1h 35m,Lady of Guadalupe
105,3.3,DESCONOCIDO,DESCONOCIDO,"Massimo is a member of the Sicilian Mafia family and Laura is a sales director. She does not expect that on a trip to Sicily trying to save her relationship, Massimo will kidnap her and give her 365 days to fall in love with him.",1h 54m,365 Days
106,6.5,['Miguel Velez'],"['Michal Mieszczyk', 'Miguel Velez']","Mikolaj jumps on a train captivated by a beautiful woman. He hopes to convince her that they are made for each other. On the way to happiness he finds himself with no ticket, and tickets are sacred for the crude conductor Mr. Nowak",1h 19m,Time for Love
107,5.0,['David Torres'],DESCONOCIDO,Eric is a journalist who stops publishing after a threat. Nicolasa convinces him to investigate a group of people stripped of their lands and resources. Eric then embarks on a search for justice that leads him to a mythological entity.,1h 4m,El Hombre Búfalo
108,4.5,['Danny A. Abeckaser'],DESCONOCIDO,The Brooklyn-native street basketball legend Jackie Ryan.,1h 38m,Blackjack: The Jackie Ryan Story
109,5.2,['Darya Charusha'],DESCONOCIDO,"Hoping to change her life, Marina, a small town girl, embarks on a journey to a life coaching event. But an unexpected delay at a St. Petersburg airport sends her on a 24 hour comedic spree, which may ultimately provide her with the key to her happiness.",1h 35m,The Marathon of Desires
110,5.7,['Rudolf Havlik'],"['Rudolf Havlik', 'Radka Trestíková']","Six women, six destinies connected in one novel. Have you ever wondered what a married man's mistress is dealing with and what is the horrible wife he is telling her about? Or why does a wife's sister have such a bad relationship with her daughter? How does the fifteen-year-old girl, whose parents never make time, feel? And where did the money actually go? Who took th... Read all",1h 37m,Bábovky
111,6.6,['Marcia Weekes'],DESCONOCIDO,"A Jamaican doctor trained in Western medicine and in conflict with his family (all of whom are doctors) about his belief in the benefits of bush medicine, travels to Ghana to prove them wrong.",1h 56m,Joseph
112,--,['Sean Roberts'],DESCONOCIDO,"Jim a hardworking construction worker who has pain behind him from sexual abuse as a child. Takes out his pain on his co worker girlfriend, wife and kids . As a result of his pain he causes his wife to be hurt from his abuse . His kids suffer because his son goes to school and bullies another student because of his pain. The cycled continued until it was was stopped b... Read all",--,The Pain Behind You
113,7.2,['Sanal Kumar Sasidharan'],DESCONOCIDO,"In Sanskrit, Maya means magic or illusion upon which the universe is woven. Protagonist, Maya refers to the wider mystery of the universe and its masterful manipulation with the human minds. The mystic story unravels in a Himalayan climb.",--,A'hr
114,5.0,DESCONOCIDO,"['Rouzbeh Akhbari', 'Felix Kalmenson']",An Armenian film director location scouts for an upcoming film on the history of the movement of ideas and contagion along the ancient trade networks which connected the historic Armenian capital of Ani to the world. Along the way he encounters the complex geopolitical realities which impact the region.,1h 4m,Threshold
115,6.9,['Robert Peters'],DESCONOCIDO,Mugabe rises from being a prisoner to power as a guerrilla fighter but gradually becomes the world's top tyrant. After four decades in power his allies do the unexpected.,2h,Mugabe
116,--,DESCONOCIDO,DESCONOCIDO,"When a group of kids get lost in Hell, they try to find their way back by investigating a series of haunted paintings they discover along the way.",--,The Painting
117,--,['Darshan Kanaka'],DESCONOCIDO,,--,Simpallag Mathond Love Story
118,5.1,['Borko Brajovic'],DESCONOCIDO,"Davor is an ordinary young man living in the countryside. His life is very simple and he likes to play tennis, dreaming of turning pro someday. One day, Davor stops by accident in front of an old house, located very close to an old well. Driven by curiosity he decides to have a closer look, that will turn out to be a big mistake.",1h 29m,Studenac
119,--,['Shaun Peter Cunningham'],DESCONOCIDO,"Having successfully made it to The After, the survivors learn that every action has a reaction, but when forced to face their mistakes, will they make amends, or suffer the ultimate consequence?",--,Beyond The After
120,--,['Robert Homann-Cauquil'],"['Ute Homann', 'Robert Homann-Cauquil']","Heiko lives in Berlin, he is a small criminal, and lived together with Angelina, who is always prostituting himself, with politicians, and wealthy men. They both have big dreams. When playing poker, Heiko first wins a lot of money, but at the end of the day he loses all. The mafia guy Bruno makes a deal with Heiko, he should trade Cocaine for him. All the deal went wr... Read all",--,Angelina Call Girl
121,4.9,['Rakesh Mehta'],"['Jass Grewal', 'Anooj Kumar Sareen', 'Prince Kanwaljit Singh']","To fight the corruption in Punjab university, senior student Sandhu announces his candidacy as Grewal for the election.",1h 55m,Ik Sandhu Hunda Si
122,6.7,['Sebastián Schindel'],"['Pablo Del Teso', 'Sebastián Schindel']","Desperate and confused, Alicia will do the impossible to keep her son from prison after he's convicted of trying to murder his ex-wife.",1h 39m,The Crimes That Bind
123,4.8,['Domenico de Feudis'],DESCONOCIDO,"While visiting her fiancé's mother in southern Italy, a woman must fight the mysterious and malevolent curse intent on claiming her daughter.",1h 33m,The Binding
124,--,['Seezan Ali'],DESCONOCIDO,After number of miscarriages a woman finds out that she can no longer conceive babies and requires her to make serious decisions to save her marriage.,--,Andhirikan
125,6.4,['Yuki Tanada'],DESCONOCIDO,"It was a pre-destined love and marriage for Sonoko and Tetsuo. They tied the knot and became husband and wife no questions asked. All is well then. Well, perhaps not. Each holds a secret that even the binds of matrimony cannot untie. Sonoko does not know that Tetsuo makes sex dolls or Dutch wives. Sonoko has a secret too. She is about to tell Tetsuo what she has been ... Read all",2h 3m,Romance Doll
126,--,DESCONOCIDO,DESCONOCIDO,DESCONOCIDO,--,Error nombre para la pelicula con id: tt10917968
127,7.2,['Ashish R. Shukla'],"['Avinash Singh', 'Vijay Narayan Verma']","With their planned heist gone wrong, Bony and Fundoo get inextricably involved in the pursuit of 'Kohinoor' - quite possibly the biggest scandal the country will ever witness.",2h 5m,Bahut Hua Sammaan
128,8.2,['Darling Krishna'],DESCONOCIDO,Adi embarks on a rollercoaster journey searching for true love. Through varied experiences he questions if he'll find his soulmate.,2h 33m,Love Mocktail
129,--,['Kyle Brown'],DESCONOCIDO,,--,Color of Vacancy
130,6.5,['William Collinson'],"['William Collinson', 'Ami Di Castri', 'Czerina Patel']","After waking from a 50-year coma at 76, David struggles to accept his aging body and lost time, but he still remembers his college sweetheart, Helena McCarthy.",1h 35m,Mr Johnson
131,--,['Tijuana Layne'],DESCONOCIDO,A woman drowns herself in a cycle of abuse and alcoholism after the death of her husband. Her husband's friend receives a letter and commits to a promise to help The Blue Rose.,--,The Blue Rose
132,5.4,DESCONOCIDO,DESCONOCIDO,The story of a group of soldiers going to Gallipoli War.,1h 47m,Mendilim Kekik Kokuyor
133,--,['Luke Agius'],DESCONOCIDO,A struggling taxi driver moonlights as a disposal guy for a serial killer.,1h 30m,The Ferryman
134,6.5,['Zhora Kryzhovnikov'],"['Zhora Kryzhovnikov', 'Andrey Zolotarev']","Figure skater Nadya and hockey player Sasha got married and more than anything, they dream of a child. However, the price that they will have to pay for this dream is unimaginably high.",2h 12m,Ice 2
135,--,['Azadeh Abadpour'],DESCONOCIDO,,--,Iron deficiency
136,--,['Tracey Strnad'],DESCONOCIDO,"Harper takes medical tourism to a new level as she escapes city life to have her abortion in a small cottage resort town on a long weekend. While there, she experiences her childhood playground in a new light.",1h 15m,Labour Day
137,7.7,['Mejbaur Rahman Sumon'],DESCONOCIDO,Miracles about the life story of fishermen.,2h 11m,Hawa
138,3.4,['Vidhu Vinod Chopra'],"['Vidhu Vinod Chopra', 'Abhijat Joshi', 'Rahul Pandita']",Shikara is the story of resilience in the face of insurmountable odds. It's also the story of a love that remains unextinguished through 30 years of exile. A timeless love story in the worst of times.,1h 58m,Shikara
139,5.4,DESCONOCIDO,"['Jibit George', 'Jinoy Janardhanan']","The story revolves around two families, portraying their relationship, and how a hen and its eggs changes it over time.",1h 39m,Kozhipporu
140,7.0,['Bishal Sapkota'],DESCONOCIDO,A Nepali comedian's professional commitment and personal life takes turn during his journey to a far remote region of Nepal for a performance.,1h 59m,Selfie King
141,5.2,['Andrey Zagidullin'],DESCONOCIDO,"Contemporary Moscow. After a car accident, champion athlete Sergey Borozdin suddenly has a psychic ability to see past events. When he becomes a suspect in a series of murders, he is forced to use this ability to find the real killer.",1h 30m,Petropolis
142,8.1,DESCONOCIDO,DESCONOCIDO,Young woman who wants to achieve her dreams without realizing the ramifications of her actions.,1h 40m,Khwab Sare Jhootey
143,--,['Robert D. Parham'],"['Earlena Brown', 'Shania Brown']","Crystal is a very outgoing preteen who loves people, loves her life and loves just living. One day she started to change but everyone just assumed she was going through puberty. No one noticed until they had no other choice.",--,Why Me
144,6.9,['Harvey John'],DESCONOCIDO,"Following the death of his best friend, 17-year-old Shelby struggles to readjust back into life at boarding school until popular girl Lilibet decides to take him under her wing. With the aid of her reckless and wealthy group of friends, Shelby finds himself reintroduced to a fast moving world of parties, sex and drugs -- but with life after school quickly approaching ... Read all",1h 42m,Sticky Toffee Pudding
145,7.2,['Bogomil Kalinov'],DESCONOCIDO,Dr. Stefanov is in the middle of a huge media scandal due to a patient's death. Antonia is a young journalist who bravely embarks on a journey to uncover what truly happened.,1h 30m,Ashes Over Sun
146,--,['Zhibin Zhang'],DESCONOCIDO,"The story tells about an era-fusion, about love, about family affection, and about nature. It talks about the relationship between the Baima people, the Han people, the white horse people and nature.",--,White Horse Paradise
147,6.2,['Francesco Lettieri'],"['Peppe Fiore', 'Francesco Lettieri']","Naples. At almost fifty years old Sandro is the leader of the Apache, a group of ultras with whom he has spent his whole life at the stadium: a life of violence, clashes, passions, and unshakable values. Now that a hooligan prevents him from approaching the curve, those values are starting to falter. He feels for the first time the need for a normal life, a relationsh... Read all",1h 48m,Ultras
148,5.6,['Younuts'],DESCONOCIDO,"On holiday at Riccione beach, a group of teens get to know each other and help each other get through summer loves' heartache.",1h 41m,Under the Riccione Sun
149,1.7,['Terry Lee Coker'],DESCONOCIDO,"After capturing Kazimierz Piechowski at the Hungarian border, he is sent to Auschwitz where he is forced to move corpses from the gas chambers to the crematorium.",1h 20m,The Escape from Auschwitz
150,6.1,['Birol Kurt'],DESCONOCIDO,A military scientist conducts a sleep experiment and 6 people is selected as subjects,1h 48m,Deney
151,4.8,['Khaled Ridgeway'],DESCONOCIDO,A smooth-talking telemarketer finds himself at the mercy of the man he tried to swindle.,1h 28m,Death of a Telemarketer
152,4.8,['Paul Leyden'],"['Joseph Downey', 'Hope Bryant']","When Anna Wyncomb is introduced to an underground, all-female fight club in order to turn the mess of her life around, she discovers she is much more personally connected to the history of the club than she could ever imagine.",1h 37m,Chick Fight
153,6.5,['Kamen Kalev'],DESCONOCIDO,"The life of a man at the ages of eight, eighteen, and eighty-two",2h 5m,February
154,--,['Kan Zhou'],DESCONOCIDO,,--,Mei yi ge hun dan dou hen you shang
155,5.7,['Barbara Topsøe-Rothenborg'],DESCONOCIDO,Follows three longtime girlfriends from elementary school who are coming into their prime and finding a new lease on life after participating in a cooking course in Italy.,1h 38m,Food Club
156,6.2,['Pietro Castellitto'],DESCONOCIDO,"Two families, one bourgeois and intellectual and the other proletarian and fascist, are brought together by a trivial accident that will bring these two polar-opposites together and set them on a collision course.",1h 49m,The Predators
157,7.1,['Ariel Winograd'],"['Alex Zito', 'Fernando Araujo', 'Rodolfo Palacio']","In 2006, a group of thieves performed what is considered one of the most famous and smart bank heists in the history of Argentina when they rob the Banco Río branch in Acassuso.",1h 54m,The Heist of the Century
158,5.0,['Justin McMillan'],"['Marc Furmie', 'Eddie Baroo', 'Justin McMillan']","Hana's search for her son's body leads her to the sleepy town of Billing, where her investigations uncover more than she expected and threaten to expose the town's secrets - secrets that both the living and the dead will fight to protect.",1h 42m,Sweet River
159,--,['Joe Hille'],DESCONOCIDO,"Chaos Ranch follows a dysfunctional family living in the small, rural, sun-scorched town of Oracle, Arizona. The family grapples with problems, finding themselves entangled in a web of family drama, self-exploration, drug-use, and more.",--,Chaos Ranch
160,4.9,['Adam Mervis'],DESCONOCIDO,A man and woman begin a complex affair over 72 hours in a Las Vegas penthouse.,1h 24m,The Last Days of Capitalism
161,--,['Marco WestWood Gonzalez'],DESCONOCIDO,,--,Cereal Killer
162,5.6,['Ian Liberatore'],DESCONOCIDO,"When Sean and James return home for summer break, the two draw a friendly relationship but soon reveal their inner dark secrets that lead to a tragedy that will affect everyone.",1h 50m,All-American Boy
163,6.4,['Giulio Base'],"['Giulio Base', 'Marco Beretta', 'Israel Cesare Moscati']","In her Roman attic, a girl finds an old picture of the Jewish child Sarah Cohen whose family has been killed by the Nazis in World War II. She will track down her past...",1h 40m,A Starry Sky Above the Roman Ghetto
164,7.0,['Anubhav Sinha'],DESCONOCIDO,Thappad is a story of Amrita whose seemingly perfect life is shattered when her husband slaps her once in a party. But is one slap enough to question what a relationship stands for?,2h 22m,Thappad
165,6.4,['Roderick MacKay'],DESCONOCIDO,"To escape the outback, a young Afghan cameleer falls in with a mysterious bushman on the run with stolen Crown gold.",1h 56m,The Furnace
166,6.1,['Anu Menon'],DESCONOCIDO,"Shakuntala Devi, a mathematician's journey to become 'The Human Computer' and her relationship with her daughter.",2h 7m,Shakuntala Devi
167,7.1,['Julio Roman'],"['Ronald Benitez', 'Julio Roman']","Based on the supernatural true stories, ""Creere"" tells the stories of five (5) group of people whose lives are interrupted by supernatural power of God.",1h 43m,Creeré
168,7.8,['Ritam Srivastav'],DESCONOCIDO,"the life journey of the dreaded dacoit Shiv Kumar Patel who ruled the lands of Bundelkhand for twenty-eight years and had the entire police, administration and the politicians being obedient to him.",1h 41m,Taanashah
169,4.1,['Vijay Anand'],DESCONOCIDO,A conman tries to save an innocent girl from the clutches of a womanizer after realizing that he had fallen in love with her.,2h 1m,Dagaalty
170,5.9,['Moroco Colman'],DESCONOCIDO,"The true story of Argentina's most notorious serial rapist: a dedicated husband and father who lived a double life, preying for decades on young women in the college city of Córdoba.",1h 20m,The Longest Night
171,5.5,['Naranipuzha Shanavas'],DESCONOCIDO,"Sujata (mute) is in love with her neighbour, a sufi priest but her father gets her married off to a well-do-to NRI, in Dubai. Ten years have passed since and she thinks that she's left that love in her past - until, one day, she gets a call. Her husband (Rajeev) decides to bring her back to the village. What follows, forms the crux of Sufiyum Sujatayam, a musical love... Read all",2h 2m,Sufiyum Sujatayum
172,--,['Arthur J. Mangano'],DESCONOCIDO,,--,Brew
173,--,['S. Tynsong'],DESCONOCIDO,"When a drunken father takes no responsibility for his family, will his wife and his son live a better life?",--,Ka bor jong ka kyiad
174,--,['Michael Mandell'],DESCONOCIDO,,--,Razor Blade
175,--,['Val Comorie'],DESCONOCIDO,An Asian social worker is forced into dealing with the Mob.,--,Wong's War
176,--,['Altantuya Tumurbaatar'],"['Norov Dalkhaa', 'Agar Victor']","Mongolia, 1960's. An old herdswoman lives alone in her yurt in the great Gobi Desert. Visitors from the national registration office come to collect information from her for the census. Sarcastically naming the elderly woman ""pretty lady"", they question her about her identity - but she divulges little. However, when one of the officers stays the night to count her liv... Read all",1h 45m,Blue Destiny
177,--,['Jakub Mainski'],DESCONOCIDO,,--,Sztynort 1935
178,--,['Jimmy Bridges'],"['Nycce Bingsly', 'Jimmy Bridges', 'Audrica Peters']",,--,40'N Still Single
179,--,['Frank Sabatini'],DESCONOCIDO,,--,Mirror on My Wall
180,--,['Frank Sabatini'],DESCONOCIDO,,--,The Jealous Mirror on My Wall
181,5.3,['Satish Vegesna'],DESCONOCIDO,"Balu loses both of his parents in his childhood and he grows up as an orphan. Because of this, he starts an organization named ""All Is Well"" to supply emotions to the needy.",2h 32m,Entha Manchivaadavuraa
182,4.6,['Mehmet Tanrisever'],DESCONOCIDO,,1h 49m,Once Upon a Judgment Day
183,6.8,['Zaida Bergroth'],DESCONOCIDO,"Depiction on the life of Tove Jansson, showing both her personal relationships, and the creation of the popular Moomin books.",1h 43m,Tove
184,--,['Ari Dassa'],DESCONOCIDO,"A group of diverse artists living in Los Angeles are connected by the pursuit of creativity, love and self-discovery.",1h 36m,The Circular City
185,5.7,['Gary Lee Vincent'],DESCONOCIDO,"Based on a true story, Officer Carl Thomas (Jeff Moore) was fearless at going after the bad guys. But Thomas had a dark side. In Dispatched, learn how God changed the heart of a street-hardened cop into an ambassador of God's love.",1h 16m,Dispatched
186,4.5,DESCONOCIDO,DESCONOCIDO,"Witness the most miraculous events in history as Jesus sets sail with fishermen, challenges the Pharisees, befriends the outcasts, and heals the hurting. The lives he touches will never be the same.",2h 10m,Jesus
187,6.3,['Beniamino Catena'],DESCONOCIDO,The life of an Italian 9 year old girl and of a Chilean man working in the Atakama desert bond together in a unpredictable and mysterious way known to time and space only.,1h 40m,Vera de Verdad
188,6.2,DESCONOCIDO,DESCONOCIDO,"Every day, three sex workers cross the border from France into Belgium to practice their trade. At the end of one particularly hot summer, all three share a secret that will bind them together forever.",1h 31m,Working Girls
189,7.2,['Teja Marni'],DESCONOCIDO,"A gripping tale around the lives of five people grappling for their dreams when a young politician, suddenly in the hot seat of power, makes the life-altering decision of setting his father's legacy to stone by hook or by crook.",2h 2m,Johaar
190,--,['Ted Amaradidis'],DESCONOCIDO,"Synopsis: We go through the life of Fransesco Giacomo Paolo DiMarco. Something like FORREST GUMP except it is about a businessman and an artist / painter. A life full of adventure, drama and love. Two versions: 2D and 3D.",--,Naming Leonardo
191,--,DESCONOCIDO,DESCONOCIDO,,--,King Amir's Verdict
192,5.5,['Yûichirô Hirakawa'],DESCONOCIDO,"A group of the smartest kids at a seemingly perfect orphanage uncover its dark secret, and set in motion a dangerous and desperate escape plan.",1h 59m,The Promised Neverland
193,6.5,['Quentin Reynaud'],DESCONOCIDO,"Thomas was once renowned as a young tennis prodigy, but never had the career he hoped for. At 37, despite his declining physical fitness, he decides to compete in the qualifying rounds of the French Open for one last attempt at glory.",1h 45m,Final Set
194,9.2,['Shreemukha Sullia'],DESCONOCIDO,"Damodar, a 24 year old egotist, believes he is very talented but in reality, his only skills are stealing areca nuts from the house and making TikTok videos. He has a desire to go to the city and become famous. Will his dream come true?",1h 56m,Damayana
195,--,['Tyaba Charles'],"['Alex Kakooza', 'Reagan Laurian']",WHERE WE BELONG is a story about a downtown street hustler DRONE who leads a disobedient group of young men engaging in juvenile delinquency and violence that was left behind by their guardian CHIEF. Drone as a new leader makes different encounters to find money for survival where he got arrested. His set free with the help an uptown girl JULIAN whom they later develo... Read all,--,Where We Belong
196,5.9,['Robert Cremona'],DESCONOCIDO,"The airing of the Arabic version of an international dating TV show, that offers a panel of women the choice of a potential male suitor, sparks uproar and turns the show host into a public enemy.",1h 14m,TV Society
197,5.7,['Zu Quirke'],DESCONOCIDO,An incredibly gifted pianist makes a Faustian bargain to overtake her older sister at a prestigious institution for classical musicians.,1h 30m,Nocturne
198,6.9,['Scott Lambson'],DESCONOCIDO,A 19th century fur trapper must figure out his past when he awakens all alone in the Rocky Mountains badly hurt and with temporary amnesia.,1h 10m,Into the Soul
199,9.3,DESCONOCIDO,"['Bonga Shin', 'Stephen Shin', 'Jun You']","Paul's life takes a dark turn when his wife, Joanne, and his stepdaughter, Lucy, turn up dead. Distraught, he is unable to do any work and becomes homeless. Directionless and clueless, he lives a life of sorrow. Danny, ex-husband to Joanne, shows up in front of Paul and helps him to discover the truth about the deaths of Joanne and Lucy. Energized, Paul and Danny emba... Read all",1h 32m,The Walk
200,4.5,['Scott Hester'],DESCONOCIDO,"After Paul Hanson agrees to a last minute business meeting on Christmas Eave, He finds himself constantly overcoming repeated obstacles while trying to make it home in time for the big Christmas Extravaganza.",1h 10m,The Greatest Gift Ever Given
201,7.3,['Takahiro Miki'],DESCONOCIDO,"A tragic accident lead to Akari's blindness, but she clings to life and the smaller pleasures it can still afford her. Akari has also lost her family. She meets Rui a former kick boxer, misplaces him and the two begin speaking. He too has a past and is disassociated with most of society. One things leads to another and they develop feelings for one another. However, t... Read all",2h 3m,Your Eyes Tell
202,5.6,['Ayman Makram'],DESCONOCIDO,"The film revolves around an officer who undertakes research on social issues, especially living in poor neighborhoods at the heart of cairo.",1h 38m,Yom wa Lailah
203,--,['Stephen Mitchell'],DESCONOCIDO,"On the eve of an execution, eight people confront the darkness in their own lives.",--,Look Into Darkness
204,7.2,['Alan Nadal Piantini'],"['Manuel Aranda', 'Emmanuel Galán']","Jordan, a basketball-loving teenager trapped in vice and bad influences, meets Don Roberto, who will coach him not only in basketball, but spiritually too.",1h 28m,Atravesando el Jordán
205,8.1,DESCONOCIDO,DESCONOCIDO,"Terrel Emotion, a local transportation driver from a small town in South Florida, who dreams of one day making it big as a recording artist in the music industry, meets the girl of his dreams through mutual friends, Milyan Sanchez, a beautiful local entertainment journalist, who sings like an angel from heaven. As the two fall in love and embark on a incredible romant... Read all",2h 1m,The Finest
206,--,['Christopher Johnson'],DESCONOCIDO,"After his sister shows up beaten at his doorstep, a young man's past pain boils into rage as he confronts her abusive husband.",--,Beater
207,5.1,['Ant Horasanli'],"['Ant Horasanli', 'Ezra Sholeh']",A young thief with a history of grand theft auto becomes an informant and helps police bring down a criminal enterprise involved in the smuggling of hundreds of exotic super cars.,1h 31m,Rev
208,5.7,['Julio Hernández Cordón'],DESCONOCIDO,"A strange self-portrait carried out by a young woman who begs to ride freely with her bicycle. Accompanied by her father, who whispers local stories in her ear, a ghost full of poetry and a wolf woman, the girl goes on a mission to find the lake of Texcoco, in Mexico.",1h 12m,The Howls
209,5.7,['Jill Gevargizian'],DESCONOCIDO,A lonely hair stylist becomes obsessed with the lives of her clients and descends into murderous madness.,1h 45m,The Stylist
