,Puntuacion_IMDB,Dirección,Guionistas,Argumento,Duración,Nombre de la película
0,6.6,['Isao Yukisada'],"['Ryûta Hôrai', 'Naoki Matayoshi']","Nagata is the director of a theater troupe. Unfortunately, he is rather unsuccessful on his finances which makes the crew has little confidence in him.",2h 16m,Theater
1,5.6,['Rafael Flores'],DESCONOCIDO,"As a sex worker (Liberty) desperately searches for housing after recently discovering she is pregnant, her ex-boyfriend/pimp (King) battles with supporting his family. Meanwhile, an undocumented teen (Augustin) struggles to survive while he sleeps on the streets of East Oakland and is pursued by a bully who he encounters in a homeless shelter. Lastly, we follow the st... Read all",1h 26m,E.14
2,6.5,['Arunkanth'],DESCONOCIDO,"A Business Fight between Young Entrepreneurs who start an Internet Radio Station, and A Magazine Publishing Corporate. The Internet Radio station hosts a Talk show on Marriage and Matrimony which kindles crazy thoughts among the public.",1h 40m,Indha Nilai Maarum
3,6.5,['Glenn Triggs'],DESCONOCIDO,"Featuring no-dialogue, Dreams of Paper and Ink follows an elderly novelist Wade, who re-visits the crossroads of his first and 2nd love through imagination and a typewriter.",1h 50m,Dreams of Paper & Ink
4,--,['Yolande k Boyom'],"['Yolande k Boyom', 'Lynneise Joseph']","The story is about Diane, a young African girl looking to belong who embarks on a life changing voyage, which takes her through the underworld of prostitution and the horrors of human trafficking. (FRENCH) L, histoire nous parle d, Diane, jeune fille a la recherché d, un aver meilleur, qui I, embarque dans un voyage a travers les enfers de la prostitution et les horro... Read all",--,The Road to Freedom
5,4.2,['Virginia Abramovich'],"['Virginia Abramovich', 'Katherine Andrews']",It's about a woman's pursuit to join her missing lover by crossing into a parallel dimension.,1h 40m,Between Waves
6,5.8,['Andrew Cohn'],DESCONOCIDO,Stanley's last shift at his fast food job takes an unexpected turn when he befriends a young African-American work employee.,1h 30m,The Last Shift
7,--,DESCONOCIDO,DESCONOCIDO,"Retired Navy SEAL and CIA operative Chuck Brandau is on his way home from burying his teammate after a particularly bad op when he runs into Linn, the local pusher. Chuck must decide to whether to let Linn live or die.",--,Rest Area
8,5.3,['Stefan Westerwelle'],"['Hannah Schweier', 'Stefan Westerwelle']",A ballerina discovers hip-hop by chance and is faced with an impossible choice: Does she pursue her family's legacy or her newfound love.,1h 42m,Into the Beat
9,6.6,['Peter Ho-Sun Chan'],DESCONOCIDO,"After 12 years, the Chinese women's volleyball team again reached the Olympic final. The ups and downs of the Chinese women's volleyball team for more than three decades have slowly spread away.",2h 15m,Leap
10,4.4,['Brian Franklin'],DESCONOCIDO,A naive young husband must face down his obsessive and psychotic friend when their plan to elicit a confession from his adulterous wife ends in murder.,1h 15m,The Passenger
11,6.8,['Kaori Makita'],"['Hiroshi Seko', 'Kou Yoneda']",Yashiro is the president of the Shinseikai Enterprise. He leads a double life as a deviant and a masochist. Doumeki Chikara comes to work as a bodyguard for Yashiro. They begin an affair of two men with songs in their hearts.,1h 25m,Saezuru Tori Wa Habatakanai: The Clouds Gather
12,6.9,['Ismaël Ferroukhi'],DESCONOCIDO,"Mica, a boy from the slums, is hired as the handyman at a swanky tennis club in Casablanca. There is he noticed by Sophia, a former tennis champion, who takes him under her wing.",1h 43m,Mica
13,5.3,['Just Philippot'],DESCONOCIDO,"A single mother's business of a locust farm isn't doing so well. She discovers by accident that blood makes them thrive, and does her best to hide her secrets.",1h 41m,The Swarm
14,7.9,['Diego Rocha'],DESCONOCIDO,"To overcome the fear of losing his ill and aging grandfather, a forensic photographer needs to discover the truth behind the alleged suicide of an elderly man.",1h 50m,The Fall
15,4.7,['Nathan Clarkson'],DESCONOCIDO,A set of diverse characters wind up together in an old diner in a small town on Christmas Eve during a snowstorm while a young expectant couple tries to make it home on a night that's anything but silent.,1h 11m,Miracle on Highway 34
16,5.3,['Jorge Piwowarski'],"['Jorge Piwowarski', 'Federico Viescas']","Diego Lamote (Christian Sancho) is at a breaking point in his life. Having economic issues and finished his career as a footballer he decides to return to Argentina and reinvent himself as a football Manager. Francisco Méndez (Andrés Vicente), his former coach, who continues to be in charge of the sub-17 of the ""Club Atlético Acassuso"", leads a solitary life with exce... Read all",1h 26m,Un Crack
17,4.6,['Petr Zahrádka'],"['Alexandra Leclère', 'Petr Zahrádka']","Happily married for fifteen years, Zuzana finds out one day that her husband has been having an affair with another woman for a long time. Zuzana does not hesitate and decides to visit her daughter-in-law Lenka and make her a slightly unconventional proposal. Her plan is scandalous. She suggests that she share the care of Jirka and turn him into a man for a change. Le... Read all",--,Chlap na strídacku
18,3.7,['Mehmet Tanrisever'],DESCONOCIDO,,1h 47m,Keman Agitlari
19,7.3,['Karuna Kumar'],"['Tammareddy Bharadwaja', 'Nagendra Kasi', 'Karuna Kumar']","Mohan Rao and his elder brother face Pedda Shavukar and Chinna Shavukar, a political battle where low caste fights the high caste power.",2h 24m,Palasa 1978
20,6.0,['Chris Cowden'],DESCONOCIDO,"Macie (Patty Srisuwan), a Thai immigrant adopted into a North American family, must look after her dementia suffering grandfather (John Rhys-Davies), as she searches for the truth about her past.",1h 52m,Moments in Spacetime
21,5.9,['Christian Lerch'],"['Josef Einwanger', 'Christian Lerch']","Pre-teen, shy Bavarian village boy Felix hears his father died on the front in World War II, so he's left with his mother. Luckily he becomes buddies with Karri, the cocky son of local Nazi boss Ortsgruppenleiter Feik 's son Karri and thus the petty tyrant's protege as well as a ""war hero's heir"". Karri drags Felix along in attempts to prove their bravery, terrorize r... Read all",1h 33m,Das Glaszimmer
22,6.7,['JJ Fredrick'],"['JJ Fredrick', 'Pon Parthiban']",Ponmagal Vandhal (Meaning: The Precious Princess has Arrived) is a courtroom drama that takes place in Ooty. Jyotika plays the lead in the film alongside various other veteran actors playing important roles.,2h 3m,Ponmagal Vandhal
23,5.5,['David Färdmar'],DESCONOCIDO,"One morning it is over. For Hampus it is a relief to break up from their destructive relationship, while Adrian is devastated. Will he be able to survive without the love of his life, or is there a way of somehow getting him back?",1h 44m,Are We Lost Forever
24,5.9,['Prasobh Vijayan'],DESCONOCIDO,Aravind is informed that something unexpected has happened to his family and has to reach the hospital immediately. What awaits him comes as a shock as he is soon sucked into a miasma of questions that he has to fight to find the answers.,2h 1m,Anveshanam
25,7.3,['Aleem Khan'],DESCONOCIDO,"Set in the port town of Dover, Mary Hussain suddenly finds herself a widow following the unexpected death of her husband. A day after the burial, she discovers he has a secret just twenty-one miles across the English Channel in Calais.",1h 29m,After Love
26,--,['John Kouromihelakis'],"['Ranelle Golden', 'Susan Meister']",This is a touching heartfelt story about love and the loss of loved ones and the hope and faith to go on and legacy of love that keeps our loved ones with us.,--,Always with you
27,5.0,['Nacho Garassino'],DESCONOCIDO,"A father, a son, and one dying wish: a trip to the sea.",1h 30m,Rumbo al Mar
28,6.8,['Robert Machoian'],DESCONOCIDO,David desperately tries to keep his family of six together during a separation from his wife. They both agree to see other people but David struggles to grapple with his wife's new relationship.,1h 25m,The Killing of Two Lovers
29,5.3,['Hiroki Inoue'],DESCONOCIDO,Two male actors are drawn to each other. Can they work things out?,1h 24m,Love Stage!!
30,7.7,['Aaron Sorkin'],DESCONOCIDO,"The story of 7 people on trial stemming from various charges surrounding the uprising at the 1968 Democratic National Convention in Chicago, Illinois.",2h 9m,The Trial of the Chicago 7
31,6.3,['Elissa Down'],"['Michael Armbruster', 'Shawn Ku']","After failing to find success on Broadway, April returns to her hometown and reluctantly is recruited to train a misfit group of young dancers for a big competition.",1h 49m,Feel the Beat
32,6.1,['Ivan Ruiz Flores'],"['Ana González Gutiérrez', 'Ivan Ruiz Flores']","Julia has just retired and is ready to pursue her life-long passion: sculpture. However, her mother, who has been shifting between living with both her children, takes the opportunity to settle in under Julia's care.",--,Retrato de mujer blanca con pelo cano y arrugas
33,3.1,['Ricky Borba'],DESCONOCIDO,"Based on the true story of a couple killed while riding a motorcycle (based on the book ""In The Blink of an Eye"") and the forgiveness of the man responsible for their deaths.",1h 38m,My Brothers' Crossing
34,5.7,['Lex Ortega'],DESCONOCIDO,"A married couple and their young daughter are terrified of the neighbors' dog, which ends up biting the girl. The dog is sacrificed to the desolation of its owners who saw it as their son. They enter the married couple's house at night to take revenge. What they want is justice: sacrifice the girl.",1h 27m,Human Animals
35,4.7,['Indrasis Acharya'],"['Indrasis Acharya', 'Riddhi Majumder', 'Abarna Roy']",Parcel is story of a doctor couple and Nandini the female protagonist suddenly starts receiving some unanimous mysterious parcels with some of her older and recent photographs. This process creates a turbulence in their family and they go verge of terminating their marriage. Nandini tries to find out the root cause anticipating some black mailing purpose with associat... Read all,2h 3m,Parcel
36,--,['Bruce C. Bradbury III'],"['Bruce C. Bradbury III', 'Zavier Henderson']","A touring musician returns home to spend time with old friends and an old flame for a day. Just as times begin to feel right again, she has to reckon with leaving again.",--,Rooftops
37,--,DESCONOCIDO,"['Mikaela Bertholf', 'Cam Dyer', 'Deaton Gabbard']","Amelia Ripley has it all, the perfect life, the perfect husband, the perfect job as a freelance writer but when her husband, Liam Ripley, becomes more and more jealous of her best friend, Noah, things take a turn for the worst.",1h 2m,Broken Vows
38,6.5,['Gaspar Antillo'],"['Gaspar Antillo', 'Josefina Fernández', 'Enrique Videla']","Memo lives on a remote Chilean sheep farm, hiding a beautiful singing voice from the outside world. A recluse with a glittery flair, he can't stop dwelling on the past, but what will happen once someone finally listens?",1h 31m,Nobody Knows I'm Here
39,7.6,['Marjan Gavrilovski'],DESCONOCIDO,"A junkie, a gambler and an accordion player get involved with a mafia while on their way to return a bought Albanian girl back to her father.",--,"Te dua, I Swear"
40,--,['Larissa Anton'],DESCONOCIDO,,1h,Zeitreise durch den Odenwald Teil 2 - sagenhafte Frauen im Spiegel der Zeit
41,7.4,['Rikiya Imaizumi'],DESCONOCIDO,"Shun and Nagisa first meet and fall in love during high school. However, despite strong feelings, they go their separate ways. Years later, Shun is now living alone in a rural area when Nagisa arrives with his six-year-old daughter, Sora.",2h 7m,His
42,5.1,['César Rodrigues'],DESCONOCIDO,"Follows the young Ana, who studied fashion design dreaming of becoming a great stylist but dropped everything to become a digital influencer for a famous brand.",1h 36m,Airplane Mode
43,6.6,['Omer Inal'],"['Omer Inal', 'Ozkan Kucuk']","The story is about three people who have never met, facing the consequences of their choices while their lives change entirely. Aylin's, Fikret's and Cihangir's choices which seem instantaneous and insignificant, reveal unseen results in each other's lives. The lives of these three people will have unpredictable results.",1h 45m,The Other Path
44,--,['Jayesh Trivedi'],DESCONOCIDO,A lady who struggle for justice,--,Bawari
45,--,['Mark Young'],DESCONOCIDO,,--,Lost in Paradise
46,6.0,['Henrik Ruben Genz'],"['Bo Hr. Hansen', 'Henrik Ruben Genz', 'Erling Jepsen']",A woman disguises herself as a man to join the army in order to protect her educationally subnormal son who has been called up to fight in WW1.,1h 40m,Erna at War
47,5.6,['R.S. Durai Senthilkumar'],DESCONOCIDO,"Sakthi is a petty thief in a Chennai slum, who learns the Adimurai, the ancient and oldest form of martial arts. Meanwhile, an evil man and his son challenge Sakthi for a kickboxing tournament, and Sakthi agrees to participate in it.",2h 21m,Pattas
48,7.3,['Caleb Lisitsin'],"['Caleb Lisitsin', 'Aiden Gale', 'Adam Corey']",A young man returns to his hometown after years of being gone to get revenge on a gang that ruined his life.,1h 24m,Vigilante
49,7.4,['Georgis Grigorakis'],"['Georgis Grigorakis', 'Maria Votti', 'Vangelis Mourikis']","A father and a son long lost. Love and hate. Digging deep into mud to find their roots. Revenge and Redemption. A Western, revisited.",1h 41m,Digger
50,--,['Daniel Payn'],DESCONOCIDO,"George Slater returns to the Midnight hotel 40 years later to recall the traumatising events that happened to him, all the while searching for a sense of closure.",--,Lost in Midnight
51,4.9,['Maciej Dutkiewicz'],"['Arkadiusz Borowik', 'Maciej Dutkiewicz']","In the Masurian scenery, the story of two inseparable friends - policemen who, after ostentatiously leaving the service, opens a pub and a marina by the charming lake in Morag. However, their respite from challenges does not last long - they are quickly drawn into the middle of a criminal mystery involving an attractive businesswoman. In addition, things get complicat... Read all",1h 44m,Code Name: Challenge
52,5.6,['Tim Jameson'],DESCONOCIDO,"""A Black small business owner and white business executive must work together to save themselves and their families from the clutches of a demented captor.""",--,By Days End
53,7.8,['Aaron Lee Lopez'],DESCONOCIDO,"When her family goes out of town, Alex and her fellow band geek friend Claire decide to take her brother's candy apple red 1966 Mustang on weekend joyride in hopes of appearing cool and impressing her high school crush.",1h 27m,Teenage Girl: First Wheels
54,--,['Hubert Wieckowski'],DESCONOCIDO,"A man lives a happy life with his girlfriend, but one day he meets a stranger that's going to change the way he looks at himself and his choices.",--,Jab
55,--,['Bowen Li'],DESCONOCIDO,"An assassin (Annie Knox) sits at her target's (Adrian Perez) table and attempts to get an invite back to his house, but when she gets there she finds a surprise in the shape of her old best friend- her target's wife (Emma Knox).",--,Seduction
56,7.8,['Carlos R. Lopez Parra'],DESCONOCIDO,"Manuel, a 70 year old man and his son Simon, a 30 year man with a profound cognitive disability, live isolated in a small town in the Colombian countryside. For both of them, home comforts are minimal due to their physical problems, the long distances they must travel to get food and the dangers of the region, which are the arising violence of the 50's. Loneliness is ... Read all",--,Nubes grises soplan sobre el campo verde
57,--,DESCONOCIDO,DESCONOCIDO,DESCONOCIDO,--,El Cóndor Colombiano
58,5.2,['Esteban Arango'],"['Esteban Arango', 'Erick Castrillon']","When a family leaves their native Colombia for the United States in the summer of '99, a metalhead science prodigy and his aimless younger brother struggle to align the American Dream with their new reality.",1h 45m,Blast Beat
59,5.8,['Anil Ravipudi'],DESCONOCIDO,An army major sent to Kurnool to give company to his injured colleague's family ends up locking horns with a corrupt minister who is targeting the family.,2h 49m,Sarileru Neekevvaru
60,7.3,['Angga Dwimas Sasongko'],DESCONOCIDO,"Three siblings live in happy-looking families, but one of them changes and gets warned by his parents, prompting the rebellion of the three siblings which led to the discovery of the secrets and great trauma in their families.",2h 1m,One Day We'll Talk About Today
61,8.5,DESCONOCIDO,DESCONOCIDO,"Good Morning Indonesia, a school for poor orphans, invites seven children to become a team. But, jealousy and envy started because of the hidden love between them. They are sent to Europe without accompany, and the conflicts are exploded.",2h 9m,The Garuda Kids
62,--,['James M. Perry'],DESCONOCIDO,,--,Obscurity
63,6.1,['Srijit Mukherji'],"['Rohini Ghosh', 'Mani Shankar Mukherjee']",A crime repeats its pattern after 25 years .Is it the same killer or a new psycho on the streets?,2h 9m,Dwitiyo Purush
64,--,['Joshua Bovinette'],DESCONOCIDO,Bump Kowalski is a washed up pinball wizard on the path to repair his pinball past.,1h 24m,Bump Kowalski and the Ten Commandments
65,6.3,['Jacqueline Lentzou'],DESCONOCIDO,"After years of distance, Artemis has to get back to Athens due to her father's frail state of health. Discovering her father's well-kept secret allows Artemis to understand her father in a way she was not able before.",1h 48m,"Moon, 66 Questions"
66,--,DESCONOCIDO,"['Austin Burnette Mitchell', 'Jeremy Reyes']","A bizarre religious zealot entrusts the help of a hitch-hiking country singer in order to help find his younger brother, who he believes to be kidnapped by a cult that worships Baphomet somewhere in the desert outside Las Vegas, Nevada.",1h 23m,Baphomet Mountain
67,--,DESCONOCIDO,DESCONOCIDO,DESCONOCIDO,--,Error nombre para la pelicula con id: tt10795930
68,7.4,['Andrey Konchalovskiy'],"['Elena Kiseleva', 'Andrey Konchalovskiy']","When the communist government raises food prices in 1962, the rebellious workers from the small industrial town of Novocherkassk go on strike. The massacre which then ensues is seen through the eyes of a devout party activist.",2h 1m,Dear Comrades!
69,6.1,['Claudio Noce'],"['Enrico Audenino', 'Claudio Noce']","Two young boys, Valerio and Christian, form a powerful friendship over the summer.",2h,Padrenostro
70,4.3,['Justin Viggiano'],DESCONOCIDO,A newly hired night watch woman's deceased child's clown doll goes missing from her place of work and starts appearing in places it shouldn't weakening her already fragile sanity.,1h 35m,Drown the Clown
71,6.3,DESCONOCIDO,DESCONOCIDO,"A young man faces immense pressure from his family to move to America, get a job and have his life settled abroad.",2h 15m,Pressure Cooker
72,5.9,['Sreevardhan'],DESCONOCIDO,Krishnamurthy Who Is An IIT BOMBAY Student Comes To Hyderabad And Gets To Know That His Uncle Is Missing. Entire Story Revolves Around The Mysterious Missing Case Of Krishnamurthy's Uncle.,2h 2m,IIT Krishnamurthy
73,6.0,['Pratim D. Gupta'],"['Rohini Ghosh', 'Pratim D. Gupta']","Two people whose love is a force that can never be changed, no matter how much its surroundings may change. A unique take on the timelessness of romance.",1h 45m,Love Aaj Kal Porshu
74,--,['Peter Alexander'],DESCONOCIDO,"The Last Weekend is about college graduates who've been friends since high school. It's their final get together before embarking on careers or wherever life takes them. An innocent, impromptu beach party gets a bit out of hand, but as the party winds down, a dark secret is learned affecting everyone.",1h 26m,The Last Weekend
75,6.1,['Steven Soderbergh'],DESCONOCIDO,A famous author goes on a cruise trip with her friends and nephew in an effort to find fun and happiness while she comes to terms with her troubled past.,1h 53m,Let Them All Talk
76,4.1,['Deniz Denizciler'],DESCONOCIDO,The love story of a girl Asli from an intelligent family and a man named Kerem from a family of the underworld of Istanbul.,1h 37m,Agir Romantik
77,--,DESCONOCIDO,DESCONOCIDO,DESCONOCIDO,--,Error nombre para la pelicula con id: tt10816420
78,6.9,['Francesco Amato'],DESCONOCIDO,"Inspired by the extraordinary story of Elisa Girotto, the woman who moved the world by leaving 18 birthday gifts for her daughter when she discovered that she would have little time with her.",1h 55m,18 Presents
79,5.5,['Hisonni Mustafa'],"['Hisonni Mustafa', 'Hedy Wong']","To give her family a chance at a better life and save her family's failing restaurant, Tera Wong, a desperate 20-year-old Asian girl, parlays her Chinese food delivery expertise into a profitable drug hustle.",1h 40m,Take Out Girl
80,--,['James F. Oakes'],DESCONOCIDO,"An eventful day in the life of Benjamin Wyatt - an aging indie musician whose chance at regaining success suddenly crosses paths with his life, love and future in the worst way.",--,The Band Forgettable
81,--,['Alessia Di Giovanni'],DESCONOCIDO,"Two girls in 1987, an abuse, a revenge, an homicide. A female punk thriller.",--,Spore
82,6.0,['Alessandro Lunardelli'],"['Giacomo Ciarrapico', 'Davide Lantieri', 'Alessandro Lunardelli']","Italian Army Corporal Ettore, kidnapped in Syria by Isis, is freed after paying a ransom. Back to Italy the Army wants to award him a medal, but he has only one thought: his girlfriend Jamila, blocked in Syria, prisoner of the jihadists.",1h 40m,La Regola d'Oro
83,6.1,['Travis Fine'],DESCONOCIDO,"TWO EYES is a cinematic triptych which follows three main characters in three distinct time periods: in Late 19th century Montana, an artist (Benjamin Rigby, Alien: Covenant) seeking inspiration for his art, explores the landscape with his Native American guide (Kiowa Gordon, the Twilight Saga) and finds his conceptions of himself and the world around him challenged. ... Read all",1h 35m,Two Eyes
84,6.2,['Alexander Milo Bischof'],DESCONOCIDO,A couple's relationship threatens to collapse under the pressures of life.,1h 30m,Trouble Will Find Us
85,7.1,['Kushan Weerarathne'],DESCONOCIDO,A young woman on the edge of a half constructed building top trying to jump off. But a voice talks to her. It's a man. He tells her it's a matter of the last second thought which step her away from jumping. They start taking and decide to run away. So their story unveils while they travel around and across the country.,--,Soosthi
86,4.6,DESCONOCIDO,DESCONOCIDO,This is a film about the 'very hush-hush' human trafficking industry. It will bring awareness to this multi-billion dollar scourge.,1h 1m,Friend Request
87,--,['Suvendu Das'],DESCONOCIDO,A doomed young life in the hands of the begging-mafia.,1h 30m,Beg for Life
88,6.0,['Harsha Udakanda'],DESCONOCIDO,,--,Seda Mawathe
89,8.2,['Mike Gutridge'],DESCONOCIDO,A tormented psychology professor exploits the gift of a reluctant autistic girl to uncover the mystery of her past life.,--,In Your Afterglow
90,--,['Cyril Lorin'],DESCONOCIDO,,--,Opération Phoenix
91,--,['Narugopal Mandal'],DESCONOCIDO,,--,Ektu Valobasar Janno
92,5.9,['Oskar Roehler'],DESCONOCIDO,"The life and the impact of iconic German New Wave director, Rainer Werner Fassbinder.",2h 14m,Enfant Terrible
93,6.5,['Kentarô Hagiwara'],DESCONOCIDO,"When a musician dies, his spirit can only be seen and heard by an awkward university student. They can switch places for 30 minutes using a Walkman. The student learns to socialize with the musician's old band and girl.",1h 54m,Our 30 Minute Sessions
94,7.9,['Ramin Rasouli'],DESCONOCIDO,"In a remote area in Afghanistan, stories of the lives of a young shepherdess, a bird catcher boy and a mourning teacher are intertwined by the wounds of war which are still bleeding.",1h 31m,The Dogs Didn't Sleep Last Night
95,5.4,['Ludovic Bergery'],"['Ludovic Bergery', 'Julien Boivent']","Recently widowed Margaux moves in with her sister. Looking to turn a page, she re-enrolls at university and becomes interested in new pursuits. At the same time, dark compulsions begin to arise.",1h 40m,Margaux Hartmann
96,5.8,['Lluís Danés'],"['Lluís Arcarazo', 'María Jaén']","In early 20th century Barcelona, little Teresa goes missing shocking the country. When police start investigating Enriqueta Martí, the ""Vampiress of Raval"", they cover a much more sinister affair.",1h 43m,The Barcelona Vampiress
97,3.5,['Lili Matta'],"['Lili Matta', 'Lana Marks']","An ex-marine with PTSD storms into a gallery, taking hostages and forcing them to confront their complex past and looming mortality, as time ticks by.",1h 24m,86 Melrose Avenue
98,3.6,['Joseph Ramos'],"['Sandra L. Bucy', 'Thomas Crouser Jr.', 'Julian Crouser']","At Castle Park High, both Dillon and Travis have a crush on Megan. Dillon would kill for her but not if a hidden secret in the basement kills them first.",1h 21m,Deadly Promises
99,7.0,['Rodrigo Sepúlveda'],DESCONOCIDO,"Among gunshots and boleros, a passionate relationship flourishes between a lonely transvestite and a young guerrilla during the Pinochet dictatorship in Chile.",1h 33m,My Tender Matador
100,--,DESCONOCIDO,DESCONOCIDO,,2h,Do You Still Love Me?
101,6.1,['Gabriel Le Bomin'],"['Valérie Ranson-Enguiale', 'Gabriel Le Bomin']","Paris, June 1940. The de Gaulle couple is confronted with the military and political collapse of France. Charles de Gaulle joins London while Yvonne, his wife, finds herself with her three children on the road of the exodus.",1h 48m,De Gaulle
102,7.9,['James Webber'],DESCONOCIDO,"Two young women come to a crossroads in their life, which makes them examine their tragic past and look forward to a new future.",--,Sorority
