90,"3,0",['Mark McNabb'],"['Virginia Carraway', 'Charlie Fitzgerald']","Action thriller about a brotherhood of friends torn apart by a dangerous secret and an even deadlier conspiracy. When ex-cop Nick Browning is called by his estranged wife (Tara Goudreau), needing his help to find their missing daughter, he comes home to aid in the investigation, only to discover that there's more to the disappearance than his 'friends' are letting on.",1h 36min,Blind Eye
91,"5,4",['Julien Seri'],"['Cédric Jimenez', 'Julien Seri', 'Sylvie Verheyde']",Deception leads an ex-convict (Clovis Cornillac) to the violent world of underground fighting.,1h 38min,Scorpion
92,"6,8",['James Gray'],['James Gray'],El gerente de un club nocturno de Nueva York intenta salvar a su hermano y padre de unos mafiosos rusos.,1h 57min,La noche es nuestra
93,"6,2",['Philip G. Atwell'],"['Lee Anthony Smith', 'Gregory J. Bradley']","Un agente del FBI trata de vengarse de un misterioso asesino conocido como ""Rogue"" que acabó con la vida de su compañero.",1h 43min,El asesino (War)
94,"5,6",['Yukihiko Tsutsumi'],"['Akira Amasawa', 'Baku Yumemakura']","Brace yourself for a hilarious action-filled ride with The Sword of Alexander! Based on a serial story by Yumemakura Baku, The Sword of Alexander (a.k.a. Taitei no Ken) is a rollicking period fantasy adventure, complete with ninjas, warriors, magical weapons, and a couple of aliens. With a host of colorful characters, impressive CG visuals, and genres colliding left a... Leer todo",1h 50min,Taitei no ken
95,"3,6",['Jesse V. Johnson'],['Jesse V. Johnson'],Sin emoción. Sin miedo. Sin dolor. Eran los soldados perfectos para proteger a la humanidad.,1h 33min,The Last Sentinel
96,"5,7",['Nick Love'],['Nick Love'],A group of people who feel betrayed by their government and let down by their Police force form a modern-day outlaw posse in order to right what they see as the wrongs of society.,1h 43min,Fuera de control
97,"4,6","['Colin Strause', 'Greg Strause']",DESCONOCIDO,"La guerra entre Alíen y Predator llega a una pequeña ciudad de Colorado, y los residentes tendrán que unir fuerzas por una oportunidad de sobrevivir.",1h 34min,Aliens vs. Predator 2
98,"6,2",['Joyce Bernal'],DESCONOCIDO,"Due to the recommendation of his godfather who is a renowned secret agent, a bumbling reserved agent was tasked to retrieve an important artifact.",1h 33min,Agent X44
99,"6,7",['Joseph Cedar'],"['Joseph Cedar', 'Ron Leshem']",The story of a group of Israeli soldiers stationed in an outpost prior to the withdrawal of forces of 2000.,2h 11min,Beaufort
100,"6,2",['Robert Shaye'],DESCONOCIDO,"Two siblings begin to develop special talents after they find a mysterious box of toys. Soon the kids, their parents, and even their teacher are drawn into a strange new world and find a task ahead of them that is far more important than any of them could imagine!",1h 30min,"Mimzy, más allá de la imaginación"
101,"6,2","[""Shin'ichirô Sawai""]","['Takehiro Nakajima', 'Shoichi Maruyama', 'Seiichi Morimura']","Epic sweep and intimate details flow together to paint the story of Temujin, the man who became Genghis Khan.",2h 16min,Genghis Khan: To the Ends of the Earth and Sea
102,"5,7",['Juney Smith'],['Juney Smith'],A Jewish parole officer becomes a reading teacher for illiterate teens at a New York City high school and has a hard time motivating his students.,1h 39min,City Teacher
103,"4,8",['Michael Katleman'],"['John Brancato', 'Michael Ferris']","Se envía un equipo de noticias a Burundi para capturar y llevar a casa un legendario cocodrilo de 7,5 metros. Su difícil tarea se vuelve potencialmente mortal cuando un señor de la guerra los apunta a la muerte.",1h 33min,Cocodrilo (Un asesino en serie)
104,"3,3",['Karl Kozak'],"['Don J. Rearden', 'Karl Kozak', 'Kraig Wenman']","Budget cuts force two rival ambulance companies and their misfit medics to go head-to-head to save their patients, their jobs and their beer money, all in the name of emergency medicine.",1h 25min,Skid Marks
105,"5,4",['Erken Ialgashev'],"['Erken Ialgashev', 'Yermek Yutrsunov']",The son of a rich businessman who has ties with the Russian mob. But the mob sets up his family and forced the young guy at fighting in martial arts tournament.,1h 45min,Blizhniy Boy: The Ultimate Fighter
106,"6,4",['Akihiko Shiota'],"['Osamu Tezuka', 'Masa Nakamura', 'Akihiko Shiota']",A female warrior who was raised as a man joins a young samurai's quest to recover 48 of his body parts from 48 demons and to avenge her parents death.,2h 19min,Dororo
107,"4,0",['Andy Cheng'],"['Robert Foreman', 'Daniel Sadek']",A gorgeous young automobile fanatic--and front to the hottest unsigned band on the West coast--finds herself caught up in illegal drag-racing competitions organized by exotic car fanatics.,1h 42min,Redline: Competición mortal
108,"5,8",['Nathyn Masters'],['Nathyn Masters'],A deep cover agent is framed after a botched sting operation and the assassination of two undercover officers.,1h 35min,Wages of Sin
109,"5,4",['Mitchell Lichtenstein'],['Mitchell Lichtenstein'],Una estudiante de secundaria descubre que tiene una ventaja física cuando se convierte en objeto de violencia masculina.,1h 34min,Vagina dentata
110,"6,6",['Rolf de Heer'],['Rolf de Heer'],"A scientist & inventor in 1907, Dr Plonk, predicts that the world will end in 101 years, unless something is done about it. A comedy in the Charlie Chaplin / Buster Keaton tradition.",1h 25min,Dr. Plonk
111,"6,8",['Charlie Nguyen'],DESCONOCIDO,"France employs local secret agents in Vietnam 1922 to eliminate resistance. The rebel leader's pretty daughter gets captured. Later an agent seems to have fallen in love with her and helps her escape. He flees, too. Lots of martial arts.",1h 43min,Dòng máu anh hùng
112,"5,7",['Simon Fellows'],"['Dan Harris', 'James Portolese']","Stowe es un policía corrupto adicto a la heroína. Debido a un accidente, entra en coma, y vuelve en sí siendo una mejor persona. Se despierta con ganas de arreglar las cosas.",1h 47min,Desafío a la muerte
113,"5,1",['Mark Mahon'],['Mark Mahon'],A single father decides to break his dying wife's last wish to not box again in order to save his young son from certain death.,1h 35min,Strength and Honour
114,--,DESCONOCIDO,DESCONOCIDO,DESCONOCIDO,--,Error nombre para la pelicula con id: tt0790602
115,"4,8",['Tony Mitchell'],DESCONOCIDO,"Cuando una fuerte tormenta coincide con alta mar, desencadena una marea colosal, que viaja sin piedad por la costa este de Inglaterra hasta el estuario del Támesis. No se trata de si, sino de cuándo se va a inundar Londres.",1h 50min,Inundación
116,"4,3","['Jeff Crook', 'Josh Crook']","['Jeff Crook', 'Josh Crook']","A decorated war hero returns to the States after the brutal murder of his wife and child back home in Rockaway, Queens, and vows revenge against the network of neighborhood criminals responsible for their deaths.",1h 18min,Rockaway
117,"4,0",['Gerry Lively'],"['Ken Lamplugh', 'John Weidner']",A bodyguard must cope with hatred for his new client.,1h 30min,Body Armour
118,"3,6",['C.B. Harding'],"['Bear Aderhold', 'Tom Sullivan']","Confunden a tres patosos por reservistas del Ejército y los meten en un avión con destino a Irak, pero, por error, los dejan en alguna parte de México con un Humvee.",1h 30min,Delta Farce
119,"6,7",['James Wan'],"['Ian Mackenzie Jeffers', 'Brian Garfield']",Nick Hume decide tomarse la justicia por su cuenta en venganza tras el asesinato de su hijo en una gasolinera por una banda callejera.,1h 45min,Sentencia de muerte
120,"5,6",['Gérard Krawczyk'],['Luc Besson'],"Daniel, un conductor de un taxi muy especial en Marsella, lleva a tiempo a un famoso jugador de fútbol al estadio y luego ayuda a su torpe amiga de la policía, Émilien, a atrapar a un peligroso belga huido de su custodia.",1h 31min,Taxi 4
121,"2,4",['Jeffrey Lynn Ward'],['Jeffrey Lynn Ward'],"Trapped in an abandoned schoolhouse with an evil they helped create, but cannot defeat, the students are ill prepared for their last lesson...in terror!",2h,Hallows Point
122,"5,4",['Randy Bettelon'],DESCONOCIDO,"BOUND BY BLOOD follows the lives of three men, bound by family, who are split apart by tragedy. Trevor Thomas is the rebellious kickboxer and childhood friend of Johnny Choi. He is married to Johnny's sister, Lauren, and the two are expecting their first child. Johnny is an undercover narcotics officer who always follows the letter of the law, while his father, Master... Leer todo",1h 45min,Bound by Blood
123,"7,1",['Apoorva Lakhia'],"['Apoorva Lakhia', 'Suresh Nair', 'Raj Vasant']","Un relato del gángster Mahindra Dolas y su banda, que aterrorizó a la ciudad de Mumbai, y una guerra masiva entre la policía de Mumbai y las bandas durante el 16 de noviembre de 1991.",2h 2min,Shootout at Lokhandwala
124,"3,6",['Declan Mulvey'],"['Declan Mulvey', 'Christopher Curran', 'Joe Miale']","In the city where image is everything, the criminal underworld holds a fight tournament where legends are born, and the men who own them rule the streets.",1h 32min,TKO
125,"5,8","['David Nerlich', 'Andrew Traucki']","['Andrew Traucki', 'David Nerlich']",Una terrorífica historia de supervivencia en los manglares del norte de Australia.,1h 30min,Black Water
126,"6,6",['Micha Wald'],['Micha Wald'],"Four men living in Eastern Europe in 1856 get caught up in tales of thievery, murder and revenge.",1h 25min,Voleurs de chevaux
127,"5,9",['Jon Knautz'],DESCONOCIDO,A troubled young man still mourning the childhood loss of his family now has to deal with his professor being turned into a monster.,1h 25min,Jack Brooks: Cazador de Monstruos
128,"3,1",['Vikram Bhatt'],DESCONOCIDO,"A young man receives a phone call from a woman claiming to have been kidnapped. Meanwhile, the abductors use her as a hostage to force her MI5 husband into assassinating the Indian prime minister.",1h 42min,Speed
129,"4,9",['Claudio Fragasso'],['Rossella Drudi'],"After 11 years in prison, Mafia accountant Turi Arcangelo Leofonte can return to freedom.",1h 35min,Milano Palermo - Il ritorno
130,"5,0",['Adrian DeLude'],"['Wanda Coleman', 'David Sheldon']","After her master is killed, a rogue FBI agent goes under cover into a world of violence, motorcycles, and deceit to discover the truth behind her samurai master's death. Not only does she find answers to her questions, but also finds her self in the middle of a power struggle between the DA and the head of a crime family.",--,Lady Samurai
131,"7,1",['Antoine Fuqua'],"['Stephen Hunter', 'Jonathan Lemkin']","Un tirador que vive en el exilio vuelve a la acción tras enterarse de un complot para matar al presidente. Tras ser traicionado por el atentado y darse a la fuga, emprende la búsqueda del verdadero asesino y de la verdad.",2h 4min,Shooter: El tirador
132,"5,0",['Sam Um'],"['Todd Van Horne', 'Lauran Janes', 'Sam Um']","Ray, a young female master assassin with dark past, is hired by a mysterious aging hitman, Will. When she kills an innocent person by mistake and botches the job, she become the target of Will's deadly boss and the Korean government.",1h 30min,Fighting with Anger
133,"6,6",['Onur Ünlü'],['Onur Ünlü'],"Musa Rami, who has become a legend with his struggle against the mafia, is a police officer at homicide division. One day prior to celebrating his 63rd birthday, with a surprise party arranged by his family, he finds out that he has cancer and two months left before his death.",1h 53min,Polis
134,"5,8",['Brad Furman'],"['Jonas Pate', 'Josh Pate']","After he's shot during a heist in East L.A., an armored truck driver wrestles with rehabilitation and tracking down the man who committed the crime.",1h 36min,The Take
135,"4,3",['Tom Six'],['Tom Six'],"Two girlfriends let themselves be locked in a department store for the sake of a school paper, but they look quite differently at this exciting undertaking. One takes everything seriously. The other wants to turn the night into a party.",1h 15min,Honeyz
136,"6,3",['Tony Visintainer'],['Tony Visintainer'],"Isaac, a naïve and troubled young man, becomes stuck in a surreal dystopia where he is consumed by violence, revenge, and the consequences of the outside world.",--,Utopia
137,"6,6",['Peter Flinth'],"['Jan Guillou', 'Hans Gunnarsson']","Arn, hijo de un importante noble sueco, es educado en un monasterio y enviado a Tierra Santa como caballero templario para hacer penitencia por un amor prohibido.",2h 19min,Arn: El caballero templario
138,"6,2",['Puri Jagannadh'],DESCONOCIDO,"After thrashing a goon's son, a crime reporter escapes to Kulu Manali where he falls for a woman who soon gets kidnapped.",2h 28min,Desamuduru
139,"6,5",['Ricardo Sean Thompson'],['Ricardo Sean Thompson'],"Four stick up girls from Brooklyn decide to rob the illegal poker game of a notorious drug dealer, but unfortunately the operation goes fatally wrong.",1h 36min,Back Stab
140,"6,0",['Michael Kang'],"['Edmund Lee', 'Michael Kang']","When John Kim, an ambitious young lawyer, takes on a pro bono case to exonerate a fourteen-year-old boy from a first degree murder charge, he finds a world he never knew existed in the underbelly of Manhattan - the Korean underworld.",1h 26min,West 32nd
141,"7,5",['Indra Kumar'],DESCONOCIDO,"Four lazy slacker conmen buddies who are jobless, homeless and broke learn about the secret of a hidden treasure from a dying thief and later embark on a race against time to find the mobster's buried treasure and claim it while being pursued by a determined police inspector who is hellbent to get the treasure all by himself.",2h 16min,Dhamaal
142,"6,6",['Vishram Sawant'],['Atul Taishete'],"Modern day Bombay is ruled by Bangkok-based underworld don, Khalid Bin Jamal, who has the Home Minister, A.R. Sarang, as well as the Police Commissioner on his payroll. Khalid would like to get rid of a number of thorns on his side, namely S.P. Naidu, a former aide; A.R. Sarang, who has been flip-flopping; and Bombay Police's Encounter Specialist Suryakanth Satham. He... Leer todo",2h 35min,Risk
143,"6,9",['Mustafa Sevki Dogan'],DESCONOCIDO,"Story about an ottoman WWI veteran, who resistances against the occupiers.",2h 6min,Son Osmanli Yandim Ali
144,"7,0",['Garth Jennings'],['Garth Jennings'],"During a long English summer in the early 1980s, two schoolboys from differing backgrounds set out to make a film inspired by Acorralado (1982).",1h 36min,El hijo de Rambow
145,"6,1",['Stanislaw Mucha'],DESCONOCIDO,"Young Franciszek witnesses a church painting theft and films it. He is not going to reveal the perpetrator to the police, however, but to blackmail him.",1h 41min,Nadzieja
146,"4,7",['Johnny Kalangis'],"['Kevin Hennelly', 'Johnny Kalangis', 'Christopher Warre Smets']",A comedy-horror-thriller in which a doctor and his teenage daughter are terrorized by flesh-eating zombies at a truck stop.,1h 23min,Mis apetitosos vecinos
147,"6,6",['Stuart Townsend'],['Stuart Townsend'],"Los activistas llegan en masa a Seattle, Washington para protestar contra una reunión de la Organización Mundial del Comercio. Se producen disturbios y caos mientras los manifestantes logran detener las reuniones de la OMC.",1h 39min,Batalla en Seattle
148,"6,1",['Pavel Sanaev'],['Pavel Sanaev'],"A young music video director, a ballet dancer and a dolce vita seeker - they come to Moscow to conquer the city, but each of them goes their own way. Sooner or later the three of them realize: to get what you are striving for you might risk many things, but friendship and love.",1h 27min,Nulevoy kilometr
149,"7,9",['Jeff Jensen'],['Jeff Jensen'],"Lance King is the newest arrival to the MotoGP Championship racing series. His team is owned by a racing legend but is struggling to remain competitive against the deep-pocketed manufacturer teams. They search for money from new sponsors to no avail until someone approaches them and buys the team. The new team owner, Anna Zykov, is an intelligent and well prepared bea... Leer todo",--,Velocity
150,"3,3",['C. Roma'],"['Ari Graham', 'Brook Durham', 'Kevin Moore']",Two aliens who crash on Earth must find a buried weapon that will destroy the planet and their own society if not stopped.,1h 36min,Alien vs. Alien
151,"4,6",['Johnny Araújo'],['Chorão'],"In São Paulo, the upper middle class punk-singer Andre a.k.a. Magnata spends his time in the periphery with his friends from the lower class, singing in clubs and wasting his inheritance. When he is challenged by his friends to steal a Ferrari from a store, he accepts the challenge and he goes with his pal Chivitz. They rob the car and after driving for fun, Magnata g... Leer todo",1h 37min,O Magnata
152,"4,1","['Shimon Dotan', 'Dolph Lundgren']","['Leopold St-Pierre', 'Frank Valdez']","A mercenary is hired to protect an expedition group while they search for a Tangka, a Buddhist artifact worth millions of dollars.",1h 34min,Deudas de sangre
153,"6,5",['Aristomenis Tsirbas'],"['Evan Spiliotopoulos', 'Aristomenis Tsirbas']","Un pacífico planeta alienígena se enfrenta a la aniquilación, ya que el resto de la raza humana sin hogar pone sus ojos en Terra. Mala, una adolescente terriana rebelde, hará todo lo posible para impedirlo.",1h 25min,Objetivo Terrum
154,"5,5",['Shane Abbess'],DESCONOCIDO,"Gabriel el arcángel lucha para devolver la luz al purgatorio, un lugar donde reina la oscuridad, y salvar las almas de los habitantes de la ciudad.",1h 54min,Gabriel
155,"2,4",['J.A. Steel'],['J.A. Steel'],"The centuries old battle between the powers of heaven and the forces of hell have collided in a final modern day showdown. The determining factor my lie in the heart of a little girl, murdered at 8 she has arisen to avenge those that have wronged her, but will find that the truth is not always as it seems. Will she risk damning her own soul to purgatory forever to do ... Leer todo",1h 26min,Salvation
156,"6,6",['Joe Menendez'],['JoJo Henrickson'],"Un par de ladrones profesionales ven que su plan de robar a un millonario es demasiado complicado, ya que su equipo no quiere ser parte de este trabajo de alto riesgo, entonces deciden contratar a un grupo de aficionados.",1h 38min,Ladrón que roba a ladrón
157,"4,7",['Suresh'],['Suresh'],"Sabari deals with the problems of doctors, who fights the evils in the society.",--,Sabari
158,"8,0",['José Padilha'],DESCONOCIDO,"En 1997, el capitán Nascimento tiene que encontrarse un sustituto, al tiempo que intenta limpiar las calles de Río de narcos y criminales antes de la llegada del Papa.",1h 55min,Tropa de élite
159,"4,0","['Gilles Paquet-Brenner', 'Cyril Sebas']",DESCONOCIDO,"Two crooked lawmen (Stomy Bugsy, Titoff) search for a precious stone to collect an inheritance.",1h 36min,Gomez vs. Tavarès
160,"4,2",['Sandro Cecca'],"['Luca Biglione', 'Giovanna Caico']",A female hired killer arrives in China to complete a job. She ends up befriending her prostitute neighbor who she also ends up getting hire to kill. The mob and police end up chasing both of them as the action unfolds.,1h 30min,Two Tigers
161,"4,6",['Joshiy'],"['Rajesh Jayaraman', 'S.N. Swamy']",An orphan grows up in Veerakudi village under a taxi driver who names him Rayyar. He grows up to avenge the death of his parents who were mistaken to be naxalites and were murdered brutally.,2h 15min,Janmam
162,"4,2",['Chee Keong Cheung'],"['Chee Keong Cheung', 'Oliver Morran']","In the UK suburbs, an underground tournament is set to challenge twelve fighters from different backgrounds to compete for the price of £500,000. They have been handpicked for a no-holds barred competition that will push each fighter to their limit. Each fighter has their own reason for competing, and each will give everything they've got to take the prize...but there... Leer todo",1h 35min,Underground
163,"3,4",['Anubhav Sinha'],DESCONOCIDO,Three unique diamonds. Two teams of thieves. One big heist that spins out into a battle for the ultimate eternal prize: Cash.,2h 17min,Cash
164,"5,8",['Vladimir Shchegolkov'],DESCONOCIDO,,1h 45min,Odna lyubov na million
165,"7,3",['Xiaogang Feng'],"['Heng Liu', 'Jingyuan Yang']",Un soldado lucha por que se reconozca a los compañeros caídos durante la guerra civil China.,2h 4min,Héroes de guerra
166,"5,9",['Osman Sinav'],"['Osman Sinav', 'Aybars Bora Kahyaoglu']","A story describing Turkish narcotic police team named ""Pars"" who are trailing the traffic through Afghanistan, Turkey, Europe and USA.",2h 25min,Pars: Kiraz Operasyonu
167,--,DESCONOCIDO,DESCONOCIDO,DESCONOCIDO,--,Error nombre para la pelicula con id: tt0886505
168,"4,5",['V.V. Vinayak'],"['Rajendra Kumar', 'Prem', 'V.V. Vinayak']",A mother from a small village searches for her son in Hyderabad; unaware that he has changed his name and is now both a target and a threat for all the gangsters of the city.,2h 35min,Yogi
169,"5,2",['Lasse Spang Olsen'],"['Nikolaj Peyk', 'Lasse Spang Olsen', 'Henning Bahs']","When Maria's father sends her a priceless painting he's stolen, she must decide whether to collect the reward or protect the father who walked out on her.",1h 28min,Den sorte Madonna
170,"5,5",['Alexi Tan'],DESCONOCIDO,"Set in Shanghai during the 1930s, the story is inspired by John Woo's classic work Bullet in the Head, released in 1990.",1h 35min,Tian tang kou
171,"4,2",['Johny Antony'],"['Udaykrishnan', 'Siby K. Thomas']",A corrupt police officer takes bribes to make up the amount that he paid to get the job.,--,Inspector Garud
172,"5,5",['Vamshi Paidipally'],DESCONOCIDO,"Munna is a college student who targets Khakha, a local gangster with whom he has a personal vendetta since childhood.",2h 47min,Munna
173,"4,3",['Ahmad Samir Farag'],['Nader Salah El Din'],"Sharif is a private security guard performing his duty to guard an Egyptian girl, this girl faced by many problems because of this guardianship to be saved from death,when she attacked by a terrorist group.",1h 30min,Code 36
174,"6,7",['Nai-Hoi Yau'],"['Nai-Hoi Yau', 'Kin-Yee Au']","With the nickname Peggy, a new recruit is mentored by Dog-Head, while undergoing on-job training while tracking down a gang of well organized armed heist robbers. The police use the surveillance cameras trying to track their identities.",1h 30min,Gun chung
175,"6,8",['Julian Gilbey'],"['Julian Gilbey', 'Will Gilbey']",The life of career criminal Carlton Leach.,1h 59min,Rise of the Footsoldier
176,"5,9",['Michael Kastenbaum'],"['Jesse Lawler', 'Saundra McKenna', 'Stephen Polk']",Corbin Bernsen starts in this children's adventure where only the pure of heart will be able to find the key to breaking the curse that holds real pirates captive.,1h 31min,Pirate Camp
177,"5,8",['Yoshimitsu Morita'],DESCONOCIDO,"A scruffy, masterless samurai decides to help a group of young warriors whose leader was taken captive by a gang of ambitious officers.",1h 59min,Tsubaki Sanjûrô
178,"3,2",['Igor Breakenback'],['Igor Breakenback'],"Breakenbacks wife is kidnapped at the airport. Kidnappers request he collects a few items to trade for his wife. Breakenback is out of luck, the items are in the hands of cool assassins, crazy stuntman, wild dancers... and a chiropractor! For some reason there is a bunch of Ninjas on his back too... Well, good luck with that!",1h 34min,Good Luck with That
179,"5,0",['Yoshinori Kobayashi'],DESCONOCIDO,She was the best crime fighter on the force...until a powerful conspiracy turned everyone against her.,1h 52min,Anfea: The Movie
180,"6,1",['Takashi Miike'],"['Takashi Miike', 'Masa Nakamura']","A nameless gunfighter arrives in a town ripped apart by rival gangs and, though courted by both to join, chooses his own path.",2h 1min,Sukiyaki Western Django
181,"3,3",['Terence H. Winkless'],"['Raly Radouloff', 'Terence H. Winkless']","The future. The corrupt regime broadcasts the illusion of a beautiful city to the chip in your head, when in fact the city is in ruins. The rebels know the truth and seek to foment revolution.",1h 30min,Nightmare City 2035
182,"5,7",['Tommy Wirkola'],"['Stig Frode Henriksen', 'Tommy Wirkola']","Cuando un simpático campesino ve cómo su prometida, sus amigos y su familia son asesinados a tiros en su fiesta de compromiso, está decidido a vengarse, tan pronto como despierte del coma.",1h 33min,Kill Buljo: The Movie
183,"4,2",['Chris Hanaford'],['Chris Hanaford'],"A street-hardened bank robber just released from prison sets out to reunite with his father and rob The Bank of Hollywood. Enlisting the aide of a femme fatale and an out-of-work Elvis impersonator as accomplices, they promise the easiest pay-off of their miserable lives Five hundred large for five minutes work"".",1h 10min,The Caper
184,"7,0","['Peter Ho-Sun Chan', 'Wai-Man Yip']",DESCONOCIDO,"China, década de 1860: tras la masacre de su ejército, el general Qingyun se une a 2 líderes de bandidos en contra los rebeldes. Forman un ejército leal a Qing con los ojos puestos en los rebeldes de Suzhou y Nanjing.",2h 6min,The warlords: Los señores de la guerra
185,"7,3",['Vishnuvardhan'],DESCONOCIDO,"Un policía persigue al gángster internacional Billa y resulta ser el único que lo ve morir. Coloca a Velu, un doble de Billa, dentro de la pandilla para obtener información. Pero incriminan a Velu del asesinato del policía.",2h 10min,Billa
186,"3,2",['Albert Pyun'],['Chad Leslie'],A desperate criminal and a merciless posse become trapped in a remote Mexican ghost town by a vengeful demon.,1h 24min,El maldito oeste
187,"7,6",['Gary Carbo'],['Gary Carbo'],"""Fear Ever After"" presents an unofficial reenactment of events surrounding the disappearance of the entire production crew of SPANK ME PRODUCTIONS. Jessie Valencia, a young and beautiful student filmmaker, answers an ad to work on a feature film and has no idea that it's an adult film... another by the infamous SMP. She learns more than she ever bargained for with tha... Leer todo",2h,Fear Ever After
