188,"6,8",['Sukumar'],['Sukumar'],A young man is drawn to violence but finds out that it's easier to get into violent situations than out of them.,2h 43min,Jagadam
189,"2,0",['P. Vasu'],DESCONOCIDO,A common man and his Handicap Sister struggles in the modern world. How they are gonna fight them back is all story about.,2h 29min,Maharadhi
190,"7,2",['S.S. Rajamouli'],DESCONOCIDO,"A lovable scoundrel's life is cut short when he angers the god of death; however, he still has a few tricks up his sleeve.",3h 5min,Yamadonga
191,"7,5",DESCONOCIDO,DESCONOCIDO,El destino del mundo se ve amenazado por las monstruosas criaturas conocidas como Angels. NERV es la organización designada para contrarrestar esta amenaza.,1h 38min,Evangelion 1.01 You are (not) Alone
192,"6,9",['Anwar Rasheed'],"['Benny P. Nayarambalam', 'Anwar Rasheed']","The daily lives of Vasco Da Gama and his friends in a fraction of Cochin, called Chota Mumbai is portrayed in this comedy.",--,Chota Mumbai
193,"7,4",['Chandra Sekhar Yeleti'],"['Koratala Siva', 'Chandra Sekhar Yeleti']",An ailing gangster with a rare blood group targets a man with the similar blood group to get his heart for a vital transplant.,1h 59min,Okkadunnadu
194,"6,7",['Shafi'],"['Raffi', 'Meccartin']","Mahi is nicknamed Mayavi for his ability to beat up baddies stealthily without revealing his identity. He often ends up in jail. While serving time he develops a friendship with Balan, another convict. Balan's brother is seriously ill in hospital and is in need of an expensive operation. Meanwhile Mahi is picked as the lone lucky prisoner to be pardoned and released o... Leer todo",2h 4min,Mayavi
195,--,DESCONOCIDO,DESCONOCIDO,DESCONOCIDO,--,Error nombre para la pelicula con id: tt0925306
196,"5,3",['M. dot Strange'],['M. dot Strange'],Two outcasts fight for survival in a sinister fantasy world. Their lives are constantly in jeopardy after they're caught in the middle of a deadly battle between bizarre monsters on their way to the ice cream shop.,1h 28min,We Are the Strange
197,"5,5",['Erik Novák'],['Viktor Nagy'],"NOSEDIVE depicts a world of unlimited drugs, wild parties, beautiful people, and no sleep. However, when reality takes a dark turn, a group of characters are forced to step out of the nightclub and into darkness.",1h 30min,Zuhanórepülés
198,--,DESCONOCIDO,DESCONOCIDO,DESCONOCIDO,--,Error nombre para la pelicula con id: tt0926110
199,"6,8",['Omid Shabkhiz'],"['Peter Banifaz', 'Omid Shabkhiz']",Charlie Vespa is the worlds most Skilled assassin and wants revenge for the death of his family.,1h 12min,Banished
200,"7,2",['Dejan Zecevic'],"['Boban Jevtic', 'Dejan Zecevic']",A man awakens from a two-month-long coma with total amnesia and sets out to discover the truth about his identity.,1h 47min,Cetvrti covek
201,"6,1",['Dominique Deruddere'],"['Dominique Deruddere', 'Frank Van Laecke']",A retired boxing champion takes a young apprentice from an immigrant family under his wing,1h 37min,Firmin
202,"5,2",['To-Hoi Kong'],DESCONOCIDO,"When a precious Tibetan bead is stolen by rogue members of the mysterious Gemini Clan, the protectors of the bead enlist the help of some righteous former Gemini Clan members to retrieve the bead and bring the evil disciples to justice.",1h 39min,Seung ji san tau
203,"2,0",['Scott Harper'],"['Steve Bevilacqua', 'David Michael Latt']","A team of soldiers must stop a giant, bloodthirsty crocodile from reaching a nearby city, while trying to avoid being a meal for the beast themselves.",1h 25min,Supercroc
204,"5,6",['Joe Otting'],"['Joe Chappelle', 'Robert Archer Lynn', 'David Alford']","El hijo de Thomas Archer es asesinado por un demente que entró inesperadamente en su hogar. Su mujer está tan afectada que su matrimonio se hunde, y la policía no parece hacer progresos en la búsqueda del asesino.",1h 33min,Camino de la venganza
205,"5,2",['Kazuyoshi Kumakiri'],"['Jirô Matsumoto', 'Takashi Ujita']",,1h 43min,Furîjia
206,"6,5",['Sreenu Vaitla'],DESCONOCIDO,"Seenu - Ravi Teja, is fondly called as Dubai Seenu. His sole aim in life is to fly to Dubai and earn tonnes of money. In the process, he gets hold of a broker and gets duped by him in Mumbai.",2h 37min,Dubai Seenu
207,"6,9","['Michel Gut', 'Alexander Hübner']",DESCONOCIDO,,1h 20min,Drop Out
208,"7,0",['Robert Archer Lynn'],"['David Alford', 'Robert Archer Lynn']","A man discovers the vehicle's GPS is being controlled by an unknown agency. Forced into a series of tasks that become increasingly dangerous, he must find out what his antagonists want, find a way to save his daughter, and stay alive.",1h 30min,Adrenaline
209,"1,5","['Taner Akvardar', 'Mustafa Altioklar']",['Emine Altioklar'],"There are soldiers who want to be a commander. But these soldiers always hanging around. Commanders want to bring to hell them. But these soldiers always makes jokes and they palters. Meanwhile, one of soldiers deal with him lover.",1h 40min,Emret Komutanim: Sah Mat
210,"5,5",['Surender Reddy'],DESCONOCIDO,Athidi(Mahesh Babu) is falsely convicted for killing his adopted parents and goes to jail for 13 years and when he comes back he loves Amrita (Amrita Rao) unaware that she is the daughter of his adopted parents.,2h 52min,Athidhi
211,"6,2",['Gautham Vasudev Menon'],"['James Siegel', 'Gautham Vasudev Menon', 'Meghana Karthik']","After starting an affair with a married woman, a married man's life starts changing for the worse in more ways than he could imagine.",2h 27min,Pachaikili Muthucharam
212,"3,8",['Egor Konchalovskiy'],['Yuriy Perov'],A journalist who possesses information on uranium sales is set up by his enemies and sent to prison.,1h 52min,Konservy
213,"5,1",['Bharathan'],"['Bharathan', 'Mohan Nair']","Guru is an MBA student who is diagnosed with ESP. Since all his visions come true, he runs away to Mumbai when he sees himself stabbing his girlfriend. Unfortunately, he has a lookalike who's a crook.",2h 51min,Azhagiya Tamilmagan
214,"8,6",['Jesse Cowell'],['Jesse Cowell'],The story of a little girl pushed to the utter edge of sanity and the animated demons that are unleashed by her pure rage and fury.,1h 30min,Drawn by Pain
215,"7,1","['Johnnie To', 'Ka-Fai Wai']","['Ka-Fai Wai', 'Kin-Yee Au']",A rookie cop teams up with a former detective with a supernatural gift to hunt down a serial killer.,1h 29min,Mad detective
216,"6,8",['Fumihiko Sori'],"['Fumihiko Sori', 'Haruka Handa']","Japan, 2077: A female agent named Vexille is dispatched to Tokyo to investigate whether Japanese are developing robotic technology, which has been banned by the U.N. due to its potential threat to humankind.",1h 49min,Vexille
217,"7,5",['Ray Garcia De Leon'],"['Ray Garcia De Leon', 'Bob Dolan']","Thrust into working with new escort Gwen Miller, tortured driver John Dorian forms a partnership with her anchored by a set of unmovable, self-defined 'rules'. But through their dealings, Gwen's empathy and naïveté gradually soften John, sending his fragile world into a tailspin of violent and devastating consequences.",1h 34min,The Governor
218,"5,4",['Chris Stapp'],"['Matt Heath', 'Chris Stapp']","Young Randy has dreamed of being a stuntman, teaming up with misfit stunt-team the Timaru Hellriders, is employed by mentor-turned Dick Johansonson, and meets the one-legged cunning stunt babe Tracy ""Tragedy"" Jones.",1h 15min,The Devil Dared Me To
219,"7,0",['Jeethu Joseph'],['Jeethu Joseph'],"A detective investigates the death of the wife of an emerging politician. The death was first ruled as suicide, but he realizes this is not a suicide but a well planned murder in cold blood.",--,Detective
220,"7,7",['Amal Neerad'],['Amal Neerad'],"Four brothers hunt for the killer and the truth behind their loving foster mother who was murdered in cold blood, .",2h 10min,Big B
221,"3,5",['Dan Shelby'],"['Dan Shelby', 'Mack Storm']","Young basketball star Dan Milano has all the makings of a pro player -- talent, skill and determination. But as he sets out to make his dream come true, Dan learns that in the world of professional basketball, talent only gets you so far. Based on a true story, this telling drama exposes the politics and corruption that run rampant in organized sports.",1h 15min,Faded Dreams
222,"4,4",['Teja'],['Teja'],,--,Lakshmi Kalyanam
223,"7,2",['Chatrichalerm Yukol'],DESCONOCIDO,"Prince Naresuan is now the crown prince of Ayutthaya and the king of Burma is dead. While the new Burmese king is waging war, the crown prince plots to assassinate Naresuan. Hearing this, the prince decides to evacuate Thais out of the Burmese capital and declare that Siam will no longer bow to Burma. The war for the kingdom's independence begins.",2h 45min,Tamnaan somdet phra Naresuan maharat: Phaak prakaat itsaraphaap
224,"6,9",['Paco Limón'],DESCONOCIDO,"Doc Hell, famous gynecologist, wants to control the entire world. His plan: to heal the humanity using a miraculous medicine, in exchange for its complete submission. But his goals will be compromised when an unexpected detail, García Nurse, seeks revenge. The killer sent to her annihilation has failed. Nurse, murderer, one neighbor's boyfriend, the building manager, ... Leer todo",1h 24min,Doctor Infierno
225,"4,5",['Balasekaran'],['Balasekaran'],"Deepika (Bhavana) is an arrogant rich girl. A medical college student, she dictates terms at the college. Sister of local don Kasi (Prakash Raj), she is feared by students, professors and even the Dean of the College. Enter Aarya (Madhavan), a final year student who comes to Chennai Medical College from Coimbatore. A soft-spoken Aarya runs into Deepika. They develop c... Leer todo",2h 37min,Aarya
226,"6,8","['Gayatri', 'Pushkar']","['Gayatri', 'Pushkar']",Chandru is an expert auto rickshaw driver and racer while his friend Bigilu is an expert mechanic. Chandru's life begins to unravel after he loses a race due to a distraction.,2h,Oram Po
227,--,DESCONOCIDO,DESCONOCIDO,Fast paced action thriller starring rising Bollywood star Ashish Choudhary.,1h 30min,Ilzaam
228,"6,5",['Timothy Norman'],['Timothy Norman'],A blood-soaked chronicle of the final desperate gang war between Boston's Irish and Italian mobs.,1h 35min,Beantown
229,--,DESCONOCIDO,['Magaly Rodriguez'],,--,Golpe a Golpe
230,"5,3","['Jaroslaw Sypniewski', 'Jacek Filipiak', 'Michal Gazda']","['Artur Kowalewski', 'Piotr Pytlakowski', 'Wojciech Tomczyk']","An investigate crime reporter meets at a hotel for a taped interview with a big time gangster who has turned state's witness and says that he's started a new, legitimate life. What the gangster doesn't know is that a bomb that he planted to kill a fellow gangster accidentally killed the reporter's pregnant wife years ago, and the reporter isn't about to reveal this to... Leer todo",1h 37min,Swiadek koronny
231,"6,1",['Seong-gyun Park'],['Seong-gyun Park'],"Three martial art master with the same surname, Kim. Compete with each other to win the beautiful girl heart, Yeon Sil.",1h 37min,Kim-gwanjang dae Kim-gwanjang dae Kim-gwanjang
232,"8,2",['Amrit Sagar'],['Piyush Mishra'],"Based on true facts, the film revolves around 6 brave soldiers who escape from the clutches of the Pakistan Army and risk death with honour and courage with sacrifice towards their journey home.",2h 16min,1971
233,"7,0",['Michael Ryan'],['Michael Ryan'],"""A lost and estranged ex-military sniper turned mercenary for an unscrupulous company finds solace, hope, and possibility in choosing to protect a deaf child during a mission to assassinate her, making him a rogue agent determined to find safety for his new counterpart, while delivering a very important invention for a friend indebted to him for protecting his family ... Leer todo",--,The Silencer & the Sky
234,"6,7",['Hajime Kamegaki'],"['Masashi Kishimoto', 'Junki Takegami']","A powerful spirit that once threatened to destroy the world is back! Naruto's mission is to protect a priestess named Shion, who is the only one with the power to seal away the monster.",1h 34min,Gekijô-ban Naruto shippûden
235,"5,4",['Phetthai Vongkumlao'],['Phetthai Vongkumlao'],"The best agent of Vieng, the country near the boundary of Thailand received the important mission that he had to catch two armed dealers who could be the dangerous for his country.",1h 35min,The Bodyguard 2
236,"6,0",['Takashi Miike'],"['Masashi Sogo', 'Seiji Togawa']","Cult Japanese director Takashi Miike draws inspiration from the popular Playstation 2 title Yakuza for this unhinged tale of underworld violence in Tokyo starring Goro Kishitani and Kazuki Kitamura. It's summertime in Tokyo, and as the temperature rises, two undercover cops stake out a high-profile bank robbery while complaining about the air conditioning. When the ma... Leer todo",1h 50min,Ryû ga gotoku: Gekijô-ban
237,"3,8",['Lisa Comrie'],DESCONOCIDO,A 17-year-old girl has mysterious encounters with paranormal activity in the small town of Pine Valley.,1h 21min,Sarah Landon and the Paranormal Hour
238,"6,7",['Wilson Yip'],"['Kam-Yuen Szeto', 'Lik-Kei Tang']","A hot-headed inspector takes on a small but powerful Vietnamese-Chinese gang, after a series of crimes and murder attempts committed and putting an undercover cop and his girlfriend in great danger.",1h 28min,Flash Point
239,"6,5",['Natasha Arthy'],"['Natasha Arthy', 'Nikolaj Arcel', 'Rasmus Heisterberg']","Aicha practica Kung Fu en su escuela secundaria en Copenhague. Su padre turco, musulmán, quiere que se convierta en médico, pero en su lugar comienza a entrenar en un club de Kung Fu donde Emil la ayuda con su entrenamiento.",1h 40min,Fighter
240,"6,7",['Benny Chan'],DESCONOCIDO,"Three cops team up to bring down a criminal gang of seven, who have their own hidden agenda.",2h 9min,Invisible Target
241,"3,3",['Vinayan'],"['Vinayan', 'Sunil K. Anand']",An orphan boy enters a chemistry laboratory and drinks a chemical which made him invisible for a limited time. The plot forms when he takes revenge on those people who harassed him and his friends of the orphanage by becoming invisible.,2h 15min,Athisayan
242,"4,5",['Izuru Narushima'],"['Yasuo Hasegawa', 'Kenzaburô Iida', 'Tetsuo Takashima']","As the Americans run Japan they also reserve the right to fly aeroplanes with nuclear weapons on board over the skies of the country. The Japanese mountains are often referred to as the Alps and it is here that a secretive US military aircraft with weapons of mass destruction crashes. The race is on for a group of journalists to climb the mountains and reach it. Yet, ... Leer todo",2h 12min,Middonaito îguru
243,"6,9",['Gabriel Dowrick'],DESCONOCIDO,"A revolutionary procedure performed in the jungles of Guatemala gives rise to an unspeakable horror when one doctor discovers how to implement mind control. By injecting a deadly cocktail straight into the brains of the world's unwanted, a new slave race is created - available for sweat shops, sex farms and private mercenary armies. One huge corporation is slowly buil... Leer todo",1h 25min,Nailed
244,"3,8",['Vinayan'],['Vinayan'],A police inspector gets beaten by the goons and loses his sanity and is taken care of by the village headman's daughter. But the inspector's girlfriend arrives from another village to take him back.,1h,Black Cat
245,"4,7",['Lee Demarbre'],['Ian Driscoll'],A Mexican wrestler entangled with the mob seeks revenge after a group of Mexican migrants are massacred in a human smuggling ring.,1h 30min,The Dead Sleep Easy
246,"6,8",['Shawn Flanagan'],"['Shawn Flanagan', 'Anthony Santucci']","A hitman specialized in executing cheating spouses contemplates redemption after falling for a single mother. When the killer blows off a very important hit, his partner in crime sets out to finish the job.",1h 38min,The Unwilling
247,"4,3",['Shaji Kailas'],['Rajesh Jayaraman'],Appan menon is on his way to investigation. Susan who knew appan menon try to locate his more information which forms a twist,2h 5min,Time
248,"6,2",['Hitoshi Matsumoto'],"['Hitoshi Matsumoto', 'Mitsuyoshi Takasu']",An eccentric man living alone in a decrepit house in Tokyo periodically transforms into a 100-foot tall giant in order to defend Japan against similarly sized monsters.,1h 53min,Big Man Japan
249,--,"['Manohar', 'Ashok Raj', 'G. Ramesh']",DESCONOCIDO,"Vishwa, head of a local mob in JJ Colony does illegal activities to favor contractor Natesan Gounder. Accidentally, he gets trapped into RDX smuggling. To find the actual criminal, Arunthathi IPS is assigned to this case. When she comes to know about his past, her true relationship with him is revealed. Will Vishwa be out of this mist and reunited with his family is t... Leer todo",--,JJ Colony
250,"6,3","['Shawn Cain', 'Rick Diaz']","['Shawn Cain', 'Rick Diaz']","A thriller about a detective who needs money to save his dying daughter. He finds himself in the position of taking money from the bad guys in order to save his little girls life, but this comes at a huge cost.",1h 47min,Kiss from the Grave
251,"5,8",['Taikan Suga'],['Norio Kida'],"Hayato Akaboshi quits racing cars and settles in a village when he accidentally kills another driver. He works at a garage and turns its fortunes around, making the owner of another garage jealous.",--,Supîdomasutâ
252,"7,0",['Takashi Miike'],"['Hiroshi Takahashi', 'Shôgo Mutô']","Genji, hijo del jefe de un clan mafioso, decide demostrar a su padre que él es capaz de ponerse al cargo del negocio familiar. Intentará convertirse en el señor del peor y más peligroso instituto estudiantil de todo el país.",2h 10min,Crows Zero
253,"6,0",['Thesingu Rajendar'],['Thesingu Rajendar'],"Veerasamy (T. Rajendar) is a lawyer party leader and Member of the Legislative Assembly (MLA) in Chennai. His party has 13 MLAs and is in support to the sitting government (126/234). He tries to do good things to people. His sister falls in love with a pimp's brother, and a neighbor Sarasu (Mumtaj) falls in love with Veerasamy. Veerasamy then has to handle family conf... Leer todo",--,Veerasamy
254,"7,4",['Mohit Suri'],['Shagufta Rafique'],"A loyal henchman is ordered by his boss to keep an eye on his mistress, and trouble begins when he refuses to kill her.",2h 6min,Awarapan
255,"6,1",['Kittikorn Liasirikun'],['Kittikorn Liasirikun'],,1h 30min,May narok muay yok law
256,"5,3",['Ole Martin Hafsmo'],['Peder Fuglerud'],"Mikkel (15) lives a good life with his mother in Oslo. Here he has heaps of friends and spends most of his day on a skateboard. When his mum gets a new job, Mikkel has to move to a small village and start all over. In this village skateboard no longer matters and snowboard is the new big thing. To be accepted by the new kids, Mikkel has to go into training. On top of ... Leer todo",1h 30min,Switch
257,"3,9",['Le Bao Trung'],['Le Bao Trung'],,1h 28min,Võ Lâm Truyên Ky
258,"7,9",['Dale Jackson'],['Jeff Jones'],"Daniel Neal and his Older brother josh grew up together on a farm in Northern Virginia. Daniel the hard working salt of the earth type and Josh the smart bookish one. After their father dies Josh leaves the family when he's 17 to go north and get an education. The family never hears from him again, until one day many years later on a battlefield in northern Virginia, ... Leer todo",48min,Sons of Virginia
259,"1,6",['Griff Furst'],"['Geoff Meed', 'David Michael Latt']","The U.S. government initiates a program to create genetically-modified cybernetic super soldiers, but it goes awry when the test subjects escape from their holding cells. Set on an island in an undisclosed location.",1h 25min,Universal Soldiers
260,"5,5",['Takuji Kitamura'],"['Tatsuhiko Takimoto', 'Hirotoshi Kobayashi']","Yosuke, a typical slacker kid dozing his way through school, showing nothing in the way of ambition as he quietly mulls over the death of a close friend the year before. He is clever enough and full of smart comments but just doesn't seem to see the point of much in life. That changes when he meets Eri by chance, late one night. She is a beautiful young girl, herself ... Leer todo",1h 49min,Negatibu happî chênsô ejji
261,"6,7",['Farah Khan'],DESCONOCIDO,"Om, un joven artista de cine, se enamora de Shantipriya, una reconocida actriz, pero muere mientras intenta salvarla de un accidente de incendio. Treinta años después, renace y se propone vengar su muerte.",2h 42min,Om Shanti Om
262,"6,1",['Mark A. Reyes'],DESCONOCIDO,"Against the advice of a concerned mythology professor, a group of school friends--Shiela, Rina, Christian, Kerwin, and their friends--decides to take an out-of-town trip during Holy Week. They start out believing they've made a good decision; everyone is happy and excited about their upcoming adventure. But the mood soon starts to change. week. Shiela begins having dr... Leer todo",1h 33min,Tiyanaks
263,"7,0",['Quentin Tarantino'],['Quentin Tarantino'],Dos grupos distintos de voluptuosas mujeres son acechados en diferentes momentos por un doble de acción lleno de cicatrices que utiliza sus coches a prueba de muerte para ejecutar sus planes asesinos.,2h 7min,Death Proof
264,"5,7",['K. Madhu'],['A.K. Sajan'],Railway Anti-Criminal Task Force (RATs) investigates three unrelated murders happened in a train.,--,Nadiya Kollappetta Rathri
265,"4,6",['Joshiy'],['Ranjith'],"David and Sara's marriage gets canceled due to an unexpected tragic event. Years later, they continue to love each other and strive to protect an innocent girl from an ambitious politician.",2h 29min,Nasrani
266,"5,4",['Soi Cheang'],DESCONOCIDO,"After serving time for the murder of his parents, a fighter with a taste for violence enters the world of kickboxing.",1h 45min,Gwan gai
267,"6,7",['Sameer Puri'],['Sameer Puri'],"An unusual tale of two brothers whose lives change dramatically following an encounter with a woman named Jennifer. Acting as catalysts, subsequent events unwittingly change each brother's destiny in irreparable ways. Set in one day on the streets of India's capital, what follows is a hard-hitting perspective of a world that comes crashing down on both brothers as con... Leer todo",1h 15min,Delhi Boom!
268,"6,4",['Major Ravi'],"['Shiju Nambiath', 'Major Ravi']",An investigation story set in the early 90's based on the Rajiv Gandhi assassination.,--,Mission 90 Days
269,"4,7",['Joshiy'],"['Udaykrishnan', 'Siby K. Thomas']","Gokul Das, an ex-gangster tries to make a living by becoming the driver of a millionaire, whose daughter, Priya is the target of some killers. Das tries to save Priya, but things are not what they seem to appear.",--,July 4
270,"6,8",['Takahiro Imamura'],"['Eiichirô Oda', 'Hirohiko Uesaka']","A re-telling of the Alabaster Arc from One Piece (TV). Luffy and his crew come to rescue a land in the midst of a civil war, due to a powerful devil fruit user.",1h 30min,One Piece: La saga de Arabasta - Los piratas y la princesa del desierto
271,"6,8",['Han Jae-rim'],"['Han Jae-rim', 'Ji-won Lee']","A light hearted action noir about a part time gangster who tries to be a full time daddy and wants to live a peaceful life with his family despite of being in trouble almost all the time, due to his profession.",1h 49min,Uahan segye
272,"4,7",['Sven Knüppel'],['Sven Knüppel'],"An action-story set in the ruins of future Babylon. In this war torn megalopolis a group of people struggles for survival. An artist tries to save her lover, a politician his integrity, a sportsman his dignity, a merchant his money and a cab driver his organs. But as all these people fight, love, trick and run for their lives in an epic conflict, they discover one sol... Leer todo",1h 40min,Taiketsu
273,"4,8",['Ronnie Ricketts'],['Willy Laconsay'],,1h 25min,Rumble Boy
274,"3,6",['Kirk Bowman'],['Kirk Bowman'],"Sexy young starlets perform in on-line videos for a Lingerie Designer's contest. Several do scarf juggling in panties, while another team does a gangster-themed video with pastel-colored squirt guns. A feisty girl - ASHLEY performs a black magic ceremony with her friends on camera, but, at that very moment, a gun fight breaks out downtown during a botched jewel transa... Leer todo",1h 18min,Curse of the Pink Panties
275,"7,0",['Shinji Aramaki'],"['Shirow Masamune', 'Kiyoto Takeuchi', 'Todd Weinger']","Con Briareos convaleciente tras una misión, a Deunan se le asigna un compañero nuevo y notablemente familiar mientras una extraña ola de ataques terroristas asola Olimpo.",1h 45min,Appleseed: Ex Machina
276,"6,2",['Valeriy Todorovskiy'],"['Oleg Malovichko', 'Valeriy Todorovskiy']","Young and talented man has a dream - to become a successful DJ. But on his way to fame he takes the wrong step, that may be fatal...",2h 4min,Tiski
277,"5,8",['Kenta Fukasaku'],"['Nobuyuki Jôkô', 'Tetsuya Oishi']","Recovering from a failed love affair, Shiyori and best friend Aiko head to the country. But they soon discover that the tranquil village is the home of a cult with a fetish for cutting off female legs. They try to escape but are split up and keep in touch via mobile phone. But will they meet a grisly end?",1h 30min,X-Cross
278,"6,0",['Sriwass'],DESCONOCIDO,"Section Sankar, a notorious criminal, frames ACP Bose in a bank employee's murder. Chandu, Bose's brother steps in to solve the case, save his brother and punish Sankar.",2h 44min,Lakshyam
279,"6,5","['Jeevitha', 'Rajasekhar', 'Samudra V.']",DESCONOCIDO,An army officer endangers his life and alienates himself from his family when he decides to fight corruption.,2h 50min,Evadithe Nakenti
280,"6,4",['Ernesto Díaz Espinoza'],['Ernesto Díaz Espinoza'],A club bouncer with a dark past and great fighting skills decides to become a superhero.,1h 30min,Mirageman
281,"6,6",['Tony Y. Reyes'],"['Bibeth Orteza', 'Tony Y. Reyes']",,1h 50min,Enteng Kabisote 4: Okay ka fairy ko... The beginning of the legend
282,"2,9",['Mark A. Reyes'],DESCONOCIDO,An ex-military colonel and his fellow survivors must stand a chance against the alien race called Balangs who conquered their entire world.,1h 50min,Resiklo
