,Puntuacion_IMDB,Dirección,Guionistas,Argumento,Duración,Nombre de la película
0,--,['Marcos Manhães Marins'],['Marcos Manhães Marins'],,15min,Chateaubriand - Cabeça de Paraíba
1,"6,3",['Patricia Ferreira'],DESCONOCIDO,"Paloma is a young psychiatrist, who is hired to work as a director of a clinic in Galicia, and is attracted to Mario, her very first patient. He suffers from a rare form of amnesia, commonly known as Korsakov's syndrome. As a result, both his short and long term memories are affected, and he has temporary lapses of perception. However, Paloma finds Mario to be a fasci... Leer todo",1h 40min,Sé quién eres
2,"5,1",['Marie-Christine Questerbert'],['Marie-Christine Questerbert'],"In the fourteenth century, the young Aliénor managed to treat the king of France, victim of a fistula. As a reward, she asks the sovereign to marry Bertrand de Roussillon she loves since childhood.",1h 47min,La chambre obscure
3,"7,2",['Ann Hu'],DESCONOCIDO,"Beijing, 1902: an enterprising young portrait photographer named Liu Jinglun, keen on new technology, befriends a newly-arrived Englishman who's brought projector, camera, and Lumière-brothers' shorts to open the Shadow Magic theater. Liu's work with Wallace brings him conflict with tradition and his father's authority, complicated by his falling in love with Ling, da... Leer todo",1h 56min,Xi yang jing
4,"8,3",['Will Wallace'],"['Jerry Sticker', 'Will Wallace']",,1h 30min,A Christmas Tree and a Wedding
5,"8,0",['Marc Levin'],DESCONOCIDO,"A one woman documentary play based on hundreds of interviews conducted after the riots that followed the 1992 acquittal of the police officers who beat Rodney King. This is a film adaptation of the play, directed by Mark Levine with additional documentary footage.",1h 16min,Twilight: Los Angeles
6,"6,5",['Sergio Bellotti'],['Daniel Guebel'],"Based on a true crime, ""Treasure of Mine"" follows a week in the life of Carlos Dietrich, a dark bank officer for the past 22 years at the Bank of Argentina. At 40, Dietrich faces an end to his illusions at all levels: emotionally, with his wife and lover, professionally (stagnant), personally (unfulfilled) and financially. He places himself on the fence between his da... Leer todo",1h 33min,Tesoro mío
7,"6,0",['Markus Imboden'],"['Walter Bretscher', 'Beat Schlatter']",,1h 30min,Komiker
8,"7,8",['Chitraarth'],DESCONOCIDO,"Udham Singh was born and brought in a Sikh Kamboj family in Punjab, India, during the time when the British ruled India. Enraged at the massacre of over 2000 men, women, and children at the hands of Brigardier General Edward Harry Dwyer (Tom Alter) in Jallianwalla, (now known in History books as the Jallianwalla Baug Massacre) Udham Singh swears vengeance. He sets abo... Leer todo",2h 45min,Shaheed Uddham Singh: Alais Ram Mohammad Singh Azad
9,"7,1",['Serik Aprimov'],['Serik Aprimov'],Tsjiboet and his two brothers grow up in a small village in Kazachstan. An old veteran tells them about a house where high officers can get the most beautiful women for free and the brothers start a search for this dreamplace.,1h 20min,Tri brata
10,"7,4",['Martin Sulík'],"['Dusan Dusek', 'Martin Sulík']",A doctor performs a small miracle with cigar smoke. A soldier performs heroics in his lovemaking. A deaf man awakens to discover a snake has slithered down his throat. A poacher becomes his own victim.,1h 46min,Krajinka
11,"7,7",['Brian Young'],['Brian Young'],"Dad was always there for us... Ray, a cab driver, views the world to be as lost as the passengers he picks up. Contact with his brother, Dr. Tom McCormack and father is non-existent. Except for his friendship with May, the elderly owner of the hotel where he lives, he is content just being left alone. Ray's only passion is his love of art. Tom's world takes a turn whe... Leer todo",1h 35min,Counting Days
12,"6,9",['José Nascimento'],"['João Canijo', 'José Nascimento']",Tragic real life story about a group of Portuguese fishermen who get caught in the middle of a storm in the Tejo river (Lisbon) and struggle to survive.,1h 35min,Tarde Demais
13,"6,2",['Gianfranco Giagni'],"['Graziano Diana', 'Nino Filastò', 'Gianfranco Giagni']","Beginning of the 80's: a politician is kidnapped and dies of heart attack during an interrogation. Before his death, the terrorists videotape his report on the exchange of money between businesspersons and politicians.",1h 26min,Nella terra di nessuno
14,"5,3",['Stanley Kwan'],['Jimmy Ngai'],"The story of seven people stuck on a remote island, quarantined by the government due to a viral outbreak.",1h 43min,You shi tiaowu
15,"7,2",['Robert Guédiguian'],"['Jean-Louis Milesi', 'Robert Guédiguian']","A dark tale of working-class life in Marseilles, a city in crisis. Interesting characters include a hard-bitten but compassionate fish market worker with a drug addicted daughter and a moody bartender with a shocking secret life.",2h 13min,La ciudad está tranquila
16,"6,1",['Tata Amaral'],DESCONOCIDO,"Selma, a retired nurse, is an extremely loving mother for his son Raimundo, in an almost incestuous relationship. One day, she becomes aware of some changes in her son's behavior. At first, she thinks it may be some girlfriend. But soon she learns it's something else.",1h 22min,Através da Janela
17,"6,9",['Zhou Sun'],"['Heng Liu', 'Xiaoli Shao', 'Zhou Sun']",Gong Li stars in this low-key drama about a single mother who will do anything to provide for her son. Sun Liying (Li) struggles to care for her hearing-impaired child Zheng Da (Gao Xin) after her taxi driver husband divorces.,1h 30min,Piao liang ma ma
18,--,['Taku Ohshima'],['Taku Ohshima'],,1h 44min,Kasei no waga ya
19,"6,8",['Jim McKay'],['Jim McKay'],"Focusing on the bonding between three girls in Brooklyn's ""Jackie Robinson Steppers Marching Band"" and the choices the girls face once their high school closes down for asbestos removal.",1h 35min,Our Song
20,"6,3",['Lucas Reiner'],['Lucas Reiner'],Los Angeles at the end of the century.,1h 32min,The Gold Cup
21,"6,1",['Karl Francis'],['Karl Francis'],Herbert Biberman struggles as a Hollywood writer and director blacklisted as one of The Hollywood Ten in the 1950s.,1h 49min,Punto de mira
22,"5,9",['Steve Barron'],['Wesley Burrowes'],A woman becomes furious when her husband arrives home from the local pub and turns into a rat.,1h 29min,Rat
23,"6,0",['Rudolf Thome'],['Rudolf Thome'],"On the occasion of his 60th birthday, Adam organizes an extended celebration at his country home. In addition to his current wife and their young children, the guests are his previous wives, the few most important of his former lovers, and the son he has not seen in decades with his family.",1h 43min,Paradiso: Siete días con siete mujeres
24,"7,7",['Algimantas Puipa'],"['Ernst Wiechert', 'Vytautas Zalakevicius']","At the end of the 19th century, proud but poor fisherman Jurgaitis gets imprisoned for a crime he did not commit. His beautiful daughter Elze is sent to live with rich German merchant Michael. There she falls for his son Endrik.",2h 15min,Elze Is Gilijos
25,"6,3",['Göran Nilsson'],['Åke Smedberg'],An old man fights to keep the government from building a dam on his fishing river.,55min,Rackelhane
26,"6,3",['Jonathan Teplitzky'],['Jonathan Teplitzky'],After a one-night stand a couple is faced with the terrifying possibility of what they really want.,1h 35min,Mejor que el sexo
27,"6,9",['Ben Hopkins'],DESCONOCIDO,"A man comes to London, uses a strange force to take over different men's identities, and creates chaos.",1h 27min,The Nine Lives of Tomas Katz
28,"6,2",['Richard Dutcher'],['Richard Dutcher'],"Life as a Mormon missionary isn't what 19-year-old Brandon Allen expected: so many rules and so few successes. Los Angeles is as unrepentant as Sodom and Gomorrah. He's forced to share a small apartment with five young prank-loving missionaries and, to top it off, his first companion, 29-year-old Marcus Dalton, proves to be a harsh mentor. After only one day as a miss... Leer todo",1h 48min,God's Army
29,"5,4",['Étienne Faure'],['Étienne Faure'],"Thomas is a bisexual man involved in several relationships. When suddenly one of his relationships, single mother Ann, dies, Thomas feels a responsibility towards her 13 year old son Gregoire. He tries to obtain custody.",1h 50min,In extremis
30,"6,0",['Todd Verow'],"['Philly Abe', 'Jim Dwyer', 'Todd Verow']","Anti-Matter(Philly) is the queen of nothing, the rule of nowhere, the monarch of ciphers...",1h 16min,Once and Future Queen
31,"5,7",['João Pedro Rodrigues'],DESCONOCIDO,"Young and handsome Sergio works the night shift as a trash collector in Lisbon, Portugal. He can't force himself to connect with his pretty female co-worker Fatima, who displays an avid interest in him, so instead Sergio roams the city with the trash company's pet dog. Eventually Sergio becomes fascinated with a sleek motorcycle, and then also its owner, João - a youn... Leer todo",1h 27min,El fantasma
32,"5,5",['Jason Bailey'],['Jason Bailey'],"Alison is a young woman on a clock - she's been diagnosed as HIV positive, and now has to confront her past as she contacts her sexual partners to warn them to get tested. Josh is a young man wrestling with his own demons - having blown it with the girl of his dreams, he now finds himself unable to make any emotional connections and hopes to leave town to escape his p... Leer todo",1h 35min,Keep Breathing
33,"7,1",['F.A. Brabec'],DESCONOCIDO,"Seven seemingly unconnected fairy tales - glued together only by folklore, mood, color and light - make up this Czech collection of visual poetry. The original piece of literature, written by Karel Jaromír Erben in 1853, contained twelve tales.",1h 21min,Kytice
34,"5,9",['Anne-Sophie Birot'],"['Anne-Sophie Birot', 'Christophe Honoré']","Even though they grew up in opposite parts of France, Gwen and Lise are best friends and spend every summer vacation together on the Brittany coast where Gwen lives and Lise's family has a summer home. But this summer is different because Lise's family isn't going on vacation for reasons that she won't explain to Gwen. Sick of her parents bickering about money and mis... Leer todo",1h 42min,Les filles ne savent pas nager
35,"5,8",['Peter Goedel'],DESCONOCIDO,,1h 36min,Tanger - Legende einer Stadt
36,"6,5",['Muthyala Subbaiah'],"['Bhupati Raja', 'Satyanand']",The story of an elder brother who would do anything for his younger brothers.,2h 37min,Annayya
37,"7,6",['Toshiyuki Morioka'],['Toshiyuki Morioka'],"Per Wikipedia: Requiem from the Darkness ( , Kyogoku Natsuhiko Kosetsu Hyaku Monogatari?, lit. ""Natsuhiko Kyougoku's Hundred Stories"") is a series of novels by Natsuhiko Kyogoku. It was made into horror anime series, licensed in English by Geneon Entertainment, and into a series of live action TV specials directed by Yukihiko Tsutsumi. The plot of the anime revolves... Leer todo",1h 44min,Kurayami no rekuiemu
38,"3,6",['Manuel Palacios'],DESCONOCIDO,"Andres did his time in jail following a false accusation. He doesn't care about revenge, however the unwritten Romani law bounds him to strike back.",1h 46min,Gitano
39,"7,6",['Rituparno Ghosh'],['Rituparno Ghosh'],A lonely middle-aged woman is forced by circumstance to let out her house to a film crew. She is attracted to the charming director and he exploits this fact to suit his purposes.,2h 30min,Bariwali
40,"6,8",['Miguel Alexandre'],['Georg Heinzen'],"Three jailers, a wheelchaired man and a mentally handicapped girl climb a mountain in the alps along with their supervisors.",1h 42min,Gran Paradiso
41,"6,6",['John Hay'],DESCONOCIDO,"Jimmy Grimble is a shy Manchester school boy. However, through football, and some special boots, he manages to gain the confidence to succeed.",1h 46min,El sueño de Jimmy Grimble
42,"5,7",['Robert Fedor'],['Robert Fedor'],"When tough street kid Ricky Horvath loses his beloved dog Buddy to a syndicate of vicious dognappers, he must turn to the one man he cannot forgive: his estranged grandfather, police detective Geza Horvath.",1h 32min,Bring Him Home
43,"6,8",['Edward Vilga'],['Edward Vilga'],"Arriving in Manhattan, the kids talk about their plans for the day in New York. Ally has been filming her friends with her new DV video camera. However, the friendly banter is disrupted by a fender bender that sets our story in motion.",1h 30min,Chaos Theory
44,"6,6",['Alain Desrochers'],DESCONOCIDO,"Réal (Bossé) and François (Papineau) are two old buddies in their early 30s who reunite at last to unearth a time capsule bottle which contains their dreams and ambitions from 15 years earlier. The problem is, their little treasure is buried on a plot of land that now belongs to a grumpy old coot, Antoine. Paying big bucks to get at their bottle, they discover that An... Leer todo",1h 47min,La bouteille
45,"5,8",['Jingle Ma'],"['Susan Chan', 'Felix Chong']","Is anyone who he says he is in this caper that moves from Hong Kong and Las Vegas to Tokyo? Ken doesn't show up in Vegas for his wedding; his disconsolate bride, Macy, heads home for Hong Kong and finds John, an interior decorator, waiving a check of Ken's that has bounced. She leaves immediately for Tokyo to find her businessman boyfriend, and John tags along. Ken's ... Leer todo",1h 58min,Tokyo Raiders
46,"4,8",['Colin Nutley'],['Colin Nutley'],A day in the life of ten Swedish actresses up for the same big Hollywood movie role.,2h 14min,Gossip
47,"4,7",['Jeff Winner'],"['Jeff Winner', 'Todd Peters']","What if every day of your pathetic life you worked yourself silly at a meaningless job and put off till tomorrow doing what you've always wanted to do? What would you try? How far would you go? As far as it takes? If so, You Are Here.",1h 32min,You Are Here*
48,"4,8",['József Pacskovszky'],"['Jacek Kondracki', 'József Pacskovszky']",,1h 40min,A mi szerelmünk
49,"7,6",['Aleksey Balabanov'],['Aleksey Balabanov'],"Arriving in Moscow, Danila discovers Konstantin dead and he sets out to avenge his death; a journey that leads him to Chicago and a whole new experience.",2h 2min,Brat 2
