91,"8,1",['Alejandro G. Iñárritu'],['Guillermo Arriaga'],"Un horrible accidente automovilístico conecta tres historias, cada una de ellas con personajes que se enfrentan a la pérdida, el arrepentimiento y las duras realidades de la vida, todo ello en nombre del amor.",2h 34min,Amores perros
92,--,['Gregory Horoupian'],['Gregory Horoupian'],,--,Solitude
93,"6,9",['Roch Stéphanik'],"['Sandra Cheres', 'Yves Sarda', 'Roch Stéphanik']",After the sudenly abandon from her husband a woman decide to work as a prostitute at the airport,2h 5min,Stand-by
94,"6,2",['Raúl García'],"['Dago García', 'Raúl García']","A group of friends have a screenplay ready for filming, and they only need financing. After trying in vain to find someone who will give money for their production, they plan to rob a bank in order to obtain the money for their picture.",1h 45min,Kalibre 35
95,"5,4",['Quentin Lee'],['Quentin Lee'],"At his agent's party, Ryan, a young screenwriter, and Joel, Ryan's boyfriend, meet Leo, an aspiring novelist and a college student. During an intense conversation about serial killers, Ryan feels viscerally connected to Leo as if everyone in the party has vanished. Out on a limb, Ryan leaves Joel's apartment on the fateful morning and drifts into three different possi... Leer todo",1h 26min,Drift
96,"6,5",['Rajko Grlic'],"['Rajko Grlic', 'Alex Koenigsmark']","Misadventures of a hapless young man from rural Bohemia who, in 1991, is finally free to cross newly open borders.",1h 41min,Josephine
97,"7,0",['Andrucha Waddington'],['Elena Soarez'],"A true story that comically depicts the relationship between an ordinary woman and her three husbands, who live in the same house in a poor and arid small village of the Brazilian northeast.",1h 44min,Eu Tu Eles
98,--,DESCONOCIDO,DESCONOCIDO,Desconocido,--,Error nombre para la pelicula con id: tt0243116
99,"5,0",['Mariusz Trelinski'],DESCONOCIDO,A look at the 1990s generation of cynical and selfish young Varsovians who managed to achieve financial success. But at what cost?,1h 43min,Egoisci
100,"5,0",['Jochen Hick'],DESCONOCIDO,"Was the AIDS virus created during an experiment gone awry at the Pentagon top security genetic laboratory? Stefan, an East German medical student whose father was a high-ranking AIDS scientist in the former GDR, is determined to find out.",1h 48min,Que nadie duerma
101,"5,8","['Akhenaton', 'Kamel Saleh']","['Akhenaton', 'Kamel Saleh']","The story of a group of friends, stars of a quiet life of night breaks and free time in a poor district of Marseille. One summer, a tragedy with racism as the key will fall on their lives.",1h 30min,Comme un aimant
102,"6,0","['Fernando Fernán Gómez', 'José Luis García Sánchez']","['Anonymous', 'Fernando Fernán Gómez']",Un maduro Lázaro tiene que demostrar a un tribunal de Toledo que su forma de vida se debe no a una voluntad de delinquir sino a la necesidad de escapar del hambre.,1h 28min,Lázaro de Tormes
103,"6,4",['Zelito Viana'],"['Joaquim Assis', 'Eduardo Coutinho', 'Zelito Viana']","The film tells the story of an intuitive, adventurous man who loved his country and being Brazilian. This man fought to be loyal to himself. His music is a transparent portrait of his genius, intuition, freedom, adventure, and passion for Brazil. The story shows aging Villa-Lobos going to a gala concert in the Theatre of Rio de Janeiro for a tribute in his honor. This... Leer todo",2h 12min,Villa-Lobos: Uma Vida de Paixão
104,"7,7",['Shinji Aoyama'],['Shinji Aoyama'],"Los traumatizados sobrevivientes de un secuestro en un autobús se unen para un viaje por la carretera para intentar superar su yo dañado. Mientras tanto, un asesino en serie anda suelto.",3h 37min,Yurîka
105,"7,0",['Lone Scherfig'],"['Maeve Binchy', 'Lone Scherfig']",Varios corazones solitarios de un barrio de la periferia de una ciudad danesa asisten a un curso de italiano con el fin de encontrar el amor de sus vidas.,1h 52min,Italiano para principiantes
106,"6,9",['Gérard Corbiau'],DESCONOCIDO,"Corbiau repeats the Farinelli formula, artistic rivalry and social private drama expressed in dazzling, sometimes excessively lavish baroque scenery, music and costume, but this time in its ultimate setting: Versailles. There are two protagonists - first the title character, Louis XIV, the French sun-king who has two passions, establishing absolute rule over the realm... Leer todo",1h 55min,La pasión del rey
107,"5,8",['José García Hernández'],['Manuel Ortega'],"Daniel (Federico Luppi) is the star of a popular television series who is interested in more prestigious work. and longs to appear on the legitimate stage. Daniel is lobbying for the leading role in Divertimento, a well-known play that made a star of leading man Bernardo Gabler (Francisco Rabal). When Daniel pays a visit to the theater where the play is being staged, ... Leer todo",1h 33min,Divertimento
108,"5,7",['Scott Patterson'],"[""John O'Brien""]",,1h 17min,"A Wreck, a Tangle"
109,"6,3",['Gholam Reza Ramezani'],['Gholam Reza Ramezani'],"A restless boy is forced by his pedlar father to spend hours inside his father's cart as punishment. Ironically, the enclosed space gives the curious kid the chance to witness the world through a small hole in the cart.",1h 10min,Charkh
110,"7,8",['Svetoslav Ovtcharov'],['Svetoslav Ovtcharov'],,1h,Bulgaria - tova sam az!
111,"6,1",['Anne Villacèque'],"['Elisabeth Barrière-Marquet', 'Anne Villacèque']",Thirty year old virgin Sybille meets the man of her dreams. Or is he?,1h 46min,Petite chérie
112,"5,5",['Alexandre Arcady'],DESCONOCIDO,"Famous TV news anchorman Pierre Nivel left Algiers for France in 1962. That's been a secret; his Paris co-workers have never known that he was formerly an Algerian pied noir. An Algerian delivers an urgent message to Pierre from a Leïla Jalal... Algiers, 1962. The Nivels live in the same apartment building as the Moslem Jalal family. Lycée student Pierre is in love wi... Leer todo",1h 54min,Là-bas... mon pays
113,"7,1",['Im Kwon-taek'],"['Sang-hyun Cho', 'Hye-yun Kang', 'Kim Myung-gon']","A governor's son falls in love and marries a beautiful girl, the daughter of a courtesan. Their marriage is kept a secret from the governor who would immediately disown him if he found that his son married beneath him.",2h 17min,Chunhyang
114,"5,1",['Shakeel Noorani'],DESCONOCIDO,"A conman disguises himself as a groom in order to con a wealthy yet a troubled businessman, later reforms his criminal ways to win his ladylove.",2h 49min,Joru Ka Ghulam
115,"5,3",['Martin Cummins'],"['Richard C. Burton', 'Martin Cummins']","Caught in the jagged downtown world of drugs, prostitutes and violence, three young artists lead tumultuous lives in desperate need of an overhaul. Relationships stumble as careers take flight. Support and friendship and slip into betrayal. For some, there is redemption. For others, death. The comedic, the pathetic, the talented and the ruined all walk the same raw st... Leer todo",1h 32min,We All Fall Down
116,"2,1",['Isidora Bjelica'],['Isidora Bjelica'],"A story about two unhappy couples: one living in Dorcol (the old part of Belgrade), and the other who live in Manhattan. The couple from Dorcol wants to move and live in Manhattan, while the couple from Manhattan wants to get back to their native country and live in Dorcol. However, these people do have something in common: sexual gluttony.",--,Dorcol-Menhetn
117,"5,7",['Jochen Kuhn'],"['Jochen Kuhn', 'Claudia Messemer']",An artist finds that leaving the creative life behind is more complicated than he expected in this comedy. Edward Schreiner is a painter whose unusual ideas about art have prevented him from winning an audience for his work. Edward insists on destroying all of his work.,1h 37min,Fisimatenten
118,"3,6",['Richard Friedman'],['Richard Friedman'],"L.A. is struck by a series of minor earthquakes. The experts don't know what's happening since their advanced systems didn't detect any seismic activities. Kimberly Stevenson is sent to investigate the epicenter in a remote mountainous forest, and she is surprised to discover she's not alone. Somebody knows the real secret about the ""earthquakes"".",1h 32min,Punto cero
119,"5,4",['Jean-Pierre Mocky'],"['Elisabeth Sanxay Holding', 'Jean-Pierre Mocky']","Married to a younger woman, Jacob sinks into jealousy, alcohol and violence.",1h 30min,La candide madame Duff
120,"4,9",['Anne DeSalvo'],['Anne DeSalvo'],"While trying to help their widowed mother cope, each of four sisters begins to understand what is missing in their own lives and relationships, and the lessons they learn affect the entire family.",1h 31min,Las chicas Amati
121,"7,6",['Lucio Gaudino'],['Nicola Molino'],,1h 26min,Prime luci dell'alba
122,"6,5",['Javier Olivera'],DESCONOCIDO,"Pedro (Julio Chávez), ex-combatant of the Falklands War, can not forget those days when he was in the trenches, nor can he forget Raúl, his fighting companion, who remained forever in that desolate place of nightmare.",1h 31min,El visitante
123,"8,1",['Vivi Letsou'],['Vivi Letsou'],"A lesbian stripper lives with her lover, a novelist with writer's block who cheats on her with another woman.",1h 20min,Skeleton Woman
124,"5,7",['Yoram Gal'],['Yoram Gal'],,1h 28min,Pere
125,"5,6",['Katrine Wiedemann'],"['Morten Korch', 'Vinca Wiedemann']",,1h 27min,Fruen på Hamre
126,--,['Roberto Meddi'],['Gioia Magrini'],,1h 20min,Ponte Milvio
127,"6,3",['Paul Tickell'],"['Simon Bent', 'B.S. Johnson']",A man uses the principles of double-entry bookkeeping to settle his accounts with society.,1h 29min,Christie Malry's Own Double-Entry
128,"7,4",['Giuseppe Tornatore'],"['Giuseppe Tornatore', 'Luciano Vincenzoni']","En medio del clima de guerra, un adolescente que se descubre a sí mismo se convierte en enamorado de Malèna, una mujer sensual que vive en una pequeña y estrecha ciudad italiana.",1h 48min,Malena
129,"7,8",['Kat Candler'],['Kat Candler'],,1h 30min,Cicadas
130,"5,9",['Hyatt Bass'],['Hyatt Bass'],"The film is set against the sweltering beauty of the Texas countryside, at the ranch estate of a well-to-do family.",1h 40min,75 Degrees in July
131,"6,9",['Sergio Bianchi'],DESCONOCIDO,"Dissection of Brazilian problems, using six people who meet in a restaurant in São Paulo as models to illustrate political and sociological theses.",1h 41min,Cronicamente Inviável
132,"5,0",['William Katt'],"['Kermit Christman', 'William Katt']",An ex-convict tries to make an honest living and take care of his girlfriend and her mentally slow brother.,1h 22min,Clean and Narrow
133,"5,5",['Gary Walkow'],['Gary Walkow'],La historia del escritor William Seward Burroughs y su esposa.,1h 33min,Beat
134,"3,3",['Angela Evers Hughey'],['Angela Evers Hughey'],A family of friends is forever changed when two of the friends realize that their love for one another goes beyond the confines of their conventional relationship.,1h 21min,An Intimate Friendship
135,"6,8",['Marleen Gorris'],"['Vladimir Nabokov', 'Peter Berry']",Dos mundos chocan cuando un genio excéntrico se enamora de una mujer bella de fuerte voluntad.,1h 49min,La defensa Luzhin
136,"6,1",['Kaspar Rostrup'],"['Martha Christensen', 'Kaspar Rostrup']","A mother and her autistic son Brian. One evening he comes home from his evening walk with stained shoes. The next morning it is rumored that a young woman was murdered in the neighboring park. The identity of the suspect is obvious, and while the police break down the door, Fru tries to keep her son in safe waters.",1h 40min,Her i nærheden
137,"5,9",['Krisztina Deák'],DESCONOCIDO,"The film is the filmed version of Pál Závada's novel of the same title, which was first published in 1997 and soon became a bestseller. The story takes place during World War I and afterwards in a small town in south-eastern Hungary. It tells about the unhappy marriage between a young man, Ondris, who is a member of the Slovak minority of the town, and his wife Jadvig... Leer todo",2h 10min,Jadviga párnája
138,"7,0",['Aditya Chopra'],DESCONOCIDO,"A film about the battle between love and fear, between two stubborn men and their opposing beliefs and the outcome of the love stories of 3 couples.",3h 36min,Mohabbatein
139,"6,6",['Claude Mouriéras'],['Claude Mouriéras'],"Three French sisters have their lives interrupted and their relationship called into question when their father returns to visit 15 years after having abandoned them and their now-deceased mother. Each responds differently to his return according to how her character evolved from her relation with him and his unexpected departure. They eventually realize, though, that... Leer todo",1h 36min,"Tout va bien, on s'en va"
140,"7,3","['Tony Gatlif', 'Cathy Konrad']",DESCONOCIDO,"Vengo is a majestic ode to the artistry and magic of flamenco dancing, set against the compelling backdrop of two gypsy families locked in an age old struggle for power.",1h 30min,Vengo
141,"6,3","['D-Shot', 'Hunter McCann', 'Harry Mok']",['D-Shot'],"Enemies since back in the day, two homeboys take a different path in life. College bound Daryll, desperate to keep a roof over his family's head and seduced by the money, power and respect of the hustler lifestyle moves in on his old nemesis' turf setting off a battle over territory in a war that rages throughout the inner city.",1h 15min,Obstacles
142,"4,9",['Hunt Hoe'],['Hunt Hoe'],"Vijay Chatterjee was born in British India, and his dad was a freedom fighter. Unable to handle the riots between Hindus and Muslims in the late 40s, the Chatterjees first immigrated to Britain, and then to Toronto, Canada, where they enjoyed considerable bliss in the company of other Canadians from Bangla Deshis, Pakistanis and Sri Lankans, and opened a restaurant. S... Leer todo",1h 47min,Seducing Maarya
143,"5,3",['Paul Marcus'],['Jeff Miller'],"A washed-up detective discovers his own psychic ability when assigned to investigate a serial murder case. The killer has a deranged obsession with the novel ""Alice in Wonderland."" As the psychopath's bloody reign of terror continues, the cop spirals deeper and deeper into the case where the horrors of the past and present come together.",1h 40min,Visiones extrañas
144,"7,6",['Ayse Polat'],"['Ayse Polat', 'Basri Polat']","Senay (Blume) is a willful eleven year old girl in Hamburg who's Turkish father has just died. The only friend responding to the news about her father is a gay Turkish cabaret singer, Zeki (Siir Eloglu). Together they travel through Europe in search of the orphan girl's mother, Cicek (Fecht), who left at childbirth and whom Zeki represents as Senay's aunt.",1h 31min,Auslandstournee
145,"6,6",['Hans-Christian Schmid'],"['Hans-Christian Schmid', 'Michael Gutmann', 'Benjamin Lebert']","Benjamin is a 16 year old, paralyzed on one side of his body, with lousy grades in math, who switches to a boarding school to reach grammar school. Acclimatization to the new environment is difficult in the first place and he has to struggle with the various problems of coming of age, when he falls in love with the school's dream girl Malen.",1h 37min,Crazy
146,"6,6",['Denis Bardiau'],"['Denis Bardiau', 'Alexandre Jaffray']","Go behind the scenes as cameras study a rare creature - Marty Stouffer - a man dedicated to wildlife. Marty Stouffer is seen working and playing with his friends and family. Never-seen home video highlights this very personal biography. From his childhood in Arkansas, and some youthful adventures in Alaska and Africa, to his current role as creator of Wild America dot... Leer todo",1h 29min,El mundo de Marty
147,"3,6",['Sheldon Lettich'],"['Stephen Brackley', 'Pamela K. Long']","Después de que un gran terremoto destruya Los Ángeles, se forma un nuevo orden. Pero el desacuerdo entre las filas conduce a más guerras y perturbaciones. Se debe poner orden si hay alguna esperanza para el futuro.",1h 35min,La última patrulla
148,"6,0",['Jeanne Labrune'],['Jeanne Labrune'],"Such an inconsequential event - the unfortunate purchase of a package of cling film - reveals the character and behavior of a small group of individuals caught up in the chaos of today's society. Though it creates arguments and inner questioning, this event - and its various consequences - also creates bonds.",1h 29min,Mañana nos irá mejor
149,"6,7",['María Novaro'],['María Novaro'],A woman steals from her drug-dealer boyfriend and runs away. She meets a sympathetic woman on the way who helps her escape.,1h 49min,Sin dejar huella
150,"6,1",['Vincent Giarrusso'],['Vincent Giarrusso'],"The world of 14 year old Shaun revolves around his broken family home, and a group of truant friends who inhabit Melbourne's northern suburb shopping centres. As he tries to make the transition into adulthood, the audience is forced to view the world through the eyes of one whom society is reluctant to accept.",1h 24min,Mallboy
151,"5,9",['Sheri Elwood'],['Sheri Elwood'],"A reclusive woman's unpublished story about a curse, told to a grieving girl, turns out to be something other than a fairy tale.",1h 41min,La fuerza del pasado
152,"3,8",['Rob Hardy'],DESCONOCIDO,Los problemas surgen cuando una pareja felizmente casada trae a alguien más para condimentar las cosas.,1h 33min,Sólo para tres
153,"6,0",['Alan White'],DESCONOCIDO,A naïve insurance adjuster comes under the tutelage of his jaded boss and gets caught in a web of deceit and lust.,1h 33min,Risk
154,"7,1",['Dominik Moll'],"['Dominik Moll', 'Gilles Marchand', 'Francis Villain']","Harry knew Michel in high school; they meet again by accident, Harry inserts himself in Michel's life... and things take a sinister turn.",1h 57min,"Harry, un amigo que os quiere"
155,"6,6",['Olivier Assayas'],"['Jacques Chardonne', 'Olivier Assayas', 'Jacques Fieschi']","In late nineteenth century Charante, Protestant minister Jean Barnery causes local disquiet when he arranges a separation from his obsessive wife - and more talk when he decides to take her back. By this time he has been drawn to Pauline, niece of a Cognac distiller, and this precipitates him divorcing his wife, settling on her and his daughter the shares he owns in h... Leer todo",3h,Los destinos sentimentales
156,"5,1",['Laurent Perrin'],"['Camille Taboulay', 'Laurent Perrin']",,1h 45min,30 ans
157,"6,2",['Jerry Schatzberg'],"['Bob Cea', 'Jerry Schatzberg']",Daniel Moulin goes to New York on a business trip and decides to take advantage of his time in the Big Apple to try and locate the father he never knew. The only thing he has to go on however is an address in the Bronx that is 25 years old.,1h 44min,El cielo del Bronx
158,"6,0",['Chantal Akerman'],"['Chantal Akerman', 'Eric De Kuyper', 'Marcel Proust']","Una adaptación de ""La Prisionera"" de Proust, historia de un amor disfuncional y trágico ambientada en París.",1h 48min,La cautiva
159,"4,1",['Robert Adetuyi'],DESCONOCIDO,A gifted musician struggles to rise above the crime-plagued urban streets and realize his dream.,1h 26min,Turn It Up
160,"5,3",['Steve Suissa'],"['Marc Esposito', 'Steve Suissa']","Stan, a Jewish high school student, lives with his parents and his sister, Sarah. The school does not interest him. His grandfather destines him to the job of butcher. Fascinated by the movies Stan dreams of becoming an actor.",1h 30min,L'envol
161,"4,8",['Akashdeep Sabir'],['Neeraj Pathak'],"Krishna Patil is a poor, unemployed, unsuccessful and short tempered youth who stays in a chawl with his father Ramakant and elder sister Mansi. He tries to secure a job in the police department but fails. One day he happens to meet Kavita Choudhary, a young, rich, beautiful, intelligent lawyer. He falls for her instantly and begins wooing her. Kavita, having recently... Leer todo",--,Ghaath
162,"6,8",['Jean-Pierre Denis'],"['Jean-Pierre Denis', 'Paulette Houdyer', 'Michèle Pétin']",Based on the true story of two chambermaids (the Papin sisters) of 1930s France who murdered their employer and her daughter.,1h 34min,Les blessures assassines
163,"3,2",['Melvin Van Peebles'],['Melvin Van Peebles'],"A closed-minded conservative couple masquerade as liberal do-gooders in late 60's France. With orders piling up at their bistro, The Full Belly, Loretta and Henri, self-described ""pillars of the community,"" hire Diamantine as a waitress in order to give a poor black orphan a break. At home, they tell their trusting, new live-in employee that she's ""one of the family,""... Leer todo",1h 45min,Le conte du ventre plein
164,"6,3",['Eric Rochant'],"['Laurent Chalumeau', 'Eric Rochant']","After a drug deal gone wrong, Bédé goes into hiding in the countryside at a reformative school for criminal youth. His location is found out, and he and the pupils have to protect themselves with whatever means they have.",1h 24min,Total Western
165,"7,1",['Michael Haneke'],['Michael Haneke'],"Un joven acosa a una mujer sin hogar, otro hombre protesta, la policía detiene a ambos y la mujer tiene que salir del país. ¿Cuáles fueron sus diversas historias que llevaron a este evento?",1h 58min,Código desconocido
166,"6,3",['Aaron Michael Lacey'],DESCONOCIDO,"In 2069, doctors have developed the technology to create human clones. After governmental legislation, banning human cloning, the doctors at D.B.I. find another way to continue their experimentations on an orbiting space prison, the Maxine-2000. In Washington D.C., Essex is an agent for the National Bio-ethics Advisory Commission who specializes in enforcing the Bio-e... Leer todo",2h 15min,Xscape
167,"6,0",['Declan Lowney'],['Colin Bateman'],A sleazy chef is forced to face the truth about the man he has become and realizes that he has the chance to begin again.,1h 31min,Wild About Harry
168,"6,1",['Kamshad Kooshan'],['Kamshad Kooshan'],"Surviving Paradise follows the adventures of 10-year-old Sam and 8-year-old Sara, Iranian children lost in Los Angeles, as they struggle to search for an uncle and elude the hit man who kidnapped their mother. On their way, they encounter a colorful cast of character and dangerous situations, but through connections they endure the rigors of life on the street.",1h 30min,Surviving Paradise
169,"7,0","['Massimo Martella', 'Fabio Rosi']",DESCONOCIDO,"A great economist, Federico Caffè, disappeared without a trace. He moves away from his home and disappears into thin air. What happened to him remains a mystery full of theories.",1h 32min,L'ultima lezione
170,"5,7",['Romuald Karmakar'],"['Romuald Karmakar', 'Bodo Kirchhoff']","Due to a delayed flight a group of German flight passengers have to wait in the hall of the airport of Manila. The crowd is quite mixed, ranging from an cultivated east German teacher couple up to sleazy sex tourists. As the waiting prolongs, more and more aggressions and long repressed behaviors shed their way to the surface.",1h 53min,Manila
171,"6,7",['Spike Lee'],['Spike Lee'],"A frustrated African-American TV writer proposes a blackface minstrel show in protest, but to his chagrin, it becomes a hit.",2h 15min,Bamboozled
172,"3,4",['Ray Manzarek'],DESCONOCIDO,Three men are dangerously obsessed with the same woman.,1h 32min,Love Her Madly
173,"6,4",['Oliver Schmitz'],DESCONOCIDO,A young Soweto actor joins a gang to study up and be more convincing in a gangster role he wants.,1h 30min,Hijack Stories
174,"7,0",['Michel Jetté'],['Michel Jetté'],"After an unpleasant run-in with a group of bikers, a young convenience store robber (Marc) gets approached by the same bikers to help out with a picnic. After the picnic, seeing he has guts, the bikers propose him for membership. As the story unfolds, Marc winds up questioning his own morality and wondering whether he's going down the wrong path. The biggest problem, ... Leer todo",2h 10min,Hochelaga
175,"5,1",['Eoin Moore'],['Greg Brennan'],"Maria is a wife and mother in the beautiful, but very remote Connemara region of Ireland. When an old friend from Germany arrives in the place, her life is thrown into turmoil.",1h 45min,Conamara
176,"7,6",['Yoshiaki Kawajiri'],DESCONOCIDO,"Cuando una joven es secuestrada por un vampiro, un legendario cazarrecompensas es contratado para traerla de vuelta.",1h 43min,Vampire hunter D: Bloodlust
177,"6,9",['Bernard Rapp'],"['Philippe Balland', 'Bernard Rapp', 'Gilles Taurand']","Nicolas, a handsome, young waiter, is befriended by Frédéric Delamont, a wealthy middle-aged businessman. Delamont, a man of power, influence and strictly refined tastes, is immediately smitten by Nicolas' charm. Lonely and phobic, Delamont offers Nicolas a lucrative job as his personal food taster. In spite of their differences, a close friendship begins to emerge be... Leer todo",1h 30min,Une affaire de goût
178,"7,0",['Ken Loach'],['Paul Laverty'],Dos hermanas latinas trabajan como limpiadoras en un edificio de oficinas y luchan por el derecho a sindicalizarse.,1h 50min,Pan y rosas
179,"6,7",['François Ozon'],"['Rainer Werner Fassbinder', 'François Ozon']","In 1970s Germany, a 50-year-old businessman falls in love with a 20-year-old man.",1h 22min,Gotas de agua sobre piedras calientes
180,"6,0",['Colleen Murphy'],['Colleen Murphy'],A teacher falls in love with a pianist who turns out to be a dangerous psychopath.,1h 37min,Desire
181,"7,6",['James Mathers'],"['Reed Bernstein', 'James Mathers']",The homeless live in a forgotten world in downtown Los Angeles.,--,King of the Korner
182,"6,9",['Edo Bertoglio'],"[""Glenn O'Brien""]","After being released from the hospital, the artist Jean Michel Basquiat wanders around Manhattan trying to sell art to make money and find a place to stay.",1h 12min,Downtown 81
183,"4,1",['Sharon von Wietersheim'],['Sharon von Wietersheim'],,--,No Taboo
184,"4,6",['Terry Cunningham'],DESCONOCIDO,An American army intelligence officer discovers corruption and murder by American soldiers in Vietnam.,1h 35min,Factor caos
185,"5,0",['Mark Lamprell'],['Jerome Ehlers'],,1h 27min,After the Rain
