186,"4,6",['Brent Florence'],['Brent Florence'],"Three smalltown friends looking to leave their troubles behind come up with a robbery scheme to fund their trip to the big city. But as their plan goes awry and the authorities become involved, they are left with no other alternative but to take hostage a pair of traveling young lovebirds, with no shortage of problems of their own.",1h 25min,"A Girl, Three Guys, and a Gun"
187,"5,5",['Arne Olsen'],['Arne Olsen'],"Owen is the head administrator of an old-age home in Washington. One day, a resident discovers that he is cheating on his taxes and orders that Owen takes him and two others on a road trip to British Columbia. While there, they try to break him from his cynical businessman mold by setting him up with a waitress, among other things.",1h 34min,A vivir que son dos días
188,"5,1",['Stephen Kay'],"['Ted Lewis', 'David McKenna']",Un sicario de la mafia de Las Vegas vuelve a su ciudad natal para investigar la misteriosa muerte de su hermano.,1h 42min,Get Carter (Asesino implacable)
189,"6,7",['Salvador Aguirre'],"['Salvador Aguirre', 'Alejandro Lubezki']","After spending three years working in the United States, Filiberto returns to his hometown in Mexico, believing that there he will find the recognition he has been denied. The reality is very different. In his village, Filiberto will not only find violence, betrayal and disaffection, but he will also be on the verge of losing his identity.",1h 32min,De ida y vuelta
190,"6,3",['Guido Chiesa'],"['Guido Chiesa', 'Beppe Fenoglio', 'Antonio Leotti']","After 8 September 1943, Northern Italy is occupied by the Germans. The Italian army collapses and the soldiers escape to the mountains to set up a resistance. Many civilians do the same, and Johnny, an English literature student, is among them. Johnny avoids joining the red partisans (Communists) and tries to be part of the azure bands (former regular soldiers). In bo... Leer todo",2h 15min,Il partigiano Johnny
191,"6,3",['Kristian Levring'],"['William Shakespeare', 'Kristian Levring', 'Anders Thomas Jensen']","When a bus breaks down in the desert, the passengers decide to stage ""King Lear.""",1h 50min,El rey está vivo
192,"6,8",['Michael Kalesniko'],['Michael Kalesniko'],A sarcastic playwright in LA gets new neighbors - single mom and 8 y.o. girl. His wife wants kids and babysits the girl. He doesn't want kids yet plays with her to find out how children talk - for his play. Paternal instincts?,1h 47min,Cómo matar al perro de tu vecino
193,"6,6",['Roland Suso Richter'],['Uwe Timm'],A Kurdish boy who sells drugs and an ex-cop who drives a taxi: an unlikely couple who get lost in an urban crime thriller.,1h 40min,Eine Hand Voll Gras
194,"6,3",['Carlos Gerbase'],DESCONOCIDO,,1h 40min,Tolerância
195,"7,7",['David Feldman'],"['Carl V. Dupré', 'David Feldman']","This film focuses on a trio of down-and-out gambling slackers. Dot (Kevin Corrigan), Lem (Mick Cunningham), and Curry (Michael Lowry) spend much of their time sucking down beer and making back bets on Yankees games, until they stumble upon the investment opportunity of a lifetime -- or so they think. As their luck seems to turn, Dot tries to go straight and pursue a f... Leer todo",1h 34min,Broke Even
196,"7,1",['Ricky Tognazzi'],DESCONOCIDO,"Costanza is drinking a beer in a Prague pub, a summer night in 1968, while a violinist enters and starts playing a ""canone inverso"" for her. It is not a case, that music and that violin have a story behind that could concern her. It is the love story between Jeno Varga and the music, between Jeno and Sophie. It is also the friendship story with David on the background... Leer todo",1h 47min,Canone inverso - Making Love
197,"7,1","['Derek W. Hayes', 'Stanislav Sokolov']",['Murray Watts'],The story of Jesus Christ.,1h 30min,El hombre que hacía milagros
198,"5,8",['Tony Mortillaro'],['Tony Mortillaro'],A father's retirement is foiled when all of his dysfunctional children simultaneously move back home as adults.,--,Family Jewels
199,"6,2",['Jan Schütte'],['Klaus Pohl'],"It is one of the last days of an exceptionally hot summer in 1956. Bertolt Brecht (Bierbichler) is about to leave his lakeside house among the tall birches in Brandenburg to return to Berlin for the upcoming theater season. Most of the women in his life are there: his wife, Helene Weigel (Bleibtreu); his daughter, Barbara; his old lover Ruth Berlau; his latest flame, ... Leer todo",1h 37min,Abschied - Brechts letzter Sommer
200,"7,2",['Giovanni Fago'],DESCONOCIDO,,2h 10min,Sulla spiaggia e di là dal molo
201,"7,3",['Bryan W. Simon'],"['Jim Moores', 'Bryan W. Simon']","Two estranged brothers are forced to take a surreal and heartfelt journey to understanding, when they pick up the body of their deceased father in Mexico. A father they haven't seen in over 20 years.",1h 39min,Along for the Ride
202,"6,2",['Steve Wang'],DESCONOCIDO,,--,Sirens of the Deep
203,"5,1",['Luca Bercovici'],"['Luca Bercovici', 'Rick Bloggs', 'Kandice King']","Jack Sweeny is a young man just trying to get a job. Turned down at another bank due to his criminal record he meets a girl, Rebecca, but also witnesses a 3 way shootout between 2 groups of criminals and the cops over a suitcase containing perfect plates for counterfeiting bank notes. Jack grabs the plates and attempts to sell them via his friend Zippo. However with a... Leer todo",1h 41min,Ciudad de corrupción
204,"6,1",['Sally Potter'],['Sally Potter'],Una joven refugiada que viaja de Rusia a América en busca de su padre perdido se enamora de un jinete gitano.,1h 40min,Vidas furtivas
205,"6,7",['Martin Rodriguez'],['Alberto Fuguet'],"This drama explores the relationship between two brothers, separated by life and reunited again by destiny.",1h 30min,Dos hermanos
206,--,['Husam Chadat'],['Elisabeth Karsten'],,2h,The Summer of the Kavalcutes
207,"6,2",['Tamra Davis'],DESCONOCIDO,An ungrounded young mother and her thoughtful teenage son are banished to a remote provincial town by her domineering father.,1h 40min,Sueños de adolescente
208,"6,9",['Rod Lurie'],['Rod Lurie'],"La senadora Laine Hanson es candidata a vicepresidenta de Estados Unidos, pero la información y la desinformación sobre su pasado emergen y amenazan con descarrilar su participación.",2h 6min,Candidata al poder
209,--,DESCONOCIDO,DESCONOCIDO,Desconocido,--,Error nombre para la pelicula con id: tt0210065
210,"6,5",['Martin Duffy'],"['Rhidian Brook', 'Maureen Tilyou']","A lonely boy, from a broken family, becomes inspired by faith healers.",1h 33min,The Testimony of Taliesin Jones
211,"6,6",['Greg Harrison'],['Greg Harrison'],An inside look into one night in the San Francisco underground rave scene.,1h 26min,Con la música a tope
212,"7,3",['Hilary Birmingham'],"['Hilary Birmingham', 'Matt Drake', 'Tom McNeal']","Tully can get any girl he wants and often does every night - until he meets the new girl, Ella - who reveals something within him and his family they've long buried.",1h 42min,Tully
213,"3,9","['Marina Dubrovina', 'Aki Kaurismäki']",['Igor Maiboroda'],My great opportunity to work camera-assistant with great Cinematographer Georg Ivanovich Rerberg (1937-1999). This film was he's last movie.,--,"Vera, nadezhda, krov'"
214,"6,9","[""Audrey O'Reilly""]","[""Audrey O'Reilly""]","When her husband dies, Mrs. Duane finds a very particular way of dealing with his death. A love story set between this world and the next.",--,In Loving Memory
215,"4,9",['Tamás Sas'],DESCONOCIDO,About the rise of a oligarch surrounded by his criminal contacts.,1h 40min,Rosszfiúk
216,"5,6",['Laetitia Masson'],['Laetitia Masson'],"The movie rather presents a map of its main character's mind than a story. Realistic scenes mix with dream sequences and hallucinations. The realistic episodes feature Gabrielle, a young woman living in a trailer on a beach in northern france. She works in a bar, drinks a little too much and is a big fan of aging rock/blues singer Lennox. A more dreamlike storyline sh... Leer todo",1h 47min,Love me
217,"6,8",['Alexander Samaan'],"['John Garrett', 'Alexander Samaan']","Life is a drug-induced haze for Claire Oberon, who lives in her remote mansion addicted to heroin, surrounding herself with her drug-addicted friends and letting her life slowly fade away. Attempting one last chance, Claire's mother, Judith Oberon, contacts Cary Gable, an ex-boyfriend of Claire's, to help clean her up. At a standstill in his own life, Cary sees this a... Leer todo",2h,Chasing the Dragon
218,"6,7",['Gérard Blain'],"['Gérard Blain', 'Wilhelm Bérard', 'Michel Marmin']","A son will be invested with a dual mission: to honor the memory of the dead father by charging his murderers the price of blood and, therefore, restore broken family harmony.",1h 20min,Ainsi soit-il
219,"6,5","['Andrea Frazzi', 'Antonio Frazzi']","['Lorenza Mazzetti', ""Suso Cecchi D'Amico""]","1943, an estate north of Firenze. The weight of the world is on the shoulders of Penny, who's about 10. An orphan, she must watch over her little sister when they go to live with her aunt and uncle. Penny's a Catholic, and worries about her uncle's soul. He's Jewish, progressive and a free thinker, a fair boss, and devoted to his family. He can be stern, so Penny also... Leer todo",1h 42min,El cielo se desploma
220,"7,3",['Maggie Greenwald'],['Maggie Greenwald'],"After being denied a promotion at the university where she teaches, Doctor Lily Penleric, a brilliant musicologist, impulsively visits her sister, who runs a struggling rural school in Appalachia. There she stumbles upon the discovery of her life - a treasure trove of ancient Scots-Irish ballads, songs that have been handed down from generation to generation, preserve... Leer todo",1h 49min,Songcatcher
221,"6,2",['Dein Perry'],DESCONOCIDO,Charismatic tap dancing Sean tries to find a way out of working at the steel mill. When failure brings him home he starts his own dance group wearing hardhats. He must then find inspiration in the steel mill he once tried to escape.,1h 35min,Bootmen
222,"5,6",['Sally Field'],['Jon Bernstein'],"Mona sacrifices everything, including family, in pursuit of a beauty pageant victory. Her friend Ruby helps her to an amazing degree.",1h 52min,Beautiful
223,"6,1","['Mariana Rondón', 'Marité Ugas']","['Mariana Rondón', 'Marité Ugas']",,1h 35min,A la medianoche y media
224,"7,3",['Thomas Bezucha'],['Thomas Bezucha'],"Big Eden is a small, fictional northwestern Montana town.",1h 58min,Big Eden
225,"6,4",['Julien Temple'],['Frank Cottrell Boyce'],Friendship and betrayal between two poets during the French Revolution.,2h 4min,Pandaemonium
226,"6,9",['Dominique Deruddere'],['Dominique Deruddere'],"Jean is a family man and factory worker who dreams of becoming a songwriter. Pinning his hopes on his teenage daughter, Marva, he takes her to singing contests in which the awkward and overweight girl struggles to belt out a tune. When Jean is suddenly fired because of cut backs, he is ashamed and even more desperate to have his daughter succeed. In a chance meeting J... Leer todo",1h 37min,Quiero ser famosa
227,"8,1",['Ljubisa Samardzic'],"['Srdjan Koljevic', 'Djordje Milosavljevic']","Belgrade during the height of the war Yugoslavia in 1999. Kaja struggles with daily destruction and the constant threat of being drafted, but also with his impending divorce from his wife Tijana, who wants to emigrate with their son.",1h 35min,Nebeska udica
228,"6,7",['Nicholas Hytner'],['Carol Heikkinen'],Un grupo de 12 adolescentes de diversos orígenes se inscriben en la Academia de Ballet Americano de Nueva York para convertirse en bailarines. Cada uno de ellos se enfrenta a los problemas y al estrés de progresar en el mundo de la danza.,1h 55min,El ritmo del éxito
229,"7,8",['Boaz Yakin'],['Gregory Allen Howard'],La verdadera historia de un entrenador afroamericano recién nombrado y su equipo de secundaria durante la primera temporada que juegan como una unidad racialmente integrada.,1h 53min,Titanes: Hicieron historia
230,"5,8",['Kathryn Bigelow'],"['Anita Shreve', 'Alice Arlen', 'Christopher Kyle']",Una fotógrafa que trabaja para el periódico investiga un doble homicidio en 1873 y descubre que su vida es paralela a la de un testigo de la tragedia.,1h 54min,El peso del agua
231,"6,6",['Sander Francken'],"['Sander Francken', 'Norman de Palm']",A local Dutch judge gets entangled in the mysterious past of his Antilian wife.,1h 35min,Papa's Song
232,"6,1",['Gergely Fonyó'],['Gergely Fonyó'],The adventures of a 30 year old retarded man living in Venice Beach.,1h 20min,Johnny Famous
233,"7,8","['Mark Benjamin', 'Danny Hoch']",['Danny Hoch'],"From the mind of Brooklyn actor, performance artist and hip-hop activist Danny Hoch, this film spins out the stories of ten lives shocked by globalization, the prison industry and life in general.",1h 30min,"Jails, Hospitals & Hip-Hop"
234,"5,8",['Stanley Bennett Clay'],DESCONOCIDO,"Sensing there is something terribly wrong at home, a young man drops out of college and tries to 'fix' his family.",1h 18min,Ritual
235,"6,3",['Françoise Prenant'],"['Françoise Prenant', 'Cécile Vargaftig']",,1h 48min,"Paris, mon petit corps est bien las de ce grand monde"
236,"6,7",['Karyn Kusama'],['Karyn Kusama'],Diana se entrena como boxeadora a espaldas de su padre y logra un éxito impresionante que abre nuevos caminos a las mujeres boxeadoras.,1h 50min,Girlfight
237,"6,0",['Joe Mantegna'],DESCONOCIDO,Film adaptation of David Mamet's comic play Lakeboat about a grad student who takes a summer job on a Great Lakes freighter and sees life through the eyes of his low-brow crew members.,1h 38min,El buque del lago
238,"6,8",['John Fawcett'],DESCONOCIDO,"Dos hermanas obsesionadas con la muerte, deben lidiar con las trágicas consecuencias cuando una de ellas es mordida por un hombre lobo.",1h 48min,Ginger Snaps
239,"6,4",['Rodrigo García'],['Rodrigo García'],Las vidas entrecruzadas de cinco mujeres de California que luchan por salir adelante con sus problemas personales.,1h 49min,Cosas que diría con sólo mirarla
240,"6,2",['Laurence Ferreira Barbosa'],"['Laurence Ferreira Barbosa', 'Bruno Guiblet', 'Yvonne Kerouedan']",The lives of three lonely people are loosely intertwined in this Parisian tale. Adolescent Marguerite (Lolita Chammah) combats her isolation through spiritual questing and occasional talks with God. Childless housewife Claire (Isabelle Huppert) negotiates a number of unwelcome erotic encounters while trying to determine if she is barren. And dissolute Jacques (Frédéri... Leer todo,2h 3min,La vie moderne
241,"5,9",['Lluís Josep Comerón'],['Lluís Josep Comerón'],"A Spanish cleaning lady arrives in Aix en Provence the same day her son is being judged for murder. The public defender does what is in her hands, but she cannot avoid a sentence to life imprisonment. The victim was his fiancée, a girl everyone in town knew. In a face-to-face meeting, the son tells his mother about his innocence. With the assistance of the public defe... Leer todo",1h 37min,La otra cara de la luna
242,"6,1",['Mehdi Charef'],['Mehdi Charef'],"Marie-Line works as a chief cleaner, at night, in a mall. She leads a team of 3-5 women, most of them being illegal aliens. Marie-Line is a hard woman with a golden heart, and she's in love with dead singer Joe Dassin. When her fascist husband walks out on her, whe tries to find love through ads.",1h 40min,Marie-Line
243,"7,0",['Juan Carlos Tabío'],DESCONOCIDO,"A desperate group of people wait at a rundown Cuban transit station for the next bus to arrive. The problem is, it never shows up. While a number of busses pass by the station, and others that are either full or at the end of the line stop by, it soon becomes obvious that the bus everyone was waiting for has left them high and dry. While one of the would-be passengers... Leer todo",1h 45min,Lista de espera
244,"5,2",['Benjamín Cann'],"['Jesús González Dávila', 'Sergio Schmucler']","In this deliciously kinky film that takes place in the wee hours of a Mexico City morning, long-absent Pedro returns to preside over his seriously bent family. But while Pedro is busy making love to his wife, their children Blanca, Teo and Marcos have different ideas about their father's return. Meanwhile, the neighbors are up to their own devices in a wickedly funny ... Leer todo",1h 49min,Crónica de un desayuno
245,"3,6",['Udo Blass'],['Udo Blass'],"A professor designing a machine designed to meet the naughtiest fantasies. In order to perfect the discovery, he performed tests on various subjects, aided by his assistant very appealing.",1h 20min,Sex Files: Sexual Matrix
246,"4,7",['Laurent Dussaux'],DESCONOCIDO,"Bruno Markham, director of pornographic films, tries to convince his producer Françoise to invest in an author's film, but she refuses on the pretext that the X is more profitable. His scenario obtains a significant subsidy.",1h 37min,Le coeur à l'ouvrage
247,"6,1",['Daniel Calparsoro'],"['Daniel Calparsoro', 'Frank Palacios', 'Santiago Tabernero']","Three young and desperate inhabitants of Madrid attempt to rise above their circumstances by any means available to them in that sun-drenched city. This tight-knit trio must scramble when their hasty plans become derailed by a demanding matriarch, an abusive older brother, and the entire corrupt underclass with which they deal.",1h 30min,Asfalto
248,"5,5",['John A. Gallagher'],"['Steve Carducci', 'John A. Gallagher']",A young couple from the city takes a trip to the country.,1h 29min,Hechizo de luna
249,"7,2",['Mimi Leder'],"['Catherine Ryan Hyde', 'Leslie Dixon']",Un niño intenta hacer del mundo un lugar mejor después de que su maestro le da esa oportunidad.,2h 3min,Cadena de favores
250,"6,4",['José Zaragoza'],"['Leopoldo Serran', 'José Zaragoza']","A group of friends in Sao Paulo see each other regularly in different venues of this huge metropolis, and act as their own de-facto family. They are similar in many ways, all upper middle class professionals between 28 and 32 years of age, and very conscious of their psyche and lives. The diversity within the group however, is also remarkable. It's made up about half ... Leer todo",1h 50min,Até que a Vida nos Separe
251,"7,3",['Eli Frankel'],"['Eli Frankel', 'Joubin Mortazavi']",Five former friends are brought together by the death of an old friend for a final weekend trip to Las Vegas on the weekend before college graduation.,1h 45min,21
252,"1,8",['Patrick Sébastien'],['Patrick Sébastien'],"Zef, twenty years old, is a simple-minded man who can only say one word: ""love you"". Always happy, loving everyone, he lives with his sister Sophie on a farm in the Lot. Attracted by the sad smile of Marie, he rapes her one evening without realizing the gravity of her act. Internal in a psychiatric asylum, Zef falls into a deep silence. Hugues, a doctor with avant-gar... Leer todo",1h 30min,T'aime
253,"6,0",['Conor McPherson'],['Conor McPherson'],"An Irish-Italian café owner in a seaside town faces a life crisis: his wife has recently died and he's severely in debt. His oldest son tries to help, but he has his own serious problems; his younger son and daughter, meanwhile, are having troubles in school.",1h 37min,A por todas
254,"7,7",['Carlos Siguion-Reyna'],['Eric Ramos'],"12-year-old Lily lives with her father, who has been suspended from the police force, and her stepmother. Her parents sell Lily's aging dog to Mr. Teban for dog meat. Lily convinces Mr. Teban to return her dog, then begins a friendship with the dog-meat seller, much to the disgust of her family and friends. Mr. Teban becomes her surrogate father, and supports Lily aga... Leer todo",1h 58min,Azucena
255,"7,2",['Anh Hung Tran'],['Anh Hung Tran'],"With the brilliant Vietnamese summer as a setting Vertical Ray of the Sun is beautiful from beginning to end. The plot centres around three sisters, two of whom are happily married (or so it appears). The youngest sister is single and living with her cute older brother, whom she is desperately in love with. A second sister is married to a man who has another woman and... Leer todo",1h 52min,Pleno verano
256,"6,7",['Robert Lepage'],DESCONOCIDO,"A man lives in parallel worlds, falling in love with the same woman, while the police hunt down a serial killer who steals brains.",1h 33min,Possible Worlds
257,"5,4",['Eugene Jarecki'],['Eugene Jarecki'],"Patty, a victim of domestic abuse, meets her match in Tommy, a former boxing hopeful looking for a new star to put in the ring. But he never could have imagined it would be Patty.",1h 30min,The Opponent
258,"5,7",['Rodolfo Durán'],['Eduardo Leiva Muller'],"Esteban is a journalist who is escaping to the northern border. In the Buenos Aires of 1978, his life is in danger. The threats after one of his articles in the newspaper and his own inner conflicts push him to run away. But crossing the border is impossible. He comes back to a village near the frontier, where he stays at Father Gabriel's, a priest with ideas and atti... Leer todo",1h 30min,Cerca de la frontera
259,"7,6",['Léon Desclozeaux'],DESCONOCIDO,"Moti, a 12-year-old Bengali boy, tells us about his country and how his life has been profoundly influenced by a chance encounter with Paul Danvin, a French ship captain. Paul is in the depths of depression. He has recently watched helplessly as a bunch of pirates looted and set fire to his ship, The Alhambra. He ends up in Chittagong, Bangladesh. Without the ship, th... Leer todo",1h 22min,Chittagong: Dernière escale
260,"5,3",['Juan Pinzás'],['Juan Pinzás'],"First-ever Spanish Dogma Film. An acid psychosocial-sexual comedy tells the story of a group of friends from university who, ten years after finishing their journalism studies, decide to meet up again in one of their friends' homes to revisit past times. Up until now, they have all done well in life and should be happy, but they aren't. A weekend will be more than eno... Leer todo",1h 33min,Érase otra vez
261,"5,3",['David Lipszyc'],"['David Lipszyc', 'Juan Carlos Onetti', 'Ricardo Piglia']","To the ruins of an Argentinean town arrives Larsen as general manager of the shipyard, that is the source of income of that place.",1h 28min,El astillero
262,"5,5",['Hans Kristensen'],"['Jane Aamund', 'Stellan Olsson']",The strong willed independent Juliane Jensen has been married to her husband Otto for five years after her previous husband Simon took his own life due to a severe depression. The Blacksmith Otto fights in the new union for better conditions for the common worker. There are forbidden erotic thoughts in almost every small ally and Juliane has to give her best to keep h... Leer todo,1h 40min,Juliane
263,"7,1",['Takeshi Kitano'],['Takeshi Kitano'],"Un mafioso japonés se ve exiliado a Los Ángeles, donde vive su hermano con una pequeña pero respetable banda multirracial, a la que inspira para expandir su influencia.",1h 54min,Brother
264,"6,1",['Aziz Mirza'],"['Sanjay Chhel', 'Raaj Kumar Dahima', 'Manoj Lalwani']","In order to seek justice for a man who exacts vengeance on a politician, who was responsible for his daughter's death, two rival reporters teams up to help him to prove his innocence.",2h 40min,Phir Bhi Dil Hai Hindustani
265,"4,3",['Cybil Richards'],['Louise Monclair'],"When three women get cheated on by their husbands they decide to get even and open up The Mistress Club, where seduction is the name of the game and forbidden sex is the natural outcome.",1h 13min,The Mistress Club
266,"7,2",['Rainer Kaufmann'],"['Ralf Hertwig', 'Ingrid Noll', 'Kathrin Richter']","Love story spanning 60 years of the lives of Charlotte and Hugo. As a teenager before the war she is in love with him, but he marries her sister. They share some brief happy moments during the difficult post-war period, then they are separated for the longest time. They meet again as 80-year olds.",2h 4min,Kalt ist der Abendhauch
267,"6,9",['Greg Berlanti'],['Greg Berlanti'],An insight into the turbulent lives and loves of a gay clique based in Los Angeles.,1h 34min,El club de los corazones rotos
268,"7,9",['Kamal Haasan'],"['H. Banerjee', 'Kamal Haasan', 'Manohar Shyam Joshi']",Saketh Ram's wife is raped and killed during direct action day riots in Calcutta. He is convinced that Mahatma Gandhi is responsible for all the problems happening in the country and sets out to kill him.,3h 6min,Hey Ram
269,"9,1",['Julián Hernández'],"['Roberto Fiesco', 'Julián Hernández']","Bruno, a young prostitute on the streets of Mexico city, spends his free time yearning for his straight friend Umberto. When Umberto rejects him, Bruno reacts with his own violent and misguided actions...",50min,Hubo un tiempo en que los sueños dieron paso a largas noches de insomnio...
270,--,['Sophie Blondy'],['Sophie Blondy'],,1h 26min,Elle et lui au 14ème étage
271,"4,4",['Brian Yuzna'],DESCONOCIDO,"Un hombre vende su alma al diablo para obtener superpoderes y vengar la brutal muerte de su novia. Al darse cuenta de que el precio es el alma de su nuevo interés amoroso, se vuelve contra el diablo.",1h 41min,Faust: La venganza está en la sangre
272,"6,0",['Gregory Mosher'],['William Wheeler'],"A telesales con man finds the ultimate racket, but starting an affair with the girlfriend of his guru-like boss might be the wrong call.",1h 38min,Estafadores
273,"5,4","['Jed Mortenson', 'Richard Speight Jr.']",['Casey Peterson'],"News of a slacker's infidelity spreads like wildfire throughout a tight knit San Francisco neighborhood, leading the man to retrace his steps and win back his girlfriend.",1h 18min,North Beach
274,"6,1",['Marc Forster'],"['Adam Forgash', 'Catherine Lloyd Burns', 'Marc Forster']",The story of a Californian couple expecting a child and their group of friends confronted with the tragedy of a big loss.,1h 27min,Un grito en la noche
