,Puntuacion_IMDB,Dirección,Guionistas,Argumento,Duración,Nombre de la película
0,"6,3",['Takashi Miike'],"['Toshiki Kimura', 'Seishu Hase']","When Brazilian-Japanese Mario is unleashed from jail, he sets out to rescue his beautiful Chinese girlfriend, Kei, from being deported to Japan.",1h 43min,Hyôryû-gai
1,"6,7",['Esteban Schroeder'],"['Esteban Schroeder', 'Pablo Vierci']","A Montevideo journalist discovers that the murder of a boy from the slums near the vineyards had political reasons, and was not an isolated incident. Developing a friendship with the victim's older brother, and then the entire family, the journalist tries to get to the bottom of this case. It is not the only case of summary executions of young poor boys in this vineya... Leer todo",1h 27min,El viñedo
2,"5,7","['Fow Pyng Hu', 'Brat Ljatifi']","['Fow Pyng Hu', 'Brat Ljatifi']","Jacky is a Chinese kid aged 25 of emigrant parents who lives in a terraced house in Eindhoven with his mother. He grew up in the vacuum between two cultures. He is intelligent but lacks the energy to steer his life in a specific direction. Jacky's calm life is disrupted when his mother urges him to marry a girl from China, following tradition, and leave the parental h... Leer todo",1h 20min,Jacky
3,"6,9",['Gustavo Balza'],"['Gustavo Balza', 'Armando Coll']",,1h 31min,Caracas amor a muerte
4,"6,9",['Shaan Shahid'],['Pervez Kalim'],"Maima splits up with Razi because of his second marriage and goes to Hong Kong to give birth to their son Zain. When Zain grows up, he happens to fall for Chand, Razi's daughter with his second wife, and their past returns to haunt them.",--,Mujhe Chand Chahiye
5,"6,5",['Moufida Tlatli'],DESCONOCIDO,"The gulf between men and women in Tunisia, political, psychological, and physical, is explored in this downbeat drama. A woman and her two daughters return to the female community on the island of Djerba from Tunis, where her husband works.",2h 2min,Se casó con todo
6,"7,1",['Jerzy Stuhr'],"['Krzysztof Kieslowski', 'Kazimierz Orlos']","Left behind by a circus, a camel wanders to the house of a simple middle-aged couple. Although the wife is initially bewildered by the strange and unexpected animal, her husband immediately adopts it as a pet. As the man and his new companion take their daily walks in the village, neighbors are drawn to the odd sight and approach him about riding the camel or using it... Leer todo",1h 13min,Duze zwierze
7,"6,8",['Samira Makhmalbaf'],"['Mohsen Makhmalbaf', 'Samira Makhmalbaf', 'Zaheer Qureshi']","Itinerant Kurdish teachers, carrying blackboards on their backs, look for students in the hills and villages of Iran, near the Iraqi border during the Iran-Iraq war. Said falls in with a group of old men looking for their bombed-out village; he offers to guide them, and takes as his wife Halaleh, the clan's lone woman, a widow with a young son. Reeboir attaches himsel... Leer todo",1h 28min,La pizarra
8,"6,4",['Óscar Urrutia Lazo'],['Óscar Urrutia Lazo'],"The adventure of a young photographer in the Mexican jungle, searching for his lost shadow, stolen by an old Indian witch.",1h 50min,Rito terminal
9,"7,5",['Per Fly'],"['Kim Leona', 'Per Fly']",Kaj is an alcoholic living on the money the Danish state is providing him. Him and his friends spend their time drinking beer at a public bench. One day Kaj's life turns upside down when a young lady and her child moves in next to him.,1h 33min,Bænken
10,--,DESCONOCIDO,DESCONOCIDO,Desconocido,--,Error nombre para la pelicula con id: tt0244884
11,"8,2",['Wen Jiang'],DESCONOCIDO,Villagers in World War II China are unsure what to do with the two enemy prisoners who have been left in their care.,2h 19min,Los demonios en mi puerta
12,"7,4",['Márta Mészáros'],"['Márta Mészáros', 'Éva Pataki']","Marta Meszaros, Hungarian filmmaker, returns to her childhood home in Kyrgyzstan. The filmmaker recreates a fiction around the life of her parents in this film entirely devoted to the cult of memory",1h 44min,Kisvilma - Az utolsó napló
13,"3,5",['Robbie Moffat'],DESCONOCIDO,"A businessman puts his credit cards and briefcase in the trunk of his car, gets wildly drunk and wakes up to find a girl and nothing else.",1h 32min,Love the One You're With
14,"4,9",['Rodney Gibbons'],['Terry Abrahamson'],The murder of the ex-wife of Dr. Sam Dennis Charney (Rutger Hauer) leads Detective Della Wilder (Pam Grier) to uncover a series of women's murders somehow linked to a big pharmaceutical company.,1h 30min,Cómplices
15,"5,2",['Alain Mazars'],"['Alain Mazars', 'Caroline Silhol']","Anne Laugel, a young divorced woman, mother of a ten-year-old girl, Sophie, travels to China to adopt a baby. She is convinced, as a good Westerner, to carry out this adventure for the happiness of the new born, her daughter and hers.",1h 37min,La moitié du ciel
16,"5,6",['Waldemar Dziki'],DESCONOCIDO,,1h 36min,Pierwszy milion
17,"7,4",['J.R. Jarrod'],['J.R. Jarrod'],A rape accusation against the president of a student political coalition brings war to its members.,1h 30min,Divided We Stand
18,"7,8",['Rory B. Quintos'],DESCONOCIDO,"Filipina Overseas Contract Worker is forced to leave her family and take a higher-paying job in a more-prosperous Asian country, unaware of her husband's death.",2h 15min,Anak
19,"6,8",['Vivian Chang'],['Vivian Chang'],"Three almost unconnected chapters that can be read either as separate stories or as three stages of a woman's life, this quietly moody drama effectively reflects on alienation and solitude within families and relationships.",1h 36min,Xiao bai wu jin ji
20,"6,7",['Mark Herman'],"['Mark Herman', 'Jonathan Tulloch']",Two teenage boys will do anything to get money to buy season tickets for their local team.,1h 39min,¡Qué pasada!
21,"6,4",['Marco Petry'],"['Marco Petry', 'Stefan Wood']","The last weeks of school have begun; before graduation, the boys catch their last chance to really have fun with friends and all the girls. From the life of a group of school pupils in a small town- the last days before real life begins",1h 39min,Schule
22,"5,2",['Anders Rønnow Klarlund'],['Anders Rønnow Klarlund'],"A policeman, Niels, lost his wife eight years ago in a traffic accident. Niels was driving the car. Ever since he has been tormented by grief and guilt. A case about a small girl who has escaped from a psychiatric hospital opens up old wounds. A series of coincidences leads Niels to believe that his wife has been reborn in order to avenge her death. Can he believe the... Leer todo",47min,Ved verdens ende
23,"5,8",['Nadir Moknèche'],['Nadir Moknèche'],"In Algiers in 1993, while the civil war is starting, Mrs Osmane's tenants have to endure her bad temper. Her husband left her and the fear to lose her respectability haunt her. The former member of the Resistance during the Independence War persists in controlling the slightest moves of the households rather than struggle against her own frustrations. Learning her dau... Leer todo",1h 40min,El harén de Madame Osmane
24,"6,6",['Harry Sinclair'],['Harry Sinclair'],"Lucinda, Rob and their 117 cows lead a charmed existence in a magic land. He milks, she's the honey. But Lucinda is worried that their happiness cannot last. She tests their love with a game of sabotage that threatens to curdle everything.",1h 27min,El precio de la leche
25,"6,3",['Gordon Eriksen'],DESCONOCIDO,A subject perfect for a sleazy talk show turns into something much deeper as the participants of a documentary become aware of the filmmaker's purpose.,1h 24min,The Love Machine
26,"6,1",['Ebrahim Forouzesh'],['Ebrahim Forouzesh'],"Mamal, an 11 year old boy tries to help his family ta make a living.",1h 25min,Mard-e Koochak
27,"6,8",['Isao Morimoto'],['Isao Morimoto'],"Boku (Edward Atterton), is a foreign student in Japan, who wants to assimilate with a polite Kyoto society but finds himself rejected as a outsider. Undaunted, he volunteers to read books to a young blind woman (Honami Suzuki) and begins to find acceptance with the beautiful Kyoko. She chooses classic Japanese literature for their sessions until one day she has him re... Leer todo",2h 2min,Ichigensan
28,"5,0",['Raj Kanwar'],DESCONOCIDO,"Having witnessed his family being massacred during a riot in his village, Badal is raised by a terrorist and sets out to exact revenge on the police officer responsible for his family's murder.",2h 46min,Badal
29,"5,1",['David Dhawan'],['Rumi Jaffery'],"Sapna has lost her parents at an early age and lives with her three quirky uncles - Bhola Nath is a fitness freak, Prabhu Nath is a deeply religious fellow and Vicky Nath is a disco-savvy dude. Sapna is fed up of their quirks and runs away to Europe where she meets Raja. Her purse is stolen and hence she has to depend financially on Raja. During the course of the tour... Leer todo",2h 38min,Dulhan Hum Le Jayenge
30,"7,3",['Puri Jagannadh'],DESCONOCIDO,"Badri (Pawan Kalyan) is an ad agency director whose parents are settled in the USA. He has a love called Vennela (Renu Desai), who is a close family friend of Badri's family. Their parents want these two to tie the knot.",2h 38min,Badri
31,--,['Jean-Michel Gibard'],['Sarah Ambos'],"Alex is a happy man. Right arm of his father-in-law, CEO of a large multinational, his rise seems irresistible. To get rid of this cumbersome son-in-law, he has a compromising photo montage that accuses Alex of adultery.",1h 30min,Le margouillat
32,"6,5",['Otto Alexander Jahrreiss'],"['Markus Hoffmann', 'Otto Alexander Jahrreiss']","A Rumanian call-girl in Germany is spied on by her neighbor, who blackmails her clients, and acts as her ministering angel, against her wishes. They need lots of money to finance her escape from the underworld.",1h 41min,Zoom
33,"7,1",['Khosrow Sinai'],"['Hamid Farrokhnezhad', 'Khosrow Sinai']",Ahlam who is studying medicine in the college is in love with Dr. Parviz and wants to marry him. But according to her tribe's laws and traditions she must marry her cousin Farhan. She decides to face her family and find a solution.,1h 53min,Arous-e atash
34,"7,1","[""Leung Chun 'Samson' Chiu""]","[""Leung Chun 'Samson' Chiu"", 'Kwun Hung Siu']","From Singapore to Hong Kong to Macau, 3 different women with different lives experience the same situation of falling in love with 2 men and how they deal with the dilemma. In Singapore, meet Joy who's torn between her boss and an idealistic baker. In Hong Kong, Cherry dreams of the strong, macho type but also wants the sweet, sensitive New-Age guy. In Macau, Cecilia ... Leer todo",1h 55min,Yüeliang de mimi
35,"5,9",['Rachel Samuels'],"['Robert Louis Stevenson', 'Lev L. Spiro']","A man joins a secret club for those who are seeking to end their lives, only to rediscover his will to live upon meeting the club's only female member.",1h 29min,The Game of Death
36,"7,2",['Amir Muhammad'],['Amir Muhammad'],"Malaysia's first digital film is an urban comedy set during one day in Kuala Lumpur. It features four entwined stories about desire, where people's paths cross in unexpected ways. A suicidal young man mourns the death of his step-mother, who had come into fatal contact with an apple. A bubbly DJ on the eve of her wedding catches her fiance in an unexpected sexual enco... Leer todo",1h 37min,Lips to Lips
37,"6,8",['Teck Tan'],['Teck Tan'],"Harry Lee returns home to Malaysia from overseas studies. He has failed everything and is kicked out of home by his father, a disgrace. He forms a dance band with Yati, his childhood friend. Harry is Chinese by race and does not believe in god. Yati is a modern Malay and Muslim who believes in her heritage and religion. The five members of this band (Malay, Chinese, I... Leer todo",1h 30min,Spinning Gasing
38,"4,8",['Aleksi Mäkelä'],['Venla Mäkelä'],"Jussi, a career criminal, gets doublecrossed by his girlfriend after robbing a jewelry store. Twelve years later he's married with 2 children and working as a dentist. On his family vacation to Spain his past comes to haunt him as he runs in with the woman who betrayed him all those years ago.",1h 25min,Lomalla
39,"6,1",['Alejandro Agresti'],"['Alejandro Agresti', 'Pedro Mairal']","In Curuguazu, located in the Argentinian countryside, seventeen year-old Daniel Montero has been raised by his grandmother for three years since the death of his parents in a car accident. Daniel has a boring life, working in a poultry processing plant and meeting his friends in the square to make small talk. He saves some money from his salary and buys an old televis... Leer todo",1h 40min,Una noche con Sabrina Love
40,"6,5",['Daniel Burman'],"['Daniel Burman', 'Emiliano Torres']","In 1999, Argentina's peso craters. Ariel, a young man from Buenos Aires' Jewish community, deals with his mother's fatal illness, finds a job as a night shift surveillance camera monitor, and wonders when he'll discover sex. Santamaria, middle aged, loses his bank job and is dismissed by his wife; he finds stolen wallets in dumpsters to return to their owners. Ariel t... Leer todo",1h 38min,Esperando al mesías
41,"6,0",['Khalid Mohamed'],"['Khalid Mohamed', 'Javed Siddiqui']",In 1993 Fiza's brother Aman disappears during the riots in Mumbai. In 1999 Fiza is tired of waiting and goes looking for him.,2h 50min,Fiza
42,"5,0",['Sonia Fritz'],DESCONOCIDO,"A story of romance and suspense in Puerto Rico, year 2006. Angela, star reporter of Teledigital TV Network, is married to Armando and they have an 8-year old son, Ivan. When their marriage fails, Armando kidnaps Ivan and takes him to the United States, but Angela, aided by Pedro, a lawyer, recovers her son in the end. The outcome of their love story remains open to th... Leer todo",1h 31min,El beso que me diste
43,"5,8",['Ted Grouya'],['Ted Grouya'],A beautiful woman must choose between the guy who says he loves her and the life-long friend who shows her how she deserves to be treated.,1h 29min,Jerks
44,"5,2",['Dmitriy Astrakhan'],['Artur Brauner'],,1h 31min,Kasachstan Lady
45,"5,4",['Slava Tsukerman'],"['Nikolai M. Karamzin', 'Sophia Romma']",A beautiful peasant girl is romanced and abandoned by a young nobleman.,1h 45min,Poor Liza
46,"6,9",['Christian Petzold'],"['Harun Farocki', 'Christian Petzold']",Clara and Hans are left-wing terrorists who have been sought by police for almost fifteen years. Their increasingly rebellious daughter begins to pose a threat to their security when she falls in love with a boy she meets on the beach.,1h 46min,Die innere Sicherheit
47,"7,1",['Julian Schnabel'],DESCONOCIDO,La vida del poeta y novelista cubano Reinaldo Arenas.,2h 13min,Antes que anochezca
48,"6,1",['Serge Le Péron'],['Serge Le Péron'],"François Marcorelle, an investigation magistrate in Chambéry, finds himself in the room of a young Polish girl that he met in a restaurant.",1h 36min,L'affaire Marcorelle
49,"7,9",['Fabián Bielinsky'],['Fabián Bielinsky'],"Dos estafadores intentan jugársela a un coleccionista de sellos vendiéndole una hoja de sellos raros falsificados (las """"Nueve Reinas"""").",1h 54min,Nueve reinas
50,"7,1",['András Surányi'],"['Ilona Dr. Nagy', 'Miklós Mészöly', 'András Surányi']",,1h 35min,Film...
51,"5,8",['Donald Crombie'],"['Rob George', 'Kate Fawkes', 'David Marlow']","A troubled, lonely teen gets a new lease on life when he comes upon a group of selkies, mythical people with the power to change into seals.",1h 28min,"Selkie, soy una foca"
52,"6,8",['Alain Ross'],"['Virginie Chanu', 'Alain Ross']",,1h 15min,L'attrape-rêves
53,"6,1","['Charles de Meaux', 'Philippe Parreno']","['Philippe Parreno', 'Charles de Meaux']",,1h 14min,Le pont du trieur
54,"7,7",['Peter Hyoguchi'],"['Duffy Hecht', 'Peter Hyoguchi']",Thirteen-year-old Tessa faces more than the usual tribulations of adolescence.,1h 31min,"First, Last and Deposit"
55,"7,0",['Mia Trachinger'],['Mia Trachinger'],"After fleeing a war-torn country, a couple finds that their only means of survival is to don giant bunnysuits to make a living.",1h 28min,Bunny
56,"7,6",['Rajiv Menon'],"['Jane Austen', 'Rajiv Menon', 'Sujatha']","An Indian adaptation of Jane Austen's ""Sense and Sensibility"" focusing on two sisters of opposing temperaments.",2h 31min,Kandukondain Kandukondain
57,"8,3",['Mani Ratnam'],DESCONOCIDO,"After a difficult romance in a class-divided society, the love birds find out marriage is not what they thought it would be.",2h 36min,Alai Payuthey
58,"7,3",['Achero Mañas'],"['Achero Mañas', 'Verónica Fernández']",Un pequeño de 12 años sufre maltrato físico en casa de manos de su padre alcohólico.,1h 28min,El Bola
59,"5,2",['Kornél Mundruczó'],"['Sándor Zsótér', 'Viktória Petrányi', 'Kornél Mundruczó']",A young man lives in rural Hungary with his girlfriend Mari. Also on the scene is her homosexual brother. Mari doesn't know that when the two men go to work in the city they raise cash by turning tricks and burglarizing houses. A love triangle begins...,1h 20min,Nincsen nekem vágyam semmi
60,"6,1",['Helena Taberna'],"['Patxi Amezcua', 'Andrés Martorell', 'Helena Taberna']",A former terrorist living in exile endangers her life when she returns to Spain with her family.,1h 44min,Yoyes
61,"6,6",['Pierre Salvadori'],DESCONOCIDO,"Paris today, a working-class neighbourhood, a square. Two bars stand facing each other as they would in the main street of a town in the Far West. Marie is 25 years old and has come back to Paris after a long absence in search of her brother, Antoine. She finds a young man who has changed. He hangs out with a rough crowd and is killed soon afterwards in circumstances ... Leer todo",1h 42min,Les marchands de sable
62,"5,2",['Jon Gunn'],"['Jon Gunn', 'John W. Mann']","Estranged twin brothers - one a con man, the other an Episcopal deacon - accidentally switch places... and find God in the process.",1h 46min,La calle del perdón
63,"4,8","['Mike Tristano', 'Frank Zagarino']","['Terry Cunningham', 'David Dadon', 'Mark Anthony Galluzzo']",A wrongfully sentenced man is given a chance at freedom in exchange for the safe delivery of stolen diamonds.,1h 29min,Never Look Back
64,"6,4",['Gerrard Verhage'],"['Ger Beukenkamp', 'Pieter Nouwen']",A wealthy former art dealer and professional classical singer Edward Schneider gets his one chance to perform the part of Jesus Christ in the St. Matthew Passion by Johan Sebastiaan Bach. This is a great opportunity for him and together with his musical companion Jan Wynands he prepares himself of this onerous assignment. Soon it becomes clear that he is unable to per... Leer todo,--,Het negende uur
65,"7,5",['Edward Holub'],['Edward Holub'],"Eve is torn between her ex-boyfriend Charlie, just released from jail, and her new boyfriend Slim, a drug dealer. In order to gain her freedom from both men, she plans a risky double-cross that may put all their lives in jeopardy.",1h 20min,Night Runs Red
66,"5,8",['Jaime Chávarri'],"['José Ángel Esteban', 'Carlos López', 'Manolo Matji']","En 1965, tres estudiantes de medicina son enviados por sus familias a Cádiz con la esperanza de aprobar el curso. Todo cambia para todos ellos y para su propio futuro al compartir un chalet y al conocer bailarinas de un club nocturno.",1h 41min,Besos para todos
67,"6,3",['Yôichi Higashi'],"['Yôichi Higashi', 'Tetsujirô Yamagami']","A 29 year old graphic designer named Koji goes back to his hometown to attend his father's funeral, as well as mentor his 14 year old nephew Takuya who has recently been arrested. Koji feels he can reach Takuya, who he believes may share similar problems as Koji once had. Takuya though resists all efforts from Koji .",1h 56min,Boku no ojisan
68,"4,7",['Edgar Honetschläger'],['Edgar Honetschläger'],"The director chronicles his last trip to Japan with his girl friend (Yukika Kudo), an attempt at Eastern and Western observations.",1h 19min,L + R
69,"8,2",['Priyadarshan'],DESCONOCIDO,Tres hombres desempleados buscan respuestas a todos sus problemas de dinero. ¿Sabrán qué hacer cuando llegue la oportunidad?,2h 36min,Hera Pheri
70,"6,1",['Jan Verheyen'],"['Jean van de Velde', 'Mischa Alexander', 'Bart De Pauw']",La historia se centra en un grupo de amigos que han estado jugando juntos al fútbol durante más de 10 años y que ahora están preparándolo todo para su partido número 500.,1h 45min,Team Spirit
71,"3,8",['Jesper Jargil'],"['Jesper Jargil', 'Niels Vørsel', 'Lars von Trier']","A documentary that closely examines ""Psychomobile 1"", a theater project Lars Von Trier coordinated in 1996. 53 actors spent two months in a 19-room art museum improvising characters while Von Trier choreographed their moods and movements through a series of traffic lights.",1h 21min,De udstillede
72,"4,7",['Kelley Cauthen'],['Leland Zaitz'],"Two roommates take a roadtrip to Malibu hoping to attend a sorority party. However, their journey is filled with many distractions.",1h 26min,Destino Malibú
73,"5,8",['Bart Patton'],DESCONOCIDO,"Dramatisation of Harold Morris's book based on his own life as a racist who is falsely imprisoned, but turns his life around, becoming friends with a black man and winning an humanitarian award.",1h 30min,Unshackled
74,"4,9",['Jeremy Stein'],['Jeremy Stein'],"Un fotógrafo tiene una sola noche para encontrar diez fotografías mágicas o, de lo contrario, se arriesga a perder todo lo que es importante para él.",1h 31min,The Photographer
75,"6,9",['Jean-Pierre Sinapi'],"['Anne-Marie Catois', 'Jean-Pierre Sinapi']",A sexual revolution starts in an internment center when an empathetic caretaker takes seriously the claim of a quadriplegic rude and nasty man to visit a prostitute. Should we all be granted sexual rights?,1h 30min,Nacional 7
76,"7,3",['Lasse Hallström'],"['Joanne Harris', 'Robert Nelson Jacobs']","Una mujer francesa y su joven hija abren una chocolatería, en un pequeño y remoto pueblo, que sacude la rígida moral de la comunidad.",2h 1min,Chocolat
77,"7,3",['Masahiro Tsuchihashi'],['Masahiro Tsuchihashi'],"Kyoko, the heroine, receives a surprise visit from her ex-boyfriend Shunichi after a lapse of four years. Shunichi has decided to commit suicide and asks Kyoto to die with him. Kyoto agrees because she has been suffering from the conflict between her inner search for freedom and her inescapable role as her politician father's second secretary. Kyoko and Shunichi make ... Leer todo",3h 2min,Truths: A Stream
78,"7,1",['Heikki Kujanpää'],"['Veli-Pekka Hänninen', 'Annakaisa Sukura']","In a religious rural community in the 1950s, Ritva, a young woman has kept her pregnancy a secret. Helped by her sister, she gives birth but soon abandons the baby. The next day the infant is brought to the hospital where Ritva works. Troubled with shame, Ritva finds consolation from a dying priest.",1h 2min,Pieni pyhiinvaellus
79,"5,0",['Drahomíra Vihanová'],DESCONOCIDO,There is one thing that cannot be tolerated in Europe - love between a white woman and a Romanian man. There is no place for them to live and be happy. How do these two best friends and students react to this racial discrimination?,1h 35min,Zpráva o putování studentu Petra a Jakuba
80,"6,4",['Clemens Klopfenstein'],['Clemens Klopfenstein'],"A group of actors and actresses travels through Italy and is expected in Rome. Caroline Redl loses her way in a forest while reciting the lines, ""If I dress as a soldier, they will think of me as a soldier."" Spoken in the twilit forest, the text attains a tremendous self-evident truth, and Shaw's 'Joan of Arc' becomes a young woman of today, stripped of all historical... Leer todo",1h 25min,WerAngstWolf
81,"6,2",['Daniel Cebrián'],DESCONOCIDO,,1h 36min,Cascabel
82,"6,1",['Harold Trompetero'],"['Claudia Liliana García', 'Harold Trompetero']","Based on a series of episodes aimed as ensuring the director to exorcise the defects, fears and phobias circulating about the world of ordinary love. There are 35 stories developed at an average of two minutes of that structure this film¸ an attempt to explain the failure of marriage in the manner of a puzzle that is organized in the course of the plot.",1h 20min,Diástole y sístole: Los movimientos del corazón
83,"6,7",['Sébastien Lifshitz'],DESCONOCIDO,"Mathieu, de 18 años, pasa el verano en la casa de verano de su madre, en Bretaña. En la playa, conoce a Cédric, un chico de su edad. Empieza una historia de amor entre los dos chicos.",1h 40min,Primer verano
84,"6,7",['Laurent Firode'],['Laurent Firode'],"How, thanks to what's known as the ""Butterfly theory"" (a random series of unlinked events), can a young woman and a young man meet ?",1h 30min,Le battement d'ailes du papillon
85,"6,4",['Rob Morrow'],DESCONOCIDO,An artist with Tourette Syndrome falls in love with his best friend's pregnant girlfriend.,1h 37min,Maze
86,"7,1",['Pavel Lungin'],"['Aleksandr Galin', 'Pavel Lungin']","The beautiful Tanya returns to her small mining town, after supposedly working as a model in Moscow. She decides to marry her shy school sweetheart Mishka, who now works in the mine. The miners finally receive some pay, but Mishka still ends up with no money to buy his bride a gift, so he seeks the help of his perpetually drunk buddy Garkusha. Mishka's poor working-cl... Leer todo",1h 54min,La boda
87,"5,5",['Tibor Klöpfler'],['Tibor Klöpfler'],,1h 38min,El niño
88,"6,7",['András Fésös'],"['András Fésös', 'Gábor Németh']",,1h 31min,Balra a nap nyugszik
89,"8,1",['Edward Yang'],['Edward Yang'],Cada miembro de una familia de clase media de Taipei busca reconciliar las relaciones pasadas y presentes en su vida diaria.,2h 53min,Yi yi
90,"6,1",['Higuchinsky'],DESCONOCIDO,The inhabitants of a small Japanese town become increasingly obsessed with and tormented by spirals.,1h 30min,Uzumaki
