275,"6,3",['Taylor Hackford'],"['Tony Gilroy', 'William Prochnau', 'Thomas Hargrove']","Alice contrata a un negociador profesional para conseguir liberar a su marido, que ha sido secuestrado por las guerrillas antigubernamentales de América del Sur.",2h 15min,Prueba de vida
276,"4,8",['P. David Ebersole'],DESCONOCIDO,"Kalib is ready for one of the fights of his life, he's going up for boxings Lightweight Championship Title of the world, but when trouble erupts-his life takes an awkward turn. Kalib who was a child from an abusive home, decides to dedicate his life to saving abused children. This decision changes his life, his wife's life, and the people around him.",1h 21min,Fuera de combate
277,"6,4",['Caroline Vignal'],"['Olivier Gorce', 'Caroline Vignal']","In this coming of age drama, a teenage hairdresser apprentice looking to lose her virginity befriends classmate that give her advice about sex. When she falls for a guy in school, she begins to learn the lay of the land.",1h 36min,Les autres filles
278,"5,5",['Chuck Parello'],['Stephen Johnston'],"The story of Ed Gein, who dug up the corpses of over a dozen women and made things out of their remains before finally shooting two people to death and butchering their bodies like beef sides.",1h 29min,Ed Gein
279,"7,2",['Bob Giraldi'],"['Rick Shaughnessy', 'Brian S. Kalata']","At a popular NYC Italian restaurant on a dramatic, busy evening, there are 2 gangsters, cop detective, food-critic, ex bookmaker owner, his chef son, indebted gambler sous-chef etc.",1h 39min,Dinner Rush
280,"6,8",['Alice Nellis'],['Alice Nellis'],"Alice Nellis's small-scale debut tragicomedy spotlights small-town elections. The protagonist, a university student name Jana (Theodora Remundová) who is trying to solve a troubled relationship with a married man, takes her mother's place on the election commission. In the meantime the mother (Iva Janzurová) is going through her own small domestic crisis with her husb... Leer todo",1h 44min,Ene bene
281,"7,0",['Jean Odoutan'],['Jean Odoutan'],A poor Beninoise corn farmer wanting to break out of his deep misery buys a shaky Peugeot 504 and tries his hand at being a bush cabdriver.,1h 26min,Barbecue-Pejo
282,"4,8",['David G. Delser'],"['David G. Delser', 'Gustavo Fuertes', 'Álvaro Gallegos']",,1h 38min,Me da igual
283,"5,4",['Stephen Berra'],['Stephen Berra'],"Eric, an intensely nihilistic yet charismatic youth, manipulates four other teen-aged misfits into a ""chance"" meeting at 7-Teen Sips, a local coffee shop.",1h 30min,7-Teen Sips
284,"5,2",['Didier Martiny'],['Yasmina Reza'],"Joseph and Olga Stegudith, elderly Parisians of Viennese Jewish extraction, come to luxurious Evian with Olga's brother Michel Mazelsky to hear their son, virtuoso cellist Jascha, perform. Jascha is lovesick over violinist Anna Ghirardi, with whom he had a brief affair a year ago, although she's happily married to naturalist Primo.",1h 42min,2 Días en el Lago
285,"6,1",['Christophe Blanc'],"['Christophe Blanc', 'Roger Bohbot', 'Ève Deboise']","After fifteen years together, Francoise breaks with Jacques. She finds herself alone with her three children, her work as a nurse and her pretty house. Little prepared for this situation, which she did not choose, she began to go out at night, to frequent new places, open to chance meetings. She neglects her mother's duties a little, doing and saying things unthinkabl... Leer todo",1h 58min,Une femme d'extérieur
286,"4,8",['Derek Vanlint'],DESCONOCIDO,"When five bodies turn up in the waters of Burman City, its illusion of safety is shattered, and Mayer Hackett will stop at nothing to see the peace returned.",1h 40min,Alarma en la ciudad
287,"4,5",['M.F. Hussain'],"['Kamna Chandra', 'M.F. Hussain']","Gaja Gamini, the embodiment of the Indian spirit, inspires artists of all kinds, interacts with and influences the West, and exists through the ages.",2h 2min,Gaja Gamini
288,"7,3",['Jan Svankmajer'],DESCONOCIDO,"A childless couple passes off an anthropomorphous tree stump as their baby, but things get out of hand when the monstrosity comes to life and demands to be fed.",2h 12min,El pequeño Otik
289,"5,5",['Benoît Peeters'],DESCONOCIDO,"Virgil Ioan, a Romanian journalist, comes to Paris to find out what happened to Constantin Dolinescu, a renowned dissident writer, who disappeared after arriving in France in 1987.",1h 30min,Le dernier plan
290,--,DESCONOCIDO,DESCONOCIDO,Desconocido,--,Error nombre para la pelicula con id: tt0227277
291,"6,1",['Virginie Wagon'],"['Virginie Wagon', 'Erick Zonca']","It would seem that Marie has it all: a loving husband, a charming child, and a good job. But something elusive with a terrific force continues to pull her to another life to another man. (French with English subtitles).",1h 47min,El secreto
292,"7,1",['Robert Favreau'],"['Michel Marc Bouchard', 'Gilles Desjardins']",,1h 47min,Les muses orphelines
293,"7,5",['John Bailey'],['David Hare'],"In this one-man Broadway production directed for the stage by Stephen Daldry, acclaimed screenwriter-playwright David Hare recounts his eye-opening journey to Israel and Palestine.",1h 39min,Via Dolorosa
294,"5,7",['Ciro Durán'],['Ciro Durán'],The film starts from the time of the assault that a command of the guerrilla group M-19 performed at the Embassy of the Dominican Republic in Bogotá¸ when celebrating the national holiday. This are retained¸ many diplomats including the ambassador of the United States. Recreate the relationship between kidnappers and hostages¸ and negotiations with the government for ... Leer todo,1h 50min,La toma de la embajada
295,"6,0",['Beda Docampo Feijóo'],"['Enrique Cortés', 'Beda Docampo Feijóo']",It opens with a murder. Abelardo Sachs is the owner and editor of a famous political magazine He's gunned down in his luxurious home by a masked killer.,1h 30min,Ojos que no ven
296,"5,9",['Clement Virgo'],['Clement Virgo'],"Two brothers in their early 20s, one black, one white, each the other's keeper since their family was torn apart by a decade old tragedy.",1h 39min,Love Come Down
297,"6,2",['Tomy Wigand'],"['Matthias Dinter', 'Martin Ritzenhoff']","For Hans Pollack and his friends, soccer is the most wonderful hobby in the world. They all worship the world-class forward Pablo Dios. Their adoration goes so far that it makes them forget the birth of a daughter, gamble away a house, ""accidentally"" kidnap the rich and arrogant football star, and tear apart the family. However, Pablo and Hans gradually develop an unl... Leer todo",1h 32min,Fußball ist unser Leben
298,"5,7",['Isaac H. Eaton'],['Isaac H. Eaton'],"Michael is a recovering alcoholic/drug user. Back on the wagon, he's now responsible for a young, beautiful, and pregnant wife. He's working the graveyard shift at a gas station to support his new family, but the job drives him crazy. Then a wealthy stranger, Stuart, enters Michael's life, taking Michael through a tour of the seediest and slimiest parts of L.A. underb... Leer todo",1h 35min,La hora de las sombras
299,"5,1","['Pascal Arnold', 'Jean-Marc Barr']","['Pascal Arnold', 'Jean-Marc Barr']","Un hombre bien dotado, cuya mujer mojigata se niega a acostarse con él, encuentra liberación sexual con la novia francesa de un viejo amigo.",1h 49min,Demasiada carne
300,"5,9",['Todd Verow'],"['Jim Dwyer', 'Todd Verow']","Three generations of small town rebel-rebels crash into each other and burn in Todd Verow's new film, A Sudden Loss of Gravity. The small town of Bangor Maine is finally entering the 80's with a pile-up of new wave proportions. Based on true stories of the Northeastern town.",1h 30min,A Sudden Loss of Gravity
301,"4,7",['Jérôme de Missolz'],DESCONOCIDO,"A man stands before the insatiable desire of women, their sensual instincts, their hilarious seduction games, their grace, their rudeness, their needs.",1h 34min,La mecánica de las mujeres
302,"6,9","['Olivier Ducastel', 'Jacques Martineau']","['Olivier Ducastel', 'Jacques Martineau']","A tale revolving around the carefree bon-vivant Felix, who is content living with his boyfriend, Daniel in the town of Dieppe in Northern France. When Felix is laid off from his job, he decides to take a road trip to Marseilles to track down the father he's never met. Backpack in tow, Felix sets out walking, hitching, and borrowing cars to get to the south of France. ... Leer todo",1h 35min,Drôle de Félix
303,"3,3",['Fred Olen Ray'],['Steve Latshaw'],"Secret Service agents target a presidential candidate by hijacking the Concorde he is on and kill the pilots. It's up to an Air Force officer, nicknamed ""Washout"" because he can't fly a plane, to land the Concorde.",1h 34min,Pánico en el Concorde
304,"3,8",['Denise Coates'],['Denise Coates'],Karen Moone is a needy woman with an unfaithful boyfriend that is completely miserable after the suicide of her mother. Her only friend is the punk singer and baker Marnie Lowell. Kyle Elliot is a man bored with his perfect middle-class life with the shallow and beautiful wife Sarah that works composing jingles for advertisements. While waiting for a bus in a rainy ni... Leer todo,1h 29min,Our Burden Is Light
305,"6,8",['Peter Sheridan'],"['Brendan Behan', 'Nye Heron', 'Peter Sheridan']",Irish teenager political activist and future writer Brendan Behan is befriended in a British borstal (reformatory) by a liberal warden.,1h 31min,Borstal Boy
306,"5,5",['Richard Shepard'],DESCONOCIDO,A woman's desperate search for her brother in the capital of Mexico.,1h 30min,Distrito federal
307,"4,1",['John Stewart'],['John Stewart'],"Plagued by endless visions and nightmares, Jenny Adams suspects that, as a child, she was responsible for the brutal murder of her own mother.",1h 39min,The Asylum
308,"6,6",['Simon Cellan Jones'],['Joe Penhall'],A schizophrenic causes havoc in his brother's restaurant.,1h 41min,Some Voices
309,"6,6",['Steve Dunning'],['Steve Dunning'],"Lee's family sent her from China to Los Angeles three years ago to be a waitress in a Chinatown restaurant and send money home to support her ailing grandmother. She lives with her bitter aunt, and endures terrible treatment at work, but feels trapped. Steve, a well-traveled engineer, enters her shabby restaurant by accident one day and is smitten by her. He works to ... Leer todo",1h 52min,Now Chinatown
310,--,['Susan Hebert'],['Susan Hebert'],,--,Quinceañera
311,"5,1",['Jo Sol'],['Jo Sol'],"Although she's still hung up on the man who broke her heart, club dancer Simona pledges to eradicate all memories of him by removing the tattoos he put on her body. Complicating matters is Mariel, the owner of a Barcelona tattoo shop whose obsession with Simona's undulating form leads him to steal the money to help her pay for the necessary laser treatments.",1h 30min,Tatawo
312,"5,7",['Max Mitchell'],['Max Mitchell'],"A wealthy professional gay couple, who wish to adopt children, see their lives turned topsy turvy when they take in two misbehaving brothers, supposedly just for one night.",1h 33min,Get Your Stuff
313,"5,0",['Asia Argento'],['Asia Argento'],"Una joven actriz se embarca en una juerga autodestructiva de sexo, drogas y otros excesos mientras busca su alma para encontrar el camino hacia la redención.",1h 31min,Scarlet Diva
314,"3,6",['Val Lik'],['Val Lik'],"Can a young person in the South Bronx pursue a dream that isn't tied to crime, gang-banging, prostitution, violence, and racism? Tommy is a natural leader and a gifted artist. When Allen, a white kid, moves into the neighborhood with his single mom, he's a victim of constant harassment until Tommy offers friendship. Meanwhile, a corrupt cop hits on Allen's mother and,... Leer todo",1h 45min,Boricua's Bond
315,"5,3",['Anne Wheeler'],"['Linda Svendsen', 'Robert Forsyth', 'Lori Lansens']","Marine Life revolves around the chaotic family life of June, a middle-aged lounge singer and mother.",1h 35min,Marine Life
316,"6,3",['Michael Winterbottom'],"['Frank Cottrell Boyce', 'Thomas Hardy']",Un prospector que vendió a su esposa y a su hija pequeña a cambio de una explotación minera intenta desesperadamente recuperarlas mientras ayuda a construir el Ferrocarril del Pacífico con un grupo de amigos pioneros.,2h,El perdón (The Claim)
317,"5,7",['Michael Radford'],"['Michael Radford', 'David Linter']",A non-glamorous portrayal of the lives of people who make their living at a strip club.,2h 3min,Blue Iguana
318,"5,7",['Carlos Saura Medrano'],DESCONOCIDO,"13-year-old Milio admires his older brother Luis who belongs to a drug gang in a poor Madrid suburb. But after the death of a friend and gang member, Luis himself only wants to get out of the dealer scene and lead a normal life.",1h 30min,¿Tú qué harías por amor?
319,"7,1",['Leonardo Henríquez'],"['Leonardo Henríquez', 'William Shakespeare']",,1h 26min,Macbeth-Sangrador
320,"5,7",['Lynne Stopkewich'],"['Laura Kasischke', 'Lynne Stopkewich']","A young married woman (Parker) sells her body, not just for money, to guests at the motel where she works as a receptionist.",1h 32min,Suspicious River
321,"5,8",['Stephen La Rocque'],['Stephen La Rocque'],A fugitive from justice may also be a killer.,1h 32min,Por encima de la sospecha
322,"3,3","['Damian Lee', 'Jim Wynorski']","['Kevin Bernhardt', 'Steve Latshaw', 'Damian Lee']",Captain Matt Hendricks and Dr. Linda Christian are locked in a submarine with Russian terrorists that threaten to launch a chemical virus on US territory.,1h 35min,Agente rojo
323,"8,4",['Abe Levy'],['Abe Levy'],,1h 27min,"It's Alright Ma, I'm Only Trying"
324,"7,0",['Giorgio Treves'],DESCONOCIDO,"A Venetian countess, pregnant with illegitimate child, befriends her also pregnant servant girl and they almost become more than friends, but her family, infuriated over her scandalous pregnancy, has a plan for her and the baby.",1h 27min,Rosa e Cornelia
325,"5,5",['Matt Brown'],['Matt Brown'],"An ensemble romantic comedy chronicling the lives of a group of twenty-somethings that deals with adolescence of growing up and the realities that life has to offer, set on the island of Nantucket.",1h 30min,Ropewalk
326,"7,0",['Élie Chouraqui'],DESCONOCIDO,"When a Newsweek photojournalist disappears in war-torn Yugoslavia, his wife travels to Europe to find him.",2h 10min,Las flores de Harrison
327,"7,0",['Kate Woods'],DESCONOCIDO,At seventeen Josie Alibrandi is about to enter her final year as a scholarship student at an exclusive Catholic College. It's the year her life is turned upside down and changed forever.,1h 43min,Buscando a Alibrandi
328,"5,2",['Bradley Battersby'],"['Tom Hughes', 'Bradley Battersby']",A college professor reluctantly hides an escaped female convict who tries to get him to help prove her innocent of a murder.,1h 43min,Injusta condena
329,"6,1",['Benoît Jacquot'],"['Serge Bramly', 'Jacques Fieschi', 'Bernard Minoret']",A man prepares himself to be transferred to a detention center and rest home where he will relive one more time the highlights of his youth.,1h 40min,Sade
330,"5,8",['Christian Vincent'],DESCONOCIDO,,1h 40min,Sauve-moi
331,"6,4",['Yves Hanchar'],"['Jacky Cukier', 'Yves Hanchar']","During a family reunion in 2000, guests decide to read out laud their ""where i see myself in 10 years"" wish lists which they wrote down during their 1990 family reunion.",1h 45min,En vacances
332,"7,3",['M. Night Shyamalan'],['M. Night Shyamalan'],Un hombre aprende algo extraordinario sobre sí mismo tras un devastador accidente.,1h 46min,El protegido
333,"5,5",['Shajoon Kariyal'],['Babu Janardanan'],"A woman walks into the subway station. Suddenly a man comes up to her and starts singing. While listening to his song, she starts daydreaming. In her dream, she flies to the moon.",2h 22min,Dreams
334,"7,2",['Agnès Jaoui'],"['Jean-Pierre Bacri', 'Agnès Jaoui']","La vida de 6 personas mayores de 35 años en Rouen, Francia, y su relación entre ellos.",1h 52min,Para todos los gustos
335,"5,2",['Rama Rao Tatineni'],"['Aadesh K. Arjun', 'Erode Sounder']",A noble family presides over a small town in India.,2h 55min,Bulandi
336,"6,4",['Amos Gitai'],"['Amos Gitai', 'Marie-Jose Sanselme']","When the Yom Kippur War breaks out, two Israeli soldiers find themselves unable to locate their unit. Eager to take part in the war effort, they join an airborne medical evacuation unit.",1h 57min,Kippur
337,"6,3",['Matthew Tabak'],['Matthew Tabak'],"La aburrida existencia de un vendedor de seguros da un giro cuando un extraño, el ex convicto Auggie Rose, muere inesperadamente en sus brazos.",1h 49min,Tras la sospecha
338,"6,5",['Erik Clausen'],['Erik Clausen'],"One day Kevin runs into the rearview mirror on Bent A.'s new car. It smashes and Bent A. gets hold of Kevin's address: he wants compensation. He meets up with Kevin's single mother Vibeke who, as Kevin puts it, has ""bad nerves.""",1h 39min,Slip hestene løs
339,--,DESCONOCIDO,DESCONOCIDO,Desconocido,--,Error nombre para la pelicula con id: tt0221928
340,"5,8",['Bill Eagles'],['Simon Donald'],Two girls thrown together by their boyfriends' violence accidentally kill one of them.,1h 26min,Criaturas hermosas
341,"4,9",['Anthony Hickox'],['John Penney'],"In 1986, David Whitman came home, contaminated his wife and child, and watched them die. Years later, he leads a hazmat team investigating an industrial accident near Budapest. One contaminated man escaped. Terrorist expert Holly Anderson is part of a unit which operates on the premise that the contaminated man is a terrorist murdering his victims. Whitman, on the oth... Leer todo",1h 40min,El asesino silencioso
342,"7,3",['Christopher Coppola'],['Nick Johnson'],"Daring to tread in the footsteps of Billy Wilder, Paul Morrissey and Andrew Lloyd Webber, Christopher Coppola's tongue-in-cheek spin on SUNSET BOULEVARD stars brother Marc (a ringer for third sibling Nicolas Cage, an executive producer here) as a pizza delivery guy who dreams of recapturing his onetime glory as a child television star. Delivering a pie, he's adopted a... Leer todo",1h 50min,Bel Air
343,"6,2",['Michael Walker'],['Michael Walker'],"A college professor wakes up to find his wife has not returned home, then struggles to understand her disappearance.",1h 44min,La pesadilla
344,"6,4",['Gabriele Salvatores'],"['Domenico Starnone', 'Gabriele Salvatores']","Antonio is a man who was born with unusually large incisors; his freakishly huge teeth make him an outcast from his peers as a child, and he attempts more than once to break off the offending choppers.",1h 36min,Denti
345,"4,5",['Sanjay Gupta'],DESCONOCIDO,"An assassin is sent to kill the witness from testifying against the killers. In the process, the assassin falls in love with the witness.",2h 4min,Khauff
346,"6,7",['Denis Villeneuve'],['Denis Villeneuve'],"Tras lanzarse a un río en su coche, una mujer conoce a un hombre que la ayuda a hacer las paces con la vida.",1h 27min,Maelström
347,"4,7",['James Allen Bradley'],"['Tony Jiti Gill', 'Garrett Clancy']",Un niño de 12 años y su familia vuelven a empezar su vida en una nueva ciudad.,1h 30min,Los recién llegados
348,"6,1",['Mike Figgis'],['Mike Figgis'],Cuatro historias simultáneas que siguen alternativamente a una amante lesbiana enamorada mientras se obsesiona con los coqueteos de su pareja y los tensos acontecimientos de una productora de cine de Hollywood.,1h 37min,Timecode
349,"5,7",['Arto Paragamian'],['Arto Paragamian'],"A paleontologist is diagnosed with a fatal brain disease and, rather than falling into a depression, explodes into life.",1h 34min,Two Thousand and None
350,"4,6",['Knut Erik Jensen'],"['Alf R. Jacobsen', 'Knut Erik Jensen']","Oslo lawyer Josef Omgang returns to his native village on the Finnmark coast, where he finds his father's seafood company in trouble. International buyers have started trawling the market, and Josef realizes that the vital natural resources are in the hands of organized crime.",1h 34min,Når mørket er forbi
351,"4,9",['Frouke Fokkema'],['Frouke Fokkema'],"The Detour tells a semi-autobiographical tale of a young woman's obsession with a charismatic older writer. Dutch actress Tamar van den Dop plays Johanna, a directionless young woman unceremoniously dumped by her boyfriend. Taking in a play by the Austrian writer Thomas Bernhard, she finds herself deeply moved by its dark themes of suicide, solitude, and the impossibi... Leer todo",1h 38min,De omweg
352,"7,1",['Andrew Dominik'],"['Mark Brandon Read', 'Andrew Dominik']","""Brutal y violenta. Película australiana que dramatiza la vida de un notorio criminal, Mark Brandon Reid apodado """"Chopper"""". Basada en la autobiografía que este criminal psicopata y mitomano que escribío en prisión cumpliendo una sentencia. Escrito por Gustavito.-""",1h 34min,Chopper
353,"6,7",['Ventura Pons'],"['Sergi Belbel', 'Ventura Pons']","Seven individual stories ending with each character meeting their doom are replayed with alternate endings, showing how one slight shift of events can change their fate.",1h 29min,Morir (o no)
354,"5,6",['Sylvie Verheyde'],"['Alexis Galmot', 'Sylvie Verheyde']","Johan has three children with different women. Two adult daughters: Sophie and Virginie, and a young son in Amsterdam. Loïc gave Johan diamonds of a criminal origin. Her husband Simon thought they were his and murdered her. Then he set out his hunt for the diamonds and for killing Johan. The police thought that Johan had murdered Loïc and called his daughters, who had... Leer todo",1h 35min,Princesses
355,"6,9",['Agustí Villaronga'],DESCONOCIDO,Dos jóvenes y una mujer que compartieron la misma experiencia traumática durante la Guerra Civil española se reencuentran años después en un hospital para recibir tratamiento antituberculoso.,1h 47min,El mar
356,"5,5",['Stacy Cochran'],['Stacy Cochran'],"After an expose on NFL players causes a series of lawsuits, a reporter gets fired. A loyal editor nonetheless gives him a freelance story to work on. It seems that an athletic 19 year old actor had been preparing to star in a low-budget gridiron movie when a mysterious assailant attacked him and destroyed his appearance. He was, of course, dismissed from the film. The... Leer todo",1h 33min,Drop Back Ten
357,"6,3",['Jun Falkenstein'],"['Eddie Guzelian', 'Jun Falkenstein', 'A.A. Milne']",Tigger va en busca de su familia por el Bosque de los Cien Acres.,1h 17min,La película de Tigger
358,"4,8",['Raúl Veiga'],['Raúl Veiga'],"A powerful story surrounded by desire and mystery. A couple commits suicide as a result of a secret death pact. Ranxel, their friend, is with them during the last moments but is unable to impede this disastrous event. As a consequence the couple's ex-lovers connect to try and understand how this calamity happened. In their quest the unexpected occurs: new sentiments t... Leer todo",1h 30min,Arde amor
359,"4,1",['Jean Pellerin'],"['Geri Cudia Barger', 'Jonathan Raymond', 'Phillip J. Roth']",People are trying to find their way out of subway tunnel after a devastating earthquake.,1h 34min,Daybreak
360,"6,7",['Sam Raimi'],"['Billy Bob Thornton', 'Tom Epperson']",Una adivina con percepción extrasensorial recibe el encargo de ayudar a encontrar a una joven que ha desaparecido misteriosamente.,1h 52min,Premonición
361,"6,2",['Reggie Rock Bythewood'],['Reggie Rock Bythewood'],Una productora de televisión negra lucha en Hollywood.,1h 47min,Entre líneas
362,"6,8",['Brett Ratner'],"['David Diamond', 'David Weissman']","Un bróker, cuya única obsesión es el trabajo y una vida llena de lujo, se despierta siendo un vendedor de neumáticos y casado con su antigua novia, a la que había abandonado para que no obstaculizara su carrera en el mundo de las finanzas.",2h 5min,Family Man
363,"6,7",['Rajkumar Santoshi'],DESCONOCIDO,Un notorio terrorista manipula a la despechada amante de un mayor del ejército indio para que lo ayude a obtener un código militar clasificado.,2h 56min,Pukar
364,"6,3",['Arturo Ripstein'],"['Paz Alicia Garciadiego', 'Lucio Anneo Seneca']","Based on the Greek tragedy MEDEA, this is a present day Mexican version, set in the seediest possible milieu of Mexico City. A woman abandoned by her husband, is thrown out of her apartment by her landlord - who is also her husband's new father-in-law. She is also about to lose custody of her two children to her husband, a low-life, second-rate boxer and opportunist. ... Leer todo",1h 38min,Así es la vida
365,"5,4",['Tim Kirkman'],DESCONOCIDO,"Cuando la semilla de ""Somewhere"" de West Side Story se planta en el alma de un niño gay, comienza la búsqueda de la película. Nueve escenas interconectadas interpretan este acontecimiento teatral histórico.",1h 21min,The Night Larry Kramer Kissed Me
366,--,DESCONOCIDO,DESCONOCIDO,Desconocido,--,Error nombre para la pelicula con id: tt0220332
367,"7,7",['Stephen Daldry'],['Lee Hall'],Un joven con talento se debate entre su inesperado amor por la danza y la desintegración de su familia.,1h 50min,Billy Elliot (Quiero bailar)
368,"4,0",['Andrew Repasky McElhinney'],['Andrew Repasky McElhinney'],"American Gothic horror story, but then different. Severe camera and shadowy lighting dominate in this story about a family of poverty-stricken nobility that takes it all out on a 19th-century plantation. Outside evil is afoot.",1h 23min,A Chronicle of Corpses
369,"7,1",['Vanessa Jopp'],['Maggie Peren'],Two friends and a young woman experience the odds and ends of their first jobs.,1h 30min,Vergiss Amerika
370,"5,1",['Anil Devgan'],"['Anees Bazmee', 'Robin Bhatt', 'Javed Siddiqui']",Raju is hired to pose as uncle to three orphaned kids in order to usurp their inheritance. But he changes his mind after falling in love with their governess and decides to fight the greedy relatives.,2h 43min,Raju Chacha
