475,"7,2",['Brian Pera'],['Brian Pera'],"Woman's Picture is an anthology film inspired by classic women's films of the thirties, forties, and fifties. The story is divided into three sections, each of which deals with its own specific female character. The segments function as parallel dimensions, exploring thematic connections between women whose immediate experiences seem very far removed from one another.",1h 45min,Woman's Picture
476,--,['Johnny Rice'],DESCONOCIDO,"After being away at college, 19-year-old Travis (Chaz Moore) returns home for the summer. Life in small-town Florida seems as mundane as ever. Once darkness falls, he meets up with an old friend Jeremy (Mark Malta), who hasn't achieved much since graduation. Together they travel to a party far outside of town. Travis finds himself stuck in a house full of questionable... Leer todo",1h 19min,Small Hours
477,"6,1",['Jacob Estes'],['Jacob Estes'],"When a family of raccoons discover worms living underneath the sod in Jeff and Nealy's backyard, this pest problem begins a darkly comic and wild chain reaction of domestic tension, infidelity and murder.",1h 41min,The Details
478,"6,1",['Sulev Keedus'],"['Madis Kõiv', 'Sulev Keedus']","Film about a man who was sent to fight in Afghanistan years ago, where he converted to Islam. He now returns home only to find himself facing another kind of war.The front line in the decrepit Estonian town runs between Eastern and Western culture, men and women, common sense and madness. Somewhere amidst these battles is his daughter, who Kirotaja has decided to find... Leer todo",1h 58min,Kirjad Inglile
479,--,['Timothy Das Hanche'],DESCONOCIDO,,--,Poley Poley Urey Mon
480,"4,5",['Johnny Roc'],['Johnny Roc'],A humanoid assigned to investigate a mysterious exiled revolutionary finds her beliefs challenged as she unravels his true identity.,--,Man Without a Head
481,"6,1",['Ernie Barbarash'],['Aaron Rahsaan Thomas'],Dos asesinos aceptan trabajar juntos mientras uno intenta vengar a su esposa y el otro cobra una recompensa por un trabajo.,1h 41min,Juego de asesinos
482,"5,4",['Marc Erlbaum'],['Marc Erlbaum'],"When tragedy strikes the community surrounding a cafe in West Philadelphia, the cafe's regulars come to realize how intertwined their lives truly are.",1h 35min,Café
483,"7,2",['Jaume Balagueró'],['Alberto Marini'],Todos los días te despiertas en la seguridad y comodidad del hogar. ¿Pero es tu casa realmente segura?,1h 42min,Mientras duermes
484,"6,5",['Aleksandr Sokurov'],DESCONOCIDO,A despairing scholar sells his soul to Satan in exchange for one night with a beautiful young woman.,2h 20min,Fausto
485,"6,1",['Chuck Mitsui'],['Chuck Mitsui'],"Over the mountains, hidden from the touristic beaches of Waikiki, Ralsto, a 19 year old Hawaiian skateboarder, wakes up to a day he will never forget.",1h 40min,One Kine Day
486,"7,0",['David Mackenzie'],['Kim Fupz Aakeson'],Una chef y un científico se enamoran cuando una epidemia comienza a despojar a las personas de sus percepciones sensoriales.,1h 32min,Perfect sense
487,--,['Samandar Khamrakulov'],['Samandar Khamrakulov'],,1h 30min,Arzanda
488,"6,5",['Andrew Kenneth Gay'],['Andrew Kenneth Gay'],"After an unplanned pregnancy and a hasty marriage, an aspiring children's entertainer and his bar-tending wife are forced to confront difficult choices about their future.",1h 34min,A Beautiful Belly
489,"6,2",['Nicole Kassell'],['Gren Wells'],"Marley (Kate Hudson) es una bella mujer que descubre que padece cáncer, pero cuando inesperadamente se enamora de su médico (Gael García Bernal), la amenaza de caer en el amor es más aterradora que la muerte.",1h 47min,Un pedacito de cielo
490,"6,7",['Paolo Sorrentino'],DESCONOCIDO,"Cheyenne, una estrella de rock retirada que vive en Dublín, regresa a la ciudad de Nueva York para encontrar al hombre responsable de la humillación que sufrió su padre recientemente fallecido durante la Segunda Guerra Mundial.",1h 58min,Un lugar donde quedarse (This Must Be the Place)
491,"6,8",['Sean Durkin'],['Sean Durkin'],"Una mujer traumatizada intenta reintegrarse en su vida familiar tras huir de una secta abusiva, perseguida por memorias dolorosas y una creciente paranoia.",1h 42min,Martha Marcy May Marlene
492,"6,2",['Eran Kolirin'],['Eran Kolirin'],A family man becomes obsessed with looking at his own life out of context.,1h 34min,Hahithalfut
493,"6,8",['Lasse Hallström'],"['Simon Beaufoy', 'Paul Torday']","Un experto en piscifactorías intenta hacer realidad el sueño de un jeque de llevar la pesca deportiva al desierto, un viaje a contracorriente sobre fe y peces para probar posible lo imposible.",1h 47min,La pesca del salmón en Yemen
494,"8,0",['Greg Takoudes'],"['Maeve McQuillan', 'Dennis Ostermaier', 'Greg Takoudes']","THE JONESTOWN DEFENSE is an American independent feature film about Christopher Waite, a Sarasota businessman living on the Florida Gulf Coast in the spring of 2009, who is struggling with both a collapsed economy and a personal life in free-fall. Over the next four days, Christopher will face the onerous task of firing the employees of the company he manages, the dis... Leer todo",--,The Jonestown Defense
495,"4,3",['Ingo Heise'],"['Ingo Heise', 'Sinta Tamsjadi']",Arriving at the estate of the rich Talmon-Family psychologist Gina Malone finds herself trapped immediately in a deadly web of a crushing social machinery infused with malicious dark twists.,1h 16min,Biester müssen sterben
496,"6,3",['Winston Furlong'],['Winston Furlong'],"A self-indulgent Aussie-Indian writer's attempts to repair a neglected relationship with his 12-year-old daughter from a broken mixed marriage, takes a turn when they discover a large box full of all white Lego bricks at a garage sale.",1h 32min,Taj
497,"7,1",['Joseph Cedar'],['Joseph Cedar'],"Eliezer and Uriel Shkolnik are father and son as well as rival professors in Talmudic Studies. When both men learn that Eliezer will be lauded for his work, their complicated relationship reaches a new peak.",1h 47min,Pie de página
498,--,['Aziz Sajwal'],DESCONOCIDO,It is a film on a small town girl named Piya who has fall in love with a boy Rahul through social media.,--,Paapi
499,"5,8",['Robert Celestino'],"['Rick Gomez', 'Frank John Hughes']","Henry, un novelista exitoso que lo tiene todo sobrevive a un trauma y se ve perseguido por un sueño que lo aterroriza. Decide ir a un lugar para comenzar su próxima novela y se encuentra con un vagabundo que lo confronta",1h 24min,Leave
500,"7,1","['Stephen J. Anderson', 'Don Hall']",DESCONOCIDO,"Mientras buscan miel, Pooh y sus amigos se embarcan en una aventura para encontrar la cola perdida de Igor y rescatar a Christopher Robin de un monstruo desconocido.",1h 3min,Winnie the Pooh
501,"6,0",['Michael Cuesta'],"['Gerald Cuesta', 'Michael Cuesta']","After 20 years on the road with Blue Oyster Cult, Jimmy Testagros returns to his hometown to life with his ailing mother. Complications arise when he falls for an old friend, who is now married to his longtime nemesis.",1h 35min,Roadie
502,"5,2",['Rikki Beadle Blair'],['Rikki Beadle Blair'],"In 5-man-a-side soccer, a newly formed gay team goes up against an established team with a deserved reputation for violence and a skittish first-time official, with more action off-field than on.",1h 39min,Kickoff
503,"6,3",['Endre Hules'],['Endre Hules'],"There were two brothers - two dancers - in Communist Hungary. One defected, the other stuck it out. One gave his soul to commerce, the other to the Party. After twenty years, they meet again. And the dance begins.",1h 40min,A halálba táncoltatott leány
504,--,['Anshuman Barua'],"['Anshuman Barua', 'Umakant Maurya']",,--,Shivam
505,"8,1",['Tate Taylor'],"['Tate Taylor', 'Kathryn Stockett']",Un aspirante a autor durante el movimiento por los derechos civiles en los 60 decide escribir un libro des de la perspectiva de las asistentas domésticas afro-americanas sobre las familias blancas para las que trabajan.,2h 26min,Criadas y señoras
506,"4,9",DESCONOCIDO,DESCONOCIDO,"Six friends meet every evening in a basement to make music. During the daytime, there are no rehearsals for what life brings us. Each endeavour leaves its mark. Six short films by six different directors dealing with the troubles of youth.",2h 1min,O que Há de Novo no Amor?
507,"5,5",['Teddy Lussi-Modeste'],"['Teddy Lussi-Modeste', 'Rebecca Zlotowski']","Jimmy Rivière is a young gypsy living in a travelers camp; his adoptive father, a Pentecostal preacher, urges him to be christened and lead a life of sacrifice in the name of the Lord.",1h 30min,Jimmy Rivière
508,"4,7",['Charles de Meaux'],"['Douglas Coupland', 'Mian Mian', 'Charles de Meaux']","After moving to the Macau region of China, a jockey becomes involved in the city's racing scene, along with its criminal underbelly.",1h 30min,Stretch
509,"5,3",['Rebecca Daly'],"['Rebecca Daly', 'Glenn Montgomery']","Arlene vive en una comunidad rural. Una mañana despierta en el bosque junto al cadáver de una mujer. Las sospechas crecen y Arlene se encierra, con miedo hasta de dormir.",1h 28min,The Other Side of Sleep
510,"6,6",['Elisabeth Scharang'],DESCONOCIDO,"At the end of World War II, Hungarian Jews are forced on a death march to the Austrian concentration camp Mauthausen. Only few civilians try to rescue them.",1h 30min,Vielleicht in einem anderen Leben
511,"6,7",['Nanni Moretti'],DESCONOCIDO,La relación entre el Papa recién elegido y su terapeuta.,1h 42min,Habemus Papam
512,"6,8",['Michael Dowse'],DESCONOCIDO,"Etiquetado como el ""rechazado"" por su familia, un portero supera las probabilidades de llevar a un equipo de inadaptados de bajo rendimiento a la gloria del hockey semi-profesional, superando todo lo que se interpone en su camino.",1h 32min,Goon
513,"5,5",['Josh Sugarman'],"['Josh Sugarman', 'Brandon Yankowitz']","To win the celebrity and self-made wealth he craves, an aimless, twenty-something Manhattan playboy devises a film based on his party-boy, club-going lifestyle, and hires a self-destructive aspiring playwright to ghost the feature script. As the mismatched pair struggles to complete the script and get a handle on their misdirected lives, they reveal the sometimes come... Leer todo",1h 44min,Trophy Kids
514,--,['Tsitsi Dangarembga'],['Tsitsi Dangarembga'],"I WANT A WEDDING DRESS is the story of young Kundisai Sande who desperately wants to get married but finds herself in a sexual network with disastrous consequences. Her boyfriend Teri deserts her, only to find himself in the same sexual network. Mahachi, the successful, promiscuous businessman who seduces Kundisai brings infection to the marriage bed. In the midst of ... Leer todo",1h 29min,I Want a Wedding Dress
515,"4,9",['Jed Strahm'],['Jed Strahm'],"On Christmas Eve, two sisters sharing a Venice apartment discover their home is the final target of a brutal gang of criminals led by Jess and his sadistic sister Lorraine.",1h 23min,Knifepoint
516,"6,0",['Jim Sheridan'],['David Loucka'],"Tras mudarse al que parece un hogar idílico, una familia descubre la brutal forma en que los previos habitantes fueron asesinados.",1h 32min,Detrás de las paredes
517,"7,0",['Pablo Llorca'],['Pablo Llorca'],,1h 37min,El mundo que fue y el que es
518,"7,6",['Nick Sandow'],DESCONOCIDO,Three men in a New York City Off-Track Betting establishment.,1h 13min,Ponies
519,"6,4",['Berndt Mader'],['Berndt Mader'],"A teenage boy, adrift amongst a sea of family indiscretions, discovers what it means to be a man.",1h 32min,5 Time Champion
520,--,['Pitambar Kale'],DESCONOCIDO,,--,Chandrapurchi Devi Mahakali
521,"6,0",['Václav Havel'],['Václav Havel'],An absurdist look at the life of an ex-politician.,1h 34min,Odcházení
522,"3,3","['Jaiveer', 'Anay Sharma']",DESCONOCIDO,Three married men seek counseling from a fourth in order to meet and date other women.,2h 14min,Happy Husbands
523,"5,1",['Joe E. Goodavage'],DESCONOCIDO,"A compulsive gambler struggles to keep his job, family and life from the depths of addiction, along with a beautiful phyciatrist who is treating him, they hatch a life changing plan that will alter their lives forever.",1h 48min,The Last Gamble
524,"5,4",['Rosa Karo'],['Rosa Karo'],"A romantic fairy tale about a 19-year old orphan girl who, as her sole inheritance, gets an antique key that unlocks both an old Italian villa and the secrets of her family history.",1h 32min,The Italian Key
525,"6,5",['Aaron J. Salgado'],DESCONOCIDO,"In Miami, three lifelong friends, months away from high school graduation indulge in reckless behavior that finds them on the brink of either their graduation or their mortality.",1h 40min,Magic City Memoirs
526,"6,2",['Randy Kent'],['Barry Kneller'],"Lemon, a hard-working repair man, is going nowhere. An unlikely friendship with a homeless war Veteran helps Lemon turn things around in this heart-warming and uplifting film set in modern-day Los Angeles.",1h 14min,Life of Lemon
527,"6,7",['Richard Roy'],"['Michel Michaud', 'Richard Roy']","In order to to see his idol, Jimi Hendrix, a twelve year old boy attempts a journey from his Quebec village to Woodstock.",1h 43min,Frisson des collines
528,"7,2",['Thom Fitzgerald'],['Thom Fitzgerald'],"A lesbian couple escape from their nursing home and head up to Canada to get married. Along the way, they pick up a young, male hitchhiker.",1h 33min,Cloudburst
529,"6,1",['Llorent Barajas'],['Llorent Barajas'],Young Emilio and and his stepfather deliver mail as well as read and write letters for most of the illiterate villagers. Emilio changes some letters to optimistic stories from sad stories. Emilio then falls for a young girl named Elena.,1h 37min,Cartas a Elena
530,--,['José Mattos'],"['José Mattos', 'Paulo Cesar Nogueira']",,1h 31min,City Down - A História de um diferente
531,"6,3",['Rolla Selbak'],['Rolla Selbak'],"Three Veils is the story of three young Muslim women whose lives unexpectedly intersect as they deal with issues of sexuality, tradition, and identity. To the outside world, they seem to be typical young college students dealing with the challenges of growing up and finding ones place in the world. But each girl has a story that, behind the veil, is brimming with desi... Leer todo",1h 57min,Three Veils
532,"5,0",['David Mueller'],"['Lynn Salt', 'David Mueller', 'John Harris']","In Santa Cruz for the summer, a young woman discovers the sport of surfing -- and a family secret as well.",1h 36min,Beautiful Wave
533,--,DESCONOCIDO,['Andronico Gonzalez'],"Tequila and Bobo hit the little town of Chedron intending to rob the local bank whose owner, De Koven, is trying to freeze out all the ranchers in the area by the simple expedient of foreclosing on the mortgages his bank holds on their land.",1h 35min,Tequila
534,--,['Scott Wurth'],['Scott Wurth'],"""Panata"" is a pledge to God from Man, it's a way of expressing your faith.",54min,Panata
535,"4,5",['Nathanael Coffman'],['Nathanael Coffman'],"A high school love comedy, which authentically depicts the lives of today's ever-evolving and parentally subversive youth culture.",1h 31min,Getting That Girl
536,"7,0",['Daniel Auteuil'],"['Marcel Pagnol', 'Daniel Auteuil']","En el sur de Francia, en la década de 1930, un padre se debate entre su sentido del honor y el profundo amor que siente por su hija cuando ella se mete en problemas con el hijo rico de un comerciante.",1h 49min,La fille du puisatier
537,"5,8",['Matias Meyer'],"['Israel Cárdenas', 'Matias Meyer']","After the mexican government tries to restrict religious practices, many people revolted, but now the wars is ending and the some of last rebels must decide whether to accept a pardon or continue their cause.",1h 29min,Los últimos cristeros
538,--,['Samuel Vincent'],DESCONOCIDO,"Charles is a successful young man who is being haunted by a bad decision made in his past. His recent engagement to his childhood sweetheart, Tammie is raising a lot of attention. At first, he seems to have it all, a great career, a loving family, some great friends, and a bright future but he suddenly finds himself in a world of trouble; How and why did everyone turn... Leer todo",--,Mea Culpa
539,"5,7",['Mun Chee Yong'],['Mun Chee Yong'],A drama centered on a man dealing with the aftereffects of being in a coma caused by a car accident.,1h 33min,Where the Road Meets the Sun
540,"5,6",['Lavinia Currier'],"['Lavinia Currier', 'Louis Sarno', 'Suzanne Stroh']","The story of Louis Sarno, an American ethno-musicologist who lived among the Bayaka Pygmies in Central Africa for 25 years.",1h 45min,Oka!
541,"6,0",['Yukinari Hanawa'],"['Hisanori Shimizu', 'Kôta Yamada']","A businessman who owns his own business becomes the guarantor for a friend who is borrowing money from a lender. Sadly, the friend disappears leaving the man on the hook for the loan. This comes at a time when his own business is failing. When it rains it pours and as he concentrates on his problems and lack of funds, he finds out that his wife has contracted cancer. ... Leer todo",1h 53min,Shiniyuku tsuma tono tabiji
542,"5,6",['Olaf de Fleur Johannesson'],"['Olaf de Fleur Johannesson', 'Hrafnkell Stefansson']","A desperate city-slicker engineer cheats his way into a small farming community, pretending to know how to save them by refinancing their slaughterhouse not knowing that he's walking into a local war of small-town politics and general misbehaving.",--,Kurteist fólk
543,"5,7",['Robbie Moffat'],['Robbie Moffat'],"Present day. Sarah McGuire, a travelling sales woman is off on a trip up north to sell her boss's latest range of lingerie stock Unhappy in her current relationship with a car mechanic, she sets off with a mind to change her life for the better. She is good at her job but is unfulfilled. To alleviate her daily boredom she runs to orchestral music. Running is her one r... Leer todo",1h 47min,Got to Run
544,"6,0",['Kit Vinsick'],['Kit Vinsick'],"'If the truth sets you free, will it also bring you peace?' Charlie's bittersweet journey touches on our deepest questions of love, spirituality and what it really means to be a friend.",1h 22min,Whisper Me a Lullaby
545,"5,3",['Michael Knowles'],DESCONOCIDO,A guy in his mid-thirties watches as his life comically unravels after he enters into a relationship with the daughter of a former high school classmate.,1h 37min,The Trouble with Bliss
546,"5,9",['Hadar Friedlich'],['Hadar Friedlich'],"The world of Hanna Mendelssohn, an 80 year old widow, disintegrates as the Kibbutz which she helped to found undergoes privatization.",1h 25min,Emek Tiferet
547,"5,6",['Renny Harlin'],"['Mikko Alanne', 'David Battle']","A drama set centered around the war between Russia and Georgia, and focused on an American journalist, his cameraman, and a Georgian native who become caught in the crossfire.",1h 53min,5 días de guerra
548,--,"['Vincent Escobar', 'Mike Ramirez']",DESCONOCIDO,"This is a love story about a young woman named Katie and the two men she shares her heart with, Charlie and Bobby. Katie and Bobby are high school sweet hearts with a twist of infidelity on Bobby's behalf. Katie is torn about her relationship with Bobby. She has left him in the past only to find her going back. After leaving him a second time, she finds herself unwill... Leer todo",1h 30min,Charlie
549,"4,8","['A.D. Calvo', 'Alejandro Daniel']",['A.D. Calvo'],"A strange and gripping holiday tale of grief, love, and the horrors of loneliness.",1h 13min,The Melancholy Fantastic
550,"6,5",['Kurt Kuenne'],['Kurt Kuenne'],"A man begins to experience his life out of order: each time he falls asleep, he wakes up on a different day of his life, at a different age, and he never knows where or when he will be ""tomorrow.""",1h 22min,Shuffle
551,"5,8",['Ciril Braem'],['Thomas Huber'],,1h 18min,Mein Prinz. Mein König.
552,"2,3",['Laron Austin'],"['Martin L. Kelley', 'Eddie Davis Singleton']","When thieves steal the tracks that Rippa was using for a crucial beat battle, the up-and-coming music producer struggles to prove his talent by cooking up an even hotter mix with the help of some talented friends.",1h 35min,Battle
553,"7,3",['Vladimir Blazevski'],"['Vladimir Blazevski', 'Darijan Pejovski']","A group of crotchety codgers attempt to revive the punk-rock band they all played in 17 years earlier in ""Punk Is Not Dead,"" from Macedonian scribe-helmer",1h 44min,Pankot ne e mrtov
554,"4,4",['Mark Elliott'],['Kevin Sampson'],A dark comedy about an emerging band's experiences in the UK music scene.,1h 45min,Powder
555,"2,4",DESCONOCIDO,"['Marv Blauvelt', 'Anthony G. Sumner', 'Trevor Wright']",Four Twisted Tales that lead to a Dead End.,1h 38min,Psycho Street
556,"5,0",['Predrag Antonijevic'],DESCONOCIDO,"In post-Katrina New Orleans, a disgraced detective encounters the ghost of a murdered woman who wants to help him identify her killer.",1h 38min,Little Murder
557,--,['Amancay Tapia Montes'],['Amancay Tapia Montes'],"Due to social unrest in the streets of La Paz (Bolivia), the owner of a modest beauty salon in a suburb of the city and her family, are forced to spend a few days together trapped inside with two clients. As the hours go by,petty fights between the five of them will make the coexistence in the confined space insufferable, turning the beauty salon into an unexpected ba... Leer todo",1h 20min,Campo de Batalla
558,"7,8",['Daishi Matsunaga'],DESCONOCIDO,"Pyuupiru is a Japanese contemporary artist whose works are highly acclaimed in recent years. An old friend of his (hers), Daishi Matsunaga has filmed him for 8 years, ever since Pyuupiru frequented clubs wearing eccentric handmade costumes. Pyuupiru went through a gender identity disorder, broken heart and castration operation, and then he held a performance at Yokoha... Leer todo",1h 30min,Pyuupiru 2001-2008
559,"5,7",['Alex Pires'],"[""Art D'Alessandro"", 'Alex Pires']","A hard-working cupcake maker is inadvertently elected mayor of a small town burdened with debt. Uneducated, she relies on her street smarts to clean up the town.",1h 26min,Mayor Cupcake
560,"6,7",['Gus Van Sant'],['Jason Lew'],Narra la historia de amor de una joven pareja. Ella (Mia Wasikowska) es una enferma terminal que se enamora de un chico (Henry Hopper) al que le gusta asistir a funerales. Ambos se encontrarán además con el fantasma de un piloto kamikaze japonés (Ryo Kase) de la II Guerra Mundial.,1h 31min,Restless
561,--,['Bi Gan'],['Bi Gan'],,1h 10min,Laohu
562,"6,5",['Roberto Minervini'],"['Roberto Minervini', 'Denise Ping Lee']","Three people come together by chance and take a road trip to West Texas, where their lives are forever changed.",1h 25min,The Passage
563,"6,0",['Alan Brown'],"['Alan Brown', 'William Shakespeare']","A modern take on Shakespeare's 'Romeo and Juliet'. Set at an isolated all-boys military academy, it follows the forbidden relationship between two cadets.",1h 34min,Private Romeo
564,"7,1",['Brigitte Bertele'],['Johanna Stuttmann'],"After an evening out, the 35-year-old, self-confident Judith is raped on her way home. She fights with all possible means to prevent her life being changed. Her lawyer advises her to press charges. But the destructive consequences force their way into her life. When the perpetrator's false statement causes her hopes of legal redress to collapse, Judith looks for anoth... Leer todo",1h 37min,Der Brand
565,"4,5",['Swapna Joshi'],"['Himesh Reshammiya', 'Subrat Sinha']","On a break from his pushy girlfriend, a male falls for the sister of his employer.",2h 2min,Damadamm!
566,"5,8",['Henning Carlsen'],"['Jean-Claude Carrière', 'Gabriel García Márquez', 'Henning Carlsen']","Un viejo periodista apodado El Sabio, decide celebrar su cumpleaños número 90, regalándose una noche de amor loco con una adolescente virgen.",1h 30min,Memoria de mis putas tristes
567,--,['Kenaz'],['Kenaz'],"The story is about a 5 year old girl ,Neela. Who lives in a children's home. she is always lost in thoughts. The only time we can see her happy is when there is a sound of an airplane flying over her high in the sky. As it is obvious now that Neela likes to fly, i.e., to become a pilot, we see her trying all crazy things just to reach the sky. With a series of events ... Leer todo",50min,Aakaasam
568,"5,8",['Victoria Mahoney'],['Victoria Mahoney'],"A medida que su familia se desmorona, Sweetness O'Hara, de diecisiete años, debe valerse por sí misma en un vecindario donde su supervivencia es incierta.",1h 34min,Yelling to the Sky
569,"5,2",['Puneet Issar'],DESCONOCIDO,Neo-Nazis and bigoted police oppress and target vulnerable Sikhs & Asians in post 9-11 America.,2h 30min,I Am Singh
570,--,['Emre Amram Sonmez'],DESCONOCIDO,Israeli and German musicians perform the works of Jewish composers in the room where the infamous Wannsee conference took place 67 years earlier.,1h 36min,Am grossen Wannsee: The Wannsee Recordings
571,"8,6",['TheWorldFamous Ike'],['TheWorldFamous Ike'],,1h 42min,Soap on a Rope
572,"5,8",['Steven Soderbergh'],['Lem Dobbs'],Un súper soldado de los Black Ops planea vengarse tras ser traicionado durante su última misión.,1h 33min,Indomable
573,"5,0",['Yan Vizinberg'],"['Yan Vizinberg', 'Lee Peterkin']","A young Russian woman, smuggled into America by human traffickers, must fight for her life in order to derail the traffickers' plans.",1h 25min,Cargo
574,--,['Han Tang'],DESCONOCIDO,"'Yellow Face' is one Chinese actress' journey to discover what it means to be East Asian in the U.S. The film-maker is the first Chinese National to be accepted into the Juilliard School's Drama Division. Since her graduation in 2008 she has followed the protest against yellow-face in Hollywood. 'Avatar: The Last Airbender,' a children's show on Nickelodeon featured E... Leer todo",46min,Yellow Face
