763,"6,5",['Sarah Polley'],['Sarah Polley'],Una mujer felizmente casada se enamora del artista que vive al otro lado de la calle.,1h 56min,Take This Waltz
764,"6,3","['Jim Brown', 'Gary Burns']","['Gary Burns', 'Jim Brown']","In an effort to re-connect a pessimistic ""Everyman"" with humanity, a journalist takes him on a voyage of possibilities as seen through the eyes of leading thinkers in the arts and sciences.",1h 32min,The Future Is Now!
765,"8,5",['Micah Cohen'],DESCONOCIDO,"Ethan is in a major slump; he's unemployed, isolated and just plain confused. After his friends drag him out, another ""night out"" spirals into a whirlwind of events that will forever change all of their lives.",1h 32min,Lost in a Crowd
766,"5,1",['Simon Staho'],"['Simon Staho', 'Peter Birro']","Anything can happen and will happen in this romantic musical where four teenagers risk their feelings and dreams in the space of a single, extraordinary night. Daniel, Lina, Stefan and Therese are sixteen years old. They are the best of friends and are on their way out for the night. It is a night like any other and yet a night like no other before. When the sun rises... Leer todo",1h 30min,Magi i luften
767,"5,4",['Craig Lahiff'],['Craig Lahiff'],"Colin happens upon a road accident where he finds a dead man, a beautiful woman, and a suitcase full of money. After trying to do the right thing he soon finds himself caught up in a dangerous scheme.",1h 26min,Swerve
768,"5,5",['Ti West'],['Ti West'],"Durante los últimos días en el Yankee Pedlar Inn, dos empleados decididos a revelar el pasado embrujado del hotel comienzan a experimentar eventos perturbadores cuando antiguos huéspedes se registran para una estancia.",1h 41min,Los huéspedes
769,"3,6",['Yvan Gauthier'],"['Paul Conway', 'Yvan Gauthier']","Inspired by true events, L.A., I HATE YOU intertwines three tales of sex, violence, redemption, murder and unthinkable twists all taking place in the City of Angels; Los Angeles. When a desperate husband suddenly regrets the hit he has ordered on his handicapped wife, he frantically attempts to stop the murder. However, this sets in a motion a series of events far gre... Leer todo",1h 33min,"L.A., I Hate You"
770,"8,1",['Jose E. Cruz Jr.'],['Jose E. Cruz Jr.'],"""CLOSE-UP"" is a dramatic feature film told through the eyes of a failed Philadelphia actor who has succumbed to drug addiction. Our story follows him during the Holidays as he desperately tries to regain everything he has lost in his life; his wife and child, his job, and his pride, before it's too late. Over the course of one day on New Years Eve in New York City, a ... Leer todo",1h 25min,Close-Up
771,"5,3",['Curtis Graham'],['Tim Paskert'],A young man struggles with balancing success and relationships until he travels to a mysterious island in the Bahamas and discovers the secret of The Glass Window.,1h 29min,The Troubadour
772,"7,0",['Sean McNamara'],DESCONOCIDO,La adolescente surfera Bethany Hamilton se sobrepone al trauma de haber perdido el brazo izquierdo en el ataque de un tiburón y regresa al agua.,1h 52min,Soul Surfer: Alma surfera
773,"7,1",['Andrew Walkington'],['John Warburton'],"As the plague of teenage violence and anti-social behavior spreads uncontrolled, society fights back with a radical plan: a revolutionary school to rehabilitate those beyond help. But what are their methods and are they a step too far?",1h 12min,Re-Evolution
774,"6,6",['Shinpei Takeda'],DESCONOCIDO,"2 former high school friends drive from Canada to Mexico as they visit atomic bomb survivors from Hiroshima and Nagasaki that live in the States. During the trip, they record the piece of a modern history crucially important in Japanese collective psyche while exploring their own identities and revealing the reality of psychological scars.",1h 12min,Hiroshima Nagasaki Download
775,"6,8",['Steven Soderbergh'],['Scott Z. Burns'],"Profesionales de la salud, funcionarios del Gobierno y gente común se encuentran en medio de una pandemia mientras el CDC trabaja para encontrar una cura.",1h 46min,Contagio
776,"6,2",['Casper Andreas'],"['Casper Andreas', 'Andy Zeffer']",A fresh face comes to Hollywood to act in movies but only the gay porn studios are eager to provide him with work.,1h 44min,Going Down in LA-LA Land
777,"6,0",['Fred Schepisi'],"['Judy Morris', 'Patrick White']","Elizabeth Hunter controls all in her life - society, her staff, her children; but the once great beauty will now determine her most defiant act as she chooses her time to die.",1h 54min,El foco de la tempestad
778,"5,3",['Brian Brough'],"['Jennifer Jan', 'Brittany Wiscombe', 'Jane Austen']","Dos hermanas se ven obligadas a abrirse camino en el mundo después de que su padre sea encarcelado. Elinor es limpiadora en un balneario. Marianne trabaja para una empresa de marketing, pero también fabrica lociones perfumadas.",1h 30min,Aroma y sensibilidad
779,"6,7",['Joe Carnahan'],DESCONOCIDO,"Cuando su avión se estrella en Alaska, seis trabajadores del petróleo son liderados por un hábil cazador para sobrevivir, pero una manada de lobos despiadados los persigue a cada paso.",1h 57min,Infierno blanco
780,"6,7",['Rodrigo García'],DESCONOCIDO,"Albert Nobbs lucha por sobrevivir en la Irlanda del siglo XIX, donde las mujeres no son independientes. Haciéndose pasar por hombre para trabajar como mayordomo, Albert conoce a un apuesto pintor y busca escapar de su mentira.",1h 53min,Albert Nobbs
781,"6,4",['Jens Lien'],['Nikolaj Frobenius'],"It's not easy to rebel when your dad wants to join the party... One day (in 1979), Magnus and his son Nikolaj hit the wall in their new terrace house in Rykkinn. Magnus is an architect, hippie and free spirit, a glaring exception in a community where equality and conformity is the norm. He always stands up for his son, supporting him unconditionally, even when Nikolaj... Leer todo",1h 27min,Sønner av Norge
782,"8,3",['I. Michael Toth'],['I. Michael Toth'],"A small theater company is rehearsing ""The Dream Play"" by August Strindberg. When a new actor comes to their town and gets a role in the play, the whole question of 'whose dream is this?' acquires a new meaning. During rehearsals, he develops new friendships and a conflict with the eccentric but demanding director of the play. While trying to master the multiple roles... Leer todo",1h 37min,The Dream Play
783,"6,0",['Anders Engström'],DESCONOCIDO,"A young student is found stabbed, and her family hires Vares to investigate the case.",1h 34min,Vares - Pahan suudelma
784,"5,4",['Joe Nussbaum'],['Katie Wech'],El baile de graduación se acerca y las historias entrecruzadas del instituto están a punto de alcanzar su punto culminante. Algunas relaciones acabarán y otras empezarán.,1h 44min,Fin de curso
785,"5,8",['Dominik Moll'],DESCONOCIDO,"Satanás intenta corromper a un joven novicio, el Hermano Ambrosi, que fue abandonado a las puertas de un monasterio y quien fue acogido y educado por los monjes.",1h 41min,El monje
786,"5,3",['Pawel Pawlikowski'],"['Douglas Kennedy', 'Pawel Pawlikowski']",Un escritor norteamericano viaja a Francia tras perder su trabajo por un escándalo. Allí conoce a una enigmática mujer viuda..............Basada en una novela de Douglas Kennedy.,1h 24min,La mujer del quinto
787,"5,8",['Harry Thomason'],"['Howard Klausner', 'Dub Cornett']","At the end of 1952, with the best years of his career behind him, Hank Williams hires a local youth to drive him through the Appalachian countryside for a pair of New Year's Day shows in West Virginia and Ohio.",1h 42min,The Last Ride
788,"6,6",['Andi Rogenhagen'],['Andi Rogenhagen'],"""Ein Tick anders"" tells the story of the 17 year old Eva who suffers of Tourette Syndrom. She tries to find a way to avoid to have move from the countryside to Berlin with her parents as she fears the life of a big city. It's a very humorous film with strange characters and a great song (Arschlicht = butt light).",1h 26min,Ein Tick anders
789,"7,6",['Kang Je-kyu'],DESCONOCIDO,"En la Corea de la Segunda Guerra Mundial, corredores rivales, uno coreano (Jang Dong-gun) y otro japonés (Joe Odagiri), van juntos a la guerra contra los soviéticos.",2h 17min,Mai wei
790,"5,4",['Mario Van Peebles'],"['50 Cent', 'Brian A. Miller']",A drama centered around a promising football running back during his senior year in college.,1h 50min,Campeón
791,"5,4",['Ville Jankeri'],DESCONOCIDO,Three outcast young men get increasingly drunk when they wander around on a hot summer day trying to find something to do.,1h 20min,Pussikaljaelokuva
792,"5,4",['Raimo O. Niemi'],"['Tuija Lehtinen', 'Juuli Niemi']",An upper class teenager leaves his predetermined life to start a new one in a small town.,1h 40min,Roskisprinssi
793,"5,9",['Anders Grönros'],"['Kinna Gieth', 'Anders Grönros', 'Peter Pohl']","Two teenage girls, Tina and Cilla, are identical twins who suffer a tragic event.",2h 5min,Jag saknar dig
794,"6,3",['Bala'],"['Bala', 'Meghana Karthik']",A zamindar takes an affinity to two extremely playful half-brothers who openly con people for a living. But a local animal smuggler steps in to disrupt the harmony in the lives of the zamindar and his adopted family.,2h 7min,Avan Ivan
795,"6,4",['Eldar Salavatov'],DESCONOCIDO,"Russia, early 90s. A fictional story inspired by financier Sergey Mavrodi, his securities company ""MMM"", and the pyramid scheme he ran that left upwards of fifteen million investors with nothing when it crashed.",1h 45min,PiraMMMida
796,"6,5",['Fumihiko Sori'],"['Ikki Kajiwara', 'Tetsuya Chiba', 'Eriko Shinozaki']","What does a young orphan urchin do in the slums of Tokyo? He gets into trouble, into brawls, into fights and eventually he lands in jail. Except this one is not just beating, he has a raw talent and a force that gets noticed. Out of jail, it is time to take the boy and polish the raw talent into something that fits the boxing ring.",2h 11min,Ashita no Jô
797,"5,9",['Ulrika Bengts'],"['Annina Enckell', 'Mikael Wahlforss']","A hauntingly beautiful and unusual coming-of-age tale. Set in 1890, Iris's artist mother leaves Stockholm for the summer and sends her 9-year old daughter to stay with an uncle in the Finnish archipelago. The girl learns to play with other children and discovers the joys of friendship in the remote Åland Islands.",1h 25min,Iris
798,"6,8",['Ian Palmer'],DESCONOCIDO,An epic 12-year journey into the brutal and secretive world of Irish Traveler bare-knuckle fighting. This film follows a history of violent feuding between rival clans.,1h 37min,Knuckle
799,"5,2",['Charles-Olivier Michaud'],['Caroline Héroux'],"This is the story of Delphine Lamarre, a young woman trying to focus on the way to dance, rather than on her university studies. It will pass through trials and consequences facing choices.",1h 40min,Sur le rythme
800,"6,0",['Ben Sombogaart'],"['Tessa de Loo', 'Marieke van der Pol']",A famous actress finds herself captured by a morbidly deranged paintress.,1h 30min,Isabelle
801,"7,0",['Michael Pavone'],['Michael Pavone'],"In 1965, 13 y.o. paperboy Andy's paired up with a geek on a project in the popular junior high teacher's class. Andy learns and grows from it.",1h 41min,That's What I Am
802,"7,1",['Tom McCarthy'],DESCONOCIDO,A struggling lawyer and volunteer wrestling coach's chicanery comes back to haunt him when the teenage grandson of the client he has double-crossed comes into his life.,1h 46min,Win Win (Ganamos todos)
803,"6,4",['Pia Strietmann'],"['Lea Schmidbauer', 'Pia Strietmann']","When novelist Andrea Dewenter dies in a car accident, the lives of her husband Christian, grown-up son Lars, and adolescent daughter Elaine go off the rails. For all three, the few days between Andrea's sudden death and her funeral turn into an emotional roller coaster that eventually shows them the virtue of being a family.",1h 35min,Tage die bleiben
804,"5,1",['Julian Grant'],"['Julian Grant', 'Grant Stokes']","When the secretly gay lead singer of up and coming band ""65 Home"" is brutally murdered in a Chicago back alley, his friends and lovers travel back to Nashville with his ashes to honor him and examine why he was killed.",1h 31min,Fall Away
805,"5,0",['Danielle L. Ross'],"['Anika C. McFall', 'Danielle L. Ross']","Two couples find themselves entangled in love triangles that lead to betrayal, broken friendships and life-changing consequences.",--,He Who Finds a Wife 2: Thou Shall Not Covet
806,"4,6",['Alexander Grigorenko'],DESCONOCIDO,"On the brink of adulthood, two lifelong friends are forced to reconcile their homosexual love for one another with their evangelical Christian upbringing.",1h 43min,A Heaven for Queers
807,"5,7",['Steven Cantor'],DESCONOCIDO,"A candid portrayal of Lily Dale, a spiritualist community in upstate New York, where most of the town's residents are registered Mediums who regularly give spiritual readings to visitors through alleged communication with the deceased.",1h 30min,Nadie muere en Lily Dale
808,"6,3",['Luis Ortega'],"['Luis Ortega', 'Alejandro Urdapilleta']","Julieta and Federico are parents of three boys, it is a high class family. He is a successful architect. They receive the visit of Tito, uncle of Federico, a gray man who has just left the prison. Tito wants to go to the sea and Federico proposes to go to a house that he himself built for some friends, but Federico stays in the city, working.",1h 13min,Verano maldito
809,"5,8",['Mike Flanagan'],['Mike Flanagan'],"Una mujer y su hermana comienzan a vincular un misterioso túnel a una serie de desapariciones, incluida la de su propio marido.",1h 27min,Absentia
810,"5,9",['Hernán Belón'],"['Hernán Belón', 'Valeria Radivo']","Elisa, a thirty-eight-year old woman, leaves for a week with her husband and young daughter on a vacation to a house in the country. Everything is going for her: she has a successful professional career, loves her family, has enough money for a comfortable life, and has plans for the future. After arriving to the country, a strange feeling takes hold of her. She start... Leer todo",1h 25min,El campo
811,"5,2",['Phillip Guzman'],"['Mick Rossi', 'Phillip Guzman']","Inspired by true events, this psychological thriller resolves around an unusual small-town Ontario household that harbors a serial killer.",1h 32min,A Kiss and a Promise
812,"5,6",['Lisa Albright'],"['Lisa Albright', 'Christina Lazaridi']","A drama centered on a former actress who subjects her 15-year-old daughter to a series of depressed small towns, money woes, failed love affairs, and bouts of depression.",1h 33min,Coming Up Roses
813,--,['Marcelo von Schwartz'],"['Jonathan Bennett', 'Marcelo von Schwartz']","David White is an American surgeon who comes to Bangkok for a conference. He meets a mysterious Thai woman who guides him towards a past he did not know changing his role, from a respected surgeon to a confused detective, to finally discover his father's hidden story and consequences.",1h 36min,Dark Bridge
814,"7,2",['Eric Leiser'],['Eric Leiser'],Three artists struggling against the grid of society find spiritual renewal.,1h 22min,Glitch in the Grid
815,"5,6",['Jamil Walker Smith'],['Jamil Walker Smith'],"Armed with dreams that extend beyond their block, Luis and Ronald, two best friends from Los Angeles, videotape their last 36 hours before shipping off to Afghanistan. One hundred days before Obama's inauguration, these young men have joined the Marines together to face the obstacles and circumstances that seem to overwhelm their passage into manhood. Luis wants to be... Leer todo",1h 20min,Make a Movie Like Spike
816,"7,5",['Jim Kohlberg'],"['Gwyn Lurie', 'Gary Marks', 'Oliver Sacks']","Tale of a father who struggles to bond with his estranged son Gabriel, after Gabriel suffers from a brain tumor that prevents him from forming new memories. With Gabriel unable to shed the beliefs and interests that caused their physical and emotional distance, Henry must learn to embrace his son's choices and try to connect with him through music.",1h 45min,La música nunca se detuvo
817,"4,9",['Heath Jones'],['Heath Jones'],"In a basement, somewhere in war torn Baghdad, hostage Adam Smith is waiting to die.",1h 35min,Kingdom of Dust
818,"3,9",['Timothy A. Chey'],['Timothy A. Chey'],"A down-and-out law student sues Satan for $8 trillion dollars. Satan appears to defend himself with seven of the greatest trial lawyers, and the trial of the century begins.",1h 37min,Suing the Devil
819,"7,1",['J.C. Chandor'],['J.C. Chandor'],"Sigue a las personas clave en un banco de inversión, durante un período de 24 horas, durante las primeras etapas de la crisis financiera de 2008.",1h 47min,Margin Call
820,--,['Dave Jannetta'],['Dave Jannetta'],Sometimes our future is waiting for us in the past.,1h 16min,Rachel & Diana
821,"5,5",['Jesse Baget'],"['Jesse Baget', 'Stefania Moscato']","Leroy Lowe, grand dragon of the Texas Ku Klux Klan confronts everything he's been taught to hate when he's sentenced to three years of hard labor on a prison work farm, where Warden Merville, dead set on rehabilitating Leroy, chooses Emilio, a Hispanic field worker imprisoned for fighting for labor rights, to be his cell-mate. Leroy, confined in a small cell with the ... Leer todo",1h 25min,Cellmates
822,--,DESCONOCIDO,DESCONOCIDO,DESCONOCIDO,--,Error nombre para la pelicula con id: tt1616096
823,"6,5",DESCONOCIDO,['Luis Arrieta'],Un chico solitario no quiere vivir más hasta que conoce a una chica que le hace sentir el actor estrella de su familia.,1h 47min,Los inadaptados
824,"6,5",['Clint Eastwood'],['Dustin Lance Black'],"J. Edgar Hoover, poderoso jefe del FBI durante casi cincuenta años, repasa su vida profesional y personal.",2h 17min,J. Edgar
825,--,"['Melinda Bateman', 'Bradley Nesbitt']",['Melinda Bateman'],"A happily married couple, trying to advance their careers, is divided by an unexpected visitor who brings chaos and death.",1h 28min,The Enemy and the Victim
826,"7,8","['Roberto F. Canuto', 'Xiaoxi Xu']","['Roberto F. Canuto', 'Xiaoxi Xu']","The story follows three family members (mother, daughter and son) as they try to survive their loneliness and obsessions by going through different sexual experiences and relationships with a prostitute.",1h 22min,Desire Street
827,--,['Daniela Creutz'],['Daniela Creutz'],"One love story within tradition - and one outside of it Set in the Kashmir region of Srinagar amidst the half-century old Pakistan-Indian conflict, a history of war and a lifetime of Islamic family tradition threaten to break apart a couple in love. Will ARRANGED HAPPINESS triumph over a Muslim man's love for a Western woman?",1h 30min,Arranged Happiness
828,"6,8",['Paul Brown'],"['Paul Brown', 'Brooks Douglass']","Heaven's Rain is the true story of the Douglass family, whose lives were irrevocably changed one evening 30 years ago. The son, after becoming an Oklahoma State Senator and authoring groundbreaking victims' rights legislation, is forced to move forward from his past.",1h 28min,Heaven's Rain
829,--,['Michael Angelo'],['Michael Angelo'],"Words to Kills is a nonfiction drama-comedy centered in Atlanta, Georgia that focuses on the life of Marco Sloan, who is a very prominent author. Vanessa Davenport, an efficient personal assistant to Marco Sloan, is at odds with Marco's fiancée Stacie Bonet. Vanessa creates a sinister plan to destroy Stacie and walk away with Marco. However, Stacie and her friends cou... Leer todo",2h 12min,Words to Kill
830,"6,2",['Rohan Sippy'],DESCONOCIDO,A corrupt police officer is entrusted the task of apprehending drug-dealers.,2h 8min,Dum Maaro Dum
831,--,DESCONOCIDO,DESCONOCIDO,DESCONOCIDO,--,Error nombre para la pelicula con id: tt1618376
832,"5,9",['Corbin Bernsen'],['Corbin Bernsen'],"The story of an 11-year-old boy whose derby dreams are left in pieces when his soldier father is killed in Afghanistan. The boy teams up with a father figure whose own son, a firefighter, died in the line of duty, and the two help each other find redemption and revive the derby.",1h 48min,25 Hill
833,"6,7",['Mia Hansen-Løve'],['Mia Hansen-Løve'],"Una crónica del romance entre Camille y Sullivan, que comienza durante su adolescencia y retoma después de la ausencia de 8 años de Sullivan tras explorar el mundo.",1h 50min,Un amour de jeunesse
834,"7,7",['Stéphanie Lamorré'],DESCONOCIDO,"SO FAR is about the life of a woman from South America struggling to make her way into the United States. To capture the struggle and danger of the journey, I traveled alone with her during weeks, filming her overland from Ecuador through Central America and into the United States, ending the journey in New York City.",1h 24min,Un si long voyage
835,"6,2",['Hans Steinbichler'],"['Josephin Thayenthal', 'Robert Thayenthal']","In Germany, in 1991, Marga suffered from Alzheimer's disease. Sofia, her daughter, only reluctantly accepts to take care of this mother, who has always treated her with a certain coldness.",1h 39min,Das Blaue vom Himmel
836,"3,5",['Kanchi Wichmann'],['Kanchi Wichmann'],"Three days in the lives of four friends on the streets of East London. Girlfriends Liza and Sally have a band to pull together and a birthday to celebrate, yet from this moment on their lives will change forever.",1h 47min,Break My Fall
837,"6,7",['Leila Djansi'],['Leila Djansi'],"Pabi and Jimah are happily married and living a peaceful life when disaster strikes in the form of a domestic accident which leaves Jimah with a scar. Unable to live with his new features, his anger and hurt turn him into a monster. The once peaceful relationship turns into abuse.",1h 56min,Sinking Sands
838,"4,0",['Simon Tate'],['Simon Tate'],"1978. A mother, father and their 3 year old son are murdered. The killer their 12 year old son William. 2008. William is released with a new identity and wants to die. Ryan needs the story. A story of courage, sacrifice and love.",1h 38min,The Point of Regret
839,"6,4",['Robbie Pickering'],['Robbie Pickering'],"Having discovered that her dying husband has an illegitimate child living in Florida, a devout Christian housewife leaves her sheltered world on a mission to reunite father and son.",1h 30min,Natural Selection
840,"6,8",['Peter Bishai'],"['Peter Bishai', 'André Pieterse']","A story of love and friendship set against the violence of Apartheid in South Africa. It is a story of the ups and downs of the lives of the three main characters, and how their lives intersect over the years.",1h 55min,A Million Colours
841,"3,5",['Brian Brough'],['Brittany Wiscombe'],"People disappear every year out in the Canadian wilderness - however, this year is different. This year something is increasing the body count. Jim ('John Schneider') and his research team trek into the Canadian wilderness to study the Canadian Lynx every year. However, this year is different. The Lynx are missing. In fact most of the wildlife is missing; Jim and his ... Leer todo",1h 28min,Bestia de nieve
842,"6,1",['Elgin James'],['Elgin James'],Lily y Alison se enfrentan a un evento que cambia la vida después de que dejan su hogar en Salton Sea y siguen a los chicos que se encuentran de regreso a Los Ángeles.,1h 34min,Little Birds
843,"7,3",['João Canijo'],['João Canijo'],A regular family living in the outskirts of Lisbon sees the serenity of their lives shaken beyond any remedy within a week.,2h 11min,Sangue do Meu Sangue
844,"6,1",['Sonja Lindén'],DESCONOCIDO,"People and technology are becoming increasingly intertwined. With the accelerating pace of everyday life and our increasing virtual presence as individuals, the line between the real and the virtual self has begun to blur. In this personal and cinematic journey, the director observes the links between freedom and dependence in our time.",1h 30min,Five Star Existence
845,"6,3",['Jason Reitman'],['Diablo Cody'],"Poco después de su divorcio, una escritora de ficción regresa a su casa en la pequeña ciudad de Minnesota, buscando reavivar un romance con su ex-novio, que ahora está felizmente casado y tiene una hija recién nacida.",1h 34min,Young Adult
846,"7,1",['Bavo Defurne'],"['Bavo Defurne', 'Yves Verbraeken', 'André Sollie']","En su búsqueda del amor, un adolescente acaba obsesionado con un chico que vive cerca.",1h 38min,"Noordzee, Texas"
847,"8,1","['Derek R. Griffith', 'Jill Baker']",DESCONOCIDO,He fights for wealth. She fights for independence.,1h 24min,D*I*Y
848,"5,2",['Shunji Iwai'],['Shunji Iwai'],"A biology teacher looks for young suicidal women online to satisfy his taste for blood. Rather than violent, his acts are quite peaceful and always consented.",1h 58min,Vampire
849,"4,4",['V.V. Vinayak'],DESCONOCIDO,"Badri, a warrior and the protector of Badrinath temple, finds himself in troubled waters after an agnostic woman falls for him and his mentor suspects him of loving her back.",2h 20min,Badrinath
850,"7,8",['Joseph Meissner'],['Helen Krieger'],"A diverse group of New Orleans artists and musicians struggle to find meaning in their lives, work, and relationships one year after Katrina. A nuanced view of the city and its people, it shows the changing landscape of New Orleans as it has never been seen before, dispelling the stereotypes of Bourbon Street and Twenties' jazz to reveal the tragic, defiant, joyful ci... Leer todo",1h 30min,Flood Streets
851,"6,4",['Carsten Unger'],"['Reza Bahar', 'Carsten Unger']","Nine-year-old Nikolas has been missing for days. Criminal psychologist Claudia notices contradictions in her conversation with the parents of the missing child, in particular Nikolas' mother, who appears to be hiding something.",1h 40min,Bastard
852,"6,5",['Don Handfield'],['Don Handfield'],A man looks back 15 years to the injury that ended his career as a promising high-school football player.,1h 58min,El Jugador
