176,"5,0",['Buket Alakus'],"['Ruth Toma', 'Hatice Akyün']","Hatice is the older of two daughters of Turkish parents living in Germany. And while their father is open minded and has adapted to the Western lifestyle in most regards, he still stands firm on some Turkish traditions. One of them is that a younger daughter cannot get married before her older sisters. With her younger sister already pregnant, Hatice is under pressure... Leer todo",1h 29min,Einmal Hans mit scharfer Soße
177,"6,1",['Conor Long'],['David Gitlin'],"Four friends and Graduate students in the physics department of their University discover their clean energy machine actually works as a crude, rudimentary teleportation device. Through experimentation, adjustments and some misuse-use of the device, it is quickly discovered that the machine holds many consequences.",1h 34min,Point B
178,--,['Jordan Olds'],DESCONOCIDO,A young man works night shifts at a bodega so during the day he can date his middle school crush in a lucid dream.,51min,Alice
179,"7,3",['Ciaron Davies'],['Ciaron Davies'],"In the future, everyone can hear you scream......On television!",1h 30min,Invasion Ireland
180,"6,5",['Steve Franke'],"['Liz Cardenas', 'Steve Franke']","Fresh from selling their company, the Baker family has moved into a posh new home. Bailey seems to be living the life and even has a crush on a pretty female dog, Trixie. But things get turned upside down when Felix, the adorable Pomeranian Trixie's family has been fostering, is suddenly snatched by a shady character named TC, who mistakes him for the big boss' dog. B... Leer todo",1h 25min,Adventures of Bailey: A Night in Cowtown
181,"6,1",['Andreas Schmied'],DESCONOCIDO,"Most of the time, Patrick Angerer enjoys a pretty laid back view of life. So he's not especially impressed by the protest action his workmates are taking against the strict wage targets set by the new management of Falkendorf steel plant. But things suddenly begin to get interesting for Patrick when his ex, Barbara Brossman, still the great love of his life, is sent t... Leer todo",1h 34min,Die Werkstürmer
182,--,['Vinnie Hogan'],['Vinnie Hogan'],"Shannon Cable looks after a weird old house that is haunted by a trio of singing ghosts known as the Funky Soul Retrievers. Joined by this supernatural trio, Shannon must confront the real threat that haunts the house.",1h 9min,The Fable of Shannon Cable
183,--,"['Shannon Lanier', 'Robbie Soto']","['Shannon Lanier', 'Robbie Soto']","At the request of his adolescent granddaughters, older Mike (Ralph Mauriello) reminisces about winning and losing his the love of his life, his wife, Beth (Alexis Barone [young], Connie Lamothe [older]), in this frame story directed by Shannon Lanier and Robbie Soto. In his recollection of his high school days as the captain of the debate team, he and his friends Mark... Leer todo",--,Reminisce
184,"6,5",['Daniel Poliner'],['Daniel Poliner'],"When Lou's romantic plot to win the heart of his model congress running-mate falls apart, he's forced to improvise.",1h 46min,"Jack, Jules, Esther & Me"
185,"6,6",DESCONOCIDO,DESCONOCIDO,"Valencia is a collaboration between a national community of queer filmmakers to adapt the underground classic memoir into a kaleidoscopic vision of San Francisco's Mission District in the early 90s during the rise of a punk lesbian diaspora told through the experiences of Michelle, a single rootless twenty-something searching for sex and love, drugs and adventure.",1h 45min,Valencia: The Movie/S
186,"5,1",DESCONOCIDO,DESCONOCIDO,"Cuatro episodios sobre el fin del mundo desde diferentes puntos de vista y también desde génerox diferentes: romance, drama, thriller y película de acción.",1h 52min,Al final todos mueren
187,"7,0","[""Je'Caryous Johnson""]","[""Je'Caryous Johnson""]","Bishop Luther Lance Love Jones and his wife, Beulah Mae have made a business of saving relationships on the brink of disaster. When three couples show up for their latest marriage retreat, the issues destroying their relationships may be more than even they can fix. Four couples turn to an unconventional retreat to save their relationships to see if they really are Ma... Leer todo",1h 38min,Je'Caryous Johnson's Marriage Material
188,--,['Hideya Yamaguchi'],DESCONOCIDO,"Takeuchi and Abe are failing TV directors. Seeking a chance to break out from their slumps they go to the Jukai. The Jukai is a vast, primeval forest that spreads out on the northwestern foot of Mount Fuji, where many have wandered in and never came back. Today it is widely known as a suicide destination. The directors stake out near the Jukai, hoping to find a prospe... Leer todo",2h 4min,Jukai no futari
189,"6,0",['Robbie Moffat'],['Mark A.C. Brown'],Fledgling female stand up learns how not to die on stage.,1h 38min,Heckle
190,"4,5",['Stephen Langford'],['Stephen Langford'],"When an IT guy meets a beautiful girl who dreams of being an actress, he pretends to be a big shot producer to win her over. With the insistence of her suspicious friends, she continually tests to see if he is the real deal. This leaves him no choice but to desperately keep up the illusion, because he finds himself falling in love with her.",1h 30min,She's with Me
191,"6,8",['André Pellenz'],DESCONOCIDO,"After another spat with her kids, Dona Hermínia decides to take some time off from them and hides away in her aunt's house, where she reminisces about her kids in an age when they still needed her.",1h 24min,Minha Mãe é uma Peça: O Filme
192,"5,6",['Tom Krueger'],['Tom Krueger'],"In this ensemble comedy set in the heart of Cajun Louisiana, a haplessly ne'er-do-well son returns home from a year in prison, eager to redeem himself in the eyes of his family. Armed with the wisdom of 'the Quantum Secret,' and a whole-hearted but off-beat attempt at a viral internet campaign, he goes about reinventing himself as an alternative medicine doctor. Of co... Leer todo",1h 28min,You're in Charge
193,"7,0",['Rainer Cvillink'],"['Rainer Cvillink', 'Sean Dunne']",A pair of working class stiffs kidnap the son of San Francisco's most feared gangster only to find out that the father doesn't want him back.,1h 26min,The Final 4
194,"7,4",['Márk Bodzsár'],DESCONOCIDO,"1992. Milan Kolarov escapes from Yugoslavia to Hungary. Shortly after that, he gets recruited by paramedics, who are making big money of selling identities of the people died in the ambulance on the way to the hospital.",1h 40min,Isteni müszak
195,--,['Nils Härgestam'],['Nils Härgestam'],"In a bizarre post-apocalyptic world, Drifterboy and Boss-Action go on a quest to find a supposed civilization beyond a mountain. Instead, they find hell.",47min,Mutant Apocalypse in Drugfuck Deathcamp
196,"5,3",['Alessandro Siani'],"['Alessandro Siani', 'Fabio Bonifacci']",A princess has to pretend to be in love with a rude and ignorant boy to gain approval from her subjects.,1h 37min,Il principe abusivo
197,"7,8",['Matthew Kowalchuk'],"['Matthew Kowalchuk', 'Morris Panych', 'Daniel Smith Arnold']","Suicidal accountant Holloman forms a strange relationship with happy-go-lucky salesman Lawrence. As he tries to teach Holloman to stay positive and turn his life around, Lawrence's own life begins to crumble.",1h 28min,Lawrence & Holloman
198,"4,9",['Patrick McGuinn'],['Greg Chandler'],"Birch, a young man living in the Catskill Mountains, reunites with his childhood friend from the city, Andrew.",1h 41min,Leather
199,"7,0",['Sylvain Chomet'],['Sylvain Chomet'],"Paul, thirty or so, lives in a Paris apartment with his aunts, two old aristocrats who have raised him since he was two and who dream of seeing him become a virtuoso pianist.",1h 46min,Attila Marcel
200,"5,8",['Fausto Brizzi'],DESCONOCIDO,"Andrea, unico maschio in un'ingombrante famiglia tutta al femminile (sono sette: mamma, tre sorelle, nonna, badante e cane, rigorosamente femmina), ha finalmente incontrato Giulia, la donna della sua vita. Poiché nessuna delle precedenti fidanzate è mai sopravvissuta al deflagrante impatto con le invadenti e devastanti femmine, al povero Andrea sembra che l'unico modo... Leer todo",1h 34min,Pazze di me
201,"6,8","['Israel Cárdenas', 'Laura Amelia Guzmán']","['Israel Cárdenas', 'Laura Amelia Guzmán']","Carmita, an 80 year old Cuban actress exiled in Mexico lives in a mansion in ruins. She's strong enough to appear on TV, read her fan mail and complain about her ex husband who ruined her dream of a possible Hollywood career. The unexpected visit of Laura and Israel allows us to discover a world trapped in the golden age memories.",1h 20min,Carmita
202,"6,4","['Robert Townsend', 'Elijah Nathaniel Wells']","['Michelle Amor', 'Robert Townsend', 'Cheryl L. West']",El entrenador de baloncesto de un instituto intenta dar la vuelta a su equipo.,1h 24min,Playin' for Love
203,"6,5",['Henry Chan'],"['Megi Hsu', 'Weiko Lin']","When a cold hearted telecommunications executive returns to his small island town for his estranged mother's burial, he learns about the true Taiwanese tradition that mandates him to marry within 100 days so that the parent's spirit can transition peacefully. When a typhoon leaves him stranded for 3 days, he rekindles romance with his free spirited, childhood sweethea... Leer todo",1h 44min,Zhen ai 100 tian
204,"5,6",['Toshio Lee'],['Daisuke Tanaka'],"The Tanita Corporation has developed the world's first body fat measuring device. The company itself also has many overweight employees. Because of this, the company finds it difficult to persuade perspective customers to buy their product. Company President Unosuke Tanida (Masao Kusakari) then orders all of his employees to go on diet. Vice President Konosuke (Kenta ... Leer todo",1h 40min,Taishibôkei tanita no shain shokudô
205,"7,2",['Ethan Dawes'],['Ethan Dawes'],"After a series of frustrating events throw Max Greene over the edge, he and three friends take an impromptu trip to the desert to clear their heads and reassess their lives.",1h 10min,Go for Broke
206,"4,6",['Roberto Santiago'],"['Pablo Fernández Vázquez', 'Roberto Santiago']","A romantic comedy that tells the story of Gonzalo, a Spaniard, and Valentina, an Argentinian. They live on Margarita Island and manage a hotel that only admits couples. After several years together, their love is going through a crisis, maybe because of the exhaustion that time might cause, maybe because of the lack of passion. The arrival of new guests, among whom is... Leer todo",1h 37min,Sólo para dos
207,"4,5",['Indra Kumar'],DESCONOCIDO,"Meet, Prem, and Amar look to have a blast at their college reunion, though they soon find themselves in another predicament.",2h 17min,Grand Masti
208,"6,8",['Roberta Durrant'],['Shirley Johnston'],"'Billy Elliot with sax meets Buena Vista Social Club in Cape Town, South Africa.' 13-Year-old Felix dreams of becoming a saxophonist like his late father, Zweli, of the famous Bozza Boys Band. His mother, Lindiwe, hates jazz, which she blames for Zweli's death. Because of alcohol, he died before her youngest son was born. Felix's world is turned upside down when he wi... Leer todo",1h 34min,Felix
209,"6,7",['Chadd Harbold'],DESCONOCIDO,"When former comedian Mark McCarthy is faced with a rare form of cancer, he hires a young, impressionable cameraman to document his crude and comical lessons on what it means to be a man for his unborn son.",1h 25min,How to Be a Man
210,"4,9",['Carlo Vanzina'],DESCONOCIDO,"A family by surprise! Five people who never met are convened by a notary for the reading of a will, and learn they are all brothers and sisters, children of the same father! They'll share a large inheritance if they can deliver the ashes to their father's favorite lake in Arizona! Accepting the challenge, these newfound family members (""mai stati uniti"") set out on a ... Leer todo",1h 30min,Mai stati uniti
211,"6,6",['Dexter Fletcher'],DESCONOCIDO,Dos soldados regresan a su hogar en Edimburgo y retoman sus vidas y relaciones.,1h 40min,Amanece en Edimburgo
212,"5,2",['Tammy Riley-Smith'],['Tammy Riley-Smith'],A passionate chef resorts to extreme measures to get an obsessive dieter to eat good food.,1h 23min,Delicious
213,"6,4",['Seiji Kishi'],"['Romeo Tanaka', 'Jun Kumagai', 'Makoto Uezu']","Menzu keeps quiet about his delusions of grandeur until Ry, a beautiful young woman claiming to be a witch from another universe, expands his horizons.",1h 25min,Aura: Maryuuin Koga saigo no tatakai
214,--,['Roger Majkowski'],['Roger Majkowski'],"The Savage Beast is a dark comedy that tells the story of a troubled, slightly sex addicted dog trainer who believes he's discovered a sound, in the form of a vicious dog's strange howl, that negates his libido...thereby solving all of his ills and allowing him to see, what he's convinced, is the truth about the world around him...or so he thinks so.",1h 33min,The Savage Beast
215,"5,7",['Cherien Dabis'],DESCONOCIDO,"May returns to her childhood home in Jordan for her wedding. Shortly after reuniting with her sisters and their long-since divorced parents, myriad familial and cultural conflicts lead May to question the big step she is about to take.",1h 39min,El verano de May
216,"7,4",['Damian Lahey'],['Damian Lahey'],"During the holidays, a recent widower and struggling children's book author makes one last push for his career while trying to take care of his two little girls.",1h 16min,The Heroes of Arvine Place
217,"5,8",['Erik Canuel'],"['Diane Cailhier', 'Erik Canuel', 'Andrée A. Michaud']","When betrayed by his family, a man calling itself Fred Moreau escapes with a briefcase full of stolen money. He hides in a cottage on the shore of Lake Kaionwahere, believing to be quiet with his dog Jules. Soon, however, he meets his only neighbor, a mysterious fisherman, and a dancer who is hiding from him while a policeman in love with her trying to find her. While... Leer todo",1h 58min,Lac Mystère
218,"6,6",['Giovanni Veronesi'],DESCONOCIDO,"The life of a sub-proletarian boy in Rome through the Seventies and Eighties, choosing his own path with his lifetimes friends and family.",1h 53min,L'ultima ruota del carro
219,"6,2",['Brian McGuire'],['Brian McGuire'],A pervert's quest for love.,1h 28min,Prevertere
220,"7,0",['Jay Douglas Guffey'],"['Bill Hicks', 'A.J. Moorehead']",,--,Bill Hicks Lives
221,--,['Brian Spiegel'],DESCONOCIDO,A documentary exploring the largest convention of queer rock climbers in the world and the reasons behind its forming.,1h 1min,Climbing with Pride
222,"8,5",['Peter Cameron'],['Peter Cameron'],"After breaking up with his girlfriend, Dave's two best mates, Murray and Bob, decide to take him on a road trip to Sydney enlisting their gullible neighbor George to drive them. They then embark on a journey that they won't soon forget.",1h 20min,Bush Boys
223,"4,3",['Martin Miehe-Renard'],DESCONOCIDO,"La familia Berg gana un viaje a África. Cuando los niños quieren participar en obras de caridad con animales en peligro de extinción, y sus padres no pueden, persuaden a su tío Eric para los lleve.",1h 17min,Min søsters børn i Afrika
224,"8,8",['Robert Krakower'],DESCONOCIDO,Always Learning is a comedy about a 17-year old homeschooler named Tobiah whose entire life is controlled by the decisions of his overprotective mother. Tobiah's life takes a turn for the worse when his mother decides he is too young to move away to a four-year university from which he's received a full-ride scholarship. It's at this point that a recently expelled del... Leer todo,1h 25min,Always Learning
225,"6,7",['Keisuke Yoshida'],"['Keisuke Yoshida', 'Ryô Nishihara']","Mabuchi and Yoshimi meet at a screenwriting class. Mabuchi works hard to become a writer, but can't see a future for herself. Meanwhile, Yoshimi is a bigmouth who never tries hard at anything. These two people's fate intertwined.",1h 59min,Bashauma-san to biggu mausu
226,"4,7",['Alejo Rébora'],"['Matías Oniria', 'Alejo Rébora']","The day after she got her brother in the second worst problem of his life, Ana L. Bruselas escapes her captors without being able to bring her sawed off tits with her. But Ana L. won't rest until she gets her beloved tits back.",1h 28min,Trash dos: las tetas de Ana L.
227,"4,0","['Jason Friedberg', 'Aaron Seltzer']","['Jason Friedberg', 'Aaron Seltzer']","Claire está a punto de casarse, pero su despedida de soltera rápidamente se sale de control.",1h 30min,Resacón en Las Vegas. Ellas también
228,"5,6",['Siraj Kalla'],"['Siraj Kalla', 'Rajsekhar Pvr']",Four friends desperately in need of money decide to rob a local bank until they're trapped inside with hostages and can't get out.,--,D for Dopidi
229,--,['Susan Nogues'],"['Miranda Megill', 'Susan Nogues']","Celebrity reporter Kate Reynolds has the career that every young starlet in Hollywood dreams of. Fame, family, fortune. That is until, everything comes crashing down at once. On a journey of self-discovery, Kate seeks out her parent's childhood home - a small town in Tennessee, where maybe she can start over. Here she meets a local conspiracy theorist and self-proclai... Leer todo",1h 8min,Daughter
230,--,DESCONOCIDO,DESCONOCIDO,DESCONOCIDO,--,Error nombre para la pelicula con id: tt2505418
231,"5,9",['Blake Powell'],"['Aude Metzger', 'Blake Powell', 'Bram Stoker']","The year is 1977 and the Black Dawn is putting its diabolical plan to resurrect Count Dracula into motion. Victoria Van Helsing and Patricia Pennyweather must battle the Black Dawn, the mysterious T.R.A. and even Count Dracula himself to save the world.",1h 15min,Dawn of Dracula
232,"6,3",['Charlie Vaughn'],['Brandon Alexander III'],"An uproarious cross-dressing comedy, First Period follows a new girl and an outcast as the most awkward girls in high school. Together, they set out to take over the annual talent contest and win over the whole school.",1h 40min,First Period
233,"4,8",['Jirí Menzel'],"['Jirí Menzel', 'Tereza Brdecková']","An opera troupe in a small town decides to perform Mozart's Don Giovanni. The view behind the scenes uncovers the world of opera without the glitter. A tale of love and disappointment, about music and passionate love-making and about people that live their lives in spite of the opera.",1h 42min,Donsajni
234,--,['Dan Gil'],['Dan Gil'],,--,Jingle Boy
235,--,['Vincent C. Morreale'],DESCONOCIDO,,1h 35min,How to Win the Internet and Other Questionable Endeavors
236,"4,4",['Fred Olen Ray'],"['Pat Moran', 'Andrew Stevens']","It's Chad Sheppard's birthday and he's in for a big surprise! His best friend, Abner, a big furry Sheepdog can suddenly vanish into thin air and can talk too! But Chad already has enough problems fighting off two bullies who want to wreck his chances with the cute girl next door. With the parents out of the house, Chad and Abner have to fight off the bad guys, get the... Leer todo",1h 30min,"Abner, the Invisible Dog"
237,"3,4",['Sangeeth Sivan'],"['Jasvinder Bath', 'Lynda Deol']","The trio reunites in the UK and they fall in love, become involved with a nightclub, and have to face up to the challenge of a local don.",2h 34min,Yamla Pagla Deewana 2
238,"2,1",['David DeCoteau'],['Andrew Helm'],A sassy feline helps a family resolve its problems.,1h 25min,A Talking Cat!?!
239,"4,9",['Hilde Van Mieghem'],"['Bert Scholiers', 'Steven R. Thé', 'Hilde Van Mieghem']","Four women in the Miller family: teen daughter Eva, her mother Judith, aunt Barbara and older half-sister Anna, work their way through the chaos called love. The result is a roller coaster ride of first crushes, lust, affairs, baby fever, and indestructible love. The four women are beautiful, courageous and sensible, but are also sometimes a bit lost. Can their male c... Leer todo",1h 32min,Smoorverliefd
240,"7,2","['Yelena Popovic', 'Alexandros Potter']",['Yelena Popovic'],"Helena, a beautiful immigrant actress/model, way too old for modeling and too old for acting without credits finally lands a big job but overseas. Out of desperation and advice of her LA friends she commits a federal fraud to get her traveling documents. To escape jail time she gives out names. In this comedic/dramatic piece as she is still wondering where her career ... Leer todo",1h 21min,L.A. Superheroes
241,"5,7",['Mark de Cloe'],"['Maarten Lebens', 'Simon Verhoeven']",Following the love lives of different types of men in Amsterdam.,1h 37min,Mannenharten
242,"6,2",['Holger Haase'],"['Jens-Frederik Otto', 'Florian David Fitz']",When three generations of one family temporarily have to live together under one roof chaos ensues.,1h 41min,Da geht noch was
243,--,['Jiyoung Lee'],['Jiyoung Lee'],We must all own up to our moral sleaze.,1h 9min,Moral Sleaze
244,"7,2",['Michael Ferrell'],['Michael Ferrell'],"When Brian's new girlfriend, a stand-up comedian, suddenly disappears, he enlists the help of his broken-hearted best friend and imaginary characters from a cliché romantic comedy to find her.",1h 15min,Twenty Million People
245,"6,1",['Drew Tobia'],['Drew Tobia'],An odd pregnant girl disrupts the lives of her campy recovering alcoholic mother and crude gay sister during a nervous break-down.,1h 22min,See You Next Tuesday
246,"5,0",['Justin Baird'],"['Sherman Hirsh', 'Les Mahoney']","Mike Case is a low-rent private detective who works out of his car and advertises on Craigslist. When approached by the wealthy socialite Victoria Billows to find her missing husband, Mike is initially reluctant (""A missing husband? Never heard that one before"") but is persuaded to take the case by Victoria's money and her not so subtle feminine charms.",1h 16min,Mike Case in: The Big Kiss Off
247,--,['Michael J. Klassen'],DESCONOCIDO,"Marc Anderson, a young film maker, in his quest to find happiness battles in reality and through his own imagination.",1h 45min,Contract Player
248,"5,9",['Emmanuel Saada'],DESCONOCIDO,"All connected with a mourning and a pregnancy, a bunch of 30 something years old guys are looking for a goal in their lives. 'Elephants' tells in a poetic way, this deep human adventure.",1h 27min,Les éléphants
249,"5,8",['David Wnendt'],DESCONOCIDO,Las aventuras de una chica excéntrica que tiene actitudes extrañas hacia la higiene y la sexualidad y que anhela el reencuentro de sus padres divorciados.,1h 49min,Feuchtgebiete
250,--,['Cord McConnell'],['Cord McConnell'],Josh has just suffered his life's greatest heartbreak. His world is now incomplete and things are only getting dimmer... until he commits to finding his true love through online dating.,1h 20min,Me Without You
251,"6,9",['Roberto Andò'],DESCONOCIDO,"When a politician disappears, his (mad) twin brother is brought to replace him.",1h 34min,Viva la libertad
252,"6,5",['Laïla Marrakchi'],['Laïla Marrakchi'],"The whole family is reunited when Sofia comes back for her father's funeral. Quickly, inner problems are revealed.",1h 40min,Rock the Casbah
253,"7,7",['Sherief Elkatsha'],DESCONOCIDO,"A documentary that explores the life of one of the world's most populated cities from its streets. Shot in 2009-2012 (before and during the Egyptian revolution, and ending with the most recent presidential elections), the film explores the country's collective identity, inherent struggles, and the sentiments that lead through the historic changes taking place in Egypt... Leer todo",1h 17min,Cairo Drive
254,"4,6",['Lulu Keating'],"['Lulu Keating', 'Roslyn Muir', 'Peggy Thompson']","Lucille comes of sexual age in the rebellious 1970s. Determined to take advantage of the new freedom offered by The Pill, she explores and experiments with women and men, straight and gay, at home and abroad. As her careen as a musician advances, Lucille's wild lifestyle and haunting past derail her. With the support of her gay roommate and her first woman lover, she ... Leer todo",1h 23min,Lucille's Ball
255,"5,1","['Lucky McKee', 'Chris Sivertson']","['Lucky McKee', 'Chris Sivertson']","A rebel girl signs up a group of cheerleaders to help her take down the captain of their high school football team, but a supernatural turn of events thrusts the girls into a different battle.",1h 29min,All cheerleaders die - Todas las cheerleaders muertas
256,"8,3",['Stanley Joseph'],"['Stanley Joseph', 'James Morcan']",A young Indian nurse moves to Sydney where she's placed in the household of a wealthy Indian-Australian family and given the task of caring for an elderly lady.,1h 39min,My Cornerstone
257,"6,3",['Nico Sommer'],"['Julia Stiebe', 'Nico Sommer']","With her husband leaving, Silvi finally realizes that her rather dull marriage has failed. The 47-year-old woman, now lost and lonely, but also driven by the desire to not be alone, she decides to start over again.",1h 37min,Silvi
258,--,['Tôru Kamei'],DESCONOCIDO,,1h 15min,Mameshiba Ichirô fûten no shibajirô
259,"6,9",['Daniel Dencik'],"['Daniel Dencik', 'Michael Haslund-Christensen', 'Janus Metz']","A grand and adventurous journey of discovery to the last white areas of the world map. But no matter how far we go and how hard we try to find answers, we ultimately meet ourselves and our own transience.",1h 30min,Ekspeditionen til verdens ende
260,"4,1",['Jason Richard Miller'],DESCONOCIDO,"Four friends go to Las Vegas to win a poker game. When the friends lose, they run from a loan shark and end up in the desert.",1h 30min,Unidentified
261,--,['Jay Segura'],DESCONOCIDO,"California Dreamers is an epic animated adventure that tells the story of a bird and cat that leave their home Russia to seek the American dream. The pair makes their way to Long Beach, CA and quickly learn that the dream can sometimes be a nightmare as they are captured and imprisoned by the LYFE (Live Young Forever) Corporation, a cosmetics manufacturer that secretl... Leer todo",--,California Dreamers
