,Puntuacion_IMDB,Dirección,Guionistas,Argumento,Duración,Nombre de la película
0,"5,9",['Patrick Perez Vidauri'],DESCONOCIDO,"This summer, Beetle, Sharky and Joker are on a quest to become men, but it's going to take a lot of guts, money and some fake ID's because Lola's Love Shack is their last stop for losing it.",1h 33min,Lola's Love Shack
1,"5,3",['Lynn Shelton'],['Lynn Shelton'],"A massage therapist is unable to do her job when stricken with a mysterious and sudden aversion to bodily contact. Meanwhile, her uptight brother's floundering dental practice receives new life when clients seek out his healing touch.",1h 28min,Manos mágicas
2,--,"['Darik Datta', 'Neil Evenson']",DESCONOCIDO,A hilarious behind the scenes look at the second largest comedy festival in Canada. See the chaos and conflict and meet the personalities behind the microphone in this laugh filled joy ride into insanity.,1h 27min,Squirrel Chasing
3,"5,9",['Ken Kwek'],['Ken Kwek'],A kindergarten principal finds a series of morbid cartoons drawn by a docile pupil. A porn actor struggles to rise to the occasion while filming his first porno. A middle-aged nightclub bouncer faces off with a rebellious teenage stripper. Director Ken Kwek tells three iconoclastic stories in a short film that pitches political correctness out the window of Singapore ... Leer todo,46min,Sex.Violence.FamilyValues.
4,"5,1",['Geir Vegar Hoel'],"['Stig Frode Henriksen', 'Tommy Wirkola']","Jompa Tormann is back, and everything is better, except the humor, which is even worse than in the first movie of vengeance.",1h 28min,Kill Buljo 2
5,--,['Scot Weaver'],['Jk Stone'],Newhighers is a comedy about two roommates and their loss and pursuit of employment. NEWHIGHERS is a double edge sword. On one edge it's about two roommates and several others being given employment under false pretenses. And on the other edge it's about the total embracement of the weed culture.,1h 29min,Newhighers
6,"6,0",['Matthew Perkins'],"['Dugan Bridges', 'Matthew Perkins']","Tired of being overlooked for bigger roles, a struggling dwarf actor sets out to be cast as the Tin Man in Martin Scorsese's remake of The Wizard of Oz.",1h 24min,The Little Tin Man
7,"5,3","['Stewart Alexander', 'Kerry Skinner']",['Stewart Alexander'],"Romance, crisis and adventure on one of London's luscious commons.",1h 29min,Common People
8,"6,5",['Andrew Fierberg'],['Justin McCarthy'],"Two rich kids from Mexico, who came to New York City to party, are caught up in a case of mistaken identity. They end up in the Hamptons after fleeing an INS agent.",1h 30min,El cielo es azul
9,"6,3",['Yoshishige Miyake'],"['Hiro Arikawa', 'Yoshikazu Okada']","Set within the hospitality division of the Kochi Prefecuture, employees attempt to find new ideas to promote tourism in the region. The hospitality division in Kochi Prefecture can't promote the beautiful nature in the area due to a strict rule by the prefecture government. Popular writer and Koichi area native Kyosuke Yoshikado (Kengo Kora) is appointed as a special... Leer todo",2h 3min,Kenchô omotenashi ka
10,"5,5",['Henry Saine'],DESCONOCIDO,"Tras las guerras corporativas, en la era postapocalíptica de los Bounty Killers, los asesinos compiten por fama y dinero.",1h 32min,Bounty Killer
11,"4,0",['Colin Sander'],"['Christian Sander', 'Colin Sander', 'Scott Sander']",Three college freshmen tackle their first semester under the guidance of their legendary stand-in R.A.,1h 23min,Dean Slater: Resident Advisor
12,"6,3",['Nicholas Naylor'],DESCONOCIDO,"Will Travers, The manager of a successful pawnshop has to see if his cheating girlfriend is at it again. But while he is searching for answers he has to entrust his shop to to his team of sarcastic slackers! Watch as they set out to prove that just because they take your crap doesn't mean they will put up with it!",1h 50min,PawnZ
13,"7,1","['Hélène Giraud', 'Thomas Szabo']","['Thomas Szabo', 'Hélène Giraud']",Una mariquita une fuerzas con un escuadrón de hormigas negras para recuperar una caja de lata con deliciosos terrones de azúcar. Un batallón de feroces hormigas rojas ya ha puesto sus ojos en el botín. ¿Quién se impondrá?,1h 29min,Minúsculos: El valle de las hormigas perdidas
14,"5,3",['Prabhu Deva'],DESCONOCIDO,"An aimless ruffian starts working for a drug baron and his mission is to kill the rival, whose niece he eventually falls for.",2h 26min,R... Rajkumar
15,"3,4",['Anil Sunkara'],"['Jayashankarr', 'Upendra Madhav', 'Anil Sunkara']","Bava (Allari Naresh), Ajay (Kick Shyam), Shiva (Vaibhav) and Purush (Raju Sundaram) are thick friends. They grow up together and share everything in life. While Bava is an easy going person, Ajay and Shiva are seen as more mature and responsible people. Purush is a comical flirt. Ajay is all set to marry his sweetheart Shruthi (Sheena), so the four friends decide to c... Leer todo",2h 26min,Action
16,"4,6","['Brian Follmer', 'Jasen Talise']","['Brian Follmer', 'Jasen Talise']",A group of Berkeley students make it rich in the stock market and become the youngest landlords in the city of Berkeley.,1h 41min,Bullish
17,--,"['Jeff Prugh', 'Jason Thompson']","['Jeff Prugh', 'Jason Thompson']","After an uninspired waiter receives a one-month medical leave of absence, his girlfriend gives him those thirty days to figure out his life.",1h 11min,Leave of Absence
18,"6,7",['Maximilian Hult'],['Maximilian Hult'],"Lou mostly keeps to herself, grandmother Frida grieves for her husband's death, Tom isn't good at anything, and Henrik always finds the right book in his second-hand bookshop.",1h 30min,Hemma
19,"5,9",['Yukihiko Tsutsumi'],DESCONOCIDO,"Himawariso is a group home for intellectually disabled persons. Comic book artist Itpon moves in and begins working at the institution with his daughter Mako, who is intellectually disabled. Mako and another resident, Uyan, fall for each other, but father is concerned.",--,Kuchizuke
20,"8,3",['Yôichi Fujita'],DESCONOCIDO,Gintoki travels into the future and discovers it to be a wasteland with his friends fallen apart. He reunites them to find out what went wrong and how to fix things.,1h 50min,Gekijouban Gintama Kanketsu-hen: Yorozuyayo eien nare
21,"4,6",DESCONOCIDO,DESCONOCIDO,"Brad has come to the crossroads in his life. He's 30 years old, lives with his parents and has a dead-end job as a pizza delivery driver. He is disrespected by his parents, his boss, his customers, a hooker, and even his best friend. Throughout the movie Brad undergoes a building psychosis. He feels pathetic, like a disappointment and a complete failure. Brad becomes ... Leer todo",1h 16min,The Pizza Boy
22,"6,5","['Olli Koivula', 'Solvan Naim']",['Solvan Naim'],"A young pizza delivery boy, Anthoni, faces a life-changing crisis when his curiosity pulls him away from his delivery order into an adjacent apartment's open door. He cannot resist the temptation when he stumbles across a large sum of money in the aftermath of what seems to be a drug deal gone bad. After taking the money his life is thrown into turmoil as everyone he ... Leer todo",1h 23min,Full Circle
23,"3,4",['Travis Legge'],"['Kyle Hoskins', 'Travis Legge']",Sasha tries to get her soon-to-be ex husband Kyle laid so she can move on with her sex life guilt-free.,1h 30min,Dry Spell
24,--,['Christopher D. Grace'],['Christopher D. Grace'],"A Dramatic but occasional satiric intersection of diverse intimate relationships, and how the individuals involved juggle life, love, and loathing.",--,Sleeping in Beds
25,"5,0",['Lisa Marie Gamlem'],"['Birgitte Bratseth', 'Anne-Cath Vestly']",A girl has a trouble family when they accidentally miss there truck by a theif. But basically their Grandma comes to them for a visit. They found the car and got it back to there house.,1h 6min,Mormor og de åtte ungene
26,"7,1",['Daniel D.W.'],DESCONOCIDO,"An independent film maker stays with an eccentric artist and his art manager to document their art process, which is both strange and frightening.",1h 40min,Clark: A Gonzomentary
27,"5,5",['Courtney Daniels'],['Courtney Daniels'],"While at a dinner party, four married Los Angeles couples play 'a kissing game,' Seven Minutes in Heaven.",1h 27min,What Other Couples Do
28,--,"['Todd Frugia', 'James Strzelinski']","['Todd Frugia', 'James Strzelinski']",ONE BODY is an existential comedy that follows two members of a religious order that disbands after a doomsday prediction fails to be realized.,1h 1min,One Body
29,"3,2",['Creep Creepersin'],['Creep Creepersin'],"A deformed killer named ForkFace comes back to a town after years of being missing to get vengeance against the townspeople who made him this way the only way he knows how, by forking them all to death.",--,Fork You
30,"7,5",['Eugenio Derbez'],DESCONOCIDO,Un hombre que creó un nueva vida para él y la hija que fue dejada a su puerta seis años atrás ve su familia amenazada por la reaparición de la madre biológica.,1h 55min,No se aceptan devoluciones
31,"7,8","['Edgar Tang', 'Dzul Sungit']",['Edgar Tang'],A spirited cancer survivor goes on a spontaneous search for 'The Berlin Patient' - the first man in the world actually cured of HIV.,1h 13min,I Hugged the Berlin Patient
32,"6,3",['Pavan Moondi'],"['Pavan Moondi', 'Michael Sloane']","Everyday Is Like Sunday is a comedy/drama aiming the lens at post-collegiate characters stuck between their imminently-ending youth and impending adulthood. The film follows Mark, Jason, and Flora, as they realistically attempt to pull themselves out of economic and emotional doldrums.",1h 30min,Everyday Is Like Sunday
33,"5,3",['Herschel Faber'],['Herschel Faber'],Four men share an ex factory loft in LA. Dean is a romantic wannabe screenwriter. The others are cavemen preoccupied with getting laid. Tess is their platonic friend.,1h 28min,Cavemen
34,"6,6",['Jefferson Moore'],DESCONOCIDO,"An arrogant young executive is forced to rely on the assistance of a grizzled, reclusive farmer to get her home in time for the upcoming Easter holiday with her estranged family.",1h 38min,Pieces of Easter
35,"2,8",['Matt Gibson'],['Matt Gibson'],"On September 11, 2001, terrorists attacking the World Trade Center rise from the dead as zombies.",1h 24min,Towers of Terror
36,--,['Jordan Gouveia'],['Jordan Gouveia'],,--,Halfway
37,"2,8",['Dennis Devine'],"['Brandon Benz', 'Dennis Devine', 'Keith Parker']",This movie is a documentary about fat people.,1h 22min,Fat Planet
38,"4,8",['Calvin Lee Reeder'],['Calvin Lee Reeder'],"A quiet drifter leaves prison, finds home on the road.",1h 37min,The Rambler
39,"6,6",['Fred Schepisi'],['Gerald Di Pego'],Un profesor de arte y un profesor de inglés forman una rivalidad que acaba en una competición en su escuela en la que los alumnos deciden si las palabras o las imágenes son más importantes.,1h 51min,Lecciones de amor
40,--,['Jared Vincenti'],['Jared Vincenti'],A halfway-romantic comedy about brain damage and life after college.,1h 24min,Day of Youth
41,"4,5",['Claudio Insegno'],DESCONOCIDO,,1h 30min,Una notte agli studios
42,"6,2",['William Dickerson'],"['William Dickerson', 'Dwight Moody']","Who is Taylor? That is the question filmmaker William Dickerson tries to answer in this metafictional satire about a quirky and charismatic lifestreamer. ""Taylor"" is an open book who magnetically draws others into his world where public and private are one and the same. But as Dickerson pushes Taylor to delve deeper into his traumatic past, the story takes an unexpect... Leer todo",1h 37min,The Mirror
43,"6,8",['Pierre Monnard'],DESCONOCIDO,"Perfection-obsessed Bin Inspector, Hansjörg Sthäli, falls for the wrong girl, Lily Frei, a charming waitress at his local diner and a compulsive hoarder at home.",1h 35min,Recycling Lily
44,"6,4",['Luis Carlos Hueck'],"['Alfredo Hueck', 'Luis Carlos Hueck']",HD. Baseball fans Andres and Julissa fall hard for one another and have to keep Andres' love of a rival team secret from Julissa's father.,1h 55min,"Papita, maní, tostón"
45,"6,4",['Anna Condo'],['Anna Condo'],"With money running low, nine New Yorkers forgo their annual Christmas in Aspen and head to Pennsylvania for a murder-mystery weekend.",1h 23min,Merry Christmas
46,"7,4",['Ryan McKenna'],['Ryan McKenna'],The First Winter is the story of Portuguese man's first winter in Winnipeg.,1h 13min,The First Winter
47,"4,4",['Egidio Coccimiglio'],"['Floyd Byars', 'Cheol-su Park']",The lives of two female neighbors intersect when their individual obsessions begin to unravel.,1h 28min,Compulsion
48,"6,6",['Goran Vojnovic'],DESCONOCIDO,"Marko, Adi, Aco, and Dejan hang out in front of a block of flats in Fuzine. Marko is pissed because he quit playing basketball, the sexy TV presenter doesn't notice him, and his father Radovan will beat him up for quitting basketball. Adi is irritated by the fact that his brother Sanel is a drug addict and his father Mirsad prefers to shag waitresses somewhere in Aust... Leer todo",1h 40min,Cefurji raus!
49,"6,0",['Hajime Hashimoto'],"['Naomi Azuma', 'Ryôta Kosawa', 'Yasushi Sutô']",,1h 59min,Tantei wa bar ni iru 2: Susukino daikousaten
50,"6,1",['Rocco Papaleo'],"['Walter Lupo', 'Rocco Papaleo']","Mamma Stella is on edge. As if she hadn't got enough trouble already with her daughter Rosa Maria, who has left her husband now Costantino, her son, has disrobed. Afraid to be the talk of the village, relegates him to a distant lighthouse belonging to the family. But Costantino does not remain far from the madding crowd for long. It does not take long indeed before al... Leer todo",1h 43min,Una piccola impresa meridionale
51,"5,1",['Bryan Poyser'],"['Bryan Poyser', 'David DeGrow Shotwell', 'Steven Walters']","In this raucous, surprisingly romantic comedy, two pairs of exes are torn between rebound sex and getting back together. But can they survive the acts of revenge carried out at the Air Sex World Championships?",1h 31min,The Bounceback
52,"6,8",['Mahmut Fazil Coskun'],"['Mahmut Fazil Coskun', 'Tarik Tufan']",A barber in Yozgat - a very small city in the middle Anatolia - has an emotional breakdown when he runs into Yavuz and Nese who have come to town to sing in a small music hall-bar.,1h 33min,Yozgat Blues
53,--,['Adam Merrett'],['Adam Merrett'],,--,The Warehouse
54,"5,4",['Creep Creepersin'],['Creep Creepersin'],This movie is about a bad script being made into a worse a movie. The best part is the end credits.,--,Awesome Girl Gang Street Fighter
55,"7,0",['Juli Jackson'],['Juli Jackson'],"Charlie, an artist who seeks a connection between her work and her estranged father's music, teams up with Louie, an obsessive record collector from Memphis, and together they begin an exhaustive search for a rare 45 recording from the 1960s Arkansas garage rock scene that takes them both on a journey across the seldom-explored landscape of the new Old South.",1h 37min,45RPM
56,"3,7",['Dominic Ow'],"['Teng Liang Koh', 'Alvin Soe']","'Red Numbers' revolves around a guy, who according to a fengshui master, only has three lucky minutes in his miserable life. His fortune is wrapped up with a greedy family whose grandfather holds the key to the winning combination in the 4D lottery.",1h 35min,Red Numbers
57,"5,1",['Robert Alaniz'],['Robert Alaniz'],"A successful career woman gets caught up in a comedic whirlwind of events, when a mystical necklace given to her as a gift from her boyfriend may be causing her to uncontrollably speak her mind in the politically-correct world of corporate business.",1h 52min,You Don't Say!
58,"4,8",['Johan Nijenhuis'],DESCONOCIDO,"A vacation to Ibiza with many parties. Part of a family lives on the island and the rest is visiting, which causes much drama.",1h 57min,Verliefd op Ibiza
59,"5,5",['Oskar Santos'],DESCONOCIDO,"Los gemelos Zip y Zap, son enviados a la escuela de verano de reeducación. Ellos forman una pandilla con otros 3, oponiéndose a la tiranía de la escuela con bromas. Luego, van a buscar tesoros.",1h 37min,Zipi y Zape y el club de la canica
60,"6,3",['Ken Scott'],DESCONOCIDO,Un afable soltero descubre que engendró a 533 niños a través de donaciones anónimas a una clínica de fertilidad hace 20 años. Ahora debe decidir qué hacer cuando 142 de ellos presentan una demanda para revelar su identidad.,1h 45min,¡Menudo fenómeno!
61,"6,8",['Marc Rothemund'],"['Katharina Eyssen', 'Sophie van der Stap']","Rather than let cancer run her life, a young woman starts wearing different wigs to express herself and live her life to the fullest.",1h 55min,Heute bin ich blond
62,"6,4",['Roger Michell'],['Hanif Kureishi'],Una pareja británica regresa a París muchos años después de su luna de miel para tratar de rejuvenecer su matrimonio.,1h 33min,Le Week-End
63,"6,7",['E.L. Katz'],"['David Chirchirillo', 'Roald Dahl', 'Trent Haaga']",Una intrigante pareja somete a un padre de familia en apuros y a su viejo amigo a una serie de retos cada vez más retorcidos en el transcurso de una noche en un bar local.,1h 28min,Juegos sucios
64,"5,9",['Satoshi Miki'],DESCONOCIDO,El mundo está lleno de mí.,1h 59min,Ore ore
65,"4,6","['Brian Jun', 'Jack Sanderson']","['Brian Jun', 'Jack Sanderson']",A reclusive novelist struggles to find romance and meaning in his life despite disastrous and comedic circumstances.,1h 31min,She Loves Me Not
66,"7,0",['Nicole Holofcener'],['Nicole Holofcener'],Una mujer divorciada que decide perseguir al hombre que le interesa se entera de que es el ex marido de su nueva amiga.,1h 33min,Sobran las palabras
67,"2,3",['Kevin P. Farley'],['Lisa Baget'],"A man, long haunted by the paranormal, captures on camera the horror and hilarity he and his beautiful girlfriend encounter after moving into a new home.",1h 28min,Paranormal Movie
68,"3,1","[""Kevin O'Neill""]",['Keith Shaw'],A catastrophic volcanic eruption releases ancient dragon-like creatures on the surrounding areas. Scientists believe this could start a chain reaction of volcanic eruptions giving way to a global Dragon Apocalypse.,1h 31min,Dracano
69,--,DESCONOCIDO,DESCONOCIDO,DESCONOCIDO,--,Error nombre para la pelicula con id: tt2393308
70,"5,6",['Ted Bezaire'],"['Ted Bezaire', 'Michael Stasko']","A mild mannered birder seeks revenge on a younger rival, after losing the highly coveted Head of Ornithology position at the National Park.",1h 25min,The Birder
71,"7,3",['Antej Farac'],['Antej Farac'],"Seen as hopeless cases, they live in a run-down boarding house by the name of Annelie. A true story about a real place, where in 2012 the unthinkable happens: the reality comes to an end.",1h 51min,Annelie
72,"6,8",['Vinko Bresan'],"['Vinko Bresan', 'Mate Matisic']",Un joven sacerdote tiene la idea de perforar los condones antes de que se vendan para aumentar la tasa de natalidad de su isla.,1h 36min,Los niños del cura
73,"6,3",['Kosta Djordjevic'],"['Kosta Djordjevic', 'Biljana Maksic', 'Neda Radulovic']","The film follows three young characters of different social status, possessed by love for the wrong person. During the day and night, after a series of tragicomic, sometimes absurd situations they are going through, their paths intersect. The fanatical pursuit of the object of his obsession, all three end up in a suspicious night club in one last attempt to fulfill th... Leer todo",1h 30min,S/Kidanje
74,"7,0",['Meera Menon'],"['Laura Goode', 'Meera Menon']","FARAH GOES BANG is a road-trip comedy centered on Farah Mahtab, a woman in her twenties who tries to lose her virginity while campaigning across America for presidential candidate John Kerry in 2004. Farah and her friends K.J. and Roopa follow the campaign trail across historic Route 66 on their way to Ohio, the central battleground state of 2004, seizing control of t... Leer todo",1h 32min,Farah Goes Bang
75,"7,0",['Richie Babitsky'],['Zack Van Eyck'],"Richard is a hopeless romantic. That is, he wants romance but he's hopeless. Like many single men, he has an inflated opinion of himself. He's quite good at overlooking his own flaws, so why can't he overlook them in others? When his latest relationship crumbles, Richard invites an ex-girlfriend to lunch, thinking perhaps she was the one for him. In their one-sided co... Leer todo",--,Three of One Kind
76,"6,4",['Nathan Marshall'],['Sigurd Ueland'],"When ten executives secretly meet to sell off their company, they're murdered one by one in this darkly comedic romp through the halls of corporate America.",1h 34min,"Coffee, Kill Boss"
77,"5,5",['Robbie Moffat'],"['Marla Lerwin', 'Robbie Moffat']","June Bennett goes to Yorkshire to marry one of the richest men in Britain. Despite being twice her age, she knows what she is doing.",1h 33min,I Know What I'm Doing
78,"4,8",['Kirk R. Thatcher'],['Bradley Zweig'],Four kids travel through the amazing wonders of a science museum with their advanced robot tour guide.,1h 15min,Sid the Science Kid: The Movie
79,"5,8",['Pablo de la Barra'],DESCONOCIDO,"Es la historia de Pedro, quien está a punto de ser nombrado magistrado de la Corte Suprema de España. Una llamada le informó de la muerte de su abuela en Venezuela, quien le dejó una herencia, noticia que lo obligó a tomar sus maletas viajar a dicho país, sin imaginar que todo esto cambiará su forma de ver la vida, la justicia y el amor.",1h 44min,La Ley
80,"5,6",['Pavel Göbl'],['Pavel Göbl'],The theme of the fairytale is the struggle between good and evil - albeit this time in a different guise.,--,Kovár z Podlesí
81,"5,7","['Mike Justice', 'Stephen Kitaen']","['Mike Justice', 'Stephen Kitaen', 'Sean Singletary']","Barry Montenegro, a ruthless, cynical, politically incorrect, and quite possibly sociopathic Hollywood actor becomes the prime suspect when a series of brutal murders rocks his latest production.",1h 28min,The Trouble with Barry
82,"6,3",['William Maria Rain'],['Basil Shadid'],"When Lincoln encounters a radical queer hitchhiker, his inner artist awakens, threatening his job, his recent engagement with Lucas, and the campaign for marriage equality.",1h 25min,R/Evolve
83,"7,5",['Kurt Larson'],['Kurt Larson'],"A recently dumped and unemployed man in his 30s decides to moonlight as the 'son' of his childhood hero, a bygone local celebrity Horror Host named Ghostman. When his videos go viral, he must settle an old score with a high school rival and figure out where his life is headed, all while keeping his identity secret from a new woman in town he's fallen for.",1h 34min,Son of Ghostman
84,"6,8",['Teruyoshi Uchimura'],"['Osamu Suzuki', 'Teruyoshi Uchimura']","The story revolves around two struggling comics, Takashi Komoto (Keisuke Koide) and Yohei Tanaka (Atsushi Ito), who have been performing together as a manzai comedy duo called ""Boso Swimmers"" for the past 12 years with very little success. The pair rarely discuss their concerns for the future together, even though they're now 30 years old with little hope of making it... Leer todo",1h 55min,Bokutachi no koukan nikki
85,"5,1","['Tammy Caplan', 'Joe Tyler Gold']",['Joe Tyler Gold'],"A magician competes in an international magic competition where he goes head to head with a female street magician he has fallen in love with. This film shows great magic performed by a cast of professional magicians. Like a great musical where the songs and the story are seamlessly intertwined, Desperate Acts of Magic does the same, mixing story and magic as one.",1h 26min,Desperate Acts of Magic
86,"6,5",['Yûichi Fukuda'],['Shunjû Aono'],"A man who had raised his daughter after he was a divorced, quitted his job suddenly to find himself. Then he wastes his time for a while, but one day he begins to try to be a comic artist.",1h 43min,Ore wa mada honki dashite nai dake
87,"8,2",['Max Barbakow'],['Max Barbakow'],A young filmmaker considers his adoption and the three families linked by his birth.,1h 5min,"Mommy, I'm a Bastard!"
88,"5,1",['Joel Franka'],"['Joel Franka', 'Gladys Marciano', 'Benoît Mariage']","With their beloved mother only a few days to live, her children decide to give her a surprising parting gift: bring Dave, a lifelong fan, to her bedside in the Ardennes. But even though everyone adores her, brothers, sister and brother-in-law are not on the best of terms and cooperation is not their strong point. For her sake, however, they will overcome their resentm... Leer todo",1h 35min,Une chanson pour ma mère
89,"6,1",['Richard Shepard'],['Richard Shepard'],"Tras doce años en la cárcel por mantener la boca cerrada, el conocido ladrón de cajas fuertes Dom Hemingway regresa a las calles de Londres para cobrar lo que se le debe.",1h 33min,Dom Hemingway
90,"6,2",['J. Rick Castaneda'],['J. Rick Castaneda'],"Franklin, the best wine salesman in the Yakima Valley, hates his life. His girlfriend is cheating on him, and he doesn't even have the self-respect to tell her that he knows. When he meets the ""other guy"", who turns out to be a terrific person, he decides it's time to let go of some baggage.",1h 31min,Cement Suitcase
91,"4,4",['Lionel Bailliu'],DESCONOCIDO,"Twice, Vincent thought he met the woman of his life. Twice, they left him for the same man - Denis. Now that Vincent is in perfect love with Anna, his only fear is that history will repeat itself.",1h 25min,Denis
92,"4,8",['Steven de Jong'],"['Hilde Woudstra', 'Steven de Jong', 'Dick van den Heuvel']","A farmer lost his wife and is anything but looking for a new romance. But when a popular TV dating show plans to film a new episode on his farm, he is lured into participating in the show to save his farm.",1h 37min,Leve boerenliefde
