93,--,['Richard M. Siggins'],['Richard M. Siggins'],"A comedy about two brothers who, with their father, ran a successful law firm. After their fathers death the older brother goes to work for a big law firm and the younger brother revives the family law firm. The two brothers have the ultimate courtroom showdown . Along the way Kevin will find true love and win the case with the help of his misfit team of lawyers and s... Leer todo",1h 30min,Attorney at Low
94,"3,2","['Jason Friedberg', 'Aaron Seltzer']","['Jason Friedberg', 'Aaron Seltzer']","En esta parodia de los Juegos del Hambre, Kantmiss Evershot debe luchar por su vida en los 75º Juegos del Hambre, donde también puede ganar un jamón viejo, un cupón para un submarino de un metro de largo y un pepinillo comido.",1h 23min,Los muertos del hambre
95,"5,7",['Andrea Zaccariello'],"['Massimiliano Orfei', 'Paolo Rossi', 'Andrea Zaccariello']",Santilli is looking for a lucky break to change his life. In South Italy there's a town whose entire population is over the age of eighty. Santilli opens a funeral agency. With the earnings from the certain funerals he'll be able to solve his problems. Santilli patches together a credible funeral agency and waits for the old-timers to die. Days glide by and not a sing... Leer todo,1h 43min,Ci vediamo domani
96,"4,7",['Serge Bozon'],DESCONOCIDO,"After an Algerian informant is murdered, two female investigators are sent to investigate.",1h 46min,Tip Top
97,"7,0",['Masahiro Andô'],DESCONOCIDO,"The story about a girl whom her mother ran away with a lover so she went to live with her grandma whom she never knew in her hotel, then she found herself responsibile for all the work and to started a new life.",1h 6min,Hanasaku Iroha: Home Sweet Home
98,"6,3",['Luc Besson'],"['Luc Besson', 'Michael Caleo', 'Tonino Benacquista']","La familia Manzoni, un famoso clan mafioso, se muda a Normandía bajo el programa de protección de testigos, donde intenta adaptarse.",1h 51min,Malavita
99,--,['Donald Petrie'],['John Hazlett'],"Atlantic Gold is a comedy about the fishing village of Lucky Harbour, and what happens when a lost cargo of marijuana washes up on its shore.",--,Atlantic Gold
100,"6,6",['Paul Feig'],['Katie Dippold'],Una honesta agente especial del FBI forma equipo con una policía malhablada de Boston para atrapar a un despiadado narcotraficante.,1h 57min,Cuerpos especiales
101,--,['John Clerkin'],['John Clerkin'],A Lowly janitorial worker at a genetics lab steals a modified potato for its ability to give a natural and effective high. Sharing the potato with others spreads the joy but this does not last. The plant has other ideas all soon become psychopaths bent on the plants survival.,--,Potato Vampires
102,"6,4",['Álex de la Iglesia'],"['Jorge Guerricaechevarría', 'Álex de la Iglesia']","Una banda de ladrones armados encuentra refugio en una aldea aislada sin saber que está repleta de brujas, y que el fin del mundo está ahora en sus manos.",1h 52min,Las brujas de Zugarramurdi
103,"3,0",['Paul Ruven'],"['Marian Batavier', 'Paul Ruven', 'Wendy van Dijk']",Ushi must marry a sumo wrestler but she doesn't want to marry him. She is going to find a husband to marry in 8 days so she doesn't have to marry Sumo.,1h 32min,Ushi Must Marry
104,"2,4","['Gonzalo Badilla', 'Sebastián Badilla']",['Sebastián Badilla'],"Emilio Ortiz is and his best friend Berna are entertainers for children's birthday parties. A Emilio has a pretty new neighbor, Sol, who is a babysitter. Emilio falls head over heals for Sol and decides to become a babysitter along with Sol in order to see if he can make her fall in love",1h 30min,El Babysitter
105,"7,1",['Naofumi Higuchi'],"['Naofumi Higuchi', 'Takehiko Minato']","On the eve of the closure of a cinema, an examination of what this means for film and for Japan as a whole from the point-of-view of the viewing public and the cast who staffed many of the films. Intermissions marks the return of actress Akiko Koyama to film following the death of her famed husband whom she had been looking after for years.",1h 52min,Intâmisshon
106,"6,9",['Michael Medeiros'],DESCONOCIDO,"When a hostage situation turns into sexual obsession, all bets are off.",1h 30min,Tiger Lily Road
107,"4,7",DESCONOCIDO,DESCONOCIDO,Embark on an adventure like no other with a very special knight who must save the magical kingdom where he lives by redeeming his knightly honor.,1h 24min,El caballero Don Latón
108,"4,5",['Matteo Vicino'],['Matteo Vicino'],Federico and Riccardo have been friends ever since childhood. The two friends become aware of the possibility of getting a grant. But soon they discover that the competition is open to unmarried couples.,1h 32min,Outing - Fidanzati per sbaglio
109,"6,4",['Lionel Baier'],"['Lionel Baier', 'Julien Bouissoux']","April 1974. The Federal Councellor, annoyed by the anti-establishment tone of The French speaking Swiss radio channel, imposes ""safer"" subjects on Philippe de Roulet, the programs director. To please him, de Roulet sends to Portugal a team composed of Julie, a dedicated feminist, Cauvin, a former war reporter sidelined since he started losing memory, and Bob, a sound ... Leer todo",1h 25min,Les grandes ondes (à l'ouest)
110,"7,1",['Sion Sono'],['Sion Sono'],Un equipo de filmación se ve envuelto en una disputa del clan yakuza.,2h 9min,¿Por qué no jugamos en el infierno?
111,"6,6",['Dayna Hanson'],['Dayna Hanson'],"IMPROVEMENT CLUB is a hybrid feature film that uses dance and music to tell a story of the exhilaration and humiliation of making art in America today. When their New York gig falls through, a ragtag, avant-garde performance group with a political message struggles to find their audience-- and the motivating force behind their work. Part of an integrated suite of new ... Leer todo",1h 38min,Improvement Club
112,"6,5","['Richard Waters', 'Emma Gahan']","['Paddy C. Courtney', 'Emmett Hughes', 'Slaine Kelly']","Two years after the death of his wife, an Irish Father summons home his two Sons & Daughter, causing all to fear the worst, but he is not the only one with a secret...",1h 24min,The O'Briens
113,--,"['Bryant Robinson', 'Jamaal Buchanan']",DESCONOCIDO,"International A Cappella vocal band & winners of 'MTV's Top Pop Group' MO5AIC travel to the eclectic regions of Colombia sharing their vocally inspired musical gifts with the masses while simultaneously immersing themselves within the community, lifestyles, and the infamous stereotypes associated with the Colombian culture.",1h 30min,Global Vocals
114,"7,0",['Claudia Sainte-Luce'],['Claudia Sainte-Luce'],"Claudia termina en el hospital con un caso grave de apendicitis. Allí, conoce a Martha, el resto es historia.",1h 29min,Los insólitos peces gato
115,"7,3",['Jeff Rosenberg'],['Jeff Rosenberg'],An eccentric theater artist struggles to stage an Othello-based OJ Simpson musical with the help of his childhood friends.,1h 30min,Orenthal: The Musical
116,"8,1",['Jared Burt'],['Rob Parsons'],"Everything is going right for Rick. A wife he loves, a son he adores, a respectable career. However all that changes in one day as his company deals with layoffs and off shoring, then learns of news about his son that forces Rick to question who he is, and who he needs to be.",--,Calling
117,"7,2",['Andrew Hutcheson'],['George Murray'],Justin is an awkward teenager by day and an expert lock-picker and poet by night. He attempts to win the heart of April Grace.,1h 38min,April Grace
118,"5,9","['Ruben Amar', 'Lola Bessis']","['Ruben Amar', 'Lola Bessis']","When a bubbly young artist moves into a couple's tiny Chinatown apartment, their already fragile balance is upset even further.",1h 35min,Swim Little Fish Swim
119,"5,7","['Helge Schneider', 'Andrea Schumacher']",DESCONOCIDO,"Commissioner Schneider is back. Nineteen years after ""00 Schneider - Jagd auf Nihil Baxter"" aging policeman now has to face villain Jean-Claude Pillemann.",1h 34min,00 Schneider - Im Wendekreis der Eidechse
120,--,['Adam Haynes'],"['Tom Demar', 'Adam Haynes']","Stanley stalks a beautiful woman. At a coffee house she magically turns into another beautiful woman who mistakes Stanley as her blind date. They proceed to have a strange, hot, funny blind date. Just as things start to get serious she turns back into the first woman, who is now extremely upset.",1h 10min,Midday Games
121,"6,2",['Javier Ruiz Caldera'],"['Pablo Alén', 'Breixo Corral']","Ruth, una joven alocada que aún no ha renunciado al amor, decide asistir a las bodas de tres de sus ex.",1h 34min,3 bodas de más
122,"7,1",['John Wager'],DESCONOCIDO,"Take five wounded veterans and four top comedians, the result... laughter and the healing power of humor.",1h 15min,Comedy Warriors: Healing Through Humor
123,--,['Joe Chang'],['Joe Chang'],"On Halloween weekend, a traveling performance artist and his kid sister revisit the childhood hometown where they grew up, discovering the things they once remembered are vanishing, and things they've kept inside themselves never go away.",1h 23min,Present
124,"2,6",['Craig Moss'],['Craig Moss'],"Después de una temporada en un hospital psiquiátrico, una joven regresa a la casa donde su padre mató a todo el elenco de The Artist durante su exorcismo.",1h 20min,30 noches de actividad paranormal con el diablo adentro de la chica del dragón tatuado
125,"4,4",['Amrit Sagar'],['Aakash Kaushik'],"Rabba Main Kya Karoon is a roller coaster ride, which centres around a big - lavish Delhi wedding.",1h 56min,Rabba Main Kya Karoon
126,"5,7",['Reem Kherici'],DESCONOCIDO,"Maya, a young stylist, is about to get her dream job when she is forced to move back to Morocco.",1h 35min,París a toda costa
127,"8,0",['Chris Adcock'],DESCONOCIDO,"He truly is a ""Dopeless Romantic."" Comedian Erik Myers performs in a hilarious stand-up comedy routine. Watch as he shares his hysterical experiences in a life of bad relationships and substance abuse with a live audience.",1h 15min,Erik Myers Dopeless Romantic
128,"6,8","['Philippe Appietto', 'Nathalie Sauvegrain']","['Philippe Appietto', 'Nathalie Sauvegrain']","Océane, a young girl from the Parisian suburbs, gets dumped on a highway station. She then follows a stranger, Oliboy, an odd forty-something musician who is about to do a summer tour in the south-west of France. She will discover his life philosophy in an authentic isolated surf camp ; a timeless summer paradise. This story of emancipation on the background of surf a... Leer todo",1h 43min,Océane
129,"5,6",['Pandiraj'],"['Pandiraj', 'Rishabh Purohit']","The story of two loafing friends, who want to enter politics.",2h 15min,Kedi Billa Killadi Ranga
130,"6,0",['Carter Mays'],['Carter Mays'],"All Norah ever wanted to be was a reality TV star. But her dream-come-true quickly turns into a nightmare when she allows a motley television crew of chickens, led by a sociopath, 'Charlie Chicken', to invade her home, manipulate her emotions, and drag her and her soon-to-be-ex-boyfriend into the desert on what is supposed to be a glamorous reality TV shoot. Deep in t... Leer todo",1h 30min,Bad Chicken
131,"6,1",['Clark Gregg'],['Clark Gregg'],"En un intento por fichar a una estrella de Hollywood, Howard Holloway debe lidiar con su volátil padre, un rival intrigante desde hace mucho tiempo y un productor y director de casting que lo desprecia.",1h 30min,Trust Me
132,"8,1",['Brandon Walz'],DESCONOCIDO,"""Geek USA"" is a quirky romantic comedy filled with 90s nostalgia about a high school senior in a rock band who suddenly goes from zero social life to having three very competitive dates for prom.",1h 30min,Geek USA
133,"6,5","['Steve Durand', 'Bryan Gaynor', 'Gavin McInnes']",DESCONOCIDO,'Godfather of hipsterdom' Gavin McInnes goes on a stand-up comedy tour with his best friend from high school and things go from bad to worse to downright catastrophic.,1h 8min,The Brotherhood of the Traveling Rants
134,"5,9",['Darren Stein'],['George Northy'],"¿Qué sucede después de que Tanner es descubierto por sus compañeros de clase y se convierte en el título de ""mejor amigo gay"" de tres abejas reinas de la escuela secundaria?",1h 32min,G.B.F.
135,"4,8",['Joel Núñez Arocha'],"['Natalia Armienta', 'Ragnar Conde']","Conocer la pareja de tu vida es sólo obra del destino! Pero una cosa es casarse y otra, controlarse. Así que para sobrevivir la crisis del matrimonio, te diremos cómo lograrlo. Esta divertida comedia te enseñará que en el amor; TODO SE VALE! Knowing the partner of your life is only the work of fate! But ... one thing is to get married and another controlled. So to ... Leer todo",1h 40min,7 Años de Matrimonio
136,"8,1",['Logan Hendricks'],DESCONOCIDO,"Think dating is hard when you're 20 years old? Try 70, 80, or even 100. Set in sunny Sarasota County, Florida, Love at a Certain Age is the story of four senior citizens as they navigate their sunset years. A rare glimpse into the window of senior homes, fraternities, bars and community centers, the stories in this film will affirm intimacy, sex, and true love are not... Leer todo",1h 32min,Love at a Certain Age
137,"6,3",['Julia von Heinz'],"['John Quester', 'Julia von Heinz', 'Theresa Bäuerlein']","A German girl travels to Israel to help people with disabilities, where she learns a lot about the role of her grandparents in WWII and meets a man who wants to move to Berlin.",1h 40min,Hannas Reise
138,"6,9",['Sebastián Lelio'],"['Sebastián Lelio', 'Gonzalo Maza']","A story set in Santiago and centered on Gloria, a free-spirited older woman, and the realities of her whirlwind relationship with a former naval officer whom she meets out in the clubs.",1h 50min,Gloria
139,"7,6",['Stephen Frears'],"['Steve Coogan', 'Jeff Pope', 'Martin Sixsmith']","Un periodista político cansado del mundo retoma la historia de la búsqueda de una mujer por su hijo, que le fue quitado hace décadas después de quedarse embarazada y ser forzada a vivir en un convento.",1h 38min,Philomena
140,"7,3",['Aaron Fradkin'],['Aaron Fradkin'],"Ben, a 25 year-old with anxiety and OCD, still living with his Mom, is forced to embark on a road trip with his only friend Richardson, an unambitious model. They are asked to drive to Salt Lake City to help Ben's angry great uncle move out of a retirement community and into his own home. In this take on modern young adulthood, we follow Ben and Richardson over the co... Leer todo",1h 21min,15 North
141,"5,0",['Lari Teräs'],DESCONOCIDO,"Blood Riders is a blood soaked adventure comedy about 4 young friends who stumble upon a body after stealing a car. That discovery pushes the friends on a road trip around town during which they try get rid of the increasing amount of corpses. Along their wild ride the kids encounter neo-Nazis, punk artists, devil worshipers and a plan to resurrect Hitler.",1h 11min,Blood Riders: The Devil Rides with Us
142,"5,8",['Agnès Obadia'],"['Agnès Obadia', 'Samantha Mazeras', 'Pénélope Bagieu']","Josephine doesn't like her job and keeps on having relationships without a future. Her sister and parents keep pushing her to find a good husband. To shut them up, she creates a handsome Brazilian millionaire but her little white lie has a flip side - she loses everything to find the love of her life.",1h 28min,Joséphine
143,"6,8","['Andy Heathcote', 'Heike Bachelier']",DESCONOCIDO,"Official Selection of Sundance Film Festival. A heart warming, tearjerker of a movie about the incredible bonds between man, animal and countryside.",1h 38min,The Moo Man
144,"5,2",['Devi Prasad'],DESCONOCIDO,"A girl lies to her father that her boyfriend, a salesman, is rich. But he breaks the alliance on learning the truth. She then challenges him that her boyfriend will become a millionaire in six days.",2h 5min,Kevvu Keka
145,"6,6",['Rafael Gutierrez'],DESCONOCIDO,"Jess is abrasive and doesn't care. Pier is a sweet girl, but is eager to explore her sexuality. Brianna is a former nymphomaniac fighting her inner desires by finding herself in a new state of celibacy. This vulgar, alluring, risque' threesome decide to plan a slumber party. As each colorful, animated character arrives at the event, shit begins to hit the fan. True co... Leer todo",1h 5min,Foul Mouths: A Teenage Rage
146,"8,0",['Roger Vass'],DESCONOCIDO,"The film is a portrait of interactions between deaf, hard of hearing, and hearing people. The plot focuses on five characters in a post-­apocalyptic setting. Told with humor and emotion, this film takes an authentic look at three different types of hearing loss experiences. While navigating through this tale of awareness and survival, both hearing and deaf will realiz... Leer todo",1h 45min,Lake Windfall
147,"4,7",['Yûichi Fukuda'],DESCONOCIDO,"Detectives in the special investigation team in Kanagawa go after criminal organization ""Red Venius,"" based out of Yokohama. While pursuing the gang, the detectives turn into children due to exposure to a special gas.",1h 39min,Kodomo keisatsu
148,"6,8",['Clay Westervelt'],"['Hart Baur', 'Clay Westervelt']","'Play like the music doesn't matter.' The unbelievable true story of the band that gained massive east coast popularity in the late 1980s despite having a complete lack of musical talent and ambition. A powerful PR machine built their fame, and soon their primary objective was to invent new and creative ways to get kicked off stage without actually playing. Narrated b... Leer todo",1h 17min,Skum Rocks!
149,--,['Mike Elsherif'],"['Barret Bell', 'Mike Elsherif', 'Zach Kleinsmith']","Two twenty-something childhood friends, Liza and Elliot, reunite and spend a day together with the mission of finding a lost golden retriever in their hometown. On the way, the bumbling gumshoes begin to discover unsaid feelings for each other, confusion about the current state of their lives, and a kinship that can only arise in quarter-life crisis commiseration. The... Leer todo",1h 11min,City Strays
150,"6,6","['Krishna D.K.', 'Raj Nidimoru']",DESCONOCIDO,"A group of friends, just looking to have a good time in a rave party on a remote island in Goa, find out that the island is infested with Zombies.",1h 48min,Go Goa Gone
151,--,['Jeffery Lamb'],['Jeffery Lamb'],What a summer! Thirteen year old Kylee was not looking forward to spending time at her grandparent's house near the Ocala National Forest. After arriving she makes an unlikely friend and things change quickly. Now Justin and her are trying to outsmart kidnappers and save the quiet forest community from a developers bulldozer. An endangered flying frog that no one has ... Leer todo,1h 34min,Save the Gator Queen
152,"6,5",['Mainak Bhaumik'],DESCONOCIDO,"""A love letter to Calcutta,"" declares Mainak. ""It's about a typical Bengali family of dadu (grandfather), parents and three brothers and their love interests. Then there's the Marwari community which plays a big part in today's cosmopolitan Calcutta. This is a film about the Calcutta we see now. It's urban and young and yet the Bong idiosyncrasies are very much there.... Leer todo",1h 45min,Maach Mishti & More
153,"4,5",['Jeff Stephenson'],"['Robert Budreau', 'Adam Bradley']",An office comedy about two best friend finance grads who embark on a crazy mission to stop an investment bank from closing a crooked deal involving student loans.,1h 20min,Cubicle Warriors
154,"5,2",['Ask Hasselbalch'],DESCONOCIDO,"Pelle, de 12 años, es mordido por una hormiga y desarrolla superpoderes. Con la ayuda del nerd de los cómics Wilhelm, Pelle crea una identidad secreta como el superhéroe Antboy.",1h 17min,Antboy. El pequeño gran superhéroe
155,--,"[""Peter O'Donoghue""]",DESCONOCIDO,"Fancy dress, mass maraca shaking and pounding techno workouts - what's not to like in this eclectic vision of retirement? This is an upbeat but unnerving look at the relativity of freedom in China's 'harmonious society'.",52min,Happy Everyday
156,--,['Paul Wheeler'],"['Shenoah Allen', 'The Pajama Men']",,--,In the Middle of No One
157,"5,0",['Luigi Cecinelli'],DESCONOCIDO,"""Nothing can stop us"" is a On the Road comedy. And 'the journey of formation of 4 ""particular"" boys, to the affirmation of self and acceptance of their differences. A fun and spectacular journey through Italy, the French countryside and Spain will lead them to Ibiza, the party capital. Friendship, complicity, adventures and summer loves are the ingredients of this rom... Leer todo",1h 31min,Niente può fermarci
158,"9,0","['Patrick Chapman', 'Keith Black']",['Timothy Chapman'],"Sam, a struggling artist, has one opportunity to impress a dealer and his assistant. However, an unexpected visit from his brother, Phin, who suffers from frontal lobe damage, pulls all of them all into a night of constant delusions.",1h 30min,Phin
159,"3,5",['K. King'],"['K. King', 'Kurt Knight']","When a street drug turns junkies into an army of zombies, a man named Hunter finds himself with nothing but a beat-up car and a trunk full of guns and booze, until he stumbles across a small band of survivors.",1h 33min,Zombie Hunter
160,"6,9",['Amos Posner'],"['Amos Posner', 'Joe Uchill']","When an underground radio DJ makes fun of a fading pop star who happens to listen to his show, the two begin an unlikely relationship. But difficult life and career crossroads jeopardize their idyllic New York romance.",1h 37min,B-Side
161,"8,1",['Lila French'],"['Lila French', 'Leonard Melfi']","During the course of one night, two strangers, a lonely waif and a prodigal poet, form an unexpected connection.",46min,Birdbath
162,"6,4",['Wolfgang Groos'],"['Thomas Winkler', 'Rainer Ewerrien', 'David Ungureit']","Max and his band, ""Systemfehler"", are preparing for an important concert when their guitarist injures his hand. Know-it-all eco-activist Inge, who Max has made fun of, seems to be the only available stand-in.",1h 38min,Systemfehler - Wenn Inge tanzt
163,"7,5",['Kirk White'],['Kirk White'],"On his last day in the big city, a disillusioned actor tries to make peace with never making it big.",1h 27min,F**k New York
164,--,['Clive Williams'],['Clive Williams'],Mr Obscure is a feature film based around the life and times of 'the forgotten man' Thomas Berkeley.,1h 30min,Mr Obscure
165,--,['Adam Rosenbaum'],DESCONOCIDO,Three 20-somethings roam the Tennessee countryside in search of a time machine.,1h 1min,The Turtle and the Time Machine
166,"5,7",['Ferdinando Vicentini Orgnani'],DESCONOCIDO,"It all started with the first wine sip Giovanni Cuttin had in his life. A Marzemino, a wine mentioned by Lorenzo da Ponte in his libretto for Mozart's Don Giovanni. Since then, the shy clerk becomes the bank director, a lady-killer and the most revered wine expert in Italy. But soon he will be charged for his wife's murder. Being grilled by Inspector Sanfelice, Giovan... Leer todo",1h 32min,Vinodentro
167,"5,7",['Carl Bessai'],['Brent Butt'],"In a case of mistaken identity, a salesman is hired as a private detective by a woman to find her missing brother, and complications ensue.",1h 36min,No Clue
168,"6,1",['Giacomo Campiotti'],DESCONOCIDO,The story takes place in the italian city of Turin. A roman boy loses his mind for a cancer-sick girl. He will do everything as possible to make her fall in love with him and save her life.,1h 42min,"Blanca como la nieve, roja como la sangre"
169,"8,8",['Cheol-su Park'],['Kyungsook Suh'],"This film consists of 19 episodes on sexuality. It's an experimental mixed genre, which ranges from a rap song to a dance and a short drama. A main female character appears from the first episode to the last, and the film can be read as her journal or diary.",1h 30min,Saeng-saeng-hwal-hwal
170,--,['Scott Sheppard'],DESCONOCIDO,"Three American sisters, raised in India by missionary parents, return to the land of their childhood for the first time in fifty years. Their journey is entertaining and emotional, and proves that it's never too late to go home.",1h 27min,"Planes, Trains & Autorickshaws"
171,"5,7",['Destiny Ekaragha'],['Bola Agbaje'],"GONE TOO FAR follows two estranged teenage brothers over the course of a single day as they meet for the first time, and struggle to accept each other for who they are. Yemi can't wait for his big brother to join him on the estate in Peckham - but when Ikudayisi arrives from Nigeria wearing socks and sandals Yemi questions both his judgement and his African heritage. ... Leer todo",1h 28min,Gone Too Far
172,"7,6",DESCONOCIDO,DESCONOCIDO,"'Getting Back To Abnormal' is an intimate look at race, politics and culture in post-Katrina New Orleans. Five years after the storm, New Orleans has changed. It is less black and less poor, and one polarizing white politician has become a lightning rod for all things racial. Councilperson Stacy Head, a self-styled corruption fighter, takes her sometimes jaw-droppingl... Leer todo",1h 30min,Getting Back to Abnormal
173,--,"['Gary Abrams', 'Noah Rieke']",['Gary Abrams'],,--,Darius
174,"6,1",['Cherie Kerr'],['Cherie Kerr'],"The film keys in on the proverbial David vs. Goliath scenario when the filthy-rich land developer, Vivian Brechner, decides not to renew the lease on a bowling alley in a small town so that, together with a local avaricious tribal Indian chief, she can tear it down to make way for a gambling casino. What happens when the 52 people in Fountain Springs learn that Founta... Leer todo",1h 33min,We've Got Balls
175,"7,6",['Iain Cash'],"['Iain Cash', 'Peter Spencer']","When an execution is sanctioned in the UK for the first time in almost 50 years, it soon becomes a media circus. The television rights are sold, and it becomes the worlds biggest reality TV show, re-branded as X-Day.",1h 30min,The Last British Execution
