262,"6,1",['Ivana Lalovic'],"['Stefanie Veith', 'Ivana Lalovic']",Asal and Zoe are best friends and spend their last summer together before their lives begin in earnest. Asal wants nothing more than to have a boyfriend and Zoe dreams of becoming a make-up artist. An inspiring coming of age story.,1h 30min,Sitting Next to Zoe
263,"6,1",['Kevin Willmott'],['Kevin Willmott'],"In 1939, African American leaders respond to Jim Crow segregation by building a rocket to colonize Mars. The three person crew blasts off, but time travel instead, arriving in present-day America revealing much about race today.",1h 38min,Destination Planet Negro
264,"6,6",['Antoinette Beumer'],DESCONOCIDO,"Soof está a punto de cumplir los 40 y tiene todo lo que siempre quiso: tres hijos, un pequeño negocio de catering, un dulce esposo llamado Kasper y una hermosa casa. Hasta que empieza a preguntarse: ¿Esto es todo?",1h 36min,Soof
265,"7,0",['Manolo Caro'],['Manolo Caro'],"This comedy drama features two couples living in the same building, Lucas & Julia the catholics, Aaron & Nora the jewish and Lola the world traveler spanish. The story takes place at the arrival of a new renter the ex soccer player Felix; as soon as he's installed the neighbors gather for a dinner just to find out the problems between them; After this Lola reveals her... Leer todo",1h 43min,No sé si cortarme las venas o dejármelas largas
266,"4,4","['Alexandre Charlot', 'Franck Magnier']","['Roba', 'Alexandre Charlot', 'Franck Magnier']",The daily adventures of a boy named Boule and his spaniel Bill.,1h 22min,Boule & Bill
267,"6,3",['Daniel Castro'],['Daniel Castro'],"Daniel, a Spanish filmmaker would like to give his country back some of the hope it has lost due to the financial crisis. He's determined to shoot an inspirational movie about the Moncloa Pact, the agreement that brought back Democracy to Spain after the Franco era. The thing is he wants the film to be a musical.",1h 5min,Ilusión
268,--,['Akiko Ôku'],['Shigeru Murakoshi'],,40min,"Tadaima, Jacqueline"
269,"4,9",['Gabriel Ochoa'],"['Rafael Cobos', 'Ada Hernández', 'Gabriel Ochoa']","Alex comes across Lucias life, two youngsters who start discovering each other, the escape velocity will determine their future.Paz y Jorge see how their relationship is fading and they don't know what to do, hyperbola, whose bodies will never go back to their point of origin. Albert and Irene meet after some decades of separation, parabola whose trajectories, it seem... Leer todo",1h 30min,El amor no es lo que era
270,"5,7",['Raphael Vieira'],['Leo Lama'],,1h 17min,Dores de Amores
271,"7,2",['Michael Sneed'],['Michael Sneed'],,--,A Grain of Sand
272,--,['Mickey Reece'],['Mickey Reece'],,1h 10min,Bolo
273,"6,7",['Takehiko Shinjô'],['Ryô Kuemi'],"Kanna Seto lost her childhood friend Haruta in a car accident when she was a freshman in high school. Carrying the emotional pain from that incident throughout her life, Kanna is still wounded as an adult. Kanna then meets Roku Akazawa, who also carries a painful experience from his past. When Roku was an elementary school student, a girl who was with him got into an ... Leer todo",2h 6min,Kiyoku yawaku
274,"7,2",['Liam Kyle Sullivan'],['Ian Harvie'],"Groundbreaking transgender comedian, Ian Harvie is unafraid to joke about subjects no other comedian has ever touched. Harvie unveils his first-ever live standup comedy concert film, poking fun at topics from top surgery to his fear of public restrooms to his active sex life.",1h 15min,Ian Harvie Superhero
275,"4,1",['H.M. Coakley'],['H.M. Coakley'],"In this African-American comedy, a delightfully dysfunctional family settles their differences after a series of hilarious misadventures surrounding a family reunion.",1h 31min,Cleaver Family Reunion
276,"5,6",['Polo Menárguez'],"['Polo Menárguez', 'Font García', 'Jorge Monje']","On a weekend trip to the country side, Raúl and Manuel, two men in their thirties who have been friends since high school, will confront their fears, feelings, and explore the deepest side of their friendship. Manuel guides Raúl through a tour around the abandoned ruins of Soria, a deserted province of Spain, in an effort to create the perfect atmosphere to confess hi... Leer todo",1h 36min,Dos amigos
277,"6,9",['Santiago Alvarado Ilarri'],"['Santiago Alvarado Ilarri', 'Ramón Salas']","Magno, the Great Spanish superhero, vanished from public life after his implication in a child molestation scandal. 20 years have passed and now a documentary filmmaker follows the trail of the fallen hero to make a movie about him.",1h 32min,Capa caída
278,--,['Mady Schutzman'],DESCONOCIDO,"Dear Comrade documents the story of Llano del Rio (1914-18), the most important non-religious communitarian experiment in western American history. Llano is offered as a site to explore the struggles, courage, frustrations, fantasies, and Sisyphean efforts of innumerable idealists who have assumed comparable struggles in spite of tremendous odds. The story is told thr... Leer todo",56min,Dear Comrade
279,"9,0",['Scott Andrew Kurchak'],['Gail Golden'],"Ellie is an idealistic, young actress living in NYC. She's a very giving person, so when her husband, Mitchell, gets a job offer back home in Buffalo, Ellie reluctantly agrees to the move. Mitchell loves Buffalo, so Ellie looks for happiness there, too. She joins a little theatre company and, unwittingly, winds up emotionally involved with the director, James. Ellie j... Leer todo",--,Give & Take
280,--,['Iván López'],"['Iván López', 'Nasarre Rabadán']",,--,La manada
281,"6,4",['Nobuo Mizuta'],['Kankurô Kudô'],"Why merely say 'sorry' when you could truly make amends by hiring the expert to do the right thing? The Apology King, one Mr. Kuroshima, is advertising his service to an audience at a theatre. You can use him to apologize for your past mistakes. What proceeds is six of the specialist's more prominent cases and how they end up leading into one prominent theme.",2h 8min,Shazai no ôsama
282,"7,3",['Amin Dora'],['Georges Khabbaz'],"Ghadi es diferente de los otros niños, ¿podría ser un ángel? su padre Leba y sus compañeros de equipo hacen creen a toda la ciudad que lo es.",1h 40min,Ghadi
283,"6,8",DESCONOCIDO,DESCONOCIDO,Entrelaza 16 historias que suceden en la provincia de Alicante.,--,El amor y otras desgracias
284,--,['Yûji Nakamae'],"['Tamaki Sakai', 'Yuiko Miura', 'Maki Takahashi']","On Ishigaki Island, conflict brews over a large-scale bridge construction project. One day, Yajima, a public official from the Ministry of Environment, is sent to Ishigaki Island. Yajima announces to his colleagues that he is absolutely opposed to the bridge construction project and that he will become a coral ranger who protects the coral reef there. This surprises h... Leer todo",1h 40min,Sango renjâ
285,"5,4",['Riton Liebman'],"['Riton Liebman', 'Gábor Rassov']","For Milou, 40, football is a real drug, a religion he practices as a fanatic. He makes a point of contributing by all means to the victory of his team: Standard de Liège. But his meeting with Martine will give him a good reason to drop out.",1h 30min,Je suis supporter du Standard
286,--,['Jennifer Heaton'],['Jennifer Heaton'],"Chelsea just wants to be a typical teenager, but her stepdad's life making low-budget indie horror films surrounds her with an array of wild characters that leave her embarrassed and frustrated. When she meets Danielle, a fiery young lesbian who has been rejected by her own family, they form a bond that allows Chelsea to re-evaluate her desire for a life that is nothi... Leer todo",1h 37min,Scary Normal
287,"4,4",['Lenka Kny'],DESCONOCIDO,"José de 60 años regresa a Praga después de 30 años viviendo en México, aunque estaba convencido de que nunca volvería a ver su ciudad natal.",1h 22min,Milagro en Praga
288,--,['Patrick Christl'],DESCONOCIDO,A behind-the-scenes look at the worst reality show ever produced.,1h 27min,Wedding Bells & Shotgun Shells
289,"7,4",['Ryan McKenna'],DESCONOCIDO,"The 1980s saw the birth of prairie post-modern cinema, a Winnipeg art movement that gained major international acclaim in the 1980s. At the center of the movement, was the subversive punk renegade Greg K., who produced and distributed every major film out of Winnipeg in that era, as well as created and starred in the cult classic Winnipeg TV show Survival.",57min,Survival Lessons: The Greg Klymkiw Story
290,"6,6",['Ryuta Tasaki'],['Soubee Amako'],"At a time when nations are warring, a sword with mysterious power called ""Heaven's Sword"" is stolen. The sword is said to give its wielder the power to conquer the world. Various ninja all over Dokutake Castle and beyond also manuevering for this sword of immense power. Rantaro and his classmates are assigned to retrieve the stolen sword, their first real ninja missio... Leer todo",1h 30min,Nintama Rantarô: Natsuyasumi shukudai daisakusen! no dan
