653,6.5,['Pa. Ranjith'],DESCONOCIDO,Kaala is about the life of Nellai / Tirunelveli based Tamils who live in large number in Mumbai.,2h 42m,Kaala
654,5.4,['Ramakant Prasad'],DESCONOCIDO,,2h 27m,Gadar 2
655,6.7,['Sam Liu'],DESCONOCIDO,"In an alternative Victorian Age Gotham City, Batman begins his war on crime while he investigates a new series of murders by Jack the Ripper.",1h 18m,Batman: Gotham by Gaslight
656,--,['Clint Gaige'],DESCONOCIDO,"When treachery and murder turn Danny's world upside down, nothing will stop him from pursuing revenge. Blending modern and classical, this retelling of Hamlet casts the Danish Prince as the heir apparent in a crime family, who sees his world crumble as his power-hungry uncle launches a chain of events that will bring their whole world tumbling down.",1h 36m,Hell Is Empty
657,4.7,['Noboru Iguchi'],DESCONOCIDO,"After a group of girls get murdered, they come back as ghosts and seek revenge.",1h 46m,Ghost Squad
658,6.4,['Yan Han'],DESCONOCIDO,A man finds himself deep in debt and is coerced to board a ship that hosts a risky gambling party.,2h 12m,Animal World
659,3.2,['Rene Perez'],DESCONOCIDO,"A martial artist, trained by the military to become an assassin, begins to question himself after killing someone who didn't deserve to die. He now must face not only his demons, but his former boss and his goons by using a combination of firepower and his martial arts prowess.",1h 17m,The Dragon Unleashed
660,5.3,['Chandoo Mondeti'],DESCONOCIDO,"A twin brother of the protagonist is absorbed due to Vanishing Twin Syndrome and controls his left hand. When his life is threatened, the twin brother that never existed protects him like a shield.",2h 31m,Savyasachi
661,7.5,['Takayuki Hamana'],DESCONOCIDO,,1h 51m,Magical Girl Lyrical Nanoha: Detonation
662,3.7,['Sandosh Kesavan'],"['Atiqah Jani', 'Sandosh Kesavan']","Operasi X ASP Redzuan loses faith in his fellow police officers when he witnesses the death of his best friend, Inspector Aman, who he believes have been killed by the police. He then breaks off communications with everyone and starts living on a secluded island, hiding his true identity from the residents there. But Dato' Mokhtar and Tuan Anwar from Bukit Aman manage... Read all",1h 37m,Operasi X
663,4.9,['Siddique'],"['Charu Gupta', 'Ramesh Khanna', 'Siddique']",Two children raised by single parents attempt to reunite their parents to enjoy the happiness of a complete family.,2h 32m,Bhaskar Oru Rascal
664,6.9,['Ajay Bhupathi'],"['Ajay Bhupathi', 'Tajuddin Syed']","Believing his girlfriend loves him even after being married, a man waits for her return and in the process ignites violence.",2h 33m,RX 100
665,--,['Dev Kumar Shrestha'],DESCONOCIDO,,--,The Karma
666,--,DESCONOCIDO,"['Ben Lettieri', 'Neil Wilson']",The dark underworld builds in power led by the Martinet and Katasha. As their evil plans unfold only one true hero can stop them.. but he strays from the path of fate not ready to accept who he is.,1h,Lonewolf: The Awakening
667,3.6,['Richard Colton'],DESCONOCIDO,This movie is a modern day version of The Prince And The Pauper where one man from a poor background ends up taking over another man's life from the entirely opposite end of the spectrum.,1h 36m,Dead Ringer
668,4.6,DESCONOCIDO,DESCONOCIDO,"72 HOURS: PDEA Agent Marius Reyes' mission to catch a well-known Fil-Chinese drug lord fails because of a traitor in his task group. Now, he is out to finish this mission, clear his name, and serve his country at all cost. AMATS: A man in denial of his current impoverished situation hooks up with a gang of drug pushers and addicts. VIRGO: ""My rage will wash away the s... Read all",1h 58m,Tres
669,6.6,['Hae-Young Lee'],DESCONOCIDO,A police detective determined to catch the unseen boss of Asia's biggest drug cartel joins hands with a revenge-thirsty member of the gang.,2h 3m,Believer
670,5.8,DESCONOCIDO,"['Husein M. Atmodjo', 'Gunawan Raharja']","22 minutes before, during, and after the explosion of 2016 Thamrin's bomb in Jakarta.",1h 11m,22 Menit
671,3.8,['Andrew Lau'],"['Kin-Hung Chan', 'Chao Rong']","Set in the final years of the Ming Dynasty, when the nation is gifted a rare creature by the Bruneian Empire. A member of the Imperial Secret Police is tasked to tame the beast but realising that it is a kind creature by nature, he releases it from the palace and then elopes with the daughter of a man executed on false charges. His action prompts the palace to put a h... Read all",1h 44m,Kung Fu Monster
672,6.5,['Sara Blecher'],DESCONOCIDO,An estranged son must break the rules to save his family (and their criminal empire) when his overbearing father falters.,1h 31m,Mayfair
673,1.8,['Jared Cohn'],DESCONOCIDO,"When a black ops team is sent to investigate the crash of an unidentified aircraft, they soon find themselves being hunted by the former occupants.",1h 27m,Alien Predator
674,--,['Jake Masterton'],DESCONOCIDO,A brother who was recently killed due to his disagreement of not wanting a part in the life of a gangster. His living brother decides to take revenge by destroying his own allies. This is his Primal Night.,--,Primal Night
675,5.8,['Shakti Soundar Rajan'],DESCONOCIDO,"After discovering that an asteroid the size of a city is going to impact Earth in less than a month, India recruits a misfit team to save the country.",2h 10m,Tik Tik Tik
676,4.8,DESCONOCIDO,DESCONOCIDO,"The alarm has sounded and the Pontypandy crew is off to rescue their friends and others in need. From engine sparks and wild fireworks to water rescue and more, you won't want to miss these adventures with your favorite hero, Fireman Sam!",1h 2m,Fireman Sam: Set for Action!
677,--,['Yizhi Yang'],DESCONOCIDO,"One is a mountain girl with a stunt, and the other is a glamorous female undercover who becomes a gangster. The difference between the yin and the yang makes them meet, know each other, know each other, and save a redemption in the rivers and lakes. It's ridiculous and frightening. The stunts and tactics show up in the rivers and lakes. Is it right or wrong? A mysteri... Read all",1h 49m,Qi nuzi zhi ren zai jianghu
678,6.5,['Tzu-Hsuan Hung'],"['Chien-Ming Huang', 'Tzu-Hsuan Hung']","With a single mistake, Rui, a former star basketball player, loses his job and has nothing to do. Collecting parking fees on the street, he's snooping around a dark world. He knows it is not where he belongs, but he has no place to go and nobody welcomes him. Then one day, he finds a woman bleeding on the street, and he takes her to the hospital. On the way, he is kid... Read all",1h 45m,The Scoundrels
679,5.7,['Satoshi Nishimura'],"['Keita Amemiya', 'Yasuko Kobayashi']","Set during the Heian Period, Kyo is a beautiful city that is proud of its glory. Two beautiful onmyouji meet, and the sad and short-lived beautiful cherry blossom starts to stir after 1000 years.",1h 22m,Usuzumizakura: Garo
680,6.0,['Chenyang Yin'],DESCONOCIDO,"Wuyou, part of a secret security operative, teams up with local intelligence in South East Asia to rescue kidnapped foreign royalty.",1h 10m,Special Mission
681,--,['Terance Mcleod'],DESCONOCIDO,"Unsocial Justices is a miniseries about a rogue Black detective in the streets of Atlanta. It's has ability to make you smile, laugh, and cry.",--,Unsocial Justices
682,6.9,['R. Chandru'],DESCONOCIDO,,2h 35m,Kanaka
683,8.1,['Pradeep Raj'],DESCONOCIDO,"A speech and hearing impaired ecologist, is devoted to preventing deforestation.",2h 9m,Kichchu
684,6.5,['Pierre Morel'],DESCONOCIDO,"Five years after her husband and daughter are killed in a senseless act of violence, a woman comes back from self-imposed exile to seek revenge against those responsible and the system that let them go free.",1h 41m,Peppermint
685,6.2,['Venky Kudumula'],DESCONOCIDO,"Hari (Naga Shaurya)'s fascination is fights and disputes. He is always involved in one or the other fight just for the sake of it. In an interesting scenario, Hari is sent to a village called Tiruppuram where Telugu people, headed by Keshava (Achyuth Kumar) and Tamil people, led by Veera Muththu (Mime Gopi) fight with each other. Hari initially shows interest in the f... Read all",2h 25m,Chalo
686,7.9,['Alonso O. Lara'],"['Pablo Pichardo', 'Luis Huizar']","Dos familias que compiten por el control del negocio ilícito en la zona. Gustavo, quien es la Oveja negra de la familia Morales, será el talón de Aquiles del cual se valdrán y aprovechará la Familia Cortés para ejercer total dominio de la droga.",1h 55m,El Motero
687,7.3,['Trivikram Srinivas'],DESCONOCIDO,A young scion of a powerful family with a long history of violence decides to put an end to the bloodshed which leads him to a path of self discovery.,2h 42m,Aravindha Sametha
688,4.4,['Rob Pallatina'],"['Jacob Cooney', 'Brandon Stroud']",Passengers and crew on a flight are attacked by unseen forces that threaten all aboard.,1h 29m,Flight 666
689,3.7,['Philip Chidel'],DESCONOCIDO,"After an unnatural event leaves mankind nearly extinct, a runaway girl and a rogue bounty hunter brave a dangerous wilderness to find a fabled sanctuary that can either save or destroy what's left of humanity.",1h 25m,The Outer Wild
690,--,['Joseph Lee Billups Jr.'],DESCONOCIDO,,--,Stand Alone
691,--,['Jean-Louis Uzan'],DESCONOCIDO,Euphoria & Drama during the Rio de Janeiro Carnaval 2018,1h 19m,Johnny do Brasil *
692,4.6,DESCONOCIDO,DESCONOCIDO,A vampire joins a secret society to destroy an alien conspiracy for world domination. He battles extraterrestrials and uncovers a shadow government.,1h 20m,Anunnaki: The Fallen of the Sky
693,--,['Romane Simon'],DESCONOCIDO,,--,The Dawn of Zombie Apocalypse
694,5.4,['Jimmy Henderson'],"['Jimmy Henderson', 'Michael Hodgson', 'Kai Miller']","After years of tracking down international criminals, a trip to a remote jungle prison will force Chinese cop Xin to become human prey to fight for his freedom - and to save his own life.",1h 30m,The Prey
695,6.6,['Cheuk Man Au'],DESCONOCIDO,"When a dog is in need of rescue, the Paws-Men assemble to save the dog immediately like Batman.",1h 37m,Paws-Men
696,5.4,['Ganeshaa'],DESCONOCIDO,An honest cop tries to bring a lot of positive changes in a city which is polluted by a goon's actions.,2h 36m,Thimiru Pudichavan
697,4.5,['Karim El Sobky'],"['Amin Gamal', 'Mahmoud Hamdan', 'Mohammed Mehrez']","Badr the Diesel is a doppelganger who lives in a poor neighborhood. He meets Donia El Sayad, a famous movie star whose assistant Afaf is Badr's sister. When Afaf gets killed, he decides to seek revenge and find those who are responsible for her death.",1h 30m,El Diesel
698,4.5,['Saquan Jones'],DESCONOCIDO,And There Were 4 is Crash (2005 Oscar winning movie) meets African-American Superheroes.,1h 26m,And There Were 4
699,--,['Sathish Ramakrishnan'],DESCONOCIDO,,--,Tamizhananean.Ka
700,--,['Arthur J. Mangano'],DESCONOCIDO,A man's sweeping saga that exceeds the imaginations of those who have dreamed it.,--,Pilot
701,8.2,['Digpal Lanjekar'],"['Iraj Farahvashi', 'Digpal Lanjekar']","Farzand follows the story of warrior Kondaji Farzand, who along with 60 warriors defeated 2500 soldiers of the enemy to win the Panhala fort in just three and half hours in 1673.",2h 21m,Farzand
702,6.2,['David Kerr'],DESCONOCIDO,"After a cyber-attack reveals the identity of all of the active undercover agents in Britain, Johnny English is forced to come out of retirement to find the mastermind hacker.",1h 29m,Johnny English Strikes Again
703,--,['Aaron Stielstra'],DESCONOCIDO,"In the hillbilly town of Cortez Heights, a drug cult kidnaps an innocent hippie--and all hell breaks loose. Two detectives Lupo and Fabrizio must break the case without first killing their bloated, alcoholic (and bisexual) boss Commissioner Peterson. Meanwhile, a serial killer depletes the population with no concerns for the dignity of his victims, be they fraternity ... Read all",--,Less Human Than Human
704,--,['Jun Huang'],DESCONOCIDO,,--,Sharp the Bull
705,4.9,['Jon Guerra Jr.'],DESCONOCIDO,,--,Wolfsbane Say my Name
706,4.1,['Juan Salas'],DESCONOCIDO,"Timothy Hughes (Adrian Lockett) returns back from War only to face tragedy. His brother has been murdered , and they have no witnesses. which sends him on a downward spiral of Violence along with his Uncle ( DSR legend, Big Tuck), while being pursued by a DEA Agent (Christian Petrovich) under investigation , who takes one last chance at a new life but digs himself dee... Read all",1h 20m,The Wolf Catcher
707,3.9,['James Bickert'],DESCONOCIDO,"An innocent college student is tossed into a jungle hellhole where she must fight for her life against an evil wardress, psycho inmates, voodoo experiments and the incredible torture machine.",1h 22m,Amazon Hot Box
708,5.2,['Gokul'],DESCONOCIDO,"Mature Don Junga Mariappan travels back to Paris, France to find and take revenge on the drug dealers who killed his friend.",2h 36m,Junga
709,--,['In-chun Oh'],"['In-chun Oh', 'Jiyoung Park']","North Korea 's female elite agent 'JIWON', undercover as a police officer in South Korea. One day she receives, an important mission of delivering 'important thing(a KIM IL-SUNG badge!)' to North Korea. However, she loses the 'important thing' on the way to North Korea. Now, she is get in the worst situation where she cannot go north and also south in a deep forest ne... Read all",1h 18m,Dust Angel
710,5.1,['Toka McBaror'],DESCONOCIDO,"Four rich men (the Merry Men) seduce powerful women, get contracts from the political elite, steal from the rich, give to the poor and have sex with the hottest women in town. They face their biggest challenge yet when they antagonize a notorious and corrupt politician who plans on demolishing a village to build a shopping mall. The four men scheme to save the poor pe... Read all",1h 46m,Merry Men: The Real Yoruba Demons
711,--,['Karu Pazhaniappan'],DESCONOCIDO,,2h 14m,Pugazhendhi Enum Naan
712,6.7,['J. Nutan Punkaj'],DESCONOCIDO,"Rooma comes to Ranchi from Sri Lanka, She stays in Kishoreganj at Raja's apartment. Raja is gangster who works for Tony. Tony too likes Roma but because of Raja he can not have her. But Later Toneys opponent Michel is killed in a confrontation by Tony. Tony force Raja to Take responsibility for the murder. Raja does it for his mentor after getting married to Roma, Raj... Read all",--,Ilaaka Kishorganj
713,5.1,['Maruthi Dasari'],DESCONOCIDO,The son of an egoistic businessman falls in love with an egoistic girl and has to convince her egoistic mother in order to marry her.,2h 27m,Sailaja Reddy Alludu
714,--,DESCONOCIDO,DESCONOCIDO,DESCONOCIDO,--,Error nombre para la pelicula con id: tt8377736
715,6.3,['Dinesh Selvaraj'],DESCONOCIDO,"An encounter specialist's success in hunting down and eliminating criminals takes him to the holy city of Rameshwaram, where he will face the biggest threat of his career.",2h 8m,Thuppakki Munai
716,--,['Jeremiah Kipp'],"['Ziyad Saadi', 'Ziyad Rahim Saadi']","Traumatized from his last mission, Detective Lin is hesitant when being asked to rescue a Senator's kidnapped wife. On his journey, he quickly discovers the more sinister secrets behind, along with his haunting past and current danger.",1h 30m,Broken Badges
717,--,['Marcus Kempton'],"['Marcus Kempton', 'Joel D. Wynkoop']",The Joel Wynkoop Action Pack is an anthology feature film consisting of 4 short films directed and produced by Marcus Kempton. Joel D. Wynkoop's Nekoda Joel D. Wynkoop's Battlesuit Tim Ritter's Hess Peace Love Unity Retribution,2h,The Joel D. Wynkoop Action Pack
718,5.5,['Marc Price'],DESCONOCIDO,"A film crew wants to witness a gangland hit, and instead have to fight for their lives to survive the night.",1h 40m,Nightshooters
719,--,['Seth Ferranti'],DESCONOCIDO,The Tooth Fairy Mafia Don runs into the Easter Bunny Assassin and all hell breaks loose..,--,Easter Bunny Assassin: Chapter 3 - Tooth Fairy Mafia Don
720,5.2,['J.P. Dutta'],"['Nagender Choudhary', 'J.P. Dutta']",An action-war drama based on the 1967 Nathu La and Cho La clashes along the Sikkim border after 1962 Sino-Indian War.,2h 30m,Paltan
721,3.8,['Dale Fabrigar'],"['Suzanne DeLaurentiis', 'Dale Fabrigar', 'Everette Wallin']",Passengers on a train that crashes into a river must decide whether to risk waiting for help in the wreckage or take their chances in the murky depths below.,1h 20m,D-Railed
722,6.5,"[""Shin'ya Ayabe""]",DESCONOCIDO,"Tomio and his younger brother Shizuka run a bar ""Zenigata"" in a backstreet of a fishing port. At midnight, the bar changes to lender ""Zenigata."" Tomio and Shizuka lend money and charges the borrower high interest. One day, Yakumo Kenmochi, who is a former boxer, asks Tomio and Shizuka to work for them.",1h 51m,Zenigata
723,4.7,DESCONOCIDO,DESCONOCIDO,A down-and-out loser goes from zero to hero after getting superhero powers in this fantasy tale.,1h 18m,The Loser Hero
724,8.6,['Kenny Basumatary'],DESCONOCIDO,"Inspector Boro is an incorruptible, no-nonsense cop highly skilled in martial arts who gets suspended for bashing up a well connected gang of traffickers. A Superintendent of Police asks him to unofficially track down a girl named Sabrina Rai who has been missing for four days. While investigating, he learns that someone had taken her from her village to Guwahati city... Read all",1h 40m,Suspended Inspector Boro
725,5.2,['Director X'],DESCONOCIDO,"With retirement on his mind, a successful Atlanta-based drug dealer sets up one last big job while dealing with trigger-happy colleagues and the police.",1h 56m,SuperFly
726,6.1,['Jin-Soon Lim'],DESCONOCIDO,"Gi Cheol and Yoo Jin work together to find the missing girl, but traces of her are disappearing.",1h 39m,The Villagers
727,4.7,['Dominic Goodie'],DESCONOCIDO,"An ex-cop turned private Investigator struggles to put together the pieces of a new case, but with each clue he finds trouble seems to follow.",--,Without Fear
728,--,DESCONOCIDO,DESCONOCIDO,High school friends Don (David Paul) and Kevin ( John Rage Lesser) became overnight sensations in the pro wrestling world. They where sitting on top of the world until Don decided to go back to his old habits which put Kevin's family in grave danger. Now they must wrestle to save them. Will they stay on top or will they get pinned down and can't get up.,--,Wrestling with the Mob
729,5.2,['Yijun Liu'],DESCONOCIDO,"The movie ""Hong Kong Rescue"" recounts the outbreak of the Pacific War on December 8, 1941. Hong Kong was occupied by the Japanese army and expelled millions of Hong Kong refugees. At the same time, in order to achieve cultural control of the Chinese nation, the Japanese special agencies in Hong Kong searched and captured Chinese patriots and cultural celebrities who w... Read all",1h 34m,Hong Kong Rescue
730,6.1,['Marco Mak'],DESCONOCIDO,"Huang Feihong broke the headquarters of the White Lotus Society in Guangzhou, and swept Kanna Society's Sumo Dojo, attacked directly the headquarters base of the Kanna Society and finally rescued Zhang Zhidong out, making great contributions to the Counter-Japanese War in his own way.",1h 35m,Warriors of the Nation
731,3.8,['Lingfeng Zhu'],"['Rong Dai Lin', 'Jingzheng Sun']","After claiming countless lives, the fairies won the great battle with the demons. However, the leader of their Kunlun sect Yu Qingzi died for his young apprentice Xiao He. 500 tranquil years later, Xiao He finds himself face to face with a resurrected Yu Qingzi.",1h 30m,The Legend of Zu
732,6.8,['Aleksey Sidorov'],DESCONOCIDO,"An SS Panzer Division uses a T-34 manned by Soviet POWs as a training target, but the prisoners plot a daring maneuver.",2h 19m,T-34
733,5.2,['Kalyaan'],DESCONOCIDO,Four criminals sent to a village to recover buried treasure by a don decide to cheat him and share the treasure between themselves.,2h 9m,Gulaebaghavali
734,6.4,['Saiji Yakumo'],DESCONOCIDO,"A sage travels to the past and collects a set of legendary swords, which he brings to life as a gang of talented but dysfunctional young men, to fight a battle against evil.",1h 41m,Touken Ranbu: The Movie
735,6.5,['Panos Cosmatos'],DESCONOCIDO,"The enchanted lives of a couple in a secluded forest are brutally shattered by a nightmarish hippie cult and their demon-biker henchmen, propelling a man into a spiraling, surreal rampage of vengeance.",2h 1m,Mandy
736,4.8,['Michael Fredianelli'],"['James Allen Brewer', 'Michael Fredianelli']",A C.I.A. agent participates in a secretive brain-transference program when the ambassador to Italy is kidnapped by a rogue agent.,1h 26m,The Infinity Project
737,3.7,['Chaolu Hasi'],DESCONOCIDO,"Temüjin and Börte are childhood lovers who are deeply in love; but news of Temüjin's father's death swiftly disrupted their relationship. Temüjin heads back to his hometown, but was faced with a sudden attack from his father's former comrades.",1h 59m,Genghis Khan
738,7.1,['Jack C Mancino'],"['Karl Brenner', 'Akasuki Hashimoto']",Prof. Jack Taylor tests a newly developed digital environment called 'Vivid Dreams'. He pretty much gets confused when his mind gets mixed with fantasies from other subconsciouses. You never dream alone.,2h 48m,The Seventh Page
739,6.8,['Thiago J. Silva'],DESCONOCIDO,,1h 56m,King Kong
740,--,['Zane Woods'],DESCONOCIDO,,1h 21m,Into this World
741,5.5,['Rohit Shetty'],DESCONOCIDO,Simmba enjoys all the perks of being an amoral and unethical police officer until a life-changing event forces him to choose the righteous path.,2h 38m,Simmba
742,2.2,['Kenneth Cox'],DESCONOCIDO,,--,Fortnite Live Stream 1
743,--,['Vedguru'],DESCONOCIDO,,--,Dandayatre
744,--,['Udaya Bhaskar'],DESCONOCIDO,,--,Vijeta
745,7.6,['P.S. Mithran'],"['P.S. Mithran', 'Pon Parthiban', 'Rishabh Purohit']",A soldier takes on a gang of cyber criminals when money goes missing from his account.,2h 40m,Irumbu Thirai
746,--,['Wendy Woody'],"['Tara Chadwick', 'Wendy Woody']","Casey's world is changed forever when she opens an ancient artifact given to her by a mysterious woman. Suddenly she is thrown into a world of extraordinary power, vengeful queens, and some not-so-godlike new neighbors. Will the combination of otherworldly powers with Earthly emotions prove too much to handle? God drama, girl drama and saving the world - is it worth t... Read all",--,God Complex
747,--,DESCONOCIDO,DESCONOCIDO,,--,Dogstar: High School 2
748,--,['Jie Hou'],DESCONOCIDO,,1h 7m,Special Force Return III Top Secret Battlefield
749,5.9,['M. Nagarajan'],DESCONOCIDO,"Easwaran and Hari beat up a local mayor's son for harassing Hari's sister. However, hell breaks loose just when everything seems to go well.",2h 2m,Kaala Koothu
750,--,['Kody Newton'],"['Bryan Newton', 'Kody Newton']",,--,Ninja Cowboy Viking vs. the Modded
751,7.3,DESCONOCIDO,DESCONOCIDO,When lives are challenged the game will never be the same.,1h 16m,Chained
752,6.1,DESCONOCIDO,DESCONOCIDO,The Federation and Neo-Zeon collaborate to capture a rogue suit.,1h 28m,Mobile Suit Gundam: NT - Narrative
753,7.3,['Soo Sung Lee'],DESCONOCIDO,Park Young Ho is a new transfer student in school. He quickly becomes the target of top bullies of school because he stands up against them to protect a student from getting bullied.,1h 21m,Bullies
754,5.4,DESCONOCIDO,DESCONOCIDO,"When Cleo - born on a very auspicious day in the Chinese calendar - turns 18, she finds out that the Chinese mafia murdered her father. Outraged, she goes to Athens' Chinatown to confront the killers but soon realizes that in order to take her revenge she first has to face her own dark destiny.",1h 31m,Chinatown: The Three Shelters
755,4.1,['Christopher R. Mihm'],DESCONOCIDO,"In writer/director Christopher R. Mihm's ""post-apocalyptic-spaghetti-Midwestern,"" a man with no name is forced into a world of danger and bloodshed after he saves a scientist and a gifted child from a horde of radiation-scarred mutants. Though he would prefer to stay hidden until he can escape to a new life, something about the child-and the murderous ""Death Dealers"" ... Read all",1h 28m,Guns of the Apocalypse
756,--,DESCONOCIDO,DESCONOCIDO,DESCONOCIDO,--,Error nombre para la pelicula con id: tt9207198
757,--,DESCONOCIDO,"['David Lazarenko', 'Spencer Streichert']","Superhero Detective, Dr. Face, follows his arch nemesis back in time to avenge the death of his rookie and save the future in this dark comedy.",--,Dr. Face: Time 2 Face Justice
758,--,['Maitreyee Pakhira'],DESCONOCIDO,,--,Rudra The Beginning
759,--,['Nodir Muminov'],DESCONOCIDO,,2h,Temur
760,--,['Kazarr'],DESCONOCIDO,"The story plot centers around one woman (RUBY) the Protagonist of the film, and her parents MARK and BETTY, despite the many overwhelming obstacles, near death tragedies, physical abduction, and abusive relationship by deranged ex-boyfriend (JAMES) Antagonist, she overcomes them all through a life of faith, hope, and determination to survive. This film works to reveal... Read all",--,Ruby
761,6.7,['Simerjit Singh'],"['Rupinder Inderjit', 'Rashid Rangrez']",It is a biographical feature film on India's Highest Wartime Gallantry Award - Param Vir Chakra winner Subedar Joginder Singh. He fought three wars (as per records) for India before achieving martyrdom in the Sino-Indian War of 1962 while commanding a platoon in North Eastern Frontier Agency (NEFA) (Now Arunachal Pradesh). The story portrays his character and motivati... Read all,2h 19m,Subedar Joginder Singh
762,--,['Shad El-amin'],DESCONOCIDO,"When Alvera, the Girl Assassin, learns that her adversary Caesar might not be dead, she returns home with a single purpose: to find Caesar. The Girl Assassin soon faces an unexpected challenge when a mysterious man, Marduk, plays with her emotions. Now, she must fight to destroy the new evil that arises, and to learn the truth about Caesar.",--,Girl Assassin: The Search for Caesar
763,--,['Arasu'],DESCONOCIDO,What happens when the villain sets out to seek his revenge from the two lovers who created a ruckus for him.,1h 5m,Aagan
