442,6.0,['Aigars Grauba'],"['Aigars Grauba', 'Max Kinnings']","On his deathbed, the reigning king bestows power to an unexpected heir who must find strength within himself to unite his people against the violent crusades which threaten their freedom.",1h 54m,The Pagan King: The Battle of Death
443,6.5,['Christopher Annino'],DESCONOCIDO,A Roaring Twenties escapade about a small-time crook turned vaudeville theater owner.,1h 30m,Silent Times
444,5.5,['JoJo Henrickson'],DESCONOCIDO,A group of young international military fighters join with their tough veteran leader to protect a young boy whose family was murdered. Now they must figure out who are the good guys and bad guys before they all end up dead.,1h 40m,The Contractor
445,2.9,['Von Bilka'],"['Dan Underhill', 'Von Bilka']","A mere decade after the Heptigalaxial Cosmic Eternity War, the Kingdom of the Seven Galaxies is once again on the precipice of oblivion. The evil prince ADORASTIUS has escaped his icy incarceration and threatens the universe with the most fantastical yet calamitous power imaginable. The multiverse cries out in peril, and the beleaguered hero GALACTIC COMMANDER HELIOS ... Read all",1h 36m,Galaxy Lords
446,8.0,['Ashley Bell'],"['Ashley Bell', 'John Michael McCarthy III', 'Fernanda Rossi']",A team of elephant rescuers embark on a mission to rescue a 70-year old captive Asian elephant.,1h 17m,Love & Bananas: An Elephant Story
447,6.0,['Ke Zhou'],DESCONOCIDO,"Two brothers, experts in martial arts, have to separate their paths due to a fight in which one of them is badly wounded. Years later they are reunited in a world where organized crime controls everything.",1h 28m,Path to the Dream
448,--,['Zainal Palmans'],DESCONOCIDO,,--,Z-Fury
449,3.2,['Mike Garrick'],"['Mike Garrick', 'Steven J Heath']","A young woman awakens in a world devastated by meteorite strike, yet she recalls her own death 70 years ago. Searching for answers she finds plague, destruction, madness and a terrifying adversary, who confronts her with a long forgotten memory and an impossible choice.",1h 29m,Yesterday's Girl
450,6.4,['Dale Stelly'],DESCONOCIDO,"Two of Compton's Finest, Det. Blackman and Det. Vargas are on the hunt for Columbian drug lord Silk Delgado who is flooding the streets of Compton's with the world's most deadliest drug called ""The Devil's Breath"".",1h 45m,Compton's Finest
451,7.2,['Alex Ranarivelo'],DESCONOCIDO,The inspiring story of a BMX champion who overcame an abusive childhood through the love and life lessons of his interracial foster family.,1h 38m,The Ride
452,5.4,['Kevin Glynn'],DESCONOCIDO,"Peter, a young aircraft engineer is deceived by his manager Jason into substituting faulty aircraft parts. When a part explodes killing a passenger, Air accident investigation find Peter responsible. Jason is found murdered.",1h 30m,Point of no Return
453,3.5,['Joaquin Montalvan'],"['Joaquin Montalvan', 'Eunice Font', 'S.E. Feinberg']","A legion of demons have been unleashed creating an apocalyptic America. Pike leads a group of survivors fighting demonically possessed corpses through the wasteland trying to make it to Jawbone, while The Magistrate is creating an army of cannibal corpses to serve him. What will be required of Pike to defeat this legion? It all started in Jawbone and it will all end i... Read all",1h 40m,Cannibal Corpse Killers
454,4.8,DESCONOCIDO,"['Josh Smith', 'Tate Smith']",Two Fur Traders on the Run from Shoshone Indians Test the Bonds of Brotherhood.,1h 32m,Iron Brothers
455,6.4,['Jeethu Joseph'],DESCONOCIDO,"Aadhi, an aspiring musician, travels to another state in hopes of making it big. While there, an unexpected event leaves him trapped, unable to return to his family and running for his life.",2h 38m,Aadhi
456,7.6,['Paul Sanchez'],DESCONOCIDO,"Charlie Sheen narrates a documentary about the making of Platoon, the award winning, non-union, low budget film cast with young, unknown actors. Insider stories of Oliver Stone's unique directing style and brutal filming conditions.",1h 29m,Platoon: Brothers in Arms
457,6.9,['Timo Tjahjanto'],DESCONOCIDO,"Ito, a gangland enforcer, is caught amidst a treacherous and violent insurrection within his Triad crime family upon his return home from a stint abroad.",2h 1m,The Night Comes for Us
458,7.6,['Vikramaditya Motwane'],"['Vikramaditya Motwane', 'Anurag Kashyap', 'Abhay Koranne']","The origin story of Bhavesh Joshi, an Indian superhero, who sets out to fulfill his slain friend's wish to clean and reform the country, by training himself to fight and wearing a mask.",2h 34m,Bhavesh Joshi Superhero
459,5.5,['Michael Caton-Jones'],DESCONOCIDO,"An aging hitman's last job goes sideways, forcing him to redeem himself.",1h 44m,Asher
460,4.4,['Carl Strathie'],DESCONOCIDO,"After a space mining operation gone bad, Troy is on an emergency escape vehicle drifting towards the sun. He gets radio contact with possible help but will they get there in time?",1h 32m,Solis
461,5.2,['Gerard McMurray'],DESCONOCIDO,"America's third political party, the New Founding Fathers of America, comes to power and conducts an experiment: no laws for 12 hours on Staten Island. No one has to stay on the island, but $5,000 is given to anyone who does.",1h 37m,The First Purge
462,4.8,['David McCracken'],DESCONOCIDO,"An action/thriller set in 1977 about four friends who reunite for a bachelor party to hunt for buried Prohibition money on Kentucky's Bluegrass Bourbon Trail, only to become ripped apart by greed, corruption, and murder.",1h 38m,Bullitt County
463,5.5,['Roel Reiné'],DESCONOCIDO,"The power struggles and wars between the Frisian Redbad and his sworn enemy Pepin of Herstal, Lord of the Franks.",2h 40m,Redbad
464,2.2,['Asif Akbar'],"['Asif Akbar', 'Bernard Selling']","A billionaire and his team with a private space exploration program, returns to Earth with an abducted extraterrestrial from a newly discovered alien planet, with hidden secrets of his own from this world.",1h 45m,Astro
465,--,DESCONOCIDO,DESCONOCIDO,"Brainwave and Doctor Discord destroy Silver City as they battle against each other. The Tempest Heroes fight back but to little avail. With the arrival of a stranger from another world, heroes and villains travel through space and time in a search for complete control.",--,Infamy
466,3.5,['Sean Cain'],DESCONOCIDO,"As the earth crumbles under the feet of the unsuspecting Angelenos, and a sea of hot lava is about to boil over, a geology geek and a young disaster-movie diva must avert a nightmare come true. Will the mayor act fast before it's too late?",1h 26m,Eruption: LA
467,3.6,['Jesper Ganslandt'],DESCONOCIDO,"Sean Haggerty only has an hour to deliver his illegal cargo. An hour to reassure a drug cartel, a hitman, and the DEA that nothing is wrong. An hour to make sure his wife survives. And he must do it all from the cockpit of his Cessna.",1h 29m,Beast of Burden
468,2.4,['Jarret Tarnol'],DESCONOCIDO,"While trying to remain a good husband and father, Superbat and the Avengers of Justice come out of retirement to stop Dark Jokester and Lisp Luthor from freezing the planet.",1h 27m,Avengers of Justice: Farce Wars
469,5.6,['Detlev Buck'],DESCONOCIDO,A gangster in Berlin tries to change his fate.,1h 43m,Asphaltgorillas
470,7.3,['R. Ajay Gnanamuthu'],"['R. Ajay Gnanamuthu', 'Pattukottai Prabhakar']",A CBI officer goes in search of a ruthless serial killer. Things get worse when the murderer targets the former and her family.,2h 50m,Imaikkaa Nodigal
471,4.9,['Prem'],DESCONOCIDO,An interesting adaption of the relationship and the analogy of the iconic characters Ram and Ravan set in the present day world.,2h 56m,The Villain
472,7.3,['Rathish Ambat'],DESCONOCIDO,Kammaran Nambiar is a crooked man whose life story as an unscrupulous Indian peasant is turned into a film where he is glorified as a freedom fighter with much manipulation of history.,3h 2m,Kammara Sambhavam
473,6.0,['Sam Levinson'],DESCONOCIDO,"After a malicious data hack exposes the secrets of the perpetually American town of Salem, chaos descends and four girls must fight to survive, while coping with the hack themselves.",1h 48m,Assassination Nation
474,5.7,['Patrick Alessandrin'],DESCONOCIDO,"Following the untimely death of his grandpa Gus, thirteen-year-old Shaun disregards his parents' wishes and embarks upon a great journey into the wild with his dog Riley to spread his grandpa's ashes from a remote mountaintop.",1h 27m,Surviving the Wild
475,9.2,['Jason Lupish'],"['Jennifer Farrugia', 'Jason Lupish', 'Erica Sherwood']",A struggling writer pens a best seller about a single mother struggling to support her family by getting caught up in the world of underground bare knuckle fighting while her 14 year old adopted daughter searches for her estranged mother.,1h 30m,Fight!
476,7.8,DESCONOCIDO,DESCONOCIDO,"At the Riviera Hotel and Casino auction, a working class family looking for bargains, two lowlife thieves, a Vegas historian fighting to save the Riviera, and an old timer security guard who can't bring himself to let go of the place, are trapped inside the haunted hotel and must escape with their lives from sinister forces that are beyond their control.",--,The Auction
477,--,DESCONOCIDO,DESCONOCIDO,"In a small town in Africa, two college kids, Kwesi and Niko become entangled in the world of internet theft. When a local criminal takes them under his wing the two friends must now find their way to redemption or risk being trapped in the cycle of crime.",1h 29m,Scam Republique
478,3.7,['Jezar Riches'],DESCONOCIDO,A couple is pulled over by police. When a simple traffic stop becomes a nightmare they will never forget.,1h 50m,Halt: The Motion Picture
479,6.4,['Vignesh Shivan'],"['Neeraj Pandey', 'Vignesh Shivan']","Angered by the corruption that stopped him from becoming a CBI officer, a young man forms a gang who pose as CBI officers and raids the corrupt.",2h 18m,Thaanaa Serndha Koottam
480,6.2,['Jesse V. Johnson'],"['Scott Adkins', 'Pat Mills', 'Stu Small']","Mike is a tough hitman, who makes his hits look like accidents or suicide. He's in a gang of hitmen, each with his own style. When his loved ex is killed, Mike looks for those responsible.",1h 45m,Accident Man
481,7.4,['Milorad Krstic'],DESCONOCIDO,"Four expert thieves attempt to steal every famous artwork that is haunting their mutual psychotherapist. A detective attempts to find out who the ""Collector"" is.",1h 36m,"Ruben Brandt, Collector"
482,5.7,['Lin Oeding'],"['Ian Shorr', 'Peter Gamble']",An employee at a weapons factory discovers that an energy drink turns his co-workers into zombies.,1h 32m,Office Uprising
483,3.9,['Chase Dudley'],DESCONOCIDO,"When inexperienced criminal Ben holds up a small-town restaurant, the poorly-planned robbery spirals into a hostage crisis beyond his control. Trapped inside with him is his girlfriend, manager Adie Graham, a cunning sociopath.",1h 45m,Payday
484,--,['Feng Liu'],DESCONOCIDO,"Two men and a woman, each of whom is trying to get their hands on a trove of precious jewels. Lots of misunderstandings arise, forcing the three hapless jewel hunters to co-operate. Despite internal rivalries an unexpected harmony arises.",1h 30m,Stolen Fairytales
485,--,['Ajay Srivastava'],DESCONOCIDO,,2h 40m,Nathuniya Pe Goli Mare 2
486,4.1,['Torsten Künstler'],"['Lo Malinke', 'Tripper Clancy']",A pair of Tactical Units Police Officers from different walks of life come together to rescue an ambassador's daughter.,1h 40m,Hot Dog
487,--,DESCONOCIDO,DESCONOCIDO,"A group of life time nerds gain very unusual super powers when they eat radio active chili . When one develops the ability to time travel they discover WWII time traveling Nazis who are trying to take over all eternity, Our heroes now must band together to stop them.",1h 4m,Fantastic Friends
488,5.6,['Emmanuel Saez'],DESCONOCIDO,"Seven Arch Angels take on Satan's Army of the Undead, after an apocalyptic asteroid hits planet Earth",1h 40m,Dark Patch
489,6.6,['Baltasar Kormákur'],DESCONOCIDO,"A true story of survival, as a young couple's chance encounter leads them first to love, and then on the adventure of a lifetime as they face one of the most catastrophic hurricanes in recorded history.",1h 36m,Adrift
490,5.0,['Adam Marcus'],"['Adam Marcus', 'Debra Sullivan']","Christmas dinner brings tidings of death when someone enacts revenge, and out of the bloody madness rises a hero who must face all odds to stop an outbreak before it's too late.",1h 29m,Secret Santa
491,6.6,['Shinsuke Sato'],"['Hiroya Oku', 'Hiroshi Hashimoto']",An middle-aged office worker encounters aliens and is gifted with alien technology and limitless powers.,2h 7m,Inuyashiki
492,3.7,['Richard Griffin'],DESCONOCIDO,"In the year 2024, homosexuality has been outlawed by an extreme right-wing government. Only one extraordinary man can stop this wave of terror and repression, a superhero for our troubled times.",1h 34m,Code Name: Dynastud
493,--,DESCONOCIDO,DESCONOCIDO,,--,MountAlien
494,6.4,['Gabriel Soriano'],DESCONOCIDO,,1h 30m,Colores Verdaderos
495,--,['Chase Diedrich'],DESCONOCIDO,"High-schooler Finnigan Greed has found a stone that gives him superpowers. As he tries to hide his powers and new identity, he meets a new friend, Jordan Peralta, who just so happens to have similar powers.",--,Metalloid: Freshman
496,4.7,['Justin Lee'],DESCONOCIDO,An ex-soldier ventures into the Pacific Northwest to uncover the truth behind his fiance's disappearance.,1h 29m,Big Legend
497,8.4,['Cristobal Gonzalez Camarena'],DESCONOCIDO,"How the human race has forgotten to be connected with mother nature, because they're to busy in the cities, with the social media, become drug addicted, alcoholic, and do not remember that Nature is the were all come from. Nature is connection to the earth, water and wind. In this story we follow 10 people that where disconnected and drown into drug addiction, showing... Read all",1h 50m,La Era de la Desconexión
498,3.8,['Emmet Cummins'],DESCONOCIDO,"A young, skilled Viking embarks upon a perilous journey, fighting a lone battle to become a warrior Viking and fulfill his family legacy.",1h 47m,The Lost Viking
499,5.0,['Babak Najafi'],DESCONOCIDO,"Mary is a hit woman working for an organized crime family in Boston, whose life is completely turned around when she meets a young boy whose path she crosses when a professional hit goes bad.",1h 29m,Proud Mary
500,6.6,['Johnny K. Wu'],"['Johnny K. Wu', 'Kyle Znamenak']",Naive Ed trying to prove to everyone he's a great Kung Fu Master while learning through life that it is never black and white when being bullied.,1h 33m,Innerself
501,--,['Sonny P. Louis'],DESCONOCIDO,"After finding a mysterious book, a young man (Dave) suddenly develop supernatural abilities. But all Magic comes with a cost. Dave has to fight to free his soul from an ultimate reality, where the human souls are damned for eternity.",--,The Book of the Damned
502,5.5,['Soi Cheang'],"['Ning Wen', ""Cheng'en Wu""]",A travelling monk and his followers find themselves trapped in a land inhabited by only women.,1h 54m,The Monkey King 3
503,4.7,['Vikram Sirikonda'],DESCONOCIDO,A peaceful man completely devoted to his family finds his violent past resurfacing.,2h 27m,Touch Chesi Chudu
504,6.0,DESCONOCIDO,"['Mike Kang', 'Daniel Okoduwa']","A young refugee girl escaping civil war wrongly lands in a remote uninhabited part of Australia. She must reach civilization whilst fighting starvation, harsh terrain and a hunter who hunts her in vengeance for the death of his son.",1h 23m,Survive or Die
505,5.9,['Dong-seok No'],"['Ui Seok Cho', 'Lee Hae-jun', 'Kôtarô Isaka']",A deliveryman has to run for his life when he is he falsely accused of killing a presidential candidate in a car explosion.,1h 48m,Golden Slumber
506,6.9,['S. Craig Zahler'],DESCONOCIDO,"Once two overzealous cops get suspended from the force, they must delve into the criminal underworld to get their proper compensation.",2h 39m,Dragged Across Concrete
507,7.4,['Dallas King'],"['Liu Ziming', 'Fang Liu', 'Dallas King']","Set in the post-apocalypse, a group of fighters believe they're fighting for their freedom, until they realize they're in a comic book.",1h 21m,Ink & Rain
508,7.5,['Leigh Whannell'],DESCONOCIDO,"Set in the near-future, technology controls nearly all aspects of life. But when the world of Grey, a self-labeled technophobe, is turned upside down, his only hope for revenge is an experimental computer chip implant.",1h 40m,Upgrade
509,5.5,['Tom Oesch'],DESCONOCIDO,"While transporting a dying man to the hospital, two paramedics find a million dollars in cash sewn into his clothing. When the man dies, they decide to keep it, setting them on a path for a hellish night of violence and mayhem.",1h 41m,Danger One
510,3.9,['Steven C. Miller'],DESCONOCIDO,"Years after he fought his way out of an inescapable prison, Ray Breslin has organized a new top-notch security force. But when one of his team members goes missing, Breslin must return to the hell he once escaped from.",1h 36m,Escape Plan 2: Hades
511,8.6,['Grant Murphy'],DESCONOCIDO,"Brumville follows Connor Cutire and his two childhood friends Lee and Mikey. Connor and Lee want to make as much money as fast as possible selling drugs to eventually move away, go legit and move in to real eastate, with Mikey the accountant doing all the paperwork for them. But as Connor highlights in the film ""life is never that simple.",--,Brumville
512,6.2,['John Andreas Andersen'],"['John Kåre Raake', 'Harald Rosenløw-Eeg']","In 1904 an earthquake of magnitude 5.4 on the Richter scale shook Oslo, with an epicenter in the ""Oslo Graben"" which runs under the Norwegian capital. There are now signs that indicate that we can expect a major future earthquake in Oslo.",1h 46m,The Quake
513,5.9,['David Raymond'],DESCONOCIDO,"A weathered Lieutenant, his police force, and a local vigilante are all caught up in a dangerous scheme involving a troubled, recently-arrested man who's linked to years of female abductions and murders.",1h 38m,Night Hunter
514,5.5,['Elder Fraga'],"['J.J. Salinas', 'Sérgio Minehira', 'Leonardo Granado']","São Paulo is a complex city. So complex that when stories based on true elements mix with fiction, it is difficult to know which one is which. ""SP: Crônicas de uma cidade real"" is a collection of five stories: The rescue of a policeman, the punishment of a murderer, a sadist who studies the boundary between the beautiful and the grotesque, the search for lost memory a... Read all",--,SP: Crônicas de uma cidade real
515,--,['Micah Webb'],"['Davionne Coubarous', 'Micah Webb']",A multi-billion dollar corporation produces a serum that turns humans into super-soldiers and sells them on the Black Market. They are opposed by an unknown group who is trying to expose them.,--,Project Jyn
516,4.3,['Brian A. Miller'],DESCONOCIDO,"A bank manager haunted by a violent heist that took the life of a coworker teams up with his ex-cop neighbor to bring down the assailant, initiating an explosive counterattack that brings all three men to the breaking point.",1h 29m,Reprisal
517,--,DESCONOCIDO,DESCONOCIDO,,1h 2m,The Lines Between
518,--,['Pascal Luneau'],"['Pascal Luneau', 'Antoine Martin-Sauveur', 'Luc Porta']","At the end of WWII, the General De Gaulle decides dissolve all the French resistance networks that helped the allies. Only one was spared, the ""304"". In 2018, this enemy is called corruption, lobbies and crooked politicians.",1h 28m,Mémoires du 304
519,5.3,['Will LeForestier'],DESCONOCIDO,"An American student in Seoul, South Korea uses his skills as a spy to stop foreign agents and local gang members from gaining access to a supercomputer that can connect to anyone and anything.",1h 50m,Eyes Wide Open
520,7.2,['David Nelson'],DESCONOCIDO,"The Flying Dove organization pits the United States and Russia against each other in hopes that the two sides will go to war. Meanwhile, the CIA has assigned Ben Dalton to oversee a defection from the Flying Dove terrorist group.",1h 47m,The Hidden Dove
521,6.4,['Luis Ismael'],"['Luis Ismael', 'Dinis Santos', 'Daniel Costa']","Romeu, a corrupt cop, hires the services of Cid and Alex, to catch a notorious criminal, who left Mexico and is on his way to Galicia, Spain to find the killer of his brother, also trying to catch the same criminal is an FBI agent.",2h,Bad Investigate
522,6.4,['Nirmal Sahadev'],"['George Kanatt', 'Nirmal Sahadev']","Trapped in a life of crime, a mysterious getaway driver, lives with this code of conduct and protects his only friend. When he meets someone who can potentially change his entire world, he yearns at a chance for redemption.",2h 16m,Ranam
523,6.0,['Susanna Fogel'],"['Susanna Fogel', 'David Iserson']",Best friends Audrey and Morgan unwittingly become entangled in an international conspiracy when one of them discovers that the boyfriend who dumped her was actually a spy.,1h 57m,The Spy Who Dumped Me
524,3.3,['Eric Zaragoza'],DESCONOCIDO,"The International Space Station is now a prison - the ultimate black site. No one's getting out. And no one knows it's there. But when the imprisoned terrorists take over the Station and turn it into a missile aimed at Moscow, only a shuttle pilot and a rookie doctor can stop them. Their task is complicated by a rogue CIA agent (Scott Adkins) who has his own plans for... Read all",1h 29m,Incoming
525,6.9,['David Mackenzie'],DESCONOCIDO,A true David vs. Goliath story of how the 14th century Scottish 'Outlaw King' Robert the Bruce used cunning and bravery to defeat the much larger and better equipped occupying English army.,2h 1m,Outlaw King
526,5.3,['Brett Donowho'],DESCONOCIDO,"At a bachelorette party in a nightclub, the bride tells 2 guys offering blow to go away. They abduct her. The groom's 2 big brothers looked after their kid brother as kids and do so now again as veterans, ""looking"" for her and the 2 guys.",1h 26m,Acts of Violence
527,2.8,['Mohsen Mohseni-Nasab'],DESCONOCIDO,Sadra has been living out of the country(Iran) for so Long and now she is trying to bring her sister(Bahar) to Russia to study university. Bahar arrive to Russian airport but some stranger kidnapping her and talking her to an unknown place and now Sadra have to fight for her freedom.,1h 26m,Rhino Horn
528,5.3,DESCONOCIDO,DESCONOCIDO,"The story of the Odiyan clan, one of the most dreaded, shape-shifting black magicians in the world which ruled the darkness of night through during the pre-electrification era in Kerala.",2h 47m,Odiyan
529,3.9,['Ryan Bellgardt'],"['Ryan Bellgardt', 'Galen Christy', 'Adam Hampton']","In the near future, 10 death row convicts are forced to compete in a virtual reality game that pits them against dinosaurs and each other.",1h 26m,The Jurassic Games
530,7.0,DESCONOCIDO,DESCONOCIDO,"IAS officer Chanchala Reddy is imprisoned in a haunted house, while she is interrogated by law enforcers investigating a politician they suspect of corruption.",2h 18m,Bhaagamathie
531,6.9,['Angga Dwimas Sasongko'],DESCONOCIDO,"Indonesia, the 16th century, Wiro Sableng, a disciple from a mysterious Warrior named Sinto Gendeng, got a mission from his Master to take down Mahesa Birawa, her former disciple who betrayed her.",2h 3m,212 Warrior
532,4.8,['Ben Kent'],"['Ben Kent', 'Joel Wilenius']","When a hopeless stag party goes on a mock zombie survival weekend, an unfortunate turn of events leave them fighting for their lives.",1h 25m,Fubar
533,4.3,['Jodi Scurfield'],DESCONOCIDO,Speedboat racing champion and multimillionaire Ben Aronoff leads a double life that lands him in trouble with the law and drug lords.,1h 42m,Speed Kills
534,--,DESCONOCIDO,DESCONOCIDO,"Three random strangers end up moving together due to unforeseen circumstances. When one of the roommates takes a USB drive with criminal information on it, the three now friends must duck and dodge some of the most dangerous criminals.",--,Dodging the Bullet
535,6.3,['Stephen Armourae'],DESCONOCIDO,The feature length version following on from a short film in 2017 entitled The tragedy of King Lear.,2h 27m,King Lear
536,7.2,['Joseph C. Grant Jr.'],DESCONOCIDO,"An organic blend of action, suspense and gut-busting, hilarious comedy occur when two ""good-natured"" friends inadvertently snatch a bag that a cop needs to repay an overwhelming debt to the Irish Mob. What the duo find is that they are now knee-deep in a deadly web that not only includes a cell of crooked cops and the Irish Mob but also an endless array of shady, devi... Read all",1h 21m,The Stuff
537,--,['Michael Aguiar'],DESCONOCIDO,,--,The Run
538,5.3,DESCONOCIDO,DESCONOCIDO,"After finding out about an illegal arms deal, a military intelligence officer goes rogue with highly sensitive data related to his organization, and his mentor, a colonel, races to hunt him down.",2h 37m,Aiyaary
539,4.5,['Luke Sparke'],"['Luke Sparke', 'Felix Williamson']","A small group of town residents have to band together after a devastating ground invasion. As they struggle to survive, they realize they must stay one step ahead of their attackers, and work together for a chance to strike back.",1h 59m,Occupation
540,6.4,['Alexi Carpentieri'],DESCONOCIDO,The story revolves around a group of teenage boys. When one of them suddenly gets a chance to make a pact with the devil things shift quickly in their lives.,--,Bimbo bambino
541,5.4,['John Maringouin'],DESCONOCIDO,"A dullard Texas entrepreneur reinvents himself as a cowboy in China's tech wild west, but finds himself at the mercy of corrupt American expats looking to reinvent him once more.",1h 30m,Ghostbox Cowboy
542,7.6,['Govind Varaha'],DESCONOCIDO,The movie highlights the issues of attachment and detachment in human relationships through the events that occur in the life of a girl before and after her romantic affair.,2h 6m,Velakkariyayirunnalum Neeyen Mohavalli
