,Puntuacion_IMDB,Dirección,Guionistas,Argumento,Duración,Nombre de la película
0,6.6,['Pat Jackson'],DESCONOCIDO,"A lone shark bounty hunter pits himself against secret agents from three countries. The prize: a million bucks in cash for vital state secrets. A little talky in spots, but overall not bad. Color. 16mm.",1h 37m,To Chase a Million
1,--,['Erico Alessandro'],"['Erico Alessandro', 'Érico Alessandro de Munhoz']",,1h 30m,Stage 3
2,--,['Erico Alessandro'],DESCONOCIDO,,--,New Breed
3,5.3,['Kaarthikeya Varikallu'],DESCONOCIDO,"""Rangu"" movie shot based on the true life story of a Vijayawada student ""LARA"", who faced bitter experiences and their Severe consequences in his life.",2h 36m,Rangu
4,5.1,['Chad Ferrin'],DESCONOCIDO,Three friends find themselves lost on Skid Row and are captured by an angry homeless gang.,1h 20m,Attack in LA
5,--,['L. Ravi Kumar'],DESCONOCIDO,It is about the things that happen due to alcohol addiction. Raghuram joins army and gets killed by enemy army. His father then gets addicted to alcohol to kill his pain. But Raghuram shocks everyone as he returns home safe. His father then continues his rest of life spending with alcohol.,1h 38m,Amalu
6,--,['Khyler Vick'],DESCONOCIDO,,--,blockheaDs 3
7,--,['Augustus Omojowo Thomas'],DESCONOCIDO,,--,Jane Rambo Daughter of the Jungle
8,--,['Evgeniy Mishukhin'],DESCONOCIDO,,--,Robbers 3: Saved in Time
9,5.8,['Milan Chams'],DESCONOCIDO,"A guy is desperate to go to London to settle his life, and when he finally gets there, he starts to fall in love with a girl.",--,Happy Days
10,4.5,['Ümit Degirmenci'],"['Ümit Degirmenci', 'Yilmaz Gungor']","Umut Güneri is one who deals with trade. They have concentrated on drinking alcohol in the past with his Russian partner Sergey Krilenkov. Due to the introduction of mixed drink with drugs by Sergey Krilenkov Turkey market in Turkey, 25,000 people lost their lives. For this reason, Umut Güneri and Sergey Krilenkov's partnership was completed by Umut Güneri.",--,Zor Oyun: Kapanmayan Hesap
11,5.7,['Guohan Hu'],DESCONOCIDO,,1h 35m,Ji yao zhuan
12,--,['Aaron Gregson'],DESCONOCIDO,,--,Wolverine Chronicles
13,--,['Matthew Stalletti'],DESCONOCIDO,"Average teenage superhero, Bumbleboy, spends his days stopping crime and helping cats down from trees. A mysterious group of men with mysterious looking tech send Bumbleboy on a quest to prove that he is more than just kid. As things unravel, Bumbleboy realizes that it's not so easy to juggle life while trying to be a hero. Will he learn what it means to be a ""true"" h... Read all",--,Bumbleboy
14,6.8,['Duy Joseph'],DESCONOCIDO,,1h 39m,Fight Back to School
15,8.7,DESCONOCIDO,DESCONOCIDO,A young couple must overcome a bitter grudge or be consumed by hate when the souls of their tormentors are reincarnated in their newborn twins.,2h 12m,Clinging with Hate
16,6.3,['Joon-Hyeong Heo'],DESCONOCIDO,"In this Korean action comedy, seven people including a cop, a killer, gangsters and a delivery man all try to get their hands on a gun and a golf bag filled with cash.",1h 41m,Snatch Up
17,5.9,['Davaajargal Tserenchimed'],"['O. Erdene', 'Sumya Sonomdeleg']","The ruffles king forbids music for his kingdom and gets cursed for it. The king's right hand secretly wishes to take the throne and tries to kill the king, but the cursed king just would not die. Later when the king's right hand figures out how to kill the king and takes over the kingdom. The left-for-dead king gets local's support whom secretly kept practicing the ar... Read all",2h 38m,The Legend of Gobi
18,--,['Promise Shoyenka'],DESCONOCIDO,THE IMPOSIBLE MISSION. The quest to become mightier and greater in the Christian circle motivated a lot of pastors to join the Dark circle confraternity.,1h 3m,The Imposible Mission
19,--,['Rajesh Fernandes'],DESCONOCIDO,,--,Planning Devachem
20,--,['Yuehui Chen'],DESCONOCIDO,"The Doctor of Evil activated the time-space portal to cause time-space changes in various parts of the world. Human beings are ready to fight the invasion of alien monsters. The communication system of the X-Force sub-base in Kuala Lumpur, Malaysia was invaded by mysterious saboteurs. Bai Lu was assigned to Kuala Lumpur to carry out a reconnaissance mission. Lu sudden... Read all",1h 36m,Guang ying zhi zhan
21,5.6,['Mengxi Tao'],DESCONOCIDO,"During the reign of the Kangxi Emperor, when Wu Sangui died, the senior general Ma Bao begins to seek protection to escort Chen Yuanyuan and his grandson to live in seclusion. Qingping Escort Agency, the No. 1 Escort Agency, takes the heavy responsibility by accident. In the end, they make a narrow escape after going through bloody battles with various forces.",1h 30m,The Bravest Escort Group
22,5.1,DESCONOCIDO,DESCONOCIDO,Set in 1941 in Murmansk. A ferryboat ships prisoners and ammunition to battle line to help the fighting against German army. The crew must elude the attack from German warcrafts and control the prisoners' riot.,1h 18m,Sem par nechistykh
23,8.1,['Haiqiang Ning'],"['Haiqiang Ning', 'Sen Xiao']","China's first military peace film, telling the story of current officers and men of China's peacekeeping force in the implementation of President Xi.",1h 36m,China Peacekeeping Forces
24,--,['Yaata Satyanarayana'],DESCONOCIDO,,--,Swarna Khadgham
25,5.0,['Drilon Hoxha'],DESCONOCIDO,"Love is not enough to achieve the set goals and is seen as a stumbling block, and you have to make a pact with the world of crime and often sacrifice friends and family for ambition. The only value left to the human being is fading with the passage of time and is being replaced by the anger of vengeance. The film illustrates a young man who regains freedom but does no... Read all",--,Dashuria S'mjafton
26,7.0,['Yu Bin Zhuang'],DESCONOCIDO,"A hundred years ago, the Demon Lord controlled the world and nobody could stop him. Later, the fish-like people sealed off the Demon Lord in order not to let him harm the world. The elders of the clan formed several battle arrays with the strength of the whole clan, and sacrificed themselves as guardian gods of arrays. Fearing that later generations would awaken the D... Read all",1h 16m,Ghost Boxing 3
27,7.5,DESCONOCIDO,DESCONOCIDO,,1h 27m,Operation Undercover 2: Poisonous Dragon
28,--,['Kamen Sway'],DESCONOCIDO,,1h 26m,Branded Fate
29,5.2,['Santiago Ventura'],"['Gonzalo Palermo', 'Santiago Ventura']",A girl has the ability to see in color in a dystopian world where people can only see in black and white.,1h 40m,Grey Eyes
30,5.6,['Dong Wei'],DESCONOCIDO,"In the Republic of China period, warlords have dogfights. The three forces, that is, the Tang Men of Sichuan, stationed warlords and Banshan priests, give full play to their abilities to fight for the ancient treasure Muchen Bead. During the process to prevent Muchen Bead from being used to summon underworld guards to slay ordinary people, Tang Que, Duan Yao and Yang ... Read all",1h 10m,Tang Men
31,8.3,['Xiaochuan Guo'],"['Xiaochuan Guo', 'Xiaochuan Guo']","In a turbulent time in the Ming Dynasty, the Imperial Bodyguard solves humans' cases, while the Jinwu Guard takes charge of ghosts' and monsters' business. Eunuch Wei seizes great power and suppresses dissidents. Colluding with the monster Huo Feiyuan, he framed up Feng Tingzhang, the Director of the Grand Court. Zuo Changgeng, Feng's disciple, accidentally gets invol... Read all",1h 24m,Da ming ping yao zhuan
32,4.5,['Mehmet Çetin'],DESCONOCIDO,,--,Mahsusa: Yüzyillik Mühür
33,--,['Jack Garner King'],DESCONOCIDO,A wannabe nature survivalist and a communist drug addict start a violent feud born from a terrible misunderstanding,1h 26m,BearCat Wilson: Catfish Bob's Revenge
34,6.8,['Hisashi Saitô'],"['Tetsuto Uesu', 'Takao Yoshioka', 'Yasunori Yamada']","Toujou Basara is a high school student whose father has suddenly just remarried. His father then departs overseas leaving Basara with two new beautiful step-sisters. Little does he know, his new sisters, Mio and Maria are actually the new Demon Lord and a succubus!? Almost trapped into a life of servitude, Basara forms a reverse contract by accident and ends up becomi... Read all",1h,The Testament of Sister New Devil: Departures
35,--,['Leon Ding'],DESCONOCIDO,"Two chickens start a new chapter in their lives by learning a mysterious martial art. As they train, it is obvious they don't exactly fit in until evil weasels threaten the chickens' way of life, and the town has to band together to defeat them.",1h 20m,The Salted Egg
36,--,['Aftab Rana'],DESCONOCIDO,"Pratighat is a Bhojpuri movie starring Kamal Ranjit and Kanchan Singh in prominent roles along with Manoj Pandit. It is a drama directed by Aftab Rana with Basant Kumar Ravi as the music composer, forming part of the crew.",2h 10m,Pratighat
37,--,['Anthony Oleszkiewicz'],DESCONOCIDO,"In a school ruled by fear, an orphaned boy decides to become a masked vigilante.",1h 13m,Batboy: Knight of Terror
38,--,['Xiaogang Wang'],DESCONOCIDO,,--,Changan demon talk
39,--,DESCONOCIDO,DESCONOCIDO,,2h,Bound and Beautiful Married Woman Wet Rope Lust
40,--,DESCONOCIDO,DESCONOCIDO,,--,Werewolf Fatal
41,--,DESCONOCIDO,DESCONOCIDO,,2h 31m,First Impression 130 Junmai: Birth of A Beautiful Pure Pretty Girl
42,--,['Anand .D. Ghatraaj'],DESCONOCIDO,,2h 42m,Shahenshah
43,2.7,['Om Prakash Rao'],DESCONOCIDO,A son's over-compulsive adoration towards his mother causes trouble for both of them.,2h 8m,Huccha 2
44,8.4,['Nobuhiro Suzumura'],DESCONOCIDO,Kuroto Dan has obtained the God Maximum Mighty X and the world falls into the chaos. Kiriya has found the key to face the power that not even Muteki can overcome and ready to face him.,1h,Kamen Rider Ex-Aid Trilogy: Another Ending - Kamen Rider Genm vs. Lazer
45,--,DESCONOCIDO,DESCONOCIDO,DESCONOCIDO,--,Error nombre para la pelicula con id: tt11243080
46,7.9,['Nobuhiro Suzumura'],DESCONOCIDO,A new training game has created for the recovery treatment of people because of bugsters. The test is ran on Parado and Poppy. But there is something different about Parado as another Parado is appeared with the strong bond with Emu.,--,Kamen Rider Ex-Aid Trilogy: Another Ending - Kamen Rider Para-DX with Poppy
47,7.1,['Near Human Intelligence'],DESCONOCIDO,This movie shows the tragic events of what happens after Club Penguin shuts down.,1h 30m,Club Penguin Shutdown: The Movie
48,8.0,DESCONOCIDO,DESCONOCIDO,"Follows a mysterious Amazon hunter named Jin Takayama, the heavily-sheltered Haruka Mizusawa, and the Nozama Pest Control Service, a small group of mercenaries as they hunt down the awakening Amazons.",1h 39m,Kamen Rider Amazons: Awakening
49,7.9,DESCONOCIDO,DESCONOCIDO,"The existence of the Amazons has become public knowledge. A new government organization tasked with hunting down the Amazons. However, the Amazon Cells have mutated and capable of infecting humans and transforming victims into monsters.",1h 39m,Kamen Rider Amazons: Reincarnation
50,4.6,['Tuyen Quang Nguyen'],DESCONOCIDO,"Hai Black, the owner of Vung Tau Dog Race Track, as well as a lender and betting organization, kidnapped Hoa when she and her husband went to watch dog racing. He insisted that Hoa had colluded with Tuan Dog, the former owner of the racetrack, to steal money and a very important object from his safe. After his attempts to use torture to get a confession, Hai Black rap... Read all",1h 32m,Cam Bay - Hoi Tho Cua Quy
51,--,DESCONOCIDO,DESCONOCIDO,,1h 30m,Tottenham Hotspur Football Club vs Wolverhampton Wanderers F.C.
52,--,DESCONOCIDO,DESCONOCIDO,,1h 30m,Huddersfield Town A.F.C. vs Tottenham Hotspur Football Club
53,--,DESCONOCIDO,DESCONOCIDO,,1h 30m,Tottenham Hotspur Football Club vs Fulham F.C.
54,--,DESCONOCIDO,DESCONOCIDO,,1h 30m,Tottenham Hotspur Football Club vs Burnley Football Club
55,--,DESCONOCIDO,DESCONOCIDO,,1h 30m,Tottenham Hotspur Football Club vs Huddersfield Town A.F.C.
56,--,DESCONOCIDO,DESCONOCIDO,,1h 30m,Chelsea Football Club vs Tottenham Hotspur Football Club
57,--,['Edward Tracey'],DESCONOCIDO,Jack Wilson has returned with the help of the Siren to take down Christopher Chance and his team.,--,The Emerald Archer
58,6.3,['Eli Roth'],"['Joe Carnahan', 'Brian Garfield', 'Wendell Mayes']","Dr. Paul Kersey is an experienced trauma surgeon, a man who has spent his life saving lives. After an attack on his family, Paul embarks on his own mission for justice.",1h 47m,Death Wish
59,--,['Bryan Leung'],DESCONOCIDO,"The conflict between the Yin-Yang Devil Cult and the Hong Sect has been lasting for 500 years. Qigong is the 18th chief of the Hong Sect. One day, with the help of his disciples Rong and Jing, he finally captures and executes Mr. Dongfang, the leader of the Yin-Yang Devil Cult. Just as everyone thinks the case has come to an end, one of Hong Sect's disciples reports t... Read all",1h 4m,Conquering the Demons of Master
60,--,DESCONOCIDO,"['Jing Li', 'Man Shan', 'Zhu Xiao']","Zhong Kui, an orphan who has determined to become an exorcist since he was young, calls himself ""the exorcist master"". He forms an exorcist team with the fish-like person Xiaoyu and the silly ginseng elf Huanxi. They make a living by playing tricks to people. When the three come to Luo City and plan to cheat the local people for money as they usually do, they are surp... Read all",1h 3m,Demons Hunter - ZhongKui: Nightmare
61,--,['Zheng Liu'],DESCONOCIDO,A diary was found in the coffin of his great-grandpa Jin Maocai when the professional treasure hunter Jin San moved his ancestral grave. The diary recorded that the authentic manuscript of Su Dongpo's famous poem was buried in a Japanese underground fortification in Mongolian during the Counter-Japanese War. Jin San formed a treasure-hunting team to carry out treasure... Read all,1h 27m,Tomb Guardians II: The Sea of Death
62,--,['Elijah Butler'],DESCONOCIDO,"Sonic and friends team up with a couple agents to save Amy Rose, find the 7 chaos emeralds and save the world from Dr. Eggman and his plan on world domination.",2h 2m,Speed: A Sonic the Hedgehog Movie
63,--,['Balbir Begampuri'],DESCONOCIDO,,--,Delhi to Lahore
64,4.2,DESCONOCIDO,DESCONOCIDO,"Well, Luke Skywalker is still drinking discolored milk - not much has changed in the 'Star Wars' universe. The guys at RiffTrax may not be consuming strange liquids, but they are poking fun in this comedic audio track.",--,RiffTrax: Star Wars: The Last Jedi
65,6.4,['Yulong Guo'],"['Xinyu Chou', 'Shuang Zhong']","In A.D. 684, The Headless General, A giant killing party at the imperial palace of the Great Reich. One day ahead of the grand coronation of the first empress WU in Chinese history, a giant ""headless general"" appears and kills inside the royal tomb.The Empress WU request a genius detective Dee to start investigating the case.",1h 27m,Di Renjie: The Headless General
66,5.8,['Sonam Dorji Casper'],DESCONOCIDO,,--,Singye
67,6.4,['Yulong Guo'],"['Xinyu Chou', 'Shuang Zhong']","In A.D. 684, The Headless General, A giant killing party at the imperial palace of the Great Reich. One day ahead of the grand coronation of the first empress WU in Chinese history, a giant ""headless general"" appears and kills inside the royal tomb.The Empress WU request a genius detective Dee to start investigating the case.",1h 27m,Di Renjie: The Headless General
68,5.1,['Zhang Zhu Lin'],DESCONOCIDO,Ge Zhen joins a killer organization the 12 troops. Justice and evil coexist and the entanglement between loyalty and betrayal come one after another.,1h 13m,The Mystical Treasure
69,5.6,['Hongzhi Liu'],DESCONOCIDO,Masters of different martial arts styles start to disappear or are killed mysteriously.,1h 23m,Monkey King Reincarnation
70,5.9,['Dai Wei'],DESCONOCIDO,"20 years after the Revolution of 1911, Huo Zhenshan opens a school to promote Chinese martial arts. But a new challenge in the black market emerges.",1h 39m,Shocking Kung Fu of Huo's
71,--,['Nadim Mehanna'],DESCONOCIDO,"Issam is a mysterious grotto-man living in the wilderness, over viewing a rural village with a lot of happenings - For more than twenty years, they call him ""the thief of food"" as he steals nothing but something to eat, no one dares to confront him, he looks scary with his thick beard but ""the Gost"" is also friendly and loving, while he rescues inhabitants from all ki... Read all",--,Meenak Enta
72,--,['Timothy Paul Taylor'],"['Teresa D. Lee', 'Timothy Paul Taylor']",,--,Ad Meliora: Dentro e Fora
73,8.0,['Chuanlin Sun'],DESCONOCIDO,"After an official of Youzhou province was attacked, both imperial court and folk force are involved in following actions.",1h 32m,The Heshuo Misty Clouds
74,--,['Foday Sillah'],DESCONOCIDO,They grew up together until life tore them apart. Years later one is making money but from a gangster lifestyle and the other struggles on the streets. Fate brings them back together but at what cost?,1h 8m,The Choice
75,5.5,['Gabriel Leung'],DESCONOCIDO,A group of strangers find themselves trapped on an island during a storm. The situation becomes even worse when it transpires that the island is home to hordes of the undead and only by working together can they find a way off the island. This goofy action movie borrows liberally from Romero and Giallo and delivers with a unique Chinese twist.,1h 16m,Zombie Island
76,--,['Iván Valentín'],"['Óscar Gómez Bolívar', 'Iván Valentín']",,--,El camino de Ares
77,--,DESCONOCIDO,DESCONOCIDO,,--,El camino de ares
78,--,['Alexis Fusario'],DESCONOCIDO,"In the year 2077, the nefarious world government Entercelt is planning to go back in time and squash every popular movement and revolution in history. A band of time-travelling rebels (and a few historical figures) will try to stop them.",2h 33m,"Mnémora: Pueblo, Poder y Tiempo"
79,7.5,['Tsutomu Mizushima'],DESCONOCIDO,,2h 2m,Girls und Panzer Compilation Movie
80,6.0,['Sourabh Bali'],DESCONOCIDO,"In a small Haryanvi village, five brothers trade in death and fear. When they kill one of their debtors and abduct his daughter Panchaali, she lures each of the five brothers to herself, laying out their death-trap.",--,Panchaali
81,--,['Ben Li'],"['Ruofei Du', 'Xinhua Gu', 'Binbin Tang']","Qiao Fan can't control her power. After she is attacked by an unknown assassin, she is forced to avenge her father. She transforms into a ""red clad woman"". Faced with a more mysterious evil force, Qiao Fan is about to challenge an incredible journey of revenge.",1h 6m,San liu nu xia
82,--,['Alan Smithee'],DESCONOCIDO,"Ezahar is a lecturer, happily married to his wife Sherina. He starts experiencing emotional disturbances after witnessing his wife's death due to a building collapse that was caused by a terrorist group called Kalla. But he then receives news from an unidentified individual that Sherina is still alive and the terrorist group is looking for her. He begins to search for... Read all",1h 40m,Kalla: Hidup Atau Mati
83,7.0,['Christian Gudegast'],DESCONOCIDO,An elite unit of the LA County Sheriff's Dept. and the state's most successful bank robbery crew clash as the outlaws plan a seemingly impossible heist on the Federal Reserve Bank.,2h 20m,Den of Thieves
84,--,DESCONOCIDO,DESCONOCIDO,,--,Real Betis vs AC Milan
85,--,DESCONOCIDO,DESCONOCIDO,,--,Laliga 10. Matchday Getafe CF vs Real Betis Balompié
86,--,['Darby Kern'],DESCONOCIDO,"Security specialist and adventurer, Jake Muller discovers a young girl who has apparently fallen from the sky. Suddenly he's crossing paths with the military, politicians, theologians, Men In Black and, possibly, extra-terrestrials.",1h 38m,Jake Muller Adventures
87,--,['Manoj Fogat'],DESCONOCIDO,Film based on a triangle love story between Digvijay Suman and soniya. Diggi and soniya belongs to rich powerfull familes and there parents wants them to marry each other and soniya also in love with diggi. But diggi is in love with his collage mate Suman who belongs to a middle class family. Pratap(diggi's father) and Damodar(soniya's father) involved in some crimina... Read all,2h,Sanam tera ishaq
88,--,['Russell Lloyd'],"['Russell Lloyd', 'Peter D. Poulsen']","A research scientist discovers there may be a massive government conspiracy with the Chinese government to train the American public through all digital media. The technology portrayed in this photoplay is real. Actual attempts have been made by scientific contractors to warn intelligence agencies, but were dismissed. It is still unknown as to the degree by which the ... Read all",1h 29m,ACID (II)
89,--,['Jordi O. Romero'],DESCONOCIDO,,1h 35m,The Waiter (EL camarero)
90,--,DESCONOCIDO,DESCONOCIDO,,--,CD Leganés vs Real Sociedad
91,--,DESCONOCIDO,DESCONOCIDO,,--,CD Leganés vs UD Las Palmas
92,--,DESCONOCIDO,DESCONOCIDO,,--,CD Leganés vs Deportivo Alavés
93,--,DESCONOCIDO,DESCONOCIDO,,--,CD Leganés vs RCD Espanyol Barcelona
94,--,DESCONOCIDO,DESCONOCIDO,,--,CD Leganés vs SD Eibar
95,--,DESCONOCIDO,DESCONOCIDO,,--,CD Leganés vs Celta de Vigo
96,--,DESCONOCIDO,DESCONOCIDO,,--,Real Betis Balompié vs Real Sociedad
97,--,DESCONOCIDO,DESCONOCIDO,,--,Group F: Olympiacos FC - Real Betis
98,--,DESCONOCIDO,DESCONOCIDO,,--,Racing Santander vs Real Betis Balompié
99,--,DESCONOCIDO,DESCONOCIDO,,--,CD Leganés vs Deportivo de La Coruna
100,--,DESCONOCIDO,DESCONOCIDO,,--,RCD Espanyol Barcelona vs Real Betis Balompié
101,--,DESCONOCIDO,DESCONOCIDO,,--,SD Eibar vs CD Leganés
102,--,DESCONOCIDO,DESCONOCIDO,,--,CD Leganés vs Rayo Vallecano
103,--,DESCONOCIDO,DESCONOCIDO,,--,CD Leganés vs Atlético Madrid
104,6.6,['Ruben Fleischer'],DESCONOCIDO,"A failed reporter is bonded to an alien entity, one of many symbiotes who have invaded Earth. But the being takes a liking to Earth and decides to protect it.",1h 52m,Venom
105,--,['Samal Sachidananda'],DESCONOCIDO,,2h 20m,Manara Manasi
106,--,DESCONOCIDO,DESCONOCIDO,DESCONOCIDO,--,Error nombre para la pelicula con id: tt12746140
107,--,DESCONOCIDO,DESCONOCIDO,DESCONOCIDO,--,Error nombre para la pelicula con id: tt12745708
108,5.4,['Bo Zhang'],DESCONOCIDO,A secret military intelligence organization must ward off a rebellion orchestrated by the Ministry of War.,--,Assassins of Brotherhood
109,7.9,['Shaobo Tian'],DESCONOCIDO,,--,The Tigers of Guangdong
110,--,['Yamin Messika'],"['Yarmi Kadoshi', 'Yamin Messika', 'Eli Tavor']","Yu-Ya, a fighter in an elite unit, wants to marry. A problem arises in the rabbinate: his father is not registered on his identity card and therefore Yu-Ya cannot marry. With the help of his army commander, he sets out on a search for his parents' roots and identity.",1h 14m,The Onkelos Case
111,5.1,['Raj Madiraju'],DESCONOCIDO,"The story follows the lives of four unemployed engineers who turn criminals to avenge an anonymous, yet dangerous cybercriminal.",2h 5m,Aithe 2.0
112,5.5,['Brian Henson'],DESCONOCIDO,"When the puppet cast of a '90s children's TV show begin to get murdered one by one, a disgraced LAPD detective-turned-private eye puppet takes on the case.",1h 31m,The Happytime Murders
113,--,['Shûji Kataoka'],DESCONOCIDO,,--,Hasha no okite daiissho
114,--,['Sébastien Gilles'],DESCONOCIDO,"In U.S. police officers kill nearly 1000 people a year, every year. What happened that rate is so high and is it going worse or better across decades.",--,USA: Fear the Police
115,--,['Chris Ryô Kaihara'],DESCONOCIDO,,--,Kumicho e no michi ~ okami no gyakushu ~
116,--,['Mahdi Khorramdel'],DESCONOCIDO,"The events taking place on Yemen's soil resembles a war, but in reality it is a long continuous battle being carried on for three years. It is as though the battlefield of this bloody encounter has not experienced dusk or a dawn as of late.",--,Yemen: A Dubious Battle
117,4.6,['Donny Armstrong'],DESCONOCIDO,"Five.K.One, two best friends has to chose between life in the streets and loyalty when they are indicted with the help of an informant that causes everyone to be a suspect to the Boss.",1h 48m,5K1
118,--,DESCONOCIDO,DESCONOCIDO,DESCONOCIDO,--,Error nombre para la pelicula con id: tt1329350
119,--,['V. Ravi Chandran'],DESCONOCIDO,,--,Good Bye
120,7.7,DESCONOCIDO,DESCONOCIDO,,1h 29m,Peerless Hero
121,--,DESCONOCIDO,DESCONOCIDO,"Hanz's family is deep in debt due to his father's gambling issue and in order to pay up to the moneylenders, the teenager is forced to quit his dancing group so he can take on a few jobs. However, his friends keep asking him to return to the group and Hanz will have to make a choice between money and dream.",1h 58m,Who is the Champion?
122,--,['Halil Ibrahim Aydin'],DESCONOCIDO,A young man who goes after his dream receives a paper that is not clear where it came from.,--,Yaprak
123,5.4,['P.N. Sathya'],DESCONOCIDO,"Tiger is an orphan who lives in an abandoned train compartment near the Bengaluru Railway Station. He makes his living by taking on contract jobs for money and shows no loyalty, except to money. What happens when a girl named Ganga enters his life and seems like a ray hope?",2h 10m,Mari Tiger
124,6.4,DESCONOCIDO,"['Teo García', 'Genaro Rodriguez']",,--,Mal día para fumar
125,--,DESCONOCIDO,DESCONOCIDO,,1h 34m,Valencia vs Barcelona
126,--,['Prince McNonwuun'],DESCONOCIDO,,--,Temperamental II
127,6.6,['Jackson Gutierrez'],DESCONOCIDO,,--,El Hijo del Presidente
128,--,DESCONOCIDO,DESCONOCIDO,,--,Paris Saint-Germain vs Real Madrid
129,--,DESCONOCIDO,DESCONOCIDO,,--,Business Trip Massage to Stimulate Erogenous Sensation
130,--,['Xu Jiang Hua'],DESCONOCIDO,,--,Princess the Secret Service Part 2
131,8.1,['Xu Jiang Hua'],DESCONOCIDO,,--,Princess the Secret Service Part 3
132,--,['Robert Vrba'],DESCONOCIDO,,--,Vaginator: Dawn of the Bitches
133,--,DESCONOCIDO,DESCONOCIDO,,--,Dalian Yifang vs Guangzhou Evergrande
134,6.3,['Roar Uthaug'],DESCONOCIDO,"Lara Croft, the fiercely independent daughter of a missing adventurer, must push herself beyond her limits when she discovers the island where her father, Lord Richard Croft disappeared.",1h 59m,Tomb Raider
