288,--,['Jonathan Jennings'],['Jonathan Jennings'],"An 18-year-old, Jonathan, is learning how to deal with pent-up anger. The anger is so strong that it forms into a psychophysical being called Vex who shows up every time Jonathan gets angry. Jonathan eventually learns how to face his anger and comes to a very odd realization about Vex.",--,The Vex
289,--,['Rajab Mahmood'],['Rajab Mahmood'],,--,Jadoo
290,--,['Michael Hofmann'],['Michael Hofmann'],Estuas explores a parallel world of artificial intelligence and generative transmissions of life from estuarine ecosystems as a metaphor for synthesis. Live satellite signals are recomposed from space broadcasts to structure a soundscape eclipsed by silence. The satellite remapping of image details collides with multidimensional formed creatures allowing convergence t... Read all,--,Estuas
291,--,['Martigan'],"['Wes Imlay', 'Martigan']",,--,The Aries Incident
292,--,['Christopher Vaughan'],"['R. Bradley Morris', 'Natali Jones']","Years later, Jane is finally able to seek revenge on her parents murder.",--,The Ballad of Jane
293,--,['Carl Rhonin'],['Carl Rhonin'],,--,"A Can of Beans, Glowstick"
294,--,DESCONOCIDO,DESCONOCIDO,DESCONOCIDO,--,Error nombre para la pelicula con id: tt19863094
295,--,['Bailey Smith-Ogg'],['Mark Simmons'],,--,The Hit
296,--,DESCONOCIDO,DESCONOCIDO,"A captured wisecracking secret operative fights for the strength to live after a failed op ends in disaster, with only one way out.",--,Gone Gray
297,--,['Jason Ho'],"['Jason Ho', 'Kyleen Likas']",,--,The Dusty Dame
298,6.7,['Ryuta Tasaki'],['Toshiki Inoue'],,--,Avataro Sentai Donbrothers the Movie: New First Love Hero
299,--,['Rudy Hernandez Jr.'],['Rudy Hernandez Jr.'],MichaelAppleHead's First Roblox Film,--,Open the Dragon: A ROBLOX movie
300,--,DESCONOCIDO,['Jing Wong'],,--,Ke zhan
301,--,['Sam Gale'],['Sam Gale'],A British spy has a mission to obtain a powerful object before it's too late.,--,The Protagonist
302,--,['Jukka Vidgren'],DESCONOCIDO,Story of a young boy who summons his inner superhero Black Peider to help him win over his father and grandfather.,--,Black Peider
303,--,['Brandon Richard Hobson'],['Brandon Richard Hobson'],"When Charlie, a small town chef, is mistaken for someone else, he must become the ultimate action hero and fight for survival.",--,Culinary Tension
304,--,['Jon Enge'],['Jon Enge'],,--,Kit's Revenge
305,--,['Preston Pimentel'],['Preston Pimentel'],Two best friends have a not-so traditional tradition. Whenever they see each other the first thing they do is punch the other in the face.,--,Tradition
306,--,['Kaan Karaman'],['Ali Kilicci'],The two aliens who met on the Ferris wheel fell in love at first sight. The Toretto brothers try to prevent this love as they see it as dangerous.,--,Aliens in Love
307,--,['Carson Malone'],['Carson Malone'],"A cold case breathes new life when a son, hungry for revenge, hunts his father's killer and stops at nothing to track him down.",--,All Units Be Advised
308,--,['Jay Notley'],DESCONOCIDO,,--,Hunter Becomes Hunted 2
309,--,DESCONOCIDO,"['Malini Tolat', 'Cailin Wade']",,--,The Front Door
310,--,['Brandon Brown'],['Brandon Brown'],,--,Duel
311,--,['Laura Ashley Polisena'],['Laura Ashley Polisena'],,--,Electric Shock
312,--,['Jacob Godsend'],['Jacob Godsend'],"After leaving his criminal past behind, Levi comes back after 5 years to help his half brother Sean complete one more job.",--,Remnant
313,--,['Rafael Porto Hill'],['Rafael Porto Hill'],,--,Maca
314,--,['Dennis Donovan'],['Ned Ide'],"Rumors of War is the remarkable true story about the conflict in 1675 between colonists and indigenous people of New England. Violence, betrayal, and heartbreak combine to fuel a war for land. Fifty-five years after the Mayflower and exactly one-hundred years before the American Revolution, the people of New England face a moment of reckoning that will alter the cours... Read all",--,Rumors of War
315,--,['Xan Gilmour'],['Xan Gilmour'],"Player has no stable identity; he acts accordingly to various 'Profiles' in a fruitless search for social acceptance - until Aaron, a drug dealer, sends him spiraling out of control.",--,Player Profile
316,--,['Andrew Chi Nguyen'],['Andrew Chi Nguyen'],Hardened Hector makes a routine DoorDash delivery.,--,Hardened Hector
317,--,['Rodolfo Ledesma'],DESCONOCIDO,,--,La Traicion
318,--,['Nicholas Schrunk'],['Dan Carr'],"In ""Race to Miami,"" Oracle Red Bull Racing Driver Sergio ""Checo"" Perez's own excitement about the race (along with a little Manhattan street noise) causes a miscommunication between him and Team Principal and CEO Christian Horner, sending Checo on a mission to rush from New York to Miami the same day.",--,Race to Miami: F1 Road Trip USA
319,--,DESCONOCIDO,['Kenneth Forrester'],"Man meets woman. Man falls in love with the woman. Both have provocative fantasies, both wish to use the other. Falling in love can lead to happiness. This love can only lead to violence.",--,Rock Island Woman
320,--,['Levi Dennis'],['Levi Dennis'],,--,Tech Fall
321,--,['Einar Bjarnason'],['Einar Bjarnason'],After the events of the last movie they must go and fight the creature to survive.,--,The Final Confrontation
322,--,['Ian Zelenka'],"['Joseph I Morales', 'Joy Reiss', 'Ian Zelenka']",,--,Brainstorm
323,--,['Steve Whelan'],['Steve Whelan'],,--,The Hunt
324,--,['Pim Vogels'],['Pim Vogels'],Superfan Zoë will do anything in her power to get a hold of a ticket to her favorite artist.,--,A ticket to trouble
325,--,['Orion Barnes'],['Lauren N Crow'],,--,Shadowblades
326,--,['Armando Salomo'],"['Armando Salomo', 'Victor Camacho Tejeda']","Three curious students go to a neighborhood to buy drugs, before finishing their task, a police operation forces them to escape with the vendors through a labyrinth of houses and streets to try to save themselves.",--,Cola de rata
327,--,['Binyamin Mijares'],['Binyamin Mijares'],A crazy highway full of crazy cars.,--,Crazy Highway
328,--,['Jesse van Olderen'],"['Roshaan Mirnia', 'Jesse van Olderen']","Barry and Gerson save Ronald Bump (The 69th president of The Urinated Stonks Of America) from a plane crash so Bump invites them over to the White House. While they're there a monster appears and Barry, Gerson and Bump have to fight it.",--,The Mission
329,--,['Diego Sandez'],['Diego Sandez'],Rubén and Arturo sit in their car talking about the corruption and violence around them.,--,Acts of Reminiscence
330,--,['Divine Sohwo'],['Divine Sohwo'],This are group of friends who went in the jungle for treasures but we're captured by monsters,--,Dern of Africa jungle
331,--,['Owen Lezemore'],['Owen Lezemore'],,--,The Assassins Creed and the Watch Dogs
332,--,['Sammie Hottel'],"['Sammie Hottel', 'Gabriel Urbano']",A thief-for-hire takes on a dangerous mission.,--,Longer than Night
333,--,['Paris Nicole'],['Paris Nicole'],,--,Surroundings
334,--,['Kelan Reicher'],['Kelan Reicher'],"Two kids are walking down the street and they see a penny. Ian, a penny collector spots it and wants it to himself. Langdon, just a random kid wants it to spend on something not noticing the rarity of the penny. That's how it begins...",--,The Fight for the Penny
335,--,['Alix Yumi Cho'],['Bolor Saruul'],"When two Asian co-workers, Bobby and Kristin, involved with the inadvertent theft of money, they must decide between upholding the model minority stereotype by turning themselves in or using the public's perception to their advantage.",--,Asian Drivers
336,--,['Dashiell Jones'],['Dashiell Jones'],,--,Elemental Differences
337,--,['Dashiell Jones'],['Dashiell Jones'],,--,Return to Olympus
338,--,['Dashiell Jones'],['Dashiell Jones'],,--,No Two Masters
339,--,['Dashiell Jones'],['Dashiell Jones'],,--,The Portal Home
340,--,['Dashiell Jones'],['Dashiell Jones'],,--,The Turn
341,--,DESCONOCIDO,"['Celeste Blandon', 'Jake Kopronica']","It's Halloween night, and Jack O' Chan has a plan. To attend his friend Peter's costume party and ask out Lily, the girl of his dreams. Except. When he arrives, another guy named Chad has already beat him to the punch. So now, it's up to Jack O' Chan to win her heart, before it's too late.",--,Jack O' Chan in Halloween Fight Night!
342,8.5,['B.Srinivas'],['B.Srinivas'],"Daughter(Bhavana) got killed in a kidnap, Hero hunts down the people who are beyond this kidnap and murder of his daughter is the plot of the film.",--,Bhavana
343,--,['Michael Stirling'],['Michael Stirling'],An intern at a large company is called into the boss' office and given a special assignment.,--,The Briefcase
344,--,['Braedan Hall'],DESCONOCIDO,"Two nineteen-year-old best friends, Chris and Kevin, are trying to get to their weekly tradition of seeing The Kissy Fish cover band playing at a local dive when they get a flat tire. Once they arrive to buy a spare, they must learn the power of friendship and loyalty when chaos ensues.",--,Grit
345,--,"[""Darren O'Mahony""]",DESCONOCIDO,"It's 885 AD and the kingdoms of Francia have been united for the first time in a century. Charles the Fat, great-grandson of Charlemagne currently wages a slow war against the Viking settlers in Francia. If he is not stopped, soon he will turn his eyes to England. Legendary Viking clan chief Eivor Varrinsdottir has been sent for in the hopes she can help the settlers ... Read all",--,Siege of Paris
346,--,['Luis Morales'],"['Alex Lance Gonzalez', 'Luis Morales', 'Luis Morales']","Henry, wants to escape a life of crime, but is confronted by his past.",--,Fire & Blood
347,--,['Dillon Sefah'],['Dillon Sefah'],A young lady is driven by revenge to enter a dangerous tournament.,--,Small Hours of the Night
348,--,['Jessica Balzano'],['Jessica Balzano'],Leah lives alone with her mother due to her father having left to fulfill his dream as a police officer. Leah has no other choice but to turn to the criminal side of society to provide money for what's left of her family.,--,Det rätta valet
349,--,['Dylan McKay'],['Dylan McKay'],In this icy adventure Bond makes his way to the Swiss Alps to face off against one of Spectre's most cunning agents.,--,Death Over Light Ice
350,--,['Scutelnicu Andrei'],['Andrei Scutelnicu'],"After the events of Supravietuitorul I I, Max Wayl discovers that the earth is about to collide with the moon",--,Supravietuitorul III
351,--,['Rae Lloyd'],['Rae Lloyd'],"Following directly after the first film, it shows the continuation of the fight against the evil Scroo-plop",--,Stupidity 2
352,--,['Johnny Lozano'],['Johnny Lozano'],,--,Duke
353,--,['Sigit Pradityo'],['Sigit Pradityo'],"Unelected official corrupt makes a transaction to get a position in the government with a ""Jenglot Mustika"". In the middle of transaction the unfortunate event happened and changed him into Titan. Only one man can stop him. LORD RANGGA.",--,Juragan Jenglot Dari Rawa Belorong
354,6.2,['Amin Rostami'],['Amin Rostami'],"Following the theft of a bag, a murderer goes after the thieves But at the end all guys will be dead Following the theft of a bag, a murderer goes after the thieves But at the end all guys will be dead Following the theft of a bag, a murderer goes after the thieves But at the end all guys will be dead Following the theft of a bag, a murderer goes after the thieves But... Read all",--,Chaser
355,--,['Ryan Piotrowski'],['Ryan Piotrowski'],A father must try and outrun his daughter if he wants to survive Elterntag.,--,Elterntag
356,6.9,['Aniket Harer'],"['Aniket Harer', 'Vaibhavi Joshi']",Level- A story of a girl struggling to reach somewhere. She's running while facing the obstacles with force. Her enemies wait for her on every level and beat the hell out of her. But she's determined to achieve each level of difficulty by hook or by crook. But what happens at the final level of her struggle? Watch the film to know more.,--,Level an Action
357,9.6,DESCONOCIDO,"['Tadas Mickus', 'Paulius Orlovskis']","In the late 90s, a well-organized gang called the Red Zombies gathered in the Baron's Village. Their arrogance and extravagance shocked the Lithuanian officials who saw it all. A high-ranking detective Kestutis Klemas who has been tainted in the past, has been appointed to control the gang. After a grueling shootout with gang members, Kestutis Klemas is in resuscitati... Read all",--,Red Zombies
358,10.0,['Kyle Marzullo'],['Brandon Boothe'],"After learning that Thomas Mileston and his business partner Lev Kolshenko have gotten hold of the world's most dangerous pencil, former secret agent David Anderson decides he must return for one more mission.",--,Pencil 3: Left for Lead
359,8.4,['Jack Vickers'],"['George Grozier', 'Jack Vickers']","After joining the Student ID department, Gray Cade is sent on his first job to steal the ID of the student Logan Myers. With his boss watching closely. One mistake can be catastrophic to Grays future.",--,Virgin Wars (2022 Remake)
360,--,['Jac Brown'],['Jac Brown'],,--,My Name is JIMBO
361,--,['Marquis Goodman'],['Marquis Goodman'],"When crime returns to the city, It's up to Bat-Bear and Robin to save the day. Meanwhile, a new dynamic duo begins to develop their roles as heroes.",--,The Bear Knight Returns
362,--,['Fran Campos'],['Fran Campos'],"Screenplay by Fran Campos based on the characters from ""Streets of Rage"" property of SEGA",--,Rage
363,--,['Kayla Kelsall'],['Frank Minjarez'],Ben discovers that an AI he and Allison created is being used for something unexpected. He tries to convince Allison to help him investigate.,--,The Data Scientist
364,--,DESCONOCIDO,DESCONOCIDO,DESCONOCIDO,--,Error nombre para la pelicula con id: tt20723840
365,--,['Brandon James Falconer'],['Brandon James Falconer'],"Grim times have fallen onto the Ghostbuster franchises - most have gone out of business due to a lack of paranormal activity. Now, The Ghostbuster spends his days waiting for something to happen again - until one day his wish is granted.",--,The Ghostbuster Pt. 2
366,--,['Zack Hankins'],"['Alex Hankins', 'Zack Hankins', 'Mya Richter']",,--,The Fallen Cadet
367,--,['Zack Hankins'],"['Alex Hankins', 'Zack Hankins', 'Mya Richter']",,--,The Fallen Cadet
368,--,DESCONOCIDO,DESCONOCIDO,DESCONOCIDO,--,Error nombre para la pelicula con id: tt20756624
369,6.4,['James C. Williamson'],['James C. Williamson'],"The sole survivor of a crashed ship, Cass awakens in a hostile alternate version of Earth. Devoid of any memory, her only clue is a mysterious device she carries with her that is continuously counting down towards an unknown climax.",--,Exo Sapien
370,--,['Mouhamed Dione'],['Mouhamed Dione'],,--,Gawlo
371,--,['Omar De Leon'],DESCONOCIDO,"Marvyn's fascination with chaos and reveling in infinite bliss has stirred up issues, forcing the delirious teen to race home with a duffel bag full of cash and cops on his trail. Epilepsy Warning.",--,Rich Insanity
372,--,['Connor McFarlane'],"['Joseph Banks', 'Connor McFarlane']",,--,Terror at Belgrave Terrace
373,9.2,DESCONOCIDO,"['Johnny Laing', 'James Szymkow-McKenney']",Baltimore Bomb follows the life of a grizzled and aging Baltimore vigilante.,--,Baltimore Bomb
374,--,['Arthur Gallery'],['Arthur Gallery'],"A young low-life woman, haunted by anxiety, embarks on a dangerous interview for an infamous corporation in order to turn her life around and make her esteemed father proud.",--,Genesis X
375,--,['Benjamin Porter'],"['Conor Barrow', 'Christopher Boyle', 'Benjamin Porter']",,--,Cold-Hearted Cunts
376,--,['Garry Owens'],"['Aidan M', 'Colton B', 'Garry Owens']","With the ever looming threat of KHH, the team assembles to take it down. The team launches an unprecedented assault to catch the occupants off guard. With unspeakable acts having been committed, the team walks away with the satisfaction of the mission being completed. However, an after action report seems to suggest that some inside may have survived the initial onsla... Read all",--,TopGob
377,--,DESCONOCIDO,DESCONOCIDO,DESCONOCIDO,--,Error nombre para la pelicula con id: tt20860712
378,--,['Hadi Ismail'],['Hadi Ismail'],"Baalbeck, 2030, the economic and industrial heart of the Middle East, was invaded by UFOs. Highways were clogged with flying objects, military bases were attacked and destroyed, and cities were besieged. When aliens landed, they were met by the Baalbeck Defense Corps. The aliens aims at the historical roman castle.",--,The Resilience of Baalbek
379,8.7,['Jack Vickers'],"['Josh Foxon', ""Adam O'Neill Gibbins"", 'Jack Vickers']","For their last college project, 4 Students are tasked at making a short film.",--,Despondency
380,--,DESCONOCIDO,"['Benjamin Soto', 'Cristóbal de Alba']","What is the nature of a true freerider? Abraham Hochstrasser, one of the greatest exponents of jetski freeride in the world, will face himself by imposing the biggest challenge of his career: jumping from a 15-meter waterfall on a jetski. Guided by the flow of the water, he will take us beyond the last frontier of freeriding and teach us what it means to be a true fre... Read all",--,Cascada
381,--,['Tony Laudati'],['Tony Laudati'],"A recreation of the classic sword fight from 1940's ""The Mark of Zorro"" starring Tyrone Power and Basil Rathbone.",--,Mark of Zorro Sword Fight
382,--,['Puranjay Saini'],['Puranjay Saini'],A unique hard drive is stolen. A guard is sent to get it back.,--,R34LIFE
383,--,['Ilya Nazarov'],"['Ilya Nazarov', 'Lev Orlov']","Continuation of the story about three friends who went through explosions, murders and injuries. However, Ilya finds out who wants to kill him and decides to strike back, deciding to end everything.",--,Pigeons attack 3
384,--,['Aristote Boyo'],DESCONOCIDO,There is conflict between two skilled combative men (my character and another guy). I was supposed to fight him on Saturday but on Friday he is going to take his girlfriend out as it's her birthday. I chose to fight him on Friday instead.,--,Vendetta on Her Birthday
385,--,['Berk Koca'],['Berk Koca'],A deep-state assassin hunts down members of an alien cult that holds the keys to the future.,--,The Qryterion
386,--,['Yasmine Lawler'],"['James Holla Holland', 'Valentino Jefferson']",,--,Wanted
387,--,['Ethan Averton'],['Ethan Averton'],"Stuck in the Middle East during a time of incredible uncertainty, we follow a young refugee who has lost his family, his home, and nearly his life. Tested by extreme circumstance, he must survive the harsh wilderness of the Arabah, and learn how to persevere when everything around him threatens his existence. The Exile Road is a story of honour, courage, strength and ... Read all",--,The Exile Road
388,--,DESCONOCIDO,['Saskia Lynge'],"Four assassins are on the trail of Ms. Morgan. Bold and daring, Ms. Morgan goes off the grid to a remote bed and breakfast, to assess her situation. Will the four assassins find her before she finds them? After all, Ms. Morgan is an assassin, too. And going off the grid is just another way for her to hunt those who would hunt her.",--,The Fourth Assassin
389,7.7,['Victoria Vincent'],['Victoria Vincent'],"A cat named Penny living in a desensitized, unstable world has to find a new job after she gets fired in order to make her dad proud.",--,Catopolis
390,--,['Ricardo Bogliotti'],['Ricardo Bogliotti'],,--,Enfrentando el mal Parte 3. Fin de un comienzo
391,--,['Ricardo Bogliotti'],['Ricardo Bogliotti'],,--,Enfrentando el mal Parte 2. El Pasado es Futuro
392,--,['Ricardo Bogliotti'],['Ricardo Bogliotti'],,--,Enfrentando el mal Parte 1. Transformando una mejor versión
393,--,['Brad J Watts'],['Brad J Watts'],"When victims from a human trafficking ring are found dead in Druthers, a group of freedom fighters seek to deliver a message to get the mayor's wife involved from behind the veil of corruption and privilege he has hid her in.",--,The Message
394,--,['Nino Giuffrida'],"['Gianluca Fichera', 'Nino Giuffrida']",,--,Distretto Etneo - Argante
395,--,DESCONOCIDO,DESCONOCIDO,DESCONOCIDO,--,Error nombre para la pelicula con id: tt21038976
396,10.0,['Zach Charlesworth'],['Zach Charlesworth'],"Chasing the main antagonist, Romain, through the hallways of Douglas Hall results in an in depth look at residence life. SPOILER ALERT: At the end of the film, Romain is finally caught and revealed to be Italian.",--,Douglas Hall Tour Video - McGill University - 2021/22
397,--,['Tony Cole'],['Tony Cole'],"When several AIA operations go awry, Internal Affairs division agent Scott Drydell is sent to shut down the leak. It's not long until Drydell realizes how deeply into the eyes of corruption itself he's staring.",--,Double Cross
398,7.8,DESCONOCIDO,['Anthony Javier'],"When Lord Huma attacks an undefended Earth, an unlikely Jumpsuit Hero is called to defend her.",--,Jumpsuit Hero: Delta-R
399,--,['Nikolas Zorbas'],['Nikolas Zorbas'],A cold blooded vigilante has a change of heart after he murders innocents,--,The Viper
400,--,DESCONOCIDO,DESCONOCIDO,DESCONOCIDO,--,Error nombre para la pelicula con id: tt21047824
401,--,['Justin Cole Mossa'],['Justin Cole Mossa'],"An operative, Ellroy, is tasked with protecting the Asset at a safe house far from any threats. Until Ellroy discovers a threat, one who can compromise his mission and the Asset's life.",--,The Homestead
402,--,['Sam Tahhan'],['Sam Tahhan'],"Caught in the crossfire of a war-torn future, a grounded fighter pilot struggles to keep his powerful daughter from enemy forces looking to use her gifts for nefarious purposes.",--,Test Drive
403,--,['Anil Mehra'],['Anil Mehra'],"His Son, Daughter and ex-girlfriend arrive at a mental institute as part of his intervention. Patrick battles his deteriorating mind as he tries to accept the truth behind his family's resentment towards him, but is everything as it seems?",--,Reality
404,--,['Danny Lopez'],['Danny Lopez'],,--,Taking Care of Business
405,--,['Antoine Riou'],DESCONOCIDO,"10 days after the fight with Broly, Vegeta and Trunks are bothered by another android. They thought that they had finished with all the androids, but it is not the case : one is back, and he is very strong. They call Son Goku for fighting him, all together.",--,Super Android
406,--,['Jacob K. Ebbesen'],['Jacob K. Ebbesen'],"Viktor Storm has been training for months, to earn Scorpius respect and become his new apprentice. But he soon learns how difficult a life of an apprentice can be, when he is sent on a mission to kill a traitor to the order.",--,Master & Apprentice
407,--,['Lucas Dolia'],['Lucas Dolia'],,--,Escape
408,--,['Karsen Schovajsa'],['Karsen Schovajsa'],Three gang members are sent into a car garage to kill a seasoned hit man.,--,No Chance
409,--,['Lucas Dolia'],['Lucas Dolia'],,--,Heist
410,--,['Harrison Schaaf'],"['KC Deane', 'Harrison Schaaf']",,--,Reed
411,--,DESCONOCIDO,['Andrew McCloskey'],"A decade after the events of Burp Boy Part 1, see the famous superhero (that everyone likes), Burp Boy, investigate Doctor EvilApple's diabolical schemes. See, for the very first time, other Burp Boy villains such as Invisichair fight Burp Boy. Will Burp Boy prevail? Or will the world meet a much worse fate?",--,Burp Boy 2: Everlasting Battle
412,--,DESCONOCIDO,DESCONOCIDO,,--,Masters of the C-4 Fists
413,--,['Mystical Smoke'],['Mystical Smoke'],,--,Spider-Man and the Prowler Join Forces!
414,--,DESCONOCIDO,['Sepehr Khalse'],"Mehdi Nt (born May 28, 1998, Urmia, Iran) is a singer, songwriter, musician, film composer and actor.",--,Kam Avordi
415,8.0,DESCONOCIDO,"['Steve Chesworth', 'Adam Michaels', 'Chaz Dray Schoenbeck']","Vigilante Casey Jones confiscates a futuristic gun from a criminal and begins to question his brand of justice. When footage of the fight spreads, girlfriend April O'Neil warns that he is drawing the attention of a dark organization.",--,Casey Jones: Live Wire
416,--,['Cameron Thrower'],DESCONOCIDO,A secret agent is on a mission to rescue two high profile kidnapped girls with help of her partner in crime.,--,The Doyenne
417,--,DESCONOCIDO,"['Deepti Bakshi', 'Sanket Bakshi', 'Hemant Tavathia']",Two small-time criminals hired to kidnap a mob boss' only daughter fail to execute a simple checklist of kidnapping tasks,--,Ransom Handsome
418,--,['Adam Daniels'],DESCONOCIDO,Luke has a mineral inside him. The only thing known about this mineral is that is has a lot of value to many individuals.,--,Dark and True
419,--,['Noah Maringer'],['Noah Maringer'],,--,Warzone 3
420,--,['Ethan Hawthorne Dallas'],['Ethan Hawthorne Dallas'],"Time Cop follows the story of the end of a crumbling partnership between two vigilantes: Time Cop and Time Deputy. They are hot on the trail of drug lord Mr. Klu after following a breadcrumb trail of ""yeast""- a new super-drug.",--,Time Cop: A Love Letter to 80's Action
421,--,DESCONOCIDO,"['Luka Hrgovic', 'Dino Julius']","Top Gun parody about Maverich and Moose celebrating Maverich's birthday in the cockpit of an airplane, during a flight.",--,Top Fun
422,--,['Eli Canter'],"['Eli Canter', 'Geraldo Hinch']",,--,Double Take
423,--,['Andros Georgiou'],"['Kushal Kshatri', 'Sohil Kshatri', 'Andros Georgiou']","Kai finds himself wanting out of a dangerous business. With nowhere else to turn, he seeks help from his brother, Damon. When things take a turn for the worse, Damon is forced to take matters into his own hands.",--,Clipping Branches
424,--,['Hawkin Paleczny'],['Frank Woolridge'],,--,Grassetto
425,--,['David Realin'],['David Realin'],,--,Powdered Donuts
426,--,['David Realin'],['David Realin'],,--,The Life of Pablo
427,--,['Matthias Fuchez'],['Matthias Fuchez'],"Haunted by the trauma of his past, Mr Diaz hires Wei, a martial arts specialist to protect his daughter from himself should he suffer from another of his 'episodes'.",--,Episode
428,4.7,['Connor Hearn'],"['Graysen Gutwein', 'Lilly Elizabeth Hamilton', 'Connor Hearn']",,--,The Nark at Roosevelt
429,8.6,['Jonathan Gibney'],['Jonathan Gibney'],"At the dawn of the Viking era, a young boy is thrust into chaos when he loses everything.",--,The Boy
430,--,['Kelan Reicher'],['Kelan Reicher'],,--,Randall.
