431,--,['Reid Quinlan'],"['Reid Quinlan', 'Brandon Ross']","Two ninjas, one young and one old have a fun fight, or do they? You will see in this epic ninja adventure that takes place in Okinawa, Japan. Many things happen in this well-reviewed film, including epic fights, comedic moments, and more. Enjoy.",--,Ninja Warriors
432,--,['Isaac Holland'],['Isaac Holland'],"The events within the radio play commence with an action scene of Byron's first race against, most wanted street racer, Lucian Meadow, this will engage the audience within the first minute of the radio play and will assist in moving Byron's character forward and tell the audience who he is within the first one minute of the play, as well as giving the co-main characte... Read all",--,Chasin' to Runin'
433,--,['Lindley Farley'],['Lindley Farley'],"Ralph is a fan of the 1950s TV series, ""Man Of Danger."" Ralph acts out the action scenes he sees on the show in the real world.",--,Man of Danger
434,5.4,DESCONOCIDO,DESCONOCIDO,"While Ant-Man and The Wasp demo their Quantum Core, an unexpected villain shows up, eager to get their hands on the powerful tech. The heroes need all the help they can get to save the day.",--,Avengers: Quantum Encounter
435,--,['Jordan Nistico'],DESCONOCIDO,,--,Seven Deadly Sins: Escanor v Estarossa
436,--,['Kody Newton'],['Kody Newton'],,--,Trance
437,--,['Jonathan Carlander'],DESCONOCIDO,A man attempts to escape from an evil planet.,--,Darkmoon Dogfight
438,--,['Jonathan Carlander'],DESCONOCIDO,,--,Stop Motion
439,--,DESCONOCIDO,['Deo Clarisse Bashala'],"A French Speaking Foreign Lady innocently dressed and embellished in a remarkable enough way to draw the attention of thugs, speaking out loud on her Cell Phone, by a Train Station in Johannesburg, South Africa. She gets attacked by the thugs, but she manages to free herself and escape. She climbs the train and relates the story to the passengers - who do not seem to ... Read all",--,Baba Ngiya Kubonga
440,--,['Steven Nye'],['Steven Nye'],"A college athlete is pressured by his roommates to stop studying and join a party in their apartment, resulting in a fire. He must decided how to escape the dense smoke, turning back to save the girl of his dreams.",--,Boundless
441,--,DESCONOCIDO,['Brad Hopper'],"When a straightforward arrest gets stalled, Hopper tries to gain a lead to the whereabouts of the perpetrator. Sometimes you have to find your own answers.",--,Little Fish Big Pond
442,--,DESCONOCIDO,DESCONOCIDO,"After numerous run-ins and flare-ups, the Shoutikan Dojo break in through a service entrance door in the town Mall where the Wussi Ryu dojo meets to train. They have come to exact their revenge and settle old scores a brief but epic battle ensues, leading to multiple deaths and a criminal investigation. The events were captured by multiple security cameras and became ... Read all",--,Cobra K.I.A.
443,--,['Cameron Levins'],"['Cameron Levins', 'Robert Patricio']","A discharged young soldier finds himself at the breaking point of his reoccurring nightmare. As he is consumed by a mysterious sickness, he must confront that which haunts him most. Something wicked this way comes.",--,Mac
444,--,['Mengle Han'],DESCONOCIDO,,--,MLBB x Transformers Cinematic Trailer
445,--,['Roy Finch'],['Nadine Kostine'],,--,Match Point
446,--,['Saleh Tariq'],"['Abdulla Al-Adimi', 'Saleh Tariq']","Hossam tries to take revenge on his daughter's killers, but he is in danger.",--,Killing Mission
447,--,['Joshua Ortiz'],['Joshua Ortiz'],"General Jesse, Shiloh, and Ani are joined by new recruits in their continuing war to save the galaxy from evil in the form of Supreme Bolgor and King Dennis.",--,Valiant Falcons 4: Hope of the Stars
448,--,['Craig Tiber'],['Craig Tiber'],,--,Mary's Tale
449,--,DESCONOCIDO,['François-Xavier Aubague'],,--,Chasseurs de Tornades
450,--,['Geremy Barahona'],"['Geremy Barahona', 'Jean Carlos Soto']","After Beating Mickey, Sonic decides to finish off Mickey and Finally end the war that started this mess. Or will he?..",--,Sonic Infinity War: Part 2
451,--,['Charley Blum'],['Anthony Cooper'],A short film about a group of Crusaders sent on a mission to defeat an enemy beyond their realm.,--,The Knight
452,--,['Shant Zadouri'],['Shant Zadouri'],"When a woman finds herself the target of an assassination attempt, she must survive the fight of her life in order to uncover who put out the hit.",--,The Hit
453,--,['Liam W. Jennings'],['Liam W. Jennings'],,--,Bluebird
454,8.6,['Naseer Pasha'],['Akira Toriyama'],"Given diplomatic orders by the Grand Council, Vegeta, now king of the Saiyans, sets out on an interstellar assassination mission.",--,Legend: A Dragon Ball Tale
455,--,['Jackson Bartholomew'],['Jackson Bartholomew'],,--,The Seekers: A Hereafter Story
456,--,['Achyut Prashast Singh'],['Achyut Prashast Singh'],A young man named Shivam resorts to destruction with his hammer.,--,A Cold Common Man
457,--,DESCONOCIDO,DESCONOCIDO,The violent man Shivam finds a new weapon and tests his fighting skills.,--,A Cold Common Man II
458,--,DESCONOCIDO,DESCONOCIDO,DESCONOCIDO,--,Error nombre para la pelicula con id: tt21287454
459,--,DESCONOCIDO,DESCONOCIDO,"The violence-loving Shivam tries to play pretend with a toy shotgun, only to learn a permanent lesson.",--,A Cold Common Man III
460,--,['Lawrence Ribeiro'],DESCONOCIDO,"Winner of 15 awards including Best Action and Best Director. An all-out car chase on the streets of Lisbon that roars to an epic ending. The sequel to ""The Chase"" by Lawrence Ribeiro.",--,Part Deux: The Chase
461,--,['Samuel Moyle'],['Samuel Moyle'],,--,This Time Around
462,--,['Anabel Díez'],['Carlos Troyano'],,--,Verano
463,--,DESCONOCIDO,"['George Watson', 'Kapers Williams Jr.']","Professor Utonium's perfect little girls are all grown up and ready for college, but just when their lives are about to change a new villain appears from nowhere to end them.",--,Townsville
464,--,['Neil N.'],DESCONOCIDO,"Grace, an American undercover agent, has been sent on an mission to London to monitor a group of scientists that the U.S. Government suspects poses a possible biological threat. Grace, however, discovers the threat to be a cover up for something entirely different. She is questioning who she can trust within her own institution and everything she once believed to be t... Read all",--,Instinct
465,--,['Yasmin Nik'],['Yasmin Nik'],,--,Goodbye
466,--,DESCONOCIDO,"['Karel Konings', 'Maarten Sleegers']","After a group of so-called paedophile hunters beat up an alleged paedophile, one of them fears he has been recognized by him.",--,JAGERS
467,9.6,['Bahri Baykal'],['Bahri Baykal'],"Atay auditions for the role of a hitman. When he learns of his rejection, he must make a choice; one possibility being he replaces his gun's blank magazine with a magazine full of real bullets.",--,The Choice
468,--,['Akhil Aron'],['Akhil Aaron'],,--,Kanal Palarum Paranja Kadha
469,--,DESCONOCIDO,['Sourav Sarswa'],,--,Crime investigation buddhus
470,--,['Sean Johnson'],"['Sean Johnson', 'Kan Shimozawa']","A Blind traveler is making his way across the land, but some Bandits try to cut his journey short. However, their plan takes an unexpected turn.",--,Eyes in the Dark
471,6.5,['Darc Mavid'],['Darc Mavid'],,--,Da Capo - The Town of Music
472,--,['Nathan Block'],DESCONOCIDO,,--,Something Right
473,--,['Matthew Hornibrook'],"['Matthew Hornibrook', 'Tom Lowe']","Seagram, a modern day gunslinger, sets out to find the men who murdered his girlfriend and avenge her.",--,Seagram
474,--,['Ruben Ramirez'],"['Jayy Gunna', 'Ruben Ramirez']","A beef between Mexicans and blacks come down to one last meeting. Their only interest in each other is the drug game. As blacks being their number 1 customer, they have to set their issues to the side for business.",--,A Ok
475,--,['Jonathan Carlander'],DESCONOCIDO,,--,Prop Gun
476,--,['Bill Thorpe'],['Bill Thorpe'],,--,Doom - Part 1 - Shareware
477,6.8,['Sergey A.'],"['Sergey A.', 'H.P. Lovecraft']","Ctulhu awakens in the city of Kalyazin, and only a video blogger from YouTube and Howard Phillips Lovecraft himself can save the day.",--,Kalyazin. City of the Ctulhu
478,8.2,['Sergey A.'],"['Sergey A.', 'A.A. Milne']","Piglet became a Satanist and called on the spirit of Chikatilo, who moved into the baby. Only Winnie the Pooh can stop the returned maniac.",--,Winnie the Pooh vs Chikatilo
479,--,['Domas Vilcinskas'],"['Marija Judzentaviciute', 'Domas Vilcinskas']","Religious groom-to-be and two of his buddies celebrate his bachelor's party in a traditional Lithuanian sauna, where not only their bodies, but also their souls get an unexpected deep cleansing.",--,Issivalymas
480,--,['Ryley Wayne'],['Ryley Wayne'],,--,Blake Toked 3 Hard
481,7.5,['Sergey A.'],"['Roman A.', 'Sergey A.']","A young fisherman tries to catch Sharkey with vodka, but events take a completely unexpected turn.",--,Sharkey 3. Merciless summer
482,7.8,['Lars Johnsrud'],['Lars Johnsrud'],A frustrated woman seeks help from a friend for a man who does not listen because he is obsessed with his telephone.,--,Nå skal du høre
483,--,DESCONOCIDO,"['Riitta Jalonen', 'Arto Laukkanen']",Story of a Finnish stunt driver Mauri Uuskoski aka Crazy Mike.,--,Crazy Unelma
484,--,['Agustín Marchese'],['Agustín Marchese'],,--,A última hora
485,--,['Slav Syrkin'],DESCONOCIDO,"Netology - bringing back high-level education after CoVid but on a new level - online with teachers, with a huge range of professions (from coding to filming), and for all ages.",--,Netology - Teach you something new
486,--,['Mars Marshall'],DESCONOCIDO,,--,A Priceless Proposal
487,--,['Mara Cisse'],"['Danny Châu', 'Mara Cisse']",,--,Oh les batards!
488,--,['Jonathan Carlander'],DESCONOCIDO,,--,Showdown
489,--,['Jonathan Carlander'],DESCONOCIDO,,--,Kombat'n
490,--,['Matteo Bonissi'],['Matteo Bonissi'],,--,Correndo
491,--,['Will Garber'],['Will Garber'],A web adventure series host and his cameraman venture into the Black Hills of South Dakota hoping to get some good footage. Things take a deadly turn very quickly and now the duo must find the strength and courage to survive before the become prey.,--,Prey
492,--,['Matt Kane'],['Matt Kane'],"In a distant realm, two masters, each representing their clan's unique fighting style, must settle a score.",--,Kick Master vs Elbow Master
493,--,['Alex Dashwood'],['Alex Dashwood'],,--,This Party's Dead
494,--,['Vance Major'],"['Vance Major', 'Adam Mullen']",,--,Threat Level Midnight: A Star Trek Fan Production
495,--,['Josh Pulido'],"['Josh Pulido', 'Carlo Becerra']","Two screenwriters struggle to come up with an idea to pitch to their boss at a film studio, and they have less than an hour until their appointment with.....the boss.",--,The Film Café
496,--,['Christian Taliaferro'],"['Christian Taliaferro', 'Ethan White']","Louis, Jack, Caleb and Vanessa return to continue their search for the Golden Eagle. But conflicting priorities and a sinister dark talon plot attempt to send the group in different directions.",--,North Texas Treasure Hunters: Part 2
497,--,['Nathaniel Dolquist'],DESCONOCIDO,,--,Steel Tango
498,--,['NCA'],DESCONOCIDO,,--,Kala Fasana
499,--,DESCONOCIDO,['Toby Osborne'],Mad Moxxi deals with troublemakers at her infamous bar during the intergalactic launch of her own brand of Ballantine's whiskey in this live show based on the Borderlands video game.,--,Moxxi's Finest
500,--,['Jessica May Jensen'],['Isaac Cole'],,--,Technicolor Yawn
501,--,['Marcelo Pancote'],"['Desi Banks', 'Malcolm Champ Heaggans', 'Malcolm Heaggans']",,--,When Duty Calls
502,7.8,['Raphaël Hébert'],['Raphaël Hébert'],"A long time ago in a galaxy far far away, a fugitive family living in peace must brace itself when their past has tracked them down. Star Wars: Brightstar is an Internationally Award-Winning Fan Film.",--,Brightstar
503,--,['Connor McCann'],['Connor McCann'],"Goose is short horror film set on a university campus, following a group of bartenders at the student pub. After they finish their shift and begin to walk home, they come to realize the world has changed drastically since last call. Soon they find themselves hunted by a deadly and determined predator hellbent on bloody chaos.",--,Goose
504,--,DESCONOCIDO,['Yûki Kedôin'],"Kento and Sakura, Samurai siblings, are looking for roles as actors after moving to Canada from Japan. While they film their samurai sword fight audition tapes, Kento feels that he is not good enough, and will not get roles in an English-speaking country. Kento ends up going on a date with a new friend, Emma, that he and his sister met for a sushi party, and she pushe... Read all",--,Ippo
505,--,['Abraham Lopez'],['Abraham Lopez'],"An up-and-coming superhero strives to prove herself by venturing into a dangerous dimension to undertake a rescue mission. Upon the beginning of the mission, the young superhero and her seemingly normal best friend encounter the guardian of the dimension who is wounded and troubled, and they quickly learn that this mysterious dimension needs more help than they origin... Read all",--,The Healing Touch
506,--,['Scott Rhodes'],['Scott Rhodes'],"There is danger in the town's streets, when a man desperately chases another for something the other did in a grocery store.",--,Chase Scene
507,--,['Chris R. Notarile'],['Chris R. Notarile'],,--,Jaci
508,--,['Fernando Durán Gómez'],"['Juanjo Arroyo', 'Fernando Durán Gómez']","Hiroshi, a Yakuza assassin, is surprised by his old gang while enjoying a Tomita Brand, the exclusive craft beer preferred by criminals. Hiroshi will fight his old comrades for both his life and his independence. Until the last drop.",--,Tomita Brand
509,--,['DJ Danny'],DESCONOCIDO,,--,Savdhan Punjab
510,--,['Xander Haan'],['Xander Haan'],Dumpywing's greatest wish comes true. He now has the biggest dumpy you've ever seen. But what will happen when he loses it all?,--,Dumpywing: Piece of Cake
511,--,['Dominik Taylor'],['Joe Tryner'],A group of film students struggle to make their fight scene seem real.,--,The Final Cut
512,--,['David Elijah Piersaul'],['Corey Simpson'],,--,Spring Cleaning
513,--,DESCONOCIDO,"['Aster J. Brotman', 'Claire Russell']","Impossible Girl faces her nemesis, Dr. Wrath, and discovers an unsettling truth.",--,Bros Before Foes
514,--,['Ryker Sixkiller'],['Ryker Sixkiller'],,--,Chris
515,--,['Matthew Winters'],DESCONOCIDO,,--,It Wasn't Me
516,--,['Kari Ovi'],DESCONOCIDO,,--,Ostra War
517,--,['Tony Cole'],['Tony Cole'],"Military contractor Rick Dunne is ambushed on a mission, and soon he realizes work on the private sector isn't so black and white.",--,Code of Honor
518,7.7,DESCONOCIDO,['Logan Thirtyacre'],Jeffy' mom escape's prison on jeffy's 18th birthday to kidnap him and get the millions of dollars left to him by his father but it turns out he faked his own death and alive and after Nancy escape she hires screwball to kidnap Jeffy but everyone is dressed like Jeffy so they accidentally kidnaps Marvin and after Nancy kidnaps Marvin the call rosalina and she called th... Read all,--,SML: The Movie
519,--,['Dawuud Malik'],['Dawuud Malik'],"2 Criminals revel in their success of stealing £100,000 from a small town bank however they soon realize their plan was not as perfect as they had thought",--,"£100,000"
520,8.2,DESCONOCIDO,['Steve Spiegel'],Take off on an intergalactic chase through space and time with the Guardians of the Galaxy.,--,Guardians of the Galaxy: Cosmic Rewind
521,--,['MelonInDisguise'],['MelonInDisguise'],,--,I made a Roblox Movie
522,--,['Benjamin Yackshaw'],"['Josie Vorenkamp', 'Benjamin Yackshaw']","Three greedy bounty hunters in gold rush California struggle to determine the identity of a mysterious stranger. Is the man a notorious outlaw with a price on his head? Or did they kidnap a complete nobody? Dirt, sweat, lies, and bullets fly in The Bounty.",--,The Bounty
523,--,['Matthew D. Panepinto'],['Gray with an A'],,--,Friendly
524,--,['Clentonium'],DESCONOCIDO,Arrested for making a Clone army Tony blends in with his clones to hide from the Police. El Fugitivo follows a fugitive fresh out of prison with a million dollar bounty on his head.,--,El Fugitivo
525,--,DESCONOCIDO,"['Clentonium', 'Merseer']",,--,Bravo Falcon
526,--,['Nole Balaniz'],['Nole Balaniz'],"Samuel Todd has been acting as a low level vigilante named Manthrax for nearly a year. With the help of his agent Victor Bonds, they have been getting paid gigs for small vigilante tasks. Manthrax embarks on his most recent mission : egging a frat house. He narrowly escapes some frat guys, and continues with his work. However, Samuel has a bigger problem. His college ... Read all",--,Villainthropy
527,--,['Clay Lacey'],DESCONOCIDO,A survivor in a post-apocalyptic world finds the cryogenically frozen body of his favorite scientist. He must use the scientist's brain to traverse his memories throughout time and find answers to how he can save the deteriorating condition of the earth.,--,Memora
528,--,['Matthew Lee Blackburn'],['Matthew Lee Blackburn'],"When a prison transport dumps its cargo on a desolate planet, company operatives must hunt down the surviving prisoners and the hostile aliens roaming loose on the planet's surface.",--,According to Plan
529,--,['Francois D'],['Francois D'],"The Game is resurrected as the battle between immortals continues. 2241 A.D. - time for the next Gathering. Immortals are once again summoned in armed combat to battle for the Prize. Demon Warrior, Nichiren Nakano, faces off with unavoidable challenges in this next generation. There can be only one.",--,Highlander Renegade
530,--,['Lewis Pavlovic'],"['Callum Forman', 'Cara Mcwilliam-Richardson', 'Lewis Pavlovic']","A young couple argue when one does something truly unspeakable. Their argument spans three rooms, three attempts of reconciliation and three genres, all in under three minutes",--,Are You Still Watching?
531,--,['Debasis Mahato'],DESCONOCIDO,,--,Raw Official
532,--,DESCONOCIDO,['Rebeca Casagrande'],,--,O Imaginário de Sofia e Pudim
533,--,['Mark Westin'],DESCONOCIDO,A backwards retelling of an assassin killing a man on a dock.,--,Omega
534,--,['Adrian Valentin'],DESCONOCIDO,"After fighting an assassin sent to kill her, Kora discovers a plot against her that is off family inclinations.",--,Daddy
535,--,['Bennett MacIntyre'],['Bennett MacIntyre'],"When three paranormal-savvy friends in 2017 uncover the ghostly apocalypse awaiting their world, they open shop and become the ""Ghostbusters,"" the only ones to stop the end of the world.",--,Legacy Cut: The Ultimate Ghostbusters
536,--,['Ian Truitner'],['Ian Truitner'],"A street musician is wrongly accused of a crime, and he takes off on a fast-paced hair-raising foot chase through the narrow winding streets of Aix En Provence, France, with determined police matching his every move.",--,Aix-Hale
537,--,['Elvis DeRad'],DESCONOCIDO,"""Upon receiving orders on his next job, a powerful hitman is forced to confront his past.""",--,"Three Down, Five Across!"
538,6.2,['Neill Blomkamp'],DESCONOCIDO,"During a corporate war, mercs that works for the opposing factions engage in a brutal fight for a refugee convoy, with unpredictable consequences.",--,Switcher - Off the Grid Cinema
539,--,['Daniel McQuade'],['Daniel McQuade'],"With a life full of pain and suffering, two ""twins"" battle it out over secrets about their family and prepare themselves for their brutal fate.",--,Reckoning
540,--,DESCONOCIDO,['Leon Langford'],A young woman must outsmart multiple teams all fighting to steal a priceless watercolor.,--,Femme De Heist
541,--,['Nicole Lease'],['Nicole Lease'],"It only takes a single mistake to have an undercover mission go bad. After finally discovering a clue, agent Modi and Tyr set off to bring down the man behind the recent murders. Teamwork is key in their journey, but will they be able to successfully take down the bad guy?",--,Compromised
542,--,['Emir Kahn Bautista'],['Kal Rai'],"Time is on its last sign of life, the end of the world is near. The last three living immortals are battling it out. Only one immortal can be in control to keep the balance of time. So life can carry on to exist.",--,Interscape: Unconscious Minds of the World
543,7.5,['Jon Truei'],['Jon Truei'],"A mischievous, prank loving kung fu master creates fake training for a gullible teenager who still believes fantastical myths about martial arts.",--,The 44th Chamber of Shaolin
544,--,['Andrey Klimov'],['Andrey Klimov'],Deep space. An interstellar spaceship crashes. A crew of a small drop-ship have managed to miraculously survive in this disaster. Their ship is damaged and they have to land on an unexplored planet nearby. They steer the ship into an atmosphere without suspecting that a layer of impenetrable thunderclouds enveloping the planet hides something that will be even worse t... Read all,--,Countdown
545,--,['Mateo Visbal'],['Mateo Visbal'],"A professional hit-man who has a little OCD, gets blood on his nice clothes. He investigates his victims closet for a suitable replacement",--,Aberration X
546,--,['Achyut Prashast Singh'],['Achyut Prashast Singh'],A vengeful man gets stabbed with multiple knives and a secret is revealed.,--,Blade Wielding
547,7.8,DESCONOCIDO,"['Josh Foxon', 'George Grozier', 'Jack Vickers']","When his plane is shot down, VJ Nug is targeted by an assassin.",--,Wanted
548,--,['Stefan Thien'],['Stefan Thien'],,--,PowerStreet
549,--,['Geovanni Gopradi'],DESCONOCIDO,,--,A Coward
550,6.0,['Mihalis Basias'],['Mihalis Basias'],"When a mysterious, valuable box appears in Stergios' life, he must decide whether he'll overcome his fear of responsibilities and protect it from the dangerous people that are after it.",--,To kouti
551,--,['Rodolfo Fernandez'],"['Rodolfo Fernandez', 'Álex López-Reina']","John realizes his life has taken a turn for the worse by living with Tina and he seeks help from his best friend, Kyle, one last time: will Kyle help John to break up with Tina, or will John wait until she finishes him?",--,My Girlfriend T
552,6.2,DESCONOCIDO,"['Fili Olsefski', 'Andreas Vakalios']",,--,My name is Anti
553,--,['Mazu Sircle'],['Mazu Sircle'],"The story of an outcast child in a city infested with crime lurking every reeking corner who learns the significance of doing the right thing. The world of Batmania is an amplified version of the real world, making it a nightmarish hellhole in which even the purest of good hearts find no solace and lose hope. The main character, Philos Redd (played by Mazu Sircle) is ... Read all",--,The Reddback
554,--,['Ricky Gonzalez'],['Jose Raul Corres'],,--,La Entrega
555,--,DESCONOCIDO,DESCONOCIDO,"Raven gets into a competition with fellow brickmaker and karate blackbelt, Ricky, as to who can make the most bricks in a day.",--,Fist of Fire
556,--,['Joshua Mesnik'],['Joshua Mesnik'],"12 years after his YouTube video ""Hula Hoop Boy"" went globally viral for all the wrong reasons, an aspiring filmmaker is determined to re-create his viral masterpiece and gain the respect he thinks he deserves.",--,Hula Hoop Boy
557,--,['Jean Cazalot'],['Jean Cazalot'],"John and Pope are close to get the Royale treasure. But this time, John goes to the adventure with multiple friends. They are on the way to find the Royale, but it's not going to go as planned.",--,Royale: Suite
558,--,['Nick Salve'],['Greg Tulonen'],A bookstore owner with a fear of heights must overcome his anxiety to retrieve his lucky rock.,--,Acrophobia
559,--,DESCONOCIDO,DESCONOCIDO,"We met our most powerful villain yet. the Empty, A Shaman Wizard helps us unlock special powers to battle the Empty and his Void Army.",--,Elemental Masters! Ninja Kidz Movie!
560,--,['Clentonium'],['Clentonium'],,--,Hit and Run
561,6.1,['Brian L. Tan'],"['Zaike LaPorte Airey', 'Jeremy Max']",A team of elite soldiers drop into a remote jungle and encounter an unexpected enemy.,--,Anomaly
562,--,['Josh Kline'],['Serge Kolesnyak'],"Contaminated canyons of flooded New York near future. Amid the ruins, life and work continue in city's remaining relief workers adapt to the beauty of their newly transformed home and the consequences of a slow, preventable apocalypse.",--,Adaptation
563,--,DESCONOCIDO,"['Jessey Nelson', 'W. Cody Nelson']","On the set of a trashy daytime talk show (in the vein of Jerry Springer or Maury) we see what appears to be your typical DNA paternity test episode, where both of the men brought to the show by the pregnant woman refuse to claim the unborn child. Meanwhile our hero enters the building claiming he is the father of this unborn baby but is getting denied access to the st... Read all",--,Thicker Than Blood
564,--,['Andrew Mummenthey'],"['Joshua Harrington', 'Andrew Mummenthey']",The team must finally stop Strikepacer before it's too late,--,Gifted: Redemption
565,7.6,DESCONOCIDO,"['Raul Esko', 'Romet Esko', 'Janar Saaron']",When an extremely dangerous nuclear twin-turbo engine is stolen from the harbour twins sister super cops Nana and Lulu enter the world of illegal street racing in hopes of turning their lives around.,--,Topelt Turbo
566,--,['Darius Norowzian'],DESCONOCIDO,,--,Warriors
567,9.1,['Dustin Brown'],['Dustin Brown'],A condemned cow's last chance at freedom.,--,Super Cow
568,--,['Oscar Daniel Mejia'],DESCONOCIDO,Shoot. Don't forget to look over your shoulder every now and then because you never know who's watching you.,--,Foiled Up
569,--,DESCONOCIDO,"['Rodrig Andrisan', 'Geoff Brooks', 'Nick Field']","The sleepy town of Balamoron gets invaded by tea thirsty aliens. But they are all invisible. How will agent Nick field and the rest of the Essex FBI handle this new threat? With some help from Agent X maybe? Anyway, the situation is more than critical if not catastrophic. Is this the end of the world? It seems so.",--,Balamoron
