848,"5,5",['Christopher Cain'],"['Josh Fasulo', 'Brian A. Hoffman']","An alcoholic man refocuses himself on putting kids through college via 4H and FFA scholarship donations. Guiding him is a spiritual figure he calls ""The Bearded Man"".",1h 53min,Deep in the Heart
849,"9,1",DESCONOCIDO,"['Hunter M. Altman', 'Hilda Denmer', 'Pierangeli Llinas']","A peasant from Latin America emigrates to the United States to give her baby a better life. During her first night in New York, her whole world collapses and she spends a selfless lifetime in search for the child.",1h 27min,Carmen G
850,"4,7","['Mitchell Altieri', 'Phil Flores']",DESCONOCIDO,"On the run with the law on their trail, America's most anguished vampire family heads to England to find an ancient vampire clan. What they find instead could tear their family, and their throats, apart forever.",1h 22min,The Thompsons
851,"6,8",['Yôjirô Takita'],"['Tow Ubukata', 'Yôjirô Takita', 'Masato Katô']","A chronicle of the life of Yasui Santetsu, a 17th century master of go who turned his attention to astronomy and created a new calendar for Japan.",2h 21min,Tenchi meisatsu
852,"6,2",['Peter Strickland'],['Peter Strickland'],"Un ingeniero de sonido trabajando en un estudio italiano especializado en cine de terror, se ve inmerso en un horrible caso de la vida imitando al arte.",1h 32min,Berberian Sound Studio
853,"6,0",['John Duigan'],['John Duigan'],"CARELESS LOVE tells the story of Linh, a Vietnamese Australian university student who secretly starts part-time work as an escort. She develops a close rapport with one of her clients, an enigmatic American art dealer, who books her on a regular basis. For a time she manages to keep her two lives in separate compartments. But when she falls for a fellow student her wo... Leer todo",1h 45min,Careless Love
854,"5,2",['Eron Sheean'],"['Shane Danielsen', 'Eron Sheean']","When a potentially lethal virus is created within his new lab, Dr Geoff Burton is shocked to discover he is not only the unwitting cause, but also its first victim.",1h 41min,Errors of the Human Body
855,"5,8",['Nina Grosse'],"['Nina Grosse', 'Bernhard Schlink']","After being released from prison, former RAF terrorist Jens Kessler spends his first weekend in freedom with friends from the past; among them are his former lover Inga and her husband. As the tension mounts, it takes only one spark to trigger an eruption of hostility.",1h 38min,Das Wochenende
856,"7,8",['Jonathon Rayner-Burt'],['Chantal Rayner-Burt'],"Journey of a Story follows the life of William Brown, a fictional New Zealand serviceman both physically and emotionally damaged by his tour of duty in Europe and time as a Prisoner of War during World War II. Returning home, William finds a very different world to the one he left behind. Forced to leave the home he planned to enjoy with his wife Lily and young son Ja... Leer todo",1h 32min,Journey of a Story
857,"6,3",['Doris Dörrie'],"['Doris Dörrie', 'Ferdinand von Schirach']","Two young people in Berlin, a refugee and a homeless punk, form a relationship.",1h 52min,Glück
858,"6,1",['Joshua Coates'],"['Joshua Coates', 'Cynthia Rodriguez', 'Mario Steele']","Crowned ""King of Philadelphia's Judicial System"" Attorney David Marshall's fearless approach and unwavering confidence has the young bachelor flying high, attracting the most sought after women in the city. He will soon find himself entangled in a steamy love affair with a married woman. The outcome becomes devastating, with so much at stake, David and The married wom... Leer todo",1h 39min,Iniquity
859,"7,3","['Guillaume Giovanetti', 'Çagla Zencirci']","['Guillaume Giovanetti', 'Çagla Zencirci']","Noor wants to be a man. He doesn't belong anymore to the Khusras, Pakistan's transgender community. And he is definitely done with the love story he had with one of them, that had drastically changed his life. Now, he is doing a man's job in a Truck Decoration Center and he made up his mind: he will find a girl who will accept him as he is...",1h 18min,Noor
860,"6,3",['Mike Newell'],"['David Nicholls', 'Charles Dickens']",Una serie de acontecimientos cambia la vida del huérfano Pip por completo y este deja sus humildes orígenes atrás para convertirse en un caballero y disfrutar de una nueva vida.,2h 8min,Grandes esperanzas de Mike Newell
861,"4,1",['Alejandro González Padilla'],['Alejandro González Padilla'],Amidst the hostile beauty of the jungle surges the love story of how coffee first made its way to Chiapas in 1800s.,1h 40min,"Chiapas, el Corazón del Café"
862,"6,9",['Maryanne Zéhil'],DESCONOCIDO,"Marie, a Canadian editor specialized in testimonies of Genocide survivors, starts to receive anonymous large envelopes with the narrative of Ali, a young Palestinian who grew up in a refugee camp in Lebanon. Intrigued, Marie investigates the origin of these envelopes and finds out who is the anonymous writer. This is how she establishes a connection with Joseph, a Leb... Leer todo",1h 35min,La vallée des larmes
863,--,['Joshua Finch'],['Joshua Finch'],"Chronicles the epic rise and fall of Angelo Morello, a young Calabrian who finds himself entering a life beyond his wildest dreams from small time gambler in the 1960s to controlling the Australian cannabis trade during the 1970s.",1h 54min,Australian Enemy
864,"8,3",['Kris Finnigan'],DESCONOCIDO,"A male escort opens up to a first time writer about love, women, and business to give him insight for his first book. The writer meets a woman, and the film juxtaposes his experience with the tales of the escort.",--,With Her
865,"6,9",['Rob Reiner'],"['Guy Thomas', 'Rob Reiner', 'Andrew Scheinman']","Monty Wildhorn, un novelista alcohólico de películas del Oeste, ha perdido el norte. Su sobrino le empuja a veranear en la tranquila Belle Isle. A regañadientes, entabla amistad con una madre soltera y sus tres hijas.",1h 49min,El verano de sus vidas
866,"7,0","['Brian Klugman', 'Lee Sternthal']","['Brian Klugman', 'Lee Sternthal']",Un escritor en la cima de su éxito literario descubre el alto precio que debe pagar por robar el trabajo de otro hombre.,1h 42min,El ladrón de palabras
867,"3,6",['Mitchel A. Jones'],"['Mitchel A. Jones', 'Nicole Kruex']","A survivor of warfare born chemical attack, Cassie Becker faces a new world of terrible realization. The Human race has suffered terrible recourse in the wake of an attack that never should have been leaving the remaining inhabitants in a state far less then human. It has been six months since to the day in this new world of indescribable destruction and isolated fear... Leer todo",1h 29min,After the Dawn
868,"7,4",['Jérôme Le Maire'],['Jérôme Le Maire'],"Tea or electricity tells the epic story of the implementation of electricity in a tiny isolated village enclosed in the middle of the Moroccan High Atlas.Over more than three years and season after season, the director patiently reveals the outlines of the net that will inevitably end up closing on the people of Morocco. Before our eyes is draft the image of the merci... Leer todo",1h 33min,Le thé ou l'électricité
869,"7,2","['Jonathan Dayton', 'Valerie Faris']",['Zoe Kazan'],"Un novelista que lucha contra el bloqueo de escritura encuentra el romance de una manera muy inusual: creando un personaje femenino que él cree que le amará, y luego deseando que exista.",1h 44min,Ruby Sparks
870,"6,4",['Xavier Villaverde'],"['Ana Maroto', 'Xavier Villaverde', 'José Antonio Vitoria']",La relación establecida entre el estudiante universitario Bruno y la aspirante a fotógrafa Carla se ve turbada cuando Bruno se ve atraído por la sexy instructora de karate / bailarina de break Rai. Las cosas se complican.,1h 45min,El sexo de los ángeles
871,"6,1",['Matteo Vicino'],['Matteo Vicino'],"""They never come right out and tell you that"", explains Federico, an Italian teenager to an interviewer. While Josephine, a young Parisian sits in court as her lawyer continues, ""And let's not forget that Ms. Dupont was an elderly woman at the time"". And Julian, an Irish basketball star looks away with detachment from the noisy Dublin pub. All their fates are intertwi... Leer todo",2h,Young Europe
872,"6,4",['Claude Berne'],['Claude Berne'],"In Hotel Paradise, a haven of solidarity for all the abandoned, two lives meet: Paul, 50, at the end of the line, who only sees his children every other weekend, and Marie, 35, who returns 15 years later carrying a secret.",1h 35min,Hotel du Paradis
873,"8,2",['Donald Plata'],['Chris Schaefer'],"When the Japanese launched their Pacific attack, General Douglas MacArthur's United States Army Forces in the Far East included ten divisions of newly recruited and poorly equipped Philippine Army soldiers, and one U.S. Army infantry division with supporting units--the Philippine Scouts. ""Forgotten Soldiers"" follows the U.S. Army's Philippine Scouts as they protect th... Leer todo",1h 27min,Forgotten Soldiers
874,"5,6","['Harish Narayan', 'K. Hari Shankar']","['K. Hari Shankar', 'Harish Narayan']",Two students plan to investigate a strange phenomenon that they came across in a field during their summer holidays.,2h 19min,Ambuli
875,"5,4",['Eduard Cortés'],"['Eduard Cortés', 'Piti Español']","Film basado en la historia real de los Pelayo, una familia que consiguió su fortuna haciendo saltar la banca de los grandes casinos de todo el mundo.",1h 40min,Los Pelayos
876,"6,6",['Romain Nicolas'],['Romain Nicolas'],"Is there any other way of grasping life than by the thorns? The question has to be answered by four characters, the pillars of this story: Madame Rose, a wealthy, cynical novelist, Juliette, a mute, hypersensitive orphan girl, Rudy, a handsome, super-educated, mixed race guy lost in the city by night, and Marilyn, a loner with an ever-so organized life. Everyday heroe... Leer todo",1h 35min,Par les épines
877,"6,2","['João Pedro Rodrigues', 'João Rui Guerra da Mata']","['João Pedro Rodrigues', 'João Rui Guerra da Mata']","Two filmmakers leave to Macao in an adventure of discovery of a city-labyrinth, multicultural and mysterious, where the memories of the childhood - featured memories by the lived reality in Macao - have a dialog with the memories of the East built by the codes of the cinema and the literature - memories lived on a featured reality-, creating a testimony which tries to... Leer todo",1h 22min,A Última Vez Que Vi Macau
878,"5,6",['Fow Pyng Hu'],['Fow Pyng Hu'],"Nick is his own worst enemy and he is aware of this. He has a fickle character and he just as easily attracts people as he puts them off. Hoping to escape reality he emerges on a journey to Croatia. Even though he cant solve his problems, his restless soul finds a certain peace. We as viewers can leave Nick behind accepting him as he is. An unusual road movie in terms... Leer todo",1h 30min,Nick
879,"5,4","['Srinivasa Reddy', 'Sreenivass Redde']",DESCONOCIDO,A demon born from darkness plans to take over the world by marrying a girl with ominous horoscope.,2h 37min,Damarukam
880,"7,9",['Richard Britain'],['Stephen Wallis'],"The Martini Shot is a mostly improvisational piece about a well known actor that's fallen on hard times. He decides to kill himself at the end of his new film's wrap party in order to preserve his immortality before it's ruined by these lousy pictures he's found himself doing. As the night goes on, he finds both reasons for and against him following through with it. A... Leer todo",1h 32min,The Martini Shot
881,"6,9",DESCONOCIDO,DESCONOCIDO,An omnibus of ten short films by ten young directors.,2h 21min,Skopje Remixed
882,"6,5",['Djamila Sahraoui'],DESCONOCIDO,"Une petite maison abandonnée, isolée dans la campagne algérienne. Ouardia y a enterré son fils Tarik, militaire peut-être tué par son propre frère Ali, dirigeant dun maquis islamiste. Elle est surveillée par un des hommes dAli, amputé dun bras suite à une explosion. Dans cet univers crispé par la douleur et figé par la sécheresse, la vie va peu à peu reprendre ses dro... Leer todo",1h 30min,Yema
883,"5,2",['Ruba Nadda'],DESCONOCIDO,"Años después de salir de Damasco en circunstancias sospechosas, Adib debe enfrentarse a lo que dejó cuando su hija desaparece.",1h 33min,Rescate en Damasco
884,"7,0","['Abbas Kiarostami', 'Banafsheh Modaressi']","['Abbas Kiarostami', 'Mohammad Rahmani']","En Tokio, una joven trabajadora del sexo establece una conexión inesperada con un viudo durante dos días.",1h 49min,Like Someone in Love
885,"6,0",['Alejandra Marino'],['Alejandra Marino'],"Ana and Laura are soul sisters, but life had them follow different paths. A late call in the middle of the night will make them meet again. It will be a meeting both of joy and fear as it will bring back the past they don't want to remember. It will be Roberta and Juan, their teenage kids, who will discover the secret of love and blood that unites them.",1h 36min,El sexo de las madres
886,"6,0",['Rebecca Perry Cutter'],['Rebecca Perry Cutter'],A young girl and the babysitter she's idolized for years become immersed in a manipulative and deadly friendship.,1h 31min,Besties
887,"7,6",['Adam Watson'],"['Claudia A. Juarez Chavez', 'Kurt Tuffendsam', 'Adam Watson']","While serving a 33 year sentence inside La Mesa Federal Prison, the most corrupt in all of Mexico, former drug cartel chief Esteban Mendoza finds redemption while helping others overcome drug addiction.",1h 22min,Los Traficantes
888,"4,7",['Russell Leigh Sharman'],['Russell Leigh Sharman'],"Three months ago, Piper met Mollie online. And Mollie changed everything. Now a knock at the door. John Sharp. Mollie's brother. He was sent to talk Piper out of the thing's she's threatening. But neither may be who they claim to be.",1h 28min,Apartment 4E
889,"6,1",['Apichatpong Weerasethakul'],['Apichatpong Weerasethakul'],"Shifting between fact and fiction in a hotel situated along the Mekong River, a film-maker rehearses a movie expressing the bonds between a vampiric mother and daughter.",1h 1min,Mekong Hotel
890,"5,4",['Michael Caporale'],DESCONOCIDO,"Once on top of the country music industry, a recently released felon struggles to keep his life together, find his legendary guitar and connect with a daughter he has never met.",1h 51min,The Black Dove
891,"5,0",['Richard J. Bosner'],['Richard J. Bosner'],"Robert and Jenny become roommates and, after a year of living together, Robert has fallen in love with her. He cannot afford to stay in San Francisco, and he has three days to confess his feelings before he moves back to Rochester, N.Y.",1h 23min,Falling Uphill
892,"5,8",['Jessica Goldberg'],DESCONOCIDO,"After their parents abandon the family, a young woman works to take care of her younger siblings.",1h 24min,Refuge
893,"5,5",['Michael Walker'],['Michael Walker'],"Peter, a family man who works for a failing supermarket chain finds his life shaken up by his new boss, Susan, who starts to groom him for an executive position. Money and opportunities are within his grasp, but at what price?",1h 32min,Price Check
894,"6,4",['Olivier Assayas'],['Olivier Assayas'],"En los meses posteriores a las vertiginosas semanas de mayo del 68, un grupo de jóvenes europeos busca una manera de continuar la revolución que se creía que acababa de comenzar.",2h 2min,Después de mayo
895,"7,9",['Alan Ronald'],['Julian Lamoral-Roberts'],"The rendezvous at a North London Tavern between a faded horror movie actor and a young woman on a mission leads to a twisted comedy of loss, lust and paranoia.",1h 25min,Chinese Burns
896,"6,4",['Miguel Courtois'],DESCONOCIDO,Un thriller centrado en una familia tomada como rehenes por las Fuerzas Armadas Revolucionarias de Colombia.,1h 49min,Operación E
897,"7,3",['Andrzej Jakimowski'],['Andrzej Jakimowski'],Un profesor ciego rompe las reglas para ayudar a una alumna a redescubrir los placeres de la vida.,1h 45min,Imagine
898,"7,3",['Hernán Jiménez'],['Hernán Jiménez'],"After a decade abroad, Antonio returns to Costa Rica for a short visit. Unable to run away as usual, he is confronted with everything he has desperately struggled to put in the past: a broken family, an ailing father, a violent country and long lost friends.",1h 42min,El regreso
899,"6,8",['Matteo Garrone'],DESCONOCIDO,Luciano es un pescador encantador cuya inesperada y repentina obsesión por ser un concursante de un reality show lo lleva a una madriguera de percepciones sesgadas y paranoia.,1h 56min,Reality
900,"7,9",['Amit Ashraf'],['Amit Ashraf'],A drama thriller about men who run from their family responsibility and a rickshaw pedaling bounty hunter compelled to bring them to justice.,1h 30min,Runaway
901,"6,2",['Carlo Verdone'],"['Carlo Verdone', 'Pasquale Plastino', 'Maruska Albertazzi']",Tres padres divorciados se ven obligados a vivir juntos.,2h,Posti in piedi in paradiso
902,"4,8",['Andrew Lau'],DESCONOCIDO,An elite crime-fighting unit in the court of the Chinese emperor relies on flying swords to defeat their enemies.,1h 52min,Xue di zi
903,"4,8",['Emilio Martínez Lázaro'],"['Daniela Fejerman', 'Emilio Martínez Lázaro']","Tres amigos de la infancia, una mujer y dos hombres, vuelven a encontrarse muchos años después. Sexo, amor y la protagonista hecha un lío.",1h 50min,La montaña rusa
904,"6,6",['Kadija Leclere'],"['Kadija Leclere', 'Pierre-Olivier Mornas']","Alsemberg, 1975, Sarah an 8-year-old-girl is living in a Catholic foster family. One day, her biological father whom she has never seen before, comes to take her for a weekend in Paris. But she wakes up in Morocco where her father abandons her with his family without any explanation. Nine years later, with no money coming from her father, during the 'Hunger Revolt' (T... Leer todo",1h 32min,Le sac de farine
905,"6,2",['Sandrine Bonnaire'],"['Sandrine Bonnaire', 'Jérôme Tonnerre']","Touched to the depths of his being by the death of his child in a car accident nine years earlier, Jacques has lost his bearings. For this loss is all the more difficult to stand as Jacques was driving the car in which his son was killed. His relationship did not survive the tragedy and Jacques left, traveling far from the place where his and his wife's happiness was ... Leer todo",1h 38min,Su ausencia me enfurece
906,"7,0",['Marcel Mandu'],['Marcel Mandu'],"A dark and atmospheric twisting film with just a touch of horror, about a man who is thrown in to a new dimension of isolation between light and shadow, where there are no exits, where fear replaces knowledge and science, where he must fight his imagination and his thoughts, to find a way back to the real world.",1h 30min,The Wish
907,"6,8",['Jairo Boisier'],['Jairo Boisier'],"Fabiola returns to her homeland, province of Los Andes, to recover the affection of her family, after seven years of being away.",1h 23min,La Jubilada
908,"6,2",['Iván Mora Manzano'],['Iván Mora Manzano'],"The portrait of an invisible generation. A punk ballad told from the point of view of 10 youngsters with stories that interconnect, not with their destinies but with their concepts: the trip as a way of reinvention, questioning happiness and the system, evasion, moral limits, madness, decadence and love.",1h 55min,"Sin otoño, sin primavera"
909,"4,8","['Paula Fabiana', 'Adrian Steinway']","['Paula Fabiana', 'Adrian Steinway']",A classic ballerina that ends up in a burlesque cabaret. A cello player whose prison is his need for revenge. A forgotten old tranny. A lover arrested in his obsession. All characters looking for a way out of their own prisons.,1h 29min,Essa Maldita Vontade de Ser Pássaro
910,"4,9",['George Anson'],['George Anson'],"Eddy, a small-time Chicago criminal with a penchant for dim-witted schemes, is on the run. After ripping off his boss, Eddy hightails it for Mexico, but gets distracted by a pretty hitchhiker on the way. What begins as a simple tryst ends with Eddy beaten up, broken down, and penniless in Wynot, TX. Inadvertently witnessing a murder by Willet Nash, the county's all po... Leer todo",--,Spring Eddy
911,"5,3",['Xavier Giannoli'],"['Xavier Giannoli', 'Serge Joncour', 'Marcia Romano']",An average guy who works in a recycling plant wakes up one morning to discover that he's become inexplicably famous.,1h 52min,Superstar
912,"6,9",['Karan Malhotra'],DESCONOCIDO,A young boy's father is lynched before his eyes; fifteen years later he returns home for revenge.,2h 54min,Agneepath
913,"6,4",['Bahman Ghobadi'],['Bahman Ghobadi'],"Kurdish-Iranian poet Sahel has just been released from a thirty-year prison sentence in Iran. Now the one thing keeping him going is the thought of finding his wife, who thinks him dead for over twenty years.",1h 28min,Fasle kargadan
914,"5,9",['Katsuhide Motoki'],['Arisa Kaneko'],,1h 54min,"Okaeri, Hayabusa"
915,"6,5",['Nathan Frankowski'],DESCONOCIDO,"A drama centered around Renee Yohe and her battle with drugs, depression, and other life issues that ultimately leads to the founding of charity group To Write Love on Her Arms.",1h 42min,Un nuevo comienzo
916,"5,5","['Phil Dorling', 'Ron Nyswaner']",DESCONOCIDO,"When a college piano prodigy tries to check his mother into rehab, he is taken hostage by her drug dealer and swept along on a wild adventure.",1h 25min,Why Stop Now?
917,"5,4",['Brian Skiba'],['Kim Hughes'],The story of two childhood friends who have grown apart and are suddenly thrust back into each others lives when a parent develops cancer. They join forces to find the cure but soon realize their lives are danger if they expose the truth.,1h 49min,Sweetwater
918,--,['George Jecel'],"['Brook Fuller', 'George Jecel']","With civil war just over in an Eastern European country, TATJIANA, an exceptional 13 year old ballet talent is striving to escape her desperately poor rural backwater to attend an elite urban dance academy. She has no idea that behind her back deals are being made to sell her into child prostitution. It's a story of ruthless greed that will not stop at crushing an inn... Leer todo",1h 50min,Little Dancer
919,"4,7",['Matt Cerwen'],"['Scott Herford', 'Adrian Moses']","Once the most popular girl at Short Beach High, Denise Dixon finds her life turned upside-down after one night of terror. Rumours and violent backstabbing run rife. Life in Short Beach will never be the same.",1h 22min,Circle of Lies
920,"8,1",['Asif Akbar'],['Julia Davis'],"""One generally tags a doc, a doc, but the chills swim upstream, my spine argues that some factual films deserve a second tag. In this case, there's no more fitting a second category than horror, the scariest bit of celluloid you'll watch.""",1h 38min,Top Priority: The Terror Within
921,"3,1",['Kwok-Leung Kam'],DESCONOCIDO,"Passion Island - a place where individuals with different goals met, weaving colorful stories as their paths intertwined...Simon and Johanna divorced years ago, citing different values and goals in life.",1h 33min,Re ai dao
922,"3,6",['Dario Argento'],DESCONOCIDO,"Jonathan, un joven bibliotecario, va a trabajar para Drácula. Inquieto por el extraño comportamiento del conde, no tarda en descubrir hasta qué punto representa una amenaza para su mujer.",1h 50min,Drácula 3D
923,"6,5",['Akan Satayev'],"['Muhammed Mamyrbekov', 'Jayik Sizdikov', 'Timur Zhaksylykov']","A universal story about the freedom of the human spirit and the struggle against slavery and despotism, about love, loss and betrayal. It is seen through the eyes of simple Kazakh kids and teenagers.",2h 12min,Myn Bala
924,--,['Stella Arkenti'],"['Stella Arkenti', 'Alexandros Papadiamantis']",,--,I fonissa
925,"6,4",['Brandon Harris'],DESCONOCIDO,"A comedic drama set amongst grieving twenty-something man-boys in the industrial Midwest who's black friend was recently murdered in a historically troubled part of Cincinnati, Ohio.",1h 7min,Redlegs
926,"6,7",['Dean Shull'],"['Colin Goldman', 'Steve C. Roberts', 'Dean Shull']","The real story of ""4:20 Somethings"" living in California's semi-legalized marijuana culture.",1h 23min,"California, 90420"
927,"8,5",['Quentin Tarantino'],['Quentin Tarantino'],"Con la ayuda de un cazarrecompensas alemán, un esclavo liberado se propone rescatar a su esposa de un brutal propietario de una plantación en Misisipi.",2h 45min,Django desencadenado
928,"4,6",['Alexander Poe'],['Alexander Poe'],"Jennifer Carpenter, Kristen Connolly and Alexander Poe star in a comedy about three New Yorkers struggling to uncover the truth behind their romantic entanglements. Disheartened by his latest relationship catastrophe, Graham (Poe) attempts to rekindle the spark with his ex-girlfriend, Laura (Connolly). In the attempt to win her back Graham discovers he has a unique pr... Leer todo",1h 12min,Ex-Girlfriends
929,"6,0",['Ryan Darst'],"['Robert J. Gibbs', 'Whit Hertford']","Oliver Hayes, an aspiring animator whose confidence is at a low point, meets the captivating and impulsive Lily Blush, who encourages him to drop everything and go with her to Northern California in the hopes of fulfilling his fantasy of working for Pixar Animation Studios. As they travel up the coast, Oliver falls deeply in love but upon making certain startling disc... Leer todo",1h 32min,Dreamworld
930,"7,1",['Stephen Gurewitz'],['Stephen Gurewitz'],"Marvin's estranged sons, Seth and Stanley, return home for a camping trip. As past grudges are exposed, their weekend getaway slowly unfurls.",1h 15min,Marvin Seth and Stanley
931,"7,5",['Pablo Berger'],"['Pablo Berger', 'Jacob Grimm', 'Wilhelm Grimm']","El cuento de ""Blancanieves"" en una versión ambientada en la Sevilla de los años veinte y centrada en una torera.",1h 44min,Blancanieves
