206,"7,1",['Petter Næss'],"['Ole Meldgaard', 'Dave Mango', 'Petter Næss']","Soldados británicos y alemanes quedan varados en el desierto después de una batalla aérea. Al encontrar refugio en la misma cabaña, se dan cuenta de que la única forma de sobrevivir al invierno es dejar de lado las reglas de la guerra.",1h 44min,Perdidos en la nieve
207,"3,0",['Jeff Broadstreet'],"['Jeff Broadstreet', 'Robert Valding']","After inheriting the family mortuary, a pyrophobic mortician accidentally exposes hundreds of un-cremated bodies to toxic medical waste. As the corpses re-animate, the mortician's inheritance-seeking younger brother unexpectantly shows up, stumbling upon a full zombie outbreak!",1h 28min,Night of the Living Dead 3D: Re-Animation
208,"6,0",['Steve Balderson'],DESCONOCIDO,"CULTURE SHOCK is about four American college grads who take their first trip overseas and get caught in an international crime ring. It's an action-packed thrill ride with humour, intrigue, and tweets.",1h 21min,Culture Shock
209,"5,1",['William Kaufman'],DESCONOCIDO,Un asesino con experiencia juega para ambos bandos en un conflicto entre mafiosos rusos y se convierte en el objetivo de un enemigo desconocido.,1h 31min,Una bala en la recámara
210,"8,0","['Brad Allgood', 'Joshua Wolff']","['Brad Allgood', 'Joshua Wolff', 'Bil Yoelin']",This shocking documentary tells the story of the indigenous Miskito lobster divers along Nicaragua's Caribbean Coast who risk their lives every day diving for the region's most lucrative resource - the Caribbean spiny lobster.,1h,"My Village, My Lobster"
211,"2,4",['Tazito Garcia'],['Tazito Garcia'],"Will the struggle and fight to pass down a way of living, honor and expression to the next generation be possible, or is all hope lost with the strive to be the better, richer, most known icon in the media in todays world.",2h,The Dark Side: Rise of Darkness
212,"5,0",['Jesse V. Johnson'],['Derek Kolstad'],Un mensajero de un señor del crimen local debe entregar un misterioso paquete mientras es perseguido por una horda de insólitos gánsteres.,1h 35min,Entrega peligrosa
213,"4,8",['Justin Dix'],"['Eddie Baroo', 'Justin Dix', 'Adam Patrick Foster']","A special forces unit sent, to infiltrate Pine Gap Australia's top secret underground military compound, come under attack from unknown forces.",1h 26min,Crawlspace
214,"6,1",['Chakri Toleti'],DESCONOCIDO,"David Billa builds up his drug and arms dealing empire, becoming a feared underworld boss.",2h 9min,Billa 2
215,"3,8",['Daniel J. Gillin'],"['Daniel J. Gillin', 'Michael Adam Hamilton']","TROPHY tells the story of men's obsession with power and how far they will go to claim the ""PRIZE"". Two rival gangs in Los Angeles and Las Vegas, led by Gino (Robert Miano) and Cole (Michael Madsen), are vying for control. Danny (Michael Masini), an LAPD undercover police detective, goes deep into gangland to infiltrate one gang to bring down both. Along the way, he b... Leer todo",1h 39min,Beyond the Trophy
216,"3,5",['Joe Davison'],['Joe Davison'],"Several months after a zombie outbreak Frost Bite is the last town in Alaska. For John Bannister and his team of survivors it's what they call home, and it's all they got. Now, an unforeseen evil has risen, and his name is Regis, and he wants everything they have. Zombies are one thing, but Raiders are something else entirely.",1h 33min,Frost Bite
217,"6,6",['Stefano Sollima'],DESCONOCIDO,"A look at the controversial riot cops unit, told through the stories of three veteran cops and a young recruit.",1h 52min,Todos los policías son unos bastardos
218,"5,3",['Johnny Remo'],"['Daniel Backman', 'Johnny Remo']","After growing up with his single mom, skateboarder Caleb, 18, finds his busy, rich architect dad. He contacts him, when his mom's hospitalized with cancer. He joins a skateboard competition, when rent's up.",1h 52min,Hardflip
219,"4,6",['Sid Bennett'],DESCONOCIDO,"Una expedición británica formada por el investigador principal Jonathan Marchant, su ayudante, una médica y un equipo de televisión, viaja al Congo para buscar pruebas de un dinosaurio.",1h 23min,Proyecto Dinosaurio
220,"4,5",['Patricio Valladares'],DESCONOCIDO,"Ater their abusive father is jailed, two sisters being raised in a remote area of Chile find they have to answer to their uncle, a drug kingpin who wants his missing product back.",1h 37min,En las Afueras de la Ciudad
221,"5,8",['Chuan Lu'],"['Succeed Be', 'Chuan Lu']",The story of two warring generals (Liu Bang and Xiang Yu) fighting for control of China at the end of the Qin Dynasty.,2h,Wang de Shengyan
222,"6,5",['Alberto Rodríguez'],"['Rafael Cobos', 'Alberto Rodríguez']",Un escuadrón de cuatro policías encubiertos está acusado de limpiar las calles de Sevilla de drogas y prostitución.,1h 36min,Grupo 7
223,"5,6",['David Barrett'],"[""Tom O'Connor"", 'Lowell Cauffiel']",Un bombero toma una decisión inesperada cuando el hombre contra el que debe testificar le amenaza.,1h 37min,Fuego cruzado
224,"7,2",['David Barras'],"['David Barras', 'Scott MacKay', 'Scott MacKay']","Jazz and Wolf need money to save their comic shop. When the rare and valuable first issue of Electric Man shows up, they think all their problems are solved. But things are never that simple. They are not the only ones who want to get their hands on it.",1h 40min,Electric Man
225,"5,4",['Craig Moss'],"['Craig Moss', 'Elliot Tishman']",Un veterano de Vietnam se convierte en un héroe local después de salvar a un hombre de los atacantes en un autobús urbano. Él decide tomar medidas cuando su mejor amigo es asesinado y la policía muestra poco interés en resolver el crimen.,1h 30min,Tipo duro
226,"4,5",['Raimund Huber'],['Ken Miller'],"Captured international assassins are locked up inside a high-tech bunker known as the Killing Chamber. To break out of this concrete hell they must duel each other, fight deadly ninjas and battle against gangs of masked maniacs. And... if they survive this, they will have to confront Snakehead: the lethal, deranged top dog who will stop at nothing to kill 'em all!",1h 26min,Kill 'em All
227,"7,0",['Brannon Bates'],['Brannon Bates'],Rookie detective Jack Wall is up against insurmountable odds as he attempts to solve his first case with a mysterious crime lord against him. Finding the true love of his life only to have her taken away is just the beginning of his transformation into Payback Jack.,1h 38min,Payback Jack
228,"3,3",['Stephen Amis'],DESCONOCIDO,"In 1943, five US soldiers are recruited by the OSS for a time travel mission to save the world from the tyranny of Hitler's 25th Reich.",1h 25min,The 25th Reich
229,"8,4",['Nicholas Ortiz'],['Nicholas Ortiz'],"A Modern Frankenstein Film, set in New York City, where a former cop, a medical examiner and a online journalist must discover the terrifying secret behind a serial killer's actions that hold the Big Apple in a constant state of fear.",--,Siodmak
230,"5,8",['David Charhon'],DESCONOCIDO,Dos policías incompatibles se unen para investigar el asesinato de la esposa de un magnate de los negocios.,1h 36min,Incompatibles
231,"6,3",['Inon Shampanier'],"['Inon Shampanier', 'Natalie Shampanier']",A man takes a cab from LAX. A couple gets in as well and he finds out what a millionaire tour is: they take his valuables and stop at ATMs until his credit cards max out. Who is he? Twists follow.,1h 24min,The Millionaire Tour
232,"3,7",['Ansel Faraj'],['Ansel Faraj'],"The continuing story of Detective Adam Sera, and his new nemesis - the Fireman.",1h 41min,The Burning Within
233,"5,6",['Jason Connery'],"['Adam Mervis', 'Adam Ratcliffe', 'Javier Rodriguez']","Un exluchador campeón de la NCAA, en libertad condicional después de diez años en prisión, accede a una serie de peleas en jaula para salvar la vida de un amigo y se le pide que haga lo imposible: perder.",1h 30min,El chico de Filadelfia
234,"6,0",['Naoyoshi Shiotani'],DESCONOCIDO,"Six months after the massacre at her faux hometown, Saya has set out on a mission to exact revenge on Fumito, who had since then become a powerful dictator enforcing censorship throughout Japan.",1h 47min,Gekijouban Blood-C: The Last Dark
235,--,['Leif Å. Songedal'],"['Øivind Solfjeld', 'Leif Å. Songedal']",,--,Fuglekikkeren
236,--,['Sean-Michael Argo'],"['Sean-Michael Argo', 'Bekah Kelso']","Sineaters is the story of a lone drifter who has come to the end of a violent and bloody journey. He has the power to consume the sins of evil-doers, and the power to heal with his hands, part faith healer and part gun slinger. He loses the spiritual struggle with the Grim, a manifestation of all the evil he has removed from the world, and is turned against his sineat... Leer todo",1h 30min,Sineaters
237,"7,4",['Gursimran Dhillon'],"['Gursimran Dhillon', 'Colin Drake']",A detective with questionable methods enlists his group of friends to take down the drug dealers who control his city.,--,Pseudo
238,"5,7",['Michele Placido'],"['Denis Brusseaux', 'Cédric Melon']",Un detective busca al tirador que frustró el plan de atrapar a un notorio equipo de ladrones de bancos.,1h 29min,El francotirador
239,"5,4",['Micheal Bafaro'],['Micheal Bafaro'],"In an attempt to find a missing boy in the woods, an NBS news reporter and his cameraman embed themselves with a group of hunters before all goes awry.",1h 26min,Embedded
240,"8,2",['Anurag Kashyap'],DESCONOCIDO,Un enfrentamiento entre Sultan y Shahid Khan conduce a la expulsión de Khan de Wasseypur y enciende una enemistad mortal que abarca tres generaciones.,5h 21min,Gangs of Wasseypur
241,"7,2",['Luis Ismael'],['Luis Ismael'],"Tone, the leader of the gang, returns home after sometime abroad, to try to save his father's life that is on the verge of death, and needs a liver transplant to survive. For this task he needs the help of his gang, once again.",2h 9min,Balas & Bolinhos: O Último Capítulo
242,"3,3",['Shaji Kailas'],['Renji Panicker'],Two detectives investigate the death of an intelligence agent found in a river after she discovered a Pakistani plot for a terrorist attack.,3h 3min,The King and the Commissioner
243,"4,7",['Christopher Bryan'],"['Ryan Darbonne', 'Allan Traylor']","The year is...""80's future"". The world is in shambles. A bitter and desolate place. The zombie apocalypse has been devouring the world for nearly 7 years. Now, the powers that be think the suffering should end - so the ultimate weapon is sent to earth. The Zombie Christ. Those that fight alongside him have become his apostles, and together - they attempt to rid the wo... Leer todo",--,The Zombie Christ
244,"6,0",['N. Linguswamy'],"['N. Linguswamy', 'Brindha Sarathy']",Thiru join hands with his brother Guru to face the mobsters of a city.,2h 30min,Vettai
245,"5,7",['Xavier Palud'],"['Éric Besnard', 'Luc Besson']",Un inspector de policía debe resolver dos horripilantes asesinatos. El problema es que su único sospechoso es un ciego.,1h 34min,A ciegas
246,"3,9",['Steven R. Monroe'],['Steven R. Monroe'],"The film is a violent, edgy ride focusing on down and out Reagan Tyler, a man who is troubled by visions and premonitions that ultimately lead him to old school Las Vegas. It's there that Reagan meets the beautiful and mysterious Monika, a young woman who turns out to have been killed the night before he even met her. Reagan is then forced to put the puzzle together o... Leer todo",1h 28min,MoniKa
247,"8,1",['Ryan Branco'],['Ryan Branco'],"A young woman (Symphony) living in Atlanta has a loving boyfriend, great friends and a Grandmother who worries like any other. But one night things change Symphony's life forever. A choice has to be made, kill or be killed.",1h 30min,Symphonys Target
248,"3,9",['Dwayne Buckle'],['Dwayne Buckle'],"In a future world of scientific advances, humans share every aspects of their lives with their machines. But when a leading scientist and his team build an advanced prototype cyborg, the scientists aren't prepared for the consequences.",1h 51min,Cybornetics
249,"7,7",['Boodee Keerthisena'],['Ariyaratne Athugala'],"Two lovers, Yoga and Parvathi, meet on the battlefield of the Sri Lankan civil war. As the Liberation Tigers of Tamil Eelam attack the Sri Lankan army and tighten their grip on the Tamil people, Yoga and Parvathi struggle with feelings for each other and their own commitments to the LTTE. Parvathi's family is relocated to a concentration camp and Yoga is sent on a mis... Leer todo",1h 52min,Matha
250,"2,6","['Nathan Ellering', 'Phillip Ellering']",DESCONOCIDO,"A story of what happens when a reluctant man is forced to face his fears, which begins as a fun camping trip and ends in a fight for survival in the remote forest of the pacific northwest.",1h 28min,Lost Woods
251,"6,0",['Ernie Barbarash'],"['Chad Law', 'Evan Law']",Un exmercenario con la reputación de encontrar a niños perdidos es contratado por un luchador de artes marciales cuya hija ha sido secuestrada.,1h 55min,6 balas
252,--,['J Orion Liptak'],DESCONOCIDO,"Along with his android partner, an aging homicide detective in the year 2047 must overcome his hatred of the Grey aliens that now live among us to unravel a conspiracy involving an alien mob boss, a prostitute, an illegal immigrant, and a shady U.S. Senator. As the chaos and intrigue grow, Sam is pulled deeper into the underground of New Mars, TX and it's decline into... Leer todo",1h 15min,Farworld
253,"4,5",['Michael Thomas Dunn'],['Michael Thomas Dunn'],"When a college student (Annalisa Kyler) dissappears along the road, her friends quickly form a search party to find the lost woman. Unfortunately, these college slackers (Martin Seijo, Lauren Brown & Kayte Giralt) are in way over their heads. Also trying to piece this mystery together is the local Sheriff (Allan Medina) and the coroner (Ed Donovan). Womanizing jerk Br... Leer todo",1h 25min,Bloody 27
254,"7,4",['Keishi Otomo'],"['Nobuhiro Watsuki', 'Kiyomi Fujii', 'Keishi Otomo']",Un ex asesino que ha decidido no volver a matar nunca más ha puesto a prueba su voto.,2h 14min,"Kenshin, el guerrero samurái"
255,"5,1",['Matthias J. Michel'],['Matthias J. Michel'],"Vanessa, a super posh diva, finds herself stranded on a lighthouse instead at a luxury resort. To make things worse, there is no way to get off the island until the next ship arrives the following week. This leaves her with plenty of time to get acquainted with the burly lighthouse keeper and Sebastian, a dropout, with whom she competes for the only shabby little gues... Leer todo",1h 38min,Overbooked
256,"6,0",['Stephen Fung'],"['Chia-Lu Chang', 'Kuo-Fu Chen', 'Hsiao-tse Cheng']","Yang travels to Chen Village to learn a powerful form of Tai Chi. Though villagers are forbidden from teaching outsiders, Yang becomes their best hope for survival when a man arrives with a plan to build a railroad through the village.",1h 40min,Tai ji 1: Cong ling kai shi
257,"5,3",['Sajid Khan'],DESCONOCIDO,A comedy of errors wherein four men help each other to fool their prospective father-in-laws creating a cascade of confusion and mayhem.,2h 25min,Housefull 2
258,"4,1",['Todor Chapkanov'],"['Jeffrey Green', 'Rafael Jordan']","Set in a not-too-distant future in which a synthetic blood substitute, dispensed by the Romanian government, allows humans and vampires to potentially co-exist.",1h 26min,Vampiros del Hampa
259,"4,7",['David Keary'],DESCONOCIDO,"Rocket (Tray Chaney) is a businessman cashing in on an underground scheme to steal from criminals. Using his upscale nightclub as a way to pinpoint targets, he creates elaborate plans including phony police busts and online embezzlement. For his next heist, Rocket uses his girlfriend. Monae (Tila Tequila), as bait.",1h 29min,Masterminds
260,--,['Bey Logan'],['Bey Logan'],"Snowblade is a lethal lady assassin traveling the badlands of ancient China. Having sold her soul to win mastery of the sword, she fears no man, and knows no law but her own. One dark night, the devil offers her a chance to escape hell, if she can only kill seven foes before the full moon wanes...",--,Snowblade
261,"3,8",['Brandon Nutt'],"['Brandon Nutt', ""Declan O'Brien"", 'Scoop Wasserstein']",A special agent's plans to reconcile with his ex-fiancé are ruined when she boards a private jet that is targeted by hijackers working for the same crime lord that he is chasing.,1h 26min,Hijacked
262,"7,8","['Frank E. Jackson Jr.', 'Porscha Howard']",['Frank E. Jackson Jr.'],"Four drug kingpins deal with inner turmoil, familial strife and heightened stakes while taking a chance on a risky business proposition. Kwan (Che Evans), Deuce (Joe Weaze Carter), Dexter (Demetrius Parker) and Theo (Walter Maxfield Jones) may be in over their heads when they join forces with middleman Tiger (The Wires Trey Chaney) and criminal mastermind/funeral home... Leer todo",1h 35min,Dead Money
263,"5,4",['Eduardo Rodriguez'],['Jonathan W. Stokes'],"Un hombre que cruza a México con una mochila con 2.000.000 de dólares y un pasado sangriento, se encuentra bajo un repentino ataque en el tranquilo pueblo de El Fronteras.",1h 39min,El Gringo
264,"4,8",['Ward Roberts'],['Ward Roberts'],A former vigilante who has embraced his peaceful nature comes to the aid of a young mother in trouble with a cannibalistic drug lord.,1h 34min,Dust Up
265,"6,7",['Xackery Irving'],DESCONOCIDO,"A psych-patient, accused of a violent murder, turns to her court-appointed psychiatrist to prove her innocence and sanity. Her psychiatrist must help her decipher delusion from truth to unravel the mystery of her reality.",1h 32min,Nothing Without You
266,"6,0",['Amin Matalqa'],['Nizar Wattad'],A legendary Egyptian football coach is brought back from retirement by his former star player to train a team of pan-Arab misfits in Jordan to compete against France in order to secure funding for their football academy.,1h 36min,The United
267,"6,0",['Brian Kazmarck'],"['Brian Kazmarck', 'Kazy Tauginas']","When an experiment for a new miracle drug goes terribly wrong, the scientists responsible must race to prevent an apocalyptic event from occurring.",--,Terminal Legacy
268,"4,1",['Olaf Lubaszenko'],"['Jerzy Kolasa', 'Olaf Lubaszenko']","As Poland is placed under martial law in 1981, two confidence tricksters try to evade both the police and the army. They become embroiled in a web of schemes engineered by the secret service, fellow criminals and the democratic resistance.",1h 39min,Sztos 2
269,"4,5",['Patryk Vega'],"['Wladyslaw Pasikowski', 'Przemyslaw Wos']","In 1945, Polish intelligence agent Hans Kloss, codenamed J-23, goes to Konigsberg to search for the treasure stolen by the Nazis. It's there that he meets his old friend and rival, SS Officer Hermann Brunner.",1h 48min,Hans Kloss. Stawka wieksza niz smierc
270,"5,6",['Kabir Khan'],DESCONOCIDO,India's top spy Tiger and his love Zoya battle the dark world of intelligence and espionage that forbids its soldiers from loving the enemy.,2h 12min,Tiger: Agente Especial
271,"7,6",['Mike Malloy'],['Mike Malloy'],"A documentary concerning the violent Italian 'poliziotteschi' cinematic movement of the 1970s which, at first glance, seem to be rip-offs of American crime films like DIRTY HARRY or THE GODFATHER, but which really address Italian issues like the Sicilian Mafia and red terrorism. Perhaps even more interesting than the films themselves were the rushed methods of product... Leer todo",2h 17min,Eurocrime! The Italian Cop and Gangster Films That Ruled the '70s
272,"7,9",['Jay Tando'],['Jay Tando'],"The saga of two longtime hit-men. One decides it's time to retire, the other goes on a deadly rampage.",1h 25min,Spare Time Killers
273,"6,1",['Matt Sinnreich'],"['Lee Ehlers', 'Matt Sinnreich']",,--,Trigger
274,"8,3",['Joe Clarke'],DESCONOCIDO,A pizza guy gets mixed up in a casino heist on the Fourth of July.,1h 19min,The Wedge
275,"7,0",['John Mossman'],DESCONOCIDO,A man is lured by a cryptic phone call to a remote river and gets caught in a violent clan war.,1h 15min,Into the Wake
276,--,['Shûya Yoshimoto'],DESCONOCIDO,,--,Death Yankee 2
277,"3,8",['Tom Norton'],['Tom Norton'],"Laura Brummels is determined to avenge the death of a young boy - a death she could have prevented, but didn't. It's placed her in a prison of guilt driven by her cooperation as a reporter with a political regime that's successfully corrupted her. Fallen from grace with the regime, Laura is sentenced to Aquila, where no one escapes and an annual monsoon floods the pri... Leer todo",47min,7 Stones
278,--,['Markus Hagen'],"['Helge Beck', 'Markus Hagen']",,--,No Mercynary
279,"5,9",['Milos Twilight'],['Milos Twilight'],"A global conspiracy is underway guided by The New World Order. A secret religious order must face their fate, to prevent the Apocalypse, the End of Days.",1h 56min,Gothic Assassins
280,"7,6",['Michael Yebba'],['Michael Yebba'],"Tow truck driver Jason Watts is barely making ends meet, so when an opportunity to work ""overtime"" presents itself, he has no choice but to take it. Not wanting to disappoint his son, Chris, Jason takes him along for a Saturday spent in a tow truck. Chris is an amazing 8 year old that loves superheros. But which is his favorite? Hulk, Iron Man, Super Man, all good, bu... Leer todo",--,Ordinary Man
281,"7,6",['Risto Huovinen'],DESCONOCIDO,"Three producers are assigned to a secret mission. They have to shoot the movie of all movies. It all takes place in a country that is famous of it's cold hell. The Case travels through smoky bar room to suburban ghetto, where gangs are fighting for the territory to sell booze, and finally out from the city limit, to the vast, open land. Through it's journey, the Case ... Leer todo",1h 3min,The Case of Fortune
282,--,"[""Ken'ichi Fujiwara""]","[""Ken'ichi Fujiwara"", 'Hidemi Noto']",,2h 4min,Guraffurîtâ Toki
283,"6,5",['Eiichirô Hasumi'],"['Shûhô Satô', 'Yoichi Komori', 'Yasushi Fukuda']","Mika (Riisa Naka) is a flight attendant on board an airplane scheduled to land at Haneda Airport. On the way to the airport the airplane's engine starts to burn. In order to save the 346 people on board the airplane, sea marshall Daisuke Senzaki (Hideaki Ito) and his team are called into action ... (Source: Asian Wiki)",1h 56min,Brave Hearts: Umizaru
284,"5,4","['Graeme Noble', 'John-William Noble']",['John-William Noble'],"'The Shadow of Death' is a brutal psychological film about the spiritual journey of a young Christian woman and her boyfriend after her family are mercilessly gunned down in cold blood. The battle that she faces grows against dangerous and vicious criminals that are rampantly destroying lives with their daily business. Adding to this, she and her boyfriend are also th... Leer todo",1h 57min,The Shadow of Death
285,"3,8",['Raj Rohit Reddy'],"['Logan Leikam', 'Raj Rohit Reddy']",A seemingly perfect couple's façade is dependent on whether or not they are able to keep from revealing their role in a murder while holding their engagement party on a remote bay just outside of San Francisco.,1h 26min,No One Will Know
286,"3,6",['James Chankin'],DESCONOCIDO,"Chad Turner (Craig Sheffer) has been implanted with the only working biometric computer chip (aka The Mark of the Beast) in the world. The chip has the power to change the world with whoever controls it and Joseph Pike (Gary Daniels) is determined acquire the chip even in the face of the most unforeseen event ""The Rapture"". Pike has taken hostage Mr.Cooper (Eric Rober... Leer todo",1h 35min,La marca
287,"5,8",['Perry Bhandal'],['Perry Bhandal'],Un sicario de élite regresa para borrar su pasado solo para descubrir que alguien se ha metido con su futuro.,1h 36min,Asesino a sueldo
288,"5,6",['Daniel Calparsoro'],"['Jorge Arenillas', 'Javier Gullón', 'Fernando Marías']","After almost getting killed in a terrorist attack during an international mission, Spanish military doctor Pablo returns home to heal wounds with his family. He starts to suspect that the Army is withholding information about the attack and also starts being pressured by the military high command to verify the official Army version of events. His refusal to comply and... Leer todo",1h 39min,Invasor
289,"6,7",['Christophe Wagner'],"['Jhemp Hoscheid', 'Christophe Wagner', 'Frederic Zeimet']",The intrigue kicks off with a cop being murdered and develops as a complex and smart game of manipulation where nothing and no one are what they seem.,1h 36min,Doudege Wénkel
290,"5,9",['Dante Lam'],"['Dante Lam', 'Candy Leung', 'Wai-Lun Ng']","International Security Affairs agent Jon is on a dangerous mission to escort a criminal scientist to another country. En route, a member of his team, Sean, turns out to be a traitor and shoots Jon in the head while kidnapping the scientist. When Jon wakes up in the hospital, a doctor tells him that within weeks, the bullet in his brain will cause complete paralysis. J... Leer todo",2h 2min,The viral factor
291,--,['Brad J. McBride'],['Brad J. McBride'],"Sometimes to save a life, you must commit murder...",1h 30min,Hidden in Vicinity
292,"7,5",['Joan Frank Charansonnet'],"['Joan Frank Charansonnet', 'Israel Guttierrez Collado']","2029, the Earth is about to suffer the ultimate consequence of climate change that will succumb to its demise. The last hope of humanity lies in the Saturn's largest moon, Titan, the only place in the solar system with copious amounts of fluid resting on its surface. Only genetically perfect can be instructed to colonize Titan and thus save the human race. Under the s... Leer todo",1h 45min,Regression Post Panic Film
293,"6,2",['Hiroshi Matsuyama'],['Kazunori Itô'],"In 2024, the computer network prevails throughout daily life. Sora Yuuki is a 14-year-old girl. One day, she is invited to an online game ""The World"". After an accident in the game, the real world begins to deform.",1h 52min,Dotto hakku: Sekai no mukou ni
