440,--,['Moroco Colman'],['Silvio Freytes'],"A ring that pass for different hands, is the common element that interwaves different stories with an overtone deeply human: A father who se vuelve a vagrant, a teenager who se vuelve a hooker, a couple who is planning their wedding, a middle age man who dies because love and sadness, his grandson who remembers the history.",20min,La Alianza
441,--,['Greg Emmerth'],['Greg Emmerth'],"A gay couple, after a long term relationship, meet one last time to finalize their breakup.",22min,The Heart of the Matter
442,"6,0",['Nikos Pastras'],['Nikos Pastras'],A woman finds herself lost wandering in the streets. She remembers nothing. She reaches a hotel. The mystery has begun.An old film reminds her of something. Does she know this hotel? Has she ever been there? Who are these twin men? The things which happen accidentally. Everything is connected. May be not. The confidence in strangers. People's deep darkness. The death ... Leer todo,15min,Theremin
443,--,['Jim Hanks'],"['David Baden', 'Dudley Christian']",,15min,Wish
444,"7,6",['J.P. Chan'],DESCONOCIDO,,9min,Beijing Haze
445,--,['Michael Costner'],['Michael Costner'],Scotty will do whatever it takes to win back the love of his life.,6min,Scotty and Maddy
446,--,['Martin Waltz'],['Martin Waltz'],"So he sat on, with closed eyes, and half believed himself with Alicja, though he knew he had but to open them again, and all would change to dull reality - the grass would be only rustling in the wind, and the pool rippling to the waving of the reeds.",20min,Alicja Wonderland
447,"7,2",['Mark Gutteridge'],"['Mark Gutteridge', 'Aidan Lean']",A woman and her uncommunicative neighbors closely monitor a new tenant's movements until they meet up via their intercom.,10min,Intercom
448,--,['Jeff Cassidy'],['Jeff Cassidy'],A short film about a father and daughter con artist team who cleverly deceive the unsuspecting patrons at a truckstop diner.,8min,Incident at a Truckstop Diner
449,"5,5",['Michael Curtis Johnson'],['Michael Curtis Johnson'],,23min,Flotsam
450,"6,9","['Mark Beynon', 'Chris Croucher']","['Mark Beynon', 'Chris Croucher']","Divided by the stunning and vast expanse of water that is London's River Thames, a young pair of shy beachcombers are united by their fixation with metal detecting in search of rare antiquities. They soon strike up a sweet and unique connection across the water and build up a language of signs and signals with which they are able communicate daily, but when one of the... Leer todo",10min,The Beachcombers
451,"6,7",['Jean-Marie Straub'],['Cesare Pavese'],Jean-Marie Straub's first film after the death of Danièlle Huillet is a love poem to her.,26min,Le genou d'Artémide
452,"7,0",['Ben Chace'],['Ben Chace'],"""3rd of July"" tells the story of two young Iraq war veterans, as they struggle to readjust to their lives in New York. Carter Ballard and Ted Shaw, men from different upbringings, different worlds within the same city, cross paths at the Veterans' Administration as they sort through disputes over their medical benefits. From there, we follow both men through strained ... Leer todo",20min,3rd of July
453,"6,6",['Andrea Gutsche'],"['Andrea Gutsche', 'Janelle Hutchinson']",A small-town waitress finds the courage to accept her true desires in this film about longing and loving - Loretta.,22min,Loving Loretta
454,"7,6","['Jeff McCutcheon', 'Melissa Osborne']","['Jeff McCutcheon', 'Melissa Osborne']","A happily married law student's decision explores the complexities of human interactions, the ambiguity of what is left unsaid, and the thin line between love and lust.",18min,Nothing
455,"7,5",['Rocky Jo'],['Rocky Jo'],"A young and adorable Korean girl, Hyroi, experiences what many people always remember - the ups and downs of falling for a first crush.",7min,My First Crush
456,"8,2","['Joshua Zamrycki', 'Wil Röttgen']","['Joe Ress', 'Phil Turner']",A street clown goes to extremes to protect the welfare of a young girl.,14min,Charlie
457,"9,0",['Leigh Ann Biety'],"['Leigh Ann Biety', 'Donal Finn']",A Season to Wither takes place in the rural countryside in a house that sits at the end of a dusty road on the top of a hill just outside a small town. A place that seemingly fell from the sky and dropped right in the middle of nowhere. The air is filled with an eeriness reminiscent of a tale from the Twilight zone. A large storm moves in threatening to destroy an alr... Leer todo,11min,A Season to Wither
458,"6,5",['Marian Crisan'],DESCONOCIDO,"It's Maxim's birthday. He's 8 years old. He lives together only with his mother in a village not so close to the big city. For his birthday, his mother will take him to Bucharest, to McDonald's. There, Maxim hopes to meet his father.",14min,Megatron
459,--,['David Franklin'],['Colin McKenna'],,13min,Anybody
460,--,['Przemek Pardyak'],DESCONOCIDO,,5min,The Last to Remember
461,--,['Eric Liston Grant'],['Eric Liston Grant'],"40 year-old Clara Klaar tells the story of her fight against leukemia, a year of unspeakable suffering illustrated by images of the Marathon des Sables, one of the most difficult foot races in the world. A gripping tale that reveals the strength, hope and determintation which we are capable of harnessing to overcome insurmountable odds.",26min,Run for Life
462,"7,5",['Marc Wiskemann'],DESCONOCIDO,,10min,Waiting for the Sky to Fall
463,--,['Hans Emanuel'],['Erin Falconer'],"When little girls are little girls, they dream of growing up, getting married, raising a beautiful family in a beautiful house...and then?",21min,Señora Soto
464,--,['Esther Johnson'],['Mehrdad Seyf'],"""Do you love me?"", ""Yes"", he said, and then... A colorful musical journey into the narrative of a woman's tangled past, with magical glimpses of her present world and hopes for a liberated future.",15min,Yalda
465,"8,0",['Diego Sanchidrián'],"['Pedro Pablo Picazo Pérez', 'Diego Sanchidrián']","Sometimes, mystifying bonds are set up between people. Bonds which overcome distance, oblivion and unawareness. And when those bonds are created, they can become what we need to survive.",20min,El hilo de oro
466,"7,1",['Erek Kühn'],['Stefan Petermann'],"Vincent grew up in a violent surrounding, his own family. After a new family feud Vincent decides to call the police but is taken to a youth center unintentionally. There Vincent beats up the director who touched him improvidently. It seems that violence looms large in Vincent's life. Then he meets Butterfly, a diffident young boy who collects butterflies to bear his ... Leer todo",16min,"Zitronenfalter, halt's Maul!"
467,"5,9",['Adam Lipsius'],['Adam Lipsius'],Thriller in which a man is accused of a crime he did not commit.,--,4° (Four Degrees)
468,--,['Eileen Byrne'],DESCONOCIDO,,--,La nuit passée
469,--,['Kevin Porter'],DESCONOCIDO,,9min,An American Standard
470,"6,9",['Jeff Warden'],['Jeff Warden'],,13min,Jack N Jill
471,--,['Stan Rodman'],['Stan Rodman'],"Two men, one a Mexican day laborer here illegally, the other a recently unemployed blue-collar worker hitchhiking to his relatives home in a small New Mexico town find themselves unexpectedly alone together after the pickup truck they are riding in breaks down in a remote area. The hitchhiker takes the opportunity to release his anger and frustration on the young Mexi... Leer todo",23min,Ira
472,--,['Marcus Sim'],['Marcus Sim'],"Rob Lee, a martial arts movie fanatic and lackadaisical husband, opens his front door one morning to find his idol, martial arts movie star, Ringo Lee. Flabbergasted at first, Rob soon finds that this seemingly dream come true is taking a dark turn when Ringo makes him a life altering offer.",13min,An Offer
473,--,['Peter Bolte'],"['Peter Bolte', 'Francesco Saviano']","Insecurity and tension muster as Kenneth LeComb, a down and out bartender is forced to work in the presence of Herbert Zelinger, a world-renowned and accomplished artist.",9min,Veneer
474,--,['Eric Wobma'],['Eric Wobma'],A surreal and poetic quest by a man who is about to meet more than he has bargained for.,12min,"Mixed Bag, or What's in a Dream..."
475,"7,6",['Pascal Forney'],"['Pascal Forney', 'Laurent Gachoud']","Once upon a time, in a lonely valley forgotten by all, lived Vincent the magician. Every Evening, in a local cabaret, he presents his show ""The Woman Cut In Half"". As he ignores the necessity of a trick, he transforms the neighborhood in a graveyard. One night, his idol, the famous Blackstone, appears to Vincent to reveal him the trick. On the way to glory and fame?",22min,"Vincent, le magnifique"
476,"8,1",['Mauricio Chernovetzky'],"['Mauricio Chernovetzky', 'Euripides']","Euripides' Greek tragedy, ""The Trojan Women"" is played out on the edge of a rocky desolate Mexican border town in this poetic reinterpretation by Director Mauricio Chernovetzky.",27min,Cassandra
477,--,['Valerie Champagne'],['Valerie Champagne'],Ten year-old Tanya tries to save her dying father by bargaining with a demon in her bathroom mirror.,14min,Mirror Mirror
478,--,['Chip Street'],['Skot Christopherson'],"Bill Selvitella is a happily married middle-aged man who learns, quite without warning, that he has mere weeks to live. Determined to face fate bravely and responsibly, he makes his arrangements, and then throws himself a funeral party... where he meets someone who challenges his conception of how he's lived his life thus far, and how he should spend his final days.",14min,Arrangements
479,"7,4",['Alex Holmes'],['Alex Holmes'],"Ali, a spirited 8-year-old boy, lives in a detention centre with his mother and little sister, Fatima. The grim reality of their life is taking its toll; Fatima just sits staring through the fence, and his mother's only comfort is the small red jumper she knits over and over again. Ali tries to make the best of life - playing ball with the other kids and drawing pictu... Leer todo",15min,Ali & the Ball
480,--,['Joey Piscopo'],['Joey Piscopo'],,9min,Love
481,--,['Robert Cedric Bowden'],['Robert Cedric Bowden'],A filmmaker and his son set up to shoot a spectacular environment. The father leaves his son alone with the camera to get something from his car and the boy takes advantage of the moment and looks through the lens of the camera and sees his own dream as a filmmaker on his own movie set.,2min,Through the Lens
482,"8,0","['Santiago Bou Grasso', 'Patricio Plaza']",['Patricio Plaza'],"Un hombre realiza su trayecto habitual hacia el trabajo, inmerso en un sistema en el cual el uso de las personas como objetos es algo cotidiano.",7min,El empleo
483,--,['Manrico Gammarota'],DESCONOCIDO,"Un incontro casuale di Anime al capolinea, decise a farla finita sul Monte Orlando a Gaeta. Il ritrovarsi, paradossale, di destini incrociati nellultimo atto fa fiorire unaltra possibilità. Un pranzo luculliano celebra il gusto del vivere. la tragedia si trasforma in commedia, la solitudine in amicizia e la vita si rivela un campo pieno di nuovi inizi.",25min,Facciamola finita
484,--,['Peter Yunho Chung'],['Gary Chan'],,10min,"Name, Age, Sex"
485,--,['Jaap Hermans'],DESCONOCIDO,"Spring Love was performed to establish a link between Persian culture and the culture of the host country. Spring Love celebrates the dynamic tradition of Nowruz through the story of three generations experiencing love at first sight. While the story is fiction, many of the details are based on my own childhood memories, and some are based on memories of my immigrant ... Leer todo",3min,Springlove
486,--,['Stewart Thorndike'],['Stewart Thorndike'],"13-year-old Tess wants nothing more than to escape the dilapidated house she shares with her sick grandmother, Nana so she does something drastic to get the attention of her real estate agent mother.",11min,Tess and Nana
487,--,['Francesco Gastel'],['Francesco Gastel'],"Italy, 1918. A woman sees her son coming home from the battlefield after two long years. But he is no longer the same person.",13min,Tre viaggi
488,--,['Roman Bostick'],"['Roman Bostick', 'Evyh Cerhus', 'Cassie Ross Green']","A small apartment in Los Angeles, two lovers MICHAEL and ISABEL discuss the crazy day they met. Their recollection of specific events surrounding that day create distance in their otherwise seemingly loving relationship. Michael fixes restaurant computers as his day job but yearns for his passion - to secure a venue to exhibit his art. Visually, Michael's inner sub-co... Leer todo",30min,China Lake
489,--,['Sarah König'],['Sarah König'],,17min,Engelskind
490,"7,4",DESCONOCIDO,['Carla B. Guttmann'],,--,Crossing Paths
491,"6,3",['Chiwetel Ejiofor'],"['Chiwetel Ejiofor', 'Yusuf Pirhasan']",A young boy watches a televised fight in a crowded bar; a masked man versus the peoples champion. Could the man in the mask be James absent father returning as a hero,15min,Slapper
492,"4,2",['Stephane Lionardo'],['Stephane Lionardo'],"Chris Adam is a dog groomer and one of his biggest client is monsieur Marcus who think that his dog Aaron is a bit like the defended fruit of Eden's Garden. But listening too much to Eve, a young and too attractive woman, Chris will soon find himself crying his lost paradise sat on a dirty bathroom seat.",26min,Adam + Eve
493,--,['David Temple'],['David Temple'],"Pet Psychologist, Dr. Vincent Nash, dispenses a message that is part Zen; part Self-Help. His practice is home to a circle of eccentric characters who loosely represent the four stages of love: brand new, comfortable, involved-but-uncommitted, and bored. Tim Ware (Recount, The List) and Brian Durkin (Cold Case, Deja Vu) star as father and son who have different agend... Leer todo",21min,Poke the Sleeping Bear
494,"6,1",['Justine Stokes'],['Luis Fernando Midence'],A man falls in love with both a man and a woman at the same time. What will happen when they find him out?,10min,Affinity
495,--,['Cesario Tio'],['Stephanie Alison Walker'],"Out of gas and stranded on a deserted road, Billie and her recently widowed elderly mother are forced to confront the overwhelming divide that has separated them for years.",12min,Back Roads
496,"7,6",['Edward Tyndall'],['Edward Tyndall'],Sadie's Waltz is a haunting story of grief and transcendence. A young woman trapped in a home destroyed by tragedy suffers her father's tyrannical abuse until a strange vision inspired by a comic book advertisement shows her an unexpected path to liberation. Sadie's Waltz boldly dramatizes the subconscious in a film where the rational and the irrational collide in a s... Leer todo,15min,Sadie's Waltz
497,"8,4",['Inon Shampanier'],['Inon Shampanier'],"Like balls on a pool table, the lives of strangers collide and change course; 8 BALL is a philosophical suspense drama about order in the chaos of life, and the need for human connection. The film follows the intertwining stories of 3 lonely characters: an orphan child searching for his mother, an ex-con attempting to reunite with his daughter, and a pool hustler forc... Leer todo",24min,8 Ball
498,"7,8","['Susanne Culver', 'Ryken Zane']",['Brian Neil Hoff'],"Richard Watson, is a successful clockmaker who is on his way to Las Vegas with his bride-to-be... a certain Miss Lulu Sinclair. While crossing the hot California desert, his new Cadillac stalls and rolls to a stop. In short order, the situation takes a sinister turn when the hot and frustrated couple are stranded on lonely highway forcing them to come upon a run-down ... Leer todo",--,Motel 5150
499,"5,4",['Sybil H. Mair'],['Sybil H. Mair'],"In the early morning hours, a chef struggles to write the letter that could overturn his ordered life forever.",14min,The Chef's Letter
500,"6,4",['Jason Williams'],DESCONOCIDO,Serial killer Vincent is a man who has a skewed concept of love and emotional connection. Here he makes his confession to a police detective Emily Cross.,15min,Victim
501,--,['Christophe Fustini'],['Christophe Fustini'],A young girl has fallen in love with an already married man... who is himself having an affair with a young student. But are these both stories really so different?,21min,Tutto o niente
502,"6,9",['Sonja Phillips'],['Sonja Phillips'],"'The Pond' explores the relationship between Maisie, Tom and Joe, three children who regularly visit a pond in the village on their way home from school. For Maisie, the Pond is a place to escape her troubled home life and explore her strengthening allure to the boys, it is the place where she holds all the power over them. What she doesn't know is that the pond also ... Leer todo",16min,The Pond
503,--,['Pat Mills'],['Pat Mills'],"At school it's the unrelenting bullies, and at home it's her mother's ramblings about dietary restriction that incessantly torment Marjorie. The fridge offers unexpected comfort - but it has little to do with food.",13min,Marjorie
504,"6,5",['Dipk G.N. Nanglia'],['Dipk G.N. Nanglia'],,12min,The Opportunist
505,--,['Alejandro Durán'],"['Alejandro Durán', 'Pablo Ochoa', 'Gibrán Portela']",Ana is in deep coma. But her boyfriend Julio never really loses hope that she will wake up.,28min,Impasse (Días distendidos)
506,"8,2",['Ismail Sahin'],['Ismail Sahin'],"At the age of one, Hakim is found at the side of his dead mother by an old man who sends him to a children's village for AIDS orphans. There he meets Aga, a kindhearted educator whose stories captivate the kids and allows them to live life in the now.",15min,Hakim
507,--,['Ben Thompson'],['Ben Thompson'],"Felix starts a new job at the local roller rink. Judy befriends him and makes him feel welcome by teaching him how to skate much to the dismay of Francine, who wants to make his time on the job miserable.",22min,Super Skate
508,"7,2",['William Branden Blinn'],['William Branden Blinn'],"Lawrence Jefferies and Hugh Greerey have just met. They both have had girlfriends in the past...they're both straight. Thirteen or so minutes later, however, something's happened and things have changed.",14min,Thirteen or So Minutes
509,"6,2","['Kyle Garrett', 'George Seamer']",['George Seamer'],"The bleak outskirts of San Francisco act as the backdrop for this view into a jaded generation. Floating through their mid-twenties, four strangers interweave on one fateful day none of them are prepared for. Chad is a telemarketer, obsessed with living up to his idols: Bill Gates, Alexander the Great - his father - but he is the constant butt of his supervisor's mock... Leer todo",27min,Inertia
510,"8,2",['Marya Mazor'],['Jose Rivera'],"The only thing we know for certain in The Winged Man is that Daisi, a Latina high school girl, is pregnant. Is the conception the son of a mystical ""Winged Man"", as Daisi insists? Or the result of a one-night stand, as the girl's mother claims?",15min,The Winged Man
511,"7,2","['Peter Jackson', 'Neill Blomkamp']",['Peter Jackson'],Two young soldiers prepare for battle during World War I.,15min,Crossing the Line
512,"8,3",['Francesco Sperandeo'],"['Moez Ben Hassen', 'Nizaar Kaabi', 'Francesco Sperandeo']","A Tunisian man of humble origins, Mehdi's memories of his youth are dominated by the heavy wooden door at his beloved's father's house, closing in his face, symbolizing his separation from her. His heart scarred, Mehdi went to Europe to try and make something of himself. Returning, older, wiser and wealthier, he decides to achieve closure on his traumatic past by conf... Leer todo",15min,Bab al samah
513,--,['Ada Vaughan'],['Ada Vaughan'],"An abandoned mother spends all her time in the park by herself. But her daughter watches her closely. If only the mother could hear her daughter's words, or if they could talk to one another, perhaps things would be different.",--,If Only...
514,"8,2",['Jesse Grce'],"['Jeremy Fultz', 'Jesse Grce', 'Reko Moreno']",Justice closes in on a ruthless assassin for hire.,7min,Noir
515,"6,9",['Ajae Clearway'],DESCONOCIDO,"A classic coming-of-age story takes a powerful turn when Sean's struggle to understand who he really is explodes the lie that goes to the core of his being, his relationship with his father, and his future as a man.",13min,Clouded
516,"7,0",['James Nicholas Fuller'],['James Nicholas Fuller'],A butcher in a sleepy rural town has his day turned upside down after a visit from a mysterious and beautiful Stranger.,6min,Seared
517,"5,3",['Francisco Botelho'],['Francisco Botelho'],,25min,Fevereiro
518,"5,5",['João Figueiras'],['João Figueiras'],,24min,Paisagem Urbana com Rapariga e Avião
519,"8,1",['Declan Cassidy'],['Declan Cassidy'],The well ordered world of a security man in an electronics store is disturbed and a young shop assistant is bemused when a homeless man arrives to make a purchase.,4min,Whatever Turns You On
520,--,['Arlene Bogna'],"['Arlene Bogna', 'Julie Nicholson', 'Julie Nicholson']",,1min,Canvas
521,--,['Christopher Gegax'],['Julie Meyer'],A nun's chance encounter with a troubled young woman takes an unexpected turn when it's learned they share a mutual acquaintance.,9min,Forgotten
522,--,"['Enrique Gandarillas', 'Eduardo Soler']",['Enrique Gandarillas'],John Carlos is a young marine that goes to the Irak war. His mother compels him to make a promises that he'll come back. Finally he'll accomplish his promises in a tragic way.,14min,Prométame que va a volver
523,--,['Chris Rusch'],['Chris Rusch'],A day in the life of a young actress at a local theatre.,15min,Closing Night
524,"7,2",['Rúnar Rúnarsson'],['Rúnar Rúnarsson'],"2 Birds takes place during one bright summer night and follows a group of young teenagers on a journey from innocence to adulthood. The main character is a timid boy who has a typical schoolboy crush on a girl his age, who happens to be a friend of his mate.",15min,Smáfuglar
525,"5,1",['Vincent Biron'],['Annie Desrochers'],"-Olivier, a young boy who lives in the countryside, sees his father doing something he will never forget.",17min,Au bout du rang
526,"7,1",['T.J. Volgare'],['T.J. Volgare'],A brother and sister bonded together as children through a barbaric rite of passage must transcend their violent heritage or fall victim to its vicious cycle.,27min,The Abattoir
527,--,['John Alsop'],['John Alsop'],A teacher misbehaves to save his last two pupils.,16min,He. She. It.
528,--,['Alana Farrah Roa'],['Alana Farrah Roa'],,11min,Miradas urgentes
529,"7,0",['Alen Drljevic'],['Alen Drljevic'],"The director's fascination is the parallel world which exists behind the doors of big shopping malls. It is as if behind those doors everyday human problems do not exist. Yet, as we spend money, we all have to go back, through the same door, back to reality.",15min,Soping
530,--,['Matthew Petock'],['Matthew Petock'],A young cop befriends a struggling teen in the South.,18min,Jackson Ward
531,--,['Vitaliy Potrukh'],['Leonid Cherevatenko'],,--,Zakon
532,"8,7",['Eric Poydar'],"['Brett Portanova', 'Eric Poydar']",An out-of-work actor at the end of his rope has just gone to his last audition.,33min,Larry (the Actor)
533,"6,7",['Marie-Baptiste Roches'],['Marie-Baptiste Roches'],"Desperate summer holidays in the detached houses of a small town, where hot sun and boredom are legion, really get on the nerves of Solène, 16 years old teenage. Therefore, when 40 years old Antoine turns up, with his big motorcar, his leather jacket, obviously, Solène becomes troubled...",23min,Une sauterelle dans le jardin
534,"7,8",['Krzysztof Pietroszek'],['Krzysztof Pietroszek'],,--,Eve
535,"5,8",['Brigitte Sy'],['Brigitte Sy'],"A film director is investigated by the police for giving money to her imprisoned friend, whom she loves.",31min,L'endroit idéal
536,"8,5",['Ryan Pearce'],['Ryan Pearce'],,--,Draw
537,"6,0",['Paz Fábrega'],['Paz Fábrega'],,10min,Cuilos
538,"6,7",['Daniel Ragussis'],['Daniel Ragussis'],"In 1914, Fritz Haber is Germany's greatest chemist. His Nobel prize-winning synthetic fertilizers have saved the world from mass starvation. But as World War I breaks out across Europe, slaughtering millions of young soldiers, the desperate German military asks Haber to invent an entirely new kind of weapon. Already having sacrificed his Jewish identity and his wife's... Leer todo",34min,Haber
539,--,['Rob Curry'],['Anthony Fletcher'],"One tempestuous couple see how far they can push their relationship in a tale of love, death and ice cream.",7min,Domestics
540,"7,0",['Karim Fanous'],['Adam Mourad'],"Hadi is a modest Cairo bathroom attendant, quietly washing away his future. An unlikely visit to a seedy cabaret finds him cast under the spell of Nour, a superstitious belly dancer. While mustering up the will to approach her, he learns that, in life, every non-action has a non-reaction.",25min,"Clean Hands, Dirty Soap"
541,--,['Teppei Nakamura'],['Teppei Nakamura'],"A man who lost his family, a woman dependent on medication, a girl who cannot communicate with those around her... 5 different people with 5 different reasons struggling to survive. They are all trying to find what it means to live - and must face how they can stop their suffering.",28min,Day's Eye
542,"5,4",['Richard Robinson'],['Richard Robinson'],During WWI a Soldier faced with certain death makes a tough choice when another soldier gets sent in his place.,15min,Trenches
543,"7,3",['Mark Rogers'],['John S. Wells'],"Revolves around a day in the life of a homeless man in Washington, D.C. Through a series of encounters we find that the homeless guy has a heart of gold and is actually being forced to panhandle for a couple of low level thugs. As the day progresses the homeless man is reminded of what it takes in life to do the right thing. Invisible Man is a heartwarming tale of wha... Leer todo",35min,Invisible Man
544,--,['Björn Melhus'],['Björn Melhus'],,30min,The Meadow
545,"8,1",['Carlos Alfayate'],['Carlos Alfayate'],,30min,Destination: Ireland
546,"6,4",['David Victori'],['David Victori'],A man sees a woman who is beaten by her husband in the car. Decides to follow the car.,11min,Reacción
