682,--,['Howard Lukk'],['Russell Hughart'],"Iran and the United States are at each other's throats. White House officials have only 10 minutes to come up with a diplomatic solution to the Iran problem. If they fail, mankind may be doomed.",--,The Tower
683,7.8,['Martin Villeneuve'],['Martin Villeneuve'],"In this third opus, Martin Villeneuve reprises the role of Imelda, his 90 y/o grandmother, opposite Ginette Reno. The filmmaker envisions how his two grandmothers, lifelong adversaries, might have made peace before the end.",--,Imelda 3: Simone
684,--,['Danny McConnell'],['Danny McConnell'],"This is the story of tradition. Five friends get together every year, around Christmas, to exchange Secret Santa presents. This year, the presents go missing and it is up to you to figure out which one of the friends took them.",--,The Christmas Presents
685,--,['Robb Rokk'],['Robb Rokk'],A world famous artist has painted himself into a corner.,--,Art Snobbery
686,--,['Valerie Schwartfigure'],['Valerie Schwartfigure'],,--,Just for Attention
687,--,['Rima Mori'],DESCONOCIDO,,--,Wintergirl
688,--,['Alex Craig'],['Alex Craig'],"Seth Dodson, along with the rest of the world know the exact date of their ultimate demise. Just not how or at what time. We follow Seth on his death date as paranoia builds. Until something unlikely happens.",--,The Imminent Expiration of Seth Dodson
689,--,['Christian Lora'],['Christian Lora'],"In Cuba 2021, Arnold Palmer, a man of the future, travels back in time to Cuba in the year 2021 to avenge his father's death at the hands of Fidel Castro. Will he achieve his objective? Time will tell.",--,Cuba 2021
690,--,['Flaminia Graziadei'],['Laura Swain'],Two embittered sisters war over the belongings of their dead mother and are willing to do whatever it takes to get what they think is rightfully theirs.,--,Crazy Bitch Blues
691,--,['Allen Parker'],['Allen Parker'],,--,Rock Bottom
692,--,['Jordan Sarf'],"['Jordan Sarf', 'Adam M. Tuller']","Ever wonder what happened to these lovable characters? Well, here's their story.",--,McFired
693,7.1,['John Addis'],['John Addis'],Uloaku works the graveyard shift at a remote service station and is bored out of her mind. Fortunately a chance encounter with a suspicious stranger will soon fix that.,--,Lucky Break
694,8.2,['Kris Krainock'],['Kris Krainock'],"A Roman Everyman discovers a violently ill intruder on his sofa after returning from the market. Begrudgingly, the Everyman must nurse this stranger back to health before he can unearth the ominous man's true purpose for being there.",--,Bizzarro e Fantastico
695,8.1,['Miles Jay'],DESCONOCIDO,"Starting with a high-speed taxi sequence, Daniel is constantly recognized as James Bond by surprised locals as he hunts down his missing passport.",--,Daniel Craig vs James Bond
696,--,['D.A. Franklin'],['Zach Olgine'],"This is why you should reconsider letting your cousin fix the furnace. Don't be Cheap and end up with.. ""The Professionals""",--,The Professionals - Part 2
697,--,['Philan McLane'],['Philan McLane'],,--,Diverse Suite
698,--,DESCONOCIDO,['Martha Magruder'],,--,Hayseeds
699,--,['Josh Fapp'],['Josh Fapp'],,--,Grublandia
700,--,['Skyler Barrett'],['Sharon Strange'],"""The Interview"" is a short that picks up the continuing story of Crystal, from ""Crystal the Webseries"". Our heroine once again finds herself in a how-did-I-get-here moment. She must navigate, anticipate, and be quick on her feet to successfully land this dream job. ""The Interview"" is inspired by those seeking employment in today's climate, where opportunities feel lim... Read all",--,Crystal the Webseries: The Interview
701,--,['Mike Luciano'],['Brianna Lee'],"It has been twenty five years since old high school friends Tim McGallister and Laura Koch have seen each other. Now a surgeon, Laura walks down the old bike path in her hometown on her lunch break. She runs into Tim, whose out for his afternoon jog. The two share a laugh and try to remember the last time they saw each other. Soon, they begin to reminisce about that o... Read all",--,Old Friends
702,--,['Trace Englehart'],['Trace Englehart'],"When a group of teenagers try to film a documentary in hopes of landing top prize at their local film festival, they come across an aspiring, but also incompetent, stuntman who goes by the name Dick Ryder. They cover a day in the life of the loner seeking thrills.",--,Dick Ryder: Stuntman Extraordinaire
703,6.5,DESCONOCIDO,"['Benny Safdie', 'Josh Safdie', 'Adam Sandler']",Rod Goldman and Al Silverman are street performers who work the tourist scene of Times Square. Goldman gets no respect and Silverman is the first one to make sure of that.,--,Goldman v Silverman
704,--,['Nathan Mountain'],['Nathan Mountain'],"Betrayal, love, hatred, lies, all packed into 3 minutes of pure comedic drama. 'Modern Lifetime' is a Soap Opera spoof that in no way takes itself seriously, and holds up a mirror to the genre to bring to light some of the ridiculous stories they come up with.",--,Modern Lifetime
705,--,['Jamie Delaney'],"['Jamie Delaney', 'Ed Wise', 'Liam Reilly']","A series of short films explore how a group of acting students approach the craft, chronicling their experiences with their peers and teacher Russ, as they attempt to give themselves over to his processes.",--,Class
706,--,['Barry Nerling'],['Barry Nerling'],A man seeks therapy after losing a string of jobs including porn and a comic book store for falling asleep. The sessions soon reveal the man has Narcolepsy but they also trigger his memory and his questionable past.,--,Therapy
707,--,['Sarah Gartner'],['Sarah Mease'],"After an outcast catholic school girl gets her erotic book taken away by her theology teacher, she tries to steal it back.",--,The Holy Word
708,--,DESCONOCIDO,"['Josh Bonzheim', 'Grant Pichla']","Runaway teen, Maddy, is late to catch the last train out of town when she runs into her old babysitter, Mrs. Sanders. After smothering Maddy with hugs, Mrs. Sanders begins to question the motives of the happy-go-lucky girl she used to know.",--,#Trapped
709,--,['Carlo Barbalucca'],"['Carlo Barbalucca', 'Sabina Di Marco', 'Francesco Gallo']",,--,Storie di precaria follia
710,5.6,['Valérie Leroy'],['Valérie Leroy'],A young girl who has recently moved from Finland to France tries to find new friends to bond with.,--,Teen Horses
711,--,['Brian Cutter'],['Brian Cutter'],"Clown Shoe, an inept supervillain, discovers his young superhero nemesis' secret identity and decides to go after her suburban middle-aged parents. But what happens when Brian, a theoretical physicist, and Michelle, a yoga instructor, turn out to be more than what he bargained for? A dark slapstick comedy.",--,Secret
712,--,['Daisy Hobbs'],['Daisy Hobbs'],,--,Parent of the Year: Comedy Sketch
713,--,['Wyatt Steacy'],['Wyatt Steacy'],"Space Weed is a proof of concept short film about a young stoner, Seth, who wakes ups in his back yard after an asteroid crash lands there. Shortly after his best friend, Richie, arrives on the scene and Seth tries to explain to him that this asteroid is no ordinary asteroid. In fact, the smoke coming off of it gives you a high like no other. A frantic Seth pleads for... Read all",--,Space Weed
714,--,['Lloyd Briggs'],"['Joseph Arnone', 'Lloyd Briggs']","A dead girl, a kilo of cocaine, and two idiots. Can this day get any worse? You're right it does.",--,Dead Girl (II)
715,--,['Brian Pollock'],['Brian Pollock'],"Winner of the 2021 NYLIFF Audience Choice award for Best Short film, Dating blind brings you inside of a restaurant a nervous man awaits his blind date not realizing what trouble the waiter will cause as he attempts to help.",--,Dating Blind
716,--,['Clifford Milner'],['Angus Easener'],"After what seemed like a great date with a girl called Sophie, Adam tells his flatmates there won't be a second. As he recounts his time with Sophie, it becomes clear that she was a woman with a very British problem.",--,Trouble Brewing
717,--,DESCONOCIDO,DESCONOCIDO,,--,German Animash
718,--,['Kahksha Khurana'],['Kahksha Khurana'],An eccentric tv host tries to sell a new and totally useless product to his women only audience.,--,#NotAnAd
719,--,['Sheldon Bailey'],"['Sheldon Bailey', 'David Anthony Butler']","Broderick, Andrew, and Marcus are having success in their careers but not so much success in having a ""real"" romantic relationship in the hard to navigate dating scene in Los Angeles. They decide to have a boy's night sleepover where they have a candid conversation and make dating profiles for each other, then Andrew has a dream.",--,Adulting
720,--,['Sanjib Datta'],['Sanjib Datta'],"Although married, Kuheli is in love with Raghu. Their affair is being put on a test when a local goon misbehaved with Kuheli and Raghu sets for revenge.",--,Paramour
721,--,['Adam Desautels'],['Adam Desautels'],Follow a musician on his journey when he moves to New York City to pursue his dreams.,--,Dreams of a Sleepless City
722,--,['Mushad Moore'],['Mushad Moore'],,--,BET
723,--,['Mac Brydon'],['Jane Cortney'],Two brothers at odds bicycle across New York City in hopes of locating a beloved family heirloom.,--,Brando's Spoon
724,--,['Symone Baptiste'],"['Brodie Reed', 'Ellington Wells']",A struggling Black college graduate considers his options after receiving a reparations check totaling sixteen thousand dollars.,--,Sixteen Thousand Dollars
725,--,['Violetta Anna Licari'],['Violetta Anna Licari'],Three old Yentas try to find a husband for a resistant niece while three old Jewish men try to find a wife for a resistant Landscaper. The resisters cross paths unexpectedly that lead them to the alter.,--,Table Talk
726,--,['Al Golledge'],"['Stephanie Francis', 'Al Golledge']",Three couples rush through Friday to enjoy a weekend away snow skiing and overcome personal obstacles in each of their relationships.,--,Somebody Else
727,--,['Christopher Leoni'],"['Andrew Boszhardt', 'Christopher Leoni']","A group of cold-calling friends hustle day and night to book their best friend, Whitney, one night stands - only to find out that he's secretly searching for a soulmate.",--,Pitch Boys
728,--,['Zane Barber'],['Zane Barber'],A Victorian-Era gentleman ghost aides a modern college student in getting a date.,--,Victorians' Touch
729,--,['Kevin Spink'],['Kevin Spink'],A lonely man opens his door to a stray cat.,--,Un Homme et un Chat
730,7.2,['Alexandre Poulichot'],"['Alexandre Poulichot', 'Vivien Saddier']",,--,Bonne mort
731,--,DESCONOCIDO,DESCONOCIDO,DESCONOCIDO,--,Error nombre para la pelicula con id: tt11639734
732,--,['Jan Wunderbar'],"['Jan Wunderbar', 'Silvan de Cavalier']",'Beftekkel' is a short story about slick NGO madmen trying to make a fast buck by teaching the intricacies of Dutch conversation to foreigners in a war-torn country.,--,Beftekkel
733,--,['Paris Burris'],['Paris Burris'],A man finds himself in trouble after he goes on a journey to a sex shop to rekindle the fire in his marriage.,--,Potion for Passion
734,--,['Leanne Noelle Smith'],['Victoria Kucher'],"Given a gift of a dracaena, a woman self-destructs as she fails to keep the plant alive and her ego in check over the span of 10 minutes.",--,Green
735,8.6,['Sergey A.'],['Sergey A.'],"Night city. The car. People go to it. They are dishonest, and they bring with them something completely inappropriate.",--,Crime story
736,--,['Joanna Saul'],['Regina Efendieva'],"Piper can vanquish demons, but can she conquer her fear of showing the world her true self?",--,Social Caterpillar
737,--,['Terence Digan'],"['Terence Digan', 'Christy St. John']",A young woman goes on a wild adventure after she accidentally locks herself out of her apartment on the way to a job interview.,--,A Funny Thing Happened on the Way to the Interview
738,--,['Sergey Akimov'],['Evgeniya Orudzheva'],,--,One morning on 42 street
739,--,['Weatherly Becker-Gottlieb'],"['Weatherly Becker-Gottlieb', 'Pete Buchbauer']",,--,Bad Sugar High
740,--,['Jared Snow'],['Jared Snow'],"After meeting on social media LA comedian Jay Snow is in the blissful, budding stage of dating Cali Rose but hides from her his chronic illness. While on a date, his condition is severely triggered forcing Snow to confront his fears and come clean to Cali or risk losing their newfound romance.",--,Flawd
741,--,['Robert Giordano'],"['Scott Cleverdon', 'Nuria Rivera']",,--,Dirty Work
742,--,['Justin Janoson'],['Justin Janoson'],"Cassie, 16 is conflicted when her best friend Tyler, 15 comes home after being away for a long period of time. As Tyler leaves, he says the words ""I love you."" Cassie acts very awkward and turns to her sister Sophie for guidance. After telling Cassie the story of how their parents met, Cassie runs to meet Tyler. Cassie tells Tyler that she loves him, and the two kiss,... Read all",--,A Typical First I Love You
743,--,['Jack McCafferty'],"['Jack McCafferty', 'JP Vanier']","After his subject tosses him to the side, a disembodied narrator searches to find a new person to narrate.",--,Loose Narrative
744,--,['Ben Schwartz'],"['Amos Karlsen', 'Ben Schwartz', 'Jonah Wiener-Brodkey']",,--,Separation Anxiety
745,--,['Dianne Aguilar'],"['Dianne Aguilar', 'Leanne Noelle Smith']",Ed and Jane are a seemingly dull couple with a surprising secret they keep in their closets. Will the world be able to handle what they've got hidden behind closed doors?,--,Pineapple
746,--,['Jason A. White'],['Jason A. White'],"When a hard-hearted hit woman falls for her suicidal mark, she discovers that having it all may cause collateral damage.",--,The Hit
747,--,['Vincent Heneine'],"['Yoli Fuller', 'Vincent Heneine']",,--,Loup
748,7.0,['David Pujol'],"['Miguel García Navarrete', 'David Pujol']",,--,El mismo día a la misma hora
749,4.9,DESCONOCIDO,"['Swaylee Loughnane', 'Lee Westwick']","Two couples plan a big night out for Karen's 30th Birthday However one thing after the other gets in the way, making them wonder if it would just be easier to stay in and enjoy each others company or would it?",--,What Night Out?
750,--,['Shannon McDonough'],"['Maggie Cassella', 'Katie Ford', 'Shannon McDonough']","Maggie Mysteries is a parody of the international TV hit Murdoch Mysteries. In Maggie Mysteries, Maggie is the first woman and newest detective on the constabulary facing all of the challenges of being a super smart butch in a dress in 1910. She works for a homophobic sexist boss but in the end, Maggie always catches the criminal and gets the girl.",--,Maggie Mysteries
751,--,['Gina Nemo'],['Gina Nemo'],The cast for a low budget film is left in a strange location for a method acting exercise before the real film shoots. A few actors want to make it feel like they are really living in the Wild West and things go terribly wrong.,--,Dustslicker
752,--,['Autumn Palen'],['Autumn Palen'],,--,Eating Lisa
753,--,['Mykee Morettini'],['Mykee Morettini'],"Lars and Tina, a constantly bickering Generation X ""slacker"" couple embark on an absurd journey when they discover they ran out of rolling papers (and money) when attempting to smoke weed.",--,Lars and Tina's Pretty Dope Day
754,--,['Manda Owen'],"['Jennifer Coburn', 'Cory Lynn Hammond']","When Jennifer was little, Woody Allen came to her elementary school to pick kids to be in one of his movies. He didn't pick her. Now, years later, she catches the eye of bigshot movie director Cameron Crowe, whose casting director Gail is auditioning women to play bitter divorcees for his latest film. Desperate for a another shot at fame, Jennifer crash diets, squeeze... Read all",--,Never Famous
755,--,['Gerardo Chierchia'],['David Black'],"Two homeless men discuss life, love and politics. A unique comedy filled with deep insights and pathos. Starring David Black and Tim Possible. Directed by Gerardo Chierchia.",--,DERROliction of Duty
756,--,['Bradley T. Miller'],DESCONOCIDO,,--,"A Blonde, A Brunette and A Redhead"
757,8.9,['Alejandro Montoya Marín'],['Alejandro Montoya Marín'],"After getting caught smoking in public, two stoners must convince a grieving cop and his partner not to arrest them.",--,Perps
758,--,['Phil Good'],"['Jim Faircloth', 'Phil Good', 'Alex Weinle']",An absurd black comedy unbelievably based on a true story of Victorian occult murder with a hint of spiritualism,--,Copycats
759,--,['Paul Henry'],DESCONOCIDO,A struggling basketball coach tries to rally his team towards victory in their last game of the season with a grand and risky speech.,--,The Speech
760,--,DESCONOCIDO,"['Jordan Jackson', 'Myron Jewell', 'Puncho Villashio']","Living for today can be very dangerous if it jeopardizes your tomorrow. Take a ride with Pookie and Dookie as they scam their way through life. In search of a life they're not built for, watch the bumbling duo as they attempt to navigate staying alive. Some people are so sad you just have to laugh.",--,Skammerz
761,--,['John Roche'],"['Daniel Arnold', 'John Roche', 'Bryan Wynn Sutton']",Two radical environmentalists hatch a plan to kidnap a political podcaster.,--,The Only Competent Person in This Entire Country
762,--,['Jonathan Waller'],['Jonathan Waller'],"Frank is always sat on the sofa ready to masturbate whenever his wife Diane isn't around. Diane does everything for him, turning a blind eye to his pass times. When Diane is kidnapped, Frank has to get off his arse to get her back.",--,Paradise
763,6.2,['Julia Kennelly'],['Julia Kennelly'],A widow goes to a dominatrix class.,--,Marcy Learns Something New
764,5.8,['Morgane Dziurla-Petit'],['Morgane Dziurla-Petit'],"Sixty-year-old Sally longs for love and happiness. Lately, her search has been complicated by the fact that she resembles the current American president. One man's crazy assault on the world is a lonely woman's burden.",--,Grab Them
765,--,['Enrique Suarez'],['Nathaniel Bryan'],"A young teen, Daniel, decides to come out to his traditional Latino family.",--,Are You Coming Out?
766,--,['Lewi Thute'],DESCONOCIDO,"After an infamous robbery case, Detective Neus is given a new case that involves a mysterious kidnapping. With the help of his new apprentice, Neus plans on solving this special case.",--,Detective Neus: The Mysterious Case of Klaus
767,--,['Chase Otis'],['Chase Otis'],"Denny, egotistical in the Game of Thrones realm, faces off a seemingly odd foe in a park.",--,Mad Libs 2
768,--,['Kayven Kaplan'],DESCONOCIDO,The thoughts and opinions of a video gamer and filmmaker as he tries to make a career on YouTube.,--,Player One
769,--,['Mika Simmons'],['Mika Simmons'],"With the new craze for stolen-on-demand requests at its height, Bonny turns her professional eye to a stakeout for the latest batch being delivered. But when Billy, an uninvited work acquaintance appears, it's a battle of perseverance as they await the news at sunrise.",--,Breach
770,9.4,['Viktor Ivanov'],['Riccardo Romano'],"Forced by the parents to be married, a young couple in Paris discover things about themselves as they mature through their romance together.",--,Vuja De
771,--,['Julia Christgau'],['Carin Metzger'],"A parody of Simon and Garfunkel's ""America"". The song follows a happy couple while they fall apart trying to decide what to get for dinner at the grocery store.",--,American Shoppers
772,--,['Kyle Helgren'],['Kyle Helgren'],An epic battle to the death ensues when two co-workers argue about which type of M&M is better.,--,Light and Shadow
773,--,DESCONOCIDO,"['Gérald Massé', 'Véronique Mériadec']","Inch'Allah Auntie Danielle unravels a connection between a tired and embittered farmer and a group of young delinquents. Their encounter, through a shift in the balance of power, turns into a surprising, funny and moving journey.",--,Inch'Allah Tatie Danielle
774,7.9,['Rich Varville'],DESCONOCIDO,"When a young man takes his boyfriend to his conservative family's gender reveal, their relationship is tested by both the familial expectations and the truth of being who they are.",--,Reveal
775,--,['Oktay Dogan'],['Oktay Dogan'],"Lucy visits her agent Dave to discuss with him that he isn't doing enough for her to succeed in her acting career. However, Dave wants to dismiss her and replace her as soon as possible.",--,The Agency
776,--,['J. Parkhill'],['J. Parkhill'],Festival Select Short details the abated evolution and becoming of a french egg auteur.,--,Egg on Your Face
777,--,['Mark Haldor'],"['Gavin Fowler', 'Mark Haldor']",,--,The Fetish Man
778,--,['Stephen Broekhuizen'],['Stephen Broekhuizen'],,--,Interview with a hitman (based on conversations at Port authority bus terminal New York)
779,--,['Hugh Dimauro'],['Hugh Dimauro'],,--,The Stiff
780,5.5,['Justine Le Pottier'],['Justine Le Pottier'],"Paul's going to be a father but never knew his own. When his mother reveals the truth, Paul has to meet the superstar father of his.",--,Je suis ton père
781,--,DESCONOCIDO,DESCONOCIDO,"What happens when someone with bad taste writes a script, and then talented people have to make it? Bloodhound is a project based around this concept. We told someone with terrible taste to write a script, and now we have to do it.",--,Bloodhound
782,--,['Jason P. Schumacher'],['Peter Groynom'],Holly has invited all her friends over for a dinner party. So she can break up with them.,--,The Misanthrope
783,--,"[""Jenna D'Angelo""]","[""Jenna D'Angelo""]",,--,Park Day
784,--,['Johan Öjdahl'],DESCONOCIDO,,--,I sista sekunden
785,--,['Margaux Towne'],['Todd Graves'],Scooty and his buddies are watching a game show in a bar when Buzz starts playing loud rap music on the jukebox. The two grown men nearly come to blows and argue about whose dad is tougher. They arrange for their elderly fathers to meet in the ring for a testosterone filled epic battle.,--,Buzz vs Scooty
786,--,['Kristiyan Lovrich'],['Kristiyan Lovrich'],"While on the hunt for the right casting for another low budget zombie movie, Damien, a casting director, finds himself on the edge of reality and fiction due to overworking and starts to doubt his own decisions.",--,Casting
787,--,['Michael Pauley'],"['Jonathan Hicks', 'Charlie Shulman']",,--,Son of Sandra
788,--,['Michael Pauley'],"['Sean Gibbs', 'Jonathan Hicks']",,--,Bromance: Kev & Diane
789,--,['Bailee Ingersoll'],['Bailee Ingersoll'],,--,TBD 2: TBC
790,6.8,['Gabriel Oliveira'],['Gabriel Oliveira'],A day in the life of a girl literally addicted to her cellphone.,--,Les Addictions des Temps Modernes
791,--,DESCONOCIDO,DESCONOCIDO,,--,No you don't!
792,--,['Michael Pauley'],"['Jonathan Hicks', 'Charlie Shulman']",,--,Text Speak
793,--,['Jake Segelbaum'],['Jake Segelbaum'],"In order to save his friend, one man is forced to enter the dark underbelly of the world of bananas.",--,Bananas
794,--,['Sofía Alfaro'],['Sofía Alfaro'],A teenage girl prepares for her senior prom as she shares her reflections on the poetics of impermanence and quotidian life.,--,Por Falta De
795,--,['Ajay Satsangi'],['Ajay Satsangi'],Follow a young fairy child as she cleans up the streets of Los Angeles.,--,Agent Fairy
796,--,['Kevin Isaacson'],['Kevin Isaacson'],,--,A Most Forgettable Man
797,--,['Frédéric Jaeger'],['Frédéric Jaeger'],"Navid wants to enlighten the misogynistic men in Hönow, but his assistant knows better.",--,Aufklärung für Hönow
798,--,['Jonathan Kehoe'],['Marisa Hood'],"After another morning of mundane interactions with her boyfriend, a woman reaches her breaking point and throws a fork across the room.",--,Furca
799,--,['Qiyu Zhou'],['Qiyu Zhou'],,--,Beijing Wilderness
800,--,DESCONOCIDO,['Kristi Donna Ng'],,--,I Had a Great Time
801,--,['Neal E. Fischer'],['Justin Shady'],Two longtime friends search for closure over a traumatic event from their childhood.,--,Kindergarten Cop 2020
802,--,DESCONOCIDO,"['Kaleigh Brown', 'Jason M. Koch']","A young woman's struggle with social media attention leads to her last dance. Monica, a 20 something, social media star 'want to be.' Spends a wild night out with her friends and ends up meeting Jake. A typical bro-type who has more to offer Monica than charm and good looks. This found footage, horror short is a cautionary tale about who you bring into your home. Writ... Read all",--,Monica's Last Dance
803,--,['Killian Gilroy'],['Killian Gilroy'],"Ron comes home from a rough day of work, taking out his anger on his wife, Alicia.",--,The Funnyboomers
804,--,DESCONOCIDO,['Emma LaCount'],"It's the picture perfect wedding and nothing could go wrong. Or could it? Two lovebirds were about to make the biggest commitment of their lives, when a sudden realization happens that threatens to change EVERY-THING. Someone's bacon - is about to be cooked.",--,Til Bacon Do Us Part
805,--,DESCONOCIDO,"['Tim Janas', 'Matt Ketai']",,--,Start Up Startup
806,--,['Joanna Leeds'],['Joanna Leeds'],A hapless therapist struggles to get through an awkward session with an opinionated young woman and her cheating fiancé.,--,Tell Her It's Over
807,--,['Justin Norman'],['Justin Norman'],Doug struggles to part ways with a company representative who promises him the greatest job of his life.,--,Enjoy Your Evening
808,--,['Ulysse Bres'],['Cyprien Masingarbe'],"Isidor is a backpacker: seeing the world, traveling the countries, discovering their culture, he only lives for that. His catchphrase? ""Keep it Isi"".",--,Backpacking
809,--,['Maria Galindo Esquer'],['Matilda David'],,--,Merry Bloody Christmas
810,--,['Garfield Clairmonte'],['Garfield Clairmonte'],"Dumped unexpectedly by his girlfriend (Rita Bernard-Shaw) and saddened by the sudden loss of his mother (Andrea Hall), Eli (Hayden Mclean) calls upon enigmatic uncle Cassius (Garfield Clairmonte), eccentric art dealer and occasional shaman healer, as a last resort to purge his pain. The obnoxious mystic performs a series of self-concocted forest rituals, craftily devi... Read all",--,Dirt
