265,4.8,DESCONOCIDO,"['Elizabeth Blake-Thomas', 'Isabella Blake-Thomas']","During the holidays, best friends 16-year-old Charlotte and 100-year-old Evie Rose reminisce on the beautiful memories of their friendship, but this Christmas is not as joyful as the past.",--,Evie Rose
266,--,['Ariana Marquis'],DESCONOCIDO,"A grifter has been disguising herself as an environmentalist to fuel her van-dwelling lifestyle. While stopped in an East Coast town, a local's admiration sparks an undesired friendship.",--,Jerrycan
267,--,['Mason Cade Packer'],DESCONOCIDO,"Parker Cohen, a talented young pianist, is confronted with the toxicity of an old relationship when his ex-boyfriend Deon shows up on the night of a major musical showcase.",--,Sonata
268,--,['Gregory Alexander Foltynowicz'],DESCONOCIDO,"An artistic, expressive, experimental short film that explores the dynamic, complex connections between self-awareness and relationships. Specifically, the relationship difficulties individuals may experience when there's a lack of self-awareness and understanding of oneself.",--,Facades
269,--,['Frederick Tabiyus Nah IV'],"['Alexander Jesus Burgos', 'Frederick Tabiyus Nah IV']","California native Jamie Gonzalez, an amateur MMA fighter on the verge of his pro debut battles with self worth, past mistakes, tragedy, and the acceptance of those closest to him with his chosen life path. He realizes later that the only acceptance he needs is his own.",--,Find Your Faith
270,--,['Kyle Bell'],DESCONOCIDO,Spirits is a short narrative film about a young Creek boy who is conflicted about making the difficult choice of leaving his only family and home behind for a future playing college basketball.,--,Spirits (Poyvfeckv)
271,--,['Charles Opong'],DESCONOCIDO,,--,The Jungles
272,--,"[""Lawrence 'Law' Watford""]",DESCONOCIDO,A Black woman mourning the death of her child at the hands of an NYPD officer confronts the ambitious district attorney that refused to bring charges against the officer.,--,Catharsis
273,--,['Mithra B. Alavi'],"['Mithra B. Alavi', 'Zein Khleif', 'Kathleen Peiris']","Nineteen-year-old, half-Jordanian Leila must confront the complexities in the relationship with her American mother Karen after Leila returns to Los Angeles from Jordan with a new appearance.",--,Birds Fly Home
274,--,['Mary Bronaugh'],DESCONOCIDO,"Ninabelle is a religious Filipina teenager whose sheltered worldview is shaken by her first day of college. When she meets the campus comedy troupe, Nina will discover a world where provoking God is applauded.",--,Swearing
275,7.2,['Alexandra Brodski'],"['Alexandra Brodski', 'Amelia Spencer']","'Joy' captures a moment in the lives of the inmates of a children's prison, revolving around Joy - the 12-year-old self-made charismatic preacher who wields an intoxicating power over her peers, and perhaps even the staff.",--,Joy
276,5.2,['Jan van Dyck'],DESCONOCIDO,"Maurice Sanders has a gift. He's a nipple whisperer. Once he was known as ""Magic Sandy"". But that was years ago, before Doris, a famous model and Sander's muse, fell ill. Now, after more than a decade, Doris wants to meet Maurice again.",--,The Nipple Whisperer
277,--,['Adam Howe'],DESCONOCIDO,"In 1918 Ireland, a recently widowed young women is stalked by a malevolent presence after finding a trinket on her nearby beach.",--,Standing on Your Grave
278,--,['Margarita Milne'],DESCONOCIDO,"A drama that follows the events leading up to an overdose at an 18th birthday party. Cora, an Instagram 'it' girl who's unhappy with her life introduces her socially anxious boyfriend Tyler to her friendship group of similarly stylish and egocentric people for the first time. The party starts off well, but descends under the influence of a cocktail of drugs. Tyler wat... Read all",--,Birthday
279,--,['Melissa Skirboll'],DESCONOCIDO,An assassin is sent to NYC to seek vengeance against the soldier who led the massacre in her hometown in 1995. Is vengeance a dish best served this cold?,--,Greetings from Sarajevo
280,--,['Rachel Ross'],DESCONOCIDO,"An estranged father and daughter, both with newly diagnosed life altering illnesses, smoke marijuana together for the first time and it becomes healing in more ways than one.",--,Green
281,--,['David T. Cowell'],"['David T. Cowell', 'Samantha Lauren Martin']","In an attempt to reconnect after the loss of their child, Harry takes Kim away for a weekend of healing. Suffering through isolation on many different levels compounded by Kim's mental state the couple realise that their problems have only just begun.",--,Silenced
282,--,['Shadi Ghaheri'],DESCONOCIDO,Two friends help each other find fatherhood and adulthood in a world that rejects their claim to it.,--,Swimming
283,--,['Bill Hutchens'],DESCONOCIDO,How far you would go to save your relationship?,--,Serving Love
284,--,['Seidy Lopez'],DESCONOCIDO,,--,Shevolution
285,--,['Carlos Loaeza'],DESCONOCIDO,Mónica is a writer-to-be who gifts her boyfriend a compilation of every important moment that they've lived together.,--,Nuestro Último Baile
286,--,['Chris Sexton Fletcher'],DESCONOCIDO,A grief-stricken father hunts down the boy responsible for the events that led to his son's murder but finds himself unable to escape the consequences of his own violent actions.,--,The Punishment
287,--,DESCONOCIDO,"['Christina Johnson', 'Yadi Nieves']",,--,Mad Woman
288,6.9,['Lucy Knox'],DESCONOCIDO,At an idyllic spa retreat a vacationing mother and daughter bicker and avoid connection until an unfortunate accident occurs.,--,Hot Mother
289,--,['Jessie Klearman'],DESCONOCIDO,"Presents is a short film written and directed by Jessie Klearman about Lena Julian who has never known much about her dad who died before she was born. It's a sore subject with her mom, so she devises a plan to reveal to the truth: in disguise as her 10th birthday party she holds a seance, forcing her mom to tell her the truth about her father for the first time. It i... Read all",--,Presents
290,--,['Mark Bade'],DESCONOCIDO,,--,Join the Birds
291,--,['Ryan Alexander Huang'],DESCONOCIDO,"Haunted by a crash that took the life of his teammate and closest friend, a retired racing driver is asked by his manager to follow his wife and investigate suspicions of an affair.",--,Endless Yesterdays
292,--,['Rebekah Fortune'],DESCONOCIDO,,--,Her Majesty
293,8.1,['Yassin Koptan'],"['Myesha Coleman', 'Kayla Eva', 'Yassin Koptan']","After 6 years of being in a long distance relationship, Sandra travels to the Middle East to see her girlfriend and ask her the big question.",--,Skumjas
294,--,['Jacqueline Wagenstein'],"['Martin Razhdashki', 'Jacqueline Wagenstein']","Aleph, a prototype of Jorge Luis Borges, is 120 years old and was born in a Library, which he has never left. He is looking for the perpetuation of the Library, which according to the legend can only happen after the Labyrinth is unlocked by a blind person. A call from Pontius Illiteratus invites Aleph to appear at the Babylon Congress for ""adjusting his values."" Thus... Read all",--,Oxymoron of Eternity
295,--,['Benart Laze'],DESCONOCIDO,"The quiet routine of living in an absurd environment, between dreams of dancing disco hits with the love of his life and working as a gravedigger at the cemetery",--,Discofuneral
296,--,['Melanie Lim'],DESCONOCIDO,,--,Ikaw at Ako
297,8.8,['Hayley Osborne'],DESCONOCIDO,"It's 1964. James and Linda are young and in love, until one day she disappears. 43 years later he finds her, but James has to find out: is it always best to know the truth? You Really Got Me looks at whether love and hope are powerful enough to overcome prejudice.",--,You Really Got Me
298,--,['Sarah Hanssen'],DESCONOCIDO,,--,How to Protect Your Family
299,8.0,['Christopher Siaens'],"['Nathan Jasper', 'Christopher Siaens']",A young girl videotapes herself recording a heartfelt happy birthday message for her loving mother.,--,Love Letter to Mom
300,--,DESCONOCIDO,DESCONOCIDO,"In November of 2012, a young couple deals with the aftermath of a tragedy during a time of national panic before the impending Mayan Apocalypse.",--,The Argument
301,--,['Darcy Conlan'],"['Roby Favretto', 'Caitlin Spears']",A documentary crew inadvertently captures the declining success of a children's theatre duo.,--,Cactus & Mime
302,7.2,['Jacqueline Xerri'],DESCONOCIDO,"When fourteen-year-old Maggie and her two best friends hang out with older guys they meet on Facebook, a crush on a complicated boy unravels into a twisted trance fueled by Four Lokos and naive infatuation.",--,Monkey Bars
303,--,['Niccolo Rolim'],DESCONOCIDO,"A humanist portrayal of the Iraq War and its aftermath as experienced by Rosa, a half-Latina, half-Arab U.S. Marine.",--,Broken Layers
304,--,['Eva Vik'],DESCONOCIDO,"A sensual tale of two souls becoming one. Inspired by Carl Jung's theory, Anima and Animus.",--,Anima Us
305,--,['Claudia Grace Mckell'],DESCONOCIDO,,--,Just A Girl
306,--,['Carmen Antón García'],DESCONOCIDO,"A susceptible preteen and her younger sister embark on a weekend trip with their manipulative nanny only to discover that she is not who they thought, and their return is uncertain.",--,Hijas Mías
307,--,DESCONOCIDO,DESCONOCIDO,DESCONOCIDO,--,Error nombre para la pelicula con id: tt11685090
308,--,DESCONOCIDO,DESCONOCIDO,"'Don't go yellin' he said and shook her; and her body flopped like a fish. And then she was still, for Lennie had broken her neck.' John Steinbeck, Of Mice and Men",--,Semi-Detached
309,--,['Julio Nieves'],"['Roxanne Behrens', 'Maggie Corbett']",,--,Lovers language
310,--,['Stuart Elmore'],"['Jack Pickard', 'Stuart Elmore']","On their way to their father's funeral, two estranged siblings rekindle their relationship through a visit to their old, family-owned roller rink.",--,West Park
311,--,['Carly Zaleski'],DESCONOCIDO,"Poker Night is a coming-of-age story about a college senior who is put in a position he never imagined would happen to him. Looking for a way out, he plans to swindle his friends in a game of poker. What he receives at the end of the game is a new perspective on his current situation.",--,Poker Night
312,--,DESCONOCIDO,"['Adam Howes', 'Glenn Smith']","When a new book club member starts to notice eerie similarities between the novel's creepy, cat-loving protagonist and the group's creepy, cat-loving host, things take a dark turn. But has she blurred the line between truth and fiction?",--,Chapter Two
313,9.4,['Oz Arshad'],DESCONOCIDO,"Paralysed with guilt and obsessed with expiating the sin of adultery Jimmy decides to open a mosque to save him from hell. But when Fazil, the mosque's Imam, has a disagreement, they fall out and Jimmy must go it alone.",--,Expiation
314,--,['Douglas Maxwell Myer'],"['J.K. Hodge', 'Douglas Maxwell Myer']","A journey is taken to see the various rivers, ponds, lakes, streams, reservoirs, and waterfalls of Massachusetts. Vivid speculations of the water are ventured throughout the western, central, and eastern part of this great New England state. Each and every one of these magnificent aquatic quarters are keys that enrich the soul.",--,Keys to the Soul
315,--,['Christopher Siaens'],DESCONOCIDO,"A young, drug-addicted girl videotapes herself, giving thanks to her best friend who helped change her life for the better.",--,Thank You for Stopping By
316,--,['Grace Parry'],DESCONOCIDO,An aspiring actress is forced to question the lengths she will go to on her quest to be seen.,--,Outsiders
317,--,DESCONOCIDO,"['Ryder Doupe', 'Dawson Doupé', 'Todd Tapper']",Identical twin sisters who haven't spoken in years reunite for a road trip after one of them tries to take her own life.,--,Bloom
318,9.1,DESCONOCIDO,DESCONOCIDO,"Ruth, an elderly lady with dementia, becomes lost within her own home. As she tries to find answers, she ends up losing herself further, confusing reality with memories of her past self.",--,Ruth
319,--,['Kelley Lockman'],"['Charlton Hoag', 'Kelley Lockman']","A couple's love is tragically cut short when cancer takes the life of a man's young bride, leaving him in the depths of despair and grief to search for meaning, and the will to live.",--,Sunset in Winter
320,--,"[""Marta D'Ocon""]",DESCONOCIDO,"Somewhere in Latin America, a young woman joins a guerrilla army when her entire family is massacred by government troops. She initially thrives, finding strength and independence as a deadly sniper. But her newfound sense of purpose and self-respect come with a high price.",--,The War Within
321,--,['Debra Markowitz'],DESCONOCIDO,,--,The Lonely Road to Nowhere
322,--,DESCONOCIDO,DESCONOCIDO,Orpheus has become reclusive after his husband is sent back to the underworld following one single glance. Orpheus retires to his summerhouse in seclusion.,--,The Orpheus Summer House
323,7.9,['Carmen LoBue'],DESCONOCIDO,"After a surprise first-time pregnancy, a Trans couple of color wrestles with how the new baby will affect their relationship and how to raise their child in a binary world.",--,Pink & Blue
324,--,['Julia Kozak'],DESCONOCIDO,,--,Bloom
325,--,['Ludovica Musumeci'],DESCONOCIDO,"Gabi, a young woman living with a mental illness moves in with her boyfriend and starts to unravel as she tries to keep her mental condition a secret from him and her surroundings. The short film helps shed light on mental health struggles.",--,I Am
326,--,"[""Kerry O'Neill""]",DESCONOCIDO,A bittersweet coming of age story.,--,Bea at Rehab
327,8.0,['Channing Godfrey Peoples'],DESCONOCIDO,Doretha goes out for her evening drink at her local watering hole when a news story dredges up old memories.,--,Doretha's Blues
328,--,['Douglas Forrester'],DESCONOCIDO,"Ben-David chases after his elusive first kiss, but he may have to break his mother's trust to get it.",--,Beach Boy
329,--,['Simon Brandon'],DESCONOCIDO,,--,Beast in the Brain
330,--,['Malu Portela'],DESCONOCIDO,Elisa is a 16-year-old Venezuelan girl who is 8 months pregnant and she has only 1 day to cross the border with Brazil. Otherwise a curse will steal her soul.,--,Don't Look Back
331,--,['Nino Mancuso'],DESCONOCIDO,"""A couple's desire to have a child sets them on a journey that will test the threshold of their love and connection"". Wasted Seed is a film that explores the humor, trauma and absurdity of infertility in a refreshingly bold and realistic way.",--,Wasted Seed
332,--,['Shira Rosenzweig'],DESCONOCIDO,A husband and wife's last goodbye on the brink of moral collapse.,--,Come Midnight
333,6.9,DESCONOCIDO,"['Leopold Dewolf', 'Emma Qian Xu']","Nantong, China. Jian works as an e-driver, driving the cars of customers too drunk to drive home. One night, one of his passengers asks him to be taken to the police station.",--,Nantong Nights
334,6.0,['Pierre Renverseau'],DESCONOCIDO,"Greg, locked in his room, watches his body slowly turn into something inexplicable and terrifying, while hearing strange calls coming from the outside. A free adaptation of Franz Kafka's classic horror/drama short story, ""The Metamorphosis"", focusing on the one and only character Greg.",--,Zmiena
335,--,['Cody DeTurk'],DESCONOCIDO,Sixteen-year-old Sadie Dalton finally catches the mysterious spy who had following her for years. Her absurd mission is revealed.,--,Maybe I Don't Actually Suck
336,--,DESCONOCIDO,"['Eli Bevins', 'Lu Bevins']",A young son watches as the constant verbal collision between his mother and father takes a brutal toll on his emotional state.,--,Sound Mind: Breaking Me Down
337,--,['Joe Morley'],DESCONOCIDO,A young woman struggles to escape from her abusive husband after discovering that she is pregnant with his child.,--,Dark Strings
338,7.7,['Sandro Souladze'],"['Giorge Souladze', 'Sandro Souladze']","Two little brothers have to stay alone in their remote hut, to protect it from an obscure threat, while also struggling with their own fears and fantasy.",--,The Watchers
339,7.4,['Khalid Fahad'],DESCONOCIDO,"In a world where Malik lives alone, he faces fateful challenges in his life",--,Little Bird
340,--,['Lili Bordán'],"['Lili Bordán', 'Mihály Szabados']","A Hungarian actor travels to NYC to perform his one man show, only to discover that his long-lost love is in the audience.",--,One Night Only
341,--,['James Blanco'],"['James Blanco', 'Andrew Vaughan']","John has daily and random calls with his overprotective mother, discussing outlandish stories, but it's when the calls stop that hit home the most and sometimes all we have left is a voice.",--,Voicemail
342,7.6,['Jess X. Snow'],DESCONOCIDO,A non-binary Chinese-American drag queen returns to their home town to confront their estranged father about the childhood memories that continues to haunt them.,--,Little Sky
343,--,DESCONOCIDO,"['Esther Briones', 'Jano Dávila', 'Carlos Loaeza']","Devotion is an ancient Celtic spell for lonely men so they can have some company, wanna try?",--,Devotion
344,--,DESCONOCIDO,"['Eli Bevins', 'Lu Bevins']",The world is on the brink of extinction as an impressionable girl makes a remarkable plea to Mother Earth.,--,Sound Mind: No Longer Home
345,--,DESCONOCIDO,"['Eli Bevins', 'Lu Bevins']","Set in the 1930s, African American dock workers and housemaids come to terms with the life of toil expressed through modern dance and poetry.",--,Sound Mind: Same Ol' River
346,--,['Lorenzo Calder-Smith'],DESCONOCIDO,An isolated family questions their beliefs after the father undergoes a mysterious change.,--,Ora
347,--,DESCONOCIDO,"['Eli Bevins', 'Lu Bevins']","Slowly losing faith, two lovers on opposite ends of the same murder, seek answers from God.",--,Sound Mind: Habakkuk
348,--,['Lisa Younger'],DESCONOCIDO,,--,"Hi, I'm Elsie"
349,--,['Lallie Doyle'],DESCONOCIDO,,--,His Assistant
350,--,DESCONOCIDO,DESCONOCIDO,Plot unknown.,--,Ehlo Zaret
351,--,DESCONOCIDO,DESCONOCIDO,"A playful exploration on the themes of love, virginity, and sex through intimately irreverent scenes, where four women explore the constructs that have helped shape their sexual confidence, and their love for fucking.",--,All These Men That I've Done
352,--,['Maria Johnsen'],DESCONOCIDO,"When a business man sets out to rescue his wife who is with Alzheimer, all while he must deal with her disappearance.",--,Searching for Harriet
353,--,DESCONOCIDO,DESCONOCIDO,DESCONOCIDO,--,Error nombre para la pelicula con id: tt11790750
354,--,['James Alton'],DESCONOCIDO,,--,Mabel
355,--,['Ignat Ignatov'],DESCONOCIDO,A painter paints a painting,--,A Painter Painting a Painting
356,--,['Mark Blane'],DESCONOCIDO,"In this allegory on truth and loss, a mother meets a stranger who may hold the key to solving her son's untimely death.",--,Ghost Bike
357,--,DESCONOCIDO,DESCONOCIDO,,--,BLINK!
358,--,['Kamila Dydyna'],DESCONOCIDO,"""Debutante"" is the story of Meg, a young Jehovah's Witness who's subjected to the worst of what the religion has to offer: a judicial committee.",--,Debutante
359,--,['Yimeng Yuan'],DESCONOCIDO,"It's a 10-minute drama, uncovering the wound of an aspiring female painter that leads her to selectively forget the life-changing moment but still remembers the fond emotions of a toxic relationship. The story is inspired by true events. As a victim who comes to terms with the relationship with your own belief, with somebody you look up to, and with the complicated em... Read all",--,So I Erased His Face
360,--,['Nate Hapke'],DESCONOCIDO,,--,Empiricism
361,--,['Katie Byford'],DESCONOCIDO,,--,You Look Fine
362,--,['Ina Lerner Grevstad'],DESCONOCIDO,A 12-year-old boy is left behind in a flat with the responsibility of his younger siblings. When he finds his father's old gun the desperation he feels is unleashed; he loses control.,--,Ungene
363,--,['Rosie Day'],"['Rosie Day', 'Matt Parker']",Celaine is 14 years old. Celaine likes the Spice Girls and Cartoons. Celaine hasn't left her room in 6 months.,--,Celaine
364,--,['Mitchell McKechnie'],DESCONOCIDO,A struggling Scottish poet battles the tides of alcoholism in an ever growing attempt to save himself - and his soul.,--,Autumn Nocturne
365,--,['Jane Ashmore'],DESCONOCIDO,"An unrequited love story, told through the eyes of Oscar, an autistic man, who learns to articulate his feelings and emotions through the use of The Streets lyrics.",--,Love
366,--,['Esmée Lavalette'],DESCONOCIDO,The story of a lesbian girl and her issues on how to come out to her homophobic parents and wanting to meet her long distance girlfriend for the first time.,--,Found Family
367,4.5,['Adam Swain Ferguson'],"['Adam Swain Ferguson', 'Caitlin R. Williams']","A charismatic mortician finds love when he meets David, a shy southern boy attending his grandfather's funeral. Their brief romance is cut short when an old flame tries to rekindle a relationship, and a crowded house party turns violent.",--,Patrick
368,--,['Jamie Spaulding'],DESCONOCIDO,"Two brothers, driven apart by their own nature, are pitted against each other by circumstance.",--,Highwaymen
369,--,['Vanessa Hehir'],DESCONOCIDO,"A family in turmoil through a cheating husband, creates more skeletons and ghosts than meet the eye.",--,Cuckoo
370,--,['Luigi Pane'],DESCONOCIDO,"Dangerously rampant populism and racism, an uncertain political guide, an idea of Europe far from the initial one. Rather known issues. But not everything is as it seems.",--,Quasi ora
371,--,['Pratham Sharma'],DESCONOCIDO,"The psychedelic bonding between two individuals, the film shows the emotional connection of the two sub conscious minds.",--,That Day Over the Moon
372,--,['Cameron Early'],DESCONOCIDO,"Just Bake Cookies is the coming of age story of a young man named Quinton and his struggle to navigate his way from teen to manhood. We meet Quinton in high school as he saves another kid from being bullied by beating the assailants. Quinton's Grandfather, Pops has been raising Quinton ever since his mother passed away from Cancer a few years earlier. Pops is very wis... Read all",--,Just Bake Cookies
373,--,['Julian Stamboulieh'],"['Frank Marrs', 'Julian Stamboulieh']","Grief-stricken after his wife takes her own life, Gabriel volunteers to search a notorious ""suicide forest"" for other lost bodies. His vulnerability is tested when he discovers someone alive and wrestling with demons of their own.",--,The Forest
374,5.2,['Ioana Turcan'],DESCONOCIDO,,--,Empiric
375,6.0,['Anna Czarska'],DESCONOCIDO,A young woman on the autism spectrum struggles with the world around her until the kindness of one person changes her life.,--,Mildly Different
376,--,['Kylan Tyng'],DESCONOCIDO,"When an aging astronomer stumbles across a new inhabitable solar system, his hopes of going down in history are swiftly put on hold once he realizes a 6-year old girl has already named his astronomical discovery 'Gigglebutt.' The astronomer, Henry McConnell, travels cross country to rural Missouri to convince Aaron Pawson and his young daughter, Maisie, to sign over t... Read all",--,Gigglebutt
377,--,['Alexandra Velasco'],DESCONOCIDO,"Evil has no consequences for an affluent Mexican young boy in this disturbing coming-of-age story about toxic masculinity and class inequality. Inspired by true events, the film is set in 1990s LA about a day in the life of two Mexican immigrants, Diego a sensitive six-year-old boy, born into an abusive upper-class family and Mireya, an indigenous young woman from Mic... Read all",--,Becoming (El Devenir)
378,--,['Will Townsend'],DESCONOCIDO,The Red Line follows a retired blues and soul singer on his egotistical downward spiral into drug addiction.,--,The Red Line
379,--,['Nimra Munawar'],DESCONOCIDO,"A micro-short film that challenges stereotypes and misconceptions we often have of others, all the while, creating awareness on the subject of Islamophobia.",--,Perspective
380,--,['Reema Almajid'],DESCONOCIDO,,--,36 Years
381,--,['Tevin Everett'],DESCONOCIDO,"Elias struggles to piece together his day after finding a note from his wife, telling him to ""find me"". As he goes on a treasure hunt of sorts, unknown to him are nefarious forces, harboring a horrible secret.",--,Short Term
382,--,['Tony El Ghazal'],DESCONOCIDO,"Tinged with melancholy, this tightly staged short film follows a nostalgic Lebanese widow grappling to honor her late husband, despite her life being at stake in the walls of her own home.",--,Bayt El Omor
383,--,['Julie Koehnen'],DESCONOCIDO,"At the turn of the 19th century, Midwestern, social elite Clemence Finch, returns from an outing with Birgit Johannsen a prominent, independent, European woman who engineers a luncheon at a local hotel without a male family member escort. The thrill of her newfound freedom and independence shatters Clemence's world and her once singular desire to marry the man she lov... Read all",--,Awakening
384,--,DESCONOCIDO,DESCONOCIDO,"Deserted by a close friend, a young woman tries to find her way home after a dark night in Berlin.",--,Berlin
385,--,['O.B. De Alessi'],DESCONOCIDO,"In a remote country house, a girl who is struggling to connect with her family after the loss of her father, is visited by a mud monster. As her encounters with the creature become frequent, she begins to suffer from a mysterious illness.",--,Mudmonster
386,--,['Cameron Lee Horace'],"['Cameron Lee Horace', 'Miles Gibson', 'Sophie Colquhoun']","Isolated and alone during the pandemic, Maisie (Claudia Lindemann) refuses to talk. Young Maisie (Sophie Colquhoun) narrates the pleasures of youth when her deceased sisters, Alice and Lily confront a life of lust and heartache.",--,The Other Woman
387,--,['Alex Denysov'],DESCONOCIDO,,--,Última Confesión
388,8.1,['Alexis G. Zall'],DESCONOCIDO,Two childhood best friends are reunited at a house party and debate the pros and cons of finally hooking up.,--,The Beginning & The Middle
389,7.0,['Alex Proyas'],DESCONOCIDO,"A young woman lost in a nocturnal, dreamlike city, with her twin psychic brothers who try to help her find her way home as she is pursued by a shadowy cult known as The Mysterious Ones.",--,Mask of the Evil Apparition
