390,--,['Jacob Trup'],DESCONOCIDO,,--,The Flight of the Manakins
391,--,DESCONOCIDO,"['Nicky Murphy', 'Zeïna Thiboult']",The bond between two sisters is tested when they are forced to spend a day together braiding hair.,--,"Paris, I Hate You"
392,--,DESCONOCIDO,DESCONOCIDO,"When a group of friends break into a bar, the owner holds them at gunpoint. In a world where playing music is punishable by death, they find they have to play for their lives to escape capture and extermination.",--,The Chased
393,--,DESCONOCIDO,DESCONOCIDO,,--,The Red Wolf
394,--,['Samantha Laurenti'],DESCONOCIDO,"When their mother is dying, a brother and sister use her toothpaste tubes as a bench marker for how much life she has left.",--,Tubes
395,5.5,['Abderrachid Hammouti'],DESCONOCIDO,,--,Jet Lag
396,--,['Victor Rodrigues'],DESCONOCIDO,,--,Ibeji Ibeji
397,--,['Rigo Garay'],DESCONOCIDO,"After his older brother Tone is violently murdered over a pair of sneakers, 11-year-old Noel finds himself having to choose between revenge or righteousness, throughout the course of a single night. Will Noel succumb to his surroundings or choose the right path?",--,Size Up
398,--,['Oliver Griffiths'],DESCONOCIDO,"Henry Sullivan, a bounty hunter in post-civil war America, traverses the country in search of wanted outlaw Sylvester Reed. Unbeknownst to Reed, there may be more that connects the two of them than he realizes.",--,A Personal Errand
399,--,['Mehran Qorbani'],DESCONOCIDO,Mr. Biglari and the local teacher trying to convince Fatima's father to take a permission for her in the purpose of trip to the city with group of male students.,--,Bakh (The Look)
400,--,DESCONOCIDO,DESCONOCIDO,DESCONOCIDO,--,Error nombre para la pelicula con id: tt11909256
401,--,['Isaac Tomiczek'],DESCONOCIDO,A bullied gay teenager's life is turned around when a new friend teaches him how to box.,--,Taylor
402,--,['Quinn Fluet'],DESCONOCIDO,"A science experiment gives a young woman the opportunity to meet her estranged father from a different dimension. But as she interrogates him to understand why he abandoned her, she falls down a rabbit hole she could have never imagined.",--,Singularity
403,7.0,['Kath Akuhata-Brown'],DESCONOCIDO,A father turns his car into a water pump while his young daughter becomes a force of nature.,--,Washday
404,--,['Ruben Rodas'],"['Arnaldo Pitre', 'Ruben Rodas']","""A top hit-man gets caught in the middle of a betrayal scheme within his contractors""",--,Before Dawn
405,7.4,['Tiger Ji'],DESCONOCIDO,A Chinese Uber driver in New York struggles to make ends meet as he picks up his nightly passengers.,--,Wuhan Driver
406,--,['Christina Tucker'],DESCONOCIDO,"While Lily and Samantha, a long-term couple, are out doing routine errands, Samantha confesses her desire to move back home, inspiring an emotionally fraught conversation between the two.",--,Chores
407,--,['Joshua Wisdom'],DESCONOCIDO,"A wanted criminal, residing in a rundown caravan, struggles with his current life and past mistakes.",--,Caravan Blues
408,--,DESCONOCIDO,DESCONOCIDO,DESCONOCIDO,--,Error nombre para la pelicula con id: tt11930436
409,--,['Frances Rose Padunan'],DESCONOCIDO,"After a car accident, a man tries to find his missing pregnant girlfriend who got taken away.",--,Peters Rd
410,8.4,['Miguel Melo'],DESCONOCIDO,Victor prepares to tell his partner about his HIV status during a perfect date.,--,Brave
411,5.8,['Ashley Walters'],DESCONOCIDO,"Ashley Walters directs a short film set against the backdrop of an east London concrete jungle, following two best friends as they embark on a risky mission and a journey into manhood.",--,Boys
412,--,['Jonathan Rowan'],"['Jonathan Rowan', 'Khyran Shank']","From first sight to last fight, Shank's Rain takes us through the span of a relationship between two people convinced they were destined to be together until they look back and see how they crumbled apart.",--,Shank's Rain
413,--,['Sergio Nolasco'],DESCONOCIDO,"Silvio and Mariana are two senior neighbors that spend their days between their loneliness, daily routines and constant disputes over whom the tree leaves that divide their sidewalk belong to.",--,Elder Leaves
414,7.6,['Corbin Rowell'],"['Steve James', 'Corbin Rowell']","When several deaths spark suspicion, Gotham City's mysterious vigilante investigates, leading him down a dark path plagued with fear.",--,Batman: Dawn of Fear
415,--,['Jason A. Coombs'],DESCONOCIDO,"A young man from a conservative family, struggling with his sexuality, must decide if his latest affair is worth the risk to his clean cut lifestyle.",--,The Morning After
416,--,['Bruno Barranco'],DESCONOCIDO,"Nazi-occupied Poland, 1942, Stefan, a frustrated German teenager, aware of the atrocities committed by his father, Walter Ender, in the Belzec extermination camp, keeps a secret that can cost him his life.",--,Operation Zeugung (II)
417,6.8,['Ricardo Varona'],DESCONOCIDO,"In 2018, a year after the landfall of Hurricane María, a young mother named Paola attempts to find herself as she wrestles with her responsibilities to her daughter and incarcerated husband.",--,La Mujer de Hector (Hector's Woman)
418,--,['Muhebur Rahman Shaha'],DESCONOCIDO,"Lowlife Eli has been living in his own hell. With little patience left, he has the task of finding the darkest meal yet.",--,Dinner Time
419,9.2,['Olivia Hang Zhou'],"['Olivia Hang Zhou', 'Jess Kohs']","Yiru, a Chinese teenager travels to Los Angeles with her mom Jia in search of her long lost sister who was given up for adoption due to the one child policy. Yiru grapples with feelings of isolation and longing for her mothers love as the search intensifies.",--,"Apart, Together"
420,--,['Matt Somogyi'],"['Matt Somogyi', 'Anthony Toms']",A cellist is forced to confront her dark past after being repeatedly visited by a mysterious floating orb.,--,Immutable
421,--,DESCONOCIDO,"['Luciana Baseggio', 'Larissa Curi']","The past is a shattered mosaic, made out of fragments of affections and memories. Maria cannot put the pieces into perfect order but she can give them new meaning. She starts a journey to her father's home in search for answers. Spiraling into her memories, she looks for guidance into healing her soul from the past.",--,Onde há pranto há mar
422,7.5,['Joseph Wallace'],DESCONOCIDO,"A troupe of clowns gather to perform a story about a Priest and a refugee but as their misguided tale unfolds, the boundaries between fiction and reality begin to fray. A troupe of clowns gather to perform a story about a Priest and a refugee but as their misguided tale unfolds, the boundaries between fiction and reality begin to fray.",--,Salvation Has No Name
423,--,DESCONOCIDO,DESCONOCIDO,DESCONOCIDO,--,Error nombre para la pelicula con id: tt11947010
424,--,['Alberto Marchiori'],"['Teresa Lucente', 'Alberto Marchiori']",,--,La perdita
425,--,['Kevin Andrew Keegan'],"['Lexi Cowling', 'Melody McLaurin']","In the three days leading up to Victoria's high school graduation, the world of abuse between her and her mother is gradually brought into the light. Deception between the two grows as Victoria applies to college despite her mother's wishes and the true reason of Victoria's absent father is revealed. The two come to a final showdown where all is revealed and Victoria ... Read all",--,Dear Tori
426,--,['Thomas Giannakis'],"['Thomas Giannakis', 'George Hatzisaroglou']",A female performer remembers her lost lover during covid-19 quarantine. Memories are charted on her body.,--,Epidemic or Body Is Coward
427,6.1,['Shubham Sinha'],DESCONOCIDO,"Story of a customer and a cab driver's conversation, which leads to something unusual never thought of.",--,The Date
428,--,['Praveen Gunasekaran'],DESCONOCIDO,,--,The Last Piano Man
429,--,['Blake Snawder'],"['Sarah Corcoran', 'Blake Snawder']","Triggered by heavy violence and drug use in the household, a 10-year old boy named Pip reflects the shocking memories that his childhood plagued him with.",--,Revolve
430,6.4,['Wesley Mellott'],"['Chloe Carroll', 'Brittany Snyman']","When a vampire's child dies of old age after refusing to be turned, it drives his mother to extreme lengths to fill the void needed.",--,Elysia
431,8.2,['Rumen Russev'],DESCONOCIDO,"A few days before she cheats on him, a girl and a boy talk about their memories, discuss their insecurities and dream about their future.",--,Beyond Borders
432,--,['Stacey Maltin'],DESCONOCIDO,"Jack, an aging hedge fund CEO, hesitantly acquiesces when Ruby, his wife of 25 years, suggests they check out an open love party. Thrust into a new world, he is surprised to uncover the intimacy he actually desires.",--,Appetite
433,5.8,['Mariia Ponomarova'],"['Mariia Ponomarova', 'Britt Snel']","A successful data analyst takes care of his sick father in addition to his busy job. If he has to travel to Amsterdam for work, the pressure becomes too great. A special encounter with a stranger ensures that Andriy finally lets go.",--,Good Boy
434,--,['Nick Ronan'],DESCONOCIDO,"Deep in the snowy Green Mountains, two damaged lives come crashing back together when they discover something in the forest not of this world.",--,Blue Fire
435,--,['Alessandro Fiorucci'],DESCONOCIDO,,--,Never Again
436,--,['Jeong Wook Kim'],DESCONOCIDO,A young woman who is dying from lung cancer decides to make a forged medical document to cheat her SCUBA diving instructor and complete her last wish of diving with a huge manta ray.,--,The Suicide Diver
437,7.9,DESCONOCIDO,"['Alison Stover', 'Joe Benedetto']","In the aftermath of an abusive relationship, Charlotte Moreland tries to regain her mind and her old self while battling panic attacks and agoraphobia.",--,The Four Walls of Charlotte Moreland
438,--,['Joi Hiatt'],"['Bryan Huynh', 'Karin Diann Williams']","Upon leaving home Claire left the art works behind for her younger brother. As the saying life intimates the art. Something happened a few years later after she left, and now he is in reincarnation. She adores him as her only exception to make a visitation.",--,Yesterday Never Ended
439,6.7,['Belkis Bayrak'],DESCONOCIDO,"Cemile, an ambitious kickboxer, getting ready for the match which she believes in herself but not her emotions.",--,Cemile
440,5.9,DESCONOCIDO,DESCONOCIDO,A modern horror adaptation of an old Scandinavian folktale.,--,Huldra
441,--,['Txema Ballano'],DESCONOCIDO,"Two siblings, Julia and Luis, meet to receive their father's inheritance. What they do not expect is having to overcome their differences with one last test and thus know if they are worthy heirs.",--,Herederos
442,7.3,['Dillon Vibbart'],DESCONOCIDO,A doctor with the ability to visit people's dreams helps a young woman confront the terrifying reality of her nightmare,--,Somniphobia
443,--,['M.R. Wilkins'],"['M.R. Wilkins', 'Michael Worthington']","Through a series of choices, a man finds himself boxed in with no way to escape the consequences of his sinful past.",--,When Sharks Love Blood
444,--,['Z. Joseph Guice'],DESCONOCIDO,A woman and her transgender ward try to survive a dying world that adheres to strict 'Male and Female Only' guidelines.,--,The Butterfly (I)
445,--,['Jaleel Sampay'],"['Pete Freeland', 'Rafael Zubizarreta']",A group of bootleggers in the big city looking to make names for themselves during prohibition plan for a job that could potentially put them all on the map.,--,Rumrunners
446,9.4,['Deepmala'],DESCONOCIDO,"Ek Jhalak is a modern romance story set in an Indian suburb. Naman, a single parent in his mid-thirties, has gradually grown fond of his new neighbour who he has never met, incidentally. Naman has, however, caught a few glimpses of this neighbour. He has also discovered different facets of her - she is a doting mother, a devoted daughter, a working woman of the 21st c... Read all",--,Ek Jhalak- A Glimpse
447,--,['Kyle Wong'],"['Jasmin Chong', ""James O'Barr"", 'Kyle Wong']","Based on the hit comic book series ""The Crow"", a new incarnation where Sergeant Mark Leung and his wife are murdered and their daughter Isabelle taken by a Triad run human trafficking ring. Mark's partner Caitlin races to locate them before the trail runs cold and her chance at rescuing Isabelle disappears into the criminal underworld with them.",--,The Crow - Nightwatch
448,--,['Nico Fulton Lavachek'],DESCONOCIDO,"After a gas leak explosion kills her sister and leaves her on the brink of death, Quinn is sent to the afterlife to fight a monster composed of her negative thoughts.",--,The Dandelion Cortex
449,--,['Keith Farrell'],DESCONOCIDO,"A mother who takes refuge in stories, realizes that she must get rid of her prince charming to create her own happy ever after.",--,Another Happy Ever After
450,7.5,['Jovana Avramovic'],DESCONOCIDO,"Olja, disaffected, eighteen years old girl, lives in a family filled with misunderstanding. When her brother's girlfriend visits her family, she faces loss of her brother as she considered him the only thing important. Furious with everybody around her, she is stuck in a place where she doesn't know what to do.",--,Days Lost
451,--,DESCONOCIDO,DESCONOCIDO,"In a world forever altered, a couple meet for the first time after a long separation.",--,Love in the Time of Isolation
452,--,['Jake Rist'],DESCONOCIDO,"One long, uncut shot turned short film, about an 18 year old Australian soldier arriving on the front line of the Turkish battle in World War I, and following his time in battle.",--,One War
453,--,['Ben Desmond'],"['Ben Desmond', 'Karen Stirgwolt']","Liverpool 1960. Art students, Cyn and John, find their blossoming romance in a state of flux as music and fame starts to overtake their passion.",--,Cyn
454,--,['Justin Li'],DESCONOCIDO,A puzzled college student seeks to assemble an award-winning film from the scattered pieces of his imagination.,--,Formulation
455,--,['Mattias Olsson'],"['Marcus Göransson', 'Mattias Olsson']",A hapless man and a pretty woman face their insecurities during a movie night.,--,Besöket
456,--,['Brittney London'],DESCONOCIDO,One man's experience grappling with an unjust criminal justice system while attempting to save his daughter's life.,--,Duvar
457,--,['Damian Redd'],DESCONOCIDO,Evil finds an in-love couple to terrorize for his enjoyment.,--,Malign
458,7.7,['Alexandros Rellos'],DESCONOCIDO,"An elderly former singer decides to return to his career, but he comes against his past, the choices that shaped him as a character and Toronto.",--,TolisLive i (Toronto)
459,--,['Jonas Selberg Augustsén'],"['Anton Chekhov', 'Jonas Selberg Augustsén']",A woman finds out that her 7-year-old son has stolen from her. She tries to explain that it was wrong but has difficulties conversing at a level the boy can understand. She improvises her message in a bedtime story.,--,Sonata
460,--,['Pete Mangum'],DESCONOCIDO,"Set in the gold rush era, Daniel seeks to find his fortune in hopes of creating the life his late father let slip away.",--,The Prospector
461,--,DESCONOCIDO,"['Irzam Mubarik', 'Zaigham Mubarik']",A fortune teller must prove his authenticity on live television when a skeptical journalist accuses him of fraud.,--,Sanctum
462,--,['J. Large'],DESCONOCIDO,"After a long night, a pizza delivery boy decides to make one final delivery.",--,A Smile in Every Slice
463,--,['Ricardo Franco Marin'],DESCONOCIDO,"Superhero Adamant squares off with anti-hero Mayhem as they discuss the moral and ethical ramifications of being a ""hero.""",--,Adamant
464,--,['Juan Albarracín'],DESCONOCIDO,"After 20 years away from his brother Pablo, Jose returns to his childhood house with an important secret to tell him.",--,Volver al sur
465,--,['Keith Miller'],DESCONOCIDO,"After a tragic event, a young man decides to join the military to serve and fight for his country. Only problem is, his older brother won't let him.",--,Pieces Left Behind
466,7.8,['Julia Morizawa'],DESCONOCIDO,"A young girl learns of her mother's survival of the Tokyo Firebombing on March 9-10, 1945 through the eyes of her brother's spirit.",--,Dragonfly
467,--,['Tara Alexis'],"['Tara Alexis', 'Austin James']",A young boy is forced to deal with his parents contention and manipulative undertakings after his own actions cause a devastating turn of events.,--,Better Now
468,6.3,['Coxy'],DESCONOCIDO,"Anna is an eclectic woman in her 30s. One morning, she stumbles upon a show called ""Living the perfect life"". The ideal pitched by the TV host is far away from Anna's own existence and it makes her feel like an outsider. To escape her frustration, she dives into her imaginary world, until a call from her funny and intellectual friend Jean, distracts her from her thoug... Read all",--,The Imperfect Picture
469,--,['Clanch Belleza'],DESCONOCIDO,"A teenager whose perception in life has changed after the death of his mother will confront his inner demons with the help of a razor blade, a cliff, and of kind words from those who are left to love him.",--,Buhi
470,--,['Marc Cartwright'],DESCONOCIDO,Isolation drives a man to rethink his position within a capitalistic society.,--,A Machine for Boredom
471,--,['Anthony Saxe'],DESCONOCIDO,,--,Two Winters
472,6.6,['Elwood Quincy Walker'],DESCONOCIDO,A woman haunted by her OCD and intrusive thoughts must overcome herself and face her inner demons to survive the night in the event of a terrifying home invasion by three masked slashers.,--,The Rule of Three
473,--,['Sunjna Mullick'],DESCONOCIDO,"After the death of his father, Nikhil, a British-Indian journeys to his ancestral home, discovering himself along the way.",--,Peak XV
474,--,['Bryson Sams'],DESCONOCIDO,"From the Creator's of Vivé (2018) and Projection (2020), comes a Drama that dives into the minds of two recovering drug addicts.",--,Reflex
475,--,DESCONOCIDO,DESCONOCIDO,"When Rauben, a calm and solitary man, sees a dress washed downriver, he understands that he has to act quickly.",--,The man who talks to the river
476,--,['Joseph Cassidy'],DESCONOCIDO,"Ruth an elderly Jewish woman who, after surviving the Nazi regime, knows no accommodation can ever be made to anti-semitism.",--,Persistence of the Past
477,--,['Deborah Brown'],DESCONOCIDO,,--,Bala
478,--,['Mateo Rufino'],DESCONOCIDO,,--,Lady M.
479,--,DESCONOCIDO,DESCONOCIDO,DESCONOCIDO,--,Error nombre para la pelicula con id: tt12187494
480,--,['Cristiano Maria Soriquez'],DESCONOCIDO,,--,Once upon a time in Manila
481,--,['Dylan Gallimore'],DESCONOCIDO,"After making a world-changing discovery, two scientists trapped in a dying relationship are pitted against one another in a battle of ambition and will with life-or-death consequences.",--,Total Darkness
482,--,['Chen Wang'],DESCONOCIDO,"Polly gives her mentally handicapped brother, Kyle, who is allergic to milk, a bottle of milk. However, their mother, Brooke, comes home and swaps the bottle. She beats Polly and doesn't care about her bleeding hands. The other day, Polly takes Kyle to the beach and tells him to go back to the see. Suddenly, it brings her back to the memory of playing the game ""The Ki... Read all",--,The Kids of the Sea
483,--,['Randall Galius Jr.'],DESCONOCIDO,Two friends put too much of themselves into the screenplay they are writing.,--,Sellout
484,--,['Sam Walker'],DESCONOCIDO,"In a seaside town devastated by austerity, a Polish girl is terrorised by two local youths. But revenge is on the cards.",--,Tea
485,--,['Pau Verdalet'],"['Ian B. Morales', 'Pau Verdalet']","A young couple will be forced to face their own reality upon the birth of their first daughter, and in the process to awaken the ghosts in their subconsciousness to the point of questioning where the fine line between life or death lies.",--,Prolonged Silence
486,--,['Amarik Khosa'],DESCONOCIDO,A psychologically disturbed taxi driver navigates a surreal and dystopian nightmare.,--,Red Rain
487,7.4,['Harry Reeves'],"['Matt Appleby', 'Harry Reeves']","After being kicked out, Guy is attempting to amend his failing marriage and withhold a relationship with his 8-year-old son. After coming to grips with the realisation that he may never get his family back, he is caught in an unexpected situation.",--,Birdwatching
488,--,['Margalida Adrover'],"['Margalida Adrover', 'Lucía Malvido', 'Bernardo Rosenfeld']","Eva decides to have an abortion, a decision which will be easier to take than to face.",--,Eva
489,--,['Nate Hapke'],DESCONOCIDO,A theatre director slowly adds layers of artifice to build the world of her play around her two lead actresses.,--,Scene Study
490,--,['Chenjia MA'],DESCONOCIDO,"An 18-year-old boy, Simon, visits his grandfather, Carl, who was an avid climber but has experienced a stroke. After he realizes the undying adventurous spirit is always in Carl's heart, they begin their little adventure.",--,Last Wish
491,5.9,['Ali Mashayekhi'],"['Oswald Mahogany', 'Jessica Pontes']",A woman downloads an app that helps connect her to her estranged wife for a brief time.,--,The First Goodbye
492,--,['Ali Mashayekhi'],"['Oswald Mahogany', 'Joanna Tsanis']","A man falls for a girl online, then slowly discovers that she is not how she presented herself.",--,"Strange Lover, Or: How I Learned to Stop Worrying and Love the Quarantine"
493,--,['Maria Norris'],DESCONOCIDO,"As two people adjust to life after college, they also enter into a new phase of their relationship. They must learn to juggle their jobs, passions and each other in order for their relationship to grow.",--,Windmill City
494,--,['Aijaz Ganai'],DESCONOCIDO,There once was a famous artist who was in the making of a famous painting but then one day the artist killed a boy in rage. This incident destroyed the artist as the guilt of this crime stuck in his mind like an Insect and kept buzzing and would let him live in peace and in the end the artist killed himself before making his masterpiece.,--,KYOM (Insect)
495,4.5,['David Pérez Sañudo'],DESCONOCIDO,"A mother goes to visit her daughter, just when she was going to leave. The daughter is in a hurry: she has argued with her husband and if she doesn't get to her new exhibition, the relationship is in danger.",--,La colcha y la madre
496,5.7,['Ian de la Rosa'],"['Jana Diaz Juhl', 'Ian de la Rosa']","Hadoum, Fatima, Sheima and Sokayna live in El Puche, a deprived suburb of Almeria, Spain. They are proud of their roots, a blend of North African and Spanish Cultures. The girls have to cope with a difficult reality, most of their opportunities are just dreams but instead of giving up they're fighting for it. They will realize that together they can achieve anything t... Read all",--,Farrucas
497,--,['Lorna Kidjo'],DESCONOCIDO,"When Sasha's mother doesn't show up to her fiancé's funeral, she invites her over for dinner to settle the matter. The evening becomes increasingly sinister when her mother lets Sasha in on a little secret about her fiancé's death.",--,Fester
498,--,['Zach Tirone'],DESCONOCIDO,"After the unexpected death of his wife, a man grapples with his place in the world and a deadly secret.",--,Miles to Go
499,9.2,['K.J. Chaves Santos'],DESCONOCIDO,Two twin brothers and their adventure against an invasion of evil spirits.,--,Little Trees Everywhere
