131,6.9,['Tom Campbell'],"['Tom Campbell', 'Adam Spellicy', 'Annie Thatcher']",A Mixed Martial Arts fighter wrestles with the news she is pregnant in the lead up to the most important fight of her career.,--,The Bends
132,7.4,['Tom Ruddock'],DESCONOCIDO,"Two years after climbing Ben A'an, a once love struck couple return to repeat the steep hike, this time with a challenge that wasn't on the map.",--,Ben
133,--,['Anna Niebert'],DESCONOCIDO,"Grieving the suicide of her best friend, a young college student decides to take matters into her own hands and confront the perpetrator that caused her friends downward spiral.",--,Rose
134,7.6,['Stewart Hannah'],DESCONOCIDO,Matt attends group therapy to open up about being raped.,--,Wrecked
135,--,['Peter Mahan'],DESCONOCIDO,A drug addict must choose between killing a man to get out of debt or being torn apart by the ruthless drug dealer he owes money to.,--,Under the Mercy
136,--,['Frederick Tabiyus Nah IV'],DESCONOCIDO,"Diminished chronicles a young, talented musician who must learn that failure and loss can be the catalysts that sparks our creativity and the foundation that anchors our magnum opus. Diminished in our modern vernacular means to make or become less. In regards to music, diminished is a particular chord which is not a commonly used because of its dissonant, unique sound... Read all",--,Diminished
137,--,['Jesserey Tugas'],DESCONOCIDO,"In downtown Las Vegas, Vic, a middle aged bartender searches for a young girl's father who neglectfully abandons her in a casino lounge.",--,All-In
138,--,['Andrew Carter'],DESCONOCIDO,"""Uncle"" captures the essence of an Indian-American father/son relationship told through three car rides over ten years.",--,Uncle
139,7.1,['Morad Mostafa'],DESCONOCIDO,"Mariam goes to a public hospital with her husband and her daughter, bleeding and suffering from a severe pain in her abdomen.",--,What We Don't Know About Maryam
140,--,['Rauli Ylitalo'],DESCONOCIDO,,--,Lennä
141,--,['Rubén Pascual Tardío'],DESCONOCIDO,,--,Es Navidad
142,--,['Chris Henry'],DESCONOCIDO,Two friends in search of an urban myth encounter a strange force beyond their control.,--,Fish Out of Water
143,--,['Braden Friedman'],DESCONOCIDO,"A single mom and her two kids think they've won a million dollars through the McDonald's Monopoly Game, but when a game piece goes missing- the family is thrown into disarray.",--,Monopoly Game
144,--,['Brian Naughton'],DESCONOCIDO,A high school pianist's entire world comes crashing down when he begins to lose his hearing,--,Making Beethoven Proud
145,--,['Kristi Hoi'],DESCONOCIDO,A man's life in three vignettes as he navigates his sexual identity amidst tradition in Hong Kong's notorious Kowloon Walled City.,--,"No Law, No Heaven"
146,--,['Randy Valdes'],DESCONOCIDO,"Marlie, a dutiful assistant who dreams of being the theater's next star, struggles to wrangle a flamboyant cast of characters for a closing performance of ""The Bitter Tears of Petra von Kant"" their adaptation of Fassbinder's text. Along the way she learns that what she thought would bring her closer to her big break, is actually what is keeping her from her dreams. De... Read all",--,Petra
147,--,['Didi Asuzu'],DESCONOCIDO,Two people from vastly different lives sharing a moment that could change each other's futures forever. One offers the other a choice which leads them to discover intimate details about themselves and each other.,--,Chasing Cars
148,--,['Billy Williamson'],DESCONOCIDO,,--,The Ghost of Something More
149,--,['Cameron Morton'],DESCONOCIDO,"In the fall out of a sexual experience marked by muddy lines of consent, Laia slips into a late-night diner where she finds unexpected solace.",--,Whalebone
150,9.1,['Tom Morgan'],"['Tom Morgan', 'Jacob Sherwood']","Wracked with guilt, Mark, young and unemployed, turns to alcohol to cope with his depression. However, he is forced to confront his dark past when he attends a house party and things take a dramatic turn.",--,Grey Sea
151,5.9,['Kerry Chalmers'],DESCONOCIDO,"Tyler, a young gay man who is HIV positive, must deal with the demons of his past when he is confronted by a mysterious woman.",--,Mummy Brown
152,--,['Derek Zen'],DESCONOCIDO,"A woman tries to connect with her French mother, who suffers from dementia, by re-creating a delicious dish she remembers from her childhood. Food holds a special power in allowing us to access with our deepest memories and fondest love.",--,Cassoulet
153,--,['Osvaldo Ozuna'],"['Osvaldo Ozuna', 'Alci Rengifo']","Years after being separated from his mother at the southern border, young Dominik is forgetting the details of her face. He must have to confront his darkest fears in order to draw an accurate portrait of his mother and save the memory.",--,Ink
154,--,DESCONOCIDO,DESCONOCIDO,DESCONOCIDO,--,Error nombre para la pelicula con id: tt11055560
155,--,DESCONOCIDO,DESCONOCIDO,Man frees his ego and learns a hard lesson of pure selflessness when the stranger asks for his help.,--,Breadcrumbs
156,--,['Natasha Maidoff'],DESCONOCIDO,A narrative film that touches on the issues of opiate orphans effected by the opiate crisis in southeast Ohio. The film was shot on location in the foothills of Appalachia.,--,The Fullest Day of Summer
157,--,['Peter Pontikis'],DESCONOCIDO,Three young men accidentally sets fire to a hedgehog while make a fire.,--,Beneath the fire
158,--,['Kirsty Mclean'],DESCONOCIDO,"A teenage boxer tries to fill her idolised and abusive fathers space in the family, after his sudden passing.",--,Opal
159,--,['Robert Gregson'],DESCONOCIDO,"After a blowout fight, Julia's boyfriend is perfect but eerily unrecognizable.",--,A Good Couple
160,6.5,['Dheeraj Jindal'],"['Sudeep Nigam', 'Parijat Joshi']",A small town girl with many aspirations has moved to a metro city to fulfill her dreams. Now what if she needs to choose between justice and her dreams?,--,Vikalp
161,--,['Alana Spencer'],DESCONOCIDO,,--,Gud
162,--,['Ori Manahan'],DESCONOCIDO,A homeless man spends his life surviving day to day in a monotonous cycle. Each day simply fades into the next. But one day he gets an idea that will transform his life. The only question is: what will he do with his newfound opportunities?,--,Greg
163,--,['Molly Shears'],DESCONOCIDO,"After the sudden death of her older brother, Dezzy spends her summer break encountering mysterious creatures, including a doormat-stealing cousin and a beast in the woods.",--,Middle of Nowhere
164,--,['Michelle Godoy Priske'],DESCONOCIDO,An aspiring singer headed to LA learns a hard lesson about rest on the road of life in pursuit of her dreams.,--,The Long Haul
165,--,['Mina Soliman'],DESCONOCIDO,,--,Going Under
166,--,['Jay Nunez'],"['Ruben Avitia', 'Jay Nunez']","As if Salvatore ""The Don"" Pazzarelli didn't have enough to deal with being investigated by law enforcement, now he has to worry about his daughter Alison going to jail over something found in her car. It's at this point The Don calls in an old family friend Detective Frank Sandstrom to assist in ""helping"" out his old friends.",--,The Don
167,--,['Bridget Pervalle'],"['Bridget Pervalle', 'Abike Washington']",,--,"Wanda, Do the Work"
168,--,['Rishi Gandhi'],DESCONOCIDO,"Rajan's relationship with his father fractures under the weight of his mother's illness, that has turned her into an undead zombie.",--,Mater Mortis
169,--,['Edmond Mandro'],DESCONOCIDO,"His son's autism syndrome caused an emotional earthquake in the life of Sajmir which shook not only the foundations of the family, but also the love he has for his wife, Elsa. Sajmir became more introverted and the mask of the clown came to his help, whereas Elsa tries not to lose any of them. However, getting to know Alvin, his colleague's child with autism, made Saj... Read all",--,The Clown
170,7.9,['Marcos de la Rosa'],DESCONOCIDO,,--,Vagabond
171,--,['Rachel Earnest'],DESCONOCIDO,"In love with her best friend who has just married someone else, a young college student, still living at home, becomes confounded by faith and ultimately must risk telling her parents who she really is in order to save herself.",--,Moving Out
172,7.3,['Leila Jordi'],DESCONOCIDO,,--,Nagypapa
173,8.3,DESCONOCIDO,DESCONOCIDO,"A young woman's grand finale in her pursuit of artistry, and Dallas.",--,"I Wanna Make a Movie, or I Wanna Die Trying"
174,--,['Konstantin Pivovar'],DESCONOCIDO,"Year 2025: the presence of God is a proven fact. A young painter has to get a permission from the Priest in order to leave this world. However, the reasons she states are not as obvious as they seem first.",--,Paintless
175,--,['Riley J. Ewing'],DESCONOCIDO,"In a world where everyone is so addicted to their phones that they are literally connected via a wire that stems into their spines, a man searches for connection.",--,Unplugged
176,--,DESCONOCIDO,"['Chin-Wei Chang', 'Lan-Chi Chien']",An 8-year-old girl has to hold onto the image of a happy family after her father ran away from home.,--,Dolly
177,--,['Patrick FitzSymons'],DESCONOCIDO,1970s Belfast. A newly-adopted kid lives in his Wild West imagination while trying to come to terms with his new parents - and they with him.,--,Coyote
178,--,['Chin-Wei Chang'],"['Chin-Wei Chang', 'Lan-Chi Chien']","A 14-year-old boy babysitting for a single mom, struggles to hide his growing infatuation.",--,Corn
179,--,['Brendan Meyer'],DESCONOCIDO,"When Judith finds Adam after his attempted suicide, they end up on a search for their childhood haunt in the Californian desert. Home Again is a darkly humorous story about two queer friends moving forward after life has fallen apart.",--,Home Again
180,5.3,['Kasper Juhl'],DESCONOCIDO,"Silas becomes tormented by a cockroach that invades his thoughts, causing him to terrorize his girlfriend and sister. He must find a cure for his mental breakdown before it's too late.",--,Kakerlak
181,--,['Robert Zerbst'],DESCONOCIDO,,--,A Glimpse Into Trauma
182,--,DESCONOCIDO,DESCONOCIDO,DESCONOCIDO,--,Error nombre para la pelicula con id: tt11192394
183,--,['AJ Lovelace'],DESCONOCIDO,"Forced to attend group therapy, Nicole (Karen Summerton) begins to explore her relationship with loss and grief when she meets Ellis (Tamika Pettway) and James (Alec Wirth).",--,Good Grief
184,--,['Leandro Imaz'],"['Kathleen Cannon', 'Åsmund Brede Eike', 'Leandro Imaz']","Inner Calling is a bittersweet story about Benjamin, an 8 year old kid who is fighting for his dream of playing tennis against his father wishes.",--,Inner Calling
185,--,['Montana Mason'],DESCONOCIDO,"Persuaded by a friend to come to the bar and perform, Levi, a transmasculine drag performer, finds himself in a compromising situation when he is outed by another jealous drag queen. Exploring the divides within the queer community, and the pain that lies within othering our own people.",--,Boysugar
186,--,['Chloe Shelton'],DESCONOCIDO,"The year is 1781. America is divided in unrest as some Colonists are loyal to King George of England, and others are determined to enforce their Declaration of Independence under General Washington's leadership. In a reflection of the nation's division, many families are also divided down enemy lines. The Yates Family is one such family. Patriot family members defy Lo... Read all",--,Wayward
187,--,DESCONOCIDO,DESCONOCIDO,"Master Sgt. Chad Sikeston receives the Purple Heart and Medal of Valor award after being shot 3 times in Afghanistan while trying to assist some fellow soldiers. After he recovers, he returns to Missouri to face a much bigger issue.",--,Pray They Stand Down
188,6.2,['Maisie Richardson-Sellers'],"['Charlotte Casey', 'Maisie Richardson-Sellers']","New to L.A., Esi stumbles upon a diverse, vivid party, and for the first time she's welcomed into a community where she can let go of societal and family pressures and venture towards self-acceptance.",--,Sunday's Child
189,--,['Tiffany Albright'],DESCONOCIDO,A struggling young mom plots to hustle her way out of hardship and get back at her disapproving family after she learns she's pregnant with her third child.,--,A Great Expanse
190,--,['David Djaco'],DESCONOCIDO,,--,"Happy Birthday, Corey"
191,--,['Mirlande Amazan'],DESCONOCIDO,The intrapersonal fragility of a psychologist's life is revealed as she helps others navigate through the issues in their own lives.,--,Life...
192,6.4,['Alexandra Matheou'],DESCONOCIDO,"Tina lives in Limassol which is now slowly becoming the oligarch paradise of the Mediterranean. Being both a player and a victim in this city transformation, Tina feels overwhelmed - until an extraordinary encounter changes her life.",--,A Summer Place
193,--,['Jon Mancinetti'],DESCONOCIDO,Anyone can be a hero in their brother's eyes.,--,Super Bois
194,--,['Jack Curtis'],DESCONOCIDO,"Rhea (13) is the primary carer for her father who self medicates with cannabis; the only remedy he's found effective to offset his pain. When school bullies find out that his medicine is home-grown, Rhea quickly learns that sharing is not always caring.",--,Growing Pains
195,--,['Josh E. Jacobs'],DESCONOCIDO,,--,The Jungle
196,--,['Patrick Crellin'],"['Patrick Crellin', 'Bethany White']","William is a farmer in the Manx countryside who keeps to himself - until Nancy comes along. A free-spirited traveller, she enchants him into a whirlwind romance. But six months later Nancy is missing. William becomes isolated once more, letting the farm slip into disrepair and visited only by lifelong friend Jane. Nancy's absence causes unspoken tensions, and someone ... Read all",--,The Lost Wife
197,--,['Christopher Hills Eaton'],"['Christopher Hills Eaton', 'Brad Post']","Rich Foster, a lowly banker on trial for embezzlement, is visited by a few of the ""interested parties"" in his case the night before he is due to testify in court, all in an effort to clear his name.",--,Dance Card's Full
198,--,['Vladislav Alex Kozlov'],DESCONOCIDO,,--,The Duel
199,8.0,['Jefferson Stein'],DESCONOCIDO,A young Indigenous girl discovers a Latina migrant her age who has been separated from her father in the beautiful but dangerous Sonoran desert.,--,Burros
200,6.3,['Chloe Lenihan'],DESCONOCIDO,,--,Time
201,--,['Jason Gurvitz'],DESCONOCIDO,"A former Guatemalan special forces major struggles to get his family to America for asylum, but just over the US border he runs into an old ally who is now a human trafficker and in a moment of conscience rescues a girl from him and his men. In order to escape the slavers, the Major and his family will find aid from an unlikely source, a Quaker woman who wanders the d... Read all",--,In the Desert of Dark and Light
202,--,['Daniel Andres Gomez Bagby'],DESCONOCIDO,"On the verge of death, a man must decide whether or not to trust a stranger with questionable intentions.",--,The Climbing Perch
203,--,['Aliyah Curry'],"['Aliyah Curry', 'Kareem McMichael', 'Patrick Tennerson']",,--,Intervention
204,--,DESCONOCIDO,DESCONOCIDO,"The Girl who Dreamt Instead is a magical realism story about a young girl in Norway who, upon learning her family is being deported, finds herself trapped in a fantastical wilderness.",--,The Girl who Dreamt Instead
205,--,['Daniel Hillel-Tuch'],DESCONOCIDO,A mother finds her daughter in the park and attempts to reconcile her own past unstable behavior.,--,Pink
206,--,['Daniel Hillel-Tuch'],DESCONOCIDO,"After sneaking into a horror film at the movie theater her grandfather works at, a young girl is confronted with another grown-up experience.",--,Thicker Than Water
207,--,['Alexander Tuschinski'],DESCONOCIDO,"An innocent young love turns toxic - Beautifully shot, realistic tale of codependency in a relationship.",--,Gas-Shaped Light
208,8.9,['Johnattan Báez'],DESCONOCIDO,A man confronts his worst trauma in the most savage way possible.,--,Back to the Cage
209,--,['Alina Kulesh'],DESCONOCIDO,"On her 30th birthday, a woman's neglected inner child runs away.",--,Little Soul
210,6.5,['Carleton Rodgers'],DESCONOCIDO,UFOs? Alien abduction? A boy finds the key to extraterrestrial connection but loses his brother in the process. Can he re-connect to get him back?,--,Transmission
211,--,DESCONOCIDO,DESCONOCIDO,DESCONOCIDO,--,Error nombre para la pelicula con id: tt11296542
212,8.1,['Robbie Bryan'],DESCONOCIDO,"After surviving a mass shooting at his elementary school, a former music teacher resorts to desperate measures to reconcile his guilt and ignite change.",--,American Morning
213,--,['Miriam Kruishoop'],"['Miriam Kruishoop', 'Laeticia Rodriguez']","Estilo Americano tells the timely story of a Mexican-American family divided by politics. What is supposed to be a festive family gathering turns into an explosive showdown when siblings with opposing political views clash. As everyone struggles with their own deeply ingrained beliefs, some painful truths are revealed.",--,Estilo Americano
214,6.9,['Cloudy Rhodes'],DESCONOCIDO,"Violet and Blue's youth collide in an early morning toke that leads to the ocean, where connection stirs. A tender, visually-charged, uplifting queer surf-romance about the nuance of gender and the refuge found in being truly seen.",--,Beautiful They
215,8.0,['John Reavey'],"['Jordi Estapé Montserrat', 'John Reavey']","In a trouble-ridden Northern Ireland, football and writing prospect Anthony's relationship with his brothers comes under danger. Exploring religious divides and the importance of family, Anthony will come face-to-face with the one thing he is trying to fight.",--,Reavey Brothers
216,8.8,['Gudmund Helmsdal'],DESCONOCIDO,"Once upon a time in the Faroe Islands, two lone brothers struggle to save the family farm and their relationship after the sudden loss of their older brother. - Inspired by true events.",--,Trøllabeiggi
217,--,DESCONOCIDO,DESCONOCIDO,,--,La Noche en el Paraiso
218,--,['BoYang Li'],DESCONOCIDO,"Chinese filmmaker, Jake, finds out his long-time girlfriend, Lin, is pregnant, so the reality forces him to choose between a man's responsibility and a dream career in a hurry.",--,Southern Burbank
219,--,['Raphaël Chiche'],"['Ilan Aferiat', 'Raphaël Chiche']","Arnaud and Charlotte are in love. The day Charlotte becomes pregnant, an unwanted pregnancy, Arnaud does not feel ready to become a father. Charlotte, on the other hand, feels ready to become a mother.",--,Une histoire de femmes
220,--,['Petter Holmsen'],DESCONOCIDO,,--,Å ha det bra
221,--,['M.R. Wilkins'],"['Elliot Wesley', 'M.R. Wilkins']",A brother and sister struggle to cope with the worsening instability of their pill addicted mother.,--,A Will to Change
222,--,['Richard E. Haywood'],DESCONOCIDO,,--,A Father's Burden
223,8.5,DESCONOCIDO,DESCONOCIDO,Three friends spend their Sundays by the sea.,--,Escapade
224,--,['William Pinkham'],DESCONOCIDO,A getaway driver is forced to rethink his current situation when confronted with the concept of manfesting his future.,--,Getaway
225,--,['Alicia MacGibbon'],DESCONOCIDO,Kaira is the story of a woman who is forced to relive suppressed memories from her childhood when she discovers her once step-father has passed away. Kaira realizes that she must find the strength within herself to cope with her past.,--,Kaira
226,--,['Lizzie Morgan'],"['Alex Breaux', 'MK Kopp']",,--,Slip
227,--,['Renier Beukes'],"['Renier Beukes', 'Lawrence Murphy']","Faced with the threat of war, a Spartan warrior struggles with honor and duty after the capture of a Persian spy.",--,Leonidas
228,--,['Izabella Pörös'],DESCONOCIDO,The journey of the Apple before it got to Eve.,--,Sin
229,--,['West Givens'],DESCONOCIDO,,--,Blueberries
230,--,['Neera Zaveri'],DESCONOCIDO,"After the death of her father, Ava processes the memories of her seemingly perfect childhood, struggling to come to terms with her parents' role in destroying her innocence.",--,"Miss You, Dad"
231,7.3,['Gustavo Milan'],DESCONOCIDO,"Marta, a young Venezuelan mother, is immigrating to Brazil when she meets a struggling young couple with a baby girl. Her ability to breastfeed causes their fates to become forever entwined.",--,Under the Heavens
232,--,['Danny Chan'],DESCONOCIDO,,--,Roadblock
233,--,['Simon Tillaas'],DESCONOCIDO,,--,Villhester
234,6.8,['Leo LeBeau'],"['James Bell', 'Leo LeBeau']","A Transgender teenage boy finds friendship in online games, away from the bullying he faces at an all-girls private school. On the day of his 16th birthday, the bullying takes an unfortunate turn for the worse. A coming of age film by an LGBTIQA+ crew.",--,Birthday Boy
235,--,['Tabia Wade'],DESCONOCIDO,,--,Veteran Affairs
236,--,['M.J. Hahn'],DESCONOCIDO,"It follows Minho Kim, whose day is disrupted by a nationwide alert that North Korea launched a nuclear bomb on course to hit California.",--,Kim's
237,7.6,['Kevin M Turner'],"['Kyle Ivan Tiner', 'Kevin M Turner']",A young man builds an artificially intelligent woman to be his perfect companion only to find out she doesn't have feelings for him in return.,--,Beta
238,--,['Florent Cornillac'],DESCONOCIDO,,--,A Frame of Mind
239,5.7,['Carlton Daniel'],DESCONOCIDO,"Working as a mortician at his father's funeral parlor, Junior cycles through an unsatisfying life routine. A night out with friends forces him to see the world as it truly is.",--,Homegoing
240,5.4,['Usher Morgan'],DESCONOCIDO,A woman suffering from severe agoraphobia must venture out in search of her lost therapy dog.,--,Homebound
241,--,['Carol Butrón'],DESCONOCIDO,"When just a small child, Teresa has to face the disappearance of her best friend, Lucas. After many years and without having forgotten him, Teresa begins to have a hunch that Lucas is alive, but in another dimension.",--,Faith
242,--,['Edo Natasha'],DESCONOCIDO,"A South East Asian man goes to great lengths to achieve his childhood dream-to become the first internationally celebrated Indonesian film director. This semi-autobiographical tale is a personal quixotism, a prayer for all who dream.",--,Thole
243,--,['Peier Tracy Shen'],DESCONOCIDO,"Unable to do so herself, Sky enlists her best friend Finley to help approach Anika, the girl of her dreams. Parked outside of Anika's apartment, Sky brings up all the reasons Finley is the right person to woo Anika on her behalf.",--,Jagged Joy
244,--,['Maxime Roedel'],DESCONOCIDO,"On his 25th birthday, Elijah decides to get his life back on track.",--,sk8erboi
245,--,DESCONOCIDO,DESCONOCIDO,DESCONOCIDO,--,Error nombre para la pelicula con id: tt11429548
246,--,['Geoffrey Cantor'],DESCONOCIDO,,--,En Suite
247,--,['Jeanett Espedal'],DESCONOCIDO,A pizza delivery boy has a night to deliver 500 Dollars worth of pizza or he will loose his job and his little brother in the process. However his first costumer Jenny has got a different agenda for him.,--,Pizza Boy
248,--,['Christian Sanchez'],DESCONOCIDO,"Pool hustler, Cue, strives to prove he's the best player in town. After a prideful loss to a former billiards champion puts Cue and his partner, Luna, in debt Cue must now work to get out of the hole and mend his relationship with Luna.",--,Chalk
249,--,['James M. Perry'],DESCONOCIDO,Concept trailer for an upcoming narrative project.,--,The Act of Indemnity
250,--,['Tim Doubleday'],"['Tim Doubleday', 'Adrian Reynolds']",An observant local believes hipsters are secretly running underground dog-fights,--,Hockley Types
251,--,['Lawrence Murphy'],"['Oscar Millar', 'Lawrence Murphy']",A young beaten down scientist is given a new lust for life in a quest to defeat death and create Immortality.,--,Immortal
252,8.2,['Andrew Sindt'],DESCONOCIDO,,--,Prisoner
253,--,['Daniel Ott'],"['Sara Rose Carr', 'Daniel Ott']",Scattered memories of connection are relived in the rooms of the apartment where they were experienced.,--,Apartment Story
254,8.7,['Joshua Thil'],DESCONOCIDO,"Michelle and Claude invite their best friends Tania and Camille, another couple, to their home for dinner to announce that they are expecting a child. However, Jacques, the comical brother of the future mother, who was invited out of pity, provides in the course of the evening for spicy moments regarding her pregnancy, which will cause fierce discussions.",--,Afentheater
255,--,DESCONOCIDO,DESCONOCIDO,DESCONOCIDO,--,Error nombre para la pelicula con id: tt11464562
256,--,['Courtney Ware'],DESCONOCIDO,,--,Soldier Plant
257,--,['Takiya Coley'],DESCONOCIDO,,--,Through These Doors
258,--,['Joe Gietl'],DESCONOCIDO,"In the wake of an unspeakable tragedy, a husband and wife seek to fill the void that has formed in their lives. He seeks refuge in memory, she seeks refuge in science. When a new breakthrough happens at her laboratory, the lines between the two cease to exist.",--,A Void
259,--,['Sokhean Jonathan Ouk'],DESCONOCIDO,A young woman comes home after learning about the loss of her mother and confronts past memories in the house she grew up in to discover emotions she had buried over recent years about their relationship.,--,"Wish, I Was There"
260,--,['Jasper Warry'],DESCONOCIDO,"Tweaks is a multi-award winning black comedy drama about Berry, an undercover life coach, who visits his mentor and godfather Morgan, for some advice on his toughest case yet - an assisted suicide client, Griff, a happily married father of three who wants to fake his natural death. Tweaks is a highly personal, singular and topical film about mental health from award n... Read all",--,Tweaks
261,--,['Takiya Coley'],DESCONOCIDO,"Jennifer, a 911 operator, goes beyond her training to help save a woman on one of America's darkest days.",--,22 Minutes
262,--,['Benjamin Howard'],DESCONOCIDO,A teenager's attempt at finding intimacy leaves him with more questions than answers.,--,Rendezvous
263,--,['Carlos Ospina'],DESCONOCIDO,,--,La Sombra de Tu Sonrisa
264,7.6,['James Patrick Nelson'],DESCONOCIDO,"When a young gay man visits his uncle in the hospital, he stumbles into an awkward ramble about sexual fantasies, which becomes a vulnerable confession about love and forgiveness.",--,Waking Up
