532,--,['Marco Mathisen'],['Marco Mathisen'],"Ellen, a young girl is on a bridge, on a random Friday night. Her motives, some what unclear. Here she meets Alex, a young and confident boy. A conversation occurs. And this conversation can save a life. Friday addresses topics such as mental health and loneliness.",--,Fredag
533,--,['Tamekia Sholts'],['Tamekia Sholts'],"Kayla, a single and loving mother, picks up her son Brandon from juvenile detention center after two years. Despite pushing her away numerous times, she still believes he is still the same son.",--,Deliverance
534,--,['Andrea Lázaro'],DESCONOCIDO,,--,Alter Ego
535,--,DESCONOCIDO,['Akshata Honnavar'],,--,The Best of Me (II)
536,--,['Andres Toro'],['Andres Toro'],Vicente's shattered mind is stuck forever within the night that he lost the woman he loves.,--,Una Noche Menos
537,--,['Christopher Lee Herod'],['Christopher Lee Herod'],,--,Letters
538,--,['Michael Camp'],['Michael Camp'],The everyday life of Actors in Hollywood.,--,Actors
539,--,DESCONOCIDO,['Kevin Kapellas'],"A desperate man with his back to the wall, calls upon his ex-convict older brother to do some dirty work with him.",--,A Lion's Heart
540,--,['David Adams'],['Michiel van Wyngaarden'],"A short visual poem, exploring the pushing aside of ingrained habits we have erected to manage our lives, often with others. The reaching out for something new and different. Change is easy, but can be very challenging.",--,I'll Have an Other
541,--,['Sydney Ribot'],['Sydney Ribot'],"When an innocent game puts two sisters face-to-face with death for the first time, one must choose whether to protect the other from the irreversible consequences of their play.",--,Yours to Bury
542,4.4,['Justin Wilder Neese'],['Keith Sharon'],"""My Melancholy Baby"" takes a look at 48 hours into the difficult life of the Burrows family. This story is told through the eyes of the older son, Miles Burrows, a 19 year old drug addict who hasn't been home because his home life is the underlying reason for his addiction.",--,My Melancholy Baby
543,7.8,['Jake Weisler'],['Jake Weisler'],"After World War III, in 2031, a young man fights his way across a desolate American terrain to see his family and to rediscover the very essence of life -- water.",--,Essence
544,--,['Sara Scalera'],['Antonio Romagnoli'],,--,In braccio alla corrente
545,--,['Christopher Kennedy'],['Christopher Kennedy'],"After years of searching, a soldier from WW2 fulfills the promise he made to his best friend.",--,The Promise
546,--,['Charles O Brien'],DESCONOCIDO,"A recreation of a Victorian era, music infused, tour of Killarney's lakes. There are 6 people aboard a boat, two boatmen speak Irish, two women English. One boatman's brother is on the run, one of the ladies has lost her wedding ring.",--,Macalla Chill Áirne
547,--,['Kirstie Munoz'],['Kirstie Munoz'],A poetic narrative following Lenna's discovery to self-love.,--,Loving Lenna
548,7.9,['Richard Prendergast'],['Richard Prendergast'],"A young warrior's fight for his life, told through the eyes of his younger sister. Infused with imagination, tragedy and magic.",--,Maximus
549,--,['Orkhan Aghazadeh'],['Nuri Tal'],"A young girl finds herself in a quiet town in Portugal, where a peculiar and unsettling form of therapy opens up to her as the ideal way to conquer her overwhelming grief after a recent personal tragedy.",--,The Womb
550,--,DESCONOCIDO,DESCONOCIDO,DESCONOCIDO,--,Error nombre para la pelicula con id: tt13197326
551,--,['Mickey Angelov'],['Mickey Angelov'],Six strangers enter the bathroom at a party. Solitude reveals their true colors.,--,Over-Saturated
552,6.0,['Greg Hall'],"['Greg Hall', 'George Russo']",The story follows Nicky Reed a sexually repressed London Black cab driver who's life quickly falls apart when he relapses into drug addiction.,--,Baby Boy
553,7.2,"[""John 'Quig' Quigley""]","[""John 'Quig' Quigley"", 'Mark Sanderson']","""60 SECONDS"" is a short film filled with suspense, and twists right until the final second by award-winning director/producer John ""QUIG"" Quigley.",--,60 Seconds
554,--,['Luke A. McKay'],['Luke A. McKay'],A high stakes night of poker between lifelong friends takes a wicked turn when all their dirty secrets are revealed.,--,You're No Angel
555,--,['Adam Hodge'],['Adam Hodge'],"Julia has made the tough decision to put her delusional father in a psychiatric ward for his own good. When she goes to confront him, she learns a long kept family secret that changes her life forever.",--,I Was Nobody
556,--,['Aleksandra Yermak'],['Aleksandra Yermak'],"A night like no other. A man and a woman come together to share an intimate moment, heavy with anxiety. Fed with images of violence, their minds grapple with intangible and diffuse feelings, like an icy breath on the neck.",--,Bodily
557,--,['David Kennedy Polanco'],['David Kennedy Polanco'],"Ex-con, racist Hunter is caught in Octavio's supernatural web of desire.",--,"Far, Far Away"
558,--,['Luke Walters'],DESCONOCIDO,Student Bethany is thrust into a difficult situation after boyfriend Aaron finds out her future plans which then leads to an altercation that will change her life forever.,--,Take Control
559,--,['Arun Mohan'],DESCONOCIDO,,--,The Color of Art
560,--,['Michael Goldermann'],['Michael Goldermann'],A twisted coming-of-age story about the secret life of two small town teens on Halloween night.,--,Lollipop
561,--,['Louise Brix Andersen'],['Louise Brix Andersen'],,--,The Pill
562,8.2,['Nikita Fedin'],"['Nikita Fedin', 'Julia Fedina']",A lazy and infantile cat is thrown off balance by problems pulled by the tail.,--,Difficulties
563,--,['Daniele Amandolini'],['Daniele Amandolini'],"When Peter returns to his small hometown to tell his friends he plans to stay in the city he moved to for college, he's met with bitterness and resentment. As the night progresses, he lets doubts creep in before he finally realizes what's best for him.",--,Homecoming
564,--,['Chloe Kennedy'],['Chloe Kennedy'],"A coming-of-age dance film that follows 16-year-old Robyn, grappling with social anxiety and depression, expressing herself through the medium of tap.",--,Robyn
565,--,['Adam Thom'],['Adam Thom'],A young woman has to say goodbye to her best-friend on the night of his fathers funeral.,--,"Hello, Goodbye"
566,7.8,['Javier Beltramino'],"['Javier Beltramino', 'Sofía Gómez-Córdova']","An immigrant has promised his young son that he will talk to his teacher about an unfair scolding, but his limited French prevents him from doing so. After dropping his son at school and leaving him disappointed, he begins his daily job searching routine when he realizes he has lost his son's favorite book, which had been entrusted to him that morning while the two of... Read all",--,Lobo solitario
567,--,['Sam Goodwin'],['Sam Goodwin'],A young woman struggles with the frustration and rage of being ignored.,--,12pm EST
568,--,['Agatino Zurria'],['Agatino Zurria'],"Seven characters isolated in their own homes, contact one another, in hopes to find love and solace. This digital connection cannot fix years of mistreatment and selfishness.",--,Love Distance
569,--,DESCONOCIDO,DESCONOCIDO,DESCONOCIDO,--,Error nombre para la pelicula con id: tt13223280
570,--,['Sonya Padalka'],"['Alia Azamat Ashkenazi', 'Sonya Padalka']","Alisa, 24, is a passionate architect, who tries to build a loving relationship with her boyfriend, but questions if everything is that perfect between them after meeting a domestic violence victim.",--,Stay
571,--,DESCONOCIDO,DESCONOCIDO,Two former friends are forced to recollect a tragic event that is buried deep in their history after being captured by the FBI.,--,Hidden Enemies
572,--,['Primo Justice Schiappa'],['Primo Justice Schiappa'],Remnants follows Lucas as he works in his run-down workshop to combine science and magic to bring his love back to him.,--,Remnants
573,--,['Christopher Siaens'],['Christopher Siaens'],"Aleera, a young woman troubled by failed relationships and a previous abusive marriage, discovers a new strength within herself to move on from her troubles and live a fulfilling life.",--,La Vie de Aleera
574,--,['Elle Mercurio'],DESCONOCIDO,,--,Cranked 2020
575,--,['Sebastian Rico'],"['Rebecca Ballard', 'Francisco Martin del Campo']",Luis becomes desperate when a string of events leaves his Mexican restaurant on the brink of financial ruin. But it is moments like these that remind us what matters the most in life: Family.,--,Managing
576,--,['Shaquayla Mims'],['Ama Larbi'],An undocumented housekeeper faces exploitation and sexual harassment from her employers to save her ill-stricken brother before he falls into a diabetic coma.,--,Housegirl
577,--,['Mark Datuin'],['Mark Datuin'],A woman has a chilling encounter with her estranged daughter.,--,Charlie
578,--,['Jonatan Jiménez'],['Jonatan Jiménez'],"A young couple drive their car on a lonely road at night. Suddenly, strange lights in the sky illuminate them. They stop the vehicle and see that it is a UFO.",--,Reencuentro
579,--,['Christos Bitsakos'],['Christos Bitsakos'],,--,Righteous Path
580,6.6,['Saul Abraham'],['Callum Cameron'],"As home tutor Michael (Himesh Patel) seeks ways out of his spiraling depression, a moment of hope arrives via an unexpected source.",--,Enjoy
581,--,['James Niebauer'],['L.B. Bachem'],A young woman has to deal with the death of her mother and the future life she will lead.,--,P.S. I Love You
582,6.4,['Julio Mas Alcaraz'],"['Julio Mas Alcaraz', 'Carmen Mas Choclan']","Dania lives in a town outside of Madrid. In the morning, she drops her daughter Ruth at school and goes to the flower shop that she runs. After doing various tasks, she starts going over her taxes for the quarter. Times passes by and she suddenly realizes that something has gone terribly wrong around her.",--,El silencio en las flores
583,--,['Oleksandra Haloshyna'],['Anastasiia Volkova'],,--,The italian date
584,9.1,['Robert Mann'],['Robert Mann'],"Unable to emotionally communicate a young ""Gen Y"" couple ends their six year relationship via text messaging.",--,Done Talking
585,6.6,DESCONOCIDO,['Eva Libertad'],"Angela is deaf and Darío is hearing. They are a couple and have six chickens, four dogs, a vegetable garden and many communication problems. Now they also want to have a child.",--,Sorda
586,--,['Derrick Perez'],['Derrick Perez'],"A story about a young man raising his young siblings in an abusive household. Experience the struggle for hope as the young man fights to keep the his family that has been through so much, together.",--,Eyes to the Sky
587,--,['David Jimenez'],['Matthew Capron'],,--,Bottom of the Bottle
588,--,['Brendan Prost'],['Brendan Prost'],"An eerie bifurcated character drama about a queer encounter between two lonely cat enthusiasts, and a macabre test of one's social obscurity.",--,Heavy Petting
589,--,['Bailey Graham'],['Bailey Graham'],,--,Emily
590,--,['Vince Williams'],DESCONOCIDO,A look into the life of an Apollo astronaut from entrance interview to training to lunar missions.,--,Prepare for Launch
591,--,DESCONOCIDO,"['Welyton Crestani', 'Gui Morilha']",,--,Barbara
592,--,['Lizzy Born'],"['Dana Fares', 'Katie Ryan']",,--,Bathwater
593,--,['Matthew Crouch'],['Matthew Crouch'],A young woman preparing to leave for college must decide whether or not to visit her estranged father who has been reaching out to her.,--,Calling Out
594,--,['Jared Hargreaves'],['Jared Hargreaves'],,--,Assorted Numbers in a Paddock
595,--,['Valory Pierce'],['Valory Pierce'],,--,My Art Boyfriend
596,--,['Brian DeRozan'],['Brian DeRozan'],,--,Black Face
597,--,['Carlie Raymond'],DESCONOCIDO,"Evelyn is a driven, unconventional single mother who strives to conceal the fact that she's affected by societal class disparities. When her housing arrangements unexpectedly collapse, she resolves to endure another night without shelter. Facing increasingly adverse circumstances, she becomes apprehensive about social stigma. She realizes the necessity of overcoming h... Read all",--,One More Night
598,--,['Eamon Kelly'],['Eamon Kelly'],"A woman with a severe stutter discovers an old radio that begins to speak directly to her, but in the fluent version of her own voice.",--,Voice Box
599,--,['Loris Abrignani'],"['Loris Abrignani', 'Marco Spinetti']",,--,Reuza
600,--,['Lesette Maxwell'],['Lesette Maxwell'],A recently suspended Sawyer Rosen is challenged to embrace his last chapter of childhood. Even if he's the only one doing it.,--,Fish
601,--,DESCONOCIDO,['Cam Cashaw'],Evan and Zach have been together for three years. On Zach's birthday Evan does something really special for him to show how much he loves him.The day of Zach comes clean to Evan about a deep dark secret he's been keeping from him that could change their lives forever.,--,Betrayed
602,--,['Christopher Siaens'],['Christopher Siaens'],"A story of coming together, despite the darkness of the world.",--,Through the Ashes
603,--,['Marisa Avitia'],['Marisa Avitia'],,--,Orchid Daydreams
604,--,['Taylor Ferguson'],['Taylor Ferguson'],"In the face of violence, Drew is forced to build her own body armour and overcome her bully dad. A subdued, sobering story about the harsh truths learnt in childhood.",--,Tough
605,--,DESCONOCIDO,['Sandra Penzo'],,--,Ber inte om det
606,8.2,['Fayez Abou-Khater'],['Fayez Abou-Khater'],"Debts, an economic crisis, hunger, a city blast; Abdo seeks to live a normal day in Beirut while the landlord pressures him to pay his rent debt.",--,The System
607,6.2,['Robert Silver'],['Darryl Jones'],"A young woman is about to travel out of the country for the first time in her life. Before her flight, she learns the powerful gift of self love from an unexpected stranger.",--,Departure
608,--,['Kris Van de Sande'],"['Kris Van de Sande', 'Sedrick Vangronsveld']",,--,Help
609,--,['Megan Ritchie'],['Megan Ritchie'],,--,Sniff
610,--,['Forest Quaglia'],['Forest Quaglia'],"Milo Jackson returns home from war to find himself lost within his fragile psychological state; Isolated with his darkest memories, he fights the greatest battle of his life.",--,Lost in Solace
611,--,['Clarence Horatio'],['Clarence Horatio'],"Prize fighter, Marcus ""Hurricane"" Smalls, must choose whether to fight battles inside, or outside of the boxing ring.",--,Wake Up.
612,--,['Corey Emanuel Jr.'],['Corey Emanuel Jr.'],A widower delivers a word of guidance to his stepson.,--,Like Trees
613,8.4,['Julie R. Ølgaard'],['Julie R. Ølgaard'],"Louise is living in a happy relationship, however there is a savagery within her. On a business trip to Paris, she is seduced by the mysterious and alluring Olivia - and it turns her life upside down.",--,We'll always have Paris
614,--,['Galina Chakarova'],['Galina Chakarova'],"A young girl spends her time roller blading, when pandemic reality forces her to face the changes in her family.",--,Gliding
615,--,['Lloyd Edgar'],['Lloyd Edgar'],A young student's relationship changes when she goes overseas for University and the couple must learn to cope with the separation.,--,What We Left Behind
616,--,DESCONOCIDO,"['Bralyn Stokes', 'Jessica Walter']","Robby Miller (Bralyn Stokes), a former army soldier leaves the military after his wife's sudden death to raise his son JJ (Jackson Hammer). As the pressures of single fatherhood and his wife's death start to build, Robby finds himself in a place he never thought he'd be.",--,Glaciers
617,--,['Carlie McCann'],['Carlie McCann'],"In this nightmare tale, we follow our protagonist Frankie; a formerly drug addicted man returning home to a past he no longer recognizes.",--,Welcome Home Frankie
618,--,['Jonathan Leroux'],"['Jonathan Leroux', 'Omar Rasool']",,--,I'm fine
619,--,['Kai Lendzion'],"['Kai Lendzion', 'Ben Tillona']",Two avid methamphetamine users close a garage door to find find themselves trapped in an addictive horrifying loop of constant drug abuse. Pressure to continue usage causes all hope to be lost once our protagonist decides to continue to smoke rather than choose to leave.,--,Residue
620,6.8,DESCONOCIDO,"['Sam A. Davis', 'Rayka Zehtabchi']",A dead car battery leaves Safa stranded alone in a strip mall parking lot.,--,Are You Still There?
621,6.1,['Daniel Mart'],['Oli Hughes'],A young man tries to deal with the repercussions of his former life.,--,Corner
622,8.5,['Ruben Wallgren'],['Ruben Wallgren'],It's Walpurgis Eve in Sweden; a spring holiday associated with bonfires and partying. An awkward young man reluctantly follows his popular brother to a party. It becomes quite an eventful evening.,--,The First Bonfire of Spring
623,5.2,['Samuel Gonzalez Jr.'],['Samuel Gonzalez Jr.'],"A haunted veteran plagued by guilt and hallucinations struggles with the murder of an innocent civilian girl. Wishing to end it all as he tries to make sense of his past and fractured reality, a mysterious young woman changes everything.",--,That night
624,--,['Kate Surinskaya'],['Kate Surinskaya'],A teenager in suburban Russia fights for the approval of her working-class parents in pursuit of her dream to become an actress but has to face another battle when she finds out her mom is terminally ill.,--,Parallels
625,--,['Yutaka Akiyama'],"['Yutaka Akiyama', 'Daniel Ongko']",A woman about to take her own life meets a mysterious stranger in the woods.,--,On the Edge
626,--,DESCONOCIDO,['Alan Overton'],,--,Torchwood: Decades and Decades
627,--,['Anthony Paulino'],"['Laval Alsbrooks Jr.', 'Anthony Paulino']","An American family crumbles to the pressures of different ideologies, racial injustice, and being Black in America.",--,Divide: Time to Breathe
628,--,['Alberto Olivieri'],['Alberto Olivieri'],A woman enters a world where she brings about the inevitable.,--,The Infallible Art of Deflation
629,--,['Debi Bradshaw'],DESCONOCIDO,"A timid ornithology professor experiences technical difficulties during her PowerPoint presentation, leading to emotional unraveling and self-discovery in front of an impatient audience.",--,Soundman
630,--,['Marissa Vonn'],['Marissa Vonn'],"Small town obituary writer, Helena, must decide to face their past or run when their own death notice lands on the desk.",--,Next of Kin
631,--,['Davon Gilliam'],['Davon Gilliam'],"Hannah, a woman who possesses a 'special gift' seeks revenge on her unfaithful boyfriend.",--,The Hannah Games
632,--,DESCONOCIDO,['Jake Wilson-Wainwright'],"In 1967 Soyuz 1 left the earth to test the viability of space exploration, the Soviet Union was desperate for a giant leap forward in the space race. What was meant to be a mission of national pride, turned into an exercise in covering up mistakes at the highest level. Commander Chertok struggles to keep control of one of the most ambitious missions undertaken in the ... Read all",--,Soyuz 1
633,--,['Loósz Balázs'],['Áron Gasztonyi'],"By doing a small favor for his long-estranged mother, Károly is about to find out some things about the past that may change their relationship forever.",--,Anyámért mindent
634,--,['Sam Adigun'],"['Feyisayo Anjorin', 'Isaac Odeniran']","I Want Out is the story of a woman married to a successful property developer, who is rich, powerful but oppressive. She is not content with being the wife and mother of two children, she is dissatisfied with her life - she must have all her husband's wealth. She wants everything. Driven by her greed she decides to murder her husband, but by a twist of fate, she does ... Read all",--,I Want Out
635,--,['Alex Paikada'],"['Alex Paikada', 'Sebastian Paikada']","Doug, who committed a horrific crime in the past is released from prison after serving a 20 year sentence, only to realize the world he had left behind is no more and very different.",--,Jailbird
636,8.4,['Emilio Subia'],['Emilio Subia'],"In the heart of Corona, Queens, two Ecuadorian siblings are placed at odds with each other when one reveals a sudden urge to leave their home.",--,Ñaños
637,--,['Rune Lange Abildgaard'],['Rune Lange Abildgaard'],"Tea has decided to cancel her summer vacation to come visit her family house to be with her mother, who is struggling with cancer. While she's at home, she falls in love with her father's helper, Anton, who invites her to come travel with him.",--,Hybenhjerte
638,6.9,['Fawzia Mirza'],['Fawzia Mirza'],"Five prayers coincide with five stages of a Muslim couple's relationship, demystifying queerness in the Muslim community and religion in queerness.",--,Noor & Layla
639,--,['Razor'],['Razor'],A young boy who suffers vicious bullying at the hands of his older brother loses himself in the world of pro-wrestling as a means of escapism.,--,Wrestling with Reality
640,--,['Richard J. Lee'],['Richard J. Lee'],,--,Wastelands
641,--,['Ruel Smith'],['David Hunter Jr.'],A conversation between childhood friends adds another layer after the death of a loved one.,--,Close to Home
642,--,DESCONOCIDO,DESCONOCIDO,DESCONOCIDO,--,Error nombre para la pelicula con id: tt13298880
643,7.2,['Elijah Noble El'],['Elijah Noble El'],"In their third session together, a troubled sex addict seeks help from a therapist for his isolating, self-destructive vices.",--,Goodnight and Goodbye
644,--,['Valerii Mironov'],['Valerii Mironov'],A young girl is ready to sacrifice the most important for the future of cinemas,--,The Real Folks Kino
645,--,['Kimberly Hauser'],['Kimberly Hauser'],"Annie is moving to a new place, but the process of moving has left her nervous and restless. However, at the last minute, she finds exactly what she needs in an empty drawer. The surprise? The heartfelt support she was looking for arrives from an unexpected source. Sometimes all you need is a little love- from yourself.",--,Sincerely and Literally Yours
646,--,DESCONOCIDO,['Camrus Johnson'],"A group of vigilantes called The Blue Bison abduct wrongdoers and coerce them into confessions, forcing them back on the straight and narrow. Tonight, the consequences that unfurl from their attempt at justice may change every life in that room forever.",--,Blue Bison
647,--,['Guy Taylor'],"['Leda Douglas', 'Guy Taylor']","Dinah is preparing for her first ever fight as an amateur kick-boxer. As the fight approaches she attempts to re-connect with her father, however this brings back traumatic memories from the past.",--,Dinah
648,--,['Jeremy Lee MacKenzie'],['Mitchell Graham Colley'],"Young Ari struggles to cope with the absence of her mother, leading to a friendship with a neighbor who is grieving.",--,Hurricane
649,6.4,['Thomas Goersch'],['Thomas Goersch'],An old man reflects on his life.,--,Unhappy
650,7.0,['Emma Pål Brunzell'],['Emma Pål Brunzell'],A lonely influencer's self-made imprisonment.,--,Punani Steam
651,--,DESCONOCIDO,DESCONOCIDO,DESCONOCIDO,--,Error nombre para la pelicula con id: tt13313728
652,--,['Connor Chadwick'],['Connor Chadwick'],,--,Baby on Board
653,5.9,DESCONOCIDO,"['Emad Arad', 'Ziba Karamali']",Parsa -a 13 years old boy- trying to hide a secret from his father.,--,Barter
654,--,['Ebele Tate'],"['Tess Lonergan', 'Ebele Tate']","When 18-year-old Nneka attempts to connect with her estranged mother, the fantasy of who she is, is abruptly shattered by the harsh reality of living with mental illness and extreme poverty.",--,The Visit
655,--,['Panta Mosleh'],"['Julie Bruns', 'Panta Mosleh', 'Mily Mumford']","Happy Ever After is a story of forbidden love in Japan when sparks fly between Paniz and Miyuki at a house party. Turns out, Paniz is a visiting English teacher at the same school where Miyuki is a transfer student. The film unfolds an emotional journey for the two women as the trials and tribulations of a modern unconventional love in a traditional society take their... Read all",--,Happy Ever After
656,9.6,['Paul James Houghton'],['Paul James Houghton'],"'From Under The Bridge: When Bullies Become Trolls' is a bullying, cyberbullying and suicide awareness story you won't believe is based on real events! A lonely high school girl escapes depression and her bullies when she meets the perfect boy online, but is he too good to be true?",--,From Under the Bridge: When Bullies Become Trolls
657,--,['Kami Sadraei'],['Kami Sadraei'],An ordinary psychotherapy session takes a shocking turn.,--,The Sleepless
658,9.4,['Elcid Asaei'],['Elcid Asaei'],"Victoria and Nadia are meeting up to break up, but upon reaching their meeting point at a park bench where they have shared so many moments together, the memories of their bond places a big doubt on their prior intentions.",--,Lost for Words
659,--,['Nick DeSimone'],['Nick DeSimone'],,--,Vigalante Barber
660,--,['Iver William Jallah'],['Rich Ronat'],In this film-noir thriller Mabel (Zulay Henao) catches up and confronts Don Gennaro (Tom Sizemore) and his family about their dark past together.,--,When Devils Play
661,--,['Daniel Pfeffer'],"['Daniel Pfeffer', 'Sophia de Baun']","At the height of New York City's COVID pandemic, a young man can't come close to his family.",--,Don't Come Close
662,--,['Matthew Renoir'],['Marcus A. Carr'],,--,Flowers
663,--,['Julia DeSantis'],['Julia DeSantis'],"While attempting to paralyze herself in a meditative state, a girl comes to terms with the arbitrary nature of life's events and its characters, including herself and a young boy with a toy dump truck.",--,"All Is But A Few Raisins, Perhaps"
664,--,['Guess'],DESCONOCIDO,"Late at night. The sky is full of stars. The sound of the waves. Two girls sat on the beach. Tonight, one girl sit on the beach. Two girls used to live here. One of the girls and a boy live here now.",--,Now Let's Goodbye
665,--,['DeShawn Hill'],['DeShawn Hill'],"An aspiring actor lives and loves in the city of distractions, Los Angeles, CA. Can he focus on his career long enough to make his dreams come true?",--,The Man on Sunset
