1447,--,['Ryan Haigh'],['Julia Cox'],"The story of two polar opposite sisters, Jessie and Gia, whose typical sibling rivalry reaches new heights as the strange truth about what is really going on in their lives comes into focus and threatens to unravel everything they believe",--,Regal vs. Rebel
1448,--,['Liujiyi Zuo'],['Liujiyi Zuo'],"A mute man searches for the spirit of a bear and, meanwhile, his voice.",1h,Silencio
1449,--,['Nik Sexton'],"['Mira Hamour', 'Eyad Sakkar', 'Nik Sexton']","After being released from prison, Billy Skinner returns to his low-income neighbourhood feeling like the area has changed dramatically, and what was once a predominantly white neighbourhood is now mostly occupied by refugee families.",--,Skeet
1450,--,['Sirr Kuda'],['Sirr Kuda'],,--,The Lost Son
1451,8.4,['Debjoy Chakraborty'],"['Surjamit Bhattacharjee', 'Debjoy Chakraborty']","Raju, a fanatic cinema lover, finds his love interest in Rituparna. He embarks on a filmy journey, filled with action, drama, romance and comedy. But will this have a happy ending ? Will Raju be able to become SUPERMAN? Happy watching.",1h 11m,Raju Ban Gaya Superman
1452,7.8,['Topu Khan'],DESCONOCIDO,A young man embarked on a transformative journey to rid society of corruption and the misuse of political power.,2h 24m,Leader: Amie Bangladesh
1453,5.5,['Dandela Yelleshwara Rao'],DESCONOCIDO,Imagine the heartbreak when someone you loved from childhood turns out to be a crook. Will Divya be old-fashioned and be with Ram or will she leave him?,1h 58m,Love You Ram
1454,5.0,['Julian Karikalan'],['Julian Karikalan'],A mid-20s woman fresh out of conversion therapy pretends to be converted until a passionate love affair blossoms and forces her to choose between living a lie or staying true to herself and being disowned by her family forever.,--,Let's Go Below the Rainbow
1455,9.0,['Rihan Kar'],['Rihan Kar'],"Rihan Kar is a famous Indian Actor, singer, musician, actor, and internet celebrity born in Hapur, India. Rihan Kar was born in Hapur, Uttar Pardesh. His father's name was Azaj. and his mother's name is Rubi is a housewife.",2h 26m,Rihan Kar the biography 2
1456,--,['Peter Jones'],"['Lorenzo da Ponte', 'Beaumarchais']",,--,ROH Live: The Marriage of Figaro
1457,--,['Saheed Apanpa'],['Buka Obiagha'],,--,Temptation
1458,--,['Hans Dieter Fresen'],['Rossana Montoya'],"The film depicts the life of Cristina, a young middle-class mother financially supported by an emotionally absent mother. She is haunted by her previous relationship with Walter, the father of Darwin, her son. Habit, comfort and suppression make her numb and loveless. Her fleeting romantic adventures with other men are not enough to push her away from this uncertain e... Read all",1h 10m,Cristina
1459,6.9,['Justin Poage'],"['Alfred Adams Jr.', 'Justin Poage']","Growing up in a house with six women was more than a learning experience for Robert Player, it ultimately proved to be a gift and a curse. Robert, was the youngest and only male-child in the family. Not having an older male figure around, Robert, had to rely on the women within his family to teach him morals, values, and ironically how to become a man! As a result of... Read all",1h 27m,Player
1460,--,['Destin Bourdon'],['Destin Bourdon'],"When Ben finds out his friend is dying, they go on one last trip together.",--,The World is Ending
1461,--,['Ishaaon'],['Rajendra Bharadwaj'],"A powerful ode to the strength and resilience of women, taking inspiration from real-life instances of girls facing deceit, blackmail, and abuse.",2h,Antham Kadidi Aarambam
1462,--,DESCONOCIDO,DESCONOCIDO,DESCONOCIDO,--,Error nombre para la pelicula con id: tt27666063
1463,6.3,['Katina Medina Mora'],DESCONOCIDO,,1h 28m,Latido
1464,--,['Goraschenko Maxim'],DESCONOCIDO,,--,Twice
1465,7.5,DESCONOCIDO,"['John K. Eagle Jr.', 'John Eagle']","An Internet model and her roommates invite men to their house to drug and rob them, but their choices lead them to dire consequences.",1h 9m,Kisses and Bullets
1466,8.3,['Aryaa M. Mahesh'],DESCONOCIDO,The protagonist of the film has a keen interest in crime stories. So much so that he comes in contact with some rowdies in college and drifts towards a life of crime and rowdyism. What happens next forms the crux of the story.,2h 48m,English Manju
1467,5.7,['Giddens Ko'],['Giddens Ko'],"A mafia member is chased by a gang into a hair salon, a young apprentice save his life. He returns the favour by making all his gang members have their hair done by her but put in danger when they try to find a traitor.",2h,Miss Shampoo
1468,6.5,['Blue Cheng-Lung Lan'],DESCONOCIDO,"Visiting their former terminally ill teacher, Mickey, three men reminisce about their youth. Mickey often talked about romantic relationships and sexuality Mickey taught the students to understand homosexuals and themselves.",1h 58m,Cheng gong bu xi ban
1469,--,['Maya Kenig'],['Maya Kenig'],"Tala, 33, an Israeli offbeat musician, just had her first baby. Desperate to make a living and support her kid with no father in the picture, she takes up a job at the ""Milky Way"". In this dairy for breast milk, you can get the best newly mothers can offer: vegan, high-rate of protein, with top-quality essential nutrients milk. In this dystopic dark comedy, Tala embar... Read all",1h 37m,Milk
1470,--,['Austin Scarborough'],"['Ryan Owens', 'Austin Scarborough']",Chaz Jublowski and Wen Benson have been friends for years. But that friendship is tested when Wen decides to make a student film during their senior year of high school.,2h 11m,Jublowski
1471,--,['Choi Yun-ho'],DESCONOCIDO,"Average age of 60. Silver Man's little special delivery begins. 'Soon-cheol', a retired civil servant who dreamed of living alone, sends his wife first and finds out about the Silver Man delivery service and ends up working with 'Tak-bae'. However, the courier process is not smooth due to the various stories of people. The extraordinary journey of the two Silver Men b... Read all",1h 38m,Silver Man
1472,6.4,['Silk White'],['Silk White'],"After holding down her man during his 4-year-long prison sentence, Chloe is ready to risk it all when another woman tries to steal him away.",1h 11m,All I Want Is You
1473,--,['Djibo Mohamad Bachir'],['Djibo Mohamad Bachir'],,--,L'amour est un oiseau
1474,--,['Djingarey Abdoulaye Maïga'],DESCONOCIDO,,--,La fille noire du président
1475,--,['Lukas Groß'],['Lukas Groß'],,--,Hinter den Linien
1476,--,['Bobby Knight'],DESCONOCIDO,"When trying to make an honest living doesn't work, Darts gets caught up in credit card scams and the dark side that comes with them.",1h 10m,Trappn 2 Rappn
1477,--,['Godwin Onwuneme Obiora'],"['Godwin Onwuneme Obiora', 'Don Brymo Uchegbu']","When a young man falls for a woman with epilepsy, his father takes desperate measures to stop their wedding and hires an assassin to kill her.",1h 18m,Endless love
1478,3.9,['Joel Lamangan'],"['Joel Lamangan', 'Troy Espiritu']",A sexy political drama about a man who's blamed for a crime he didn't do. Will justice be ever served to small people like him?,1h 48m,Fall Guy
1479,7.0,['Taj'],"['Mani Manjinder Singh', 'Taj']",,--,Painter
1480,--,['Gabriel Chicano'],['Gabriel Chicano'],Four families tell what life was like for their children who committed suicide after suffering alleged harassment and abuse at school. His parents now only have to fight day by day for justice to be done.,--,Dolor Impune
1481,9.5,['Sachin Kadam'],['Sachin Kadam'],,2h 12m,Maratha Kranti
1482,--,['Nicholas Parish'],['Nico Mensinga'],"An old farmer works his land like he always has, season after season, though his powers are now waning. But who will he leave it to in turn, when the time finally does come, for him to let go?",1h 33m,The Old Man and the Land
1483,--,['Sandeep Sawant'],DESCONOCIDO,A shy village lad slowly discovers interesting layers of life through friends and experiences until one day he faces a life altering situation. He goes through a lot in a short span of time. And comes out all the more hopeful.,2h 21m,Hya Goshtila Navach Nahi
1484,6.9,['Paul Agusta'],['Paul Agusta'],"Angku Wan, a retired teacher who won a raffle prize from a soap company. With those billions, Angku Wan intends to build a village for the common good.",1h 37m,Onde Mande!
1485,9.4,['Rahabi Mandra'],DESCONOCIDO,"In their quest to prove infidelity and ensure a successful marriage, Almond and Takdir embark on a thrilling adventure as detectives, uncovering cases of betrayal and deception.",1h 15m,Detektif Jaga Jarak
1486,5.9,['Yong-hwa Kim'],['Yong-hwa Kim'],A man is left in space due to an unfortunate accident while another man on Earth struggles to bring him back safely.,2h 9m,The Moon
1487,--,['Chetan Sagade'],['Chetan Sagade'],"Aditya decides to start the bullock cart racing, which has been banned by the Government. He fights with all odds and finally comes victorious.",2h 5m,Naad Ekach Fakt Bailgada Sharyat
1488,4.4,['Maciej Hydr'],['Maciej Hydr'],"1991, several months after the fall of communism, Gdansk. Reemigrant Jacek Waldemar returns to Poland with a desire to act. Seeing the home mess, poverty and unemployment, he launches the first private radio on the coast. This is a shock for Slominski, director of the local radio station of the state broadcaster. So far, whether anyone listens to his broadcasts has no... Read all",1h 44m,Radiostory
1489,--,['Chunling Xu'],['Chunling Xu'],"It tells the story of six blind teenagers who dreamed of becoming excellent musicians and formed a ""miracle band"". With the help of teachers in the school for the blind, with their dedication and love for music, they overcame numerous difficulties that ordinary people cannot imagine, persevered, and finally stood on the stage to let the audience see their youth storie... Read all",1h 33m,Miracle Band
1490,--,['Divyam Jha'],['Divyam Jha'],"Acharya, a jovial wannabe artist accidentally encounters a theft attempt and sets on a quest to find the man behind the mystery.",--,Cyberrun
1491,6.2,['Jakub Michalczuk'],DESCONOCIDO,"A story about a young, 17-year-old girl who, confronted with a difficult life topic, enters the world of her father, with whom she has not maintained contact for a long time. This clash of two generations and completely different ways of looking at the world gives hope for understanding, getting to know each other again and rebuilding broken relationships.",1h 30m,Mialo cie nie byc
1492,--,DESCONOCIDO,DESCONOCIDO,A Clockwork Orange videobook.,6h 36m,Videobook: A Clockwork Orange
1493,--,['Yash Kumar Mandaavi'],"['Indrani Baliyan', 'Shivam Kumar']",Kills anyone whose name is written in it as long as its writer visualises the person's face while writing his/her name. This diary is discovered by a normal engineering student 'Siddharth Dayal/Sid'.,--,Diary of the Death God
1494,--,['Sathish Jayaraman'],['Sathish Jayaraman'],"A kabadi champion, who breaks any rule to win anything in life crosses line with a police officer,who bends any rule to catch a criminal.",2h 2m,Kabadi Bro
1495,--,['Xiaohan Zhang'],['Xiaohan Zhang'],,--,God's Absence
1496,9.2,['Michael Righini'],['Michael Righini'],,2h 54m,Fuga dalla Morte
1497,5.4,['Pierre Creton'],DESCONOCIDO,"Follows Pierre-Joseph, a student of horticulture, whose intercourse with his mentors and botany teacher leads to an original fusion of science, sex, and meditation.",1h 22m,A Prince
1498,--,DESCONOCIDO,DESCONOCIDO,DESCONOCIDO,--,Error nombre para la pelicula con id: tt27705166
1499,--,['Paul Newell'],['Mark Cornell'],"The Fog tells a rollicking tale of a fictional theater company through the eyes of one of its founders. Del Stone leads the audience through the highs and lows of his San Francisco band of merrymakers, from the struggling early days of the mid-seventies, to their glorious ascension, to today.",1h 30m,The Fog
1500,--,['Vihaan'],DESCONOCIDO,"Sivayya, an executioner, accompanied by his son finds himself looking bewildered when he spots a girl at the bus stop whose dress has a striking resemblance to that of his deceased daughter's. Feeling uncomfortable by his stares, she expresses loathe and refuses to take the same cab as his. Both of them eventually are subjected to rape. This time, he takes his son and... Read all",1h 20m,Hangman
1501,--,['Leonard Amanya'],"['Leonard Amanya', 'Amisha Mukasa', 'Kizito Samuel Saviour']",A teenage girl succumbs to abuse at her new school after her parents' death but her bravery and confidence turn her into an inspiration.,1h 34m,Crystal
1502,6.0,['Olga Muzaleva'],"['Vitaliy Andreev', 'Sergey Ivanov', 'Yusup Razykov']","1943 Anna Petrova is a combat pilot who was seriously injured. She returned to the rear and works as a chief engineer at an aircraft factory, where new Krecheta aircraft are being prepared for testing. The management of the plant, not knowing about the consequences of her injury, instructs Anna, together with Major Zotov, to overtake the prototype of the Krechet to th... Read all",1h 30m,Raspravlyaya krylya
1503,--,['Evandro Scorsin'],"['Christopher Faust', 'Evandro Scorsin']",,1h 19m,Fale Comigo Verão: O diário de um cineasta amador
1504,7.3,['Christian Hobbs'],"['Joel Harris', 'Christian Hobbs']","Up and coming lawyers Matt Murdock and Foggy Nelson unravel a conspiracy throughout Hells Kitchen, vigilantes keep disappearing with one common theme, Wilson Fisk. It's a race against the clock to stop Fisk before more innocents die.",--,Daredevil: The First Defender
1505,--,['Aniedi Awah Noba'],['Hannah Nwasor'],"After her father dies at the hands of his mistress, soon-to-graduate college student Angelica sets out to enact revenge against her.",1h 34m,Mercy Line
1506,--,['Sadagara Raghavendra'],['Kaveesh Shetty'],,--,After Operation London Cafe
1507,6.3,['Ben Anthony'],DESCONOCIDO,"Before 9/11 and Lockerbie, one brutal attack shook the world and inspired a new era of global terrorism. The hijacking of Pan Am Flight 73 in Karachi in 1986 is a story of terror and tragedy, but also a story of bravery and survival - one which could have been incalculably worse were it not for the actions of a group of rookie flight attendants and a Pan Am employee o... Read all",1h 34m,Hijacked: Flight 73
1508,4.8,['Jao Daniel Elamparo'],"['Brillante Mendoza', 'Reynold Giba']","A newly wed couple invites a woman for threesome. Unknown to them someone is watching their sexcapade. When the threesome becomes foursome, that's when chaos begins.",1h 32m,Sandwich
1509,--,['Baz Woods'],"[""John O'Rourke"", 'Baz Woods']","Abbey arrives for the first time in Dublin to meet her online boyfriend, Mike - a software engineer committed to developing Andromeda, a computer program designed to deliver psychotherapy to help people identify and change troubling emotions, thoughts, and behaviors. Under increasing pressure from his boss, Donna Anderson, to correct glitches in the Andromeda program,... Read all",1h 35m,Long Term Affects
1510,7.9,['Omar Hilal'],['Omar Hilal'],"Based on an incredible true story. A man fakes blindness to swindle into his dream of leaving his home country Egypt, and living in Europe. He joins a team of blind footballers bound for Poland.",1h 40m,Voy! Voy! Voy!
1511,--,['Verónica Chen'],['Verónica Chen'],,--,Los Terrenos
1512,--,['Mohamed El-Samman'],['Mohamed El Samman'],"Desperate to make some extra money, Kholoud bites off more than she can chew at work and races against time to fulfill an unreasonable quota.",1h 34m,Rat Hole
1513,--,['Pablo García Canga'],['Pablo García Canga'],"One night. One city. Madrid. Five conversations. Nine characters. They tell personal stories, invented stories, also an old story that goes on from conversation to conversation, a story from an old Japanese film.",1h 23m,Las tierras del cielo
1514,6.8,['Chris Kraus'],['Chris Kraus'],"For 15 years, the former piano wunderkind JENNY was sentenced to prison for a murder she didn't commit. Since her release, she's been trying to numb her self-hatred with prayers at a Christian halfway house. When she meets the Syrian war refugee OMAR who has a talent for singing, she agrees to play the piano for him on a TV music talent competition. However, by appear... Read all",2h,15 Jahre
1515,5.4,['Juan Felipe Orozco'],"['Mario Mendoza', 'Esteban Orozco', 'Nicolás Serrano']",Inspired by acclaimed Colombian author Mario Mendoza's literary universe comes this edge-of-your-seat suspense thriller. In a near future plagued by water shortages Frank Molina a gruff journalist must face his demons to get to the murder.,1h 51m,The Initiated
1516,--,['Gnanasagar Dwaraka'],['Gnanasagar Dwaraka'],,--,Harom Hara
1517,4.1,DESCONOCIDO,DESCONOCIDO,"A defiant shorts exploring passion, persecution, and revolt from past, present, and future eras, ranging from tales of an anxious young drag queen in mid-'90s Chile to a lively American summer camp that flips the script on gay panic",1h 33m,Frisky Business
1518,6.3,['Ilya Povolotsky'],['Ilya Povolotsky'],"In Russia, an introverted father and his teenage daughter live on the road in a van that contains their entire life, including the equipment for a travelling cinema: the source of their meager income.",1h 59m,Grace
1519,--,DESCONOCIDO,"['Emily Daltorio', 'Angelica DiMaio', 'Gregory Jason']","Endings tells three stories that explore different kinds of endings -- a woman facing starting over after the death of her boyfriend, friends who find themselves on different paths, and a political debate that goes off the rails.",--,Endings
1520,--,['M. Iqbal Askari'],['Javid Virk'],A story of the girl who lived in Europe,--,Ishq-E-Majjaz
1521,--,['Toshi Asaka'],['Toshi Asaka'],It's a story about how the elite Samurai who lost everything by injury and failure returns back to Samurai life again with the support of his wife. He finally overcomes his disability and accomplishes Sensei's will.,--,The Samurai
1522,--,['Ivan Hamdhani Putera'],"['Baskoro Adi Wuryanto', 'Ivan Hamdhani Putera', 'Agnes Davonar']","A guilt-ridden young woman who moves to Jogja to escape the memory of her brother meets a man with autism and with the help of a new friend, sets out to make his dream of playing with his idol a reality.",1h 45m,Angel: Kami Semua Punya Mimpi
1523,5.9,['Denis Safarík'],['Denis Safarík'],,1h 15m,O malých vecech
1524,9.0,['Guntur Soeharjanto'],['Evelyn Afnilia'],A woman finds her true love in Bali but gets caught in a dilemma between choosing her fiancé or following her heart.,1h 36m,Bukannya Aku Tidak Mau Nikah
1525,--,['Nipon Dholua'],['Nipon Dholua'],The story revolves around an adolescent school going girl from an affluent family belonging to a family of four consisting of her parents both in high flying jobs and an elder brother. The girl goes into deep emotional turmoil cutting her herself completely away from the real world.,2h 22m,Mujhe school nahi janna
1526,8.8,['S.S. Jishnu Dev'],DESCONOCIDO,Social satire movie with relevant moralities,1h 32m,Ennu Sakshal Daivam
1527,3.2,DESCONOCIDO,['Pam'],Penelope obsessed with finding her children world crumbles as she succumbs to emotional stress and the silent voices of her new reality. Her husband believes she has lost her mind and watches her deteriorate into a world of darkness.,1h 33m,Darkeplica
1528,7.5,['Aya Matsuki'],['Tsutomu Kuroiwa'],Tokyo MER stands for Tokyo Mobile Emergency Room. The members are emergency care professionals and they have to go to sites of dangerous accidents and disasters by a large vehicle equipped with medical devices and a surgery area.,2h 8m,Tokyo MER
1529,--,['Danny Do'],DESCONOCIDO,,11h 20m,The Good Doctor: Bac Si Hanh Phuc
1530,6.0,DESCONOCIDO,DESCONOCIDO,"Project by the Directors' Fortnight of the Cannes FF in which young local and international filmmakers couples meet and create together and enlighten local cinematography with short films. The program, which has already passed through Taiwan, Chile, Lebanon and southeast Europe, now reaches north Portugal.",--,Director's Factory - North Portugal
1531,7.8,['Gabbar Sangrur'],['Gabbar Sangrur'],Story is Inspired by untold and unrevealed anecdotes of Punjab's Criminals which revolves around two rivalry Gangsters Durlabh and Kesar engaged in bitter revenge leading to death of famous personalities in India. Film highlights deep nexus of students Politics and suffering families of the gangsters.,2h 1m,White Punjab
1532,--,['Nino Basilia'],DESCONOCIDO,,--,Chemical Marriage
1533,--,['Blake Bodlak'],['Blake Bodlak'],"In a world where everyone knows exactly when they will die, Mollie feels ready for her last day. But when it finally comes, she must choose how best to spend her final hours and discover what's really important to her.",--,Mollie's Goodbye
1534,7.1,['Elene Naveriani'],"['Nikoloz Mdivani', 'Tamta Melashvili', 'Elene Naveriani']","Etero, a 48-year-old woman living in a small village in Georgia, never wanted a husband. She cherishes her freedom as much as her cakes. But her choice to live alone is the cause of much gossip among her fellow villagers. Unexpectedly, she finds herself passionately falling for a man, and is suddenly faced with the decision to pursue a relationship or continue a life ... Read all",1h 50m,Blackbird Blackbird Blackberry
1535,7.6,['Kirk Langer'],['Kirk Langer'],"Based loosely on Alexandre Dumas 1844 novel 'The Count Of Monte Cristo' and set during the Covid crisis of the early 2020s. A series of murders begin, which appear to be unrelated. However, an insightful detective begins to follow a single clue that leads him to conclude that he has uncovered a Serial Killer. After contacting the FBI for assistance, a diligent FBI age... Read all",2h 40m,The Elephant
1536,--,['Temeko Richardson'],['Temeko Richardson'],Bishop Mack must face a dark secret that will destroy his family and perfect reputation as long-time pastor. Bishop Mack takes the staff on a rocky journey of unpopular decisions in cancel culture to lead an interracial church in an urban neighborhood at the risk of losing his son.,1h 7m,At the Cross
1537,--,['Argie Seth'],['Argie Seth'],"After forcefully being called to their grandmother's funeral by their abusive mother, the protagonist is forced to deal with their suicidal tendencies in conversations with their cousin, mother and recently widowed grandfather.",1h 4m,"I Went to End It All, but A Candy Changed Me"
1538,8.9,['Michael Righini'],['Michael Righini'],"A man who obsessively seeks revenge for his past, will end up losing himself along the way.",1h 19m,El Gringo
1539,6.5,['Efe Aydal'],['Efe Aydal'],"The fate of two young people, one who is interested in making dance videos and the other in gaming videos, intersects with happiness pills.",1h 32m,Beyaz Hap
1540,--,['Maciej Pawlicki'],['Maciej Pawlicki'],"A biographical story of the youth of Anna Henryka Pustowójtówna, a heroine of the January Uprising, adjutant of the dictator Marian Langiewicz, a legendary freedom fighter in Europe at that time.",--,Panna opetana
1541,5.5,['Justyna Luczaj'],['Justyna Luczaj'],"A modern version of the Oedipus myth. The action of the film takes place in an unspecified place (in a town at the foot of a cliff, between a garbage dump, barns and a forest), where people hide painful secrets. Diana, after years of absence, returns to town with milk flowing from her breasts. He has depression and memory lapses. Her return coincides with a crime comm... Read all",1h 15m,Konski ogon
1542,--,['Christian Nzonga Nkinzo'],['Christian Nzonga Nkinzo'],,1h 15m,À deux reprises
1543,6.3,['Tetsuya Chihara'],DESCONOCIDO,"""Ice Cream Fever"" tells a story of four women, whose ages range from their teens to thirties, and their lives intersect by an ice cream shop. Natsumi Tsuneta (Riho Yoshioka) is in her late 20's and has given up on her dream. She works part time at an ice cream shop. Saho Hashimoto (Serena Motola) is in her early 20's. She is too timid to take a step forward in her lif... Read all",1h 44m,Ice Cream Fever
1544,--,['Armand Parfait Mamo'],DESCONOCIDO,,--,Tawa Mima
1545,7.1,['Sara Laura Perez'],"['Joe Lopez Perez', 'Sara Laura Perez']","1999 DLLBLV,DeLeida: In DeLeida Lawter humiliates his neighbors, for a bet. All this and others in this movie where almost all the dialogues you have to imagine. DeLeida is the first of the Pais DLLBLV trilogy, made up of DeLeida, Little Beida and Lost Veida.",1h 26m,DeLeida: Original Version
1546,6.6,DESCONOCIDO,DESCONOCIDO,"At an old manor house in northern Portugal, Ana helps her friend, Emília, the elderly housekeeper who is determined to continue to keep the unoccupied house in order for the owners who are never there.",1h 59m,Légua
1547,8.3,DESCONOCIDO,DESCONOCIDO,The endeavours of a dedicated teacher who embarks upon a journey that changes the lives of 6 young misfits forever. Based on a true story.,1h 47m,Gemencheh Boys
1548,--,['Richard Kollo Nyame'],DESCONOCIDO,,--,Elsewhere
1549,--,['Greg Galloway'],DESCONOCIDO,"Three young women, having lost their jobs, make the decision to become cam girls. Things begin to improve, but their lone supporter may also be their last.",--,My Only Fan
1550,4.5,DESCONOCIDO,DESCONOCIDO,"In this cinematic zine, directors scattered all over the world adapt to screen hilarious and poignant Belarusian news stories. Featuring phone thieves, TikTok storks, the tiniest castle in the world, and victims of the depression epidemic.",2h 11m,COOL (News from Belarus)
1551,6.9,['Kang Quintus'],"['Proxy Buh', 'Enah Johnscott', 'Kang Quintus']","Villagers advise an abusive husband to channel his rage in the army. There, he must come to terms with violent urges that have deep and painful roots.",1h 41m,Nganù
1552,--,['William Seugnou'],DESCONOCIDO,,--,La femme de quelqu'un
