2118,--,DESCONOCIDO,DESCONOCIDO,"SIMONA AMAYA, a young woman from Boyacá who is around 20 years old, rebellious and daring, decides to dress as a man to be accepted into the patriotic ranks and thus be able to fight for the liberation cause. She achieves her goal and, upon joining the revolutionary ranks, she meets Antonio Arredondo, a 28-year-old young man, a colonel of the Cazadores battalion, to w... Read all",1h 40m,"Simona Amaya, Vivir o Morir por la Libertad"
2119,8.4,DESCONOCIDO,"['Mike Brown', 'Akira Talaba']","The story of an awkward loner high school boy who, in an attempt to win the heart of a girl, embarks on a comedic journey as he strives to become a stand-up comedian within a mere week.",1h 26m,The Boy Who Never Tangoed
2120,9.9,['Bodhiprakash'],['Bodhiprakash'],The film tells the story of the relationship between two ordinary Christian families in a remote village in the hilly district of Wayanad in the southern Indian state of Kerala. The film is mainly made in 10 shots with a 35mm lens.,--,Iruttumala thazhvaaram/Rabbit breath
2121,--,['Tim Jackson'],['Tim Jackson'],Filmmaker Tim Jackson exposes systemic racism and violence against black men while exploring the destructive impact of culture. A powerful call to action for change and unity in the fight for justice and a charge to recreate the culture.,--,Tim Jackson Presents: How to Kill A Black Man
2122,6.8,['Keat Aun Chong'],['Keat Aun Chong'],"Ah Eng and Dou E were trapped in the ""513"" timeline for 49 years.",1h 56m,Snow in Midsummer
2123,--,DESCONOCIDO,['Alterik Miller'],"After a car thief steals a vehicle loaded with money, an encounter with a stripper forces him to choose between tainted riches and true love.",--,Runaway Dolly
2124,8.3,['Aabis Raza'],['Nimra Jamil'],"Hum Dono Drama is a romantic comedy of a happily married couple who are breaking the stereotypes of conventional happily marrieds with a couple of babies at their disposal. However, Omer and Mahi are much different that how our society works.",--,Hum Dono
2125,6.7,['Laurens Pérol'],['Laurens Pérol'],"When the 18-year-old climate activist and trumpet talent is invited to an audition at the Opera House, she has to travel the over 1,500 km to the capital. But she refuses to fly. Trine tries to hitchhike. Her passions is put to the test.",1h 19m,Practice
2126,--,DESCONOCIDO,"['Sumanth Anubolu', 'Prudhvi Raj Salenke']","In the mean streets of Nellore, three stories of destiny, fate and karma intertwine and collide with the harsh realities of life, and are thrown into unforeseen violence only to reach the eternal truth of life.",--,Child of God
2127,--,['A.S. Afo-O'],['Nastya Chassante'],,--,Gouni
2128,--,['Javier Solórzano Casarin'],['Javier Solórzano Casarin'],"After their mother's death, a young woman and her two brothers return to their childhood home, a place of pain and trauma. As they face each other and their past, she discovers their parents' darkest secrets that have come back to haunt them.",--,Adentro
2129,6.8,DESCONOCIDO,['Sang-Hyup Chung'],"A story about an investigating team leader, Hwang Joon-cheol, in charge of investigating boys who are suspected of robbery at the local town's supermarket, 'Woori Super'.",2h 4m,The Boys
2130,6.7,['Eun-Mi Kwak'],['Eun-Mi Kwak'],"Making use of her Chinese that she learned while living in China, Han-young obtains her tour guide-interpreter's license and starts working as a guide in Korea. She gains good results at work, but she is forced to face challenges.",1h 34m,A Tour Guide
2131,--,['Kevin Lucero Less'],['Kevin Lucero Less'],Geography gives passage to time.,--,Come to Dust
2132,6.4,['Anthony Williams'],['Anthony Williams'],"After being kicked out her home for revealing a horrific family secret, Karma has no other choice but to turn to the streets for survival.",1h 3m,Karma
2133,4.8,['Basith Ahmed Khan'],DESCONOCIDO,"This is a Story of Scientist Played by Deepak Parashar who was the messenger to Peacefulness and the Lover of Mankind, lost his life while following the path of ''Ahimsa Parmo Dharma'' by his subtle thinking, proposed by him to diffuse the bomb and Nuclear explosion not to Create a War. Rather to shower the Love and Affection upon Mankind. Now, concluding the whole pa... Read all",1h 58m,Love Nation
2134,--,['Prasanna Kumar Devarapalli'],DESCONOCIDO,,--,Nidurinchu jahapana
2135,7.3,DESCONOCIDO,DESCONOCIDO,"After the sudden passing of Mihaylov, the influential founder of one of Bulgaria's most successful real estate firms, his most trusted employees, Daniel and Nikola, unexpectedly find themselves in charge of the business. However, their newfound leadership is complicated when they discover the existence of Sofia, Mihaylov's illegitimate daughter and legal heir to half ... Read all",--,Sofia at Home
2136,8.1,['Marwan Mokbel'],['Marwan Mokbel'],"An Egyptian gay couple return from the US to Egypt for a family emergency. When they fall prey to witchcraft as punishment for their homosexual sins, one of them falls into religious terror and exposes his unhealed past.",1h 51m,The Judgment
2137,--,['Bhagwant Kang'],['Maati Brar'],,1h 5m,Shayad Din Charh Janda
2138,--,['Himanshu Shrivastav'],['Kamlesh Patidar'],,--,Ahmiyat
2139,6.8,['Hridi Haq'],DESCONOCIDO,"The film revolves around a family's experiences during 1971, providing a poignant portrayal of the era.",2h 22m,1971 Shei Shob Din
2140,7.2,DESCONOCIDO,DESCONOCIDO,"Boys on Film presents ten encounters from across the globe, where the dangerous allure of a risky attraction yields emotional results - proving that the age-old adage of taking the plunge is as relevant - and sexy - as ever before.",2h 39m,Boys on Film 23: Dangerous to Know
2141,7.4,['Peaty James'],['Johnny Pierre'],"Seduction, lies and manipulation are displayed in dramatic fashion as these elements dominate this intense tale of the Ultimate Betrayal.",2h 9m,The Ultimate Betrayal
2142,8.8,['Azam Siddiqui'],['Azam Siddiqui'],It is a story of a young boy who madly falls in love with a girl and gets distracted from his focus on career and forgets about his responsibilities.,--,Ishq Ka Pyaada
2143,4.0,['Yi Huang'],"['Yi Huang', 'Qi Luo', 'Junyang Qiu']","Female student Xiaoman went home to visit her family and never returned. After being discovered missing, she had already died mysteriously. As a classmate friend and best friend, Qianqian guided the teacher and three classmates from afar to Yuanyao Village to learn local practices and stay overnight. In fact, she searched for the cause of death of the mute girl Xiaoma... Read all",1h 30m,The Puppet
2144,--,"[""T'Shombi Basemore""]","[""T'Shombi Basemore"", 'Joseph Shrewsberry']","Mariah's life is completely changed when her high school boyfriend is killed. As Mariah attempts to move on, she decides to give new love a chance, but it is not someone you would expect her to be attracted to.",1h 14m,A Perfect Blemish
2145,--,['Vincent Turner'],['Vincent Turner'],,--,Legend
2146,8.1,['Indu Lakshmi'],['Indu Lakshmi'],Nila is a soulful narration of Dr Malathy's journey after she meets with an accident.She discovers a new camaraderie leading to some unexpected situations. Nila is a tale of connections and convictions.,1h 35m,Nila
2147,7.5,['Anna Buryachkova'],"['Anna Buryachkova', 'Marina Stepanska']","Set in Kyiv in the late 1990s, ""Forever-Forever"" is an unsettling portrait of the young and rebellious as they navigate love, explore their sexuality, and play cruel games, which never have a winner.",1h 47m,Forever-Forever
2148,5.6,['Mikhail Mestetskiy'],"['Mikhail Mestetskiy', 'Aleksey Smirnov']","The dreamer Filipp is full of wild and utopian ideas. But the pregnancy of his girlfriend Marina forces him to ""grow up"" dramatically: to find a stupid job, to give up ridiculous fantasies. However, in this form, he is unloved and no one needs. As a result, difficult childbirth makes it clear: one cannot do without his imagination.",1h 45m,God rozhdeniya
2149,--,['Federico Jacobi'],['Pablo Viollaz'],"Three men spend their days in a dying gas station, on the side of a wrecked road, on the outskirts of a small town. The three men resist and wait. They spend their time in fortuitous, random or miraculous things, hoping that something will free them for this situation. One day, the opportunity they were waiting for appears, in a different way than they imagined. Now, ... Read all",1h 13m,El arranque
2150,--,['Okey Ifeanyi'],DESCONOCIDO,"The profound affection between a married couple, who have been together for a few years, faces jeopardy due to small falsehoods, deceit, and envy. They grapple with navigating their way through the ominous clouds; sinking into a state of despair they never anticipated when they exchanged their vows.",--,What the Heart Can Take
2151,--,['Tim Middlebrook'],['Tim Middlebrook'],,--,The Life of Taylor Rosa
2152,8.5,['Greg Kwedar'],DESCONOCIDO,"Divine G, imprisoned at Sing Sing for a crime he didn't commit, finds purpose by acting in a theatre group alongside other incarcerated men in this story of resilience, humanity, and the transformative power of art.",1h 45m,Sing Sing
2153,--,['Cush Berlyn'],['Cush Berlyn'],,1h 31m,TRUST: Saga
2154,6.7,['Bakeeba Ruffin'],['Bakeeba Ruffin'],"The tale of two friends torn between good and evil, forced to deal with a situation from there past that comes back to show its face, now they have to deal with the reality of their miss deed. an stand up an face it like men.",--,Realityville
2155,7.1,['Manan Sagar'],['Vinod Saraiya'],"The story revolves around Umesh, who rekindles his romance with his long-lost college crush Ketaki, a divorcee. Meanwhile, Umesh's son Tejas meets the girl of his dreams: Reva. As the father and son prepare for a double wedding, they encounter numerous challenges. What ensues is roller-coaster ride entailing misunderstandings, twists, and trials as they navigate the c... Read all",2h 12m,Hu Ane Tu
2156,--,['Moses Wolff'],['Moses Wolff'],,--,"Rasputin - Liebe, Glaube, Sinnlichkeit"
2157,6.5,['Hong-Chi Lee'],"['Hong-Chi Lee', 'Cheng Hsun Lin']","Since his release from prison, Sweet Potato has been content to run a little business with a meager income by the sea, disregarding the advice of others to the contrary.",1h 21m,Love Is a Gun
2158,9.0,['Simon Steuri'],['Simon Steuri'],"After their parents suddenly left them, 2 teenage brothers found themselves all alone. Daniel, the older brother, is deeply troubled by the violence they endured at the hands of their father and is committed to keeping their family safe.",1h 44m,How I Learned to Fly
2159,2.8,['Drxp'],DESCONOCIDO,"Although everything appears to be good at the shop, the Richardsons are actually struggling to get along at home. Things take a turn for the worse when a wealthy new man walks into the shop and catches the eyes of the youngest Richardson Kayla.",1h 49m,Crazy Love
2160,--,['J. PaulTheDemiGod'],['J. PaulTheDemiGod'],"Bently has a past for being hardcore. After the murder of her father Jesse and the disappearance of ""Kato"" Bently hits the streets to find out who killed her father and to clear her name from all of the bodies that is being pinned on her.",--,Body Count Bently
2161,--,DESCONOCIDO,DESCONOCIDO,DESCONOCIDO,--,Error nombre para la pelicula con id: tt28487991
2162,--,['Alon-4evr'],['Alon-4evr'],"A group of teens sparked by inflammatory headlines, murders an autistic boy beloved by the Brethren of the Cross Street (a mysterious order). When the BOCS discover who the architect of the toxic narrative is, they use their female assets to lure him into The Crescent for a tête-à-tête.",1h 36m,Trigger
2163,7.4,['Hur Jin-ho'],['Herman Koch'],Jae-wan's occupation as a lawyer includes defending killers. His brother is a religious doctor who constantly puts his patients ahead of his own interests. A circumstance involving their teenage children tests the brothers' consciences.,1h 56m,A Normal Family
2164,--,['Luke Schatzmann'],['Luke Schatzmann'],,1h 23m,Vértices
2165,6.3,['Hao Ning'],DESCONOCIDO,"Actor Lau Wai-Chi has a huge following of devoted followers and is always keeping an eye on his rivals. After accepting to play the lead in a modest indie drama, Lau begins the laborious process of mastering the acting skills for the role.",2h 5m,The Movie Emperor
2166,9.6,['Jackson Raj'],['Vinoth Singh'],"AwardWinner The one who immeasurably blessed with mother, father, love and place. Unfortunately he loses everything in few days and comes to the point of ending his life,and what happened to him form the crux of this emotional rural drama.",2h 7m,Aramudaitha Kombu
2167,--,DESCONOCIDO,DESCONOCIDO,DESCONOCIDO,--,Error nombre para la pelicula con id: tt28490387
2168,9.0,['Atiul Islam'],"['Debapratim Dasgupta', 'Atiul Islam', 'Tanvir Kazi']",After her father's paralysis Fotema had to stop her studies. Her dream of doing a government job ends as she had to find work to support her family's financial condition.,1h 53m,Fotema
2169,8.5,['Christianna Arango'],['Christianna Arango'],"When a group of diverse college students find themselves in a summer writing course being held in a nearby church, they are less than enthusiastic. Troubled at home in different ways these students come to class with baggage that seeps into every part of their lives. Through required writing assignments and exposure to ways of life that differ from their own, these st... Read all",--,Paper Gems
2170,7.2,['Azazel Jacobs'],['Azazel Jacobs'],"A tense, captivating, and touching portrait of family dynamics starring Carrie Coon, Elizabeth Olsen, and Natasha Lyonne as sisters who converge after their father's health declines.",1h 41m,His Three Daughters
2171,5.0,['Jorge Michel Grau'],['Jorge Michel Grau'],"Alan and his father flee from the painful loss of his mother. While hiding in a secluded housing unit, Alan discovers hidden messages that lead him to believe that his father is a werewolf. Alan decides to do something once and for all.",1h 33m,Rage
2172,--,['João Pedro Gottardo'],DESCONOCIDO,"At the end of the 70s, on the border between Brazil and Argentina, a wheat flour smuggler faces the waters of the great river daily.",1h 11m,Contrabando
2173,--,['Warren Badenski'],['Warren Badenski'],,--,Love & Vengeance
2174,6.1,['Alix Delaporte'],DESCONOCIDO,"Gabrielle joined a prestigious news program. With no formal training, she must prove herself and find place among an experienced team of special correspondents.",1h 26m,Vivants
2175,7.2,['Ryûsuke Hamaguchi'],DESCONOCIDO,"Takumi and his daughter Hana live in Mizubiki Village, close to Tokyo. One day, the village inhabitants become aware of a plan to build a camping site near Takumi's house offering city residents a comfortable ""escape"" to nature.",1h 46m,Evil Does Not Exist
2176,6.2,['Fien Troch'],['Fien Troch'],"After Holly(15) seems to have predicted a deadly school fire, all eyes are on her. Her teacher invites her to volunteer in the grieving community. Holly gives peace, warmth and hope. Soon people start demanding more and more of her.",1h 42m,Holly
2177,7.2,['Kento Yamaguchi'],"['Yamashina Aura', 'Kento Yamaguchi']",,1h 47m,Dependence
2178,--,['Prakash Madhwani'],"['Parvesh Khairaliya', 'Prakash Madhwani']",,--,Sevak: Ek Valmiki
2179,--,['Matthew King Sr.'],"['Matthew King Sr.', 'Delenia King']",,--,The Golden Door
2180,6.1,['Virginia Eleuteri Serpieri'],['Virginia Eleuteri Serpieri'],"One summer evening, twenty-five years ago: the town is deserted, the soccer World Cup final is in progress. A woman, Teresa, floats down the Tiber and lets the current carry her away.",1h 41m,Amor
2181,7.7,['Karan Tejpal'],"['Agadbumb', 'Gaurav Dhingra', 'Karan Tejpal']","Two urbane brothers witness a baby being kidnapped from an impoverished mother at a railway station in rural India. One guided by moral duty, convinces the other to help the mother and join a perilous investigation to find the baby.",1h 32m,Stolen
2182,6.4,DESCONOCIDO,['Guillermo Arriaga'],Two teen brothers and their newly-met stepsister take a road trip to the Mexico-U.S. border in a tense revenge journey to track down the man responsible for the accident that caused their father's death.,1h 57m,Upon Open Sky
2183,--,['Louie Ignacio'],"['Louie Ignacio', 'Ralston Jover']","Lola Edna bears the challenges of her debilitating dementia, while killing time in a facility for the elderlies. She collects photos from occasional visitors, mostly strangers, in the hope of remembering her long-lost daughter and granddaughter. She's ill-tempered, a bully to the other old people and to her caregivers. Until she meets Angel, a new caregiver who temper... Read all",1h 40m,Litrato
2184,6.9,['Fidel Devkota'],['Fidel Devkota'],"A pick-up truck driver leaves Kathmandu airport for a two-day drive with a delivery to a remote mountain village. On the high road, a solitary figure slowly makes his way, wheeling a small red suitcase toward the same village.",1h 27m,The Red Suitcase
2185,7.3,['Luàna Bajrami'],['Luàna Bajrami'],"Zoé and Volta set off from their isolated home village to attend university in Pristina. In the midst of social and political unrest, the two women discover a country in turmoil, searching for its identity on the brink of independence.",1h 34m,Bota jonë
2186,--,['Wole Adeyi'],['Damilola Mike-Bamiloye'],"The weeding weekend of Gabby and Marvin turns to a dramatic, one instead of a joyful one as Marvin's pasts comes in the way of their day of Joy. Marvin has to reconcile with his father to please his soon to be wife. His old time Girlfriend re surfaces and is head bent on destroying the already planned wedding between the soon to be couples.",1h 13m,The Wedding Weekend
2187,6.1,DESCONOCIDO,['Chander Kamboj'],"A theatre troupe from Punjab visit London to put on a show, where their host falls in love with an actor's family member.",2h 3m,Drame Aale
2188,--,DESCONOCIDO,['Chezzy Boy'],"You think your neighborhood has drama? Meet Crokaman Bans. He just got cheated out of $7,000 from a scratch off ticket. To make matters worst the whole neighborhood is out of control. From his crazy nephews to the stick up kids on the block, everybody is acting up. Crokaman tries to get that paper while dealing with neighborhood drama. How crazy are things gonna get? ... Read all",1h 15m,There Goes the Neighborhood Trap
2189,--,DESCONOCIDO,DESCONOCIDO,DESCONOCIDO,--,Error nombre para la pelicula con id: tt28496278
2190,--,['Richard Omidiwura'],['Gloria Bamiloye'],Tunde who was once a bad boy is now converted and his given his life to Jesus Christ. His bad friends of the past comes back to him trying to influence him. But he is head bent on being a child of God. Deolu on the other side is now doing very well in another city. His mother gives him a sister as she put to bed.,1h 29m,My Dream 2
2191,5.8,['Alain Parroni'],"['Alain Parroni', 'Giulio Pennacchi', 'Beatrice Puccilli']","Alex, Brenda and Kevin, post-millennials from Rome's countryside - living that phase of life when being in the world is something difficult to deal with - are striving against the everyday life in order to give a sense to their existences. They are trying to be noticed and remembered along time.",1h 55m,An Endless Sunday
2192,7.1,"[""Shin'ya Tsukamoto""]","[""Shin'ya Tsukamoto""]","In the black market, a war orphan is confronted with the struggles of people living in the immediate aftermath of WWII.",1h 35m,Shadow of Fire
2193,--,DESCONOCIDO,DESCONOCIDO,"Six spellbinding stories about private passions, stolen moments and the bonds we form when the world isn't looking.",1h 33m,Enchanted Hearts
2194,--,DESCONOCIDO,"['Marion Burger', 'Ilan Cohen']","It is an interactive and narrative experience in virtual reality, which invites the user to travel inside the brain of a father who is suffering from aphasia.",--,Empereur
2195,--,['Shinji Imaoka'],['Hideki Shishido'],"As men and women around the age of 30 struggle to reach their dreams, they also go through trial and error in love. This work, which depicts the encounter and parting of such a man and woman.",1h 29m,Umibe no koibito
2196,--,['Iván Cuevas'],['Adolfo Martínez Solares'],,1h 21m,Perdiendo mi virginidad 3
2197,8.7,['Odunlade Adekola'],DESCONOCIDO,"From royalty to redemption: witness the king's descent, the queen's sacrifice, and the battle for freedom.",1h 49m,Deity
2198,--,['Kanchi Wichmann'],['Kanchi Wichmann'],"In BREAK MY FALL: REDUX, girlfriends Liza and Sally experience three tumultuous days that will change their lives forever. Kanchi Wichmann's director's cut is a heady ode to the 24-hour party scene of London's alternative music scene.",1h 30m,Break My Fall: Redux
2199,--,['Emran Emon'],DESCONOCIDO,"Mr. Shahjahan's growing wealth from his cable business leads him to collect antiques. Among his finds is a portrait of a king resembling himself, which exerts a mysterious power over him.",--,Portrait
2200,7.9,['Kumud Pant'],DESCONOCIDO,,--,Chaurasi Puja
2201,--,['Rich Ho'],['Rich Ho'],"The journey of a struggling young pilot, Kai, and his fighter mecha, Little Dragon, set against a backdrop of epic galactic warfare.",1h 35m,Heavens: The Boy and His Robot
2202,--,['Arman Rahman Prottoy'],['Maruf Hossain Sajib'],"Raiyan, a wealthy young man, returns to his village and gets admitted to his childhood school to relive his memories. He meets his pretty class teacher and a sweet love story blossoms amidst nostalgic education.",--,Gulail
2203,--,['Rezwanul Islam Sunzid'],['Jobaed Ahsan'],"In a cricket-crazed community, Ayman sparks a love for the game in local kids but faces fierce opposition from his stunning neighbor, Anila.",--,Love Century
2204,--,['Rafat Mozumder Rinku'],['Jobaed Ahsan'],"On his daily commute, charming playboy Roni sets his sights on a captivating stranger, sparking a high-stakes game of love and seduction. But this time, he might be the one getting played.",--,The Pickup Artist
2205,6.5,['Ming Liang'],['Ming Liang'],"In Northeast China, Shenyang is a decaying city. Xu Lingling is a 25-year-old girl suffering from uremia whose life has collapsed. At the height of her illness, her dissolute father has returned, with her best friend Tan Na and former classmate Zhao Dongyang, to take care of her. Despite her suffering and thanks to family affection, love and friendship, she feels she ... Read all",2h 2m,Xiao yao you
2206,6.6,['Niranjan Bandi'],['Niranjan Bandi'],Okka Roju is a Telugu movie starring Aaditya Reddy Badveli and Rekha Nirosha in the lead.,2h 1m,Okkaroju... 48 Hours
2207,--,['Great Valentine Edochie'],DESCONOCIDO,Harida's past mistake haunts her peace but the price for forgiveness and comfort is too steep.,--,Restitution
2208,--,['Simon Peacemaker'],DESCONOCIDO,A woman who suffers from dissociative personality disorder finds solace in a psychologist who intends to uncover the inner mystery of the inner ghosts that haunt her.,--,Romoke's Demon
2209,--,['Tope Alake'],['Adeyinka Famoritiye'],,--,Modina's Dilemma
2210,--,['Austin Nwaolie'],['Florence Godwin'],,--,Fall Out
2211,--,['Emmanuel Eyaba'],['Nwanesi Ezenwa Chike'],,--,A Twin Tale
2212,6.7,['Ernani Nunes'],['Manuela Bernardi'],,--,No Ritmo da Fé
2213,--,['Smart Jobonson'],['Gift Collins'],,--,The Mix
2214,--,['Patience Ejoke Ogedegbe'],DESCONOCIDO,,--,Daddy's Angels
2215,--,['Emeka Madu'],['Adaeze Ibechukwu'],,--,Wrong Attachment
2216,6.0,['Jacquelyn Frohlich'],['Jacquelyn Frohlich'],"While moving from Idaho to Los Angeles with her mother, an 11-year-old girl, who is yearning for stability in her life, becomes smitten with a charismatic female hitchhiker they pick up along the way. As she detaches more and more from her mother, the girl forms an unlikely bond with the hitchhiker, blurring the line between running away and kidnapping.",--,Wayward
2217,--,['DeKeldric Davis'],"['J.L. Anderson', 'DeKeldric Davis']","It is a compelling anthology that explores the profound impact that unveiling hidden truths that you can have on individuals and their relationships. This gripping short series delves into the intricate web of consequences that arise when dark secrets are unleashed upon someone who is not yet ready to face them. At the heart of the story lies an unready participant, w... Read all",1h 16m,Hidden Secrets Everybody Has A Secret
2218,--,DESCONOCIDO,['LaNita Johnson'],"This movie is a faith-based, romantic-drama production about a woman (wife/mother) named Brittany who is diagnosed with stage 4 brain cancer.",--,Always & Forever
2219,--,['Paul Iheanyichukwu Igwe'],['Chris Bonnie'],"Cassie believes her life is perfect when her boyfriend proposes to her, but her world comes crashing down when she finds out her marriage is a sham.",--,Slick
2220,--,['Uduak-Obong Patrick'],DESCONOCIDO,,--,Plagued
2221,--,['Austin Nwaolie'],['Desmond A. Ken'],,1h 59m,Karma and I
2222,--,['Chidi Anyanwu Chidox'],['Prisca Okeke'],,1h 51m,Love & Stitches
2223,8.8,['Richard Nwosu'],['Onyii Cindy Umeh'],A young university student falls head over heels with his lecturer and vows to make her his wife.,1h 50m,Better Half
2224,--,['Scott R Sullivan'],['Scott R Sullivan'],"In the aftermath of a brush with death, Kevin is given an opportunity to avoid possible jail time by entering a new therapy program. What seems like an easy way out, turns out to be exactly the opposite as Kevin faces his biggest obstacle, himself. With mounting pressures to avenge a rival gang's blatant disrespect competing with his inner journey, Kevin navigates tre... Read all",1h 30m,Chances
2225,--,['Babawale Odunuga'],['Babawale Odunuga'],,1h 46m,Itaakun - Stolon
2226,--,DESCONOCIDO,"['Latavious Flournoy', 'Carlos Menzies']","Braxton and Brent flee from NY to LA after brutally assaulting Hunter. However, she heals and prepares to get revenge on those who hurt her.",1h,Unforgettable
2227,4.2,['Stephina Zwane'],DESCONOCIDO,"Through a year of 30th birthdays, four best friends navigate relationships, heartbreak and a shocking situation that threatens to tear them apart.",1h 46m,"Love, Sex and 30 Candles"
