701,--,['Raahul Mouje'],['Arjun Gawade'],"Ek Rupyachi Jatra (Marathi Feature Film), A story of a small girl who lives in a small village with big dreams but her parents are very poor. Her father tries to make his daughter happy by doing odd works. The story revolves around girl how she manages to get in the Fun n fair(Amusement park) with just one rupee.",--,Ek Rupyachi Jatra
702,6.5,['Kasper Rune Larsen'],['Kasper Rune Larsen'],Cille is pregnant and Tobias has discovered that his vocation in life is to become an actor; One that can entertain and bring joy to people around him. But the optimism of the young couple is challenged by an outside world that constantly seems to keep them from living their common dreams.,1h 35m,Idioten
703,7.1,['Xavier Rivers'],['Mathias Hardeman'],"Based on a true story. Pastor Arthur Allen Jr. (Rashaan Matthews) of the House of Prayer in Atlanta, takes his experience of manipulation and street hustling to the pulpit. He later discovers a boy Mathias ""Matt"" Hardeman (Vincent Ramirez) to force and groom into taking up his sinister, unsophisticated and unethical ways. After years of abuse and witnessing many dark ... Read all",2h 15m,Pulpit Gangster
704,3.2,['Hadi Moghadamdoost'],DESCONOCIDO,A Suffering and timid human confrontation with his life and obligations,--,Fragrant
705,--,['Kenneth Fung'],"['Kenneth Fung', 'Dawn Hoskins-Rivers']","A con man must deal with his brother's overdose death and is forced to repay his brother's drug boss. To get money, he romances a woman out of all she owns. The victim's friend rallies friends to help turn the tables to con the con man.",--,theLOVEcon
706,--,['Isaac Dell'],['Booth McGowan'],"Still living at home and unable to find the connection he craves in romantic relationships, Andy (Booth McGowan) returns to childhood best friend Ray (Papa Mbye) to fill the void. The two spend a weekend together at Andy's family farm where they act as little kids again: swimming in the creek, hiking through the forest, and shooting a BB gun. But reconnected after a y... Read all",1h 16m,Boys at Twenty
707,--,['Stanley Obi'],DESCONOCIDO,,--,Forbidden Love
708,6.6,['Kattia G. Zúñiga'],['Kattia G. Zúñiga'],"A heartfelt film about sisterhood, desires, jealousy and youth in the never ending tropical summer of Panama.",1h 20m,Las hijas
709,3.8,['Robert Wichrowski'],"['Anna Janyska', 'Katarzyna Bogucka', 'Anna Szczypczynska']","Stuck in a passionless marriage, a journalist must choose between her distant but loving husband and a younger ex-boyfriend who has reentered her life.",1h 32m,Tonight You're Sleeping with Me
710,6.2,['Caroline Fioratti'],DESCONOCIDO,"Virginia celebrates her 17th birthday with a big party in her penthouse. But the next day arises with a tragedy, as she is found lifeless.",1h 55m,My Drywall Cocoon
711,6.0,['Michihito Fujii'],"['Michihito Fujii', 'Kenya Hirata', 'Kim Seong-hun']","Detective Yuji Kudo drives his car to see his mother, who is hospitalized with a serious health condition. Yuji then accidentally hits a man with his car and that man dies. At the hospital, Yuji tries to cover up the death of the man.",1h 58m,Hard Days
712,--,['Benjamin Delattre'],['Benjamin Delattre'],"I had heard of a Chilean painter, author of a thousand paintings, who had disappeared long ago. I had been given an address on the banks of the Loire, at number 640 of a road that no longer existed. No one had been here for decades. Everything had remained there, as if someone had fled.",1h 16m,J'ai rendez-vous avec un arbre
713,--,['Muhammad Mostafa Kamal Raz'],DESCONOCIDO,"Shuvro is a son of a poor family. After completing his education, he started looking for a job to support his family. Even if he gets a tuition with a lot of difficulty, his student likes him. And he does not want to agree to this love",--,Bithir Banan Vul Chilo
714,6.8,['Bernd Michael Lade'],['Bernd Michael Lade'],,1h 37m,Der Zeuge
715,--,DESCONOCIDO,DESCONOCIDO,DESCONOCIDO,--,Error nombre para la pelicula con id: tt26596935
716,--,['Tissy Nnachi'],['Feyisayo Damilola'],,--,Tensing Feelings
717,--,['John Osemeke'],"['Arsenal Bruno', 'Feyisayo Damilola']",,2h 6m,Married But Feminist
718,9.2,['Chalapathy Puvvula'],['Godwin G'],,2h,Allantha Doorana
719,6.2,['Tsutomu Hanabusa'],"['Izumi Takahashi', 'Ken Wakui']","The long-awaited sequel to ""Tokyo Revengers"" will be released in two parts, before and after the film. Once again, Hinata is killed in front of Takemichi's very eyes by the now-militarized Tokyo Manjikai.",1h 36m,Tokyo Revengers 2: Bloody Halloween - Decisive Battle
720,--,['Nani Sahra Walker'],['Nani Sahra Walker'],,--,Shakti
721,--,DESCONOCIDO,DESCONOCIDO,"After so many years of being bullied, AJ and Ruth, co-workers and one-time romantic partners plan and exact their revenge against the office bully, Mr. Abubakar, who finds out that, ultimately and way too late, there are many sides to a dice.",--,Dice
722,--,DESCONOCIDO,DESCONOCIDO,DESCONOCIDO,--,Error nombre para la pelicula con id: tt26600129
723,--,['Limbert Fabian'],['Andrina Wekontash Smith'],"It showcases the key themes of Dr. King's ""I Have a Dream"" Speech and highlights the systemic inequities that persist in our society.",--,MLK: Now Is the Time
724,7.5,['Ilker Çatak'],"['Johannes Duncker', 'Ilker Çatak']","When one of her students is suspected of theft, teacher Carla Nowak decides to get to the bottom of the matter. Caught between her ideals and the school system, the consequences of her actions threaten to break her.",1h 38m,The Teachers' Lounge
725,--,['Sara Flaadt'],['Sara Flaadt'],"In love with poetry, but also with the beneficent Evil and the poetic hell which lie behind the pen and the voice of Charles Baudelaire, Riccardo gets rid of his clothes and puts on those of Charles Baudelaire, to satisfy his call for truth. From Montparnasse, he feels the need to give him a better burial by taking him away from the grave of his stepfather, General Au... Read all",1h 12m,Rejoignant Baudelaire
726,5.5,['GB Sampedro'],DESCONOCIDO,"A young couple's romance is cut short when the man learns that his woman is married. Meanwhile, an unhappily married husband meets a lonely teacher and they share an illicit affair.",1h 33m,Beloved
727,--,['Biodun Stephen'],"['Itunuoluwa Adefusi', 'Blessing Jessica Obasi-Nze']",,2h 2m,Helpmate
728,--,['Biodun Stephen'],DESCONOCIDO,,--,Exit Plan
729,4.2,['Reza Nejati'],DESCONOCIDO,,1h 30m,After Leaving
730,6.1,DESCONOCIDO,['Wil Lewis'],"To make ends meet with her drug-addicted mother, Kenya immerses herself in the world of underground strip parties.",1h 45m,A Love Story from the Streets
731,6.9,['Sung Yeon Choi'],DESCONOCIDO,"Jeong-ho, the fastest sprinter in Korea right now. The three players prepare for the national team selection for their own reasons.",1h 27m,Sprinter
732,--,DESCONOCIDO,DESCONOCIDO,The movie depicts the hope that blooms like petals in the trials faced by a mother and son who seem ordinary but are so special to each other.,--,Audrey
733,--,DESCONOCIDO,DESCONOCIDO,,1h 30m,Romance Campus
734,--,['Dabby Chimere'],DESCONOCIDO,,--,A Fight for Love
735,5.3,['Pavel Voronin'],['Pavel Voronin'],"Nadya decides at one point to radically change her life and challenge the stereotypes imposed on her by her environment. Getting into awkward situations, Nadya will have to defend the right to be herself and find long-awaited happiness.",1h 31m,YA khochu! YA budu!
736,--,['Allen Onyige'],['Tomi Folowosele'],"In the quest to provide for his poor family, 22-year-old Ikenna enrolls in AreaBoyz Mechanic Workshop which also serves as a criminal's den, He will fight for his life while he awaits trial for a crime he has no knowledge about.",--,Ikenna's Trial
737,--,['Kayode Peters'],['Pearl Agwu'],,--,The Wife
738,--,['Mr. Yash'],['Mr. Yash'],,--,Space Man
739,--,['Tissy Nnachi'],['Ikechukwu Odum'],"A lady gets a gift from her fiancé after dreaming of getting it from a stranger. Mysterious events follow, putting their relationship in jeopardy.",--,A Dead Man's Souvenir
740,7.7,['Mangesh Mahadev Badar'],['Mangesh Mahadev Badar'],"How the life of the people in the rural areas gets burnt due to drought, the relations get heated like the soil heated in summer. If there is moisture in the soil, there is also sweetness in man. Since it has not rained for two consecutive years, the people of the village are looking for a way to live, but that way is not permanent, people start moving to the city. Th... Read all",1h 33m,Madaar
741,4.4,['Said Tulyaganov'],['Said Tulyaganov'],"An extreme story of Antarctic challenge, inspired by real story, happened in 2018.",1h 21m,Kholodnaya gonka
742,4.6,['Hossein Mirzamohammadi'],['Hossein Mirzamohammadi'],"Issa Farahmand is an inspector of the welfare organization who, while investigating the financial violations of one of the centers, found out about a gang of economic corruption and drug transit by mistreated girls.",--,Leather Jacket Man
743,--,['Richard Thornéus'],['Richard Thornéus'],"Anton, a maladjusted and yearning man is trying to find love, comfort and a new family to requite his feelings. This is a journey through the early days of autumn that ends up being a series of turbulent and chaotic trials for those who crosses his path.",1h 16m,Inga skuggor kvar
744,--,['Dominikos Ignatiadis'],['Dominikos Ignatiadis'],"A road trip for six broken people, visiting institutions, cities and nature, contemplating love and freedom.",1h 16m,Prison Blues
745,9.2,['T. Mahesh'],"['Maheshkumar Munjale', 'Nilesh Mahigaonkar', 'Jameer Attar']",Ghoda is a story of a middle-class small boy's fascination to own a wooden rocking horse; and his father's terrific journey and struggle to pursue the dream of his son in this monetary world.,--,Ghoda
746,--,['Keisuke Sakurai'],['Keisuke Sakurai'],,1h 18m,Kiminisachiare yo
747,7.0,['Tariq Sayed'],['Tariq Sayed'],"After losing their first child to a genetic disease, grief-stricken parents Nicholas and Sarah enrol onto clinical trials launched by GEO Group; an established cellular meat company using its technology to create GM babies.",1h 24m,Isaac
748,--,['Boa Banx'],['Boa Banx'],,--,Love Donor
749,--,DESCONOCIDO,['Victoria González'],,1h 18m,NeverMets
750,6.5,['Georgy Danieliants'],"['Ivan Chaban', 'Georgy Danieliants']","New day - new life. The heroes get a chance to verify the authenticity of this statement, because each of them this night had the opportunity to radically change their fate. And now, with only a few hours left before dawn, they must take the first step towards a new life. But it turns out it's not so easy.",1h 28m,Do Rassveta
751,--,['Seema Desai'],['Seema Desai'],,--,Kaushaljis VS Kaushal
752,--,['Curtis Everitt'],DESCONOCIDO,Stewart checks himself into retreat therapy to work on some mental health issues where he bonds with others there.,--,Floor 6
753,5.4,['Marvin-Lee Beukes'],['Marvin-Lee Beukes'],"Young lovers Crystal and Grant dream of getting out of the Cape Flats. When they find Crystal's Mom's winning Lotto ticket, they see it as their ticket out of the Flats. Do they run away or do they stay?",1h 30m,Tickets
754,4.9,['Eliza Martirosyan'],DESCONOCIDO,Five stories of romantic relationships intertwine on Valentine's Day in a small town at the foot of a mountain.,1h 30m,Eta lyubov
755,--,['Germán Vilche'],"['Federico Arzeno', 'Adrián Caram', 'Germán Vilche']",,1h 28m,El Sueño de Emma
756,6.6,DESCONOCIDO,DESCONOCIDO,All is not as it seems in this impactful collection of shorts exploring private passions and hidden pasts.,1h 39m,These Untold Secrets
757,--,['Streetz'],DESCONOCIDO,"Without health insurance, Rick is left with only one option to live, hitting the streets and making money for his very needed surgery.",1h,Interrogated
758,6.0,['Christopher Novabos'],DESCONOCIDO,"A young man named Edmar falls madly in love with Karisma, a barrio lass. Will he still love her if he finds out Karisma's deepest darkest secret?",1h 34m,Fall
759,9.4,['Amire K Reed'],['Duece King'],This film depicts a story about a group of friends who migrate to Atlanta Ga in search of the American dream.,2h 1m,Pure Finesse
760,--,['Margaret Bihong Sha'],"['Elizabeth Geyang Wang', 'Margaret Bihong Sha']","Based on true events from the 2018 Parkland, Florida School Shooting, the story follows a grieving mother as she reconciles with the death her son: a young Chinese-American hero who was shot and killed while helping his classmates escape.",1h 29m,"See Me Once More, My Dear Kid"
761,6.8,['Kevin Arbouet'],['Jade N. Richard-Craven'],A high school athlete navigates physical and mental challenges after making the all-male football team but faces her greatest challenge when she begins to question her sexuality.,1h 36m,Gridiron Grind
762,--,['DAC'],DESCONOCIDO,"Daven is a teenager who has a recurring dream about a mysterious figure named Elohim. He goes on a trip to an island with his best friend Leo, where they meet Ana and Soi. While on the island, Daven has a vision of Elohim and gains mysterious powers that he can't control. They meet a rival named Javen, who secretly works for the rebels. Meanwhile, an alien named Karav... Read all",--,Diviners
763,--,['José Macías'],['José Macías'],,--,Poliamor
764,--,['Bálint Szilágyi'],['András Forgách'],"In this film adaptation of András Forgách's play for the stage, the legendary and tragic story of Hungarian writer Zsigmond Móricz and the women he loved is presented through the intricate web of the game of love.",1h 15m,Tercett - Móricz Zsigmond szerelmei
765,6.8,['Per Fly'],"['Per Fly', 'Ulf Ryberg']","Set in Cold War in 1961, follows the story of diplomat and economist Dag Hammarskjöld, who boards a plane in a desperate attempt to negotiate a ceasefire from his enemies after he leads UN troops into their first wartime operation.",1h 54m,Hammarskjöld
766,5.9,['Anthony Lapia'],['Anthony Lapia'],"A club in Paris. Driving techno beats sweep everyone away. People dance, consume and talk. Félicie meets Saïd and takes him to her place for an afterparty. On the cusp between night and day, different lives and views collide.",1h 9m,After
767,7.1,['Léa Fehner'],"['Léa Fehner', 'Catherine Paillé']",Sofia and Louise are newly qualified midwives. They quickly encounter the challenges of everyday hospital life in a broken health-care system.,1h 39m,Sages-femmes
768,--,['Cheyenne Carron'],['Cheyenne Carron'],"Paul, Padre in the Foreign Legion, is immersed in the sufferings of war. He is solicited by families of the dying, tormented soldiers. Paul also tries to comfort a loved one: his mother.",1h 35m,Je m'abandonne à toi
769,--,['Césaire Kafando'],['Césaire Kafando'],,--,La visite de trop
770,6.6,['Joydeep Mukherjee'],"['Padmanabha Dasgupta', 'Sujan Dasgupta']","Ekendra Sen was enjoying his vacation in Rajasthan with Bapi and Pramatha, suddenly a Professor of Archaeology at Oxford University Shatadru Ghosh informs him about his suspicion that a particular idol he had seen in London went missing.",2h 1m,The Eken Ruddhaswas Rajasthan
771,2.5,['Soumik Haldar'],"['Rudranil Ghosh', 'Somnath Roy']","On being released from jail, Bullet Singh meets Anupam and Rajat to inform him that a fellow prisoner has gifted him a 100 crores worth Hotel, which he wants to share with them. They soon realize it's a trap. Can they get out of it?",1h 59m,Abar Bibaho Obhijaan
772,7.1,['Tien-Yu Fu'],DESCONOCIDO,"For 40 years A-Rui has been running a barbershop. One day, she receives a phone call from the family of an old client who moved away, asking if she would be willing to travel to give the bedridden old man a haircut.",1h 46m,Day Off
773,6.8,['Nigam Shrestha'],['Nigam Shrestha'],"""Chhadke 2.0"" tells the story of a guy named Mendog, whose family gets killed by Gangsters of Manang while fetching YarsaGumba.",--,Chhadke 2.0
774,6.3,['Chun-Yang Lin'],DESCONOCIDO,"Right after thoracic surgeon Dr. Xia is called back to treat an emergency patient, an unknown virus outbreak forces the hospital to go into lockdown, trapping Xia, along with hundreds of healthcare providers, patients, and their families.",1h 58m,Eye of the Storm
775,7.6,['Imraul Rafat'],DESCONOCIDO,,2h 10m,Made in Chittagong
776,7.0,['Herwin Novianto'],"['Alim Sudio', 'Yoshio Katô']",4 people intend to commit suicide together by blowing themselves up using a large ball of fireworks.,1h 44m,Fireworks
777,--,['Dan E. Tibbs'],['Dan E. Tibbs'],"Growing up in an orphanage, eight-year-old Maddox's sole wish is to be adopted. Thinking God sent him a sign that it would come true, he begins to notice that his wishes for others are granted, but his wish for himself is left unanswered. Frustrated with God, and conflicted with the purpose of his powers, Maddox is left to decide whether to help those he encounters or... Read all",--,Wisher Maddox
778,--,['Hung-i Chen'],DESCONOCIDO,"Follows two men from different generations who fall in love due to an unexpected encounter, as they experiment how things would work out after an accident.",1h 57m,Fish Memories
779,5.9,['Chihiro Itô'],['Chihiro Itô'],"Mysterious young man Miyama has the ability to sense the thoughts of other people. The secrets of his background linger emerge when he confronts the thoughts of Kusaka, his junior in high school, and the past that he ran away from.",2h 10m,Saido bai saido tonari ni iru hito
780,7.5,DESCONOCIDO,DESCONOCIDO,A presentation of the five live action shorts nominated for the 2023 Oscars.,1h 50m,2023 Oscar Nominated Short Films: Live Action
781,--,DESCONOCIDO,DESCONOCIDO,DESCONOCIDO,--,Error nombre para la pelicula con id: tt26688952
782,6.4,['Maks Maksimov'],['Aleksey Sheyn'],"A young priest arrives in a provincial town. Thanks to a non-trivial approach to his role as a clergyman, he manages to show what true love for one's neighbor is. He buys a café where he begins to feed some of the patrons for free and listens to their dramatic and twisted stories. The life of people, as well as the priest himself, begins to change dramatically.",1h 40m,Pustaya tserkov
783,--,['Opeyemi Dada'],['Eyo Emmanuel'],"After a major accident, Chike wakes up from a coma with no memories. He must find a way to get his life back.",--,"Now, Always and Forever"
784,--,['Biodun Stephen'],['Biodun Stephen'],A couple in possession of hard evidence find themselves arrested and subjected to torture during a ruthless investigation.,--,Chaos Calling
785,--,['Prince Cres Ugo'],['Nonso Akaenyi'],Ichie Ekule's youthful mistake is tearing his family apart. His son takes it upon himself to reconcile their differences.,--,The First Son
786,--,['Aniedi Awah Noba'],['Lilian Ozioko'],,--,Cold Heart
787,--,['Ali El Habti'],"['Ali El Habti', 'Fritz Ethan Holst', 'Alice Murphy']","Peter faces loss and struggles, causing his hero duties to weigh heavy. Aunt May is ill, Gwen is gone, and school's tough. NYC teeters on destruction, but will Peter fight to save it, even alone, despite his fears?",--,Spider-Man: Blue
788,5.2,['Darryl Yap'],DESCONOCIDO,"The film explores the assassination of Ninoy Aquino on August 21, 1983, three years before the events of Maid in Malacañang, and how the Marcoses were accused of as those responsible for killing him.",1h 46m,Martyr or Murderer
789,--,['Ramana Mogili'],['Rajendra Bharadwaj'],,--,Janata Bar
790,--,['Great Valentine Edochie'],DESCONOCIDO,,--,Attribution
791,--,DESCONOCIDO,"['Shrey Rajdeo', 'Anish Verma']","Revolves around 2 kids, Ali, and Imran studying at a rural Islamic school in India. They become friends with a rag picker, Bantu, while playing football at a nearby ground. Soon, they become good friends. Now, Bantu shows his interest in going to school. Maulvi, the teacher of school comes to know about Bantu and his background. He manages to convince Bantu's father t... Read all",1h 35m,Salam-e-Madrasa
792,--,['Emmanuel Anyaka'],['Kikelomo Jacob'],,1h 54m,Stuck in Lust
793,6.4,['Mithran Jawahar'],"['Jagajeevan', 'S.U.Mariselvan']","The movie is based on the subject of woman empowerment, it's based on real incidents about how girls get caught by cheaters, blackmailed and used, the movies shows how girls should handle such situation and protect themselves.",--,Ariyavan
794,6.8,['Koushik Kar'],['Koushik Kar'],"Our limited understanding of the world, our misconceptions about life, derived only from what we directly witness. It highlights our incapability to look beyond the stereotyped realism.",1h 59m,Chhipkali
795,--,['K Shankar'],DESCONOCIDO,,--,Vidhi 370
796,--,['Maciej Stuhr'],"['Adam Kasjaniuk', 'Maciej Stuhr']","The rector of the university interrupts one of the lectures and informs the students that one of their friends is dead and out of concern for them, he invited a psychologist who will help them find themselves in this difficult situation. Subsequent conversations reveal the story of Marta Grall, her personality, relationships with her peers, memories of her friends and... Read all",1h 10m,Marta Grall
797,8.8,['Ferry L.'],"['Ferry L.', 'W.W. Jacobs']",A greedy husband and wife use a monkey claw amulet given by a shaman so they can get rich quickly.,1h 26m,Kutukan Cakar Monyet
798,--,['Max Rojas'],DESCONOCIDO,,--,El Matador
799,--,['Saeed Rashed'],['Saeed Rashed'],"Is an Emirati melodrama that follows Khalid, who disappears for many years and returns to a changed home that's moved on without him. As he experiences feelings of doubt and envy, a secret about his past life unburies itself.",1h 30m,Heen
800,--,['Saif Baiidya'],DESCONOCIDO,Be who you are and say what you feel because those who mind don't matter and those who matter don't mind. Based upon true event.,--,No Tears Left to Cry
801,--,['Hyung-suk Jung'],['Hyung-suk Jung'],"Young new members enter a small theater company in Daehak-ro. Among them is Hye Lee, a female member who graduated from a prestigious university. People take a strange look at her coming to the poor theater with a good academic background. Meanwhile, Hae Young, the representative and director of the theater company, feels that his artistic inspiration is running out b... Read all",1h 51m,Personas a strange girl
802,4.9,DESCONOCIDO,['Mya Speller Cullins'],"Stacey and Darrel are models of success and strength in their community. But behind closed doors, the couple's demons are tearing them apart.",--,Behind the Veil
803,7.4,['Ram Abbaraju'],"['Ram Abbaraju', 'Bhanu Bhogavarapu', 'Nandu Savirigana']",A lifelong university student struggling to pass his exams enlists the help of his son and his lovestruck friend. Hijinks ensue amidst blossoming love and comic bust-ups.,2h 20m,Samajavaragamana
804,--,['S.J. Finlay'],['S.J. Finlay'],"Shot guerrilla style in dangerous parts of the southern Philippines, Boy From Nowhere is S.J. Finlay's feature film debut. It features a cast of non-actors whose lives closely mimic the tale of a boy caught up in chain of events beyond his control. After losing his father and home when his fishing village is burned down in an attack, a lost and gentle young boy sets o... Read all",1h 15m,Boy from Nowhere
805,--,['Szabolcs Peto'],['Szabolcs Peto'],"Through the individual fate of a man, our independent art film shows what our lives will be like in the not-too-distant future, when our world is a very different one in everything but appearance.",--,Alagút a fény végén
806,--,DESCONOCIDO,DESCONOCIDO,"Joon-seok, a successful author, and Deok-hee, an art instructor look like a normal couple who lead happy lives, but their biggest problem is Deok-hee's selective amnesia. One day, Joon-seok goes on a journey to prep his new novel and tragically dies in an accident. Overwhelmed with sorrow, Deok-hee heads to the same place and as she traces his journey, she faces the u... Read all",--,While You Were Sleeping
807,6.7,['Toka McBaror'],"['Linda Ikeji', 'Odewa Shaga']",Based on a true story. When a university student in Nigeria is having trouble collecting money from another student. He enlists the help of his friends to get it back. But something goes wrong. The town this happens in invokes jungle justice on these university kids just trying to get their money back.,1h 50m,Dark October
808,--,['Samuel Obiora'],['Amakirita Bob-Manuel'],,1h 21m,Perfect Friendship
809,--,['Kelechukwu Nuel Uche'],['Prisca Okeke'],,1h 50m,Flip Side
810,--,['Satyendra Singh'],['Pramod Singh'],Devanand Dheere Dheere is a Rom-Com based on slices of life. The story of the film revolves around a 45 years old bachelor Devanand who falls in love with a girl almost 20 years younger to him.,1h 37m,Devanand Dheere Dheere
811,--,['Weiran Li'],"['Zijian Chi', 'Weiran Li']",,--,Chuanguo yueliang de luxíng
812,4.3,['Joel Lamangan'],"['Bonifacio Ilagan', 'Eric Ramos']","As unrest unfolds, a family who lives in the slums grapple with the murder of their patriarch in the hands of corrupt policemen, turning from passive victims of social injustice into active participants in the final hours of the uprising.",1h 44m,Hour of Danger
813,6.6,['Ashraf Hamza'],['Ashraf Hamza'],"When the marriage between Haala and Ameen gets decided in a short span of time with very little time for preparations, it leads dramatic ride between the families.",2h,Sulaikha Manzil
814,--,['Joe Adetona'],DESCONOCIDO,,--,Bad Puzzle
815,5.9,['Shoib Nikash Shah'],['Shoib Nikash Shah'],"On the verge of a divorce, Rehaan and Iram meet for one last time over coffee. But they get stuck in a snowstorm and are left with no choice except to confront their pent-up feelings.",1h 19m,The Last Coffee
816,3.4,['Antoine Allen'],DESCONOCIDO,"A look at the lives of five New Yorkers dealing with a variety of life's challenges and conflicts. Little do they know that all will be over soon. If you knew that the end of the world was about to come, would you do anything differently?",--,Not Promised Tomorrow
817,--,['Patience Oghre'],['Tega A. Onobrapeya'],A family is thrown into turmoil when they wake up to find their baby has been kidnapped.,--,Kidnapped
