1071,9.1,['Brian Nesbit'],"['Brian Nesbit', 'Darnice Wright']","Charisma Harper, a vulnerable teenager, finds romance and comfort in a charming online boyfriend, Eli. Disturbances in her home life push her into the arms of her newfound love until Eli deceives Charisma and she is forced to leave her suburban life.",--,Fishnets
1072,--,['Suraj Savkoor'],['Suraj Savkoor'],"Darren Briggs, a police officer in his 40s, pulls over Ernest, a 93 year old man, for going above the speed limit. Upon closer inspection, he notices fresh bruises on Ernest's face. Briggs also notices from Ernest's license that not only is his license expired but he lives in one of the troubled neighborhoods of their small town. Ernest struggles to communicate owing ... Read all",--,Erasmus
1073,--,['Adielenah Perez'],['Adielenah Perez'],"Eight year old Bella helps her neighbor, Karen, search for her missing cat. But both of them have a secret they are not ready to share.",--,Super Bella
1074,--,['Keagan Afonso'],"['Keagan Afonso', 'Nala Tshibubudze']",An abstract narrative following two young South African workers in the heart of Johannesburg's industrial sector during Covid-19,--,Casual Workers
1075,--,['Polly Cole'],['Polly Cole'],,--,Normal
1076,--,['Landon Coats'],"['Landon Coats', 'Ana Kalan']",,--,Who Are We?
1077,--,['Shaquayla Mims'],['Shaquayla Mims'],"When a hopeless battered woman crosses paths with a bullied transgender teen, they're each forced to speak their truth within 24 hours or their secrets will be the death of them.",--,Fine
1078,--,['Emily Capehart'],['Emily Capehart'],"Blaze Forrester is a high school junior in a near-distant post-apocalyptic future where the gene that turns people into zombies has infiltrated the human race. She carries this gene, as does her 12 year old brother Dax. They must conceal this fact for fear of being exiled outside of their sector (the city of Los Angeles) walls. Unfortunately, this is not possible as D... Read all",--,Z47
1079,--,['Georgia Stedman'],['Georgia Stedman'],"A young boy must escape his uncle, who believes his parents are unfit.",--,Breadcrumbs
1080,--,['Eduardo Moreno'],['Nicole Katzew'],,--,Crónico(a)
1081,--,['Jeremy Zelikovic'],"['Tara Doustar', 'Jeremy Zelikovic']",A dying vampire is forced to choose between her mortal companion or living to see another day- but the arrival of a young girl complicates matters even more.,--,Creature
1082,--,['Dan Hewitt Owens'],"['Chelsy Leigh Jackson', 'Dan Hewitt Owens']",,--,An Unwanted Promotion
1083,--,['Reginald Bernandino'],"['Aaron Douglas Armer', 'Reginald Bernandino']",A young man navigates a path amidst toxic masculinity and the desire for female companionship.,--,Curse
1084,--,['Nina Gofur'],['Nina Gofur'],An experimental short documentary film that questions when and why we feel vulnerable and how that transforms when we empower ourselves to reclaim our bodies. The film follows three narratives that explore insecurities by challenging the gaze that is traditionally cast upon them.,--,Nectar
1085,--,['Pål Erik Helgerud'],['Pål Erik Helgerud'],,--,The Last Dance
1086,--,['Maddalena Kingsley'],['Maddalena Kingsley'],,--,Prometheus Bound
1087,--,['Justin Bromley'],"['Justin Bromley', 'Rio Miller']","An insecure, aspiring dancer faces her ultimate test when her abusive partner inflicts a major disadvantage on her the evening before her performance for a dance scholarship.",--,Persist
1088,--,['Matthew Summer'],['Matthew Summer'],A young hard working couple trying to ensure survival in a brutal world.,--,Class
1089,9.6,['Grish Majethiya'],['Grish Majethiya'],The film is about a college student Ashutosh who is working on a new invention that can Change The Entire World for the past couple of years. His mentor Akash always guides and motivates him. Will he have to face Failure again?,--,Decision
1090,--,['Dibakar Ronnie Das'],['Dibakar Ronnie Das'],,--,The Bench
1091,--,['Matthew Summer'],['Matthew Summer'],This is a story about love. The love between a young couple who reflect on a once beautiful and fruitful relationship. Time has played its part in drifting the two apart from being as infatuated as they once we're.,--,I Don't Love You Anymore
1092,--,['Matthew Summer'],['Matthew Summer'],"Set in the 11th century, the old Scotsman relives his account of the reign of MacBeth.",--,A Scottish Tale
1093,7.1,['Cristian Patanè'],"['Andrea Paolo Massara', 'Cristian Patanè']","It follows Gaia, who works in a funeral home and one day something unexpected happens.",--,Corpo e Aria
1094,--,['Thomas Bischof'],['Thomas Bischof'],"Karl, a retiree and ex-thug, is on his way through the bars and brothels of Vienna. He and his companions are struggling through the night under the burden of misery well aware that there is no escape.",--,Servus Karl
1095,--,['Jesse Hutchins'],"['Wes Fisher', 'Jesse Hutchins']","A small, single-screen theater is saved from permanent closure when a stranger in town for business presents an unexpected solution.",--,Luminous Dreams
1096,7.8,['King Dawit'],['King Dawit'],"As the COVID-19 pandemic continues, eccentric bedroom musician Tommy Doss is invited to lunch by the connection-starved Lucy, who is taken by his enigmatic personality and homemade tapes.",--,Tapeboy
1097,--,['Minar Kishore Joshi'],"['Minar Kishore Joshi', 'Seema Rekha']","After her wife's death due to corona-virus , a happy to go man Ram (Minar) promises to save every corona-virus patients.",2h 30m,World War Covid
1098,--,['George Sermon'],DESCONOCIDO,"Mary's life forever changes after she is diagnosed with deadly disease. A young girl who now lives with her father long ago lost a loving mother, from that day on their life turned to total misery, until the day they found the will and courage to carry on.",--,Memento Mori
1099,--,['Miguel Angel Tamayo'],"['David Jura', 'Miguel Angel Tamayo']",,--,Eutuxia
1100,9.2,['Lisa Marie Tedesco'],['Lisa Marie Tedesco'],"When the curtain descends on their final performance of Romeo and Juliet in drama club, high school seniors Abigail and Sky bid a fair adieu to the stage they loved while letting their most deepest desires for one another surface at the cast party.",--,Spin
1101,--,DESCONOCIDO,['Ruben Bouillon'],Simon is facing a hard decision. He must choose between life and death. What will Simon choose and is this the right choice? Or is it already too late when the phone rings?,--,In Limbo
1102,--,['Trevor McGhie'],['Trevor McGhie'],"A young man's journey to the past where he experiences, first hand, the struggles his ancestors endured, ultimately leading him to change his ways and better his community - instead of destroying it.",--,Lineage
1103,--,"[""T'ana Phelice""]","[""T'ana Phelice""]",When a high school basketball star pursues a career in Hollywood she must convince her disgruntled family to believe in her new road to stardom.,--,T Alexander
1104,--,['Devashish Makhija'],['Devashish Makhija'],"A wronged young tribal woman, in the absence of systemic justice, turns rebel, but struggles to be able to fulfil all the expectations that the path to retribution demands.",--,Cycle
1105,--,['Shane Harness'],"['Mike Caron', 'Shane Harness']",Andrew is reeling from his recent breakup with Sophie when his overbearing ex-wife Becky calls with Sisyphean demands.,--,A Workable Solution
1106,--,['Lanka Bandaranayake'],"['Lanka Bandaranayake', 'Ransiri Perera']","When people try to resolve their daily problems through mystic beliefs, children may become the most affected victims.",--,Mahasona
1107,--,['Bruce Koussaba'],['Bruce Koussaba'],"In search of his next vocation, the heart jazz musician Chet Baker is beheld by a beautiful photographer sitting at the back of his show. The two take off for a night of romance in the city.",--,Romance Dawn
1108,--,['Dan Hewitt Owens'],['Chelsy Leigh Jackson'],,--,Some Day My Way
1109,--,['Smerlin Segura'],['Smerlin Segura'],"Nelson, a former prisoner, fled his town with the promise of returning for his family, never imagining the surprise that life had for him.",--,Éxodo
1110,--,['Jay Parikh'],['Akshita Namjoshi'],A pregnant woman battles uncertainty and distress about the pandemic as her husband is tested positive for covid.,--,Hope
1111,--,['Mats Adler'],['Mats Adler'],"A neighborhood watch has been formed as a response to several cat killings that have taken place in a small suburban area. Frustrated with the police's inability to act, one woman takes it upon herself to catch the killer.",--,The Cat as Mouse
1112,9.1,['Matías De Leis Correa'],['Matías De Leis Correa'],"Some things end, some others may not.",--,Beyond December
1113,--,['Charlie Parkrud'],['Charlie Parkrud'],"Nate is assigned the task of shipping a bag through Haga. But when he loses it, his future no longer looks so bright, and after a while everything derails.",--,Tilltro
1114,8.0,['Maider Oleaga'],['Carlota Pereda'],A Cuban live-in maid and a slightly deaf senior woman have to spend the quarantine together in Madrid during the corona-virus pandemic.,--,Kinka
1115,--,['Luke Riether'],['Luke Riether'],An arrogant teenage man relives the actions that he committed against his father.,--,The Son
1116,--,['C. Craig Patterson'],['Dylan Filingeri'],"Inspired by a true story. Anna is battling the beginning stages of dementia at an assisted living facility in the days following the statewide quarantine. No longer able to receive visits from her family, she is forced to spend time with them via Zoom, which proves to be difficult. Anna battles the loneliness of her everyday routine and her fading memory, as she strug... Read all",--,Alone Together
1117,--,['Marco Mathisen'],['Marco Mathisen'],"A young man makes a choice, which has dire consequences for the small town he lives in. He has to fight his demons in order to move on in life.",--,Sort Snø
1118,--,['Ryan Noufer'],['Ryan Noufer'],,--,Medallion
1119,--,['Mario Antonio Liptaj'],['Mario Antonio Liptaj'],"In a London divided by a wall into two halves controlled by opposing ideologies, two women stay out past the strictly enforced curfew. They are waiting out the revolution. Emma and Betty have been friends since secondary school. Betty has always been shy and unselfconscious, though this doesn't mean she will always agree with the majority - she has always harboured ne... Read all",--,An Ugly Duckling Dreams of Flight
1120,7.7,['Luke Benward'],['David Mandell'],"Two boys let their imagination run wild in a barren desert, but the fun and games come to a shocking halt.",--,Boys
1121,--,['Robert Hayes'],['Katherine Makinney'],,--,Dark Angel
1122,--,['Jamie Zin'],['Jamie Zin'],Two daughters find themselves in a fight for survival when their father begins transforming into a blood thirsty scarecrow.,--,The Strawman
1123,9.4,['Adas Burksaitis'],['Adas Burksaitis'],,--,Konsultacija
1124,--,['Daisy Moore'],['Daisy Moore'],"Dara and Sophie's once close friendship is now only sustained by likes, memes and ever-delayed meet-ups. When Sophie commits suicide, Dara is forced to look behind the surface of Sophie's last messages.",--,7 Bananas
1125,--,['Ania Melkonian'],['Ania Melkonian'],,--,Follow Your Dream
1126,--,['Brielle Cruz'],DESCONOCIDO,A girl consumed by her own teen angst finds comfort in pretending she's the main character of an '80s brat pack movie.,--,Based on a True Story
1127,--,['Richard Barlow'],['Richard Barlow'],"A hit man has a busier than usual night carrying out jobs for his boss. With things heating up and more attention being drawn to him, he knows, one way or another, tonight will be his last on the job.",--,The Job
1128,--,['Yudelka Heyer'],['Barbara Bernardi'],"See You later follows Gabriela, a woman who suffers from anxiety and severe depression; and her journey towards healing from an intense break up with her boyfriend (a man with Aspergers) during a global pandemic.",--,See you later
1129,--,['Delilah González'],['Delilah González'],"It's the Birthday Boy's birthday, someone ate his cake, but who?",--,Who Ate the Cake?
1130,--,['Shacolby Shentell'],['Shacolby Shentell'],This impactful short film depicts the reality of what is happening in many homes nationwide since the pandemics beginning. Marriages have been suffering and divorce rates are steady rising.,--,Sincerely Judy
1131,--,['MaryCharles Miller'],['Christopher Siaens'],"A teenage girl videotapes herself, confessing to her mother about the abuse she's endured from her father.",--,His Workshop
1132,--,['Alexander Chehrazi'],DESCONOCIDO,A man living a dual identity is faced with the consequences when his long kept secret is soon discovered.,--,The Gift
1133,--,['Rebecca Van Kirk'],['Rebecca Van Kirk'],Left Side is a personal project produced by Rebecca Van Kirk in association with Panda Productions speaking on overcoming trauma.,--,Left Side
1134,8.3,['Luka Bursac'],['Luka Bursac'],Former criminal is followed by female assassin in Belgrade.,--,Spark
1135,--,['Shacolby Shentell'],['Shacolby Shentell'],,--,Blood Ties
1136,--,['Ajdin Islami'],"['Ajdin Islami', 'Darko Naneski']",,--,10 Kg.
1137,--,['Hao Dong'],['Hao Dong'],,--,Exteriors
1138,7.0,['Annie St-Pierre'],DESCONOCIDO,"December 24, 1983, 10:50 p.m.: Julie and her cousins ate too much sugar, and Santa Claus is late. Denis, alone in his car, is anxious about setting foot in his former in-laws' house to pick up his children.",--,Like the Ones I Used to Know
1139,--,['Tamia Young'],['Rebecca Faith Quinn'],"Rachel really likes Josh, but is she confident enough to let him see her for who she really is?",--,A. S.imple D.ate
1140,--,['Murad Yaseen'],"['Hafeez Ur Rehman', 'Murad Yaseen']","Fourteen-year-old Abdullah is a new student at the high school. However, his excitement is taken away when he finds himself surrounded by four grown bullies. He can't stand up to them, nor can he complain about the brutality they are causing him, fearing, he might be called names. And the only exit that he sees now is freedom.",--,Dargat
1141,--,['DeShon Green'],"['DeShon Green', 'Torique KenYae']",,--,Southern Hospitality
1142,5.7,['Noé Debré'],['Noé Debré'],"His ex, Marie, became an Instagram star (thanks to an activist group focused on the female orgasm). Depressed, Igor believes this is a deliberate campaign to prevent him from finding someone else.",--,On n'est pas des animaux
1143,--,['Octavio Maya'],['Octavio Maya'],,--,La Llamada-NYC
1144,--,['Hanna Williams'],['Hanna Williams'],,--,I'm Drowning
1145,--,DESCONOCIDO,DESCONOCIDO,,--,Parasites
1146,--,['Daniel Topic'],"['Alan Hall', 'Gráinne Good']","Sam and Sinéad play out their past, but something is different this time round.",--,Another Day
1147,--,DESCONOCIDO,['Ivan Casimiro'],A backpacker receives a text message from a stranger on his last day in Santorini.,--,Last Day in Santorini
1148,--,['Zhixin Vanessa Cheng'],DESCONOCIDO,A middle school girl's sudden shift into womanhood sparks an exploration of the intersection of the mind and body.,--,The Good Day
1149,--,['Marcus Parker-Wood'],"['Marcus Parker-Wood', 'Callum Woodhead-McClimens']","Feeling abandoned by his family and country, a social pariah finds purpose in a far right provocateur.",--,Citizen
1150,8.3,DESCONOCIDO,"['Ali Al-Fatlawi', 'Joël Louis Jent']","Rolf, a hemiplegic, spends his days dozing on a sofa bed in his dusty apartment. On TV, he learns of a deadly pandemic sweeping around the globe. When his nurse fails to visit him, Rolf realizes that his survival is anything but certain.",--,Eating the Silence
1151,--,['Sara Boutine'],"['Sara Boutine', 'Debora Giannone']",A waiter's Night Shift takes an unusual turn when a Nun and a Hajje meet at 3am.,--,Night Shift
1152,--,['Annabel Grace'],"['Annabel Grace', 'Gemma Murray']",,--,The Catch-Up
1153,5.3,['Blake Snawder'],['Blake Snawder'],"A fleeting love encounter between two men with opposing views on love proves that, like a plum, the sweetest turn bitter too soon.",--,Plum
1154,--,['Jace Black'],['Amber Patton'],,--,After Forever
1155,--,['Kady Ruth Ashcraft'],['Kady Ruth Ashcraft'],,--,Where Do You Go?
1156,--,DESCONOCIDO,"['Ariel Glenn', 'Edoardo Miranda']","A young woman named Emma leaves the city for the countryside during a pandemic. She is escaping from the virus, but she is also attempting to leave behind painful memories of her husband, Johnny, who was recently killed by a police officer. Emma arrives in the rural setting of her childhood only to run into Lorenz, a strange vagabond who claims to have access to power... Read all",--,Recalling
1157,8.2,['Nia Childs'],['Nia Childs'],"Shona's partner doesn't come home one night. Fearing the worst, she sets out to find him.",--,The Other End
1158,6.6,['William Glass'],['William Glass'],"Two friends drive out to a secluded forest and experiment with hypnotism, which triggers memories, dreams and serpentine hallucinations.",--,Night Visions
1159,--,['Marissa Lear'],['Marissa Lear'],,--,Cut Off
1160,--,['Anthony Barajas'],['Anthony Barajas'],,--,An Excerpt From...
1161,--,['Waldemar Lerche'],DESCONOCIDO,,--,Blodgildet i Roskilde
1162,--,['Eliana Alexander'],['Eliana Alexander'],Several months after Jesse's horrible crash where she severely injured a newborn she is finally in recovery and coming to terms with her sobriety. During a meeting Jesse fully expresses her pain.,--,One More for the Road
1163,--,['Andres Collantes'],['Andres Collantes'],"Twin brothers, Wil and Daly, skateboard and talk about their views on virginity",--,"It's Alright, Okay?"
1164,--,['Sofija Elena Alekna'],['Sophia Mazzella'],"After learning a popular high school senior plans to kill herself, a rebellious dropout spends the afternoon trying to understand and, along the way, discovers how alike they really are.",--,Rainy Days
1165,8.6,['Anya Chirkova'],['Anya Chirkova'],"As August creeps in, Nav forms an intimate bond with an audacious painter and a middle-aged laser tag owner. Just as he begins to find himself summer inescapably comes to an end.",--,Flower Boy
1166,--,DESCONOCIDO,['Sesselia Olafs'],It is about isolated people who yearn for human contact and connection. Their search leads them to discover something new within themselves.,--,Betur sjá augu (See No Evil)
1167,--,['John Hudson White'],['John Hudson White'],,--,On the Run
1168,--,['David R. Liu'],['David R. Liu'],,--,River
1169,--,['Vincent Maeder'],['Vincent Maeder'],The crazed relations amongst estranged family members.,--,Edgar
1170,--,['Lewis William Robinson'],['Lewis William Robinson'],"With not much to show for in his life, Andre takes his health to extreme measures by attempting an eating challenge at his local diner.",--,Big Stack
1171,--,['Luke Poirier'],"['Luke Poirier', 'Max Hauer', 'Paige Alcorn']",A teenager with an eating disorder goes on a journey in her head.,--,The Hallway
1172,--,['Max Corman'],['Max Corman'],Gavin wakes up in a new dimension everyday and searches for meaning in a series of lonely worlds.,--,Essential Ports
1173,--,['Hunter Fenoglio'],['Hunter Fenoglio'],Two American soldiers run for their lives through unknown enemy terrain after escaping a Nazi POW camp and must find the strength to survive.,--,Blind Runners
1174,--,['Alex Ewan'],['Alex Ewan'],,--,Mason
1175,--,['Carlos Novella'],['Carlos Novella'],"A man tries to save the radio that has kept him company, all his life.",--,La Radio
1176,--,['Daniel Paz Mireles'],"['Aura Tampoa Lizardo', 'Daniel Paz Mireles']","Belén receives the news that she has feared for several years, the time has come to vacate the house where she lives. Full of ghosts and uncertainties, that day, Belén begins her farewell.",--,La Intemperie
1177,--,DESCONOCIDO,['Gk Shathisnair'],The greatest aviation mystery of all time concluded by a Joint Investigation Team when the sole survivor miraculously became the only occupant to reveal the truth behind the missing flight MH 370.,--,Pilot Did It
1178,--,['Trinayan Sharma'],['Trinayan Sharma'],Its about the conditions and struggles of the common and below the poverty line people right after the corona virus has ended . It's also about the exploitation of the poor by the rich and to what extent it drives them .,--,Antardwand
1179,--,['Benno Hanke'],['Benno Hanke'],,--,Labyrint
1180,--,['Lou Camille'],['Lou Camille'],,--,Je Suis Toi
1181,--,['Miguel A. Caycedo'],['Jon Gutierrez'],"Michael, young hustler with a resentment towards God, has his faith tested when he finds his girlfriend unconscious.",--,Born Again
1182,--,['David Crockett Noonan'],['David Crockett Noonan'],The appearance of an old classmate leads a suburban dad on a twisting path down memory lane.,--,Most Likely to Succeed
1183,--,['Liam Fouracre'],['Liam Fouracre'],"A son's discovery about his reclusive father, and the trials of handling a formerly domesticated animal, will end his belated visit in flames.",--,Hound
1184,--,['Corentin Camplong'],['Corentin Camplong'],,--,Le dernier voyage
1185,6.0,['Hossein Rahmani Manesh'],['Hossein Rahmani Manesh'],"There are two friends who already know each other in a park place and Hussein points out to his friend that he should not smoke, but he has no answer for it and makes a ridiculous impression on Hussein, and Hussein does not feel good about the relationship with him at all and has to have a relationship. Cut his friendship and again Matin needs Hussein's potential with... Read all",--,Baraye Yek Rooz Boodan Ya Naboodan
1186,--,['NaTasha McKenzie'],['NaTasha McKenzie'],The pressures of keeping it together while her marriage is falling apart begins to weigh heavily on a woman as she battles her thought-provoking demons.,--,The Assumption
1187,--,['Lawrence McCudden'],['Carolyn Wagner'],,--,Quiet My Mind
1188,--,['Isaac Camner'],['Isaac Camner'],,--,Cold Call
1189,--,['Carl Mickens'],"['Carl Mickens', 'Justin Phillips']",A poetic character study on a college track star and how he grieves the death of his father.,--,Level Up
1190,--,DESCONOCIDO,['Johnny McClain'],,--,Something in the Clouds
1191,--,DESCONOCIDO,DESCONOCIDO,DESCONOCIDO,--,Error nombre para la pelicula con id: tt13742456
1192,9.2,['Alexander Vlahos'],['Alexander Vlahos'],"When Freddie hits rock bottom Lily offers a way out. Freddie must overcome his demons and allow Lily's love to be his source of strength, or lose the life they share forever.",--,Watchtower
1193,9.2,['Louisa Rose Mackleston'],['Louisa Rose Mackleston'],"The story follows an unlikely friendship between Ruth - an isolated pensioner in her 80s that visits her allotment daily, and Safiya - a teenage Syrian refugee that is struggling to adapt to her new life in Bradford.",--,Ruth & Safiya
1194,--,['Sarel Koning'],"['Merel Bel', 'Sarel Koning']",,--,"Samen, maar toch alleen"
1195,--,['Melissa Balint'],['Melissa Balint'],,--,Mom Prep
1196,--,DESCONOCIDO,['Riccardo Bernasconi'],,--,La chanson
1197,--,['Julia Elizabeth Evans'],['Julia Elizabeth Evans'],Aniko blames herself for being inappropriately harassed at work until a Facetime call with an old friend snaps her out of it.,--,Absorb Everything
1198,--,['Valentina Schwendinger'],"['Paula Edda Klein', 'Valentina Schwendinger', 'Naala Vanslembrouck']","When a young East-German woman named Maika receives a telegram from her sister who successfully fled the DDR, her life is turned upside down as she faces the prospect of justifying to the authorities her involvement in the escape.",--,The Indestructibles
1199,--,['Rory Karpf'],DESCONOCIDO,UFC Bantamweight sensation Aljamain Sterling recounts the troubling childhood that helped shape him into the fighter he is today. Witness the story of a young boy transforming into one of the top contenders in the UFC's stacked 135-pound division.,--,Aljamain Sterling: Not Broken
1200,--,['Katherine Oostman'],['Katherine Oostman'],"In the spring of 2020, with quarantine in full effect, Em makes an unlikely connection with her neighbor through their shared wall.",--,There's Something Between Us
1201,6.8,['Paul T.T. Easter'],['Paul T.T. Easter'],"A dogs loyalty is tested when the owner of a beautiful black German shepherd is killed, as his identical twin brother takes the dog on as his own. A 2021 movie dedication to MR. Shuckie the German Shepherd the directors own dog who appeared in many movies directed by Paul Easter.",--,Loyalty
1202,--,['Miguel Albuquerque'],['Miguel Albuquerque'],Felipe is a lonely teenager who starts to have weird nightmares during his summer vacation,--,Pesadelo
1203,--,['Paul Rodriguez'],['Richard Brandon'],"Peter has lost faith in himself and his religion. Whilst mourning the death of his dog, he meets Angie, a homeless drug user, in a park. His gesture of goodwill to make her life better takes them both on an unexpected path.",--,Miracle
1204,8.4,DESCONOCIDO,['David Gilna'],"With Ireland in lockdown during Covid-19, Tony can't even escape to his local pub to mourn the death of his beloved wife Jackie. Until his son David arrives unannounced with a surprise invitation.",--,One for the Ditch
1205,--,['Parasnath Gupta'],['Parasnath Gupta'],"Kashmir. Fresh rounds in exchange of fire every other day wound both, the Wall of a home on the outside along with that of Hope for Peace built within the hearts of the family.",--,Deewar
1206,--,DESCONOCIDO,"['Alyssa Aguero', 'Nikki Flemming']",,--,I Am Not a Butterfly
1207,6.9,['Charles Wahl'],['Charles Wahl'],"James and Lola live in a community without any Mohel's, and after celebrating the birth of their son are faced with family expectations and financial strain as they fly one in to perform the Brit Milah - The circumcision ceremony.",--,The Mohel
1208,--,['Ian G. Westley'],['Nathan Watson'],When Jake discovers a climate anomaly he tries to warn his friends and family.,--,Heatwave
1209,--,['Devon Tayman'],['Shonnon Marshall'],,--,Polaroids at Mohegan Bluffs
1210,--,['Urko Ortega'],['Urko Ortega'],,--,Izar Distira
1211,--,['Octavio Maya'],['Octavio Maya'],,--,La Llamada-Irlanda
1212,--,['James Huang'],"['James Huang', 'Chin Yu']",,--,End of an Affair
1213,--,DESCONOCIDO,['Ariela Rozentul'],,--,Butterfly
