1749,--,['Andrea Maria Catinella'],['Andrea Maria Catinella'],Sometimes the things you have lost can become your inner demons. A guilt that trapped the protagonist in her past and now turned under new form. What is going to happen when Alison finds herself stuck alone inside her house with an old phone that keeps ringing and an obscure presence?,--,Swallow
1750,6.6,['Marianne Farley'],['Marianne Farley'],"In the near future, following the adoption of an anti-abortion law, Kara has no other choice but to end her pregnancy, using an illegal abortion clinic.",--,Frimas
1751,--,['Mohamed Saad Taha'],"['Mahmoud Abou El-Ela', 'Mohamed Saad Taha']",In a dramatic atmosphere a An Egyptian Girl from Upper Egypt trying to get fund to her movie.,--,Horriya
1752,--,['ElSutan David Melendez'],"['Michael Andrillon', 'ElSutan David Melendez', 'Dircia Hernandez']",,--,Happy Valentine's Dear
1753,--,['Dawn Jones Redstone'],DESCONOCIDO,A look at the lives of three Black Portlanders during the COVID shutdown in Oregon.,--,See Me
1754,--,['Alexander Bok'],['Alexander Bok'],,--,The Titan
1755,--,['Joel Brown'],['Joel Brown'],,--,Djaambi
1756,--,['Ray Downs'],['Ray Downs'],"A closeted, middle aged man solicits a male prostitute who is just out of prison. At first, the two men have an easy rapport. But a miscommunication causes the exchange to turn deadly. After a bloody climax, both men are shocked by what just happened and consider how just a few seconds has ended one of their lives and ruined the other's forever.",--,Murder in a Sex Motel
1757,--,['Yunjie Zhou'],DESCONOCIDO,,--,X Silkworm
1758,--,['Jason Hyun Kim'],['Jason Hyun Kim'],"When David figures out the source of the music that is playing inside his head, he comes to a deeper understanding of himself.",--,Trombone Magic
1759,--,['Mario Scarinci'],['Mario Scarinci'],"No water is the extreme and cruel punishment for a man behind bars. Although water is all he needs, he ends up in finding a form of freedom.",--,Taken Beyond Bars
1760,--,['Toby Wosskow'],"['Caroline Wosskow', 'Toby Wosskow']","Amid rising tensions between the United States and China, an American woman struggles to maintain a long-distance relationship with her Chinese boyfriend.",--,This Uncertain Moment
1761,--,['Lorenz Baier'],DESCONOCIDO,,--,Sanfter Engel
1762,6.6,DESCONOCIDO,['Nicholas Simmons'],"Zeke and Mattix are two friends that went through life watching each other's backs. After leaving the military they both started working for Zeke's father who runs the local crime family known as ""The Organization"". Now competing for the same position in ""The Organization"", Zeke believes it's rightfully his but Mattix thinks he's done everything to earn it. Can their ... Read all",--,Gun and Run
1763,--,['Eric Bailey Jr.'],"['Eric Bailey Jr.', 'Tamara Faith', 'Justin Little']","Based on the spoken word piece, ""My Chest"" written by Tamara Faith, Hope Secured is a story of a woman who takes back her power. In wrestling against emotional abuse, the voices of well-meaning others, and her own insecurities, Tammy remembers the foundation her mother laid out for her when she was a child: ""God crafted you specifically, with no one else's help. He ga... Read all",--,Hope Secured
1764,--,['Liam Burke'],['Liam Burke'],"A South American immigrant faces uncertainty when his fiancé dies unexpectedly. With the help of an immigration lawyer he tries to get an update on his visa application, fearing that he may face deportation, then suddenly a suspicious circumstance arises leaving him in limbo.",--,Shot
1765,--,['Walter Ching'],['Walter Ching'],John was sexually abused by his father when he was a young boy. Decades later he decides to exact his revenge but finds out his father has made a new life; a new family with a young wife and an 8-year-old kid. John then lets his sympathy clouds his judgement.,--,Unforgettable
1766,--,['Ashok Pilli'],['Ashok Pilli'],"""Paluke bangaramayena"" Is a web film. Ashwith (Shrihan) a job holder who is deeply in love with Sarika (Siri). One day evening party with Aswith friends changes the story of the film. Drunken aswith calls to sarika and he asks about a desire, sarika rejects it. What happened next is that desire decimate the relationship between them?",--,Paluke Bangaramaayena
1767,--,['Oona Koivula'],['Oona Koivula'],,--,Don't Tell Dad
1768,--,['Ashish Varma'],['Ashutosh Walia'],"Silly fights, misunderstandings, disagreements, arguments. These are some of the common traits of a family. But what really matters is to be there for each other when they need you the most.",--,Mango Malai
1769,--,['Flora Ofelia Hofmann Lindahl'],['Flora Ofelia Hofmann Lindahl'],,--,Forfulgt
1770,--,['Manish Shah'],['Manish Shah'],"A remote village discovers Contagious virus, People are aware that some virus has spread in city but they are unware that it can spread to village also.",--,Human Phobia
1771,--,['Kennedy C. Hall'],['Kennedy C. Hall'],""" One couples dream to have a family of their own may end up costing them everything """,--,Still
1772,--,['Alex Cohen'],['Alex Cohen'],"After giving her final presidential toast to the members of the Gryphic Social Club at the elite Castor University, graduating senior Ellie Hill receives a letter in the club's mail. It contains bad news, news that forces her to reckon with the true nature of the organization and people she chose to spend the past four years serving. During the party, she copes with t... Read all",--,The Letter
1773,4.3,['Tero Jartti'],['Tero Jartti'],,--,Youssef Is a Tiger
1774,--,['Andrew Huggins'],"['Andrew Huggins', 'John R. Sexton', 'Donna Whitmore-Sexton']","""The quest for truth can be freeing, but often times very painful. However reconciliation, healing and ultimately a sense of peace and forgiveness can emerge for people who have been wounded at one level or another by a traumatic event.""",--,Grave Talk
1775,--,['Terrell D Perkins'],['Anthony Bam Sutton'],A black man is assaulted by police; a police officer is fired and tells her story to a news reporter.,--,Blue Line
1776,--,['Max Jones'],DESCONOCIDO,,--,Bleu
1777,--,['Bianca Siplin'],['Michelle L. Silva'],"""Flora's Spell,"" a time-bending experimental narrative that looks at the hunger both literally and figuratively of two teenage girls and the magical component that sets their hearts free. Watch Flora, a young slave girl so hungry for food she steals at all costs, her courage unwavering, as her world collides with Ruthie, an apprentice ballet dancer so hungry to please... Read all",--,Flora's Spell
1778,--,DESCONOCIDO,['David Black'],"""The Rotten Fruit of Eden"", that tells the tale of Adam being tempted by the crafty snake to eat of the forbidden fruit.",--,The Rotten Fruit of Eden
1779,--,['Corey Laramore'],"['Corey Laramore', 'Gary C. Nelson']","A story we're all too familiar seeing; A young African American teenager loses his brother to gun violence by a unruly police officer. However, what happens when that same teenager has a burning desire to exact a merciless revenge? Will the narrative change this time?",--,A Worthy Punishment
1780,--,['Brandon Austin'],['Brandon Austin'],,--,The Replacements
1781,--,['Gabriella Rodriguez'],"['Evan Carrington', 'Aren Woods']","When a routine grocery trip goes wrong, two individuals must put their differences aside in order to survive.",--,Middleman
1782,6.7,['Radovan Petrovic'],['Rumena Buzarovska'],"After losing her virginity, 22 year-old Tina pays a distressing first visit to the gynecologist.",--,Tina's Problem
1783,--,DESCONOCIDO,['Kim Miyoung'],"The Special Day Logline: Actor Youngjun has been through a hard time every day, and a special day when his close senior, Hwanmong, comes and asks for a special performance. Subject: A heartwarming message of hope that Youngjun and his surrounding people are struggling for the mother of Hwanmong with dementia. Planning intentions: How long do you believe love is val... Read all",--,The Special Day
1784,--,['Tristan Alice Nieto'],['Tristan Alice Nieto'],A transgender woman is haunted by her old life as the isolation of lockdown brings up familiar feelings of entrapment and loss.,--,Autoportrait
1785,--,['Brandon Pikulinski'],"['Rebecca Bollinger', 'Brandon Pikulinski']","Taking place in NYC, after being forced to spend the holiday together, two people, Marcy, a fashion graduate and Tommy, a former painter turned Finance worker, meet in the back of a ride. Through the course of the night they realize that they have more in common than originally thought.",--,Not A Chance
1786,--,['Marc Borràs'],['Marc Borràs'],Do you dare to look straight into the void?,--,Retrato de familia
1787,9.8,['Aishwary Dubey'],['Aishwary Dubey'],"Story is centered between a brother and sister, where sister commit suicide because her photos and videos got leaked.",--,Malicious Links
1788,--,['Seneca Robinson'],['Seneca Robinson'],,--,Pimp by Blood
1789,--,['Raphaël Chiche'],"['Juliane Boesch', 'Raphaël Chiche']",,--,Impasse des Tilleuls
1790,--,['Talia Stroh'],['Talia Stroh'],,--,Écoute
1791,--,['Nate Reynolds'],['Nate Reynolds'],"A young woman (Jessica) experiences the five stages of grief when she learns that a close friend has taken his own life. Unable to make sense of the tragic event, she channels all of that grief into a memorial sculpture, for one final goodbye.",--,No.9
1792,9.8,['Santoshh Shivamm'],['Arshad Mumtaz'],"The protectiveness and concern of a techno-savvy father for his daughter, who would go to any lengths to make sure she never gets hurt in life.",--,Dream Catcher
1793,--,DESCONOCIDO,['Audran Cattin'],,--,Livrée
1794,5.5,['Constance Tsang'],"['Constance Tsang', 'Tony Yang']","Beau, an emerging artist is about to unveil her latest installation. Her lover Paloma, is a devoted supporter. Her final breakthrough hinges on the success of this piece and soon this pressure causes a rife in the two women's relationship.",--,Beau
1795,--,DESCONOCIDO,DESCONOCIDO,DESCONOCIDO,--,Error nombre para la pelicula con id: tt13978390
1796,--,['Ivana Noa'],['Ivana Noa'],"7 characters, 7 interviews, 7 stories",--,2020
1797,--,['Abram Iman'],['Abram Iman'],"Convicted of 30 life sentences for various crimes, Andrew Clarke has been living each of these sentences one at a time, and is now about to start the 29th without any memory of his previous lives.",--,29
1798,7.1,['Jakob Marky'],DESCONOCIDO,A woman accuses her husband for sexual abuse. The frustration and tension peaks as the police officer does not seem to take her testimony seriously. It's one person's word against the other. What has really happened?,--,Förhör
1799,--,['Micah Dyer'],['Micah Dyer'],,--,Travel Light
1800,--,['Elliot Marvin Sims'],['Elliot Marvin Sims'],"James Haywood, an actor, pursues his latest callback audition.",--,The Callback: Story of a Black Actor
1801,--,['Amanda Graeff'],['Amanda Graeff'],A woman and her dog navigate homelessness during a global pandemic.,--,The Van
1802,--,DESCONOCIDO,"['Kabeer Khurana', 'Shishya Ray']",,--,Dramayama
1803,--,['Donte Underwood'],['Donte Underwood'],"Marvin (Steven Etienne) is on his way home one night when he finds his friend's sister (Chloe Mango) beaten and unconscious outside on the floor. He finds himself in between a furious Emmanuel, (McGregory Frederique) a potential suspect in Joshua, (Justin Diaz) and two officers looking for the truth. (A.K. Ibrahim and Nicholas Coley) Marvin feels the pressure of stayi... Read all",--,The Canary
1804,--,['Vince Williams'],['Vince Williams'],,--,Hollywood
1805,--,['Ashley Hays Wright'],"['Ashley Hays Wright', 'David Owen Wright']",,--,The Rapture Diaries (Part 2)
1806,--,['Enrico Saller'],['Enrico Saller'],,--,LOCKDOWN - Ich Will Hier Raus
1807,9.5,['Omesh Bhatt'],['Vijay Suthar'],"A man who enter into the year 2030 where every Saturday and sunday declared as dry day, now he struggling to get one bottle .",--,Red Zone
1808,--,DESCONOCIDO,DESCONOCIDO,DESCONOCIDO,--,Error nombre para la pelicula con id: tt13984092
1809,--,['Marley Rankin'],['Marley Rankin'],,--,Stay with Me
1810,--,['Amir Jaffer'],"['Amir Jaffer', 'Diana Kim']","Seven years after losing their child, Samy and Edwin cross paths again. We get a glimpse of the young couple's tragedy only to be reminded that in order to move on, we must first come to terms with the past.",--,Seven Candles
1811,--,['A.J. Fitzgerald'],['A.J. Fitzgerald'],"A patient is questioning continuing therapy, feeling they're not getting anything out of it, but by saying that may just get what he's looking for.",--,Next Week
1812,--,['Vaughan Capstick'],"['Vaughan Capstick', 'William Shakespeare']",,--,Richard
1813,--,['Octavio Maya'],['Octavio Maya'],,--,La Llamada-Libano
1814,--,DESCONOCIDO,['Miguel Armando Rivera'],,--,Tomorrow Was to Late
1815,--,['Nick Rose'],['Peter Smits'],"A husband and wife discuss their challenging financial situation, surrounding bankruptcy.",--,Bankrupt
1816,5.8,['Jerry Carlsson'],DESCONOCIDO,"Milo Moro finds out that his ex-partner Adrian, who has been cryopreserved for the past 43 years, can be thawed and brought back to life. When the staff from ScandiCryonics arrives to pick up the cryocontainer with Adrian's body, Milo realizes he might not be ready for Adrian to return.",--,Successful Thawing of Mr. Moro
1817,--,['Michael Augustine'],['Michael Augustine'],A young woman is deeply immersed in covering up the murder of an estranged person.,--,If I Am to Continue
1818,--,['Tony El Ghazal'],DESCONOCIDO,A short sensorial and docufictional reenactment of an abstract dream.,--,Sarab: Mirage
1819,--,['Daniel Patrick-Murrell'],['Daniel Patrick-Murrell'],The Pick Pocket Killer is a 1920s Drama/horror about a serial killer. With a skewed sense of justice the protagonist hunts down pickpockets but even he is scared of some things,--,The Pickpocket Killer
1820,--,['Mats Willems'],['Mats Willems'],,--,Briefe an den Sohn
1821,--,DESCONOCIDO,"['Alba Herrera', 'Dan Jiménez']",,--,Pare' o None'
1822,9.1,['Richard Zelniker'],['Stephen Alkus'],"A couple engages a therapist in hopes of salvaging a problematic marriage, but things take an uncertain turn as the session unravels and past secrets emerge.",--,Unspoken
1823,6.6,['Art Arutyunyan'],DESCONOCIDO,An action figure from a young gay man's Christmas Past comes to life to help him find the courage he needs to come out.,--,Christmas Coming Out
1824,--,['Paul L. Hugins'],"['Itzel Almazan', 'Andrew Jorgensen']","The Sun and the Medicine Man is a short film that follows a Mexican-American family living in and managing a small suburban motel. When the family travels to seek the assistance of a medicine man, they are given a jar of mysterious liquid and with the healing power of the sun, they find not only are their old physical wounds healed but some internal ones are as well.",--,The Sun and the Medicine Man
1825,--,['Christopher Vernale'],['Christopher Vernale'],"Joey the crook is at a crossroads. When his buddy Mike is revealed to be a dirty undercover cop, the pair spend the night staking out a perfect spot to rob their former employer. Caught in a no-win situation, Joey and Mike come to terms with their choices.",--,Stake
1826,--,['Lotte Sweeney'],"['Bella Connell', 'Lotte Sweeney']","Lucy and Jasmine attend a much anticipated high school party and experience all the joy, awkwardness and drama of underage drinking.",--,Possum
1827,--,['Mo Alagi'],['Mo Alagi'],"After a photographer goes on a coffee break, her model attempts to draw her camera to perfection out of boredom, not knowing that she's had enough with his presence.",--,"Draw It, Capture Him"
1828,6.4,DESCONOCIDO,['Katarina Resek Kukla'],"Three best friends, sworn virgins, get into a fight with local boys. When things get rough, they are saved by a girl in the making.",--,Sisters
1829,7.6,['Runxiao Luo'],['Runxiao Luo'],"As a model student, 5th grader Lin Yuqi is assigned to give a speech about her family at the Parent's Meeting. But after Lin finds out that she shares the same secret with a mischievous classmate, she starts to have second thoughts.",--,"Tou Sheng, Ji Dan, Zuo Ye Ben"
1830,--,DESCONOCIDO,['Anusha Aira'],"Ticket for One follows two teenage girls, Anastasia and Juliet, as they reflect upon their past friendship, torn apart by their ongoing competition to be at the top of their class",--,Ticket for One
1831,6.1,['Colman Hayes'],['Colman Hayes'],"Brian and Clara were engaged to be married. With a few weeks to go, Clara called it off and left. Brian never recovered while Clara moved on. Years later, she shows up at his door, unannounced.",--,Where Have You Been
1832,--,['Brandon Buikema'],['Brandon Buikema'],,--,Fit
1833,--,['Arinjay Shekhar'],['Arinjay Shekhar'],"'Distorted' is a short film based on 'schizophrenia', a mental illness that acts as a slow death sentence for many. The protagonist is suffering from schizophrenia and ends up in a messy situation due to no fault of his own.",--,Distorted - A Schizophrenia Story
1834,--,['Himanshi Handa'],['Himanshi Handa'],A woman takes up vlogging about finding positivity in isolation during COVID lockdown only to find her ideas conflicting with her desire for human connection.,--,Sounds of Silence
1835,--,['Wyatt Whipple'],['Wyatt Whipple'],"An up-and-coming motocross rider gets the opportunity of a lifetime: racing alongside his hero, only for it to permanently ruin his career.",--,Idle
1836,--,['Dan Hewitt Owens'],"['Chelsy Leigh Jackson', 'Dan Hewitt Owens']",,--,The Sum of All Anxiety
1837,--,['Jean-Claude Thibaut'],['Jean-Claude Thibaut'],"Lisa is driven back home by her father from a mental facility. She doesn't stay long and on the way to loose herself, she discovers that two hours of her life have gone missing Lisa is pursued by an omnipotent evil force, her father that is turning her whole world against her while it whispers a warning from the shadows: ""...if you find your lipstic, you'll find your ... Read all",--,Two Missing Hours
1838,--,['John Plas'],['John Plas'],Pedrito is a non binary young student who is struggling with a physical deformity after a devastating accident. Their family is unsure about how to support them but at the end Pedrito pursues their dream and succeed.,--,Paciencia el Solitario
1839,--,DESCONOCIDO,"['Jonathan Iturriaga-DaSilva', 'Anne-Hélène Prévost']",,--,Post-Mortem
1840,--,['Lindy Boustedt'],['Lindy Boustedt'],"It's the late-1980s and Lisa, a bi-racial teenager having just moved to Seattle from London, is forced into a new world when she is segregated to a different school from her all-white sister. But when she meets a welcoming student at orientation, everything changes. Written by a student in the Screenwriting Program at the Washington Corrections Center for Women, In Be... Read all",--,In Between
1841,--,DESCONOCIDO,DESCONOCIDO,,--,Iopu
1842,--,['Michelle Caruso'],['Michelle Caruso'],"Feeling undervalued in a digital age where there are endless options, a millennial Girl aches for more than being a powerless worker bee and just another fling.",--,Behind the Screen
1843,--,DESCONOCIDO,['Julio Montalvo'],"Retribution is the story of a man looking to get revenge for his brother's murder, but during the search for his brother's killer, he finds redemption.",--,Retribution the Movie
1844,--,['Sam Saliba'],['Sam Saliba'],,--,Start What You Finish
1845,9.0,DESCONOCIDO,['Timothy J. Cox'],"A day in the life of therapist Dr. Peter Marcus who, due to the pandemic, now conducts sessions with his patients online.",--,Live Health
1846,--,['Julien Dolivo'],['Julien Dolivo'],"When a struggling Elvis impersonator is humiliated by party guests, he decides he'll end the night with a bang.",--,Encore
1847,--,['Michelle Caruso'],['Michelle Caruso'],"While a progressive daughter and traditional mother bake morning bread together, they struggle to connect like they used to since beliefs have shifted from childhood.",--,Baking Memories
1848,--,['Riley W. Parker'],['Riley W. Parker'],,--,Lover No More
1849,--,['Ulises A. Morales'],['Ulises A. Morales'],,--,The bridge
1850,--,['Jae-Seok Lee'],['Jae-Seok Lee'],,--,Breathing hole
1851,8.3,['Paul T.T. Easter'],DESCONOCIDO,,--,Electric Johnny
1852,--,['Kumar Kuldip Medhi'],['Kumar Kuldip Medhi'],"This story is about a widow, who faces great financial crisis due to sudden lock-down during pandemic, and how she struggles to solve her financial needs.",--,Dearth ...Life in Pandemic
1853,--,['Stephanie Rose'],['Stephanie Rose'],"A young dancer, Monica, is desperate to get into dance school. There's just one problem: the very thing she is clean from is the very thing she's using to try and pay her way in. With family issues looming over head, Monica's mother, Grace, tries to re-connect with Monica.",--,Brown Sugar
1854,--,['Nadia Fortini'],['Nadia Fortini'],"Pressured by the sociopolitical situation in her country, Ada (18) is forced to take drastic measures to terminate an unwanted pregnancy.",--,Sen o Warszawie
1855,--,['Hanna Castera'],['Hanna Castera'],,--,Le Mâle
1856,--,['Hanna Castera'],['Hanna Castera'],,--,Jalousie
1857,--,['Zoe Eisenberg'],['Zoe Eisenberg'],"On her last night of work, a pregnant theater manager discovers a bag of cash under a seat and must decide what to do with it.",--,Cashback
1858,--,['Sean Bradley'],['Sean Bradley'],"In a world devastated by COVID-19, Caleb tries to get his family together for Christmas through a series of Zoom calls. But, will reconnecting with his estranged workaholic father derail his festive plans?",--,A Very Merry Lockdown
1859,--,['Sonja Devi'],['Sonja Devi'],On the day of her birthday a young Instagram influencer creates the best set of stories in order to entertain her followers.,--,Disconnected
1860,--,['Damian Martorana'],DESCONOCIDO,,--,Memoir of a Call Girl
1861,--,['Stephen Gentry'],"['Stephen Gentry', 'Joshua McLean']","Sarah's best friend is killed in a car accident with just several weeks until the end of high school. To cope with her grief, Sarah decides to try to convince the school principal, and the entire student body, that her best friend deserves an honorary seat at graduation.",--,Please Be Seated
1862,8.3,['Jean Pasley'],['Jean Pasley'],"Unable to accept his son's sudden death in a car crash, a father tries to come to terms with his loss and must attempt to find peace in a most unexpected way.",--,Ship of Souls
1863,--,DESCONOCIDO,DESCONOCIDO,DESCONOCIDO,--,Error nombre para la pelicula con id: tt13997922
1864,--,['Tom Aspy'],['Logan McDonald'],,--,$700+
1865,--,['Eric Yang'],['Eric Yang'],"A woman finds herself entangled in a forbidden romance with a married man, but their passionate affair takes an unexpected twist. As they navigate the complexities of their forbidden love affair, they find themselves grappling with conflicting emotions and difficult choices.",--,Love in Brooklyn
1866,--,DESCONOCIDO,['Annette Eberly'],"Based on a true story that took place in 2016, a young lady seeks help from the school counselor to find an abortion clinic. However, the counselor is moved with compassion to save the baby's life and pleads to choose life for her unborn child.",--,Plea for the unborn
1867,--,['Mahnoor Zaidi'],"['Anoushe Sheharnaz Hasan', 'Mahnoor Zaidi']","Kausar, a middle aged trans-woman, receives a call to donate blood to a critically ill boy with the same rare blood group as hers. She rushes through the busy city of Lahore to reach the hospital on time, only to find out that her blood is not welcome, even if it costs the boy his life.",--,455 mL
1868,--,['Christopher Siaens'],['Christopher Siaens'],"A teenage girl videotapes herself, giving thanks to her loving Father.",--,For Dad
1869,--,['James Trimboli'],['James Trimboli'],"Frida is excited about a date with a hot young spunk, but her friend accidentally gives her the wrong Ned's number. A creepy old man shows up who won't take no for an answer, he is a stalker and becomes obsessed with her.",--,The Wrong Ned
1870,--,['Ruhi Mansey'],['Ruhi Mansey'],A runaway teenager processes strife through her art when she's forced to reconnect with her estranged family.,--,Stroke
1871,--,['Hanna Castera'],['Hanna Castera'],,--,Obsession Fatale
1872,--,['Tony Tompkins'],['Tony Tompkins'],"When the honeymoon is over and a loveless relationship ignites, do you leave, give in or fight for a way out? Sometimes the road we choose is never the easiest but it is the one that must be taken to end the misery.",--,Tainted Rose
1873,--,['Martina Bonfiglio'],"['Martina Bonfiglio', 'Giulia Tovazzi']",Filippo calls his friend Pietro after a night out so he can help him find his car keys. Together they must recall what happened the night before.,--,L'ultima spiaggia
1874,--,['Marcus Wallace'],['Marcus Wallace'],A Successful Cater finds out her boyfriends cheats on her with her mentor/Best friend. Which cause her to go insane.,--,Temporary Insanity
1875,--,['Trey Fowler'],['Cédric Moninga'],,--,Sororité
1876,--,['Adolfo Peña'],['Ricardo Farias'],,--,El Botón
1877,--,['Matt Newby'],"['Alina Mihailevschi', 'Matt Newby']",,--,The Walker
1878,--,['João Azevedo'],['João Azevedo'],"In a world where fictional writing is forbidden, a writer must secretly make the events contained within his book happen in real life before publishing it.",--,Baseado numa História Verídica
1879,--,['Adam Frith'],DESCONOCIDO,,--,Frank Sinatra and My Dad's Wig
1880,--,['Ameeya Mehta'],['Ameeya Mehta'],,--,Radio - the movie
1881,--,['Kai Jansen'],['Kai Jansen'],"In a world where profit is more important than health, the film SIRIUM A describes a scenario in which a corporation gains political influence at the expense of global health. Desperate citizens call for protests, but are reprimanded and arrested militarily. The worried father (Herbert Corsten), an ex-employee of the SIRIUM company, rebels against the dictatorship of ... Read all",--,Sirium-A
