,Puntuacion_IMDB,Dirección,Guionistas,Argumento,Duración,Nombre de la película
0,7.7,['Setsawat Thongsrikum'],['Setsawat Thongsrikum'],"A short story based on Covid-19 events in Thailand from ""March 2020 - December 2020"" through the three characters in the short-film.",--,The Life in Covid
1,--,['Terrence Edmonds'],['Terrence Edmonds'],"Astute futures and rainbows are all you can see in Project Dreamland, an iconic kids show starring the oversized puppet Lucid Skye. When the facade deteriorates, Lucid Skye's message that all dreams come true may hold a deeper significance in the lives of the children who share the stage.",--,Project Dreamland
2,7.5,['James Morgan'],['James Morgan'],"A young fossil hunter makes a groundbreaking discovery, challenging the worldview of 19th century England.",--,Sea Dragon
3,--,['Alan Del Castillo'],['Alan Del Castillo'],"Facing the 2020 pandemic alone, Carlo reaches boiling point.",--,Kettling
4,--,['Jose Navas'],"['Jose Navas', 'Allen Poncharoensub']",Suffering from mutism has kept Marcus quiet his entire life. After years of home-schooling Marcus faces his biggest challenge yet - real school. But soon everyone will discover the incredible gift Marcus has been hiding from the world.,--,Beat Lingo
5,--,['Carter Schaeffer'],['Carter Schaeffer'],"Jordan, a lonely, lower-class punk, finds a chance to escape the drudgery of his life through a Battle of The Bands. Through it, Jordan navigates moshing, musicianship, his fantasies of rock stardom, and love for his guitar tutor.",--,Battle of the Bands
6,--,['Fabrizio Cassandro'],['Francesco Ferraris'],"The love story between Max, a street musician, and Agathe, a career woman, in a dystopian future in which words have become a consumer good.",--,Afasia
7,--,['Marie-Louise Damgaard'],['Marie-Louise Damgaard'],In a family where everybody is concerned about her brother's illness - a little girl struggles to find her place,--,"Mommy, Why Is Santa Crying?"
8,--,DESCONOCIDO,DESCONOCIDO,DESCONOCIDO,--,Error nombre para la pelicula con id: tt12267114
9,--,['Dominik Forró'],['Dominik Forró'],A film about a teenager who had trusted his friends more than he should have.,--,Planned out
10,--,['Simon Brandon'],['Simon Brandon'],"A dark, quirky comedy. The year is 2023, lockdown is still with us and the world has run out of fish fingers, or has it?. Slated by the literati for her current not-so best-selling book, reclusive, novelist and collector Evelyn Jackdaw invites her estranged and dysfunctional family to join her during lockdown for much-needed inspiration. The trap is set. The bait...Th... Read all",--,Last Fish Finger in the World
11,--,['Justin Lewis'],"['Nick Hughes', 'Justin Lewis', 'Katie McDonald']","After a horrible break-up, Roman seeks to escape his mundane life for a better one.",--,Riptide
12,--,['Amandine Thomas'],['Amandine Thomas'],"When Sherri gets arrested for shoplifting from work, she needs to find money for legal fees. After a few dead ends, opportunity strikes, and his name is Tom.",--,Cherry Cola
13,--,['Cristina Diez-Madroñero'],['Cristina Diez-Madroñero'],,--,Hay un fuego Verde
14,--,['Erica Goldsmith'],DESCONOCIDO,A sexual assault awareness film.,--,Lack of Consent Has No Dress Code
15,8.7,['Carlos Fernandez Puertolas'],"['Carlos Fernandez Puertolas', 'Jason Spencer Galsworthy']","""Frank and Emmet"" tells the story of two life-long friends and show-business partners who, after weeks of drifting apart, sit together to have a much-needed conversation. Their friendly dialog takes a turn when they address head-on the one thing they've never talked about: One of them is a puppet.",--,Frank & Emmet
16,--,['Connor Chadwick'],['Connor Chadwick'],,--,On the Scene
17,--,['Alec Davis'],['Alec Davis'],Two constantly quarreling sisters in the middle of a cross country road trip self-sabotage their way into getting hopelessly lost in the desolate back roads of rural Pennsylvania.,--,Sisters
18,--,['Herbert Gantner'],['Herbert Gantner'],,--,Die Grenze zur Unendlichkeit
19,--,['Caterina Gabanella'],['Caterina Gabanella'],A young actress is so hurt by unrequited love that she loses her sense of identity. But as a result she can become whomever she wishes to be.,--,Empty Love
20,7.6,['Erica Goldsmith'],DESCONOCIDO,"A young girl having escaped from being trafficked seeks shelter, videotaping herself as a message for her drug-addicted mother with whether or not she could, or should, come back to the life she once knew.",--,Good Girl Gone
21,--,['Caterina Gabanella'],['Caterina Gabanella'],A son proudly builds a new life away from his father's addiction. But then destiny intervenes.,--,Testa o croce
22,8.4,['Theo Lindquist'],"['Theo Lindquist', 'Liyun Yu']",Captured in an unbroken take and one single zoom. A group of friends attending a private party unwittingly become part of a voyeuristic artwork.,--,Private View
23,--,['Shadi Soheili'],['Shadi Soheili'],"Besties Ada, Carmen and Taylor keep each other's sanity in check whilst risking their livelihood through part-time pet play. On a planned visit to a client's home, Ada's out of character behavior causes suspicion between the friends.",--,Respect the Kink
24,--,['Aleisha Gore'],DESCONOCIDO,"A dynamic view of the life of an artist in Los Angeles, expressed through different artists' journeys.",--,"L.A., I Kinda Like You"
25,--,['Andrea Saavedra'],"['Andrea Saavedra', 'Kim Torres']",,--,Náufragos
26,8.2,['Nick Alexander'],"['Nick Alexander', 'Dan Bolland']","Set in the coastal town of Margate, England, this story of family explores what happens when two very different worlds come together",--,Queens
27,--,['Lou Blackmon'],['Nathan Liu'],,--,Xmas by the Pond
28,--,['Shahriar Azim'],['Shahriar Azim'],"Music student Timir barely scrapes by managing a rundown motel in Los Angeles. The poverty he witnesses affects him deeply, challenging him to find a deeper meaning to his music.",--,American Anomie
29,--,['Gianluca Zoppa'],['Gianluca Zoppa'],"The brutality, the cowardly love and the dramatic intertwining of destiny are the elements of a story with a disconcerting ending.",--,Jing
30,--,['Abigail Tay'],['Abigail Tay'],,--,Genesis
31,--,['Shehroze Khan'],"['Shehroze Khan', 'Mohammedally Shushtari']","17-year-old Jordan has grown up his whole life without a father. When his elusive uncle comes to visit for the weekend for the first time in years, the balance that Jordan's mum has strived to maintain at home starts to turn to chaos.",--,Chocolate
32,--,['David A. Malone'],['David A. Malone'],,--,September
33,--,['Georgios Dimitropoulos'],['Georgios Dimitropoulos'],Les Notes is a short cinematic film drama shot on location in Venice. The film tells the story of two lovers on a getaway with this infinite zest for life visiting their special place. Full of passion.. piercing emotions.. exploring.. relishing the moment.. feeding their souls with the energy that is Venice but.. some times the heart escapes the past. Two lovers visi... Read all,--,Les Notes
34,--,['Kristian Repshus'],['Kristian Repshus'],Leo is an insecure non-risk taker who is on daily basis being pushed down and ridiculed by the same group of bullies. Until he meets Annie and everything changes.,--,A Confident Man
35,--,['Youen Leclerc'],DESCONOCIDO,,--,Bonne Journée
36,6.4,['Antoinette Zwirchmayr'],"['Angelika Reitzer', 'Antoinette Zwirchmayr']",,--,Dear Darkness
37,--,['Anngelica-Marie Eshesimua'],['Anngelica-Marie Eshesimua'],Music brings together and tears apart the lives of three people as they fight to better their lives and those around them fight to keep them down.,--,The Broken Key
38,--,['Lilly Hu'],['Lilly Hu'],"After a video of a miscarriage suffered by a student goes viral at her high school, a shocked 16- year-old Chinese girl, Katie, attempts to solve a personal crisis in unfamiliar territory.",--,Cold Wall
39,--,['Kyle Bastin'],['Kyle Bastin'],A daughter writes a song for her mother's birthday.,--,Ivory
40,--,['Starsi Howell'],['Starsi Howell'],"After losing a boxing fight, a young girl must confront her father on her true feelings for the sport",--,Ten Count
41,--,['Nathan Mikita'],['Rolando Viñas'],,--,Eureka
42,--,['Austin Zollars'],['Preston Tholan'],,--,Birb
43,6.8,['Alex Kyrou'],['Alex Kyrou'],A woman's journey to investigate the mysterious disappearance of her partner takes her to a world far removed from her own.,--,Blank Shores
44,--,['Matthew Ramsaur'],['Lara Hill'],An FBI agent with a past suspects a young girl arrested for prostitution to be a victim of sex trafficking. Her investigation reveals a startling connection between the two of them.,--,Promises of Snow
45,--,['Bamtin Wade'],['Bamtin Wade'],A divorced mother who deals with an absentee baby father loses her daughter to the hands of kidnappers. Now she has to depend on her boyfriend and ex-husband for support while trusting the police to help find her daughter,--,Aubrey
46,9.7,DESCONOCIDO,DESCONOCIDO,"Berlin. While rents continue to go through the roof, Elias' mother is barely making ends meet with the price increases and is more irritable than ever. When Elias angrily leaves the apartment after a more heated argument, he doesn't want to go back and is dependent on his five-man gang. As the son of a rich real estate agent, Flávio, a member of the group and Elias' b... Read all",--,Weg von hier
47,--,['Jenny Mochahari'],['Jenny Mochahari'],,--,Rashi
48,--,['Mo Flannery'],['Mo Flannery'],A first person narration from a CCTV control room operator who bears witness to a real life event out of the ordinary. A woman on the outside of society who provocatively challenges the power establishments in a tense standoff. The narrator gradually unveils the event as it unfolds.,--,The Event
49,--,['Ron Jäger'],['Ron Jäger'],,--,Der verlorene Stern
50,--,['John David Edwards'],"['John David Edwards', 'Juana Samper']",A mother and her child struggle to survive in a remote forest. Starring mother and son in real life and written and directed by the father. The premise of this film explores the divine connection between motherhood and mother earth.,--,Mama
51,--,DESCONOCIDO,"['Matthew Hubbard', 'Matthew Stuart']","Two brothers trying to take on the everyday struggles of life and growing up. With no father and a absent mother in rehab, Quinn (Grant Patterson) is forced to take care of his younger sibling Junior (Rell) in ways that he hasn't had to before. When the desperation for money becomes to much, Quinn struggles with making bad and life changing decisions.",--,Junior
52,--,DESCONOCIDO,"['Saman Hosseinpuor', 'Ako Zandkarimi']","Roja (a twenty years old young girl) is forced to marry an old man, to save his brother. but she is in love with another person.",--,Congenital
53,--,['José Freitas'],['José Freitas'],"After being discouraged by his aunt, Leo contradicts her expectations and tries to fight for a place in the local football team trials.",--,Fora de Jogo
54,--,['Aaryn Osborne'],"['Orin Phillips', 'Christopher Siaens']","Coralie, a ballerina, videotapes herself, sharing with her social media followers how, even though on the surface, her grandmother is her greatest support in her ballet ambitions, not all is what it seems.",--,Broken Ballerina
55,--,['Robin Summons'],['Robin Summons'],A therapist is unable to leave her workplace where she helps abusive men.,--,Occupation
56,--,['Jason William Spencer'],['Jason William Spencer'],A salesman who is contemplating suicide as he studies a notebook of collected graffiti in a motel during a snowstorm,--,The Final Moments of Aurora Zeppelin
57,--,['Ranjit Mullakady'],['Jason Steele'],,--,Bartimaeous
58,--,['Rebecca King'],['Ánne Mággá Wigelius'],A young Sámi woman faces conflicting emotions of having found a home far away from her family in Sápmi.,--,A Home Truth
59,--,['Luke Schatzmann'],['Bruno Rapone'],"In a post-apocalyptic world, three strangers are hiding on an abandoned house, learning about each other's past and hoping to stay alive.",--,Sozinhos
60,--,['William Michael'],['William Michael'],Ellie and Jesse haven't seen each other in nearly twenty years. We follow their morning on the day that they meet again at the art gallery that they unknowingly are both connected to. After so long will this estranged mother and son be able to rekindle a relationship and mend a bond that has been broken for decades?,--,Will You Find Me?
61,9.2,['M.J. Kim'],"['Gareth Brookes', 'M.J. Kim']","When a young South Korean woman falls victim to sex trafficking and a brutal American GI, her life is destroyed by the system that protects him.",--,Juicy Girl
62,6.0,['Kristof Brandl'],"['Kristof Brandl', 'Shane Patrick']","After mankind drove itself to the brink of extinction, a zealous lone survivor hunts his way across remote Canadian landscapes in search of knowledge and materials in order to reshape humanity. Ten years later, a woman raises 10 same-age children and prepares them for the sacrifices they must make in order to save the human race.",--,Take Me to a Nice Place
63,--,['Thiago Vaz'],['Paulo Paul'],A very special boy must face his inner demons when he falls in love with a girl that is already taken.,--,Oi
64,--,['Shawn McDonald'],['Shawn McDonald'],,--,A Rose in No Mans Land
65,--,['Breton Tyner-Bryan'],['Breton Tyner-Bryan'],"7 head mafia wives from across the country convene only to find they are locked out and homeless. In the midst of their feuds, they find their rein of expected privilege has come to an end. An undercover FBI agent from Miami infiltrates the group and decides to have an affair with one of the older wives, as we journey through the memory of their shared romance. The go... Read all",--,Invicta
66,--,['Will Townsend'],['Jethro Randell'],"While trying to earn a little money on the side, Luke runs drugs over county lines. However, things soon start to get out of hand.",--,Mule
67,8.8,['Klaus Hjuler'],"['Klaus Hjuler', 'Rasmus Hougaard']","Finn is a member of a resistance group in Nazi occupied Denmark. His group gets an assignment to kill a Danish Nazi collaborator, and Finn volunteers for the assassination squad. But Finn has a secret that has very personal consequences.",--,Enemy Blood
68,--,['Joey Fingers'],['Joey Fingers'],"A wealthy bachelor ""f*ccboy"" discovers his captivating date is out for more than a good time as their trip into remote country turns apocalyptically dark in more ways than one.",--,Gold Digger
69,--,['Christopher Siaens'],"['Nathan Jasper', 'Christie Perez', 'Christopher Siaens']","Miley, an English literature professor, videotapes herself, remembering how not too long ago, she was sexually assaulted in her home by two strangers. She fights to face her demons and regain control of her life.",--,What You Stole from Me
70,--,['Richard Simon Chung'],['Richard Simon Chung'],"A fiercely independent woman struggles to cope with reality in her adoptive country, until she comes to realize that a mother's love knows no bounds.",--,Midori's Parachute
71,--,DESCONOCIDO,['Konstantin Pivovar'],"Three worshipers get a rare opportunity to pray to the divine Column inside a huge mysterious hall, but after two years one of them starts to question the absurdity of their experience since nothing has happened.",--,Iconic: a Four Act Comedy
72,--,DESCONOCIDO,DESCONOCIDO,DESCONOCIDO,--,Error nombre para la pelicula con id: tt12396366
73,--,['Florian Lidin'],['Florian Lidin'],Jeanne has Alzheimer's disease. She meets a young student who is trying to understand her relationship to the disease.,--,Papillons
74,--,['Jaeme Velez'],['Jaeme Velez'],"During an unwanted trip to the pharmacy, a grieving woman struggling with depression and addiction encounters a new companion.",--,No Quiero Luz
75,--,['Jolie Chan'],['Cherry Fu'],Twins sisters that lives in their own imagery world within each other.,--,The Splitting Mirror
76,--,['Dylan Duff'],['Dylan Duff'],"Oliver Davies ""Dylan Duff"" struggles to forgive his father's troubled past when he sees Lucas Davies ""Brian James"" for the first time since his release from prison.",--,Perspective
77,--,['Randa Ali'],['Randa Ali'],Two people develop a special connection at a farewell party in post-revolution Cairo,--,If You Find Me in Cairo
78,--,['Steven LaMorte'],"['Flip Kobler', 'Cindy Marcus']","A father and daughter meet at their favorite diner to reminisce. But when dad's memory isn't what it used to be, can she hold on to the man he once was before dementia steals his memories forever? Share a post-meal moment that celebrates life, love, joy and heartbreak, with a side of the best fries in town.",--,Memory Lane
79,--,DESCONOCIDO,DESCONOCIDO,DESCONOCIDO,--,Error nombre para la pelicula con id: tt12407624
80,--,['Christina-Kallirroi Garbi'],['Christina-Kallirroi Garbi'],"On an urban beach, K. watches the sun rise. When an unusual visitor approaches her, her life will change forever. A movie without words about people who are constantly looking for something.",--,Now That Spring Is Here
81,--,['Bramwell Noah'],['Bramwell Noah'],A good soldier never forgets.,--,Mr. Andrew's Translator
82,--,DESCONOCIDO,['Clayton Nix'],"Paula, a 40-something former model, walks out on her husband after his final careless act.",--,So Long
83,--,['Michael David Charles Hicks'],DESCONOCIDO,"Two men traverse the wilderness after a plague wipes out the population. In their struggles, their friendship is tested as they explore if mercy is inhumane or a moral obligation.",--,The Plea
84,--,['Lia Campbell'],['Derek Ugochukwu'],"Yet another tragic miscarriage sends Adaeze's life out of kilter leaving her torn between guilt, religious obligations and revealing the truth of an ill-fated medical diagnosis to her loving husband.",--,To All My Darlings
85,--,['Lauren Lox'],['Lauren Lox'],A bitter financial consultant is forced to challenge his jaundiced view of the world when a quirky stranger sets out to dismantle his reality before the sun sets.,--,Dawn
86,--,['Diana Foronda'],['Diana Foronda'],The relationship between a mother and daughter strengthen while baking challah together during the coronavirus pandemic.,--,Challah for Caroline
87,--,['Matthew Sawyer'],['Matthew Sawyer'],Emma is approaching the age where she wants to start a family. She must decide if high school sweetheart Lucas is the right person to do that with.,--,Pregnancy Test
88,8.3,['Niav Conty'],DESCONOCIDO,,--,Stepson
89,--,['Wendell Nielson'],['Wendell Nielson'],A blissfully ignorant teen comes of age when a drug deal gone bad erupts into violence outside of the bathroom where she hides.,--,Easy Livin'
90,--,['Kingy Wong'],['Olivia Carroll'],Couple will always forgive each other under any circumstances,--,A Good Time
91,--,['Rebeca Ortiz'],['Rebeca Ortiz'],"A young girl and her visiting Abuela are forced to connect, despite the language barrier that separates them.",--,Abuela
92,--,['Johnny K'],['Johnny K'],"Today's dream, tomorrow's reality.",--,Red Eagle-1
93,--,['Neal Gavyn'],"['Neal Gavyn', 'Sophie Heppell']","It follows the story of key worker Ayden ""Neal Gavyn"" during the Covid-19 pandemic. Ayden is locked down in a dementia care home for over eight weeks, while his vulnerable lover Ella ""Anna Swan"", who suffers with extreme health conditions, must stay at home and self isolate. Ayden and his colleagues are burdened with the task of safeguarding the residents, and as trag... Read all",--,Bewildered: A Covid-19 Story
94,7.4,['Rory Keenan'],['Rory Keenan'],"Heavily-pregnant Pearl leaves the house and rages against the world, as she tries to process a hidden pain.",--,Bump
95,--,DESCONOCIDO,"['Pranjal Joshi', 'Aniket Trivedi']","The aspiration of three little homeless boys to enter the city carnival starts with collecting pennies out of their workaday struggles. Unbeknownst to their innocence, a twist awaits them, only to turn the night into a childhood adventure. Or misadventure?",--,Mela (Carnival)
96,8.2,['K. Kovács Ákos'],['Oláh Tamás'],"Yugoslavia, 1991. Far away from the war zones Branka gets a job at a state hospital. The young woman is all alone, but it turns out loneliness is not the hardest burden Branka has to carry. Newborns are disappearing from the hospital.",--,Branka
97,--,['James Calvert'],['James Calvert'],Thin Ice VR is a 20-minute historical re-creation documentary VR experience presented by Tim Jarvis AM.,--,Thin Ice VR
98,--,['Agazi Desta'],['Agazi Desta'],"An idle, Arab American stoner discovers a portal to the war memories of his mother's past while doing the laundry chore.",--,Clothesline
99,--,['LaVarro Jones'],['Tamala Baldwin'],,--,Our Love
100,--,['Christopher Siaens'],DESCONOCIDO,"A bullied young girl, nicknamed ""It"", fights with thoughts of self-harm, struggling to find hope in her life.",--,A Girl Called It & a Bottle of Pills
101,--,['Geordie Joseph'],['Matt Montgomery'],"A man, like most of us, addicted to his phone, wakes one day with his phone dead and is forced to go through his routine without the distraction and starts to appreciate the life around him he never noticed before.",--,Dancin' Man
102,--,['Christopher Siaens'],['Christopher Siaens'],"Brielle, a rebellious young tomboy, videotapes herself sending a message to Thomas, a recently bullied young boy she rescued, announcing that from now on she will be his protector, his refuge, his shelter.",--,I Will Be Your Shelter
103,--,['Anthony Tringali'],['Anthony Tringali'],"In 1965, two aged silent film comedians Buster Keaton and Harold Lloyd meet with each other for the final time.",--,Keaton & Lloyd
104,--,['Alexander Roman'],['Alexander Roman'],,--,Queer Blood
105,--,['Camilla Roman'],['Camilla Roman'],"In the middle of corona lockdown, asylum seeker Leyla, meets Stig, a delivery guy - a meeting that can change both their lives.",--,Bølgeblikk
106,--,['Tess Forestieri'],['Tess Forestieri'],"When three newcomers are welcomed into a local house party in the German countryside, what seems innocuous becomes an allegory for racial profiling in this depiction of discrimination in our modern era; filled with emotionally wrought explorations of culture clash and how individual, internalized racism informs larger systems of injustice.",--,Flunkyball
107,--,['Emanuela Boisbouvier'],['Emanuela Boisbouvier'],,--,Parallèle(s)
108,--,['Lawrence Murphy'],['Oscar Millar'],"In search of forgiveness and closure, a man delves into his childhood memories. It's not long before he spirals, losing himself in what appears to be memories still too fresh to face.",--,Descent
109,8.5,['Andrew Sindt'],['Andrew Sindt'],,--,Maude's Shoulder
110,--,['Anastasia Katina'],['Anastasia Katina'],,--,Guilt of Joy
111,--,['Erika Lynn Jolie'],['Erika Lynn Jolie'],,--,Acceptance
112,--,['Austin R. Grant'],['Austin R. Grant'],"With a deadline approaching, an obsessive artist will stop at nothing to complete his masterpiece.",--,Peter Painter
113,--,['Aaryn Osborne'],DESCONOCIDO,"Jayda, a high school cheerleader, gives encouraging, supportive cheers to her school friends who struggle with self-worth.",--,You
114,--,['Rob Levinson'],['Rob Levinson'],"A parent's faith is put to the ultimate test, when coping with the tragic loss of their child. As a Georgia Lawman, it's all black and white for Wyatt Estridge. Wyatt's wife, Addison is a good-natured Christian woman, who longs for salvation and the love of her husband. But what lies just beneath the surface tells a different tale. © All Rights Reserved 2008.",--,A World of Hurt
115,--,['Aaryn Osborne'],DESCONOCIDO,"Every adoption story is different, but many start with the pain of not being able to have their own. With struggles of race and mental disorder we will overcome because we are a family no matter what people say.",--,Confessions of an Adoptive Mother
116,--,['Sidhant Sharma'],['Karan Sharma'],The story revolves around the concept of mercy killing and takes the audience on an emotional journey.,--,Bitter
117,--,DESCONOCIDO,"['Vick Krishna', 'Piyali Syam']",Two Indian-American group therapy members check into a hotel room to carry out a suicide pact.,--,Checking Out
118,--,DESCONOCIDO,DESCONOCIDO,DESCONOCIDO,--,Error nombre para la pelicula con id: tt12510498
119,--,DESCONOCIDO,['Jerry Shandy'],"A dark and twisted story about a doll, and her girl.",--,Cheyenne
120,8.0,['Cole Swanson'],['Cole Swanson'],A young Black father must learn to navigate parenthood after his girlfriend mysteriously abandons him and their five-year-old daughter.,--,Baby
121,--,['Antoine M. Dillard'],DESCONOCIDO,"Staff Sergeant Blaine, a decorated sniper recently discharged from the 160th Special Operations Aviation Regiment (Army Night Stalkers), goes back to his hotel to get some sleep. Due to PTSD and noisy surroundings, Blaine can't sleep and is compelled to take matters into his own hands.",--,Citizen Blaine
122,--,DESCONOCIDO,['Michela Marini'],Fake news spreads faster than any virus.,--,Moronavirus
123,--,['Saul Lotzof'],['Saul Lotzof'],A family dinner unravels into chaos behind the facade of sexual tension.,--,Vincent
124,--,['Krystle Weaver'],['Krystle Weaver'],A young woman learns how to love herself through a suddenly abusive relationship.,--,Aspersion
125,6.6,['Ramzi Bashour'],['Ramzi Bashour'],"Bashir attends his father's funeral in rural Lebanon only to discover a pathogen infecting the trees across his village. A dark-comedy about tradition, grief, and the environment.",--,The Trees
126,--,DESCONOCIDO,DESCONOCIDO,,--,Kallie
127,--,['Neil Antonio'],['Neil Antonio'],"Every individual walks their own path in their own time. When events begin to erupt causing global chaos, one man's journey will begin - or end.",--,Why...?
128,--,['Charlie S. Jensen'],['Davis Tanaka'],,--,Internal Affairs
129,--,['Ben Mole'],"['Ben Mole', 'Matthew Redmond']","Featuring Cirque Du Soleil's star clown, the wonderful Sean Kempton, it tells the story of a clown who loses his job and is scared to face the outside world. Eventually he gets a job in a kids' hospital - with very slippery floors.",--,The Clown
