,Puntuacion_IMDB,Dirección,Guionistas,Argumento,Duración,Nombre de la película
0,"5,9",['Jake Hull'],['Jake Hull'],A dark comedy about a reclusive college student who aspires to become one of America's greatest serial killers.,1h 11min,Grapes: The Story of an Aspiring Serial Killer
1,"5,9",['Milos Smídmajer'],DESCONOCIDO,"In this comedy fantasy, a royal wedding in the works. But a stubborn princess is up against an equally hard-headed prince: will there be a wedding, or a war?",1h 35min,Peklo s princeznou
2,"4,9",['Marie Polednáková'],['Marie Polednáková'],"High school professor Helena is one of the favorite teachers. While her professional life is going great, her personal life is taking unpredictable turns - and her extended family provides plenty of opportunities.",1h 56min,Líbás jako buh
3,"6,6",['Michael Monks'],"['Robert Lawson Gordon', 'Will Hurst']","In this heartfelt, indie romantic comedy, Joe returns home hoping to figure out what to do with his life after getting fired and finding out his wife is cheating on him with his rival coworker. But instead of finding peace and quiet at home, Joe ends up in a rivalry with his infuriating brother, Brody, after they bump into their mutual crush from high school.",1h 28min,Siblings
4,"3,7",['David Dhawan'],['Yunus Sajawal'],A man and a woman have to pretend to be a couple in order to salvage a CEO's marriage.,2h 6min,Do Knot Disturb
5,"4,1",['Tomasz Szafranski'],DESCONOCIDO,"A comedy about a psychic who pretends to believe that magic exists, a gigolo who pretends to believe the psychic, an illusionist who pretends to be somebody else and a desperate woman who believes she will find true happiness in love... when she's dead. Lenka is a psychic who besides telling fortunes is great at depriving her clients of them, with the help of an extra... Leer todo",1h 55min,Od pelni do pelni
6,"6,9",['Graham Elwood'],DESCONOCIDO,"Stand-up comedian Graham Elwood's harrowing, psychedelic journey through war zones to entertain the troops in Afghanistan.",1h 30min,Laffghanistan: Comedy Down Range
7,"5,6","['Til Schweiger', 'Torsten Künstler']","['Anika Decker', 'Til Schweiger']","Ludo Decker and Anna Gotzlowski have been living together for two years. Everyday routine has set in, with Ludo neglecting his household responsibilities much to Anna's dislike, while he is in turn annoyed by her constant complaining. When Ludo runs into his former lover Marie in the disco, and Anna's old boyfriend Ralf comes to stay in their flat for a few days, the ... Leer todo",2h 4min,Sobreviviendo al amor
8,"3,5",['Zhong Zheng'],"['Zhong Zheng', 'Heiko van der Scherm']",An American businessman travels to Beijing in search of a gullible Chinese investor.,1h 30min,Qi chuan xu xu
9,"3,2","['Jirí Chlumský', 'Pavel Göbl']","['Radan Dolejs', 'Jan Rokusek']","A young boy named Honza is a bad student, but becomes a promising golfer and experiences the sweet life in the spotlight. But he almost loses not only his girl but also himself in the process.",1h 35min,"Veni, vidi, vici"
10,"5,7",['Ryan Denmark'],"['Ryan Denmark', 'William Shakespeare', 'Jason Witter']","When Juliet, of noble Capulet birth, falls madly in love with Romeo, a zombie, the streets of fair Verona explode in an ancient feud. As the star crossed lovers struggle to overcome the prejudice toward their unholy union, Juliet's best friend Mercutio fights to win her heart back from Romeo's rotting grasp. As this timeless tragedy unfolds into a fresh new comedy, Me... Leer todo",1h 24min,Romeo & Juliet vs. The Living Dead
11,"6,3","['Jeremy Childs', 'Karen Garcia']",['Jeremy Childs'],,--,Blood Rogues
12,"4,6",['Reg Harkema'],['Reg Harkema'],"Perry, a sheltered chemical engineer, falls in love with Leslie, a former homecoming princess, when he becomes a jury member at her hippie death cult murder trial.",1h 25min,"Leslie, My Name Is Evil"
13,"5,0",['Frédéric Berthe'],DESCONOCIDO,"When Arthur's wife leaves him to get married in Miami, he immediately flies there to get her back.",1h 28min,RTT
14,"3,0",['Regan Redding'],['Regan Redding'],"Killer Biker Chicks are hot women living out in the desert flirting with sex, drugs, rock&roll and murder.",1h 40min,Killer Biker Chicks
15,--,['Rebecca Goldsmith'],"['Rebecca Goldsmith', 'Kyle Southam']","A talent agent sells her soul to the devil in order to be the best. When the devil comes to collect. Her only chance to save her soul is to find work for four of the worst, no talent performers ever - in five days.",1h 18min,"Don't Call Us, We'll Call You"
16,"7,0",['Shûichi Okita'],"['Jun Nishimura', 'Shûichi Okita']","A Nishimura le apasiona la cocina, pero nunca hubiera imaginado la tarea que tiene ahora ante sí, luego de que inesperadamente, se le asigna a una misión en el polo sur para servir como jefe de cocina en la estación Dome Fuji.",2h 5min,Nankyoku ryôrinin
17,"3,7",['Brian Trenchard-Smith'],"['Bob Clark', 'Stephen Niver']",Three college buddies search for sex in the summer holidays and end up starting a successful whorehouse.,1h 18min,Porky's IV: Pimpin' Pee Wee
18,"4,3",['Tomasz Konecki'],['Andrzej Saramonowicz'],"Two lesbian activists decide to produce heterosexual artistic porn movie to gather funds for their organization. There is a risk, that one of them has to play with a guy, whom she hates, but also is attracted to him.",2h 4min,Idealny facet dla mojej dziewczyny
19,"7,4",['Walt Foreman'],['Walt Foreman'],"In 2008, there were twenty-three robberies of businesses in Estill Springs. Sixteen suspects, of which ten were couples, were arrested and charged; pictures of twelve of the suspects appeared in the Estill Daily Journal, and the other four appeared in the Estill Record. But there was one couple who never had their pictures in any paper, never got arrested. This is the... Leer todo",1h 18min,Sparkle & Tooter
20,"7,1",['Jared Jordan'],"['Jared Cobb', 'Brett Jordan']","Carl Spitzer's successful life in the big city is crumbling all around him, literally sinking before his eyes. The wife's divorce and the pending lawsuit from his toddler-aged daughter certainly don't help. He's hit bottom. Yet, perhaps the only person with a more pathetic existence than Spitzer is his estranged dirt-leg friend Al Wrankle, who claims a ""good life"" in ... Leer todo",1h 36min,Ponytail
21,"5,9",['Paul Ward'],['Paul Ward'],Stephen y John son dos jóvenes actores en apuros que viven en un barrio muy abierto y orgullosamente gay de Dublín.,1h 32min,Fur Coat and No Knickers
22,"6,1",['Kris Booth'],"['Ramona Barckert', 'Kris Booth']",A multi phobia-plagued single woman who hasn't left her apartment in six years finds her carefully organized existence disrupted by her hot new 'on-the-go' neighbor.,1h 30min,At Home by Myself... with You
23,"6,5","['Emmanuel Caussé', 'Éric Martin']","['Emmanuel Caussé', 'Éric Martin']",,--,No pasaran
24,"6,6","['Sandra Feldman', 'Ian Mah']",['Sandra Feldman'],"Barb has the perfect life, or so she's been told. Somewhere down the road, she's gained a husband, kids and a career, but lost her freedom and passion for life. In an attempt to recapture the innocence of her carefree days, Barb calls her high school pals Patti, Karen and Liz together for a weekend reunion. Loosening up with a few bottles of wine, each shares their se... Leer todo",1h 30min,A Touch of Grey
25,"4,9",['Michèle Rosier'],['Michèle Rosier'],"Four women, all journalists for the French daily ""Libération"", decide to have, over the course of a week-end, an experience with a male prostitute.",1h 23min,Ah! La libido
26,--,['Deren Abram'],DESCONOCIDO,,--,Hollywood Moments
27,--,['Paul David Benedict'],"['Christopher Cook', 'Ben Lepley', 'Phillip McLean']","*Alternate Music Edit A comedic drama about what comes after the 'coming-of-age' movie. Gary Fischer is a middling freelance writer living in an average small town. While his two best friends appear to be happy with their daily routine of coffee shop discussions, afternoon croquet, and late-night card games, Gary is increasingly discontent.",1h,The Yin of Gary Fischer's Life
28,"5,5",['Gabriel Julien-Laferrière'],DESCONOCIDO,Samy moves from the underdeveloped crime-ridden French suburb to the riches of Neuilly.,1h 30min,Neuilly sa mère!
29,"5,6",['Norton Virgien'],DESCONOCIDO,George embarks on a cross-country trip to reunite a baby elephant with her family.,1h 20min,Curious George 2: Follow That Monkey!
30,"2,5","['Meccartin', 'Raffi']","['Meccartin', 'Raffi']",Machu (Mammootty) was cheated by an Anglo-Indian (Nedumudi Venu) by promising him to marry their daughter. They escapes to Singapore and the plot forms when Machu also flies to Singapore to find out them.,--,Love in Singapore
31,--,['Scott Reardon'],['Scott Reardon'],,1h 20min,"Our Pet, Ophelia"
32,"5,6",['Lucien Jean-Baptiste'],"['Lucien Jean-Baptiste', 'Marie-Castille Mention-Schaar']","Jean-Gabriel, married and father of three, lives odd jobs and spends his time at the local PMU bar. One day, to please his daughter, he quickly promises the whole family to take them on a ski vacation.",1h 30min,La première étoile
33,"7,9",['Brian Fairbanks'],['Brian Fairbanks'],"A lesbian hires a straight man to be her son's part-time nanny, over the protestations of her girlfriend.",1h 38min,After You're Gone
34,"4,7",['Logan McMillan'],['Logan McMillan'],"A contagious virus is turning everyone into zombies, and the only hope for survival lies in the hands of three couch potatoes.",1h 28min,Last of the Living
35,"7,0",['Marco Antoniazzi'],"['Marco Antoniazzi', 'Gregor Stadlober']",,1h 25min,Kleine Fische
36,--,DESCONOCIDO,DESCONOCIDO,DESCONOCIDO,--,Error nombre para la pelicula con id: tt1352712
37,"3,1",['Ali Ghaffari'],DESCONOCIDO,"A young man named Behrouz Nikbakht lives with his mother. He is in love with his cousin Setareh, but Setareh's father intends to marry his daughter to his nephew Ehsan. Behrooz goes to his father's grave to grieve with him. Meanwhile, the police forces arrest a professional killer in Behesht Zahra, but the killer's mobile phone accidentally falls into his hands. The c... Leer todo",1h 25min,Cheragh Ghermez
38,"7,5","['Andy Bichlbaum', 'Mike Bonanno', 'Kurt Engfehr']",DESCONOCIDO,"Troublemaking duo Andy Bichlbaum and Mike Bonanno, posing as their industrious alter-egos, expose the people profiting from Hurricane Katrina, the faces behind the environmental disaster in Bhopal, and other shocking events.",1h 27min,The Yes Men Fix the World
39,"4,4",['Charles Nemes'],DESCONOCIDO,Employees of the Geugène Electro Stim company and their manager come to Paris for a corporate seminar.,1h 35min,Le séminaire Caméra Café
40,"1,4",['Barna Kabay'],['Gergely Litkai'],"A man pretends to be a manager and helps veteran rockstar god, Johnny G. and his ex-band to reunite once more.",--,Szuperbojz
41,"7,1",['Glen Goei'],['Ken Kwek'],The Blue Mansion is a quirky murder mystery about a wealthy Asian tycoon who dies suddenly under mysterious circumstances. He returns as a ghost to try to uncover the secret of his death with the help of his family and the police.,1h 40min,The Blue Mansion
42,"4,4",['Yoshimitsu Morita'],['Yoshimitsu Morita'],A young woman goes back to her home town and gives bundles of cash to her classmates.,1h 50min,Watashi dasu wa
43,"6,3",['Mariano De Rosa'],['Mariano De Rosa'],"Juan is a family man; he feels at ease with his life and his work, and with his wife and two children. Everything seems to indicate that the summer holidays in Aguas Verdes are going to be a pleasant time. An unexpected element, however, triggers Juan's mental imbalance.",1h 30min,Aguas verdes
44,--,['Ingeborg C. Humphrey'],['Ingeborg C. Humphrey'],When a guy moves from Los Angeles to New York for business. His mind takes him on a adventure that will get him in trouble.,--,Words Unspoken
45,"5,7",['Simon Szabó'],['Simon Szabó'],"I make mine. You make yours. He makes his. Everybody makes their own. Ervin Szabó: Paper Planes Seven stories independent from each other. Meaningful and eloquent shorts which can be viewed separately, just like the videos on the internet. Fiction, in a documentary style. About grown-up children, and young adults, who fight the everyday battle, trying to survive and ... Leer todo",1h 34min,Papírrepülôk
46,"4,7",['Emma Luchini'],"['Vanessa David', 'Emma Luchini']",,1h 25min,Sweet Valentine
47,"2,9",['Mehdi Borghei'],DESCONOCIDO,"Pooneh, played by Sara Khoeiniha, and Farhad, played by Amir Jafari, have been separated for about three years after 15 years of living together. Pooneh's acquaintance with a young man becomes an incentive for Farhad to oust his love rival.",--,Laj o lajbazi
48,"4,0",['Rakesh Sarang'],DESCONOCIDO,"Govinda, a truck driver and billionaire, helps Ajay get his love Sia, the twin sister of Govinda's wife Ria. Govinda, unaware about Ajay's love interest ends up planning Ajay's meeting with himself leading to a chain of incidents.",--,Horn 'OK' Pleassss
49,"5,5",['Vilma Zenelaj'],"['Greta Zenelaj', 'Vilma Zenelaj']",Claudia invites a sheik for a session.,1h 11min,What Do I Do Now?
50,"6,2",['Alain Guiraudie'],"['Alain Guiraudie', 'Laurent Lunetta', 'Frédérique Moreau']","Justo cuando Armand se estaba cansando de la vida, se enamora de una joven llamada Curlie, con ella huye de sus padres y la policía.",1h 33min,Le roi de l'évasion
51,"7,2",['Dan Brennan'],DESCONOCIDO,"Your wedding day can be the most stressful day of your life. The Video Guys have seen it all, from cheating grooms to sexy brides. They know how to be discreet and how to deal with any problems thrown at them. Now they face their greatest challenge, to shoot one of their ex-wife's wedding.",1h 35min,The Video Guys
52,"6,1",['Péter Gárdos'],"['Zsuzsa Bíró', 'Péter Gárdos', 'Dezsö Kosztolányi']","It is 1912 and war looms on the horizon. The school year begins in a boarding school run by priests. Zoltán's father, is one of the masters and struggling with questions that challenge their faith, while waiting for news of his brother, Titanic passenger, and is a particularly problematic group of new students, many of whom have been fond increasingly heavy play each ... Leer todo",1h 33min,Tréfa
53,"7,3",['Cory McAbee'],['Cory McAbee'],"A dangerous mission reunites STINGRAY SAM with his long lost accomplice, The Quasar Kid. Follow these two space convicts as they earn their freedom in exchange for the rescue of a young girl who is being held captive by the genetically designed figurehead of a very wealthy planet.",1h 1min,Stingray Sam
54,"4,9","['Gilbert Chan', 'Jack Neo']","['Boris Boo', 'Gilbert Chan', 'Jack Neo']","A movie that revolves around three main protagonists - 52 year old Tan Bo Seng, 17 year old Benny his teenage son and 36 year old Jeremy, Bo Seng's 'adopted' brother - and their accidental journey in seeking and keeping love and happiness. Bo Seng leads a routine life. Attempts to revive the passion with his wife Jia Li cannot improve their stale love life. Jeremy liv... Leer todo",1h 53min,Xing fu wan sui
55,"4,3",['Charles Band'],DESCONOCIDO,"Stoners Larnell, Brett, and Bachman all suffer from severe delayed side effects from smoking grass from evil bong Ebee. The trio embark on a journey to the jungle in South America along with their nerdy straight-laced buddy Allistair and delivery guy Rabbit to find a cure for their various ailments. During their expedition the group encounters a bunch of beautiful wom... Leer todo",1h 20min,Evil Bong 2: King Bong
56,"7,9",['Adam Vargas'],['Adam Vargas'],"Jackson Blackman just can't get a break. He gets no respect from his roommate or friends, he plays out to empty coffee houses and scrubs money off his grandmother. Just when he thought things couldn't get any worse his car dies, but is it a blessing in disguise? After roommate Kato drives him to a music shop Jackson is mistaken for Jack Black. Kato convinces him that ... Leer todo",1h 24min,The Black Facade
57,"6,0",['Cassandra Massardi'],['Cassandra Massardi'],,1h 32min,Kawin Laris
58,"4,7",['Findo Purwono'],['Alim Sudio'],"A vengeful spirit follows three body hunters as they search for missing corpses in Jakarta, Indonesia.",1h 26min,Setan Budeg
59,"5,8",['James Sharpe'],"['William Meikle', 'James Sharpe']","Halfway to Heaven A Fantasy Romance With Comedy Halfway To Heaven about a man who is visited by God and told he will be spending time at a ""halfway house"" when dead, until SHE can make up her mind where to put him. While in his suburban limbo he meets others in the same situation of which one could be the ""Girl of his dreams"", they plan to spend eternity together but ... Leer todo",1h 20min,Halfway to Heaven
60,--,['Jake Cooper'],"['Jake Cooper', 'Craig Smith']",,1h 24min,The Key Party
61,"7,2",['Kiff Scholl'],"['Bill Robens', 'Kiff Scholl']","Scream of the Bikini is a 1960s action-spy-thriller by acclaimed South American director, Fernando Fernandez. Jasmine Orosco and Paola Apanapal - in their English language film debuts - are Bridget and Sophia: gorgeous super models by day, brutal bounty hunters by night. Murder, intrigue and pillow fights await our beautiful leading ladies at every turn, as they match... Leer todo",1h 39min,Scream of the Bikini
62,"4,1",['Hamed Kolahdari'],"['Hamed Kolahdari', 'Mehdi Mohamamdnejadian']","The film tells the story of a coffee shop that has regular customers and this coffee shop is run by a young man. With the arrival of a young woman in this cozy and quiet coffee shop, everything undergoes changes. Interesting things happen in this coffee shop ..",--,Hot Chocolate
63,--,['James Dougherty'],['James Dougherty'],"In this funny political comedy, Harry, a small time, down on his luck politician desperately searches for a candidate. He finally finds one in an unusual character, Arnold, a childlike albino janitor.",1h 33min,The Party Beyond Obama
64,"6,2",['Jai Tank'],DESCONOCIDO,A man's life changes after he sustains an injury in a terrorist attack.,2h 1min,Madholal Keep Walking
65,"7,0",['Paulo Biscaia Filho'],DESCONOCIDO,"A comic book artist, a life insurance salesman and a coroner meet in a morgue under a very unusual circumstance.",1h 18min,"Morgue Story: Sangue, Baiacu e Quadrinhos"
66,"5,9",['Irena Pavlásková'],['Tereza Boucková'],"Adolescence is always a difficult time; it is doubly so for Gábina. For one thing, she is growing up in the normalization years of the 1970s, and then she also has to face the reality that her father is a well-known actor disavowed by the regime. Although he abandoned the family years before, his existence casts an ominous shadow over the lives of not only Gábina, but... Leer todo",1h 54min,An Earthy Paradise for the Eyes
67,"6,0",['Ulf Malmros'],['Ulf Malmros'],"When the factory in Molkom shuts down, Robin leaves his beloved hometown to try his luck in Stockholm as a wedding photographer. This experience changes not merely his outlook on life but also his hairstyle.",1h 53min,Bröllopsfotografen
68,"5,8",['V.M. Vinu'],['Samjad Narayanan'],"Viswanathan, an honest village officer, wishes this son, Manu, to become an engineer. However, Manu has no interest in pursuing his studies and aspires to make a name for himself as a singer.",--,Makante Achan
69,"6,4",['Geoffrey Enthoven'],"['Chris Craps', 'Jean-Claude Van Rijckeghem']","Upon the death of her husband, Claire (70) decides to reconnect with her estranged son, down and out R&B musician Sid. She asks him to help her restart the old girl group she used to sing in with two of her friends from the old days. The rebel son is hesitant at first but eventually agrees under one condition: the band has to play HIS music.",1h 33min,Meisjes
70,"3,5",['Abbas Moradian'],DESCONOCIDO,"Karim and Atabak, who live in a neighborhood in the south of Tehran, are forced to steal from the factory and make a living by committing petty thefts and roaming the streets. When the knife reaches their bones and they have no money, a man named Torpedo invites them to steal a car.",--,Dalghakha
71,"6,4",['Emmanuel Mouret'],['Emmanuel Mouret'],Has Jean-Jacques an infallible way to seduce women or is he just fantasizing about it? His girlfriend Ariane wants to sort it out.,1h 30min,Fais-moi plaisir!
72,"6,5",['R.N.R. Manohar'],['Manohar'],"Maasilamani aka Maasi (Nakul) is an orphan living in a lower middle class colony. With a heart of gold, he is a popular guy who takes up local issues, fights for them, and is considered a rowdy by those who do not know him. Enters the heroine Divya (Sunaina), a rich upper middle class girl who is a dance instructor and with whom Maasi falls in love at first sight. How... Leer todo",2h 30min,Maasilamani
73,--,['Brice Myracle'],['Brice Myracle'],A struggling rock band decides the best way to advance their career is to make a film. Unfortunately all they can scrape together is the princely sum of $178.92! Despite this lack of funds they make their film - but will their career go meteoric?,1h 37min,The $178.92 Movie: An Instructional Guide to Failure
74,"5,9",['Jose Javier Reyes'],DESCONOCIDO,"Doris is a 30-year-old virgin who's anxious to get married, afraid of ending up an unmarried woman like her spinster aunt. With Dado, her call center agent boyfriend for years, dropping her like a hot potato and all her girlfriends getting married, Doris is even more pressured to find her Mr. Right pronto! With the help of her best pal, Randy, the search for Doris fut... Leer todo",1h 35min,Status: Single
75,--,['Paul F. Becker'],"['Steve Barraclough', 'P.F. Becker', 'Jason Christie']","The lives of seven ex-pats, now living their lives on the Island of Taiwan, converge when Felix, a Canadian expatriate himself, wants to make a documentary about the crowd he meets at the bars and parties in Far East Taiwan. Unclear of his direction, Felix begins by interviewing the 7 on their views of culture, teaching English and the future. While the ex-pats have t... Leer todo",--,Made in Taiwan
76,"6,4",['Anders Matthesen'],['Anders Matthesen'],A bitter and stressed man ends up in a car crash and gets another chance for life.,1h 20min,Sorte kugler
77,"5,6",['Michael Kupczyk'],"['Georg Piller', 'Tilmann Warnke']",,1h 24min,Diamantenhochzeit
78,"2,8",['Oleg Fomin'],"['Artak Gasparyan', 'Mikhail Gulikov', 'Garik Kharlamov']","Four friends after a long separation are celebrating the birthday, but suddenly one of them was kidnapped and it requires a redemption - one million euros. Friends trying to find the money for the release of their friend.",1h 20min,Samyy luchshiy film 2
79,"6,3",['Tom Begley'],['Rob Hayes'],"When Irishman Barry West loses his belongings on a Bulgarian holiday and wakes up naked in a goat shed, things seem like they couldn't get much worse, until he is recruited by English girl Lisa to help her rescue her sister from the clutches of the Eastern European Mafia.",--,East Meets Barry West
80,"5,6","['Fire Lee', 'Joe Ma']",['Yiu-leung Tong'],,1h 30min,Oi dak hei
81,"3,7",['Rasmus Heide'],"['Thomas Glud', 'Rasmus Heide']",The annual Xmas lunch/party at a Danish auto shop follows tradition. The employees all get drunk and do crazy things.,1h 26min,Julefrokosten
82,"8,9","['Jason Shabatoski', 'Jon Tewksbury']","['Jason Shabatoski', 'David Stefanyshyn', 'Jon Tewksbury']","In a distant nation, even foreign to those within, an oppressed factory worker embarks on a perilous odyssey to find his polka idol and prove himself to his long-lost love.",47min,Shuya Show
83,"6,1",['John E. Bryant'],"['John E. Bryant', 'Jason Foxworth']",A road movie where two brothers search for their biological parents.,1h 32min,The Overbrook Brothers
84,"5,4",['Roland Vranik'],"['András Barta', 'Roland Vranik']","Computers, TVs, cel tels and other telecom devices no longer work and the people are suffering severe withdrawal pains. Three brothers try to overcome their own major personal problems as the society slowly begins to find alternative ways of living.",1h 30min,Adás
85,"4,0",['Mac Alejandre'],DESCONOCIDO,"Long ago, the evil wizard Lizardo (Phillip Salvador) sent an army of monsters to subjugate the land and its people. Lizardo succeeded, but a prophecy tells of a comet that will fall to Earth, and a man who will wield a weapon that will free the people from Lizardo's tyranny. Flavio (Bong Revilla Jr.) is a blacksmith content with living a quiet, uneventful life in a to... Leer todo",1h 50min,Ang panday
86,"5,7",['Marius Vaysberg'],DESCONOCIDO,Three Russian expatriates are loving life and seducing women in New York City until they meet up with Saint Valentine in disguise and he curses them with impotence until they learn about true love. No love - no sex.,1h 24min,Lyubov v bolshom gorode
87,"6,2",['Yaroslav Chevazhevskiy'],"['Yaroslav Chevazhevskiy', 'Andriy Maksimenko']","Three young Russian families go for winter vacations to an unnamed exotic country, intending to rent a beach condo. However due to numerous comedic obstacles they never make it to the beach, staying at the hotel for the entire trip.",--,Na more!
88,"8,9","[""Gil O'Brien""]","[""Gil O'Brien""]","Gil O'Brien is on the cusp of middle age. His wife wants security, but he can't let go of his dream of becoming a musician. He meets up with a band of misfits and tries one last time to make it in the music biz.",1h 28min,One Hit Wonder
89,"7,5",['Murat Saraçoglu'],['Hazel Sevim Unsal'],The story of an exile man who came from Russia. He is the last descended of his family.,1h 40min,Deli Deli Olma
90,"2,2",['Harold Trompetero'],['Harold Trompetero'],"Felipe De Las Aguas is a taxi driver in the capital, which is tired of seeing the injustices that happen around him, for this reason agrees to become ""El Man"", a superhero in the flesh, that with hard work, shrewdness and empirical justice helps others with their only super power: the faith.",--,"El man, el superhéroe nacional"
