179,"6,2",['Brent Florence'],"['Brent Florence', 'Kenny Luper']","After thirteen highly unsuccessful years in Los Angeles, two ""artistic"" best friends get to direct their first ever feature film: a soft-core epic entitled The Lone Rancher, designed for late night TV.",1h 45min,Adult Film: A Hollywood Tale
180,--,['Jonathan Green'],['Jonathan Green'],Follows the lives of five friends and the choices they make as they enter real life after college.,1h 18min,Small Talk
181,--,['Timothy Johnston'],['Eric Pravitz'],"The once dominant scooter gang, the Demons, launch a fiendish plan to rebuild their declining membership. When the member of a rival scooter club falls for the girlfriend of the Demons leader, he finds himself unwittingly ensnared in their plan.",49min,Mondo Scooterama
182,--,['Antonio Aguilar'],['Jonathan Thomas'],"Larry Walker, a successful advertising associate wants to give up his playboy ways and settle down with a former college girlfriend and current co-worker Monica James. There are just two problems; Monica doesn't think he can handle a serious relationship so she gives him one day to prove he is ready and now every women at the office seems to want Larry. With help from... Leer todo",1h 43min,Office Games
183,"3,7",['Bryan E. Hall'],['Bryan E. Hall'],"A ragtag bunch of teenage door to door salesmen wreak havoc and spread the news of their coming of age in this summer before they begin their college lives. It centers around Sean, a sexually confused and drug afflicted teen who just can't seem to shake off his dysfunctional family history. Paper Boys is an adventure into the psychology of sales as a metaphor for life... Leer todo",2h 6min,Paper Boys
184,"3,4",['Lance McMinn'],"['Lance McMinn', 'Nicola Peeperkoorn']",About what you are willing to forgive for love.,1h 11min,The Richmond Family Massacre
185,"5,6",['Umesh Shukla'],DESCONOCIDO,A failed film producer and an unemployed Chartered Accountant decide to make a 'sure flop' movie,2h 11min,Dhoondte Reh Jaoge
186,"7,3",['Daniele Gangemi'],DESCONOCIDO,,1h 20min,Una notte blu cobalto
187,--,['Ron Johnson'],['Ron Johnson'],5 law abiding citizens are chosen by a dirty cop and an ex-con to participate in a reality show where the winner get to take part in a bank heist.,57min,America's Next Felon
188,--,['Jeffrey R. Hutchinson'],['Jeffrey R. Hutchinson'],Tim Baggins finally stops playing video games and leaves his house only to find his neighborhood is full of erratic characters that end up changing his life.,1h 10min,Cookies
189,"4,8",['Dave Fraunces'],['Dave Fraunces'],"After the death of his boss, Paul, an executive, hires a group of politically incorrect consultants.",--,The Consultants
190,"5,8",['Tôya Satô'],"['Kozueko Morimoto', 'Yûko Matsuda', 'Michiru Egashira']",A young teacher is given the toughest classroom in the school. Based on the TV series.,1h 58min,Gokusen: The Movie
191,--,"[""Pedro 'Zulu' González""]","[""Pedro 'Zulu' González""]",,1h 15min,Se me hizo fácil
192,"8,1","['Yue Hu', 'See-Yuen Ng']","['Yue Hu', 'Zicai Pi']",Ke Zhi Hong went from Tainan to Taipei for a job and it happened that Xia Mei Gui became his landlord simply because her dog seemed to like him. Xia Mei Gui's name sounds the same as in Mandarin who was his dream-lover in the university. Is he needs to take a long time to realize that he loves Xia Mei Gui even though it's so obvious to the others?,1h 40min,Ya mei gui
193,"9,0",['Eric Fischer'],['Mark Abramowitz'],"After being dumped by his girlfriend, 23-year-old slacker extraordinaire Simon Keenan learns there is more to life than crashing high school parties, working at a video game store, and the narrow minded suburban town he lives in. Simon struggles to find a sense of direction in his life, especially when his mother is an overly zealous born-again, his best friend aspire... Leer todo",--,Last Days of Simon
194,"2,4",['K.K. Dheeraj'],['Melonys'],"Garry works as a massage therapist while Barry is a photographer. When they become acquainted with Hanny, a Public Relations executive in an oil company, their lives become unpredictable, making everything chaotic and hilarious.",1h 30min,Pijat Atas Tekan Bawah
195,"5,7",['Encep Masduki'],['Hilman Hariwijaya'],"When Rezky, a reporter, is late for work, he is reprimanded so terribly that he decides to find a flat near the office so he won't be late again. Then Rezky meets Wisnu, a photographer, in the same taxi when both are house hunting. They are interested in Aunt Ria's apartment but as it is only for girls, they pretend to be a gay couple. Their suffering increases when t... Leer todo",--,SMS: Suka Ma Suka
196,"6,1",['Monty Tiwa'],"['Erik Tiwa', 'Monty Tiwa']","Bagyo loses his job when he is accused of ruining a national meeting of a large political party led by Zainuddin. This jeopardizes his marriage plan with Ani. Then when a gang is robbing Atika, a famous artist, Bagyo shows up to rescue Atika. He is now a national hero.",1h 37min,Wakil Rakyat
197,--,['Peter Chen'],['Peter Chen'],"A coming of age, zany whimsical Asian-American Peter with loving hearts, struggles with an embarrassing secret, discovers his American roots and finds love with Nancy, wins with nonviolence.",--,Absolutely American: A Comedy Heated Rally with Action
198,"7,2",['Ben Steinbauer'],DESCONOCIDO,"Documental sobre los videos de Jack Rebney, un vendedor televisivo cuyas malas palabras han circulado de forma subterránea en VHS en los años 90 hasta convertirse en un fenómeno de la Internet.",1h 25min,Winnebago Man
199,"6,6","['Jessica Noelle Hardy', 'Brent Kado']","['Jessica Noelle Hardy', 'Brent Kado']","Timothy Scarth and Mary Beth Grendel work to put together the 2007 Improvapalooza Festival. Timothy, one of Chicago's well known improvisers, creates Improvapalooza and Mary Beth hopes to help him grow the festival to international heights. Teams are given a suggestion of 'Chicago' at the beginning of the day and a film crew follows two main teams as they fumble to cr... Leer todo",1h 27min,Off the Cuff
200,"7,2",['Shyam Benegal'],DESCONOCIDO,"A mild mannered chauffeur finds that the government in his parched village is giving loans to dig one's own well. After fudged photographs and bribes, he has no loan amount left to build his well. Aggrieved, he protests by abjuring water.",2h 24min,Well Done Abba!
